Titre,Date de publication,URL,Contenu
Les laboratoires Anios investissent 21 millions d'euros dans leurs établissements lillois - L'Usine Nouvelle,"Thu, 15 Oct 2015 07:00:00 GMT",https://news.google.com/rss/articles/CBMihwFodHRwczovL3d3dy51c2luZW5vdXZlbGxlLmNvbS9hcnRpY2xlL2xlcy1sYWJvcmF0b2lyZXMtYW5pb3MtaW52ZXN0aXNzZW50LTIxLW1pbGxpb25zLWQtZXVyb3MtZGFucy1sZXVycy1ldGFibGlzc2VtZW50cy1saWxsb2lzLk4zNTcxMDHSAQA?oc=5&hl=en-US&gl=US&ceid=US:en,"Les laboratoires Anios vont transférer les 12 lignes de production actuellement basée à Hellemmes (Nord) vers le site principal de production, basé à quelques kilomètres, à Sainghin-en-Mélantois. Cette opération, programmée pour 2016, va générer une extension du site de 12 000 mètres carrés (incluant la production, le conditionnement, les bureaux, la recherche-développement et le service qualité).

Extension du centre de recherche

Le site de Sainghin-en-Mélantois regroupe actuellement la plateforme logistique (stockage, préparation et expédition des quelque 480 commandes quotidiennes), une unité de 15 lignes de production, le département produits (élaboration et fabrication d’équipements spécifiques comme des distributeurs de savon, lavabos hyperaseptiques, modules informatisés de nettoyage et désinfection des endoscopes…) ainsi que le centre de recherche Luce Letartre. Cette infrastructure regroupe trois laboratoires : chimie et formulation, microbiologie et chimie analytique, soit 40 personnes dans un bâtiment de 1 000 mètres carrés. Elle va également bénéficier d’une extension de 400 mètres carrés.

Pour l’ensemble de ces opérations de transferts et d’extensions, les laboratoires Anios vont engager 15 millions d’euros d’investissement. En complément, un nouveau siège social sera construit à Hellemmes, sur le site historique de la société. Montant de l’investissement annoncé : 6 millions d’euros.

Une croissance résolument tournée vers l’international

Leader en France et en Europe sur le marché de la désinfection pour hôpitaux, cliniques, industries et collectivités, Les laboratoires Anios disposent d’une autre unité de production, hors métropole lilloise : Soluscope. Cette société est située à Aubagne, dans les Bouches-du-Rhône. Rachetée par Anios en 2014, elle est spécialisée dans la conception et la fabrication de laveurs-désinfecteurs pour endoscopes et compte un effectif de 130 salariés.

Présents dans plus de 80 pays, le groupe Anios affiche un chiffre d’affaires consolidé 2014 de 206 millions d’euros et emploie 700 salariés. Le groupe est contrôlé par la famille Letartre, fondatrice de la société en 1898, depuis qu’elle a repris en 2013 la participation d’Air Liquide, qui s’élevait à 66%, avec l’appui de la société d'investissement Ardian. Le groupe a l’ambition de réaliser 50% de son chiffre d’affaire à l’international d’ici 2020 (contre 30% en 2014). Pour atteindre cet objectif, il annonce plusieurs opérations de croissance externe au cours des prochaines années, probablement en Espagne, en Chine, en Amérique du Sud et au Moyen-Orient.

Après l’acquisition de Soluscope, les laboratoires Anios ont déjà pris le contrôle de la société turque Deren en avril 2015, et en juillet 2015 celui d’Endoclear à Sao Paulo, au Brésil.

Francis Dudzinski"
- Tunisie: Les trois banques publiques resteraient étatiques - - Babnet,"Mon, 19 Oct 2015 07:00:00 GMT",https://news.google.com/rss/articles/CBMiLWh0dHBzOi8vd3d3LmJhYm5ldC5uZXQvY2FkcmVkZXRhaWwtMTEzNjQ1LmFzcNIBAA?oc=5&hl=en-US&gl=US&ceid=US:en,"<img src=http://www.babnet.net/images/1b/stb1040.jpg width=100 align=left border=0>

Tap - «Les trois banques publiques (STB, BNA et BH) resteraient étatiques et leur gouvernance serait privée», tel est le scénario qui semble avoir été retenu au terme des missions d'audit lancées en 2013», a fait savoir «Tunisie Valeurs», dans une note publiée dans sa revue d'octobre 2015.



""A l'heure actuelle, la privatisation d'une ou des trois banques n'est donc plus à l'ordre du jour, mais des opérations de cession de participations minoritaires à des partenaires privés ne sont pas à exclure"", a précisé l'intermédiaire en bourse. ""Une enveloppe de 1300 MD sera nécessaire pour la recapitalisation de ces banques.

La STB bénéficiera, à elle seule, d'un budget de 757 MD, afin de renforcer ses fonds propres, surtout qu'elle compte des créances classées s'élevant à 2400 MD, ce qui représente 30% des engagements de la banque et plus du tiers des créances classées du secteur. Il s'agit d'un montant colossal qui sera pour l'essentiel, financé par l'Etat"".

«Les trois banques publiques (STB, BNA et BH) resteraient étatiques et leur gouvernance serait privée», tel est le scénario qui semble avoir été retenu au terme des missions d'audit lancées en 2013», a fait savoir «Tunisie Valeurs», dans une note publiée dans sa revue d'octobre 2015.""A l'heure actuelle, la privatisation d'une ou des trois banques n'est donc plus à l'ordre du jour, mais des opérations de cession de participations minoritaires à des partenaires privés ne sont pas à exclure"", a précisé l'intermédiaire en bourse. ""Une enveloppe de 1300 MD sera nécessaire pour la recapitalisation de ces banques.La STB bénéficiera, à elle seule, d'un budget de 757 MD, afin de renforcer ses fonds propres, surtout qu'elle compte des créances classées s'élevant à 2400 MD, ce qui représente 30% des engagements de la banque et plus du tiers des créances classées du secteur. Il s'agit d'un montant colossal qui sera pour l'essentiel, financé par l'Etat"".

...





Pour ce qui est de la BH, il est à rappeler qu'elle a entamé, en juillet 2015, la 2ème étape de son processus de restructuration et a réalisé une opération d'augmentation de capital clôturée le 11 Septembre 2015, sur un montant de 110 MD et ce, après l'émission d'un emprunt obligataire subordonné de 90 MD, clôturé avec succès, au mois de mai de cette année.



S'agissant de la BNA, Tunisie Valeurs a estimé «qu'à la différence des deux autres banques publiques, le renforcement des fonds propres de cette banque pourrait passer par la cession de ses participations non stratégiques», surtout qu'elle « détient un portefeuille de participations important comprenant des titres cotés tels que ceux de la SFBT, la SIMPAR ou encore Air Liquide qui recèlent des plus values latentes intéressantes».



D'ailleurs d'après ""Axis Capital"", la BNA qui détient 14% du capital de la SFBT a cédé 3,08% de ses parts dans la société, pour dégager une plus value de 85,131 millions de dinars et dispose encore d'une plus value potentielle de 254 MD. «Tunisie Valeurs» a souligné qu'un ""business model"" sera mis en place afin de permettre à ces trois institutions bancaires publiques, qui s'accaparent de 38% des actifs bancaires en Tunisie, «d'améliorer leur compétitivité, de renforcer leur notoriété et de faciliter l'accès à de futurs partenaires stratégiques ou techniques privés». Et de rappeler que «la concrétisation de la réforme de fond des des trois banques publiques, initiée deux ans plus tôt, est aujourd'hui fortement attendue par les investisseurs».



Globalement, le secteur bancaire est la première force du marché, avec une capitalisation boursière de 8 milliards de dinars. Il représente 41% de la capitalisation totale.

«Son état de santé reste un baromètre essentiel de l'investissement en bourse, surtout que des prémices d'une reprise semblent se dessiner».



S'agissant des banques cotées, dont le nombre s'élève à 11 sur un total de 29 établissements bancaires, l'intermédiaire a fait savoir qu'elles ont enregistré, durant le premier semestre 2015, une performance de + 14,6%.

Le secteur a enregistré, à fin juin 2015, une légère baisse de 0,1% des dépôts à 45 437 MD.



Parallèlement, les tensions sur la liquidité semblent réapparaître, avec un accroissement des interventions de la BCT sur le marché monétaire avec une injection moyenne quotidienne de 5 541 MD, contre un montant de 3 322 MD à fin 2014.



La BIAT maintient sa position de leader en termes de dépôts, avec une part de marché de 16,6% et un total de dépôts de 7 644 MD, suivie par la BNA (5 853 MD) et la STB (5 422 MD).



En ce qui concerne les encours de crédits, ils ont enregistré une hausse de 2,5% à 46 647 MD, «une croissance molle qui témoigne d'un climat d'investissement encore fragile ».



Au niveau des crédits, c'est la BNA qui confirme sa position de leader, avec une part de marché de 15,5% (7 209 MD), suivie par Amen Bank (6 102 MD) et la BIAT (6 061 MD).



S'agissant du PNB, il a connu, durant les six premiers mois de l'année en cours, «une progression solide de 8,3% à 1 374 MD"".



Le secteur bancaire tunisien se différencie par son ""atomicité"", entre banques publiques, privées, universelles, spécialisées d'investissements.. Une meilleure concentration du marché bancaire serait aujourd'hui bien plus souhaitable pour la stabilité du système financier, a recommandé «Tunisie Valeurs» .



"
Celgene et Mersen choisissent la tour Eqho pour leur nouveau siège - defense-92.fr,"Wed, 07 Oct 2015 07:00:00 GMT",https://news.google.com/rss/articles/CBMibWh0dHBzOi8vd3d3LmRlZmVuc2UtOTIuZnIvaW1tb2JpbGllci9jZWxnZW5lLWV0LW1lcnNlbi1jaG9pc2lzc2VudC1sYS10b3VyLWVxaG8tcG91ci1sZXVyLW5vdXZlYXUtc2llZ2UtMzk4MjPSAQA?oc=5&hl=en-US&gl=US&ceid=US:en,"La Défense « a la cote » avec les laboratoires pharmaceutiques ces derniers temps…. Après la signature en septembre dernier d’AstraZeneca qui s’installera début 2016 dans la tour Carpe Diem sur 4 200 m², c’est un autre laboratoire qui a choisi le quartier d’affaires pour y établir son siège. Et c’est face à la tour Carpe Diem, dans la tour Eqho que Celgene va déménager dans les prochains mois son siège français actuellement installé rue du Quatre Septembre à Paris. L’entreprise américaine vient de signer un bail de neuf ans portant sur 3 717 m² répartis sur les 13ème et 14ème niveaux de l’édifice.

Dans le même temps Mersen, l’expert mondial des spécialités électriques et des matériaux en graphite a signé un bail de six ans portant sur 1 858 m² au 12ème étage. L’entreprise industrielle française installée actuellement dans l’immeuble Lafayette, situé au pied de la tour Eqho, qui cherchait un immeuble « plus prestigieux » devrait emménager dans ses nouveaux locaux d’ici la fin de l’année.

Concernant la première transaction, BNP Paribas Real Estate a été le conseil d’Icade, le propriétaire de la tour Eqho et Balzac REIM celui de Celgene. Pour la seconde transaction, CBRE conseillait Mersen et JLL Icade.

Celgene et Mersen rejoindront l’Ubaf qui a pris 3 724 m² de bureaux, Air Liquide 9 955 m², la Banque de France 5 616 m² et KPMG qui s’est installé cette année sur 40 468 m². Avec ces transactions, la tour Eqho dispose encore de 6 162 m² vacants en partie basse et affiche un taux d’occupation de 88 %. Selon nos informations un nouvel utilisateur pourrait se positionner dans les prochaines semaines sur 11 niveau de la tour Eqho pour une surface de 1 858 m².

Ancienne tour Descartes qui a abrité le siège d’IBM de la fin des années 80 à 2009, Eqho a été entièrement rénovée par Icade entre 2010 et 2013. Haute de 140 mètres, la tour développe 79 000 m² de bureaux répartis sur 40 étages. La tour Eqho dispose de cinq restaurants : Le Prisme, le Green, le Reflet, la cafétéria l’Horizon et un restaurant panoramique au 39ème étage. L’édifice promu comme un « campus à la verticale », par Icade propose de nombreux services : un parking privé de quatre niveaux en sous-sol de 1 100 places (voitures, bornes pour voitures électriques, vélos, deux-roues), un auditorium en gradins de 350 places, une conciergerie et bagagerie, un espace fitness comprenant notamment deux salles de squash, un salon de coiffure et un business center disposant de 18 salles de réunion avec espace lounge et terrasse ouvrant sur le quartier d’affaires. Pour ce dernier, le business center est privatisé au profit du principal locataire de la tour KPMG.

Après avoir obtenu les certifications HQE NF bâtiments tertiaires en rénovation, BREEAM niveau « very good » et la labellisation BBC Effinergie rénovation (une première pour un immeuble de grande hauteur), la tour Eqho a été certifiée HQE exploitation."
