Titre,Date de publication,URL,Contenu
Des taxis à hydrogène pour Paris dès 2016 - Automobile Propre,"Wed, 02 Dec 2015 08:00:00 GMT",https://news.google.com/rss/articles/CBMiP2h0dHBzOi8vd3d3LmF1dG9tb2JpbGUtcHJvcHJlLmNvbS9icmV2ZXMvdGF4aXMtaHlkcm9nZW5lLXBhcmlzL9IBAA?oc=5&hl=en-US&gl=US&ceid=US:en,"Associé au déploiement d'une première station de ravitaillement opérée par Air Liquide, la Société du Taxi Electrique Parisien (STEP) s’apprête à déployer plusieurs dizaines de taxis alimentés à l’hydrogène à Paris.

Après l’électrique et l’hybride rechargeable, Paris mise maintenant sur l’hydrogène pour accélérer la transition énergétique de ses taxis. Alors qu’Air Liquide vient d’inaugurer une première station de ravitaillement à Paris intra-muros, la Société du Taxi Electrique Parisien (STEP) annonce le déploiement d’une flotte de plusieurs dizaines de taxis fonctionnant à l’hydrogène.

Une station à hydrogène sur le Cours Albert Ier

Installée à l’occasion de la COP21, la station d’Air Liquide est située au cœur de la capitale, Cours Albert Ier sur le parking du Pont de l’Alma, et doit permettre de ravitailler la future flotte de la STEP.

« Je me réjouis de ce partenariat avec la start-up STEP. Cette première station nous permettra de mieux faire connaître au grand public les bénéfices de l’hydrogène comme énergie propre pour les véhicules » a expliqué François Darchis, membre du Comité Exécutif d’Air Liquide supervisant l’innovation.

En 2016, Air Liquide compte renforcer son maillage et annonce la création d’un « réseau permanent de stations à hydrogène » sur l’ensemble de la région parisienne.

70 taxis à hydrogène d’ici un an

Baptisée « hype », la flotte de la STEP sera initialement constituée de cinq exemplaires du Hyundai ix35. Produit en petite série, le Hyundai ix35 est alimenté par deux réservoirs embarquant jusqu’à 5,64 kg d’hydrogène à 700 bars et autorisant jusqu’à 500 km d’autonomie. D’ici un an, la société disposerait d’une flotte de 70 véhicules puis plusieurs centaines d’ici à 2020.

Un beau programme qui nous laisse quelque peu sceptique… Fondée en 2009, la STEP annonçait déjà l’arrivée de 200 taxis électriques – des Citroën C-Zero – dans les rues de la capitale pour 2012. On les attend toujours…"
COP21 : Guillaume de Souza veut dessaler la mer - Le Point,"Fri, 04 Dec 2015 08:00:00 GMT",https://news.google.com/rss/articles/CBMibmh0dHBzOi8vd3d3LmxlcG9pbnQuZnIvZW52aXJvbm5lbWVudC9jb3AyMS1ndWlsbGF1bWUtZGUtc291emEtdmV1dC1kZXNzYWxlci1sYS1tZXItMDQtMTItMjAxNS0xOTg3MjM2XzE5MjcucGhw0gEA?oc=5&hl=en-US&gl=US&ceid=US:en,"La newsletter sciences et tech

Votre adresse email n'est pas valide

Recevez toute l’actualité de la sciences et des techs et plongez dans les Grands entretiens, découvertes majeures, innovations et coulisses...

Tous les samedis à 16h

Merci !

Votre inscription a bien été prise en compte avec l'adresse email :



Pour découvrir toutes nos autres newsletters, rendez-vous ici : MonCompte"
"Villeneuve-sur-Lot : une usine à gaz, mais vertueuse - Sud Ouest","Wed, 16 Dec 2015 08:00:00 GMT",https://news.google.com/rss/articles/CBMid2h0dHBzOi8vd3d3LnN1ZG91ZXN0LmZyL2xvdC1ldC1nYXJvbm5lL3ZpbGxlbmV1dmUtc3VyLWxvdC92aWxsZW5ldXZlLXN1ci1sb3QtdW5lLXVzaW5lLWEtZ2F6LW1haXMtdmVydHVldXNlLTY5OTIxNDUucGhw0gEA?oc=5&hl=en-US&gl=US&ceid=US:en,"Certes, il y a comme une petite odeur. Et encore, il faut avoir le nez fin : sur le site du méthaniseur de Fonroche, les installations produisent du gaz depuis mercredi 2 décembre, à 10 heures précises. Mais pas en continu. De temps en temps, la « torchère » se réveille et consume le gaz qui n’est pas envoyé sur le réseau : « Nous ne sommes qu’à 70 % de fonctionnement de la capacité totale, sur les...

Certes, il y a comme une petite odeur. Et encore, il faut avoir le nez fin : sur le site du méthaniseur de Fonroche, les installations produisent du gaz depuis mercredi 2 décembre, à 10 heures précises. Mais pas en continu. De temps en temps, la « torchère » se réveille et consume le gaz qui n’est pas envoyé sur le réseau : « Nous ne sommes qu’à 70 % de fonctionnement de la capacité totale, sur les 34 500 MWh de gaz potentiels produits par an, explique Fabien Haas, responsable de l’activité biogaz. L’équivalent de la consommation annuelle de la moitié de la population de Villeneuve. Mais on monte doucement en puissance », précise-t-il. Après quatre ans de développement, le plus gros méthaniseur de France ronronne.

Sur le pont-bascule, un camion-citerne est pesé à chaque aller-retour, pour calculer les mètres cubes d’intrants qui franchissent le portail du site. « Ces jours-ci, en phase de démarrage, nous sommes nombreux à être présents, notamment nos partenaires du groupe danois Bigadan, mais à terme, il n’y aura que quatre personnes de Fonroche sur place, sans compter le personnel d’Air liquide et de Transport et infrastructures gaz France (TIGF). Quant à la matière première, elle arrive en moyenne d’une distance comprise entre 15 et 17 kilomètres, ce qui réduit considérablement l’emprunte carbone de nos clients. » La communication est bien huilée et au total, près de 71 000 tonnes d’intrants par an devraient être avalées par le méthaniseur.

Sur le quai de réception, la matière solide est passée dans un broyeur pour faciliter la digestion. Des broyats de maïs, du lisier, de la fiente de volaille… Rien de bien appétissant, sans compter tous les autres résidus agricoles. « Heureusement, le hangar de réception est en dépression, aucune odeur ne s’en échappe », souligne Carine Garbaye, responsable d’exploitation biogaz.

Zones de confinement

Derrière la jeune femme, l’hygiénisateur chauffe le mélange à 70 degrés pendant presque une heure, pour « éliminer les agents pathogènes ». Puis le résultat passe par les tuyaux et séjourne pendant trente jours dans le digesteur, puis encore seize jours dans le silo de stockage du site. « On attend qu’il soit bien stabilisé avant de nous en servir », précise Fabien Haas. Un peu plus loin, des ingénieurs de TIGF forment quelques agents au contrôle de débit du gaz : « Le conduit de raccordement est enterré, il passe sous le parking du site et va directement se raccorder au réseau. »

Une butte fait le tour des installations, disposées dans une cuvette : « C’est calculé pour qu’en cas de vidange totale du digesteur, aucun débordement ne puisse avoir lieu. Ce sont les normes, il n’y a pas de scénario catastrophe à envisager. Il faut juste une zone de rétention, comme une autre zone permet de recueillir les eaux de pluie à l’entrée du site. »

Brice Gallais, le responsable du site, est installé dans des bureaux en préfabriqués où on trouve aussi un petit laboratoire pour les analyses. Penché sur son écran de contrôle, il a sous les yeux tout le fonctionnement du méthaniseur et le circuit des matières en un clin d’œil : « Toutes les commandes sont là, ainsi que les différentes sondes. » Malgré son jeune âge [Brice a 26 ans, NDLR], il en est déjà à son quatrième méthaniseur. « Mais là, c’est beaucoup mieux que toutes les autres installations où j’ai pu travailler », ajoute-t-il, enthousiaste.

Stockage du digestat

Quant aux soucis rencontrés concernant les lieux de stockage décentralisés, Fabien Haas considère que ce ne sont que des contretemps : « Je vais régulièrement dans les conseils municipaux des communes concernées par le stockage et l’épandage du digestat issu de la méthanisation. Nous avons édité une plaquette pour expliquer ce que nous faisons, ce que contient le digestat. À Cazideroque et Tournon-d’Agenais, le tribunal administratif n’a rien trouvé à redire, et nous construisons également un réservoir à Croix-Blanche, qui sera bientôt terminé. » Dans un premier temps, des tests seront effectués sur certaines parcelles agricoles."
Hydrogène : une première station inaugurée à Paris - breezcar.com,"Wed, 02 Dec 2015 08:00:00 GMT",https://news.google.com/rss/articles/CBMiXWh0dHBzOi8vd3d3LmJyZWV6Y2FyLmNvbS9hY3R1YWxpdGVzL2FydGljbGUvc3RhdGlvbi1kaXN0cmlidXRpb24tdm9pdHVyZS1oeWRyb2dlbmUtcGFyaXMtMTIxNdIBY2h0dHBzOi8vd3d3LmJyZWV6Y2FyLmNvbS9hY3R1YWxpdGVzL2FydGljbGUvc3RhdGlvbi1kaXN0cmlidXRpb24tdm9pdHVyZS1oeWRyb2dlbmUtcGFyaXMtMTIxNT9hbXA9MQ?oc=5&hl=en-US&gl=US&ceid=US:en,"La station installée sur le parking du Pont de l’Alma servira à remplir les réservoirs des 5 premiers taxis électriques de la STEP

La ville de Paris vient d’inaugurer sa première station de distribution d’hydrogène. Installée par Air Liquide dans le 8e arrondissement, cette station va alimenter les premiers taxis de la Société des Taxis Electriques Parisiens (STEP).

Après les bornes de recharge, une station d’hydrogène

En décembre 2013, Paris accueillait sa première borne de recharge rapide destinée à faire le plein des véhicules électriques et hybrides rechargeables en moins de 30 minutes. Installée sur la station BP du boulevard Victor Hugo, dans le 15e arrondissement, cette borne avait été cofinancée par le constructeur Nissan. Deux ans plus tard, la capitale vient d’inaugurer sa première station d’hydrogène. Déployée par le groupe français Air Liquide sur le parking du Pont de l’Alma, Cours Albert Ier (8e arrondissement), cette station permettra aux 5 premiers véhicules à hydrogène de la Société des Taxis Electriques Parisiens (STEP) de recharger leurs réservoirs.





Fin 2016 : 75 taxis à hydrogène intégrés à la STEP

D’ici la fin 2016, la STEP prévoit d’intégrer un total de 75 véhicules électriques équipés d’une pile à combustible. A terme, plusieurs centaines d’unités sont attendues sur les routes de la région Ile-de-France. Une montée en puissance du parc qui devrait s’accompagner de l’ouverture d’une dizaine de stations de distribution d’hydrogène. Dotés d’une autonomie moyenne de 450 km pour un plein réalisé en moins de 5 minutes, les premiers véhicules sont fournis par le constructeur sud-coréen Hyundai. De type ix35 FCEV – un crossover basé sur l’ancienne génération du Tucson –, le premier véhicule à hydrogène de série a déjà été adopté par le Conseil Départemental de la Manche et commercialisé dans 14 pays."
Arkoon Netasq lance une solution de monitoring pour Splunk - Le Monde Informatique,"Wed, 02 Dec 2015 08:00:00 GMT",https://news.google.com/rss/articles/CBMieGh0dHBzOi8vd3d3LmxlbW9uZGVpbmZvcm1hdGlxdWUuZnIvYWN0dWFsaXRlcy9saXJlLWFya29vbi1uZXRhc3EtbGFuY2UtdW5lLXNvbHV0aW9uLWRlLW1vbml0b3JpbmctcG91ci1zcGx1bmstNjMxNTMuaHRtbNIBe2h0dHBzOi8vd3d3LmxlbW9uZGVpbmZvcm1hdGlxdWUuZnIvYWN0dWFsaXRlcy9saXJlYW1wLWFya29vbi1uZXRhc3EtbGFuY2UtdW5lLXNvbHV0aW9uLWRlLW1vbml0b3JpbmctcG91ci1zcGx1bmstNjMxNTMuaHRtbA?oc=5&hl=en-US&gl=US&ceid=US:en,"La filiale d'Airbus dédiée à la sécurité informatique, Arkoon Netasq, enrichit son écosystème de solutions de protection des réseaux avec un outil de monitoring dédié à Splunk. Il apporte notamment une meilleure visualisation des divers événements de sécurité remontés par ses produits.

Arkoon Netasq accroit l’intégration de ses logiciels de sécurité à Splunk, spécialisé dans l'analyse des données machine. La filiale d’Airbus Defence and Space, récemment renommée Stormshield, vient de lancer un outil de monitoring pour la solution SIEM (Security information and event management) de l'éditeur californien. Baptisée Stormshield Network Security App for Splunk, celui-ci intègre au sein d’une interface web les différents événements de sécurité émis par les produits Stormshield (pare-feu, VPN, etc) à travers Splunk.

Grâce à des tableaux de bord et à des alertes personnalisables, Stormshield propose ainsi à ses clients utilisant Splunk de simplifier la détection des incidents au niveau de ses produits. Il est censé en résulter une meilleure gestion des différentes règles de sécurité et de filtrage. Stormshield Network Security App for Splunk est disponible sur la plateforme de téléchargement d’applications Splunkbase."
60% des entreprises du CAC40 ont adopté Office 365 - Cloud - JDN,"Tue, 15 Dec 2015 08:00:00 GMT",https://news.google.com/rss/articles/CBMiXWh0dHBzOi8vd3d3LmpvdXJuYWxkdW5ldC5jb20vY2xvdWQvMTE2OTYzMy02MC1kZXMtZW50cmVwcmlzZXMtZHUtY2FjNDAtb250LWFkb3B0ZS1vZmZpY2UtMzY1L9IBAA?oc=5&hl=en-US&gl=US&ceid=US:en,"Société Générale, Alstom, Legrand, Vinci... Les fleurons de notre économie optent massivement pour la suite collaborative de Microsoft. Tour d’horizon de ces déploiements.

Le rouleau compresseur Microsoft est en marche. Dans la guerre qui l'oppose à Google dans l'adoption des solutions collaboratives en mode cloud en entreprise, le groupe de Redmond a mis le turbo. Google a bien su accrocher ces dernières années de belles références parmi les fleurons de l'économie française – Air Liquide, Lafarge, Essilor ou Valeo utilisent ses Google Apps for Work. Mais, depuis, Microsoft a mis les bouchées doubles, boosté par le discours ""mobile first"" et ""cloud first"" de son PDG, Satya Nadella. Résultat : 60 % des entreprises du CAC40 utilisent tout ou partie de sa suite Office 365. ""Le déclic s'est produit il y a deux ans. Aujourd'hui, nous assistons à une accélération des projets"", observe Nathalie Wright, directrice de la division grandes entreprises et alliances de Microsoft France.

630 000 utilisateurs d'Office 365 recensés dans le Cac 40

Dans ce dossier, le Journal du Net a recensé dix groupes du CAC40 qui mettent en œuvre Offce 365, totalisant plus de 630 000 utilisateurs de l'offre de Microsoft (voir le tableau ci-dessous). Ces projets les plus emblématiques ? Annoncé il y a un an, le programme DigitForAll de la Société Générale vise par exemple à installer SharePoint, Skype for Business ou Yammer sur le poste de travail de 150 000 collaborateurs. Chez Accor et Vinci, des chantiers de migration dépassent les 100 000 utilisateurs. (Et notre panorama ne prend pas en compte les 60 000 postes récemment annoncés par Suez Environnement, ce dernier ayant quitté le CAC40).

Face à Google, Microsoft joue sur ses atouts : sa présence historique en entreprise, son réseau dense de partenaires et, bien sûr, mais aussi le volet de sécurisation des données. Ce dernier point étant le principal frein évoqué à l'adoption des services SaaS. ""Pour un grand compte, le respect de la localisation des données et la data privacy sont des éléments essentiels"", rappelle Nathalie Wright. Microsoft recommande un hébergement des données sensibles au sein de l'infrastructure même de l'entreprise ou chez un hébergeur. Ce que permet de réaliser Office 365, puisqu'il donne le choix entre une déclinaison SaaS... et une version internalisée. Une alternative qui demeure impossible avec les Google Apps.

Première brique : la messagerie

Le déploiement des différents modules d'Office 365 est réalisé progressivement par les acteurs du CAC40 engagés. La première brique porte en général sur la messagerie avec la volonté de basculer vers une boîte aux lettres nouvelle génération. ""En 2013 et 2014, on a assisté à une vague importante de migrations de Lotus Notes d'IBM vers Microsoft Office 365"", note Cyril Drevon, responsable de l'activité infrastructure à l'agence Exakis de Lyon, un Microsoft Gold Partner.

Legrand a ainsi fait basculer 20 000 boîtes aux lettres Lotus Notes vers Exchange Online et Lync (devenu depuis Skype for Business) en moins de six mois. De fait, le mail et la messagerie instantanée vont généralement de pair. Pour les communications unifiées, l'accompagnement au changement est léger. Les utilisateurs ont en effet déjà souvent recours à ce type d'outil dans leur vie privée - avec Gmail ou Outlook. ""Déployer Skype en même temps que la messagerie crée un effet 'Waouh'. Cela génère une dynamique positive"", confirme Maximilien Chayriguès, dirigeant du cabinet EMS Conseil qui a notamment accompagné Alstom et LVMH.

Société Nombre d'utilisateurs Nature des déploiements. Les groupes du CAC40 qui ont adopté Office 365 Accor 160 000 Projet initié en 2013. Déploiement d'Office 365 (incluant SharePoint Online) pour les collaborateurs et les franchisés dans le monde entier. Alstom 85 000 Choix des solutions cloud de Microsoft dès 2010. Déploiement d'Office 365 dont Skype for Business. Accompagnement par Orange Business Services Axa NC Déploiement d'Office 365 auprès d'Axa Global Direct. BNP Paribas NC Déploiement de solutions Microsoft dont Skype for Business sur tablettes Windows 8. Capgemini 8 000 Yammer retenu comme réseau social d'entreprise. Déploiement d'Office 365 (Exchange et SharePoint) pour les collaborateurs de la filiale Sogeti dès 2013. Engie Migration de la messagerie de GRTgaz sur Office 365. Legrand 20 000 Migration des boîtes aux lettres Lotus Notes vers Exchange Online et Skype for Business. SharePoint et Yammer en cours de déploiement. L'Oréal 25 000 Yammer retenu comme réseau social d'entreprise. En septembre 2014, déploiement d'Office 365 en phase pilote sur quelques centaines d'utilisateurs. Société Générale 150 000 Déploiement de l'intégralité d'Office 365 sur les postes de travail annoncé en septembre 2014. Livraison de 90 000 tablettes sous Windows en cours de finalisation Vinci 183 000 Premier déploiement d'envergure annoncé dès septembre 2012. A elle seule, la filiale Vinci Energies compte 42 000 comptes actifs (dont Skype for Business, SharePoint et Yammer)

Etape suivante, le collaboratif

Après la messagerie, l'étape suivante, c'est le collaboratif. La conduite du changement est, cette fois, plus complexe. Il faut introduire de nouveaux usages, de bonnes pratiques, en l'absence parfois d'existant. Avec Yammer, OneDrive et SharePoint, Office 365 propose toute une panoplie d'outils pour pousser et partager des contenus. Tout l'enjeu consiste à mettre en avant la brique la plus pertinente pour un usage donné. Alors que certaines organisations tentent d'éradiquer l'e-mail en interne, le risque serait grand sinon d'empiler les boîtes (messagerie, chat, réseau social d'entreprise (RSE)…). D'où l'importance de cet accompagnement au changement.

""Une entreprise du CAC40 a pour elle de disposer d'une population demandeuse de solutions de mobilité et d'innovation"", positive Cyril Drevon. ""Dans ces multinationales, les salariés ont l'habitude de travailler en équipes virtuelles, réparties aux quatre coins de la planète, notamment dans les départements recherche ou marketing. Il faut juste les guider vers les bonnes pratiques."" Nathalie Wright y voit aussi un atout pour ces grands comptes d'attirer et de fidéliser les talents. Rompus à ce type d'outils, les jeunes actifs de la génération Y ne comprendraient pas que l'on puisse travailler autrement.

Des enjeux avant tout organisationnels

Autre difficulté à surmonter pour les groupes du CAC40 : l'évolution permanente de ces solutions collaboratives avec des apports fonctionnels à peu près tous les 30 jours. Maximilien Chayriguès a compté 440 évolutions d'Office 365 en un an ! Un mode inhérent au SaaS mais un poil perturbant pour des entreprises qui ont l'habitude de mener un grand chantier de migration sur deux ou trois ans, puis de passer à un autre sans se retourner. ""Les grands groupes doivent être en mesure d'absorber ces nouvelles fonctionnalités et de les restituer au bon département, un nouveau service peut être intéressant pour le marketing, un autre pour l'IT "", avance Cyril Drevon. Ce qui suppose d'avoir des ressources en interne de type transition manager ou community manager. Des profils qui ont commencé à apparaitre au sein des acteurs du CAC40.

Office 365 vs Google Apps for Work

Alors que Microsoft assoie sa légitimité sur sa connaissance du monde de l'entreprise, il est amusant de voir que l'éditeur a rapproché récemment les noms des modules d'Office 365 de ses solutions grand public afin de faciliter leur adoption. Lync est devenu Skype for Business, Exchange, Outlook.com. Tout l'inverse de Google qui, venant du grand public avec une approche pur web, tente de séduire les entreprises en professionnalisant son offre. ""Le choix se fait là"", tranche Cyril Drevon. ""Les grands groupes qui veulent être dans la continuité des usages choisissent Office 365, ceux qui se positionnent sur le 'disruptif full web' se tournent vers les Google Apps"", note-t-il. La différence ne se faisant donc pas, à ses yeux, sur les coûts, très proches."
