Titre,Date de publication,URL,Contenu
Nettoyer son capteur : un exercice zen où rigueur rime avec patience - Les Numériques,"Mon, 12 Sep 2016 07:00:00 GMT",https://news.google.com/rss/articles/CBMifmh0dHBzOi8vd3d3Lmxlc251bWVyaXF1ZXMuY29tL2FwcGFyZWlsLXBob3RvLW51bWVyaXF1ZS9uZXR0b3llci1zb24tY2FwdGV1ci1leGVyY2ljZS16ZW4tcmlndWV1ci1yaW1lLWF2ZWMtcGF0aWVuY2UtYTI4OTMuaHRtbNIBAA?oc=5&hl=en-US&gl=US&ceid=US:en,"Premier défi : trouver une pièce calme et bien éclairée.

Avoir un reflex et un hybride, c'est bien mignon et bien pratique pour produire de belles images, mais qui dit objectif interchangeable dit infiltration de poussières et de corps indésirables dans la chambre noire. Et bien sûr, les poussières n'étant régies que par la loi de Murphy, elles iront forcément se coller pile-poil là où elles gênent le plus, c'est-à-dire en plein milieu du capteur. Là où elles se voient bien, histoire de tenir compagnie à la belle tache causée par des projections de lubrifiant se baladant en dehors de l'obturateur — surtout l'été, quand la chaleur a bien contribué à le fluidifier. Pas de panique ! Ce pas-à-pas va vous aider à faire le ménage. Publicité, votre contenu continue ci-dessous

Un jour, en nettoyant le capteur d'un client, j'y ai trouvé une fourmi. Oui oui.

Les hybrides sont plus sensibles que les reflex à cet encrassement. En effet, étant dépourvus de miroir et l'obturateur mécanique étant ouvert en position de repos, le capteur est directement exposé aux agressions extérieures. Ceci dit, il ne faut pas croire que les reflex sont épargnés. En effet, la remontée du miroir brasse de l'air, qui peut faire voleter et remonter les poussières accumulées en bas de la chambre obscure, lesquelles ne trouveront rien de mieux que de se faufiler comme des fourbes à travers l'obturateur, celui-ci faisant également appel d'air. Au moins pourrez-vous vous consoler avec l'idée que, contrairement à un bridge ou un compact, vous pourrez toujours le nettoyer vous-même sans passer par la case SAV en cas de poussière ou de tache sur le capteur. Liste du matériel nécessaire pour procéder à un nettoyage du capteur

Vous pouvez opter pour des gants en nitrile ou, encore mieux, en coton (lavable). Publicité, votre contenu continue ci-dessous

Les indispensables : bombe à air sec et ""spatulettes"" ""Pour nettoyer un capteur, il faut une soufflette ou une poire à lavement."" NON ! Deux fois non ! Surtout pas ! Oubliez tout de suite ce conseil ! Même s'il est toujours amusant d'aller acheter une poire à lavement en pharmacie tout en expliquant que c'est pour son appareil photo, un tel accessoire est la pire des mauvaises idées lorsqu'il s'agit de nettoyer un capteur. Ce pour une raison simple, qui réside dans le fonctionnement de ces soufflettes mécaniques : vous allez aspirer de l'air ambiant pour le propulser directement sur votre capteur. À moins que vous ne viviez dans une salle blanche ou dans un laboratoire top secret de la Zone 51 — auquel cas nous voulons des photos —, il y a fort à parier que l'air ambiant de la pièce dans laquelle vous travaillerez sera rempli de poussières en suspension. Bref, une bonne fois pour toutes, notez le bien et répétez-le autour de vous : poire à lavement = caca.

Pour souffler les poussières sur le capteur, privilégiez toujours une bombe à air sec et n'utilisez jamais de soufflette en caoutchouc.

Pour déloger les poussières, utilisez donc une bombe à air sec, de celles que vous pouvez acheter pour nettoyer votre clavier de ses miettes. D'une part, l'air qui en sort est exempt de poussières et, d'autre part, le débit d'air sera à la fois plus puissant et plus précis. La ""spatulette"" est, comme son nom l'indique, une petite spatule en plastique avec un racloir aplati au bout, recouvert de textile microfibre non peluchant. Ce textile peut être pré-imprégné, mais nous vous recommandons d'utiliser des spatules sèches, qui se conservent mieux. Il faudra dès lors acheter du liquide de nettoyage dédié ou aller à la pharmacie — encore — vous procurer un flacon d'isopropanol, qui a l'avantage d'être neutre et de s'évaporer. Enfin, il existe des stylos nettoyants munis d'une brosse dépoussiérante : leur usage est strictement réservé aux objectifs, ils ne doivent jamais être utilisés sur un capteur ! Publicité, votre contenu continue ci-dessous

Achetez votre ""spatulette"" en fonction de la taille de votre capteur : Taille 1x pour les capteurs 24 x 36 mm Taille 1,3x pour les capteurs APS-H Taille 1,5x pour les capteurs APS-C (Fujifilm, Leica, Nikon, Pentax, Sony, Samsung) Taille 1,6x pour les capteurs APS-C Canon Taille 2x pour les capteurs 4/3"" (Olympus, Panasonic)

Les optionnels (mais bien pratiques) : une loupe à led, un jeu de tampons uréthanes Les loupes de qualité coûtant facilement une centaine d'euros, une telle acquisition n'est pas indispensable. Pour le plus minutieux d'entre vous et/ou pour ceux amenés à nettoyer régulièrement leur capteur, cet accessoire permet de contrôler plus minutieusement le travail, surtout dans les coins peu accessibles. Une simple lampe torche miniature peut également faire l'affaire mais vous ne bénéficierez pas de la loupe et les particules les plus fines pourraient échapper à votre inspection. Notez qu'il existe des modèles à moins de 50 € qui se trouvent très facilement.

Les tampons uréthanes sont proposés par Pentax et portent la référence O-ICK1. L'accessoire se présente sous la forme d'un bâtonnet avec un embout orange en uréthane accompagné d'un carnet de feuilles autocollantes. L'idée est de l'utiliser en tamponnant très minutieusement le capteur. Les poussières se colleront sur l'uréthane, vous n'aurez ensuite qu'à tamponner le papier collant pour que les débris collectés y soient transférés. C'est optionnel, mais l'essayer, c'est l'adopter. Autres accessoires optionnels mais toujours utiles : des gants en nitrile (pour éviter les traces de doigt) ou en coton (qui peuvent aussi faire office de chiffon mais attrapent plus la poussière), un masque de chirurgien (pour éviter les postillons — ne rigolez pas, ça arrive aux meilleurs d'entre nous —, un tourne-disque — pour passer le temps avec style. Nettoyer son capteur en quatre étapes Étape 1 : contrôle de l'encrassement Plutôt que de foncer tête baissée, prenez le temps d'évaluer les dégâts. Pour ce faire, rien de plus simple : fermez votre diaphragme au maximum, réglez la sensibilité au minimum, bloquez la mise au point à l'infini et photographiez une surface claire unie. Cela peut être une feuille ou un mur blanc, le ciel, le carrelage, peu importe. Peu importe également le temps de pose. Ce premier contrôle va vous permettre de repérer les pétouilles et vous pourrez même avoir la bonne surprise de constater qu'il n'y a pas de tache de graisse, ce qui accélérera le nettoyage. Publicité, votre contenu continue ci-dessous

Des fois, même pas besoin de prendre une photo pour constater les dégâts. Que celui qui a mangé des chips au-dessus du capteur se dénonce ! Pendant que vous y êtes, profitez-en pour nettoyer la monture optique côté boîtier et côté objectif. Des poussières, des poils, du pollen, des taches de graisse : votre capteur, un écosystème complet.

Gardez toujours à l'esprit que l'image à travers l'objectif est inversée. Ainsi, si une poussière se trouve en haut de l'image, elle se situera en fait en bas du capteur, et vice versa. De même pour la droite et la gauche. Étape 2 : chasser les poussières avec l'air Si vous possédez un hybride, le capteur se trouve déjà, a priori, exposé. Dans le cas contraire et/ou si vous possédez un reflex, nous vous invitons à vous reporter au mode d'emploi pour savoir comment forcer le relevage du miroir et l'ouverture de l'obturateur — les solutions bricolées à base de scotch et de doigt sur les lamelles sont à proscrire.

Ne maintenez surtout pas le miroir de votre reflex avec vos doigts... ... utilisez la fonction ""nettoyage manuel"" !

Munissez-vous de votre bombe à air sec. La plupart du temps, celle-ci est fournie avec une canule d'une vingtaine de centimètres : n'hésitez pas à la couper de sorte à ne garder que cinq centimètres. Ceci permettra de préserver un débit plus puissant et, surtout, de travailler plus précisément.

Secouez votre bombe et maintenez-la bien droite, l'APN étant posé sur le plan de travail, capteur vers le haut. Soufflez par petites impulsions de une à deux secondes, en procédant zone par zone. Soufflez toujours de l'extérieur vers l'intérieur afin de ramener les poussières coincées en périphérie et dans la chambre vers le centre du capteur. Retournez le boîtier, maintenez-le en l'air, capteur en bas, et recommencez le soufflage. Attention : il ne faut jamais souffler plus de cinq secondes par impulsion. D'une part, la physique fera que votre bombe se refroidira, parfois au point de ""brûler"" votre main — ce qui n'est jamais très agréable. D'autre part, l'air froid sortant de la bombe peut endommager votre capteur en y formant des cristaux de glace. Publicité, votre contenu continue ci-dessous

Avant et après le passage de la bombe à air sec.

Étape 3 (optionnelle) : tamponner le capteur pour éliminer les grosses poussières Le premier nettoyage à l'air ne suffit pas toujours à décoller les débris récalcitrants. C'est ici qu'interviennent les bâtonnets Pentax O-ICK1. Si vos bâtonnets ne sont pas neufs, vérifiez qu'aucune particule n'y est collée. Tamponnez les poussières de votre capteur une par une : un coup de tampon sur le capteur, un coup de tampon sur le papier collant, un coup de tampon sur le capteur, etc. Inutile d'essayer de tamponner plusieurs poussières simultanément, c'est le meilleur moyen de les déplacer sans les enlever. Procédez avec des gestes calmes et précis, n'appuyez pas trop fort sur le capteur. Au besoin, changer de papier autocollant dès qu'il est trop encombré. Ce n'est pas écolo, mais des fois la fin justifie les moyens. Utilisez la loupe à led (optionnelle) pour contrôler régulièrement votre travail. Étape 4 : nettoyer à la ""spatulette"" Si vous savez laver des carreaux, vous savez nettoyer un capteur. C'est juste plus petit. Commencez par contrôler qu'aucune grosse particule ne subsiste ; en passant la spatule, vous pourriez tirer un grain de poussière sur votre capteur et le rayer ! Imbibez généreusement la partie textile : il ne faut pas que l'isopropanol s'évapore trop vite, mais il ne faut pas non plus qu'il goutte sur le capteur ou qu'il laisse des traces. Raclez lentement, sans trop appuyer, dans le sens de la longueur, d'un bord à l'autre. Cinq fois dans un sens, cinq fois dans un sens. Parfois plus, parfois moins. Attendez toujours que tout l'isopropanol sur le capteur soit complètement évaporé entre chaque passage. Évitez les mouvements brusques qui pourraient brasser de l'air et de la poussière. Évitez d'éternuer sur votre capteur.

De toute évidence la spatule pour capteur APS-C est ici trop petite. Voilà. Là, c'est mieux. Le bon ouvrier, les bons outils, vous connaissez l'histoire. Vous ne pensiez pas que votre capteur était sale ? Si.

Étape 5 : contrôle final

Cette ultime étape est similaire à l'étape 1. Vérifiez qu'il n'y a plus de poussière sur votre image en répétant l'étape 1. Dans le cas contraire, recommencez les étapes 2, 3 et 4 autant de fois que nécessaire.

Le même capteur que photographié précédemment. C'est mieux, non ? Mais pas parfait...

Petit conseil : ayant nous-mêmes nettoyé des dizaines de capteurs, il nous est très rarement arrivé d'obtenir un travail impeccable. Il y a toujours une ou deux petites poussières récalcitrantes. Dans ce cas-là, inutile de vous acharner : si elles sont dans les coins extrêmes, laissez-les. Si elles sont au centre, faites en sorte de les pousser vers le haut du capteur, de sorte qu'elles ne gênent pas l'image, puisqu'elles se trouveront, sur votre photo, au niveau du sol et pas dans le ciel. Publicité, votre contenu continue ci-dessous"
Le monocylindre : Eloge de la simplicité - lerepairedesmotards.com,"Sun, 25 Sep 2016 07:00:00 GMT",https://news.google.com/rss/articles/CBMiR2h0dHA6Ly93d3cubGVyZXBhaXJlZGVzbW90YXJkcy5jb20vdGVjaG5pcXVlL21lY2FuaXF1ZS9tb25vY3lsaW5kcmUucGhw0gEA?oc=5&hl=en-US&gl=US&ceid=US:en,"Le monocylindre : Eloge de la simplicité

A l’origine de la moto, il y avait le monocylindre, simple et compact. Monté dans des machines fines et légères, il a forgé la légende, avec des BSA Gold Star, des Norton Manx… et des Yamaha 500 XT … Mais au fil des années, les motards ont demandé plus à leurs montures et le mono a marqué le pas.

Course à l’armement

Cette culasse KTM 450 démontre à elle seule la compacité du monocylindre et explique sa légèreté.

L’évolution naturelle des motos modernes va vers plus de confort, plus de vitesse, plus de fiabilité. Des domaines qui ne sont pas l’apanage du mono. En effet, déséquilibré par nature et offrant une piètre régularité cyclique, il cogne fort à bas régime, ce qui lui vaut d’ailleurs son surnom de « Thumper », (cogneur dans la langue de Shakespeare). De plus, dans la quête de performances, le monocylindre marque le pas. Logique, car pour gagner de la puissance, on peut soit augmenter la cylindrée, soit le régime de rotation du moteur. Dans les deux cas, il avoue ses limites. Si l’on augmente la cylindrée, le piston devient plus gros, donc plus lourd. De fait les efforts d’inertie qui sont à l’origine de l’usure et des vibrations augmentent du même coup. Même problème si l’on cherche à atteindre des régimes élevés, car, les efforts d’inertie évoluant avec le carré du régime, on se retrouve confronté aux mêmes risques de casse, d’usure et de vibrations…. Le mono doit donc se limiter à des puissances moyennes, sans pouvoir prétendre à battre des records…. De fait sa dernière victoire en GP remonte à 1969. C’était une Norton Manx et la course se déroulait sous la pluie. Ensuite les multicylindres, 2 et 4 temps l’ont définitivement supplanté.

Après-guerre, les monocylindres anglais constituaient l’arme absolue pour les pilotes privés qui souhaitaient courir. Ils durent cependant changer de monture à la fin des années 60 face aux progrès du deux temps et des multicylindres. Ici une Matchless G 50 : Elle fut LA concurrente de la Norton Manx. Elle s’en distinguait par son moteur simple ACT.

Yamaha réinvente le gromono

Je suis une légende. Moteur 2 soupapes simple ACT refroidi par air, démarrage au kick et freins à tambours. La 500 XT est aux antipodes du progrès, mais elle va faire un tabac. C’est à elle qu’ on doit le retour du gromono.

Pourtant en 1976 Yamaha remet cette technologie au goût du jour en lui trouvant un écrin parfaitement adapté : Le trail. Coupleux, économe, plein de caractère, le monocylindre remporte un succès mondial sous les traits de la 500 XT. Bien vite la concurrence lui emboîte le pas et le phénomène prend une ampleur insoupçonnable avec le développement du Paris Dakar. Le trail monocylindre devient alors un symbole de liberté, d’aventure et d’évasion. Nous sommes à l’aube des années 80. Mais l’histoire trébuche quand BMW entre dans la course avec son célèbre flat twin. Malgré leurs efforts, cylindrée accrue, multiplication des soupapes, double ACT, etc, les monos ne pourrons tenir tête à la vague des multicylindres. Après avoir cédé la place sur l’asphalte, il s’incline sur les pistes sablonneuses. Définitivement mort ? Non sûrement pas, le monocylindre est un mécanique rustique qui supporte les mauvais traitements. Il va donc renaître de ses cendres, tel le Phoenix.

Dernier bastion, derniers bastons

Retour en grâce : l’application des technologies de course a permis aux monos de revenir en force et de s’imposer face aux 2 temps, au bénéfice d’une équivalence de cylindrée. Le TT reste l’unique endroit où l’on trouve encore des monocylindres Hi-Tech. Ici un moteur Yamaha 450 double ACT culasse inversée et injection.

Désormais la seule alternative pour lui reste le tout-terrain pur et dur. Ici poids et compacité sont des qualités incontournables, supérieures à la puissance pure. Impossible de faire passer cent chevaux et plus sur un terrain boueux remplit de bosses. Impossible aussi de s’y débattre efficacement avec une machine proche de 200 kg. Ici le multicylindres n’a pas (encore) sa place. Mais jusqu’à une époque récente, le mono 4 temps ne pouvait lutter contre le 2 temps à cylindrée égale. Mais quand le durcissement des normes antipollution pousse le deux-temps vers la sortie (décidément, là aussi l’histoire se répète !), il s’impose. Au profit d’une équivalence de cylindrée 125 2 temps / 250 4 temps et 250 2 temps 450 4 temps, on voit naître une nouvelle race de monocylindres de moyenne cylindrée à la fois puissants, légers et performants. Cette nouvelle génération de monocylindre Hi-Tech ne s’en laisse pas compter. Double ACT, 4 soupapes en titane, refroidissement liquide, pistons forgés… Ils dépassent largement les 100 cv/L et supportent des régimes de l’ordre de 13000 tr/mn en 250 ! ! !

Cette race mutante, lorgne à nouveau vers le bitume grâce à la mode du supermotard, avec pour unique ambition de reconquérir le terrain cédé. Le mono est coriace !

Le constructeur Autrichien KTM reste le plus ardent défenseur du monocylindre sur route. Les performances et la fiabilité de ses 690 sont époustouflantes pour un mono. Ici un moteur 500 EXC.

Encadré : Le 2 temps

Puissant compact, léger, simple le monocylindre 2 temps a connu ses heures de gloire en tout-terrain.

L’évolution récente des normes antipollution l’a un peu disqualifié, mais lui non plus n’a pas dit son dernier mot… Les pilotes de TT qui ont opté pour les moteurs à soupapes n’ont pas forcément intégré ni digéré le surcoût d’utilisation qui allait en découler. Moteurs plus complexes, tournant plus vite, nécessitant une maintenance plus régulière (contrôles des jeux aux soupapes, chaîne de distribution, forte usure des soupapes titane avec la poussière…). Tout cela coûte cher … Certains commencent à penser que finalement les cylindres à trous… Ce n’était pas si mal !

Plus d'infos sur la mécanique"
