Titre,Date de publication,URL,Contenu
Riding the clean energy boom - Chinadaily.com.cn - China Daily,"Fri, 02 Aug 2013 07:00:00 GMT",https://news.google.com/rss/articles/CBMiSWh0dHBzOi8vd3d3LmNoaW5hZGFpbHkuY29tLmNuL2EvMjAxMzA4LzAyL1dTNWEyYTFkNTFhMzEwMWE1MWRkZjhlYjc5Lmh0bWzSAQA?oc=5&hl=en-US&gl=US&ceid=US:en,"Air Liquide Group's plant in Zhangjiagang, Jiangsu province. Driven by increasing demand, the company will continue strong investment in China. Provided to China Daily

French industrial gas producer plans more investments in China to cash in on growth opportunities

Air Liquide Group, the world's largest industrial gas producer by revenue, has launched the second phase of its investment program, called Tengfei II, in China this year. The programs cater to the country's growing demand for oxygen, nitrogen, hydrogen and other gases.

The French company started the first phase of its investment program, Tengfei I, in 2007. The program planned investment of 300 million euros and employment of over 500 new employees every year. Currently, the company has 4,000 employees operating 64 plants in 16 provinces.

Remi Charachon, president of Air Liquide (China) Holding Co Ltd, says Tengfei II will run till 2020 and the French company will continue strong investment and maintain good profitability in China, especially in its west and northwest regions.

The new investment will be spent on expanding Air Liquide's manufacturing facilities, on-site production, technology research, medical gas supply network and Chinese companies' outsourcing production of non-core products.

Industrial gases and related technologies are indispensable to a wide range of industries. They can be applied in healthcare, such as medical oxygen and anesthetic gas, clean energy, high-tech industries such as advanced coal gasification, metallurgy, chemicals, petrochemicals, automotive, food and pharmaceuticals, which are among China's top development priorities.

""China's policies to cut greenhouse gas emissions and improve energy efficiency have offered industrial gas makers great opportunities to maintain a fast growth rate in the world's second-largest economy,"" says Charachon, who became Air Liquide's China head in 2004 and is also chairman of Singapore-based Asia Industrial Gas Association for China.

In the past two decades, China's inexpensive labor force and resources have assisted the boom in its manufacturing sector, which has had the unfortunate side effects of low profit, heavy pollution and increased energy consumption.

Realizing that these outcomes will slow its economic growth, the Chinese government has pledged that by 2015 it will cut carbon emissions for each unit of GDP by 17 percent from 2010 levels.

China's coal-fired power plants, petrochemicals companies, and steel and cement producers have all scrambled to reduce emissions to prevent having their bank loans stopped or operating licenses revoked by the government.

Charachon says under such circumstances China is seeking high -standard technologies to produce gasoline with lower sulfur, a process that needs hydrogen.

""There are huge projects linked to energy, for instance, transforming coal into gasoline or synthetic natural gas requiring huge quantity of oxygen, and also some other technologies.""

The 51-year-old says the emerging trend of outsourcing non-core products to big companies has also brought opportunities to Air Liquide to expand into new regions.

It recently formed a joint venture with Maoming Petrochemical, a subsidiary of Sinopec in Guangdong, to build an air separation unit with a capacity of 3,000 tons of oxygen daily to provide gases for the coal-to-hydrogen project of its existing refinery.

Sun Fuquan, a researcher at the Chinese Academy of Science and Technology for Development in Beijing, says demand for industrial gases will continue to surge over the next decade due to the rapid development of China's healthcare, electronics, photovoltaic, engineering, environmental and urbanization-related industries.

China has become a big buyer of these gases in recent years. It consumed 76 billion yuan ($12.4 billion, 9.3 billion euros) worth of industrial gases last year. The China Industrial Gas Association expects China's demand for industrial gases to reach $15.94 billion by 2016.

""Stable Chinese market growth has further fueled the expansion of foreign industrial gas providers such as France's Air Liquide SA, Germany's Linde AG, the US companies Praxair, Air Products and Chemicals Inc,"" Sun says. ""They have sophisticated technologies to produce high quality gases and set long-term product goals for energy, water and chemical use.""

Even though Chinese gas makers outnumber international players in the domestic market, they are still not fully competitive, as they cannot make high-capacity air separation units.

Operating in 80 countries across the world, Air Liquide posted sales of 15.3 billion euros and net profit of 1.6 billion euros in 2012, up from 14.5 billion euros and 1.53 billion euros a year earlier. Charachon says Air Liquide's gas and services sales in China rose 15 percent and the country has become the company's fifth largest global market after the United States, France, Japan and Germany.

To further enhance its presence in China, Air Liquide signed a long-term contract with Fujian Shenyuan New Materials Co Ltd in May to supply industrial gases for its caprolactam production project in Lianjiang Kemen Economic and Development Zone in Fujian province.

It will invest in an industrial gases complex of eight units including an air separation unit of 2,000 tons of oxygen a day, a gasification unit, a purification unit of synthesis gas and an ammonia plant to supply hydrogen, nitrogen and ammonia. They will purify synthesis gas and avoid sulfur emissions, which are responsible for acid rain.

These plants will be operational in 2016 and they will be able to produce 75,000 normal cubic meters per hour of hydrogen and 250,000 tons per year of ammonia.

Charachon says another sector that Air Liquide has been engaged in is China's photovoltaic industry, to which it provides high-purity gases.

""This industry is facing a number of difficulties, such as overcapacity, potential anti-dumping tariffs from the EU, declining prices and low efficiency, we believe that there will be a consolidation of the industry and the emergence of a few key players.""

Charachon believes that China's photovoltaic industry will recover step by step.

""Solar is clean energy and renewable, and the Chinese government has been supportive of this industry. From a long-term perspective, this should be an attractive market.""

zhongnan@chinadaily.com.cn

(China Daily European Weekly 08/02/2013 page8)"
August 2013 - Dividend Growth Investor,"Sat, 31 Aug 2013 07:00:00 GMT",https://news.google.com/rss/articles/CBMiL2h0dHBzOi8vd3d3LmRpdmlkZW5kZ3Jvd3RoaW52ZXN0b3IuY29tLzIwMTMvMDgv0gEA?oc=5&hl=en-US&gl=US&ceid=US:en,"I am not a licensed investment adviser , and I am not providing you with individual investment advice on this site. Please consult with an investment professional before you invest your money. This site is for entertainment and educational use only - any opinion expressed on the site here and elsewhere on the internet is not a form of investment advice provided to you. I use information in my articles I believe to be correct at the time of writing them on my site, which information may or may not be accurate. We are not liable for any losses suffered by any party because of information published on this blog. Past performance is not a guarantee of future performance. Unless your investments are FDIC insured, they may decline in value.





By reading this site, you agree that you are solely responsible for making investment decisions in connection with your funds.





Questions or Comments? You can contact me at dividendgrowthinvestor at gmail dot com.

By reading this website, you agree that you will not modify, copy, reproduce, sell, or distribute any content in any manner or medium without permission Copyright 2008 - 2023"
Un tas de clones rit - Libération,"Sun, 11 Aug 2013 07:00:00 GMT",https://news.google.com/rss/articles/CBMiRmh0dHBzOi8vd3d3LmxpYmVyYXRpb24uZnIvdm91cy8yMDEzLzA4LzExL3VuLXRhcy1kZS1jbG9uZXMtcml0XzkyNDE5OC_SAVVodHRwczovL3d3dy5saWJlcmF0aW9uLmZyL3ZvdXMvMjAxMy8wOC8xMS91bi10YXMtZGUtY2xvbmVzLXJpdF85MjQxOTgvP291dHB1dFR5cGU9YW1w?oc=5&hl=en-US&gl=US&ceid=US:en,"Comme chaque année, le Clone Fest pose aujourd’hui ses quartiers au parc naturel du Gâtinais français (Essonne). Le rendez-vous, instauré en 2020, rassemble ceux qui se ressemblent, nés depuis 2002 grâce aux efforts de la société Clonaid. Trois jours de partage en partenariat avec les associations 130 Millions d’Amis et Tel quel, mais aussi de débat, car tous ne sont pas amoureux de l’uniforme : quelques associations de dissidents, on le sait, souhaitent«rétablir les différences». Pour mieux connaître leur quotidien, nous avons interrogé cinq clones de Francis, 65 ans, retraité de la marine. Ils ont entre 21 et 44 ans, sont enseignant ou sociologue et ont traversé la vie dans l’ombre de leur modèle ou, comme ils disent, leur «numéro 1».

«J’étais un peu leur maman»

Fransix 44 ans, gardien de prison

«Dans les cloneries [fratries de clones, ndlr], ce qui est primordial, c'est le rangement. Sans ça, on n'arrive à rien. Par exemple, 20 personnes qui cherchent leur deuxième chaussette dans le même dortoir, c'est pas possible. C'est un motif d'éradication. Pour la première campagne de clonage de Francis, on était apparus une douzaine. Dès 3 ans, chacun avait son rôle, par exemple, pour Francys, c'était les organes (lire ci-après) ; pour Francisse les actes administratifs ; pour moi c'était l'intendance. Je devais m'occuper des onze autres. J'étais un peu leur maman, et avec moi, c'était carré.

«J’ai eu une enfance plutôt agréable car on ne me demandait pas d’être bon en classe ou de servir d’esclave sexuel. Tant que j’arrivais à finir mes lessives, mon repassage, mon ménage et les courses, après avoir préparé le repas, mis la table et l’avoir débarrassée, fait un peu de vaisselle et rangé la maison, j’étais tranquille jusqu’au petit déj du lendemain. J’avais pas à me plaindre.

«Ensuite, je me suis occupé des clones des onze autres campagnes. Mais c’était pas pareil, on avait des problèmes de place, on a dû s’entasser dans des garde-meubles. J’avais comme une impression de déjà-vu. Et puis on était trop différents. En âge, je veux dire. Autant j’étais proche de mes premiers frères, que je pouvais reconnaître à l’odeur, autant ceux-là, j’étais infoutu de retenir ne serait-ce que leur prénom. Il y a eu des moments difficiles, c’est vrai, mais comme dans toutes les familles de 145 personnes. Le pire, je crois, c’est le jour de l’anniversaire, ou celui du départ en vacances. L’important dans ces cas-là, c’est de rester uni, soudé. Une équipe.»

«Putes à volonté, buffet gratuit soir et midi»

Francys 28 ans, enseignant

«Vous savez, on s’habitue. Chaque Clone Fest, c’est peut-être le dernier. On est une trentaine, je crois, à servir de réservoir d’organes pour Francis. Et Francis, son truc, c’est la picole. Il y a des gens qui clopent, bon, on peut leur changer un poumon et même avec un seul poumon, son clone survit. Ou un seul rein. Mais le foie, une fois qu’on me l’aura enlevé pour l’autogreffer à Francis, à la poubelle le Francys. C’est le progrès : Francis va mourir beurré comme un Petit Lu sans jamais avoir frôlé la cirrhose. Moi, en revanche…

«Bon, il y a des compensations. Putes à volonté, buffet gratuit soir et midi. J’ai de la chance, pour les filles, Francis a passé un deal avec une boîte russe, c’est de la qualité. Des clones de la même fille tous les week-ends, pour la sentimentalité, et des produits différents tous les soirs de semaine. Côté bouffe, rien que du bio et du diététique, afin d’éviter qu’on meure d’obésité avant d’avoir livré nos organes.

«Comme tous les CPM [clones précocement mortels, ndlr], j'ai eu à choisir un métier en rapport avec mon savoir intime de la mortalité. Les pompes funèbres ou légiste, ça ne me disait trop rien. J'ai fait dans la facilité. Prof de philo. Apprendre à mourir, la révolte, l'être, tout ça. Mais cette année, je prépare des Immortels aux grandes écoles de communication. C'est la première fois, ça me plaît bien. Je leur fais les œuvres complètes d'Alan Harrington et Michel Houellebecq en extraits. Là, j'en suis au développement créatif comme passe-temps pour l'éternité, ça a l'air d'accrocher. Ils ont une dissertation à rendre pour l'an prochain : ""Peut-on créer continûment sans devenir Dieu ?"" J'espère ne pas passer par la case morgue avant d'avoir fini le programme…»

«Même les vaches ont des taches»

Phrancis 21 ans, sans emploi

«Je suis là mais en fait je ne suis pas là. J'ai pas le droit d'être là. S'ils me trouvent ici, ils me rectifient d'emblée, s'il vous plaît notez que je ne suis pas là… [A la demande de Phrancis, son prénom a été modifié, ndlr.] Tout petit, j'ai commencé à me demander pourquoi on était autant à se ressembler. Quel intérêt de recouvrir la planète de personnes identiques, sans signe distinctif. C'est vrai, ça, même les vaches ont des taches. Et puis j'ai compris.

«Revenez dans deux cents ans, et vous ne trouverez plus qu’une dizaine de familles qui peupleront la Terre. Le clonage thérapeutique, c’est du flan. Parce que le but, c’est pas de soigner, c’est de sélectionner les élus qui feront partie du grand shebaz, le voyage cosmique pour retrouver nos ancêtres Elohim. C’est ça la vérité, c’est aussi pour ça que le Clone Fest est organisé, pour qu’on ne se perde pas de vue. Les affiches du conseil général de l’Essonne, le barbecue à 14 heures, je veux bien, mais c’est une couverture. L’essentiel, c’est les yeux, regardez… Je te vois, tu me vois, on se comprend. Tu vois ?

«Raël, pour moi, c'est le seul qui peut nous sauver, il va briser le miroir. J'ai un contact avec lui. Tous les jours, il vient me voir, avec son manteau blanc il entre dans ma chambre, me demande si je vais bien, il prend soin de moi. Je sais qu'il sait que nous savons qu'ils savent. C'est pour ça que les choses vont changer, ça va être différent, avec des différences. (Il crie) Des différences ! Après le barbecue, vous verrez… (Il est soudain ceinturé par des membres de la sécurité.)»

«On veut un enfant non né»

Francisse 39 ans, employé

«C’est en visitant la mère de Francis que j’ai rencontré Polyne. Une fille sympa. Je ne peux pas me plaindre. D’ailleurs, Francis est plutôt cool avec moi. Je fais la queue à la poste, aux Assédic, aux expos du Grand Palais, c’est moi qui cause aux garçons de café, évidemment je travaille à sa place, bref tout le sale boulot, mais Francis aime bien se garder quelques activités. Par exemple, il bosse en été, pour mater les filles en jupettes et sandales. Pendant ce temps, je me repose. Là, c’est un peu pareil. Je vais voir sa mère tous les dimanches à sa place, mais Francis ne dit rien, rapport à mon histoire avec Polyne ; tant que je fais la conversation avec sa daronne, que je lui apporte des chocolats, que je supporte ses chantages au suicide… Polyne, c’est le clone 78 de la mère de Francis. Elle a 33 ans, elle est coiffeuse. On l’a fabriquée à l’époque où l’on croyait que Pauline, sa numéro 1, avait un don de divination et que ça pourrait servir d’en avoir plusieurs en cas de guerre, de canicule, de pénurie de lolcats… On s’est aperçu trop tard que Pauline n’avait aucun don. Elle se contentait d’écouter les voisins à travers la cloison et de leur prédire ce qu’elle avait entendu.

«Avec Polyne, je crois qu’on s’aime vraiment. On envisage de déposer une demande de stérilisation, afin d’être sûrs que notre enfant sera unique puisque non né. Vous savez, être clone, c’est parfois dur. Je vois mon pote Rayanne, que son numéro 1 utilise pour pratiquer l’autofellation, c’est pas top glamour.»

«Un moyen efficace de s’épanouir en société»

Francyx 41 ans, sociologue

«Dès 2005, le clonage a d’abord été une préoccupation des couples homosexuels, qui y voyaient un moyen simple d’avoir des enfants, avant les lois sur l’adoption ou la PMA. Il y a eu les débordements que l’on sait dans les couples gays, chacun des partenaires se trouvant plus beau que l’autre et insistant pour que leur fils soit à son image. Chez les lesbiennes, à l’inverse, chacune voulait que la fille du couple soit le clone de sa partenaire. Assez vite, beaucoup de couples d’hommes se sont séparés. Chacun trouvait plus avantageux de vivre avec son seul clone que de supporter les humeurs d’un partenaire qui n’était, de fait, qu’une copie imparfaite de lui-même.

«Mais la fracture décisive dans l'évolution du clonage remonte à l'affaire des Grotowsky [en 2021, Boris Grotowksky a épousé le clone, alors âgé de 17 ans, de sa mère, clone qui a ensuite voulu se marier avec le clone d'un des jumeaux qu'elle avait eus avec Grotowsky, ndlr], qui, bien que ressortissant davantage à la psychiatrie, a eu des conséquences juridiques énormes, notamment la loi de décembre 2024 sur l'encadrement marital des clones, qui deviendra deux ans plus tard la loi sur l'encadrement sexuel.

«Aujourd’hui, le clonage reste un moyen efficace pour s’épanouir en société, c’est-à-dire en restant chez soi pendant que vos clones vous représentent au dehors. Il n’a plus, de par son encadrement juridique - et même, ne nous voilons pas la face, par une certaine lassitude de ses plus fervents supporteurs - cet attrait de l’interdit gémellaire et de la quête sexuelle infra-identitaire qu’il a pu générer jadis. Aujourd’hui, le ""droit à la ressemblance"", c’est un truc de vieux.»

Pour de vrai

1997 Messager des Elohim («nos créateurs») depuis 1973, Claude Vorilhon dit Raël fonde Clonaid, société promeuvant l'éternité par le clonage.

2000 Raël abandonne la direction de Clonaid à Brigitte Boisselier, ex-chimiste à Air Liquide et guide-évêque raélienne.

26 décembre 2002 Naissance annoncée, depuis la Floride, par Brigitte Boisselier, d'Eve, premier bébé cloné par sa société.

Janvier 2003 Après avoir annoncé des preuves ADN du clonage d'Eve (que personne n'a jamais vue), Boisselier explique que les parents du bébé ne sont plus très chauds pour le test génétique.

13 janvier 2003 Le tribunal de Fort Lauderdale en Floride entame une procédure judiciaire contre Thomas Kaenzig, vice-président de la société Clonaid.

2013 Le clonage humain reproductif n'a toujours pas été réalisé.

Demain : Le rock n’est pas revenu à la mode."
Un astronaute italien a failli mourir noyé dans son scaphandre - Le Figaro,"Wed, 21 Aug 2013 07:00:00 GMT",https://news.google.com/rss/articles/CBMiiAFodHRwczovL3d3dy5sZWZpZ2Fyby5mci9zY2llbmNlcy8yMDEzLzA4LzIxLzAxMDA4LTIwMTMwODIxQVJURklHMDA0NDAtdW4tYXN0cm9uYXV0ZS1pdGFsaWVuLWEtZmFpbGxpLW1vdXJpci1ub3llLWRhbnMtc29uLXNjYXBoYW5kcmUucGhw0gEA?oc=5&hl=en-US&gl=US&ceid=US:en,"L'astronaute italien Luca Parmitano raconte dans le détail ce qui s'est passé lors d'une sortie écourtée à l'extérieur de la Station spatiale internationale.

Le 16 juillet dernier, les astronautes Luca Parmitano et Chris Cassidy avaient dû écourter en urgence une sortie dans l'espace à l'extérieur de la Station spatiale internationale (ISS) à cause d'une grave avarie dans le scaphandre autonome de l'astronaute italien. Luca Parmitano, qui est toujours en orbite, a raconté sur son blog cet épisode terrifiant, pendant lequel il a bien failli mourir noyé à cause d'une fuite d'eau dans son casque. Ce pilote d'essai de l'armée de l'air italienne a été envoyé sur l'ISS le 28 mai dernier par l'Agence spatiale européenne (ESA) pour une mission de longue durée.

L'incident, encore inexpliqué, s'est produit le 16 juillet, seulement une heure et demie après le début de la deuxième sortie dans l'espace, qui aurait dû durer au moins sept heures. «La sensation inattendue d'avoir de l'eau sur la nuque me surprend et je suis dans un endroit où je préférerais n'avoir aucune surprise», a raconté Parmitano. Il explique avoir averti par radio son compagnon de sortie, l'astronaute américain Chris Cassidy, et la base de Houston.

«Je sens tout à coup que la température du liquide est trop froide pour être de la sueur et j'ai la sensation distincte qu'elle s'accroît en volume», poursuit l'astronaute âgé de 36 ans dans son stupéfiant récit. Le centre de contrôle de la sortie extravéhiculaire à Houston lui donne rapidement l'ordre de mettre un terme à la sortie. Mais alors qu'il abandonne ses tâches en cours et se dirige vers le sas de la station, «la sensation que l'eau augmente devient une certitude». Il la sent qui recouvre les écouteurs et se demande s'il ne perdra pas le contact audio avec ses camarades.

« Je ne sais pas si la prochaine fois que je respirerai, je réussirai à me remplir les poumons d'air ou de liquide » Luca Parmitano, astronaute de l'Agence spatiale européenne

«L'eau recouvre presque toute la partie frontale du viseur à laquelle elle adhère, réduisant d'autant ma vision», se souvient-il. À un certain moment, pendant son pénible retour vers la station, il se retrouve avec toute «la partie supérieure du casque désormais pleine d'eau». En apesanteur, l'eau ne s'accumulait pas au fond du casque, mais se collait comme un film souple sur toutes les surfaces avec lesquelles elle était en contact.

Luca Parmitano lors d'une de ses deux sorties dans l'espace. ESA

«Je ne sais pas si la prochaine fois que je respirerai, je réussirai à me remplir les poumons d'air ou de liquide», poursuit-il, alors qu'il progresse le long de l'ISS, ne voyant qu'à quelques centimètres devant lui. Heureusement, il se souvient à un moment du câble de sécurité qui le relie à la station et «le tire» vers la gauche. «Je m'impose de rester calme et avec patience je cherche en tâtonnant les poignées (du sas de recompression, NDLR) tout en pensant en parallèle à comment faire pour éliminer l'eau si elle devait arriver à la bouche», explique-t-il. Il pense à éventuellement ouvrir la valve de sécurité près de l'oreille gauche qui pourrait créer une «dépressurisation contrôlée», même si «créer une brèche dans la combinaison spatiale est la dernière carte à jouer». Au bout de quelques instants, l'eau recouvre ses écouteurs et il n'entend presque plus les communications radio de son compagnon et du centre de contrôle.

Parvenu après quelques minutes «qui semblent durer une éternité» dans le sas qui fait la transition entre la station proprement dite et l'espace, il pense, pendant la repressurisation: «Si l'eau devait me submerger, je pourrais toujours ouvrir le casque: je perdrais probablement conscience, mais ce serait toujours mieux que me noyer dans le casque.» La repressurisation terminée, Luca Parmitano, sain et sauf, peut enfin rejoindre ses compagnons à l'intérieur de la station.

Les experts de la Nasa ont lancé deux enquêtes différentes sur l'incident sans réussir pour le moment à en déterminer la cause. Ils pensent qu'il pourrait s'agir d'une fuite dans le système de refroidissement de sa tenue plutôt que dans la canule d'alimentation en eau potable reliée à son casque."
