Titre,Date de publication,URL,Contenu
"Air Liquide awarded a new contract for the ITER project, strengthening its leadership in extreme cryogenics - Air Liquide","Fri, 16 Oct 2015 07:00:00 GMT",https://news.google.com/rss/articles/CBMinQFodHRwczovL3d3dy5haXJsaXF1aWRlLmNvbS9ncm91cC9wcmVzcy1yZWxlYXNlcy1uZXdzLzIwMTUtMTAtMTYvYWlyLWxpcXVpZGUtYXdhcmRlZC1uZXctY29udHJhY3QtaXRlci1wcm9qZWN0LXN0cmVuZ3RoZW5pbmctaXRzLWxlYWRlcnNoaXAtZXh0cmVtZS1jcnlvZ2VuaWNz0gEA?oc=5&hl=en-US&gl=US&ceid=US:en,"Air Liquide announces the signature of a new contract with ITER-India for the design and manufacturing of 19 cryogenic lines for the ITER project. This latest contract comes after two earlier ones, signed in 2012 and in 2013, bringing to around 250 million euros the total amount signed by Air Liquide for the ITER project. This latest announcement illustrates Air Liquide’s leadership in extreme cryogenics for major scientific projects.

The objective of the international ITER project is to develop an experimental reactor in order to demonstrate the scientific and technological feasibility of fusion as a new source of energy. To obtain the very powerful electromagnetic fields required to confine and stabilize the fusion, it is necessary to use superconducting magnets that only function at extremely low temperatures.

The new cryogenic lines will transport helium at extremely low temperatures close to absolute zero in some cases (-269°C). Their fabrication requires the use of high tech processes and sophisticated design.

After having already completed the large scale cryogenic installations for the CERN1, Air Liquide, an expert in cryogenics, is a major industrial partner of the ITER project. It notably supplies the helium and nitrogen refrigerators used in ITER’s cryogenic plant, which will be the largest centralized refrigeration system ever built, as well as the 19 cryogenic lines.

François Darchis, member of the Air Liquide Executive Committee supervising Innovation, commented: “We would like to thank ITER-India for its confidence. This success demonstrates once again the unique expertise of Air Liquide in the field of very low temperatures and its capacity to provide very high tech systems to address ambitious scientific challenges. Air Liquide is thus contributing to the major global scientific projects and to the development of the energy solutions of the future.”

Prof. D. Bora, Director, Institute for Plasma Research, India, commented: “ITER’s cryogenic system is one of the most complex systems known today after the CERN, and we are happy that Air Liquide is associated with us in this drive for fusion.”



1 CERN (Conseil Européen pour la Recherche Nucléaire) is the European Organization for Nuclear Research.





A 1:50-scale model of the ITER Tokamak, complete with lights indicating the major sub-systems, takes its place outside of the Council Chamber in January 2013, instantly becoming a point of interest for all visitors to ITER Headquarters.



Credit: © ITER Organization, www.iter.org/

Life at ITER"
Exxon's Business Ambition Collided with Climate Change Under a Distant Sea - InsideClimate News,"Thu, 08 Oct 2015 07:00:00 GMT",https://news.google.com/rss/articles/CBMidmh0dHBzOi8vaW5zaWRlY2xpbWF0ZW5ld3Mub3JnL25ld3MvMDgxMDIwMTUvZXh4b25zLWJ1c2luZXNzLWFtYml0aW9uLWNvbGxpZGVkLXdpdGgtY2xpbWF0ZS1jaGFuZ2UtdW5kZXItYS1kaXN0YW50LXNlYS_SAQA?oc=5&hl=en-US&gl=US&ceid=US:en,"In 1980, as Exxon Corp. set out to develop one of the world’s largest deposits of natural gas, it found itself facing an unfamiliar risk: the project would emit immense amounts of carbon dioxide, adding to the looming threat of climate change.

The problem cropped up shortly after Exxon signed a contract with the Indonesian state oil company to exploit the Natuna gas field in the South China Sea—big enough to supply the blossoming markets of Japan, Taiwan and Korea with liquefied natural gas into the 21st century.

Assessing the environmental impacts, Exxon Research and Engineering quickly identified Natuna’s greenhouse gas problem. The reservoir was contaminated with much more carbon dioxide than normal. It would have to be disposed of somehow—and simply venting it into the air could have serious consequences, Exxon’s experts warned.

Exxon’s dawning realization that carbon dioxide and the greenhouse effect posed a danger to the world collided with the company’s fossil fuel ambitions.

“They were being farsighted,” recalled John L. Woodward, who wrote an internal report in 1981 on Natuna’s climate implications.

“They weren’t sure when CO 2 controls would be required and how it would affect the economics of the project.”

Since 1978, long before the general public grew aware of the climate crisis, Exxon had worked at the cutting edge of emerging climate science. At first, Exxon’s internal studies had described climate change as an important but somewhat distant problem. Now, sooner than expected, climate considerations were affecting strategic business decisions. Natuna was one example; another was Exxon’s proposed leap into synthetic fuels.

Releasing Natuna’s carbon pollution would make it “the world’s largest point source emitter of CO 2 and raises concern for the possible incremental impact of Natuna on the CO 2 greenhouse problem,” declared an October 1984 report from Exxon’s top climate modeler, Brian Flannery, and his boss Andrew Callegari.

Documents and other evidence uncovered by InsideClimate News also show that Exxon calculated that Natuna’s emissions would have twice the climate impact of coal. The company spent years researching possible remedies, but found them all too costly or ineffective, ICN’s eight-month investigation found.

Exxon managers saw the problem as both technically vexing and environmentally fraught. Not only was there carbon dioxide to be dealt with, it was mixed with toxic, flammable hydrogen sulfide, a contributor to acid rain.

“I think we generally agree that we are seeking a method of disposing of the off gases in a manner which will minimize the risk of environmental damage,” wrote Exxon’s manager of environmental affairs Alvin M. Natkin in an October 1983 letter to Natuna project executive Richard L. Preston. “We must also have the data which will be convincing not only to ourselves but also to the international environmental community that the method selected is environmentally sound.”

The company consulted with leading scientists, including NASA’s pioneering expert James E. Hansen, to understand the effect on atmospheric CO 2 concentrations if the gas from Natuna were released. It sent staff to facilities at Dalhousie University in Halifax, Canada to simulate the diffusion of the gas into ocean water. Over the years, Exxon scientists developed mathematical models to assess the options.

Because the project was so complex and expensive, the Natuna staff presented regular updates, including details of the CO 2 issue, to Exxon’s board of directors, whose members were drawn almost entirely from the company’s upper management.

Some Exxon directors accepted the emerging climate consensus. Others were less sure of the science, but agreed that as popular attention to global warming mounted, releasing Natuna’s greenhouse gases into the air could turn into a public relations debacle, former employees said.

Either way, directors repeatedly told project staff Natuna could not proceed unless the CO 2 was handled in a cost-effective way that did not harm the atmosphere.

“Their concerns kept getting stronger,” said a former employee with knowledge of the project, who asked for anonymity because the issue remains sensitive even years later. “Their attitude went from, ‘Maybe we have to remove the CO 2 ,’ to, as the years went by, their saying, ‘This project cannot go ahead unless we remove the CO 2 .'”

In 1984, Lee Raymond joined Exxon’s board of directors. A senior vice president, Raymond’s responsibilities included overseeing Exxon Research and Engineering, which conducted the Natuna studies. In the summer of 1985, ER&E prepared documents for Raymond about a study that examined disposing Natuna’s CO 2 into the ocean, an Exxon memo shows.

Eventually, Raymond would rise to become chairman and chief executive, and to lead a public campaign discrediting the scientific consensus on climate change and fighting measures to control greenhouse gas emissions.

In the meantime Exxon, now known as ExxonMobil, appears to have kept its years of climate-related deliberations about Natuna mostly to itself. Exxon only began to disclose climate risks to its shareholders years after it first weighed Natuna’s risks, federal filings show.

ExxonMobil declined to answer specific questions for this article. In July, when ICN questioned him for an earlier article about Natuna, spokesman Richard Keil said, “It is company policy not to comment on potential commercial operations.”

The Carbon Footprint

First discovered by the Italian oil company Agip in the early 1970s, the Natuna gas field lies about 700 miles north of Jakarta and holds about 46 trillion cubic feet of recoverable methane, or natural gas. But the undersea formation also contains 154 trillion cubic feet of other gases, mostly CO 2 .

To liquefy Natuna’s methane for shipping, it must be supercooled. At those low temperatures, the carbon dioxide would freeze into dry ice and clog equipment, so it had to be removed. The question was where to put it.

The Indonesian government and the state-run oil company had no issue with releasing the CO 2 into the air, former Exxon staff said. But awareness of carbon dioxide’s impact on global temperatures had been seeping through Exxon, from its rank-and-file engineers to its board of directors.

“Within Exxon in those days, there were probably two to three believers in global warming for every denier or those who emphasized the uncertainty,” said another former Exxon Research executive, who asked not to be identified for fear of reprisal.

Among the key people searching for a solution was Gilbert Gervasi, the Natuna project manager, who worked in Houston under executive Richard Preston for Esso Eastern, the unit that oversaw projects in East Asia. Gervasi spearheaded the effort from the early to mid-1980s to figure out how big Natuna’s carbon footprint would be and what to do about it.

In a Feb. 3, 1981 letter to Gene Northington at Research and Engineering, Gervasi challenged a “rough calculation” that Northington had made of the CO 2 emissions from producing Natuna’s gas and burning it as fuel. Northington’s math showed Natuna’s total CO 2 emissions would be “no higher than what would be emitted by burning” an equivalent amount of coal, Gervasi wrote.

After conducting what he described as “more rigorous” calculations, Gervasi concluded “that the total release of CO 2 from producing Natuna gas and burning of the LNG manufactured from the gas would be almost twice that emitted by burning an equivalent amount of coal.”

Six months later, Research and Engineering sent Gervasi a report, entitled “Possible Climate Modification Effects of Releasing Carbon Dioxide to the Atmosphere from the Natuna LNG Project.” It commissioned assessments of Natuna by seven eminent atmospheric scientists, including the climatologists Helmut Landsberg of University of Maryland and NASA’s Hansen.

The report, written by John Woodward, a high level engineer at Exxon Research, presented a mixed message. Natuna would constitute a “small fraction of worldwide CO 2 budget,” it found. But it also found that “emissions are nonetheless substantial by several comparisons.”

Disposal Options

Woodward examined the option of flaring the CO 2 after it had been stripped from the natural gas.

Although not combustible, the CO 2 had to be flared rather than simply vented because it was mixed with hydrogen sulfide, which is often burned to convert it to safer compounds. But flaring would not eliminate Natuna’s greenhouse gas emissions.

Next, Woodward looked at releasing the CO 2 into seawater around Natuna, a process known as sparging. The gas from the Natuna well would be piped to a nearby platform where the valuable methane would be separated from the waste CO 2 and the toxic hydrogen sulfide. Those unwanted gases, in turn, would then be sent from the platform to a pipe about 300 feet below on the ocean floor. The pipe would be arranged in a circle 6 miles in diameter and the gas would be bubbled out of perforations every six to 10 feet, like aerating an aquarium.

Woodward said that in 1982 he visited the oceanography department at Dalhousie University in Nova Scotia to use their equipment to collect data for sparging models. Dalhousie had a tank about 40 feet high and 10 feet wide, filled with ocean water. Researchers released CO 2 at the bottom of the tank, and Woodward measured the size and quantity of the bubbles at various depths as they rose to the surface to understand how the gas dissipated.

In the end, the hydrogen sulfide released with the CO 2 stymied the sparging idea, Woodward said. Exxon worried that a toxic plume might kill fish and result in bad press.

Back to Square One

The Natuna project staff and Research and Engineering specialists probed for answers through the 1980s, sometimes revisiting the approaches that Woodward had examined.

In October 1983, Gervasi sent a letter and background paper on Natuna to about a dozen staff and executives from different branches of the corporation to develop “a study program which over the next 1-2 years will put Exxon in a position to reach a final decision on the environmental aspects of the project.”

The background paper laid out options to dispose of the CO 2 , none of them optimal. Releasing the waste gases into the air remained the simplest, cheapest method. “However, this raises environmental questions concerning the ‘greenhouse’ effect of the CO 2 ,” the paper said.

Gervasi’s paper said the only effective way to dispose of carbon dioxide and hydrogen sulfide without harming the atmosphere or ocean would involve injecting the gases underground into the Natuna formation itself or a nearby reservoir. But that option appeared prohibitively expensive.

Thwarted by cost or environmental impact, Exxon returned to mathematical models over the next two years to home in on a suitable approach.

By February 1984, Exxon Research began modelling once more the feasibility of sparging.

The scientists found that the ocean would release the CO 2 into the atmosphere, probably in 10 years or sooner. Further, increased CO 2 would raise the acidity of the ocean water, damaging the local environment. “Our conclusion is that atmospheric discharge is preferable to seawater sparging,” Flannery and others concluded.

Study after study returned Exxon back to square one with Natuna: it held the rights to an enormously promising field but was unable to develop it because it was unwilling to pump so much CO 2 into the air.

The scientists’ conclusions were reflected in papers prepared for a 1985 meeting with Lee Raymond on Exxon Research’s activities.

Their synopsis said: “We modeled the sub-sea disposal of CO 2 in the shallow basin near the Natuna site and found that retention in the sea is only about a decade, as opposed to 1000 years if the CO 2 is disposed in the deep ocean. We recommend that the sub-sea sparging of CO 2 not be implemented since it offers little advantage over direct atmospheric release.”

By the late 1980s, Exxon started to explore pumping the CO 2 back into the Natuna formation, the safest option but probably the priciest.

The company found a cost-effective method to dispose of half of Natuna’s CO 2 underground, but calculated that the rest of the CO 2 would still be the equivalent of half of Canada’s annual greenhouse gas emissions, said Roger Witherspoon, a former Program Officer in Corporate Contributions in the Public Affairs department.

Company officials asked Witherspoon to find a way to plant 100,000 trees annually to offset Natuna’s remaining CO 2 emissions. The total acreage would eventually equal the size of Connecticut, Witherspoon said.

As Witherspoon researched the options starting around 1993, Exxon had embarked on a public campaign casting doubt on climate science as a basis for strong policy actions. Internally, the attitude was different.

“It was that greenhouse gas buildup could pose a threat to our business,” said Witherspoon, a longtime journalist who worked at Exxon’s Texas headquarters from 1990 to 1995. “You didn’t want climate change caused by oil and gas. So the responsible thing to do was offset any greenhouse gases you were putting into the atmosphere.”

Witherspoon said Exxon started his tree planting plan, but he does not know how long it lasted.

Exxon continued to investigate possibilities for responsibly disposing of Natuna’s CO 2 . The project remains dormant, but Exxon never gave up. After an on-and-off relationship with Indonesia, the company still holds the license, which is up for renewal next summer.

Coming soon, Part VI: Exxon embarks on a public campaign of climate denial that would last for decades.

Check out Part I, Part II, Part III, Part V and Part VI of the series."
Commercializing Boron Nitride NanoTubes (BNNTs) for the Advanced Engineering Materials Industry - AZoNano,"Tue, 20 Oct 2015 07:00:00 GMT",https://news.google.com/rss/articles/CBMiM2h0dHBzOi8vd3d3LmF6b25hbm8uY29tL2FydGljbGUuYXNweD9BcnRpY2xlSUQ9NDE0NNIBAA?oc=5&hl=en-US&gl=US&ceid=US:en,"Jérôme Pollak, Business Development Director at Tekna Plasma Systems, spoke to AZoNano about commercializing boron nitride nanotubes for advanced materials applications.

Could you provide our readers with a brief overview of the history of Tekna Plasma Systems and explain how the company has grown since it was founded in 1990?

For 25 years, Tekna has been developing and commercializing both equipment and processes based on its induction plasma proprietary technology. Our induction plasma technology is especially well adapted to the production of advanced materials and the powders necessary for new innovative emerging products and manufacturing technologies.

Tekna supplies full-scale productions of a variety of Nano powders and micron-sized spherical powders meeting all the requirements of the most demanding industries. Boron Nitride Nanotubes (BNNT) represent the brand new family of materials at Tekna.

Tekna | World Leader In Induction Plasma Technology Play

Introduction to TEKNA’s products and services

Could you summarize to our readers the details from the press release you published earlier this year (May 2015) which announced collaboration with the National Research Council of Canada (NRC)?

The National Research Council of Canada (NRC) developed, on a Tekna plasma system, a process to produce Boron Nitride Nanotubes (BNNTs). BNNTs are a material with the potential to create a big turning point in the market. Since last spring, Tekna has been in an exclusive 20-year agreement with the NRC to allow the firm to manufacture Boron Nitride Nanotubes at full-scale production.

BNNTs are an extraordinary material with unique properties that will revolutionise engineered materials across a wide range of applications including in the defence and security, aerospace, biomedical and automotive sectors. BNNTs have a structure very similar to the better known carbon nanotubes. They share the extraordinary mechanical properties of Carbon Nanotubes but have many different advantages.

How does the structure and properties of BNNTs differ from Carbon Nanotubes (CNTs)?

The structure of Boron Nitride Nanotubes is a close analog of the Carbon Nanotubes (CNT). Both CNTs and BNNTs are considered as the strongest light-weight nanomaterials and are very good thermal conductors.

Although, compared to CNTs, BNNTs have a greater thermal stability, a better resistance to oxidation and a wider band gap (~5.5 eV). This makes them the best candidate for many fields in which CNTs are currently used for lack of a better alternative. I expect BNNTs to be used in transparent bulk composites, high-temperature materials (including metal matrix composites) and radiation shielding.

Comparison between the main properties of BNNTs and CNTs (Source: NRC)

What are the main application areas in which BNNTs can be used?

The applications involving BNNTs are still in their very beginning, essentially because of the limited availability of this material until 2015. With the arrival on the market of large supplies of BNNT from Tekna, the scientific community will be able to undertake more in-depth studies of the unique properties of BNNTs which will accelerate the development of new applications.

Many applications can already be envisioned for Tekna’s BNNT powder as it is a multifunctional and high quality material. I can tell you that, currently, the combination of high stiffness and high transparency is being exploited in the development of BNNT-reinforced glass composites.

Also, the high stiffness of BNNT, along with its excellent chemical stability, will make this material an ideal reinforcement in polymers, ceramics and metals.

Besides, many applications where heat dissipation is critical are desperately in need of materials with a very good thermal conductivity. Tekna’s BNNTs are the best allies to improve not only the thermal conductivity but also maintaining a clear colour, if needed, thanks to their high transparency.

Other intrinsic properties of BNNTs are likely to promote interest for the integration of BNNTs into new applications. BNNTs have a good radiation shielding ability, a very high electrical resistance and an excellent piezoelectricity.

TEM image of Tekna's BNNT-R product

Please click here if you would like more information on the instrument used in this article or a quote

How does Tekna’s BNNT synthesis process differ from methods used by other companies?

BNNTs were first synthesized in 1995. Since then, several other processes have been explored such as the arc-jet plasma method, ball milling-annealing, laser ablation pyrolysis and chemical vapour deposition.

Unfortunately, these processes share a major limitation: their low yield. Such methods result in a low BNNT production which is typically less than 1 gram per hour. This fault is sometimes coupled with the inability to make small diameters (< 10 nm).

As a result, the availability of large quantities of high quality BNNTs for applications development using these processes is still a significant challenge.

Fortunately, Tekna’s inductively coupled plasma (ICP) technology has successfully overcome this challenge. The combination of Tekna’s ICP expertise and its partnership with the NRC opened the door to a brand new range of systems capable of producing highly pure BNNTs in significant quantities. Tekna’s system productivity reaches up to 2 orders of magnitude higher than any of the current methods.

What are the advantages of using Tekna’s unique approach in terms of quantity and price for the commercial market?

The productivity and cost efficiency of Tekna’s ICP technology allow for the first time, the supply of kilograms of Boron Nitride Nanotubes, produced at a much lower production cost.

Could you outline the composition of the BNNTs Tekna synthesizes?

The main interesting characteristics include the tube diameter, about 5 nm, and purity (> 50 %). Most nanotubes contain 3 to 5 walls and are assembled in bundles of a few nanotubes.

TEM image of Tekna's BNNT-R product

How do you see the BNNT industry progressing over the next five years?

As large quantities are now available, we saw the launch of several R&D programs based on Tekna’s BNNT, and as much higher quantities will be reached in the next 5 years, we can only imagine what the impact could be in the sciences and industry fields.

Where can our readers find out more information about Tekna and your BNNTs?

You can find information about Tekna and BNNT on Tekna’s website and on our BNNT-dedicated page.

About Jérôme Pollak

Jérôme Pollak was born in Grenoble, France in 1979. He received the B.Sc. degree in physics from the Université Joseph Fourier, Grenoble. He moved to Québec (Canada) in 2002 to work for the company Air Liquide in the design of plasma sources for the detoxification of greenhouse gases.

He continued his studies in Montreal, where he received an M.Sc. and then a Ph.D. degree in plasma physics from the Université de Montréal in 2008. His M.Sc. thesis was on the design and modelling of field applicators to sustain plasma with RF and microwave fields. While his Ph.D. thesis concerned the plasma sterilization of thermosensitive medical devices such as catheters. He was further involved in the characterization and modelling of cold plasma effects on microorganisms and polymers.

After his Ph.D., he worked for 3 years for Morgan Schaffer in Montreal on the development of gas chromatographic systems using plasma detectors.

Since 2010, he has worked at Tekna Plasma Systems in Sherbrooke (QC, Canada) as an R&D coordinator, then as product and service manager and now as business development director for America. He has been in charge of various R&D projects and business development activities implying micro-sized powder treatment and nanoparticle synthesis by high temperature plasma."
