Titre,Date de publication,URL,Contenu
Air Liquide inaugurates the world's largest low-carbon hydrogen membrane-based production unit in Canada - Air Liquide,"Tue, 26 Jan 2021 08:00:00 GMT",https://news.google.com/rss/articles/CBMioAFodHRwczovL3d3dy5haXJsaXF1aWRlLmNvbS9ncm91cC9wcmVzcy1yZWxlYXNlcy1uZXdzLzIwMjEtMDEtMjYvYWlyLWxpcXVpZGUtaW5hdWd1cmF0ZXMtd29ybGRzLWxhcmdlc3QtbG93LWNhcmJvbi1oeWRyb2dlbi1tZW1icmFuZS1iYXNlZC1wcm9kdWN0aW9uLXVuaXQtY2FuYWRh0gEA?oc=5&hl=en-US&gl=US&ceid=US:en,"Air Liquide has completed the construction of the world's largest PEM (Proton Exchange Membrane) electrolyzer. Supplied with renewable energy, this unit is now producing up to 8.2 tonnes per day of low-carbon hydrogen in Bécancour, Québec. With this large-scale investment, the Group confirms its long-term commitment to the hydrogen energy markets and its ambition to be a major player in the supply of low-carbon hydrogen.

The new 20 MW PEM electrolyser, equipped with Cummins[1] technology, is the largest operating unit of its kind in the world and will help meet the growing demand for low-carbon hydrogen in North America. Bécancour's proximity to the main industrial markets in Canada and the United States will help ensure their supply of low-carbon hydrogen for industrial use and mobility. The commissioning of this electrolysis unit increases by 50% the capacity of Air Liquide's Bécancour hydrogen production complex.

Compared to the traditional hydrogen production process, this new production unit will avoid the emission of around 27,000 tonnes of CO2 per year, which is equivalent to the emissions of 10,000 cars per year. The choice of Bécancour is based on two attributes of the site: the access to abundant renewable power from Hydro-Québec and the proximity to the hydrogen mobility market in the northeast of the continent.

Susan Ellerbusch, CEO, Air Liquide North America and Group Executive Committee Member:

“The fight against climate change is at the heart of the Air Liquide Group's strategy. The inauguration of the Bécancour site in Canada marks an important step in the implementation of this strategy. With this world’s first, Air Liquide confirms its commitment to the production of low-carbon hydrogen on an industrial scale and its ability to effectively deploy the related technological solutions. Hydrogen will play a key role in the energy transition and the emergence of a low-carbon society.”"
Air Liquide inaugurates the world's largest low-carbon hydrogen membrane-based production unit in Canada - PR Newswire,"Tue, 26 Jan 2021 08:00:00 GMT",https://news.google.com/rss/articles/CBMinwFodHRwczovL3d3dy5wcm5ld3N3aXJlLmNvbS9uZXdzLXJlbGVhc2VzL2Fpci1saXF1aWRlLWluYXVndXJhdGVzLXRoZS13b3JsZHMtbGFyZ2VzdC1sb3ctY2FyYm9uLWh5ZHJvZ2VuLW1lbWJyYW5lLWJhc2VkLXByb2R1Y3Rpb24tdW5pdC1pbi1jYW5hZGEtMzAxMjE0Njk3Lmh0bWzSAQA?oc=5&hl=en-US&gl=US&ceid=US:en,"PARIS, Jan. 26, 2021 /PRNewswire/ - Air Liquide has completed the construction of the world's largest PEM (Proton Exchange Membrane) electrolyzer. Supplied with renewable energy, this unit is now producing up to 8.2 tonnes per day of low-carbon hydrogen in Bécancour, Québec. With this large-scale investment, the Group confirms its long-term commitment to the hydrogen energy markets and its ambition to be a major player in the supply of low-carbon hydrogen.

Air Liquide inaugurates the world's largest low-carbon hydrogen membrane-based production unit in Canada (CNW Group/Air Liquide)

The new 20 MW PEM electrolyser, equipped with Cummins1 technology, is the largest operating unit of its kind in the world and will help meet the growing demand for low-carbon hydrogen in North America. Bécancour's proximity to the main industrial markets in Canada and the United States will help ensure their supply of low-carbon hydrogen for industrial use and mobility. The commissioning of this electrolysis unit increases by 50% the capacity of Air Liquide's Bécancour hydrogen production complex.

Compared to the traditional hydrogen production process, this new production unit will avoid the emission of around 27,000 tonnes of CO 2 per year, which is equivalent to the emissions of 10,000 cars per year. The choice of Bécancour is based on two attributes of the site: the access to abundant renewable power from Hydro-Québec and the proximity to the hydrogen mobility market in the northeast of the continent.

Susan Ellerbusch, CEO, Air Liquide North America and Group Executive Committee Member: ""The fight against climate change is at the heart of the Air Liquide Group's strategy. The inauguration of the Bécancour site in Canada marks an important step in the implementation of this strategy. With this world's first, Air Liquide confirms its commitment to the production of low-carbon hydrogen on an industrial scale and its ability to effectively deploy the related technological solutions. Hydrogen will play a key role in the energy transition and the emergence of a low-carbon society.""

Air Liquide's commitment to hydrogen energy

In the past 50 years, Air Liquide has developed unique expertise enabling it to master the entire hydrogen supply chain, from production and storage to distribution and the development of applications for end users, thus contributing to the widespread use of hydrogen as a clean energy source, for mobility in particular. Air Liquide has designed and installed more than 120 stations around the world to date. Hydrogen is an alternative to meet the challenge of clean transportation and thus contributes to the improvement of air quality. Used in a fuel cell, hydrogen combines with oxygen in the air to produce electricity, emitting only water. It does not generate any pollution at the point of use: zero greenhouse gases, zero particles and zero noise. Hydrogen provides a concrete response to the challenges posed by sustainable mobility and local pollution in urban areas.

About Air Liquide in Canada

Air Liquide started its activity in Canada in 1911 and now has a team of more than 2,500 employees working to serve more than 200,000 customers and patients across Canada. In all of the country's key industrial regions from coast to coast, Air Liquide offers innovative solutions — gas, equipment and services — in a wide variety of sectors: aeronautics, automotive, agri-food industries, chemical, metallurgy, metal fabrication, mining, oil and gas and healthcare.

___________________ 1 After the acquisition of Hydrogenics by CUMMINS, Air Liquide (through its wholly owned subsidiary: The Hydrogen Company) has increased its ownership stake to 19%

A world leader in gases, technologies and services for Industry and Health, Air Liquide is present in 80 countries with approximately 67,000 employees and serves more than 3.7 million customers and patients. Oxygen, nitrogen and hydrogen are essential small molecules for life, matter and energy. They embody Air Liquide's scientific territory and have been at the core of the company's activities since its creation in 1902.

Air Liquide's ambition is to be a leader in its industry, deliver long term performance and contribute to sustainability. The company's customer-centric transformation strategy aims at profitable, regular and responsible growth over the long term. It relies on operational excellence, selective investments, open innovation and a network organization implemented by the Group worldwide. Through the commitment and inventiveness of its people, Air Liquide leverages energy and environment transition, changes in healthcare and digitization, and delivers greater value to all its stakeholders.

Air Liquide's revenue amounted to 22 billion euros in 2019 and its solutions that protect life and the environment represented more than 40% of sales. Air Liquide is listed on the Euronext Paris stock exchange (compartment A) and belongs to the CAC 40, EURO STOXX 50 and FTSE4Good indexes.

SOURCE Air Liquide"
"Air Liquide, TotalEnergies, VINCI and a group of international companies launch the world's largest clean hydrogen ... - Vinci","Sun, 10 Jan 2021 08:00:00 GMT",https://news.google.com/rss/articles/CBMiSWh0dHBzOi8vd3d3LnZpbmNpLmNvbS92aW5jaS5uc2YvZW4vcHJlc3MtcmVsZWFzZXMvcGFnZXMvMjAyMTEwMDEtMDgwMC5odG3SAQA?oc=5&hl=en-US&gl=US&ceid=US:en,"Air Liquide, TotalEnergies and VINCI, are combining forces with other large international companies to sponsor the creation of the world’s largest fund exclusively dedicated to clean hydrogen infrastructure solutions. The fund aims to reach 1.5 billion euros and has already secured initial commitments of 800 million euros. Its objective is to accelerate the growth of the clean hydrogen ecosystem by investing in large strategic projects and leveraging the alliance of industrial and financial players.

The clean hydrogen infrastructure fund will invest in the entire value chain of renewable and low carbon hydrogen, in the most promising regions in the Americas, Asia and Europe. It will invest as a partner, alongside other key project developers and/or industry players, in large upstream and downstream clean hydrogen projects. Total commitments to the fund have already reached 800 million euros out of a target of around 1.5 billion euros at signature.

Air Liquide, TotalEnergies and VINCI Concessions have been at the forefront of setting up and aggregating commitments to this clean hydrogen infrastructure fund. As anchor partners, fully committed to low carbon and renewable hydrogen development, each has pledged to invest 100 million euros. The fund will be managed by Hy241, a brand new 50/50 joint venture between Ardian, a world-leading private investment house and FiveT Hydrogen, a clean hydrogen enabling investment platform. The choice of this fund manager allows to merge with their similar initiative and to add Plug Power as an anchor partner, as well as Chart Industries and Baker Hughes joining together.

LOTTE Chemical has also confirmed its intention to participate as anchor investor, and is the first Asian company to join. The fund expects to attract further investments from large financial players, with AXA as anchor investor. Large international industrial players from North America and Europe, which are strongly committed to carbon neutrality, also intend to join the initiative as non-anchor partners, such as Groupe ADP, Ballard, EDF, and Schaeffler.

With solid industrial expertise and significant investment potential, the clean hydrogen infrastructure fund will have a unique capacity to unlock large scale projects under development and accelerate the scaling up of hydrogen markets. With the announced support of public policies and some use of debt financing, the fund should be able to contribute to the development of hydrogen projects with a total value of about 15 billion euros.

A global player in concessions, construction and energy, present in some 100 countries, VINCI is actively committed to Net Zero Emission by implementing an ambitious environmental policy. Its mission is to design, finance, build and operate infrastructure and facilities that contribute to improving daily life and mobility for everyone. Xavier Huillard, Chairman and CEO of VINCI declared: “VINCI is taking concrete action to support the development of clean energy by mobilising all its divisions in concessions, construction and energy, with the aim of actively combating climate change and decarbonising mobility in particular. By launching this investment fund today, hand in hand with other major industrial leaders, we keep moving forward to make green hydrogen a strong lever in achieving our objectives”.

As a pioneer in hydrogen for over 50 years, Air Liquide is convinced that hydrogen is a cornerstone of the energy transition. The Group is providing its unique expertise along the entire value chain, using hydrogen as a clean energy carrier for industrial processes and clean mobility. Benoît Potier, Chairman and CEO of Air Liquide, declared: “Hydrogen has become a central element of the energy transition. The time to act is now, not only as companies on a stand-alone basis, but by joining forces with states, other industrial groups and the financial community. With the creation of this fund, we are demonstrating our leadership to participate in a collective dynamic to build momentum. As Air Liquide, we have already committed to invest approximately 8 billion euros in the low-carbon hydrogen supply chain by 2035. Our objective is to contribute to the development of the entire value chain from low-carbon hydrogen production to end-uses, investing in the necessary infrastructure with storage and distribution projects. Accelerating on Hydrogen development is key to mitigate climate change.”

As a broad energy Company, TotalEnergies’ ambition is to get to net-zero emissions by 2050 together with society for its global business across its production and energy products used by its customers. Patrick Pouyanné, Chairman and CEO of TotalEnergies, commented: “We believe that clean, renewable hydrogen will play a key role in the energy transition, and TotalEnergies wants to be a pioneer in its mass production. We are currently working on several projects, notably to decarbonize the grey hydrogen used in our European refineries by 2030. We are convinced that a collective effort is needed to kick-start the hydrogen sector and take it to scale. We are thus proud to launch and invest in the Clean hydrogen infrastructure fund, which will also give us privileged insights in the sector.”

The hydrogen economy is expected to be key in the fight against climate change. Many countries have initiated hydrogen-related regulations and support schemes to enable clean hydrogen to help decarbonize their economies. Hydrogen offers a solution to decarbonize industrial processes and the mobility sector.

Subject to Hy24’s French Market Authority (AMF) accreditation as an Alternative Investment Fund Manager (AIFM), the platform will be operational in late 2021 and first closing is expected before the end of the year.

1 www.hy24partners.com

Contact VINCI

Service de presse

+33 (0)1 47 16 31 82

media.relations@vinci.com



Contact Air Liquide

Corporate Communications

media@airliquide.com



Investor Relations

IRTeam@airliquide.com



Contact TotalEnergies

Media Relations

+33 1 47 44 46 99 presse@totalenergies.com



Investor Relations

+44 (0)207 719 7962 ir@totalenergies.com

About VINCI

VINCI is a global player in concessions, construction and energy businesses, employing more than 217,000 people in some 100 countries. We design, finance, build and operate infrastructure and facilities that help improve daily life and mobility for all. Because we believe in all-round performance, we are committed to operating in an environmentally, socially responsible and ethical manner. And because our projects are in the public interest, we consider that reaching out to all our stakeholders and engaging in dialogue with them is essential in the conduct of our business activities. Based on that approach, VINCI’s ambition is to create long-term value for its customers, shareholders, employees, partners and society in general. www.vinci.com

About Air Liquide

A world leader in gases, technologies and services for Industry and Health, Air Liquide is present in 78 countries with approximately 64,500 employees and serves more than 3.8 million customers and patients. Oxygen, nitrogen and hydrogen are essential small molecules for life, matter and energy. They embody Air Liquide’s scientific territory and have been at the core of the company’s activities since its creation in 1902.

Air Liquide’s ambition is to be a leader in its industry, deliver long term performance and contribute to sustainability - with a strong commitment to climate change and energy transition at the heart of its strategy. The company’s customer-centric transformation strategy aims at profitable, regular and responsible growth over the long term. It relies on operational excellence, selective investments, open innovation and a network organization implemented by the Group worldwide. Through the commitment and inventiveness of its people, Air Liquide leverages energy and environment transition, changes in healthcare and digitization, and delivers greater value to all its stakeholders.

Air Liquide’s revenue amounted to more than 20 billion euros in 2020. Air Liquide is listed on the Euronext Paris stock exchange (compartment A) and belongs to the CAC 40, EURO STOXX 50 and FTSE4Good indexes

For more information please visit: www.airliquide.com

About TotalEnergies

TotalEnergies is a broad energy company that produces and markets energies on a global scale: oil and biofuels, natural gas and green gases, renewables and electricity. Our 105,000 employees are committed to energy that is ever more affordable, clean, reliable and accessible to as many people as possible. Active in more than 130 countries, TotalEnergies puts sustainable development in all its dimensions at the heart of its projects and operations to contribute to the well-being of people."
EMN or AIQUY: Which Is the Better Value Stock Right Now? - Yahoo Finance,"Fri, 29 Jan 2021 08:00:00 GMT",https://news.google.com/rss/articles/CBMiSmh0dHBzOi8vZmluYW5jZS55YWhvby5jb20vbmV3cy9lbW4tYWlxdXktYmV0dGVyLXZhbHVlLXN0b2NrLTE2NDAwNDEwNy5odG1s0gEA?oc=5&hl=en-US&gl=US&ceid=US:en,"Investors interested in Chemical - Diversified stocks are likely familiar with Eastman Chemical (EMN) and Air Liquide (AIQUY). But which of these two stocks presents investors with the better value opportunity right now? Let's take a closer look.

We have found that the best way to discover great value opportunities is to pair a strong Zacks Rank with a great grade in the Value category of our Style Scores system. The proven Zacks Rank emphasizes companies with positive estimate revision trends, and our Style Scores highlight stocks with specific traits.

Eastman Chemical and Air Liquide are both sporting a Zacks Rank of # 2 (Buy) right now. The Zacks Rank favors stocks that have recently seen positive revisions to their earnings estimates, so investors should rest assured that both of these companies have improving earnings outlooks. But this is just one factor that value investors are interested in.

Value investors also tend to look at a number of traditional, tried-and-true figures to help them find stocks that they believe are undervalued at their current share price levels.

The Style Score Value grade factors in a variety of key fundamental metrics, including the popular P/E ratio, P/S ratio, earnings yield, cash flow per share, and a number of other key stats that are commonly used by value investors.

EMN currently has a forward P/E ratio of 13.69, while AIQUY has a forward P/E of 26.51. We also note that EMN has a PEG ratio of 3.70. This metric is used similarly to the famous P/E ratio, but the PEG ratio also takes into account the stock's expected earnings growth rate. AIQUY currently has a PEG ratio of 5.27.

Another notable valuation metric for EMN is its P/B ratio of 2.21. The P/B is a method of comparing a stock's market value to its book value, which is defined as total assets minus total liabilities. By comparison, AIQUY has a P/B of 3.74.

Based on these metrics and many more, EMN holds a Value grade of B, while AIQUY has a Value grade of D.

Both EMN and AIQUY are impressive stocks with solid earnings outlooks, but based on these valuation figures, we feel that EMN is the superior value option right now.



Want the latest recommendations from Zacks Investment Research? Today, you can download 7 Best Stocks for the Next 30 Days. Click to get this free report



Eastman Chemical Company (EMN) : Free Stock Analysis Report



Air Liquide (AIQUY) : Free Stock Analysis Report



To read this article on Zacks.com click here."
HysetCo moves to run 600 hydrogen cabs in Paris - www.electrive.com,"Wed, 27 Jan 2021 08:00:00 GMT",https://news.google.com/rss/articles/CBMiVWh0dHBzOi8vd3d3LmVsZWN0cml2ZS5jb20vMjAyMS8wMS8yNi9oeXNldGNvLW1vdmVzLXRvLXJ1bi02MDAtaHlkcm9nZW4tY2Ficy1pbi1wYXJpcy_SAQA?oc=5&hl=en-US&gl=US&ceid=US:en,"Paris will eventually see 600 fuel cell taxis. The long-running project HysetCo just acquired the cab operator Slota and plans to replace its 600-vehicle diesel fleet with the Toyota Mirai gradually. They also want to install two new hydrogen filling stations this year.

The company has been on the scene. We first reported their efforts in early 2019 when Air Liquide, Idex, Société du Taxi Électrique Parisien (STEP) and Toyota launched the joint venture. Back then, they considered HysetCo a “major landmark” for hydrogen transport and also wanted to further an existing fleet of fuel cell taxis called Hype. The initial aim was for 600 FCEVs to serve Parisians by the end of 2020. This would make also make it “the largest fleet of taxis in the world using energy as a hydrogen as an energy source,” according to the CEO of Toyota France, Frank Marotte.

Fast-forward to today, and there is a slight delay, which they apparently want to address with the new acquisition. On Twitter, AirLiquide claims “target reached” – almost. Fittingly, the Slota fleet includes 600 cabs which HysetCo will replace with Toyota Mirai successively. The exact timeframe is undisclosed but looking at the initial goal, asap seems in order.

STEP president Mathieu Gardies did mention that before he pointed out the “unusual circumstances of 2020”. He then moved on to stress “the quality of our new financial partners and by the renewed support of Air Liquide.”

The acquisition has indeed been made possible by more than €80 million in new funds as new investors joined the JV. Air Liquide has also increased its commitment so that HysetCo and Hype have now raised over €100 million in investment.

Further funding for the infrastructure comes through the federal ADEME agency and the Île-de-France Region and the FCH-JU (Fuel Cells and Hydrogen Joint Undertaking). The first new filling station this year will be at Porte de Saint-Cloud, on a Paris City site. The company does not say how many stations are currently live. At the beginning of 2019, there were four, in Paris-Orly, Les-Loges-en-Josas, Pont de l’Alma and Roissy near Charles-de-Gaulle Airport. Overall, HysetCo plans to operate around 20 H2 stations in Paris by 2024.

The current fleet of Hype fuel cell vehicles includes 100 FCEVs. The initiative had first been set up in 2015 on the occasion of the UN COP21 in Paris.

airliquide.com"
