Titre,Date de publication,URL,Contenu
Honda Just Unveiled Its New Hydrogen-Powered Car - ScienceAlert,"Wed, 28 Oct 2015 07:00:00 GMT",https://news.google.com/rss/articles/CBMiTWh0dHBzOi8vd3d3LnNjaWVuY2VhbGVydC5jb20vaG9uZGEtanVzdC11bnZlaWxlZC1pdHMtbmV3LWh5ZHJvZ2VuLXBvd2VyZWQtY2Fy0gEA?oc=5&hl=en-US&gl=US&ceid=US:en,"Just when everyone's getting all excited about electric cars usurping their fossil fuel-guzzling counterparts, Honda has announced that its hydrogen-powered cars will go on sale in Japan as early as March 2016, with launches in Europe and the US to follow.

The five-seated sedan, called the FCV Clarity, can travel 700 km (434 miles) on a single charge. It's been priced at 7.66 million yen, or US$62,807, which puts it just in the affordability range for the average consumer, the Japanese automaker saying it expects to sell far more than the 72 units it sold of its previous-generation model, the FCX Clarity. ""We want this car to be the trigger for the 'hydrogen society',"" Honda operating officer, Toshihiro Mibe, told Reuters at the Tokyo Motor Show in Japan this week.

A Honda hydrogen-powered car is nothing new. Back in 2008, the FCX Clarity was leased to a handful of private buyers in California as part of a subsidised trial deal, but things didn't go so well that time around.

For one thing, the car cost 10 times more than it does now, and on top of that, it was 30 percent less powerful. The hydrogen fuel cell stack was also incredibly bulky, and the last thing you want to do is spend more than half a million dollars on a car you can barely fit into. ""Until this point, fuel cells have been so large that they needed to be packaged elsewhere in the vehicle, like in Toyota's Mirai, which has its fuel cell stack in the centre of the vehicle, cutting into interior space,"" Nick Jaynes writes for Mashable.

The FCV Clarity, on the other hand, features a fuel cell stack that's 33 percent smaller, now taking up the same amount of room under the hood as a typical V-6 engine.

Hydrogen-powered cars work by having the fuel cell stack convert hydrogen into electricity, which powers an electric motor via a lithium-ion battery pack. ""Essentially, think of it as an electric vehicle that can be refilled in 3 minutes and emits only water vapour out of its tailpipes,"" says Jaynes.

And therein lies the biggest hurdle in convincing drivers to join the ""hydrogen society"" - you're gonna need at least one hydrogen station in your local area to make buying one of these environmentally friendly vehicles in any way practical. Joann Muller reports at Forbes that companies like First Element and Air Liquide are installing some in Northeastern US and California, supported by government grants and loans from Toyota and Honda, but the rollout has so far been slow.

Not that Honda isn't aware of the challenges its drivers could face in finding places to charge - it's now developing a personal-use Smart Hydrogen Station, which is designed to be installed at home so you don't have to go looking for a re-up. ""There's no word on when that might be available, but if it's affordable, it could be a huge breakthrough in speeding the adoption of fuel cell vehicles,"" says Muller.

It's exciting to see a car company go all-in on a vehicle that completely eliminates the need for toxic emissions. In a world where outdoor air pollution is killing more than 3 million people every year, with automobile exhaust being a significant part of the problem, alternatives like this are crucial. But only time will tell if there's truly a market for hydrogen cars out there.

""Compared to 10 years ago, I think fuel cell vehicles have developed significantly in terms of the technology,"" Honda president Takahiro Hachigo told Muller. ""Ten years ago, we said fuel cells could not be driven in cold weather, for example, and that the hardware was too heavy. Today, fuel cells are equal to gasoline engine cars."""
Avery Dennison launches bio-based PE film for label applications - Business Standard,"Wed, 14 Oct 2015 07:00:00 GMT",https://news.google.com/rss/articles/CBMilAFodHRwczovL3d3dy5idXNpbmVzcy1zdGFuZGFyZC5jb20vY29udGVudC9iMmItcGxhc3RpY3MtcG9seW1lcnMvYXZlcnktZGVubmlzb24tbGF1bmNoZXMtYmlvLWJhc2VkLXBlLWZpbG0tZm9yLWxhYmVsLWFwcGxpY2F0aW9ucy0xMTUxMDE0MDA2NDdfMS5odG1s0gGYAWh0dHBzOi8vd3d3LmJ1c2luZXNzLXN0YW5kYXJkLmNvbS9hbXAvY29udGVudC9iMmItcGxhc3RpY3MtcG9seW1lcnMvYXZlcnktZGVubmlzb24tbGF1bmNoZXMtYmlvLWJhc2VkLXBlLWZpbG0tZm9yLWxhYmVsLWFwcGxpY2F0aW9ucy0xMTUxMDE0MDA2NDdfMS5odG1s?oc=5&hl=en-US&gl=US&ceid=US:en,"In response to growing interest in using bio-based packaging materials, Avery Dennison has launched two bio-based polyethylene (PE) label films, which are the first self-adhesive PE filmic labels with a face stock that includes more than 80 percent renewable content. These labels offer brand owners the opportunity to meet their target on renewable resources in packaging, while continuing to benefit from the functionality and performance of a regular polyethylene label.Avery Dennison has worked with global resin producer Braskem and Belgium converter Desmedt Labels to prototype and test the bio-based PE label at the Belgium facilities of Ecover, manufacturer of ecologically sound cleaning products.Xander van der Vlies, sustainability director at Avery Dennison Materials Group Europe, said, “Economic growth, natural resource scarcity and an increasing demand for goods and services will all contribute to an uncertain supply of finite non-renewable resources in the years to come. With our expanding product range of sustainable label materials – which now includes these bio-based PE label films – we can support converters who want to fulfil brand owners’ needs for packaging from renewable resources, while also helping them to provide a differentiating product and drive sales in a fast-growing segment.”The bio-based PE self-adhesive laminates are available in a white and a clear version. The resin used for the new bio-based PE films is made from Bonsucro certified sugar cane, which follows rigorous social and environmental monitoring prior to certification. Both new products offer performance and recyclability comparable to standard PE85 resin.With the proper precautions and preparation, these films act as drop-in replacements, meaning converters can substitute conventional PE for a bio-based PE label film without investing in new machinery.By using biomass to create a PE label film which contains more than 80 percent bio based resin, brand owners can reduce their dependency on fossil based packaging materials."
Solvay acquires Epic Polymers' long-fibre thermoplastics biz - Business Standard,"Wed, 14 Oct 2015 07:00:00 GMT",https://news.google.com/rss/articles/CBMijwFodHRwczovL3d3dy5idXNpbmVzcy1zdGFuZGFyZC5jb20vY29udGVudC9iMmItcGxhc3RpY3MtcG9seW1lcnMvc29sdmF5LWFjcXVpcmVzLWVwaWMtcG9seW1lcnMtbG9uZy1maWJyZS10aGVybW9wbGFzdGljcy1iaXotMTE1MTAxNDAwNjkwXzEuaHRtbNIBkwFodHRwczovL3d3dy5idXNpbmVzcy1zdGFuZGFyZC5jb20vYW1wL2NvbnRlbnQvYjJiLXBsYXN0aWNzLXBvbHltZXJzL3NvbHZheS1hY3F1aXJlcy1lcGljLXBvbHltZXJzLWxvbmctZmlicmUtdGhlcm1vcGxhc3RpY3MtYml6LTExNTEwMTQwMDY5MF8xLmh0bWw?oc=5&hl=en-US&gl=US&ceid=US:en,"Solvay has acquired Epic Polymers’ long-fibre thermoplastics (LFT) technology to complement its offering of high performance light-weighting materials and gain access to metal replacement of larger automotive semi-structural parts.Based in Kaiserslautern (Germany), Epic Polymers GmbH has developed an innovative technology to reinforce high performance thermoplastic polymers with long glass fibres. Demand-led growth for these sophisticated tailored materials offering superior mechanical and thermal properties, coupled with high impact resistance, strength and stiffness at elevated temperatures, is driven by the need to reduce fuel consumption and lower CO2 emissions.“Having this technology is an important step in the expansion of Solvay Specialty Polymers’ broad offering of materials that are simultaneously light and ultra-performing. We will be able to provide larger semi-structural parts for the automotive sector, our key market, and develop expertise to apply LFT technology to core polymers including KetaSpire PEEK and AvaSpire PAEK, providing further possibilities for metal replacement in other markets such as transportation,” said Augusto Di Donfrancesco, president of Solvay’s specialty polymers global business unit.Solvay Specialty Polymers’ products replace metal in an array of demanding automotive under-the-hood components such as hot air ducts, powertrains, engine control units, oil and water modules and conduits, while LFT are typically used to make interior/exterior semi-structural parts.In addition to PEEK and PAEK polymers, the LFT technology will be applied to Solvay’s Amodel PPA and Ryton PPS portfolio of products and Technyl polyamide 6.6 (PA6.6) range.Epic Polymers GmbH is a leading supplier of high strength thermoplastics, tribologically optimised thermoplastics and conductive thermoplastics."
"Fraud targeting Saudi Aramco, ONGC foiled - Business Standard","Mon, 19 Oct 2015 07:00:00 GMT",https://news.google.com/rss/articles/CBMicGh0dHBzOi8vd3d3LmJ1c2luZXNzLXN0YW5kYXJkLmNvbS9hcnRpY2xlL2NvbXBhbmllcy9mcmF1ZC10YXJnZXRpbmctc2F1ZGktYXJhbWNvLW9uZ2MtZm9pbGVkLTExNTEwMTkwMDYzMV8xLmh0bWzSAXRodHRwczovL3d3dy5idXNpbmVzcy1zdGFuZGFyZC5jb20vYW1wL2FydGljbGUvY29tcGFuaWVzL2ZyYXVkLXRhcmdldGluZy1zYXVkaS1hcmFtY28tb25nYy1mb2lsZWQtMTE1MTAxOTAwNjMxXzEuaHRtbA?oc=5&hl=en-US&gl=US&ceid=US:en,"An attempted fraud that targeted a money transfer between India's Natural Gas Corp (ONGC) and Saudi Aramco's trading unit has been foiled, the Saudi Arabian oil giant has said.""The aborted attempt did not financially affect any of the two companies or their commercial relations,"" Aramco said in a statement carried by Saudi Press Agency yesterday.It noted that the two companies continue their business work as normal and they have enhanced protection measures for their systems information technology.According to reports, the scammers pretending to work for the ONGC were involved in the attempted fraud."
Comment optimiser son community management ? - Talents - E-marketing.fr - Emarketing,"Tue, 06 Oct 2015 07:00:00 GMT",https://news.google.com/rss/articles/CBMieGh0dHBzOi8vd3d3LmUtbWFya2V0aW5nLmZyL1RoZW1hdGlxdWUvbWFuYWdlbWVudC0xMDkwL0luZm9ncmFwaGllcy9Db21tZW50LW9wdGltaXNlci1zb24tY29tbXVuaXR5LW1hbmFnZW1lbnQtMjU5ODEwLmh0bdIBfGh0dHBzOi8vd3d3LmUtbWFya2V0aW5nLmZyL1RoZW1hdGlxdWUvbWFuYWdlbWVudC0xMDkwL0luZm9ncmFwaGllcy9Db21tZW50LW9wdGltaXNlci1zb24tY29tbXVuaXR5LW1hbmFnZW1lbnQtMjU5ODEwL2FtcC5odG0?oc=5&hl=en-US&gl=US&ceid=US:en,"Définir une stratégie de community management ne commence pas par l'ouverture d'une page Facebook, ou d'un compte Twitter. Caroline Faillet, co-dirigeant du cabinet Bolero, explique les trois étapes incontournables pour développer sa politique de community management.



Imprimer



Le community management (CM) est la discipline du marketing digital qui consiste à créer et animer des liens entre une communauté et une marque. Par communauté, on entend groupement d'individus qui partagent des centres d'intérêt et de préoccupation communs. Si le community management s'est largement développé avec Facebook, ce réseau social n'a pas le monopole des actions de community management. De plus, les marques pêchent souvent par orgueil et ne conçoivent qu'un community management dédié à leur marque. Or, on imagine bien Dior, Nutella ou Harley Davidson comme sujet principal d'intérêt de communautés, mais beaucoup moins Air Liquide, Valeo ou même Axa.



Pourquoi ne pas être un peu plus ouvert d'esprit en envisageant que la marque ne soit que l'invitée d'une communauté dont les centres d'intérêt seraient bien plus larges que la seule entreprise ? Cette approche qui sort un peu des sentiers battus nécessite de la méthode, car au jeu d'occupation des réseaux sociaux et communautés thématiques, on a vite fait de se disperser. D'où l'arbre de décision proposé qui décompose la démarche en 3 grandes étapes afin de concentrer les actions de community management aux bons endroits et sur les bonnes cibles.



Étape 1 : Quelles communautés cibler ?

Une communauté ne se décrète pas, elle se détecte et se fédère. Un travail de cartographie préalable est donc indispensable pour vérifier le potentiel pour une entreprise à mener des actions de community management. Selon les communautés identifiées dans la cartographie, un travail de community management pourra être mené sur :

Les communautés supportrices de la marque : on pourra alors envisager un community management dédié à la marque

: on pourra alors envisager un community management dédié à la marque Les communautés qui ne parlent pas forcément de la marque, mais qui abordent une thématique à potentiel pour l'entreprise

Les communautés qui représentent des cibles stratégiques pour l'entreprise (par exemple les jeunes, les mamans, les professionnels, etc.).

Étape 2 : où veut-on les fédérer ?

Une fois la communauté sélectionnée, se pose la question du lieu d'animation de la communauté. L'alternative est alors de laisser la communauté dans son ""habitat"" naturel et de choisir d'y faire contribuer le community manager ; ou bien de chercher à sortir la communauté de son espace habituel pour la canaliser vers un espace officiel de la marque. L'arbitrage réside dans l'investissement que la marque est prête à faire dans le long terme pour constituer sa propre communauté, sachant qu'il faut en moyenne 3 ans de travail. Contrairement aux idées reçues, le fait d'ouvrir une page sur un réseau social de masse (Facebook ou Twitter pour ne pas les nommer) ne facilite pas pour autant la captation. Ce n'est pas parce qu'ils sont 200 millions sur Facebook qu'ils vont affluer en masse sur la page ! Au contraire, il est souvent plus facile de créer un volet communautaire sur un site déjà fréquenté que de partir de zéro sur Facebook.

À l'inverse, se faire inviter dans l'espace naturel de l'internaute procure une visibilité immédiate. Pour certaines marques comme Isover (isolation pour la maison), qui n'ont l'occasion de vendre en moyenne leurs produits que deux fois dans la vie d'un particulier, il n'est guère pertinent de chercher à fidéliser une communauté propre. En revanche, être visible auprès du maximum d'internautes qui ont un projet de rénovation et se rendent sur les forums travaux est plus rentable. Isover a donc opté depuis 2009 pour une présence assidue de deux community managers sur les forums dédiés bâtiment et accompagne les rénovateurs dans leur projet. Malgré une adoption précoce d'une stratégie de community management, Isover n'a donc toujours pas de page Facebook !

Étape 3 : Comment organiser le community management ?

L'organisation du community management dépend directement du type d'espace retenu au préalable. Si l'entreprise a opté pour un community management externe, c'est-à-dire dans l'espace naturel d'expression de l'internaute, le travail de CM est indissociable d'une veille large des conversations sur le web, afin de remonter les interventions à potentiel sur lesquels le community manager peut se positionner. Si l'entreprise a au contraire choisi de constituer et gérer sa propre communauté, elle va devoir dans un premier temps mener des actions de recrutement pour faire venir les internautes. De la même façon, la ligne éditoriale est, dans un cas, dictée par les sujets spontanément abordés par les internautes ; dans l'autre cas, sera impulsée par les sujets de communication, mais devra aussi s'inspirer de la veille sur les discussions du public. En effet, il est très tentant mais aussi totalement contreproductif pour la marque de rester auto-centrée dans sa communication.

Dans toutes les situations, externes ou internes, le CM devra organiser une remontée d'information fiable et réactive dans son entreprise. En effet, il se doit d'être omniscient sur tous les sujets qui peuvent être abordés par le public. Il devra aussi constituer son réseau d'experts qu'il consultera en fonction des questions que lui poseront les internautes. Enfin, il mettra en place un tableau de bord de suivi de son activité. Si les indicateurs ne sont pas les mêmes, selon que le CM est interne ou externe, le tableau de bord est indispensable pour mesurer l'apport du CM sur la notoriété et la réputation de la marque."
Pile à combustible Les 5 défis de la voiture à hydrogène - L'Automobile Magazine,"Fri, 16 Oct 2015 07:00:00 GMT",https://news.google.com/rss/articles/CBMiZWh0dHBzOi8vd3d3LmF1dG9tb2JpbGUtbWFnYXppbmUuZnIvdG91dGUtbC1hY3R1YWxpdGUvYXJ0aWNsZS83MTktYWN0dWFsaXRlcy10b3lvdGEtcGlsZS1hLWNvbWJ1c3RpYmxl0gEA?oc=5&hl=en-US&gl=US&ceid=US:en,"1. Le défi de la longévité

Le premier défi concerne la durée de vie de la pile à combustible, et en particulier de la membrane, le nafion, permettant la réaction chimique entre l’oxygène et l’hydrogène donnant naissance à l’électricité. Ce nafion n’aime pas officier sous 0 °C (il faut donc le réchauffer par temps froid), ni au-dessus de 100 °C, d’où de gros besoins en refroidissement. De plus, intégrant de microparticules de platine (le catalyseur de la réaction chimique), cette membrane est très sensible à la pollution extérieure. Elle a donc besoin d’un hydrogène très pur, mais aussi d’un air propre lui apportant de l’oxygène. Pas facile dans nos cités... Toyota pense pouvoir y parvenir avec des filtres à air performants. À mots couverts, un ingénieur nous a glissé que les Mirai serviront également à vérifier, d’ici dix ans, si les filtres à air ont bien suffi à garantir la longévité de la membrane. Sinon, il faudra rajouter un catalyseur onéreux pour nettoyer l’air de ses métaux lourds, du soufre... principaux poisons pour la pile à combustible.

2. Le défi du coût

Toyota assure avoir réduit de 95 % le coût très onéreux de la pile à combustible entre les versions de 2008 et la Mirai! Il n’empêche, son prix reste toujours largement incompatible avec une production en grande série. Le constructeur ne fournit aucun chiffre précis, mais la Mirai embarquant environ 30 g de platine dans ses 8 à 9 mètres carrés de nafion (900 €/m2), on arrive presque à 8.000 € pour la seule membrane. Il faut y ajouter plus de 2.000 € pour les deux réservoirs d’hydrogène en bobinages de carbone (ils résistent à 2.000 bars de pression) équipés de leur valve de sécurité, les systèmes de refroidissement-chauffage, l’électronique de contrôle et de puissance, la batterie, le moteur électrique... Bref, au total, le coût de production du système de propulsion de cette Mirai dépasse les 40.000 €. À comparer aux 6.000 € d’un système hybride de puissance équivalente! Toyota espère encore le diviser au moins par quatre d’ici 2028-2030, si les volumes décollent… Fin 2015, la Mirai sera vendue en Europe à 66.000 € hors taxes (79.200 € TTC ou 1.200 €/mois en leasing), un tarif très élevé mais pourtant inférieur à son montant actuel de production. Ensuite, il faut donc bâtir un réseau de production et de distribution d’hydrogène, aujourd’hui inexistant pour le grand public. À voir les soucis de réseau de recharge que rencontrent actuellement les électriques, alors que cette énergie simple est disponible partout, on imagine sans mal combien ce sera compliqué pour l’hydrogène, réservé pour l’heure à l’industrie.

3. Le défi de la production

À défaut de pouvoir produire à bord de la voiture du H2 très pur, cette production qui doit être à la fois propre et faite à prix acceptable constitue donc le troisième défi. Aujourd’hui, l’hydrogène est très majoritairement fabriqué pour l’industrie (chimique, pétrolière...) par vaporéformage de gaz naturel. Une technologie pas trop chère (10 €/kg de H2 vendu, de quoi parcourir environ 100 kilomètres, soit un coût au kilomètre comparable à celui du gazole), mais qui émet 10 kilos de CO2 par kilo de H2 produit. Ainsi alimentée, la Mirai aurait un bilan CO2 moins bon que celui d’une Prius! Il faut donc produire du H2 de façon propre, par exemple par électrolyse de l’eau à partir d’électricité ""verte"" (éolien, solaire...) ou de la biomasse. Des technologies existent, mais elles sont de 30 % à 65 % plus onéreuses. Sans compter que si l’hydrogène devenait un carburant alternatif crédible, l’État ne manquerait pas de lui appliquer, comme il le fera sur l’électricité si ce ""carburant"" décolle un jour, la TICPE (Taxe intérieure à la consommation sur les produits énergétiques) qui multiplie presque par deux le coût final.

4. Le défi du transport

L’hydrogène étant l’élément le moins dense de l’univers, il prend beaucoup de place. Ainsi, dans un camion-citerne de 40 tonnes, on transporte quatre-vingts fois moins d’hydrogène comprimé à 200 bars (ce qui mange environ 10 % de l’énergie stockée) que d’essence liquide. Et si le pouvoir énergétique de l’hydrogène est bien supérieur à celui du super, il ne faut pas moins de vingt-deux camions de H2 pour transporter l’équivalent d’un seul camion d’essence. Irréaliste, tant en coût qu’en bilan énergétique global. Les spécialistes estiment d’ailleurs qu’un camion d’hydrogène parcourant 500 kilomètres aura consommé l’équivalent du contenu de sa citerne en énergie! Reste le transport de l’hydrogène sous forme liquide. C’est huit fois moins énergivore, mais la liquéfaction dépense 40 % de l’énergie contenue... Bref, la seule solution acceptable s’avère le pipeline, qui ne consomme que 4 à 5 % de l’énergie transportée tous les 500 km. Il en existe quelques-uns en Europe du Nord (nord de la France, Belgique, Pays-Bas, Allemagne...) exploités par le spécialiste français Air Liquide. Mais cela requiert des investissements très élevés.

5. Le défi de la distribution

Compte tenu des contraintes de sécurité à respecter pour ce gaz hautement inflammable et du fait qu’il faille le comprimer à 700 bars, puis le refroidir – il ne faut pas l’introduire à plus de 80 °C dans le réservoir –, les stations de distribution de l’hydrogène sont aussi imposantes qu’horriblement coûteuses (1,5 à 2 millions d’euros pièce, soit dix fois le prix d’une pompe à carburant classique). On vous laisse calculer le coût d’un réseau d’au minimum 1.000 stations pour couvrir un pays comme la France. Sans oublier que la compression-refroidissement est elle aussi énergivore : l’équivalent de 10 à 15 % de l’énergie introduite dans le réservoir.Vu la complexité des défis à relever, on comprend la prudence des constructeurs européens. Si les japonais (Toyota, mais aussi Honda qui a également annoncé un modèle en petite série pour 2016, après sa FCX Clarity de 2008) sont poussés par leur gouvernement, tout comme le coréen Hyundai, les autres marques, elles, travaillent le sujet, mais ne souhaitent pas produire de modèles avant longtemps. Ainsi, Audi et VW nous ont fait essayer des prototypes d’A7 et de Passat ""pile à combustible"" convaincants. Mais le professeur Hackenberg, directeur de la recherche et développement du groupe, s’est empressé de préciser: ""Nous travaillons depuis dix ans sur les piles à combustible, qui seront une partie de la mobilité électrique à l’avenir. Mais nous ne faisons pas de promesses vides. Il faut encore améliorer leur durée de vie et baisser le prix… [et attendre] qu’un réseau de distribution d’hydrogène ait été constitué"". D’ici là, il se peut que, prix et capacités des batteries s’améliorant, les hybrides rechargeables, qui n’ont besoin d’aucun réseau d’énergie spécifique, aient suffisamment baissé leurs tarifs pour rendre les voitures à hydrogène économiquement irréalistes. Sans oublier l’émergence éventuelle des carburants de synthèse ou celle des biocarburants de deuxième et troisième générations. Rendez-vous en 2030 pour le verdict?"
