Titre,Date de publication,URL,Contenu
Air Liquide augmente son capital pour financer le rachat d'Airgas - L'Usine Nouvelle,"Tue, 13 Sep 2016 07:00:00 GMT",https://news.google.com/rss/articles/CBMib2h0dHBzOi8vd3d3LnVzaW5lbm91dmVsbGUuY29tL2FydGljbGUvYWlyLWxpcXVpZGUtYXVnbWVudGUtc29uLWNhcGl0YWwtcG91ci1maW5hbmNlci1sZS1yYWNoYXQtZC1haXJnYXMuTjQzNjQ5MtIBAA?oc=5&hl=en-US&gl=US&ceid=US:en,"Air Liquide continue son opération de rachat du groupe américain Airgas. Dans le cadre du refinancement de cette acquisition, faite avec un prêt relais contracté en décembre 2015 et finalisée en mai dernier, le géant français de gaz industriels et médicaux a annoncé mardi 13 septembre le lancement d’une augmentation de capital de 3,283 milliards d’euros. Cette opération constitue la deuxième étape du refinancement de cette acquisition après une émission obligataire de 3 milliards d'euros en juin, et sera suivie d'une émission obligataire de 4,5 milliards de dollars US.

""C’est un moment exceptionnel pour nous qui n’arrive que tous les 30 ans"", a commenté la directrice financière du groupe, Fabienne Lecorvaisier, lors d'une conférence téléphonique. Et d’expliquer pourquoi Air Liquide a opté pour une augmentation de capital et non pas pour un financement en dette : ""Nous avons fait ce choix pour conserver la notation de notre dette dans la catégorie A et pour continuer à être capables de saisir les opportunités de notre secteur et d’investir.""

43,2 millions d'actions nouvelles

L'augmentation de capital, avec maintien du droit préférentiel de souscription, sera ouverte au public uniquement en France, et ce du 14 au 28 septembre inclus. Chaque actionnaire d'Air Liquide recevra un droit préférentiel de souscription (DPS) par action détenue, et 8 DPS permettront la souscription d'une action nouvelle. S’il ne souhaite pas souscrire à une nouvelle action, l’actionnaire pourra revendre son DPS, dont la valeur théorique a été fixée à 2,18 euros sur la base du cours de clôture du vendredi 9 septembre.

Air Liquide va émettre environ 43,2 millions d'actions nouvelles, ce qui va permettre une augmentation du capital du groupe de 12,5%, a indiqué Fabienne Lecorvaisier. Le prix de souscription des actions nouvelles a été fixé à 76 euros par action, soit une décote de 29,52% par rapport au cours de clôture de vendredi dernier, et 22,53% par rapport à la moyenne des 20 derniers cours de clôture.

Vers une cession d’Aqua Lung

L’annonce de cette augmentation de capital intervient au lendemain d’une bonne nouvelle pour Air Liquide. L’allemand Linde, grand concurrent du français, a annoncé lundi l'arrêt des discussions préliminaires de fusion avec l'américain Praxair, une fusion qui aurait valu à Air Liquide sa place de numéro mondial du secteur.

Toujours dans le cadre de son acquisition d'Airgas, qui doit lui permettre de se concentrer sur ses activités Gaz & Services, Air Liquide a confirmé la semaine dernière la tenue de discussions en vue d'une cession de sa filiale française Aqua Lung, acteur majeur des équipements individuels pour les activités sportives et professionnelles en milieu aquatique. Le rachat d'Airgas, pour un montant de 13,4 milliards de dollars (11,9 milliards d'euros), est le plus important de l'histoire d'Air Liquide.

Marion Garreau"
"Rompus, PEA, prime de fidélité… ce qu'il faut savoir sur l'augmentation de capital d'Air Liquide - Investir","Fri, 16 Sep 2016 07:00:00 GMT",https://news.google.com/rss/articles/CBMimwFodHRwczovL2ludmVzdGlyLmxlc2VjaG9zLmZyL2FjdHUtZGVzLXZhbGV1cnMvZW50cmV0aWVucy9yb21wdXMtcGVhLXByaW1lLWRlLWZpZGVsaXRlLWNlLXF1aWwtZmF1dC1zYXZvaXItc3VyLWxhdWdtZW50YXRpb24tZGUtY2FwaXRhbC1kYWlyLWxpcXVpZGUtMTQyODg1NdIBAA?oc=5&hl=en-US&gl=US&ceid=US:en,"Patrick Renard, Directeur du service actionnaires

L’augmentation de capital se déroule jusqu’au 28 septembre, que doivent faire les particuliers s’ils n’ont pas un multiple de 8 actions ?

Il est prévu tant sur le bulletin de souscription papier que sur le site internet, la possibilité d’acheter au moment de la souscription les quelques DPS permettant d’obtenir le nombre de DPS multiple de 8 immédiatement supérieur au nombre de DPS détachés, ou de vendre les quelques DPS pour arrondir au multiple de 8 immédiatement inférieur.

Que se passe-t-il dans un PEA où il n’est pas possible d’acheter des droits de souscription ?

Publicité

L’achat de DPS n’est en effet pas possible dans un PEA. Les DPS qui seraient acquis sur le marché ne pourront en tout état de cause pas être inscrits sur le PEA de l’acquéreur.

Les DPS qui seront détachés d’actions Air Liquide figurant sur un PEA seront exerçables et les actions nouvelles résultant de leur exercice seront livrées dans le PEA. Mais attention, le règlement de la souscription des actions nouvelles ne peut provenir que du compte espèces du PEA.

En présence d’un nombre de DPS émis à raison d’actions Air Liquide inscrites dans un PEA insuffisant pour souscrire des actions nouvelles, les DPS correspondants (« rompus ») ne pourront donc pas être exercés dans le PEA et ne pourront qu’être cédés, le produit de cette vente alimentant le compte espèces du PEA.

Les actionnaires concernés sont invités à se rapprocher de l’établissement bancaire teneur du PEA.

Quand les actions nouvelles seront-elles assimilées aux anciennes ?

Immédiatement. Ce sont des actions « ordinaires », ayant les mêmes droits que les actions anciennes (droit au dividende, droit de vote...). Mais attention, elles n’en ont pas l’ancienneté. Issues d'actions au nominatif pur, elles seront livrées en nominatif pur et bénéficieront de la prime de fidélité (10% de dividendes et 10% d’actions gratuites supplémentaires) à l’issue de deux années calendaires de détention. En revanche, issues d’actions au porteur ou d'actions au nominatif administré, elles seront livrées au porteur et il conviendra que l’actionnaire demande leur inscription au nominatif à son intermédiaire financier pour qu’elles bénéficient de la prime de fidélité après deux années calendaires de détention.

Que se passe-t-il pour les actionnaires individuels non français. Peuvent-ils participer à l’opération ?

L'offre est ouverte au public uniquement en France. La documentation de l'offre n’est donc pas adressée ou mise à disposition du public hors de France afin de respecter les réglementations applicables."
FDDAY sans Manuel Valls + 23 millions pour Kyriba + Klassroom = INSIDERS - FrenchWeb,"Thu, 29 Sep 2016 07:00:00 GMT",https://news.google.com/rss/articles/CBMiW2h0dHBzOi8vd3d3LmZyZW5jaHdlYi5mci9mZGRheS1zYW5zLXZhbGxzLTIzLW1pbGxpb25zLXBvdXIta3lyaWJhLWtsYXNzcm9vbS1pbnNpZGVycy8yNTg4MDjSAQA?oc=5&hl=en-US&gl=US&ceid=US:en,"Avec notre partenaire Brevo, dotez vous d'une boîte à outils marketing complète pour transformer vos visiteurs en clients fidèles

La FinTech Kyriba lève 23 millions de dollars pour financer sa croissance.

Klassroom, l'application qui digitalise le carnet de liaison, lève 300 000 euros.

Le chiffre du jour : 80% des millenials se connectent à des sites d'information grâce au mobile, mais…

L'image du jour : Malgré leur croissance, les start-up françaises peinent à trouver leur modèle de rentabilité

Les budgets du jour : La Chose, Landor…

Les nominations du jour : altima° Lyon, WeShareBonds…

Atelier en ligne : L’importance d’acquérir la confiance des internautes pour augmenter les conversions.

Le 18 octobre à 11h, avec Trustpilot​.





La droite s'est pressée au FDDAY. Alain Juppé, François Fillon, et en imprévu Jean-François Copé, sont venus à la rencontre des entrepreneurs et des investisseurs français réunis par l'association France Digitale pour son évenement annuel «le France Digitale Day». A gauche, Jean-Marc Ayrault a lancé le FDDay au quai d'Orsay et Axelle Lemaire, dont l'intervention a été saluée par les 2 000 participants (selon les organisateurs), ont répondu présents. Comme nous l'annoncions hier, Manuel Valls, qui devait intervenir comme «invité surprise» a décliné au dernier moment l'invitation des organisateurs. crédit une: Eric Ly ‏ @ DeadEye0112

La FinTech Kyriba lève 23 millions de dollars pour financer sa croissance



La FinTech Kyriba, spécialisée dans la gestion de trésorerie, vient de boucler un tour de table de 23 millions de dollars auprès de Bpifrance, HSBC et Daher Capital. Fondée en 2000 à Saint-Cloud, la société française est aujourd’hui implantée aux États-Unis, en Angleterre, au Japon et au Moyen-Orient. A ce jour, Kyriba revendique 1 300 clients à travers le monde.

Avec ce nouvel investissement, l’entreprise prévoit de financer sa croissance et de préparer le lancement commercial de ses nouveaux produits pour la détection de fraudes et la supply chain finance. «Le marché mondial évolue aujourd’hui très rapidement, devenant plus risqué pour nos clients, accentuant ainsi le besoin d’utiliser nos solutions logicielles», explique Jean-Luc Robert, PDG de Kyriba.

Connaissez vous Connaissez vous la DATAROOM de FRENCHWEB.FR notre base de données de startups et sociétés innovantes françaises: informations clés, fonds levées, chiffres d'affaires, organigramme, axes de développement. Accédez aux informations que nous avons collecté concernant plus de 1000 sociétés

Klassroom, l'application qui digitalise le carnet de liaison, lève 300 000 euros



Klassroom, l'application mobile qui réinvente la relation parents-professeurs, annonce avoir levé 300 000 euros auprès d'Allianz et d'Idinvest, grâce à la plateforme SmartAngels. L'application permet aux parents de partager le quotidien de leurs enfants lorsqu'ils sont à l'école, mais aussi d'être alertés instantanément en cas de problème ou bien de prévenir d'une absence.

Le principe est simple : le professeur télécharge l'application (ou se connecte via le site de l'entreprise) et crée une classe virtuelle. Il partage ensuite l'identifiant de cette classe aux parents de ses élèves, qui peuvent s'y connecter et y ajouter le nom de leur enfant. Totalement sécurisée et non-intrusive, l'application permet aux parents et aux enseignants de communiquer entre eux, mais sans partager leurs coordonnées de contact. Près de 40 établissements scolaires en France et aux États-Unis ont déjà adopté l'application Klassroom, ainsi qu'une dizaine de classes accueillant des enfants autistes. La start-up, soutenue par Axelle Lemaire, devrait «bientôt annoncer de nouveaux développements significatifs au niveau national».

«On pense l'école irréformable, mais quand on voit l'engouement pour Klassroom chez les professeurs et l'adhésion des parents, on ne peut que se réjouir de cette nouvelle proximité offerte par le digital», déclare Frank-David Cohen, co-fondateur de Klassroom.

Le chiffre du jour : 80% des millenials se connectent à des sites d'information grâce au mobile, mais…



Au Royaume-Uni, les millenials comptent pour 36% des audiences des sites d'information, et passent en moyenne 69 heures par mois sur ce type de médias, tous supports confondus (ordinateurs, mobiles, tablettes), selon des données comScore. Ils sont ainsi responsables de 25% du temps passé sur des sites d'informations à partir d'un ordinateur, et pour la moitié du temps passé sur ce type de sites à partir d'un mobile (sur le mois d'août 2016). Dernier constat, s'ils se connectent majoritairement via leur mobile (à 80%), les sources d'information qu'ils privilégient sont des médias plutôt traditionnels : le Daily Mail, le Guardian ou bien le Telegraph.

L'image du jour: Malgré leur croissance, les start-up françaises peinent à trouver leur modèle de rentabilité



Avec un chiffre d'affaires cumulé en hausse de 39% sur une année et des recrutements en hausse de 27%, les start-up françaises se portent bien, si l'on en croit les résultats du Baromètre France Digital-Ey présenté le 29 septembre à l'occasion du France Digital Day.

Pourtant si l'on rentre dans le détail de l'analyse, 69% des start-up étudiées ont un EBIT négatif, et seules 3% d'entre elles ont versé des dividendes à leurs actionnaires depuis leur création. Notons que l'étude porte sur des entreprises qui ont en moyenne 6 ans.

**Méthodologie: enquête menée auprès de 224 start-up françaises. Les start-up du baromètre ont en moyenne 6 ans.



Les budgets du jour : La Chose, Landor…







Piper-Heidsieck choisit La chose pour sa nouvelle signature de marque en France et à l'international



La Maison de Champagne Piper-Heidsieck a choisi l'agence de communication La Chose pour définir sa nouvelle plateforme et sa signature de marque, ainsi que pour développer sa communication media en France et à l'international. L'agence sera également en charge de la refonte de l'écosystème digital de la marque, et de sa présence sur les réseaux sociaux.

L'agence, qui accompagne différentes marques dans le secteur des boissons et du luxe, telles que Kronenbourg, Tourtel Twist ou encore Labeyrie, a récemment convaincu Fortuneo de lui faire confiance avec sa prochaine campagne de communication.

Landor présente Navblue, la nouvelle marque d'Airbus



Airbus l'annonçait à l'occasion du Salon international de l'Aéronautique de Farnborough le 12 juillet dernier, c'est l'agence Landor qui est en charge de la définition de sa nouvelle identité de marque. C'est chose faite avec la création de la marque Navblue, présentée le 29 septembre, à peine plus de deux mois après l'attribution du budget.

La nouvelle marque, qui «remet l'émotion du vol au coeur de la précision de la technique», selon l'agence, sera déclinée sur l'ensemble des supports de communication de l'entreprise. On notera que le site Internet de la marque se présente de manière originale : le «scroll up» s'y est en effet substitué au «scroll down» habituellement utilisé.

Les nominations du jour : altima° Lyon, WeShareBonds…



Anne-Laure Jozon devient directrice adjointe de l’agence altima° Lyon



Après plus de cinq ans au sein de Smile Digital, Anne-Laure Jozon rejoint l’agence digitale altima° Lyon. Dans le cadre de ses nouvelles fonctions, elle sera chargée de développer le pôle dédié à l’expérience utilisateur. En parallèle, elle participera aussi au développement commercial de l’agence, en étroite collaboration avec Jean-Pierre Cauchy, directeur général d’altima° Lyon. Auparavant, elle a travaillé pour Air Liquide et Info Presse au Canada.

Alain Cuenot rejoint WeShareBonds en tant que responsable des ventes des produits financiers



La plateforme de financement participatif WeShareBonds a décidé de s’attacher les services d’Alain Cuenot. Précédemment chez J.P. Morgan, La Compagnie Financière Edmond de Rothschild ou encore La Française Global Asset Management, il est nommé responsable des ventes des produits financiers de la plateforme de crowdfunding. A son nouveau poste, il devra accompagner le développement et la commercialisation d’une nouvelle gamme de fonds obligataires investissant dans les crédits de PME.

Microsoft experiences’16

Rendez vous pour cet évènement exceptionnel les 4 et 5 octobre 2016 au Palais des congrès de Paris​ Vous connaissiez les tech.days ? Cet évènement annuel, pour sa 10ème édition, se transforme et devient Microsoft experiences. Découvrez, durant ces 2 jours dédiés à la transformation digitale en entreprise, les témoignages de vos pairs, d’experts métiers et techniques et de leaders de l’écosystème du numérique.

Pour en savoir plus. ​

[Atelier en ligne] E-Commerce : L’importance d’acquérir la confiance des internautes pour augmenter les conversions

Le 18 octobre à 11h avec Trustpilot​ Participez à notre atelier en ligne où Brahim Ben Helal, Head of Strategic Development chez Trustpilot, et Etienne Fénétrier, Team Leader chez VE Interactive, vous expliqueront en quoi le fait de construire la confiance en ligne peut améliorer vos conversions.

Inscrivez-vous!"
"[Femmes de l'innovation] Marianne Julien, science humaine - L'Usine Nouvelle","Mon, 05 Sep 2016 07:00:00 GMT",https://news.google.com/rss/articles/CBMiZGh0dHBzOi8vd3d3LnVzaW5lbm91dmVsbGUuY29tL2FydGljbGUvZmVtbWVzLWRlLWwtaW5ub3ZhdGlvbi1tYXJpYW5uZS1qdWxpZW4tc2NpZW5jZS1odW1haW5lLk40MzMyNjLSAQA?oc=5&hl=en-US&gl=US&ceid=US:en,"Avec un comité exécutif composé de douze hommes pour… une femme, Air Liquide n’est pas un champion de la parité, mais sait promouvoir un talent, quel que soit son sexe. Marianne Julien, passée par la recherche et les ressources humaines, s’est illustrée en dirigeant le programme Horizon hydrogène énergie, financé par Bpifrance et regroupant 19 partenaires. Depuis 2014, elle est chargée des partenariats scientifiques du groupe. En dix-huit mois, elle a monté une communauté d’innovation collaborative, composée de chercheurs et de business développeurs internes et externes. « Je suis une scientifique qui s’intéresse de plus en plus à l’humain », explique cette ingénieur des Mines. Elle a lancé, en février, un challenge sur trois défis stratégiques, dont celui de créer de l’hydrogène à partir d’eau en utilisant l’énergie solaire. Résultat : une visibilité d’Air Liquide auprès des académiques du monde entier et plus de 120 projets remontés. Passionnée par l’intelligence collective, Marianne Julien impulse de nouvelles méthodes de créativité dans un groupe de 1 100 chercheurs. « On peut essayer de changer les gens, mais en général cela ne marche pas trop. Ce qu’il faut, c’est modifier l’environnement pour que chacun se sente libre. » Ce goût de l’orchestration des talents lui vient peut-être de sa pratique du cromorne, l’ancêtre du hautbois, au sein d’un ensemble de musique médiévale.

Remarque sexiste entendue

« On m’a reproché d’être “trop émotionnelle”, alors que je suis juste passionnée. Avec l’âge, je prends du recul et j’ouvre le dialogue au lieu d’être blessée par une remarque. »

"
Ingrédients : Nominations chez SEPPIC - Premium beauty,"Fri, 23 Sep 2016 07:00:00 GMT",https://news.google.com/rss/articles/CBMiR2h0dHBzOi8vd3d3LnByZW1pdW1iZWF1dHluZXdzLmNvbS9mci9pbmdyZWRpZW50cy1ub21pbmF0aW9ucy1jaGV6LDEwMzEz0gEA?oc=5&hl=en-US&gl=US&ceid=US:en,"SEPPIC, la filiale du groupe Air Liquide spécialisée dans la conception, la fabrication et la commercialisation d’ingrédients de spécialité pour la santé et la beauté, vient d’annoncer la nomination de Sébastien Duprat de Paule au poste de Directeur de l’Unité d’Innovation et Développement (U.I.D.) Excipients, au sein de sa Direction Innovation, dirigée par Philippe Msika.

Spécialiste des ingrédients cosmétiques, des procédés écoconçus et durables en chimie verte et en biotechnologies, Sébastien Duprat de Paule est diplômé de Chimie ParisTech et Docteur en Chimie Organique et BioOrganique. Il rejoint SEPPIC après une carrière au sein de Chimex, filiale de L’Oréal où il a occupé des fonctions de responsabilité croissante depuis 2003, jusqu’à la direction de la Recherche & Développement. Il aura pour mission de développer une innovation responsable dans les domaines des polymères, des tensioactifs moussants et des émulsionnants.

Myriam Maugin vient, par ailleurs, d’être nommée Directeur du site de Castres, spécialisé dans la fabrication d’excipients et d’actifs cosmétiques, d’excipients pharmaceutiques et de tensioactifs. Elle succède à Jérôme Villeneuve, qui était Directeur du site de Castres depuis cinq ans et qui a été nommé au sein d’une autre filiale du groupe Air Liquide.

Elle aura pour mission de poursuivre la transformation des activités du site de Castres. « Au fil des années, les infrastructures de ce site se sont transformées et adaptées aux exigences des métiers de la santé et de la beauté, marchés clés pour SEPPIC. Il emploie actuellement 320 collaborateurs sur 8 hectares, dont 3 500 m2 de laboratoires de synthèse, d’analyse et d’application, » explique SEPPIC dans un communiqué.

Myriam Maugin est diplômée du Conservatoire National des Arts et Métiers de Paris et Ingénieur des Mines de Paris. Elle a occupé plusieurs postes de direction de sites industriels, notamment au sein des groupes Saint-Gobain et Owens-Illinois."
