Titre,Date de publication,URL,Contenu
Meetrip.com + Matcha + Twitter = INSIDERS - Paris - FrenchWeb,"Tue, 20 Sep 2016 07:00:00 GMT",https://news.google.com/rss/articles/CBMiQ2h0dHBzOi8vd3d3LmZyZW5jaHdlYi5mci9tZWV0cmlwLWNvbS1tYXRjaGEtdHdpdHRlci1pbnNpZGVycy8yNTcwNDTSAQA?oc=5&hl=en-US&gl=US&ceid=US:en,"Avec notre partenaire Brevo, dotez vous d'une boîte à outils marketing complète pour transformer vos visiteurs en clients fidèles

Meetrip.com s’empare de Cariboo et Guide Like You.

Matcha, l'algorithme qui recommande des vins accordés aux mets.

Twitter revoit sa manière d'appliquer sa règle des 140 caractères.

92% des mobinautes qui se renseignent sur un produit l'achètent dans la journée

Twitter revoit sa manière d'appliquer sa règle des 140 caractères

Qui sont les entrepreneurs de la Tech française ?

Les nominations du jour : ByPath, Air Liquide, Ogilvy & Mather Paris, Iris Capital

Atelier en ligne: 3 visiteurs sur 4 quittent votre site si leur expérience n’est pas optimisée. Envie de changer ça?

Le 11 octobre à 11h, avec Kameleoon​

Meetrip.com s’empare de Cariboo et Guide Like You

La start-up Meetrip.com, qui développe une plateforme de mise en relation entre voyageurs et guides conférenciers, a conclu le rachat de Cariboo et Guide Like You, deux plateformes qui servent, quant à elles, d’intermédiaires entre touristes et locaux passionnés qui souhaitent faire découvrir leur ville. Les modalités financières de l’opération n’ont pas été précisées. Lancée en 2015, la plateforme Meetrip.com revendique 60 000 guides professionnels dans 80 pays. «L’ambition du groupe Meetrip-Cariboo est de contribuer au développement d’un accueil à 360 degrés, multilingue et d’être capable de répondre à ces nouveaux enjeux du tourisme», explique Ralph Guyot-Jeannin, fondateur et CEO de Meetrip.com. La start-up française aura fort à faire sur le marché des activités touristiques avec Airbnb qui vient d’acquérir la marketplace espagnole Trip4real. Cette dernière met en relation des touristes avec des habitants de la région dans laquelle ils se trouvent pour prendre part à des activités locales, soit un concept similaire à celui de Cariboo et Guide Like You.

Matcha, l'algorithme qui recommande des vins accordés aux mets



Permettre aux professionnels de l'alimentaire et de la gastronomie de fournir un service digne d'un sommelier à leurs clients, telle est la promesse de Matcha. Après une phase de R&D d'un an, la start-up a lancé son offre commerciale en début d'année.

L'algorithme qu'elle a développé permet ainsi aux professionnels de recommander des vins qui s'accordent avec les mets. De quoi permettre aux restaurateurs de fidéliser leur clientèle, mais aussi aux grossistes ou aux professionnels de la grande distribution de mieux conseiller leurs clients, qui peuvent espérer augmenter leurs revenus. En plus de son offre B2B, la société a également développé un outil mis gratuitement à disposition des particuliers, et qui leur propose une sélection de vins qui s'accordent avec le plat qu'ils cuisinent.

Connaissez vous Connaissez vous la DATAROOM de FRENCHWEB.FR notre base de données de startups et sociétés innovantes françaises: informations clés, fonds levées, chiffres d'affaires, organigramme, axes de développement. Accédez aux informations que nous avons collecté concernant plus de 1000 sociétés

A l'origine du projet, on retrouve Benoît Richert (en photo ci-contre), ingénieur-développeur et sommelier conseil, Thomas Dayras, consultant en stratégie et également sommelier conseil, ainsi qu'Eduardo Queiroz Peres, également ingénieur-développeur.

Le tweet du jour : Twitter revoit sa manière d'appliquer sa règle des 140 caractères



Il l'annonçait depuis le mois de mai, le réseau social à l'oiseau a enfin changé la manière dont il applique sa fameuse règle des 140 caractères maximum par tweet. Depuis hier lundi, les photos, les vidéos mais aussi les questions et les citations ne rentrent plus dans le décompte du nombre de caractères. Cette évolution devrait permettre aux utilisateurs du réseau social de bénéficier d'une plus grande liberté pour s'exprimer.

Say more about what's happening! Rolling out now: photos, videos, GIFs, polls, and Quote Tweets no longer count toward your 140 characters. pic.twitter.com/I9pUC0NdZC — Twitter (@twitter) 19 septembre 2016

Le chiffre du jour : 92% des mobinautes qui se renseignent sur un produit l'achètent dans la journée





Les liens entre monde physique et digital ne sont plus à prouver, notamment en matière d'e-commerce. Une nouvelle étude réalisée par Google, à partir de données de 1 000 utilisateurs mobiles, et reprise par Marketing Dive révèle ainsi que plus des trois quarts des mobinautes qui s'informent sur un produit se rendent en magasin la journée suivante. Autre enseignement de l'étude: 92% de ces mobinautes achètent dans la journée. Enfin, l'étude montre que 96% des mobinautes étudiées pour les besoins de l'étude utilisent leur téléphone pour chercher des informations au quotidien et 73% d'entre eux utilisent leur ordinateur.

Lire aussi : M-commerce rime avec sport, mode et luxe en France

L'image du jour : les secteurs qui favorisent le plus la mobilité transversale des salariés



Clustree, la plateforme de gestion des talents, s'est basée sur les données des 250 millions de profils qui sont référencés chez elle, afin d'analyser les évolutions de carrière en fonction des secteurs d'activité. Elle a dressé une liste des 10 secteurs d'activité qui favorisent le plus une mobilité transversales des salariés. La publicité, les médias et la communication arrivent en tête, suivis des services et de l'industrie. Le numérique arrive en 4e position.

Les nominations du jour : ByPath, Air Liquide, Ogilvy & Mather Paris, Iris Capital…



Thomas Cochin quitte Microsoft pour ByPath



Après plus de quatre chez Microsoft, Thomas Cochin vient de rejoindre ByPath en qualité de directeur du Business Development. Dans le cadre de ses nouvelles responsabilités, il devra contribuer au développement commercial de la société à l’échelle internationale.

En outre, il sera affecté à la gestion de la relation client. Thomas Cochin a débuté sa carrière en 2001 au sein de l’éditeur français Coheris avant de rejoindre Microsoft en 2011 où il a occupé les postes de directeur marketing puis directeur commercial en charge de l’expérience client.

Yael Azoulay rejoint Air Liquide en tant que Senior Advisor



Le groupe industriel français Air Liquide a nommé Yael Azoulay au poste de Senior Advisor, en charge de la transformation digitale. En 2008, elle a fondé la maison d’édition La Tortue, essentiellement destinée aux comités de direction d’entreprise, des grandes institutions et des collectivités locales.

Fadela Moizard prend la tête du département communication visuelle de l’IIM



L’Institut de l’Internet et du multimédia (IIM) – Groupe Léonard de Vinci a décidé de nommer Fadela Moizard au poste de directrice de l’axe communication visuelle. Dans le cadre de ses nouvelles fonctions, elle sera chargée d’accompagner le développement de cette branche de l’IIM.

Auparavant, Fadela Moizard a notamment travaillé pour PriceMinister et l’agence En Personne où elle a piloté les campagnes publicitaires de Toshiba, Epson, Véolia ou encore Société Générale.

Soline Rabaud devient la nouvelle directrice marketing de Polar France



Polar France, société qui commercialise des cardiofréquencemètres et des montres de sport GPS, s’attache les services de Soline Rabaud. Cette dernière est nommée directrice marketing.

A ce titre, elle travaillera en étroite collaboration avec Denis Bordenave, directeur général de l’entreprise. Avant de rejoindre Polar France, Soline Rabaud était chef de produit écrans et chef de marque Lumix chez Panasonic depuis 2007.

Christian Foulon promu directeur de création d’Ogilvy & Mather Paris



25 ans après son arrivée, Christian Foulon a été nommé directeur de création de l’agence de publicité Ogilvy & Mather Paris. En 1991, il avait rejoint la société en qualité de concepteur-rédacteur. Dans le cadre de ses activités au sein d’Ogilvy & Mather Paris, il a notamment collaboré avec Vittel, Epson, Caisse d’épargne, Ford ou encore La Mutuelle Générale. «Christian a vécu les différentes ères ogilvyennes de la création», note Emmanuel Lallevé, Executive Creative Director de l’agence.





Stéphane Pesqué devient Partner chez Iris Capital



Stéphane Pesqué rejoint Iris Capital en tant que Partner en charge des investissements «early-stage» en France. Avant de rejoindre le fonds d'investissement, Stéphane Pesqué a travaillé 13 ans pour la filiale de Private Equity du groupe CM-CIC, au sein de laquelle il a développé l'activité de capital-risque. Il y a investi dans plus de 20 sociétés dans les secteurs des télécoms, des logiciels, et d'Internet, parmi lesquelles Deezer, Capitaine Train (cédée à TrainLine), ou encore Mister Auto (cédée à PSA). Il a débuté sa carrière en tant que chargé d'affaires chez Siparex Ventures pendant 4 ans.

Qui sont les entrepreneurs de la Tech française ?



Frenchweb a lancé son étude «Portrait d'entrepreneurs et de dirigeants», pour comprendre qui sont les Entrepreneurs de la Tech française aujourd'hui. Participez vite à notre enquête.

3 visiteurs sur 4 quittent votre site si leur expérience n’est pas optimisée. Envie de changer ça?

Le 11 octobre à 11h, avec Kameleoon​ Pour 75% de vos visiteurs, avoir une expérience optimisée n’est plus une option. Si votre site ne les convainc pas, ils vous quittent. Mais comment comprendre leurs besoins et identifier les axes d’optimisation de votre site ? Inscrivez-vous ! ​"
L'efficacité des marques-préfixes - Les Échos,"Mon, 05 Sep 2016 07:00:00 GMT",https://news.google.com/rss/articles/CBMiSGh0dHBzOi8vd3d3Lmxlc2VjaG9zLmZyLzIwMTYvMDkvbGVmZmljYWNpdGUtZGVzLW1hcnF1ZXMtcHJlZml4ZXMtMjAzNTAwM9IBAA?oc=5&hl=en-US&gl=US&ceid=US:en,"Faut-il privilégier une marque unique, qui ne pourra satisfaire les aspirations de tous les consommateurs, ou créer une nouvelle marque pour chaque cible identifiée ? C'est la question cruciale que se posent nombre d'entreprises. La première option prive l'entreprise des consommateurs qui ne veulent pas d'une marque « pour tout le monde ». Ces « mégamarques » sont souvent jugées par des consommateurs exigeants comme dominatrices et pas assez distinctives. A contrario, créer une marque par cible engendre le développement de marques souvent trop faibles pour s'imposer et devenir rentables.

Que cherche fondamentalement le consommateur ? Il entretient deux attentes contradictoires : la sécurité et la spécificité. Il est en quête d'une marque forte qui n'aurait été faite que pour lui.

Peu enseignée, la logique des marques-préfixes peut souvent répondre à ces contradictions du consommateur. Le groupe Nestlé a des afficionados et des détracteurs. Le préfixe « Nes » de la « marque de famille » complété par un suffixe innovant crée la surprise. Nespresso, Nesquick ou Nestea sont perçus comme des produits et des marques à la fois bien spécifiques, originaux et rassurants. Le groupe Danone utilise cette astuce de « naming » avec des marques comme Danette ou Danao.

Air Liquide Welding est la partie soudage du groupe éponyme. Florafloor, Floracool et Floratec conçues récemment sur la même logique sont les trois marques de la filiale européenne de Luxury Vinyl Tiles, l'un des leaders mondiaux des parquets en vinyle de luxe. La structure de notre langue française est toute entière fondée sur la logique des préfixes et des suffixes. Cet été, on aura été pro-JO, archipro-JO, hyper-JO, anti-JO… mal-heureux ou bien-heureux !"
"Le géant BlackRock, nouveau parrain du CAC40 - L'Opinion","Wed, 21 Sep 2016 07:00:00 GMT",https://news.google.com/rss/articles/CBMiTGh0dHBzOi8vd3d3LmxvcGluaW9uLmZyL2Vjb25vbWllL2xlLWdlYW50LWJsYWNrcm9jay1ub3V2ZWF1LXBhcnJhaW4tZHUtY2FjNDDSAQA?oc=5&hl=en-US&gl=US&ceid=US:en,"Un Américain a-t-il remplacé un Belge comme parrain du CAC40 ? Alors que le Groupe Bruxelles Lambert (GBL) naguère principal actionnaire d’une demi-douzaine des plus grandes entreprises françaises s’est sérieusement désengagé de l’Hexagone, BlackRock est aujourd’hui numéro un dans le capital de six fleurons de la Bourse. Avec 4 500 milliards de dollars d’actifs dans le monde, il détient en France un portefeuille de quelque 150 milliards, dont la moitié en actions. Et s’il est présent dans toutes les sociétés du CAC40 pour sa gestion indicielle, il gère par ailleurs de multiples fonds de façon « active », ce qui le conduit à détenir des participations significatives dans dix-huit fleurons du CAC. Ce seul portefeuille vaut aujourd’hui quelque 35 milliards de dollars et lui donne une position unique parmi les grands investisseurs institutionnels présents à Paris. BlackRock a justement fait appel au début de cette année à un grand patron français, Jean-François Cirelli, ancien vice-président de GDF Suez (devenu Engie) pour diriger et développer ses activités dans l’hexagone, en Belgique et au Luxembourg."
Expansion : Paris extra muros - voyages-d-affaires.com,"Mon, 19 Sep 2016 07:00:00 GMT",https://news.google.com/rss/articles/CBMiTGh0dHBzOi8vd3d3LnZveWFnZXMtZC1hZmZhaXJlcy5jb20vZXhwYW5zaW9uLXBhcmlzLWV4dHJhLW11cm9zLTIwMTYwOTE5Lmh0bWzSAQA?oc=5&hl=en-US&gl=US&ceid=US:en,"Engoncée depuis des siècles derrière ses frondaisons – le boulevard périphérique succédant dans les années 50 aux fortifications de l’enceinte Thiers bâties au milieu du XIXe siècle, elles-mêmes calquées sur les murs des fermiers généraux d’avant la Révolution, –, Paris se met à regarder sa banlieue d’un oeil nouveau. Depuis un moment déjà, les villes limitrophes de la capitale servent de terrains de jeux aux entreprises en quête de nouveaux espaces. Cette extension du domaine des affaires s’exerce notamment dans le Nord-est parisien, à Pantin par exemple, où la maison Hermès a campé ses nombreux bureaux et ateliers depuis 1992. Une implantation qui a permis à la ville de Seine-Saint-Denis de changer peu à peu son profil en attirant plus de diversité et de culture.

Cette ambition s’est véritablement concrétisée à l’automne 2012 avec l’arrivée de la galerie Thaddaeus Ropac, le géant de l’art contemporain salzbourgeois. “Alors qu’il cherchait un endroit où exposer sans contrainte d’espace, beaucoup ont dissuadé Thaddaeus Ropac de s’installer dans cette ancienne chaudronnerie de Pantin, pensant que ça ne marcherait jamais”, explique Laura Bertaux, directrice de la galerie. Pari pourtant largement gagné : le site, qui a accueilli pour son exposition inaugurale les oeuvres monumentales d’Anselme Kiefer, rencontre depuis le succès. D’autant que la galerie est aussi devenue un lieu de festivités, surtout pendant la FIAC. “Nous recevons environ 5 000 personnes par exposition et avons constaté récemment une augmentation de 20 % à 30 % de visiteurs, continue Laura Bertaux. Cela permet de lever la barrière, surtout mentale, qui sépare encore Paris de sa banlieue.”

Pour convaincre les visiteurs tout en leur laissant du temps, les expositions durent désormais six mois. Une fois sur place, ils peuvent tranquillement profiter d’un joli jardin et d’un café récemment doublé d’un restaurant. De plus, la galerie organise des événements interdisciplinaires avec de grandes institutions comme le Centre national de la danse, mais aussi avec l’Ensemble InterContemporain en résidence à la Philharmonie, que l’on rejoint aisément à pied. “La ville a déjà beaucoup changé depuis notre installation en 2012. Un artiste a été chargé d’habiller le tunnel qui nous sépare de la mairie de Pantin ; des boutiques ont ouvert ; la piscine datant des années 30 est en train d’être réaménagée”, dit encore la directrice de la galerie qui invite de nombreux élèves des écoles à venir se sensibiliser à l’art contemporain.

Le processus de gentrification est en cours. L’agence de communication BETC vient de poser ses valises à quelques encablures de là dans les entrepôts réhabilités des anciens Magasins généraux, situés au bord du canal de l’Ourcq. Tandis que les 800 employés apprivoisent peu à peu leur nouveau quartier, une antenne de la Bellevilloise, le lieu culturel et festif parisien, ainsi qu’un marchand de fruits et légumes non calibrés ont pris possession du rez-de-chaussée.

Phénomène similaire à Montreuil, à la lisière de Paris, où les grandes entreprises telles que la BNP, Décathlon ou Ubisoft continuent de s’installer, le plus souvent dans des immeubles verts ou des usines réhabilitées. Entre les maisons en meulière, une micro-brasserie et des ateliers d’artistes, c’est l’un des plus gros quartiers d’affaires du Grand Paris qui a poussé en quelques années, totalisant aujourd’hui plus de 20 000 employés sur 420 000 m2 de bureaux. On comprend pourquoi le restaurant-galerie d’art-showroom Ici Montreuil, installé au sein d’un vaste lieu de coworking et de création collaborative, ne désemplit pas à l’heure du déjeuner. Il est vrai que le concept bobo-bio à 12 euros le menu, pensé par le chef étoilé Bruno Viala et ouvert en janvier, a de quoi faire rêver. Y compris les Parisiens. Et animer toute une zone longtemps peu attirante, mais en passe de le devenir.

HELLO PANTIN

Elle aussi peu séduisante à ses origines, la ZAC Landy-Pleyel, à Saint-Denis, travaille à son attractivité. Certes, elle peine encore à attirer cafés et boutiques, mais devant l’afflux de nouveaux employés, les choses semblent bouger. Cette ancienne friche industrielle de 35 hectares où se sont déjà implantés de grands noms tels Generali, GDF Suez ou Arcelor, a en effet vocation mixte, avec déjà 500 logements. Sa chance : l’éventuelle installation du village olympique au cas où Paris remporterait l’attribution des JO de 2024. Ce qui accélérera d’autant son épanouissement. Si le Nord-Est parisien a été un réel moteur de la redynamisation des banlieues, les abords de Paris comptent désormais plus d’une trentaine de quartiers d’affaires où les sièges sociaux d’entreprises françaises et internationales n’hésitent plus à s’enraciner. Selon l’Institut d’aménagement et d’urbanisme de la région Ile-de-France, un quartier d’affaires se définit d’après plusieurs critères, à commencer par un seuil minimum de 200 000 m2 de bureaux. Il faut aussi que le site, même à vocation mixte, soit constitué à minima de 50 % d’espaces destinés au tertiaire. C’est, on s’en doute, les Hauts-de-Seine, proximité de La Défense oblige, qui affichent la plus forte concentration de quartiers d’affaires de toute la région parisienne avec Nanterre Préfecture, Rueil-sur-Seine, le Point du Jour à Boulogne Billancourt. Toujours dans le 92, cette année a été marquée par l’ouverture à Montrouge du campus du Crédit Agricole “Evergreen”. Prévu pour accueillir 10 000 collaborateurs sur un domaine de huit hectares, il met en lumière le dynamisme économique de la banlieue parisienne.

BUSINESS ET CRÉATIVITÉ

D’autant qu’à l’est de la capitale, il y a aussi du nouveau. Un autre campus, celui de la Société Générale, un site de 90 000 m² de bureaux, viendra ancrer le Val de Fontenay dans sa fonction de quartier d’affaires, avec l’arrivée attendue de 5 500 salariés supplémentaires. Dans le Val-de-Marne également, le quartier des Ardoines, un site de 300 hectares sur le territoire de Vitry-sur-Seine tout près d’Orly, est en passe de devenir un centre économique de taille XXL avec, en tout, 300 000 m2 de bureaux qui hébergeront des entreprises telles qu’EDF, Air Liquide ou Sanofi. Pour autant, Vitry-sur-Seine se positionne aussi comme ville de culture et de créativité, célébrant cette année les dix ans de son fameux musée d’art contemporain, le MAC/VAL. Juste à côté, à Ivry-sur-Seine, ce sont des lieux artistiques plus décalés qui émergent comme le CREDAC, hébergé dans une ancienne manufacture, ou la salle de concert alternative Le Hangar.

Plus éloigné de la capitale, mais constituant un des points forts du Grand Paris, le site Paris-Saclay, dans l’Essonne, est déjà en partie opérationnel. Il deviendra sous peu un pôle scientifique et technologique clé, constitué autour d’établissements d’enseignement parmi les plus prestigieux de France : École polytechnique, Institut Mines-Télécom, AgroParisTech, ENSTA Paris-Tech, ENSAE ParisTech… La livraison finale de ce vaste campus devrait avoir lieu en 2018, même si la ligne 18 du Grand Paris Express qui le desservira ne sera sur les rails qu’à l’horizon 2023.

En attendant de pouvoir essuyer les plâtres du nouveau métro, que faut-il faire alors pour explorer ces quartiers en plein devenir, mais parfois difficiles à rejoindre ? Bonne nouvelle : les Cityscoot, des scooters électriques à prendre et déposer à travers la capitale, ont été mis en service en juin dernier avec une flotte d’un millier de deux-roues qui sera déployée jusqu’en 2017. Moyen nouveau, original, rapide et écolo de partir à la découverte des avancées du Grand Paris.

BLOC-NOTES

Galerie Thaddaeus Ropac, 69, avenue du général Leclerc. Pantin • Tél. : 01 55 89 01 10 • Internet : ropac.net Les docks de la Bellevilloise 1, place de la Pointe. Pantin ICI Montreuil, 135, boulevard Chanzy. Montreuil • Internet : www.icimontreuil.com MAC/VAL, Place de la Libération. Vitry-sur-Seine • Tél. : 01 43 91 64 20 • Internet : www.macval.fr Centre d’art contemporain d’Ivry (le Crédac), La Manufacture des OEillets. 25-29, rue Raspail. Ivry-sur-Seine • Tél. : 01 49 60 25 06 • Internet : www.credac.fr Le Hangar, 3-5, rue Raspail. Ivry-sur-Seine • Tél. : 01 72 04 64 25 • Internet : www.lehangar94.fr"
