Titre,Date de publication,URL,Contenu
L'année où trois groupes du CAC 40 ont été vendus à des étrangers - Le Monde,"Fri, 25 Dec 2015 08:00:00 GMT",https://news.google.com/rss/articles/CBMihgFodHRwczovL3d3dy5sZW1vbmRlLmZyL2Vjb25vbWllL2FydGljbGUvMjAxNS8xMi8yNS9sLWFubmVlLW91LXRyb2lzLWdyb3VwZXMtZHUtY2FjLTQwLW9udC1ldGUtdmVuZHVzLWEtZGVzLWV0cmFuZ2Vyc180ODM4MDA0XzMyMzQuaHRtbNIBAA?oc=5&hl=en-US&gl=US&ceid=US:en,"Le 14 avril, le président François Hollande recevait à l’Elysée Michel Combes (au centre), alors PDG d’Alcatel-Lucent, et Rajeev Suri, le patron du groupe finlandais Nokia, acquéreur de l’entreprise tricolore. PHILIPPE WOJAZER / AFP

Trois de chute en un an ! L’année 2015 restera dans les annales comme celle où trois groupes du CAC 40 – Lafarge, Alstom et Alcatel-Lucent – seront passés sous contrôle étranger. Une première dans l’histoire du capitalisme français.

Certains y voient une preuve de l’attractivité de la France pour les investisseurs du monde entier. Aux yeux de Patrick Kron, le patron d’Alstom, ce type de cessions constitue surtout dans bien des cas la meilleure solution pour assurer la pérennité d’activités fragiles. « Avoir un emploi durable est plus important que la nationalité de l’employeur », a-t-il plaidé, fier que l’acquéreur d’Alstom ait promis des créations de postes.

Pour beaucoup, cependant, ces opérations sont surtout révélatrices des faiblesses de l’industrie bleu-blanc-rouge. « Elles confirment le décrochage, juge l’économiste Elie Cohen. Le phénomène touche à présent les grands groupes, dont la vitalité a longtemps masqué la dévitalisation industrielle du pays. »

La France est devenue une cible

Loïk Le Floch-Prigent est encore plus sévère. « Il est indigne de présenter ces défaites comme des victoires – comme si le pseudo-armistice signé par le maréchal Pétain ne nous avait pas suffi ! », s’énerve l’ancien patron d’Elf et de la SNCF dans son livre La Bataille de l’industrie (éditions Jacques-Marie Laffont, 260 pages, 19,90 euros), à paraître en janvier 2016. A ses yeux, le sort d’Alstom, de Lafarge et d’Alcatel marque « la casse de l’industrie », son « écrasement », alors que la France a plus que jamais « besoin de champions nationaux ».

Longtemps, les grands groupes qui assurent l’armature de l’économie nationale ont été des conquérants plus que des cibles. Ils se muaient en multinationales à coups de « prises de guerre » parfois spectaculaires, comme Universal pour Vivendi, Square D pour Schneider, ou plus récemment Genzyme pour Sanofi. En sens inverse, les cessions de grandes entreprises à des investisseurs étrangers restaient exceptionnelles. A chaque fois, elles étaient vécues comme des traumatismes nationaux, à l’image du rachat de Pechiney par le canadien Alcan en 2003, puis de l’offre publique d’achat (OPA) hostile de Mittal sur Arcelor en 2006.

Aujourd’hui, les entreprises françaises réalisent toujours de 50 % à 60 % plus d’acquisitions hors des frontières que les groupes étrangers n’en concluent dans l’Hexagone. Mais il s’agit surtout d’opérations de petite ou de moyenne taille. Les très grandes conquêtes tricolores, elles, se font rares, même si l’achat, annoncé en novembre, de l’américain Airgas par Air Liquide pour 12,5 milliards d’euros montre que la flamme n’est pas éteinte. De leur côté, les géants étrangers n’hésitent plus à mettre la main sur des poids lourds français. Y compris au sein du CAC 40.

Lire aussi Air liquide redevient le numéro un mondial des gaz industriels Ajouter à vos sélections

Résultat : en montant investi, la situation s’est inversée. En deux ans, depuis le début 2014, les entreprises étrangères ont consacré 145 milliards d’euros à leurs emplettes en France, selon les pointages de Mergermarket arrêtés au 15 décembre. Les sociétés tricolores n’ont dépensé, dans le même temps, que 88 milliards d’euros en acquisitions hors des frontières. Contrairement à ce qui prévalait jusqu’en 2013, la France est donc devenue avant tout une cible.

Plus vraiment des « fleurons »

Pour Lafarge et Alstom, le coup est parti depuis un an et demi. En avril 2014, Lafarge et son concurrent suisse Holcim, les deux leaders mondiaux du ciment, ont dévoilé un accord visant à créer le champion du secteur dans le cadre d’une « fusion entre égaux ». Quinze jours plus tard, à la suite d’une fuite, Alstom reconnaissait négocier la vente de l’essentiel de ses activités – toutes celles dans l’énergie – au premier des conglomérats américains, General Electric (GE).

Le Monde Guides d’achat Gourdes réutilisables Les meilleures gourdes pour remplacer les bouteilles jetables Lire

Dans les deux cas, l’opération a mis du temps à aboutir, et a failli être remise en question. Côté ciment, la fable du mariage entre égaux n’a pas résisté longtemps. D’emblée, il était clair que dans ce projet conçu par les grands actionnaires des deux groupes, la balance penchait en faveur des Suisses. Mais, début 2015, alors que l’affaire paraissait avancer sans encombre, les cours de Bourse des deux fiancés ont divergé, compte tenu des moindres performances de Lafarge. Sous la pression des investisseurs et des dirigeants d’Holcim, il a alors fallu renégocier l’accord de fond en comble. Le PDG de Lafarge a été écarté, tandis que le poids des actionnaires d’Holcim était porté à 55 % dans le capital du nouveau mastodonte. En Suisse, depuis la conclusion de l’opération en juillet, la direction d’Holcim ne cache plus sa satisfaction : ce « petit pays » compte désormais « un grand groupe » de plus.

La vente de l’essentiel d’Alstom à GE a elle aussi menacé de dérailler. Hostile au projet, dont il n’avait pas été averti, Arnaud Montebourg, alors ministre de l’économie, a tenté d’ouvrir le jeu au nom de l’Etat actionnaire. L’allemand Siemens et le japonais Mitsubishi ont pu remettre ensemble une offre concurrente. La Commission européenne a aussi eu son mot à dire et imposé des cessions d’actifs pour éviter la constitution d’une position dominante. Au bout du compte, c’est seulement en novembre 2015 que GE a officiellement pris le contrôle des activités d’Alstom dans l’énergie, pour 9,7 milliards d’euros.

Lire aussi Alstom-GE : l’aboutissement de dix-huit mois de tractations Ajouter à vos sélections

Après ces deux dossiers sensibles, la vente d’Alcatel-Lucent est passée sans encombre. L’Etat n’a rien trouvé à redire à la cession, au finlandais Nokia, du groupe issu de la puissante Compagnie générale d’électricité (CGE). Le ministre de l’économie, Emmanuel Macron, a même salué la naissance d’« un futur grand champion européen » des équipements téléphoniques. Seule la généreuse prime de départ accordée au PDG d’Alcatel pour avoir vendu son entreprise a fait scandale, au point d’être finalement divisée par deux par le conseil d’administration. Nokia prévoit de boucler l’acquisition début 2016.

Dans les trois cas, en réalité, les groupes concernés n’avaient plus de « fleurons » que le nom. Tous se retrouvaient face à de sérieux dilemmes stratégiques. Dans un marché européen de l’énergie en pleine déconfiture, Alstom s’estimait en position de faiblesse, avec une part de marché minime par rapport à des conglomérats bien mieux armés, comme Siemens ou GE. Situation encore plus grave pour Alcatel, qui cumulait les problèmes : mariage douloureux avec l’américain Lucent, manque de taille critique, virage technologique raté vers l’Internet mobile 3G. A la clé, neuf exercices déficitaires en dix ans !

Lire aussi La Commission européenne autorise le rachat d’Alcatel-Lucent par Nokia Ajouter à vos sélections

Le cas de Lafarge était moins dramatique. Mais le numéro deux mondial du ciment était lui aussi pénalisé par une grosse acquisition, celle de l’égyptien Orascom, qui avait gonflé son endettement et freiné ses marges de manœuvre peu de temps avant que la crise ne fasse plonger ses marchés.

Alcatel, Alstom, Rhodia, Arcelor, Pechiney, Bull, Areva… « La France de l’après-guerre a été marquée par la constitution de champions nationaux qui ont joué un rôle-clé dans l’essor du pays, analyse Elie Cohen. Ils ont été nationalisés, puis privatisés, et se sont développés à travers le monde. Aujourd’hui, ces emblèmes colbertistes tombent les uns après les autres. » La faute, au moins en partie, à une politique économique qui a dégradé la compétitivité de l’industrie et n’a pas poussé suffisamment les entreprises à investir. Faute de fonds de pension, les sociétés françaises ont aussi souffert d’un manque chronique de fonds propres.

Le tissu industriel s’effiloche

Le mouvement ne serait pas spécialement alarmant si la France avait été capable, dans le même temps, de faire émerger de nouveaux champions. Ce n’est pas le cas. « Nous avons été très créatifs en matière de start-up dans le numérique ou les biotechnologies, relève M. Cohen. Mais aucune d’elles n’est devenue un grand groupe. »

Le résultat ? Il y a vingt ans, la CGE, alors rebaptisée Alcatel-Alsthom, rivalisait avec Siemens. Aujourd’hui, Siemens est toujours là, quand Alcatel est en passe de devenir finlandais et l’essentiel d’Alstom, américain. La France garde quelques points forts, en particulier dans le luxe et l’aéronautique. Mais l’ensemble du tissu industriel s’effiloche de plus en plus dangereusement."
"Première station hydrogène inaugurée à Paris - Ville, Rail et Transports","Mon, 07 Dec 2015 08:00:00 GMT",https://news.google.com/rss/articles/CBMiYmh0dHBzOi8vd3d3LnZpbGxlLXJhaWwtdHJhbnNwb3J0cy5jb20vbW9iaWxpdGUvMjI1MDctcHJlbWllcmUtc3RhdGlvbi1oeWRyb2dlbmUtaW5hdWd1cmVlLWEtcGFyaXMv0gEA?oc=5&hl=en-US&gl=US&ceid=US:en,"A l’occasion de la COP21, Air Liquide a inauguré sa première station de recharge d’hydrogène sur le parking du pont de l’Alma, en présence de la maire de Paris, qui soutient cette innovation. D’ici quelques jours, elle servira à alimenter les cinq taxis, des modèles ix35 de Hyundai de la start-up Hype. Cette société envisage de posséder une flotte de 70 taxis électriques roulant à l’hydrogène dans un an, et plusieurs centaines d’ici cinq ans. « On veut offrir une gamme très très large à la mobilité sans s’enfermer dans un choix technologique, afin de tourner le dos aux énergies fossiles et notamment au diesel », a rappelé Anne Hidalgo. Air Liquide, « qui maîtrise toute la chaîne d’approvisionnement en hydrogène, a déjà livré 75 stations similaires dans le monde entier », a expliqué Benoît Potier, son PDG. Estimant qu’il s’agit « d’une vraie étape dans le développement de la filière hydrogène », il a ajouté qu’« au moins trois stations devraient ouvrir en 2016 aux portes de Paris ». La station est compacte et mobile. Elle permet de recharger la pile à combustible du véhicule en moins de cinq minutes, pour une autonomie allant jusqu’à 500 km."
Voiture à hydrogène : des centaines de taxis électriques à Paris - breezcar.com,"Tue, 01 Dec 2015 08:00:00 GMT",https://news.google.com/rss/articles/CBMiYWh0dHBzOi8vd3d3LmJyZWV6Y2FyLmNvbS9hY3R1YWxpdGVzL2FydGljbGUvdm9pdHVyZS1oeWRyb2dlbmUtdGF4aXMtZWxlY3RyaXF1ZXMtcmVnaW9uLXBhcmlzLTEyMTXSAWdodHRwczovL3d3dy5icmVlemNhci5jb20vYWN0dWFsaXRlcy9hcnRpY2xlL3ZvaXR1cmUtaHlkcm9nZW5lLXRheGlzLWVsZWN0cmlxdWVzLXJlZ2lvbi1wYXJpcy0xMjE1P2FtcD0x?oc=5&hl=en-US&gl=US&ceid=US:en,"D’ici 2020, plusieurs centaines de taxis électriques dopés à l’hydrogène rouleront sur les routes de la région Ile-de-France. Les 5 premiers véhicules vont très prochainement être mis en service et la première station de distribution d’hydrogène installée dans Paris vient d’être inaugurée.

Après le 100 % électrique, Paris soutient l’hydrogène

La ville de Paris se montre généreuse avec les véhicules à motorisations alternatives. Après avoir soutenu l’achat de modèles hybrides par les chauffeurs et les compagnies de taxis, la municipalité offre désormais une généreuse aide pour l’acquisition de modèles 100 % électriques (jusqu’à 13 700 euros). Et pour accélérer la transformation du parc, la ville s’apprête à installer plusieurs dizaines de bornes de recharge accélérée (1h30) et rapide (30 mn). Malgré tous ces efforts, les taxis électriques croisés dans les rues de la capitale sont rares, au contraire de villes comme Amsterdam (Pays-Bas) ou Budapest (Hongrie).

Une première station intra-muros au pont de l’Alma

Pourtant, la ville qui accueille la 21e conférence annuelle sur le climat (COP21) depuis le 30 novembre pourrait devenir la capitale européenne de la voiture à hydrogène. Sur les 5 prochaines années, la Société du Taxi Electrique Parisien (STEP) devrait déployer plusieurs centaines de véhicules équipés de pile à combustible. Après avoir misé sans succès sur une flotte de modèles 100 % électriques, la STEP réoriente sa stratégie en faisant le choix de l’hydrogène. Dans les prochaines semaines, 5 Hyundai ix35 FCEV intégreront donc sa flotte et pourront faire le plein sur la première station qui vient d’être inaugurée par Air Liquide sur le Cours Albert Ier, sur le parking du Pont de l’Alma.





Une flotte de 75 véhicules à hydrogène d’ici la fin 2016

D’ici la fin 2016, plus de 70 véhicules à hydrogène seront intégrés à la flotte de la STEP. Un chiffre qui, s’il se concrétise, constituera une première mondiale. Dotés d’une autonomie moyenne de 450 km, les Hyundai ix35 FCEV – des crossovers reposant sur l’ancienne génération du Tucson – se rechargent en moins de 5 minutes sur une station publique délivrant du dihydrogène sous pression (700 bars). Présent sur 14 marchés, le ix35 FCEV est commercialisé en France au prix de 59 700 euros, bonus « écologique » de 6 300 euros déduit. Premier véhicule à hydrogène de série, le crossover sud-coréen a déjà été adopté par le Conseil Départemental de la Manche qui a fait l’acquisition de 5 unités."
"Gaz, fumée, brouillard : quelles différences ? - Futura","Fri, 18 Dec 2015 08:00:00 GMT",https://news.google.com/rss/articles/CBMia2h0dHBzOi8vd3d3LmZ1dHVyYS1zY2llbmNlcy5jb20vc2NpZW5jZXMvcXVlc3Rpb25zLXJlcG9uc2VzL3BoeXNpcXVlLWdhei1mdW1lZS1icm91aWxsYXJkLWRpZmZlcmVuY2VzLTYzNTcv0gEA?oc=5&hl=en-US&gl=US&ceid=US:en,"Le gaz, un état de la matière

Le gaz est un état de la matière constitué d'atomes ou de molécules très faiblement liés, presque indépendants. Un gaz n'a ni forme, ni volume propres.

Ainsi, la vapeur d’eau est la forme gazeuse de l'eau liquideliquide. Elle est totalement invisible et ne doit être confondue ni avec une fumée, ni avec un brouillardbrouillard.

La fumée, conséquence d’un feu

La fumée est composée de fines particules solidessolides (de la suiesuie, des cendres, etc.) qui sont émises par un feufeu ou lors d'un échauffement mécanique.

Lors d'un incendie, la fumée qui se dégage est tout aussi dangereuse que le feu en lui-même. D'abord, parce qu'elle diminue la visibilité. Ensuite, parce qu'elle peut provoquer des brûlures internes ou des intoxications si elle est inhalée.

La fumée de cigarette transporte également des substances nocives.

Le brouillard, un phénomène météorologique

Le brouillard, enfin, est constitué, tout comme les nuagesnuages, d'une multitude de fines gouttelettes d'eau liquide en suspension dans l'airair ou, parfois, de cristaux de glace et de particules solides de taille microscopique. Le tout a le don de réduire plus ou moins fortement la visibilité au sol.

Ainsi, les météorologistes ne parlent de brouillard que lorsque la visibilité est inférieure à un kilomètre. Sinon, ils emploient le terme de brumebrume."
BiotechMarine. Les algues dans ses gènes - Le Télégramme,"Tue, 29 Dec 2015 08:00:00 GMT",https://news.google.com/rss/articles/CBMiamh0dHBzOi8vd3d3LmxldGVsZWdyYW1tZS5mci9jb3Rlcy1kLWFybW9yL2d1aW5nYW1wLTIyMjAwL2Jpb3RlY2htYXJpbmUtbGVzLWFsZ3Vlcy1kYW5zLXNlcy1nZW5lcy0zNDE4OC5waHDSAQA?oc=5&hl=en-US&gl=US&ceid=US:en,"BiotechMarine, cela ne vous dit rien ? Et pour cause, cette filiale du groupe Seppic (*), installée dans la zone industrielle de Pontrieux, n'a pas de liens directs avec les consommateurs. Pourtant, ses produits se retrouvent dans nos crèmes, nos shampooings, notre rouge à lèvres ou encore notre mascara. Ils font du bien à notre peau : ils l'hydratent, l'éclaircissent, la pigmentent, la protègent du vieillissement ou de la pollution. Ce sont ce qu'on appelle des actifs, dans le jargon de la cosmétique, intégrés dans des formules. BiotechMarine a une spécificité supplémentaire : ses actifs sont fabriqués exclusivement à partir d'algues et de plantes marines (criste marine, Eryngium maritimum, etc.), et ce depuis 1988. Ce créneau précurseur à l'époque est en plein essor aujourd'hui, avec l'engouement pour le naturel.

Un environnement très porteur

BiotechMarine profite de la richesse algale de la Bretagne notamment autour de l'île de Bréhat, s'appuie sur les ressources scientifiques locales (CNRS à Roscoff, Ceva à L'Armor-Pleubian), et son savoir-faire pour développer ses fameux extraits (une quarantaine). La société qui compte 40 salariés, mise fortement sur la recherche et le développement ; elle vient d'ailleurs d'embaucher deux chercheurs en octobre. « Nos clients exigent beaucoup d'innovations dans la cosmétique. Il faut toujours mettre de nouvelles choses en avant », commente Guénolé Le Calvez, le directeur général, très fier des biotechnologies développées à Pontrieux.

Au top mondial de la culture en labo

La dernière en date est une technologie de culture en laboratoire. « On multiplie en labo des cellules végétales ou de macroalgues dans des bioréacteurs, vulgarise Guénolé Le Calvez, avec passion. Nous sommes les premiers au monde à faire de la culture de cellules de macroalgues ; cela nous a demandé sept ans de recherche. Nous avons déposé deux brevets au niveau mondial et un troisième est en cours. » BiotechMarine vient d'ailleurs d'investir lourdement dans une extension de sa capacité de production : de nouveaux bioréacteurs devraient être opérationnels début janvier. Mais quel est donc l'intérêt de cette technologie émergente ? Offrir des molécules surpuissantes, hyperactives, sous forme de poudre ? Guénolé Le Calvez choisit ses mots, plus scientifiques : « Nous savons générer par les procédés biotechnologiques de culture en laboratoire un contenu moléculaire différent de celui de la plante marine ou de l'algue qui pousse à l'état naturel. Nous savons sur-exprimer certaines molécules, comme par exemple des anti-oxydants qui ont des activités très intéressantes pour la peau. »

L'export en plein boom

Cela va s'en dire que cette technologie, complémentaire de celle de l'extraction à partir d'algues fraîches, booste la croissance de BiotechMarine sur un marché de la cosmétique en plein développement dans les pays émergents (La Chine, l'Inde, le Brésil, l'Indonésie). « Nous réalisons 15 % de notre chiffre d'affaires en France et 85 % à l'export, précise le directeur général. Et cette tendance s'accroît grâce à l'implantation de Seppic à l'étranger. On a notamment accès à ses 2.000 clients en Chine. » Le succès semble appeler le succès. Certains clients n'hésitent pas à venir de Chine ou des États-Unis pour photographier les algues et les chercheurs. BiotechMarine est aussi un outil de marketing. * Filiale du groupe Air Liquide au sein de l'activité Santé, Seppic conçoit et fournit depuis plus de soixante-dix ans des ingrédients de spécialités - excipients et actifs - dédiés aux marchés de la cosmétique, de la pharmacie, des vaccins et de la nutrition."
