Titre,Date de publication,URL,Contenu
Un astronaute échappe de peu à une noyade dans l'espace - franceinfo,"Thu, 22 Aug 2013 07:00:00 GMT",https://news.google.com/rss/articles/CBMiaGh0dHBzOi8vd3d3LmZyYW5jZXR2aW5mby5mci9zY2llbmNlcy91bi1hc3Ryb25hdXRlLWVjaGFwcGUtZGUtcGV1LWEtdW5lLW5veWFkZS1kYW5zLWwtZXNwYWNlXzM5NTM3NC5odG1s0gEA?oc=5&hl=en-US&gl=US&ceid=US:en,"Luca Parmitano a été victime d'une fuite d'eau dans son casque, alors qu'il effectuait une promenade dans l'espace. Il le raconte sur son blog.

""La sensation inattendue d'avoir de l'eau sur la nuque me surprend."" L'astronaute italien de la Station spatiale internationale (ISS) Luca Parmitano raconte, sur son blog (en italien) mercredi 21 août, l'épisode terrifiant d'une promenade dans l'espace qu'il a dû interrompre à la mi-juillet, à cause de la présence d'eau dans son casque.

Frayeur dans la Station Spatiale internationale (Arnaud Comte et David Levy - France 2 )

Voici des extraits du récit de Luca Parmitano, qui se trouve toujours sur l'ISS.

La sensation ""que l'eau augmente""

L'incident s'est produit le 16 juillet. ""Je sens tout à coup que la température du liquide est trop froide pour être de la sueur et j'ai la sensation distincte qu'elle s'accroît en volume"", raconte l'astronaute, âgé de 36 ans. Il parvient ensuite à informer l'astronaute américain Chris Cassidy et la base de Houston. Celle-ci lui donne l'ordre de mettre un terme à la sortie.

Mais alors que Luca Parmitano repart vers l'ISS, ""la sensation que l'eau augmente devient une certitude"". Il la sent qui recouvre les écouteurs et se demande s'il ne perdra pas le contact audio avec ses camarades. ""L'eau recouvre presque toute la partie frontale du viseur à laquelle elle adhère, réduisant d'autant ma vision"", se souvient-il.

""Je ne sais pas si la prochaine fois je respirerai""

A un certain moment, pendant son pénible retour vers la station, Luca Parmitano se retrouve avec toute ""la partie supérieure du casque désormais pleine d'eau"". ""Je ne sais pas si la prochaine fois que je respirerai, je réussirai à me remplir les poumons d'air ou de liquide"", poursuit-il, alors qu'il progresse vers l'ISS en ne voyant qu'à quelques centimètres de distance.

Heureusement, Luca Parmitano parvient à s'accrocher au câble de sécurité qui le relie à la station. ""Je m'impose de rester calme et avec patience je cherche en tatonnant les poignées [du sas de recompression] tout en pensant en parallèle à comment faire pour éliminer l'eau si elle devait arriver à la bouche"", explique-t-il. Il pense à éventuellement ouvrir la valve de sécurité près de l'oreille gauche qui pourrait créer une ""dépressurisation contrôlée"", même si ""créer une 'brèche' dans la combinaison spatiale est la dernière carte à jouer"".

""L'espace est une frontière, dure et inhospitalière""

Parvenu après quelques minutes ""qui semblent durer une éternité"" au sas entre la station proprement dite et l'espace, Luca Parmitano, pendant la repressurisation : ""Si l'eau devait me submerger, je pourrais toujours ouvrir le casque : probablement que je perdrais conscience mais ce serait toujours mieux que me noyer dans le casque."" La repressurisation terminée, sain et sauf, il peut enfin rejoindre ses compagnons à l'intérieur de la station.

""L'espace est une frontière, dure et inhospitalière, où nous ne sommes encore que des explorateurs et pas des colons. L'excellence de nos ingénieurs et la technologie à disposition nous font sembler simples des choses qui ne le sont pas, ce que parfois nous oublions"", conclut l'astronaute.

A la suite de cet incident, toutes les sorties dans l'espace sont suspendues jusqu'à nouvel ordre. Jean-François Clervoy, astronaute à l'Agence spatiale européenne, explique à France 2 que c'est un incident inédit.

Jean-François Clervoy, astronaute (Arnaud Comte et David Levy - France 2)

Les experts de la Nasa ont lancé deux enquêtes différentes sur l'incident, sans réussir pour le moment à en déterminer la cause. Ils penchent pour l'instant pour une fuite dans le système de redroidissement de sa tenue."
La terrifiante promenade spatiale interrompue d'un astronaute italien - Midi Libre,"Wed, 21 Aug 2013 07:00:00 GMT",https://news.google.com/rss/articles/CBMidGh0dHBzOi8vd3d3Lm1pZGlsaWJyZS5mci8yMDEzLzA4LzIxL2xhLXRlcnJpZmlhbnRlLXByb21lbmFkZS1zcGF0aWFsZS1pbnRlcnJvbXB1ZS1kLXVuLWFzdHJvbmF1dGUtaXRhbGllbiw3NDc3MDkucGhw0gEA?oc=5&hl=en-US&gl=US&ceid=US:en,"L'astronaute italien Luca Parmitano raconte sur son blog l'épisode terrifiant d'une promenade dans l'espace interrompue à cause de la présence d'eau dans son casque.

L'astronaute italien Luca Parmitano qui se trouve toujours sur la station internationale ISS a raconté sur son blog mercredi l'épisode terrifiant d'une promenade dans l'espace qu'il avait dû interrompre à la mi-juillet à cause de la présence d'eau dans son casque.

L'incident encore inexpliqué s'est produit le 16 juillet une heure et demi après le début de la deuxième sortie dans l'espace de l'astronaute envoyé sur l'ISS (Station spatiale internationale) par l'Agence spatiale européenne. ""La sensation inattendue d'avoir de l'eau sur la nuque me surprend et je suis dans un endroit où je préfèrerais n'avoir aucune surprise"", a raconté Parmitano sur son blog.

Quand l'eau augmente

Il explique avoir averti son compagnon de sortie, l'astronaute américain Chris Cassidy et la base de Houston. ""Je sens tout à coup que la température du liquide est trop froide pour être de la sueur et j'ai la sensation distincte qu'elle s'accroît en volume"", poursuit l'astronaute âgé de 36 ans dans son stupéfiant récit. Il parvient à informer Cassidy et la base d'Houston qui lui donne l'ordre de mettre un terme à la sortie.

Mais alors qu'il repart vers l'ISS, ""la sensation que l'eau augmente devient une certitude"". Il la sent qui recouvre les écouteurs et se demande s'il ne perdra pas le contact audio avec ses camarades. ""L'eau recouvre presque toute la partie frontale du viseur à laquelle elle adhère, réduisant d'autant ma vision"", se souvient-il. A un certain moment, pendant son pénible retour vers la station, il se retrouve avec toute ""la partie supérieure du casque désormais pleine d'eau"". ""Je ne sais pas si la prochaine fois que je respirerai, je réussirai à me remplir les poumons d'air ou de liquide"", poursuit-il, alors qu'il progresse vers l'ISS en ne voyant qu'à quelques centimètres de distance.

Heureusement il se souvient à un moment du câble de sécurité qui le relie à la station et ""le tire"" vers la gauche. ""Je m'impose de rester calme et avec patience je cherche en tâtonnant les poignées (du sas de recompression ndlr) tout en pensant en parallèle à comment faire pour éliminer l'eau si elle devait arriver à la bouche"", explique-t-il. Il pense à éventuellement ouvrir la valve de sécurité près de l'oreille gauche qui pourrait créer une ""dépressurisation contrôlée"", même si ""créer une 'brèche' dans la combinaison spatiale est la dernière carte à jouer"".

Parvenu après quelques minutes ""qui semblent durer une éternité"" à l'""airlock"", le sas entre la station proprement dite et l'espace, il pense pendant la repressurisation: ""si l'eau devait me submerger, je pourrais toujours ouvrir le casque: probablement que je perdrais conscience mais ce serait toujours mieux que me noyer dans le casque"". La repressurisation terminée, Luca Parmitano, sain et sauf, peut enfin rejoindre ses compagnons à l'intérieur de la station.

L'espace, ""une frontière, dure et inhospitalière""

""L'espace est une frontière, dure et inhospitalière, où nous ne sommes encore que des explorateurs et pas des colons. L'excellence de nos ingénieurs et la technologie à disposition nous font sembler simples des choses qui ne le sont pas, ce que parfois nous oublions"", conclut l'astronaute.

Les experts de la NASA ont lancé deux enquêtes différentes sur l'incident sans réussir pour le moment à en déterminer la cause. Ils pensent qu'il pourrait s'agir d'une fuite dans le système de redroidissement de sa tenue plutôt que dans la canule d'alimentation en eau potable reliée à son casque. Toutes les sorties dans l'espace sont suspendues jusqu'à nouvel ordre."
Nouveautés 2014 | Harley Davidson | La gamme CVO - motoservices.com,"Fri, 30 Aug 2013 07:00:00 GMT",https://news.google.com/rss/articles/CBMikQFodHRwczovL3d3dy5tb3Rvc2VydmljZXMuY29tL2FjdHVhbGl0ZS1tb3RvL25vdXZlYXV0ZXMtMjAxNC1oYXJsZXktZGF2aWRzb24tQ1ZPLWJyZWFrb3V0LXJvYWRraW5nLXNvZnRhaWxzLWRlbHV4ZS1lbGVjdHJhLWdsaWRlLXVsdHJhLWxpbWl0ZWQuaHRt0gEA?oc=5&hl=en-US&gl=US&ceid=US:en,"Après la superbe Breakout que nous avons grandement appréciée, Harley fait évoluer la gamme CVO, ses motos d'exception. Composée des CVO Breakout, CVO Road King, CVO Softail Deluxe et CVO Electra Glide Ultra Limited, la lignée des ""Custom Vehicle Operations"" voit surtout arriver dans ses rangs 4 modèles en édition limitée. Equipement sublime, peintures magnifiques, les CVO sont des motos qui dégagent quelque chose d'unique. Le Softail Deluxe met en avant ses hautes performances, tandis que deux modèles Touring, the Road King et l'Electra Glide Ultra Limited tirent parti des évolutions développées dans le cadre du Projet Rushmore, que nous vous présentons ci-après. Outre un look des plus léché et un souci du détail poussé à l'extrême, un CVO 2014 se reconnaît aussi grâce à son nouveau moteur, le bicylindre de 1690 cm3 baptisé ""Twin Cam 103"". Ce dernier propose un double refroidissement, permettant de gérer la température du bloc autour des bouches d'échappement. Les CVO Ultra Limited disposent ainsi d'un refroidissement mi-air, mi-liquide intégré au moteur de manière totalement invisible. De quoi réduire la production de chaleur de manière à moins se brûler les cuisses aux feux en agglomération et lorsque l'on roule à basse vitesse ? Seul un essai le dira. Pour l'instant, notons Le taux de compression augmenté, la nouvelle boîte à air à plus gros débit pour faire respirer le moteur et offrir une sonorité toujours plus rauque. Niveau performances, ces dernières sont promises à la hausse, tout comme le couple. Un effet ressenti apporté notamment par une nouvelle came moteur. Le 103 dispose d'un cinquième rapport plus court, ce que l'on ressent principalement de 95 à 130 km/h. De quoi permettre des dépassements plus vifs. Le ticket d'entrée ? 29.300 € et jusqu'à 39.000 € pour la Ultra Limited...

> Notre essai de la CVO Breakout

> Les tarifs Harley Davidson 2014

Le projet RushMore

""Projet RUSHMORE. Constuit par nous, pour nous."" Voici comment nous est présenté ce nouveau projet Harley-Davidson, issu de l'expérience accumulée lors de très nombreux roulages en compagnie des conducteurs de Harley. Trois points essentiels ont guidé le projet : ""doubler plus vite, freiner plus vite, voir mieux"". Du coup, la motorisation a évolué afin d'offrir des reprises plus efficaces encore, mais surtout, le freinage a fait un bond en avant. Baptisé ""Reflex"", ce dernier est bien entendu ABS, mais aussi couplé. Ce qui, avouons-le, n'est pas un mal pour une HD. Niveau visibilité, aucun doute, les efforts ont porté leur fruit. Il n'y a qu'à voir les optiques avant à feux diurnes intégrés, lesquels sont d'un design et d'une efficacité redoutables. Sobrement et modestement baptisés ""Daymaker"" (faiseur de jour...), le dispositif mêle LED et deux feux halogène pour offrir une puissance et une qualité d'éclairage du top niveau. Essentielle pour rouler dans de bonnes conditions, de jour comme de nuit.

Les modèles Rushmore sont également équipés d'un système de navigation et de communication dernier cri, lequel dispose d'un écran tactile de 6,5 pouces pour assurer les fonctions audio, communication et GPS. Un must en perspective !

> Le projet Rushmore en images et en vidéo (Harley Davidson)



"
