Titre,Date de publication,URL,Contenu
AirGas presents much needed supplies to New London Welding Program - Southeast Iowa Union,"Thu, 31 Aug 2023 07:00:00 GMT",https://news.google.com/rss/articles/CBMihwFodHRwczovL3d3dy5zb3V0aGVhc3Rpb3dhdW5pb24uY29tL3NlLWlvd2EtdW5pb24tbmV3LWxvbmRvbi1qb3VybmFsL2Fpcmdhcy1wcmVzZW50cy1tdWNoLW5lZWRlZC1zdXBwbGllcy10by1uZXctbG9uZG9uLXdlbGRpbmctcHJvZ3JhbS_SAQA?oc=5&hl=en-US&gl=US&ceid=US:en,"Proudly holding the AirGas pennant, Jared Flynn, Account Manager, students from Welding and Building Trades, and Matt May, Industrial Technology teacher welcome the donation of $3000 worth of consumables and equipment. AirGas supports welding programs all over the country.

Monday, Aug. 28, Jared Flynn, Sales Representative from Fairfield, AirGas Store presented The New London High School Welding Program with much needed consumables and equipment.

The Regional Manager has planned to attend but was called away at the last minutes Airgas, an Air Liquide Company, selected New London High School to receive these supplies as part of the Airgas High School Welding Education Initiative.

The Airgas Initiative provides material donations and educational support to schools such as NLHS. These efforts to support underserved high school welding programs across the nation.

Matthew May, New London’s Industrial Technology Teacher, students from the Welding and Building Trades classes, and Scott Kracht, Principal were on hand to welcome Mr.an Flynn.

Mr. May noted that there are many grant opportunities for the welding stations and large equipment, but the AirGas donation is extremely important.

Their $3000 donation of items needed to run a shop such as welding gases. rods and many smaller items are critical. Students must have these items to learn and practice the workday skills needed to become a professional welder.

The term “consumable” seems innocuous, but a high school program’s budget can be stretched thin by these daily costs. AirGas plays a vital role by providing these items.

Keeping up with job opportunities for young people is an important part of Mr. May’s work.

He noted that thousands of welding positions (315,250 to be exact) are expected to open in the next few years.

Since 2018, Airgas has assisted 72 schools, 4,200 welding students and nearly 450 instructors across the country.

In the past two years combined, more than 250 students obtained welding jobs directly after graduating from a school program supported by Airgas donations.

New London is planning to create an interest in welding careers among its students and to prepare them for entrance into a much-needed profession.

Airgas is a leading U.S. supplier of industrial, medical and specialty gases, as well as hardgoods and related products. AirGas has two distributors in Southeast Iowa, Fairfield (industrial) and West Burlington (medical).

Mr. May has worked with the Fairfield office and Mr. Flynn for a number of years.

Although Mr. May has lived in New London since 2016, he joined NLHS in 2022 as an instructor.

He taught at Keokuk HS. A grant he wrote while at Keokuk was awarded equipment and consumables in 2022.

Upon arriving in New London, Mr. May, with the encouragement of Mr. Flynn, wrote another AirGas request for help.

Now in the academic year 2023 he will experience firsthand the benefits of this outstanding national program.

In 2023 AirGas High School Welding Education Initiative awarded 55 schools to be part of the program.

Fourteen returning schools and 41 new schools from 22 states are participating. New London is the only Iowa school to be selected for the AirGas Program in 2023.

There are four key factors guiding the selection of welding programs: high unmet need at the school, a productive welding program with the potential to graduate job-ready welders; passionate teachers; and enthusiastic local Airgas champions.

Once selected, underserved high school technology programs are supported by Airgas welding and safety specialists and associates who volunteer their time and expertise.

Students, Mr. Kracht, and Mr. May help unload the pickup that arrived at 9 a.m. at the Industrial Arts Building. Jared Flynn had loaded the back seat and the bed with the AirGas donated items.

It is exciting to see emphasis placed on the trades.

Mr. May is also a carpenter and adds his proficiency by introducing students to this trade as well as welding.

Many small communities are noticing how difficult it is to find help with their homes and businesses. There is a shortage in all the trades as the Baby Boomers retire.

The New London district is looking forward to helping its students find success in entering the workforce in their chosen occupation."
Airgas Donates Nearly $2.0M of PPE to Emergency Preparedness Organizations - Business Wire,"Mon, 28 Aug 2023 07:00:00 GMT",https://news.google.com/rss/articles/CBMiggFodHRwczovL3d3dy5idXNpbmVzc3dpcmUuY29tL25ld3MvaG9tZS8yMDIzMDgyODE4NzQwNS9lbi9BaXJnYXMtRG9uYXRlcy1OZWFybHktMi4wTS1vZi1QUEUtdG8tRW1lcmdlbmN5LVByZXBhcmVkbmVzcy1Pcmdhbml6YXRpb25z0gEA?oc=5&hl=en-US&gl=US&ceid=US:en,"Airgas, an Air Liquide company, donated PPE items to local emergency preparedness and disaster response organizations for response to emergencies or natural disasters like wildfires, hurricanes, tornadoes, earthquakes, and flooding.

Airgas, an Air Liquide company, donated PPE items to local emergency preparedness and disaster response organizations for response to emergencies or natural disasters like wildfires, hurricanes, tornadoes, earthquakes, and flooding.

RADNOR, Pa.--(BUSINESS WIRE)--Airgas, an Air Liquide company, has donated PPE items that were obtained for the COVID-19 pandemic to local emergency preparedness and disaster response organizations throughout the United States. These donations include face coverings, disposable gloves, and protective covers that can be used in local emergency or disaster recovery efforts. The PPE items are on hand to be used in response to emergencies or natural disasters like wildfires, hurricanes, tornadoes, earthquakes, and flooding.

Airgas coordinated with FEMA’s National Response Coordination Center who identified and connected Airgas with local aid organizations in their network. In addition, Airgas teams in Hawaii are actively coordinating local product donations in response to the recent fires on Maui. Over the last few months, Airgas associates throughout our national Distribution Center network prepared, packaged, loaded and delivered these supplies to each of the recipients.

The Airgas donation recipients include:

COPE Preparedness - Chatsworth, CA

Biguns Hope Disaster Response - Milton, FL

Crossroad Alliance - Ocala, FL

Reach Out America - St. Louis, MO

180 Disaster Relief - Tulsa, OK

Joy in Life - Henryetta, OK

Spokes of Hope - Longs, SC

Kerrie Sodano, President - Airgas Safety, Inc., VP Hardgoods Distribution and Supply Chain Solutions, commented: “It is essential to be prepared and respond to emergencies. Our associates, especially those who came together to deliver these supplies, all support and appreciate the vital role community organizations like these play in emergency response. We are grateful to play a small role in supporting local community organizations with PPE donations that can be put to good use in a time of need.”

Airgas, Inc.

Airgas®, an Air Liquide company, is a leading U.S. supplier of industrial, medical and specialty gases, as well as hardgoods and related products; one of the largest U.S. suppliers of safety products; and a leading U.S. supplier of ammonia products and process chemicals.

Airgas helps its more than 1 million customers advance their business performance and reach their full potential with reliable products, services and expertise used to create, build, care, serve and sustain. With nearly 18,000 associates, over 1,400 locations, a robust eBusiness platform, and Airgas Total Access® telesales channel, Airgas is ready to help customers fill their potential, every day.

As an Air Liquide company, a world leader in gases, technology and services for Industry and Health, Airgas offers customers an unrivaled global footprint and industry-leading technology and innovations.

For more information, please visit www.airgas.com

A world leader in gases, technologies and services for Industry and Health, Air Liquide is present in 73 countries with approximately 67,100 employees and serves more than 3.9 million customers and patients. Oxygen, nitrogen and hydrogen are essential small molecules for life, matter and energy. They embody Air Liquide’s scientific territory and have been at the core of the company’s activities since its creation in 1902.

Taking action today while preparing the future is at the heart of Air Liquide’s strategy. With ADVANCE, its strategic plan for 2025, Air Liquide is targeting a global performance, combining financial and extra-financial dimensions. Positioned on new markets, the Group benefits from major assets such as its business model combining resilience and strength, its ability to innovate and its technological expertise. The Group develops solutions contributing to climate and the energy transition—particularly with hydrogen—and takes action to progress in areas of healthcare, digital and high technologies.

Air Liquide’s revenue amounted to more than 29.9 billion euros in 2022. Air Liquide is listed on the Euronext Paris stock exchange (compartment A) and belongs to the CAC 40, CAC 40 ESG, EURO STOXX 50, FTSE4Good and DJSI Europe indexes."
China: discovering the new state-of-the-art and more sustainable manufacturing site - Air Liquide,"Wed, 02 Aug 2023 07:00:00 GMT",https://news.google.com/rss/articles/CBMic2h0dHBzOi8vd3d3LmFpcmxpcXVpZGUuY29tL3N0b3JpZXMvaW5kdXN0cnkvY2hpbmEtZGlzY292ZXJpbmctbmV3LXN0YXRlLWFydC1hbmQtbW9yZS1zdXN0YWluYWJsZS1tYW51ZmFjdHVyaW5nLXNpdGXSAQA?oc=5&hl=en-US&gl=US&ceid=US:en,"Air Liquide recently inaugurated its new state-of-the-art manufacturing center in Penglai, Yantai Shandong Province, in China. This is the new base for Air Liquide’s industrial units manufacturing capabilities in China, as well as for our subsidiary Cryolor, which will manufacture high performance liquid hydrogen equipment for the Asian mobility market.

The relocation of facilities from Hangzhou to Yantai was an opportunity for the Group’s Engineering & Construction teams to rethink how they wanted to shape Air Liquide manufacturing capabilities in the country, in light of the Group’s strategy and the challenges in terms of environment and industrial competitiveness.

The new manufacturing site includes a sustainable workshop, which notably produces state-of-the-art energy saving air separation units, as well as hydrogen production units. Strategically located on a coastal city with a strong industrial foundation, a solid supply chain and an extensive transportation network, this site will contribute to creating a solid base for the Group’s development not only in China, but also in Asia.

Alongside the Cryogenic Technologies Center in Vitry-sur-Seine, France, and the manufacturing center in Ras Al-Khaimah, United Arab Emirates, the Yantai manufacturing center enables the Group to offer a more diversified portfolio of solutions and services to support the Group’s growth. Thanks to these production capacities, new technologies can be developed faster and turned into concrete industrial projects, particularly those of greater scale and complexity."
