Titre,Date de publication,URL,Contenu,sentiment_finbert,sentiment_label,sentiment_score,sentiment_numerique
Thales' Pulse dynamic power supply wins prestigious Crystal Cabin Award - Thales,"Wed, 15 Jun 2022 07:00:00 GMT",https://news.google.com/rss/articles/CBMigQFodHRwczovL3d3dy50aGFsZXNncm91cC5jb20vZW4vd29ybGR3aWRlL2Flcm9zcGFjZS9wcmVzc19yZWxlYXNlL3RoYWxlcy1wdWxzZS1keW5hbWljLXBvd2VyLXN1cHBseS13aW5zLXByZXN0aWdpb3VzLWNyeXN0YWwtY2FiaW7SAQA?oc=5&hl=en-US&gl=US&ceid=US:en,"Thales’ Pulse dynamic power supply wins prestigious Crystal Cabin Award Share this article



LinkedIn

During the special gala event held on June 14, 2022 at Aircraft Interiors Expo, Thales was recognized by the Crystal Cabin Award Association for its’ winning innovation, Pulse dynamic power supply.

The Crystal Cabin Award is the world’s leading prize in the field of cabin innovations and on-board products.

In the Material and Components category, Thales wins with Pulse, the smart power supply solutions designed with the passenger in mind, allocating power where they need it all while reducing weight and total cost of ownership.





The Crystal Cabin Award is the world’s leading prize in the field of cabin innovations and on-board products. Winning ideas shape the future of travel. Thales was honored to have both its power supply and Optiq in-seat display from its’ AVANT Up solution make it to finalist for this award. During the special gala event held on June 14, 2022 at Aircraft Interiors Expo, Thales was recognized by the Crystal Cabin Award Association for its’ winning innovation, Pulse dynamic power supply.

Pulse is the revolutionary new power solution from Thales, it uses a patented power management technology to dynamically allocate power ensuring every passenger can charge their devices on- wing. Pulse is the only linefit solution that eliminates today’s ‘first come, first serve’ power allocation to guarantee all devices get power, regardless of who plugs in first. Pulse alleviates the feeling of ‘low battery anxiety’ that comes with not being able to charge your personal device.

Thales’ new power solution delivers 350W of power while also supporting the at-home charging preferences of USB-A, USB-C, and wireless charging for passengers to use on the aircraft. Pulse is right sized, meaning it can fit within the seat beams, giving an average of 200 square inches of space back to the passenger.

With dynamic power allocation, less weight and reduced operational cost, this solution improves power delivery in almost every way possible.

“We are very honored to win the 2022 Crystal Cabin Award with our Pulse dynamic power supply in the category of Materials and Components. This award recognizes innovation and technological superiority in the aircraft cabin; a great recognition for our team. At Thales, we are all proud to innovate leading-edge solutions that shape the future of travel.” Said TK Kallenback, Chief Executive Officer, Thales Inflyt Experience","{'label': 'Positive', 'score': 0.9991683959960938}",positive,0.9991683959960938,1
Video: Thales Aboard F126 Frigates of the German Navy - Naval News,"Tue, 28 Jun 2022 07:00:00 GMT",https://news.google.com/rss/articles/CBMiYmh0dHBzOi8vd3d3Lm5hdmFsbmV3cy5jb20vbmF2YWwtbmV3cy8yMDIyLzA2L3ZpZGVvLXRoYWxlcy1hYm9hcmQtZjEyNi1mcmlnYXRlcy1vZi10aGUtZ2VybWFuLW5hdnkv0gEA?oc=5&hl=en-US&gl=US&ceid=US:en,"Video: Thales Aboard F126 Frigates of the German Navy Federiko Krommendijk, deputy project director for the F126 program, explains Thales's role aboard the future frigates of the German Navy (also known as Fregatte Klasse 126 and previously known as MKS180).

Damen and Thales signed on November 17, 2020, the contract for the delivery and full integration of Thales’s Mission and Combat System for the four F126 frigates contracted by the German Navy.

One of the largest ever in Thales’s history, this contract includes the comprehensive Tacticos Combat Management System and the AWWS (Above Water Warfare System) Fire Control Cluster.

Here are some of the equipment that Thales will be providing:

Tacticos combat management system

Satcom system

APAR Block 2 x-band multifunction radar for AWWS

Gatekeeper 360° IR/TV system

Mirador MK2 EO tracking and observation system

Other equipment (non Thales) that will be fuzed with the Thales systems (Tacticos + AWWS):

MK41 VLS for ESSM Block 2

Naval Strike Missile (NSM)

KORA C-ESM and R-ESM

MASS decoy launchers

TRS-4D c-band air and surface surveillance radar

RAM CIWS

127mm main gun with Vulcano extended range precision munition

Thales’s Mission and Combat System includes the comprehensive Tacticos Combat Management System and the AWWS (Above Water Warfare System) Fire Control Cluster. The contract includes four ship systems, logistic services and multiple land-based test and training sites, as well as the option for two additional ships.

F126 Main Characteristics

Photo: Damen Naval.

Length: approximately 155 meters at waterline

Displacement: maximum 10,400 tonnes

Accommodation: 110 crew, 70 passengers

Operating endurance: 24 months

Operating area: worldwide

Ice class: 1C / E1 for sea areas with ice formation

Service life: 30 years

F126 Missions

The F126 will be a multi-mission platform. Built-in modules designed for specific military missions will make this possible. These mission modules are at the heart of what “multipurpose combat ship” means in practice.

Self-defense and combat missions

Creation of a maritime picture above and under water

Maritime surveillance and embargo control, including VBSS

Military evacuation in crisis situations

Escort for merchant ships

Command of a naval task force","{'label': 'Neutral', 'score': 0.9999871253967285}",neutral,0.9999871253967285,0
Thales DIS BPS has Cleverly Managed the Semiconductor Shortage - RFID & Wireless IoT Search,"Mon, 06 Jun 2022 07:00:00 GMT",https://news.google.com/rss/articles/CBMiX2h0dHBzOi8vd3d3LnJmaWQtd2lvdC1zZWFyY2guY29tL3RoYWxlcy1kaXMtYnBzLWhhcy1jbGV2ZXJseS1tYW5hZ2VkLXRoZS1zZW1pY29uZHVjdG9yLXNob3J0YWdl0gEA?oc=5&hl=en-US&gl=US&ceid=US:en,"Supply Bottlenecks have been Absorbed Well

The pandemic-related supply bottlenecks have made Thales DIS BPS even more aware of its dependence on the Asian semiconductor industry. Thales was still well positioned in this regard, says Steffi Lasch, Sales and Marketing Manager at Thales DIS BPS: ""We ordered larger quantities than usual in good time, openly communicated any problems with our customers and took countermeasures through a series of actions.""

As a result, there have been no delays in delivery to date. Materials planning had also been handled with foresight. Here, however, as in the procurement of chips, permanent changes are on the horizon.

Hope for Semiconductors “Made in Saxony”

Against this background, semiconductor production in Saxony offers real prospects. GLOBALFOUNDRIES, Infineon and Bosch operate some of the most modern and largest semiconductor plants in the world in Dresden. Already, the Saxony region is Europe's largest microelectronics / ICT location and the fifth largest worldwide. Every third chip produced in Europe bears the imprint ""Made in Saxony"". At the moment, of course, the demand for chips far exceeds the supply from Saxony. With the European Commission's Chip Act on the way, this will change in the future.

Dual-Interface Technology DIS Enables Even More Secure Programming

The result of intensive research and development efforts over the past two years is Thales Dual-Interface Technology DIS. The in-house copper-wired antenna technology and the in-house soldering process for this card are used to embed the dual-interface module. Combinations of LF / HF / UHF transponders in addition to the PKI dual interface DIS are possible. Secure applets allow access to the PKI dual-interface chip, and the security levels of the cards can be programmed according to the environment.

""We recognized early that we have to develop and offer secure software to guarantee the security of data,"" says Steffi Lasch.","{'label': 'Neutral', 'score': 0.8894942998886108}",neutral,0.8894942998886108,0
SpaceX's Falcon 9 pushes the Thales Alenia Space-built SES-22 satellite up from Cape Canaveral SFS – SatNews - SatNews,"Wed, 29 Jun 2022 07:00:00 GMT",https://news.google.com/rss/articles/CBMif2h0dHBzOi8vbmV3cy5zYXRuZXdzLmNvbS8yMDIyLzA2LzI5L3NwYWNleC1yZWxlYXNlcy10aGUtc2VzLTIyLXNhdGVsbGl0ZS1mcm9tLWVhcnRocy1ncmF2aXR5LXdpdGgtYS1zdWNjZXNzZnVsLWZhbGNvbi05LWxhdW5jaC_SAQA?oc=5&hl=en-US&gl=US&ceid=US:en,"The launch from Cape Canaveral SFS of the SES-22 satellite by SpaceX. Image is courtesy of the SpaceX simulcast of the launch.

The SES-22 satellite was successfully launched into space onboard a SpaceX Falcon 9 rocket from SpaceX’s Space Launch Complex 40 at Cape Canaveral Space Force Station (SFS) in Florida, United States, at 5:04 p.m., local time for SES.

Artistic rendition of the SES-22 and SES-23 satellites on-orbit, image is courtesy of Thales Alenia Space.

Built by Thales Alenia Space, the first of SES’s C-band satellites dedicated to freeing up the lower 300 MHz of C-band spectrum will operate in the 135 degrees West orbital slot. The satellite will deliver TV and radio to millions of American homes and provide other critical data transmission services, with satellite operations is expected to start by early August of 2022.

The SES-22 spacecraft had a fast on-ground delivery time as satellite manufacturer Thales Alenia Space shipped it only 22 months after it was ordered. SES-22 is the seventh SES satellite launched by SpaceX over the last 10 years. This was the second launch and landing of this Falcon 9 booster, which previously supported the launch of one Starlink mission.

The launch of SES-22 is part of a broader Federal Communications Commission (FCC) program to clear a portion of C-band spectrum to enable wireless operators to deploy 5G services across the contiguous U.S. (CONUS). In response to a mandate from the FCC, satellite operators, such as SES, are required to transition their existing services from the lower 300 MHz to the upper 200 MHz of C-band spectrum to make room for 5G.

To meet the FCC’s accelerated deadline of clearing C-band spectrum across the U.S. by December of 2023 while maintaining uninterrupted services, SES will launch five satellites – SES-18, SES-19, SES-20, SES-21 and SES-22 in 2022.

“We are thrilled with the successful launch of SES-22, thanks to our partners at Thales Alenia Space and SpaceX,” said Steve Collar, CEO of SES. “The launch of SES-22, together with other upcoming C-band satellite launches scheduled this year, will enable us to continue providing the high-quality services that our customers have been accustomed to over the last several decades, while freeing up spectrum that will enable the US to rapidly unlock the promise of 5G.”

“The successful launch of SES 22 is the result of our long-standing and fruitful collaboration with SES,” said Hervé Derrey, President and CEO of Thales Alenia Space. “This achievement reflects the robustness and flight-proven heritage of our Spacebus 4000 B2 platform combined with our ability to timely and quickly deliver SES-22, two key elements leading to the decision of SES working with us to replace its existing C-Band fleet.”","{'label': 'Neutral', 'score': 0.999868631362915}",neutral,0.999868631362915,0
French arms firm busts sanctions to help Russia build weapons - Yahoo News,"Tue, 21 Jun 2022 07:00:00 GMT",https://news.google.com/rss/articles/CBMiP2h0dHBzOi8vbmV3cy55YWhvby5jb20vdGhhbGVzLWZyYXVkZS1lbi1mcmFuLWFpcy0wNzAwMDAyNDEuaHRtbNIBAA?oc=5&hl=en-US&gl=US&ceid=US:en,"It was the BMD-4 with the Thales-made Catherine FC thermal imaging camera that took part in the shelling of Ukrainian civilian cars in Bucha.

I saw a post by volunteers on a social network, and together with my fellow lawyers we launched our own probe into the French manufacturer's involvement in Russia's military aggression against Ukraine.

Oleksandr Dubilet,

Chairman of the Board of CB ""PrivatBank"" (1997-2016), Financial and banking expert

So-called exemplary company

In France, Thales is not just a public company. There are three arguments to support this assertion.

1) The company specializes in the manufacture of systems for military, aerospace and maritime purposes

2) The company's shares are listed on the Paris Stock Exchange

3) It is not so much the private shareholder (the Dassault family with its 24.62% share) that is important, but the French government and its 25.67% share. Simply put, a company that is more than a quarter controlled by the French government, exports components that kill Ukrainians.

Thales

According to open sources, Thales supplied Catherine FC thermal imaging cameras to Russia, which were used to manufacture the Essa, Plissa and Sosna-U thermal sighting systems. They enhance the combat capabilities of modified Russian T-80, T-90, T-72 tanks and other military vehicles.

Conscious violators

After photo and video evidence of ""fruitful"" cooperation between Thales and Russia appeared on the Internet thanks to volunteers, my fellow lawyers and I have found real evidence that Thales supplied these combat components after the imposition of sanctions related to Russia's annexation of the Crimea.

Since this model of equipment was created in 2016, foreign manufacturers had to supply components at least a year earlier. Consequently, Thales sold military goods and technologies to Russia after the introduction of the first wave of sanctions (Council Regulation (EU) No. 833/2014 of July 31, 2014).

Catherine FC

Are these sanctions significant? Undoubtedly. In 2015, Thales failed to sign a $1.3 billion deal to supply two helicopter carriers to Russia. Instead, both ships were sold to Egypt.

I will also talk about a lesser-known episode of illegal but profitable cooperation between Thales and the aggressor state. The French company Sofradir, a subsidiary company of Thales, specializes in the manufacture of infrared detectors for military, space and commercial use.

According to NGO Disclose, in 2016, the company supplied 83 infrared detectors (S24) and 258 infrared detectors (S02) to Russia's CJSC TPK Linkos.

What is Linkos? According to the Arms of Russia information agency, Linkos specializes in the development and production of computers and communications equipment, optical, optical and electronic and microwave systems and complexes, night vision equipment and quantum electronics products.

In addition, Sofradir supplied 138 infrared detectors (S10) to JSC NPO GIPO, the Russian state institute of applied optics, which develops and manufactures optical and electronic systems. Since 2008, GIPO has been a part of the Rostekhnologii state corporation.

Mutually beneficial cooperation between this subsidiary of Thales and Russian military institutions is evidenced by two decisions (documents 1 and 2) of the 2016 Inter-ministerial Commission for the Study of Military Exports (CIEMMG) of France. According to the documents found by our team, French officials allowed Sofradir to supply military technology and goods despite the sanctions.

In 2019, Sofradir and Ulis merged and created a new company – Lynred. The well-known Thales is a 50% shareholder in Lynred.

The conclusion is simple: Sofradir actually misled the Inter-ministerial Commission by concluding an additional agreement ""to fulfill the contract."" The additional agreement extended the contract and aimed at circumventing sanctions for further supplies of military technology to Russia.

I and my colleagues found information that proves that Thales violated the sanctions in both the first (thermal imaging cameras) and the second (infrared detectors, through the subsidiary Sofradir) episodes, in the public domain (!). In my opinion, this illustrates the perception of sanctions very well. That is, the above French companies did not even bother to conceal evidence of their sanctions violations.

Demanding action

An EU Council decision bans the supply of dual-use goods and technology to Russia. However, you may be interested to know that this document has a loophole that reads as follows: the authorized state body may issue a license to supply such goods under contracts concluded before August 1, 2014.

And the French company Thales took full advantage of it, deliberately extending the old contracts through additional agreements and actually supplying military goods in 2015-2018.

My team of lawyers is working on each of two episodes of criminal cooperation between Thales and its subsidiary Sofradir with Russia. We have sent statements to the EU Council as the body that imposed the sanctions, as well as informing the law enforcement agencies, in particular, the French prosecutor's office. Our goal is to open criminal cases based on these statements.

Having revealed the corporate structure of Thales and identified the shareholders (in particular, the French government), we plan to address the shareholders of this company, French banks, secondary monitoring bodies and stock exchanges and demand that they take appropriate action against sanctions violators.

As in the case of our legal ""hunt"" for the Belgian company New Lachaussee, which supplied ammunition equipment for the Kalashnikov concern, the purpose of international lawsuits against Thales is to punish violators of sanctions and show the toxicity of any cooperation with the aggressor state.

At a time when Ukrainians are dying for European values, Europe must be completely on our side.","{'label': 'Neutral', 'score': 0.9995545744895935}",neutral,0.9995545744895935,0
