Titre,Date de publication,URL,Contenu,sentiment_finbert,sentiment_label,sentiment_score,sentiment_numerique
Two separate private school educators charged with sex crimes involving students - Lady Liberty 1885,"Sun, 14 Feb 2021 08:00:00 GMT",https://news.google.com/rss/articles/CBMieGh0dHBzOi8vbGFkeWxpYmVydHkxODg1LmNvbS8yMDIxLzAyLzE0L3R3by1zZXBhcmF0ZS1wcml2YXRlLXNjaG9vbC1lZHVjYXRvcnMtY2hhcmdlZC13aXRoLXNleC1jcmltZXMtaW52b2x2aW5nLXN0dWRlbnRzL9IBAA?oc=5&hl=en-US&gl=US&ceid=US:en,"Two separate private school educators, one in Rolesville and one in Reidsville, have been charged with sex crimes related to students and minors they had contact with.

Paula Louise Stinson, age 30, was arrested Feb. 1 and charged with twelve counts of indecent liberties with a child.

Stinson was issued a $75,000 bond which she posted and was released. Records accessed on Feb. 14 list her custody status as unsupervised “home incarceration.”

“Investigators discovered that several text messages exchanged between Stinson and the juvenile male student were intercepted by the boy’s parents and turned over to authorities. During the investigation, it was also discovered that the suspect and student had engaged in inappropriate interactions at the school and boy’s home, over a two-week period,” the Wake County Sheriff’s Office said in a press release.

Stinson was the physical education teacher at the Thales campus in Rolesville. The school is a private school with eleven campuses across North Carolina, Tennessee, and Virginia.

Thales Academy issued a short statement, indicating she has been fired:

“Mrs. Stinson has been terminated as an employee of Thales Academy, effective immediately. Thales Leadership is actively communicating with the Wake County Sheriff’s Office and cooperating with their investigation.”

There is no teaching license on file with the state for Stinson.

A principal of a parochial school in Reidsville has also been charged in recent weeks.

Horace Branford Aldridge, Jr. age 50, was charged on Jan. 27 with five counts of taking indecent liberties with a child and one count of taking indecent liberties with a student.

Records show that Aldridge was issued a $400,000 secured bond which he has not posted and remains incarcerated at the Rockingham County Detention Center.

The arrest was the result of a joint effort by the Reidsville Police Department, the North Carolina State Bureau of Investigations, and the Rockingham County Sheriff’s Office.

This investigation is still ongoing. Anyone with relevant information is asked to call Investigator Santana Menard at 336-347-2305 or Lt. Dennis Haley at 336-347-2341. Citizens can also call Crime Stoppers at 336-349-9683.

Officials at the Community Baptist Church and School assisted law enforcement in their investigation. While the school has not yet issued a formal statement or responded to requests for comment, all reports of his arrest refer to Aldridge as a “former” principal.

There is no record of a teaching license on file with the state for Aldridge.","{'label': 'Neutral', 'score': 0.9999438524246216}",neutral,0.9999438524246216,0
France selects Thales and Airbus for its electronic warfare system - SpaceWatch.Global,"Mon, 15 Feb 2021 08:00:00 GMT",https://news.google.com/rss/articles/CBMiZWh0dHBzOi8vc3BhY2V3YXRjaC5nbG9iYWwvMjAyMS8wMi9mcmFuY2Utc2VsZWN0cy10aGFsZXMtYW5kLWFpcmJ1cy1mb3ItaXRzLWVsZWN0cm9uaWMtd2FyZmFyZS1zeXN0ZW0v0gEA?oc=5&hl=en-US&gl=US&ceid=US:en,"Paris, 15 February 2021. – The French army has contracted Thales and Airbus to upgrade the electronic warfare capabilities and system for all three armed forces, Airbus Defence & Space announced.

The French defence procurement agency (DGA) has awarded Thales and Airbus a contract for the new joint tactical signals intelligence (SIGINT) system, to upgrade the French forces’ critical signals monitoring, direction finding and spectrum analysis capabilities, Airbus said.

The 10-year contract will equip the three armed forces with a common information system and set of sensors and will provide French armed forces command with an expanded tactical electronic support measures (ESM) capability, it said.

The tactical SIGINT programme will upgrade the electronic warfare capabilities of front-line units, providing a set of high-performance portable or vehicle-mounted assets compatible with the latest communications technologies, Airbus said. The new system to monitor and localise enemy communications will support tactical manoeuvres and will equip the electronic support vehicles of the French Army’s 54th Signals Regiment (SCORPION program), the French Navy’s frontline warships and the Atlantique 2 maritime patrol aircraft. It could also be deployed to protect air bases on military operations overseas.","{'label': 'Neutral', 'score': 0.6552959680557251}",neutral,0.6552959680557251,0
"Award-winning PE teacher, 30, ‘sneaked into 14 year-old boy’s house and sexually abused... - Metro.co.uk","Mon, 15 Feb 2021 08:00:00 GMT",https://news.google.com/rss/articles/CBMigAFodHRwczovL21ldHJvLmNvLnVrLzIwMjEvMDIvMTUvYXdhcmQtd2lubmluZy1wZS10ZWFjaGVyLTMwLXNuZWFrZWQtaW50by0xNC15ZWFyLW9sZC1ib3lzLWhvdXNlLWFuZC1zZXh1YWxseS1hYnVzZWQtaGltLTE0MDg3MDY1L9IBhAFodHRwczovL21ldHJvLmNvLnVrLzIwMjEvMDIvMTUvYXdhcmQtd2lubmluZy1wZS10ZWFjaGVyLTMwLXNuZWFrZWQtaW50by0xNC15ZWFyLW9sZC1ib3lzLWhvdXNlLWFuZC1zZXh1YWxseS1hYnVzZWQtaGltLTE0MDg3MDY1L2FtcC8?oc=5&hl=en-US&gl=US&ceid=US:en,"Award-winning teacher Paula Stinson is accused of sexually abusing a 14 year-old boy at the school where she worked, and at his home (Pictures: Thales Academy/Wake County Sheriff’s Office)

An award-winning teacher sneaked into a 14 year-old boy’s house to sexually abuse him, and molested the youngster 12 times, it is claimed. Paula Stinson, 30, allegedly molested the youngster over a two week period both at the private Thales Academy in Rolesville, North Carolina, and his nearby home.

Stinson married her husband last March, with the couple buying a home together in September. Her alleged molestation was uncovered after the boy’s parents found inappropriate texts Stinson is accused of sending to the child. Subsequent interviews uncovered the alleged sexual contact.

Stinson has been fired from her job, and faces 12 felony counts of indecent liberties with a child. She made her first appearance in court on Monday morning. The scandal-hit teacher had been working as athletic director at Thales Academy for six years at the time of her arrest.

She was honored for her work by the Wake Forest Chamber of commerce last May.

A spokesman for Thales Academy told WRAL: ‘Mrs. Paula Stinson is under investigation by the Wake County Sheriff’s Office for alleged misconduct. Mrs. Stinson has been terminated as an employee of Thales Academy effective immediately.

‘Thales Leadership is actively communicating with the Wake County Sheriff’s Office and cooperating with their investigation.’

Get in touch with our news team by emailing us at webnews@metro.co.uk

For more stories like this, check our news page","{'label': 'Neutral', 'score': 0.999657392501831}",neutral,0.999657392501831,0
Thales to supply onboard CBTC equipment for Vancouver Skytrain - International Railway Journal,"Thu, 18 Feb 2021 08:00:00 GMT",https://news.google.com/rss/articles/CBMiZmh0dHBzOi8vd3d3LnJhaWxqb3VybmFsLmNvbS9zaWduYWxsaW5nL3RoYWxlcy10by1zdXBwbHktb25ib2FyZC1jYnRjLWVxdWlwbWVudC1mb3ItdmFuY291dmVyLXNreXRyYWluL9IBAA?oc=5&hl=en-US&gl=US&ceid=US:en,"TRANSLINK, which operates Vancouver’s Skytrain metro system, has awarded Thales a contract to supply 82 SelTrac Vehicle On-Board Controllers (VOBCs), a key component of CBTC signalling used on the Expo and Millennium lines, for installation on 41 new trains on order from Bombardier.

Thales has supplied its SelTrac CBTC solution for the network’s Expo and Millennium Lines since the first section of the network opened in 1986. The supplier also secured a contract to install the system on the Broadway Subway, a 5.7km extension of the Millennium Line, in September.

Translink awarded Bombardier a $C 721m ($US 565m) contract to supply 41 five-car trains for the network in September, which will replace existing trains and boost fleet capacity when the Broadway extension opens in 2025.

The VOBCs, which control acceleration, braking, direction of travel, door operations, enforce speed limits and report identified faults, will increase capacity and improve reliability. It will also enable the new trains to operate safely and efficiently with the existing fleet.

Thales will also deliver the VOBC system as part of the Toronto Transit Commission’s new Finch West expansion project.","{'label': 'Neutral', 'score': 0.7135524749755859}",neutral,0.7135524749755859,0
"Meet our CareerTrackers intern, Michaela - Thales","Wed, 10 Feb 2021 08:00:00 GMT",https://news.google.com/rss/articles/CBMiamh0dHBzOi8vd3d3LnRoYWxlc2dyb3VwLmNvbS9lbi9jb3VudHJpZXMtYXNpYS9hdXN0cmFsaWEvcmVmZXJlbmNlcy9tZWV0LW91ci1jYXJlZXJ0cmFja2Vycy1pbnRlcm4tbWljaGFlbGHSAQA?oc=5&hl=en-US&gl=US&ceid=US:en,"This year marks our second year of partnership with CareerTrackers, a national non-profit linking young Aboriginal and Torres Strait Islander adults with employers to participate in internships. This week we’d like to introduce you to one of our brilliant Career Trackers, Michaela who is working in our Legal and Contracts team.

Michaela, Legal & Contracts

Hailing from sunny Darwin, Michaela’s family moved to Sydney when she was nine years old and now reside in Camden, a suburb located on the city’s fringe. She jokes that it took them a while to acclimatise to Sydney’s cooler climate but now when they head back up north, something they try to do each year, they struggle with the relentless heat.

Michaela’s Aboriginal heritage comes from her father, who originates from the Tiwi Islands, about 80km north of Darwin, and says she first learnt about CareerTrackers in her final year of high school. She signed up without giving it too much thought and CareerTrackers reached out to her after she began university. “I went to an information session and remember thinking ‘I don’t think I’ll get this amazing opportunity otherwise.’”

Fast forward to now and Michaela is in her second year of completing a Bachelor of Law/Bachelor of Psychology at the University of Wollongong and is in the final days of her internship at Thales. Positioned within the Legal & Contracts team based at Sydney Olympic Park, Michaela’s days are filled with writing memos for legislation and shadowing her colleagues – even accompanying Vice President Legal & Contracts James Couche to meetings. Although she says she didn’t know much about Thales beforehand, “I was immediately intrigued because of the defence and security aspects, which I find interesting.”

A recent visit to our Garden Island site offered the opportunity to see a Defence establishment first hand and Michaela credits this experience as the highlight of her internship. “I really enjoyed seeing the ships and chatting with people to get a grasp of what they do and hearing their career advice.” As Michaela points out, there are many career pathways available with a Law degree and, while she hasn’t landed on which direction she’ll head in, her time at Thales has been invaluable. Just before commencing, she’d completed a contracts subject and therefore being able to see it in a practical sense has delivered an improved learning experience.

Another pleasant surprise has been the type of work she’s been engaged in, such as drafting a guide to building code legislation. “The work given to me is interesting. Thales is really valuing my opinion and the work I’m doing, so I feel proactive. Everyone has been really welcoming too.”

With another internship on the horizon in winter, Michaela hopes she can return to Thales and continue learning more about our business. Either way, she’s extremely grateful for her CareerTrackers internship. “I 100% recommend it. What I’m getting out of this is something that’ll help me in the future and its actual, proper work experience. I’ve suggested to CareerTrackers that it’d be amazing to take their program out to Darwin, where people would actually thrive with this same opportunity.”

We agree Michaela and hope to welcome a CareerTrackers intern at our Darwin site in the future!","{'label': 'Neutral', 'score': 0.9999940395355225}",neutral,0.9999940395355225,0
BEL delivers modules to Thales for radars on Rafale fighter jets - The Economic Times,"Wed, 03 Feb 2021 08:00:00 GMT",https://news.google.com/rss/articles/CBMiggFodHRwczovL20uZWNvbm9taWN0aW1lcy5jb20vbmV3cy9kZWZlbmNlL2JlbC1kZWxpdmVycy1tb2R1bGVzLXRvLXRoYWxlcy1mb3ItcmFkYXJzLW9uLXJhZmFsZS1maWdodGVyLWpldHMvYXJ0aWNsZXNob3cvODA2NzU0ODUuY21z0gGGAWh0dHBzOi8vbS5lY29ub21pY3RpbWVzLmNvbS9uZXdzL2RlZmVuY2UvYmVsLWRlbGl2ZXJzLW1vZHVsZXMtdG8tdGhhbGVzLWZvci1yYWRhcnMtb24tcmFmYWxlLWZpZ2h0ZXItamV0cy9hbXBfYXJ0aWNsZXNob3cvODA2NzU0ODUuY21z?oc=5&hl=en-US&gl=US&ceid=US:en,"



(You can now subscribe to our

(You can now subscribe to our Economic Times WhatsApp channel

NEW DELHI: Bharat Electronics Limited has delivered transmit/receive (T/R) modules to Thales for the RBE2 radar that is used by Rafale fighter aircraft, said an official statement on Wednesday. These modules were delivered to Thales by BEL after the French company transferred its technology as per the Rafale fighter jet purchase agreement between India and France The BEL's engineers were trained at the French facility of Thales as per the offset agreement.""The modules produced in India (by BEL) are then integrated with the RBE2 radar in France. BEL and Thales teams are, thus working closely to transfer advanced technological know-how,"" the Thales's statement said.The first batch of five Rafale jets arrived in India from France on July 29, 2020, nearly four years after India signed an inter-governmental agreement with France to procure 36 of the aircraft at a cost of Rs 59,000 crore.A total of 11 Rafale jets have been delivered by its manufacturer Dassault Aviation till now.V Gowtama, Chairman and Managing Director, BEL, said, ""We are happy to be associated with Thales in delivering the transmit/receive modules for the prestigious Rafale programme. The Thales and BEL teams ensured that the ToT (transfer of technology) happened seamlessly.""""We have augmented our facility in Bangalore to meet the requirements of manufacturing this state-of-the-art sub-system. We look forward to working together on many more such challenging assignments with Thales,"" he stated.","{'label': 'Neutral', 'score': 0.9999914169311523}",neutral,0.9999914169311523,0
stc pay and Thales introduce customisable contactless payment cards – Intelligent CIO Middle East - Intelligent CIO,"Wed, 17 Feb 2021 08:00:00 GMT",https://news.google.com/rss/articles/CBMicWh0dHBzOi8vd3d3LmludGVsbGlnZW50Y2lvLmNvbS9tZS8yMDIxLzAyLzE3L3N0Yy1wYXktYW5kLXRoYWxlcy1pbnRyb2R1Y2UtY3VzdG9taXNhYmxlLWNvbnRhY3RsZXNzLXBheW1lbnQtY2FyZHMv0gEA?oc=5&hl=en-US&gl=US&ceid=US:en,"Saudi Mobile Wallet, Saudi Digital Payments Company (stc pay) and Thales have introduced contactless cards to enable payments at point of sale (POS) machines, e-commerce transactions and cash withdrawal at local and international ATMs.

Thales EMV cards are fully personalised and include two different premium designs: metal cards and transparent cards, making the sourcing process for stc pay more secure and simplified.

stc pay’s customers will be able to order the card, activate, deactivate and set spending limits through their mobile application with no additional paperwork required. Fully digitised, the card is compatible with Apple Pay and mada Pay, providing a seamless and secure payment experience for iPhone and Android users.

“The global crisis has led to increased concern on the usage of cash and has naturally accelerated the transformation towards a contactless and cashless society. It is only through the creation of novel, secure solutions, that we can build a future we can trust. We are very proud of the fruitful partnership developed over the years with stc pay and we remain fully committed to supporting innovation in the Kingdom in line with Vision 2030. The Kingdom of Saudi Arabia has been at the forefront of smart cities, and stc pay plays a key role in this remarkable journey, ” said Pascal Lesaulnier, CEO, Thales Saudi Arabia.

Ahmed Alenazi, CEO, stc pay, added that: “As the Kingdom progresses towards a cashless society, we are always looking for ways to provide new and innovative technologies and digital experiences to our customers. The introduction of the contactless payment cards together with Thales provides our customers with digital payments solutions that are fast, convenient, and more importantly, secure.”.

stc pay has been recognised as the Best Digital Wallet in the Middle East and North Africa (MENA) by Global Banking and Finance Awards. The digital wallet has been designed to enable fast and convenient payment solutions that can be accessed through any smart device.

Click below to share this article","{'label': 'Positive', 'score': 0.7891522645950317}",positive,0.7891522645950317,1
BEL delivers transmit/receive modules to Thales for Rafale RBE2 Radar - Force Magazine,"Thu, 04 Feb 2021 08:00:00 GMT",https://news.google.com/rss/articles/CBMiImh0dHBzOi8vZm9yY2VpbmRpYS5uZXQvZGVzaS12aWJlcy_SAQA?oc=5&hl=en-US&gl=US&ceid=US:en,"BEL delivers transmit/receive modules to Thales for Rafale RBE2 Radar

As part of Thales’ Offsets commitments under the Rafale India contract, and in line with the ‘Make in India’ policy, Bharat Electronics Ltd (BEL) has manufactured transmit/receive (T/R) modules for the RBE2 radar on the Dassault Aviation Rafale and delivered them to Thales.

Thales is demonstrating its commitment to the ‘Make in India’ policy through transfers of technology and production, and associated training for BEL engineers in France. BEL has implemented a set of rigorous industrial processes and played an active role in the transfer programme.

Thales is an active stakeholder in the government’s ‘Make in India’ policy, and in the Offsets conditions included in the Rafale India programme. In November 2020, the first RBE2 AESA (active electronic scanning array) radar with a front end manufactured by BEL in India was delivered by Thales to Dassault Aviation. BEL implemented a set of rigorous processes at its Bangalore facility in order to achieve this key milestone.









Specifically developed for Rafale, the RBE2 is the first in-service European AESA radar and has been combat proven on Rafale aircraft operated by the French Air Force. It was developed in close partnership with Dassault Aviation and the French Defence Procurement Agency (DGA) to meet the requirements of air forces. It uses innovative technologies to combine advanced fire control radar functions and target tracking capabilities. The T/R modules are key to the RBE2 radar’s active electronic scanning performance, enabling it to steer the radar beam with the speed of an electronic chip.

Initiated at the end of 2017, the transfer of technology to BEL has included validation of the company’s technical capacity to deliver prototypes, qualify the various technologies involved in the wiring process, set up a dedicated SMC wiring production line with a preproduction run, train BEL engineers in France and install test benches for microwave characterisation at the BEL facility. The modules produced in India are then integrated with the RBE2 radar in France. BEL and Thales teams are, thus, working closely to transfer advanced technological know-how.

Building on Thales’s 50+ years of expertise with earlier generations of radars for combat aircraft, the RBE2 gives the Rafale a number of key advantages. Compared to radars with conventional antennas, the RBE2 delivers an unprecedented level of tactical situational awareness, faster detection and tracking of multiple targets, and can also implement several radar modes instantaneously.

“We’re delighted to see our collaboration with BEL delivering results, with the radar transmit/receive modules for the Rafale India programme being produced in Bangalore in line with the ‘Make in India; policy,” said Emmanuel De Roquefeuil, VP and Country director, Thales in India. M V Gowtama, Chairman & Managing Director, BEL, too, reiterated the importance of the partnership. He said: “We are happy to be associated with Thales in delivering the transmit/receive modules for the prestigious Rafale programme. The Thales and BEL teams ensured that the ToT happened seamlessly.”","{'label': 'Neutral', 'score': 0.9949173927307129}",neutral,0.9949173927307129,0
"Thales, Airbus to upgrade French electronic warfare systems - UK Defence Journal","Fri, 12 Feb 2021 08:00:00 GMT",https://news.google.com/rss/articles/CBMiW2h0dHBzOi8vdWtkZWZlbmNlam91cm5hbC5vcmcudWsvdGhhbGVzLWFpcmJ1cy10by11cGdyYWRlLWZyZW5jaC1lbGVjdHJvbmljLXdhcmZhcmUtc3lzdGVtcy_SAQA?oc=5&hl=en-US&gl=US&ceid=US:en,"The French defence procurement agency has awarded Thales and Airbus a contract for the new joint tactical signals intelligence (SIGINT) system to upgrade the French forces’ critical signals monitoring, direction finding and spectrum analysis capabilities.

“The 10-year contract will equip the three armed forces with a common information system and set of sensors and is designated a high-impact program (PEM[1]), alongside CONTACT and SCORPION, under France’s defense spending plan. This joint tactical SIGINT system will provide French armed forces command with an expanded tactical electronic support measures (ESM) capability.”

The tactical SIGINT programme will upgrade the electronic warfare capabilities of front-line units, providing a set of high-performance portable or vehicle-mounted assets compatible with the latest communications technologies.

The new system to monitor and localize enemy communications will support tactical manoeuvres in the theatre of operations, helping to keep our forces safe and secure.

It will equip the electronic support vehicles of the French Army’s 54th Signals Regiment, the French Navy’s front-line warships and the Atlantique 2 maritime patrol aircraft, and could be deployed to protect air bases on military operations overseas.

“The system will be the only one of its kind in service with the French forces. All three armed forces will rely on the same logistics infrastructure to simplify training of specialist operators and optimize through-life support delivery. The first phase of the program will provide the three armed forces with an initial operational capability for signals monitoring, with subsequent optional tranches to significantly increase the number of units in service.

New functions (new data analytics functions for the information system, expanded detection and technical analysis capabilities, etc.) will be added incrementally over the term of the contract to provide the French armed forces with a set of state-of-the-art electronic warfare systems and capabilities.”","{'label': 'Positive', 'score': 0.5763079524040222}",positive,0.5763079524040222,1
