Titre,Date de publication,URL,Contenu
Thales Alenia Space at the forefront of high-priority environmental missions - Thales,"Fri, 13 Nov 2020 08:00:00 GMT",https://news.google.com/rss/articles/CBMif2h0dHBzOi8vd3d3LnRoYWxlc2dyb3VwLmNvbS9lbi93b3JsZHdpZGUvc3BhY2UvcHJlc3MtcmVsZWFzZS90aGFsZXMtYWxlbmlhLXNwYWNlLWZvcmVmcm9udC1oaWdoLXByaW9yaXR5LWVudmlyb25tZW50YWwtbWlzc2lvbnPSAQA?oc=5&hl=en-US&gl=US&ceid=US:en,"2 new contracts signed today between Thales Alenia Space and the European Space Agency in the presence of French minister, Bruno Le Maire and Italian Undersecretary Riccardo Fraccaro

Involved in 5 out of 6 Copernicus expansion new missions

Prime contractor for CHIME, CIMR and ROSE-L, leading industrial consortium from France and Italy

Cannes, November 13, 2020 – Thales Alenia Space, a Joint Venture between Thales (67 %) and Leonardo (33 %), signed today with the European Space Agency (ESA) 2 new contracts in the frame of the new high-priority Copernicus satellite missions planned to expand the current capabilities of the Sentinels and serve EU policy as well as citizens needs.

From left to right: Hervé Derrey (Thales Alenia Space CEO), Bruno Le Maire (French Ministry of Economy and Finance) and Patrice Caine (Thales CEO).

The Copernicus Hyperspectral Imaging Mission, CHIME, worth €455 million contract, was signed by Hervé Derrey, CEO of Thales Alenia Space in the presence of Bruno Le Maire, French Ministry of Economy and Finance.

From left to right: Massimo Claudio Comparini (Senior Executive Vice President Observation, Exploration and Navigation at Thales Alenia Space), Riccardo Fraccaro (Under Secretary of the Council of Ministers of Italy) and Joseph Aschbacher, ESA Director of Earth Observation Programmes.

The Copernicus Imaging Microwave Radiometer, mission, CIMR, was signed by Massimo Claudio Comparini, Senior Executive Vice President Observation, Exploration and Navigation at Thales Alenia Space and CEO of Thales Alenia Space Italy in the presence of the Under Secretary of the Council of Ministers of Italy, Riccardo Fraccaro. The contract is worth €495 million.

Thales Alenia Space will also be responsible for the payload development for CO2M mission, that is dedicated to measuring global anthropogenic CO2 emissions and thus playing a key role in studying the causes of climate change and monitoring it. The company will also provide the IRIS altimeter onboard CRISTAL mission.



The order volume resulting from the recent bid decisions is expected to be around EUR 1.8 billion. This represents hundreds of highly qualified jobs and scientific and industrial know-how, all located in Europe.



“We are very honored to sign today 2 new contracts in the frame of the Copernicus expansion missions. Thales Alenia Space confirms its ability to serve crucial environmental missions for Europe. We really want to thank all the actors who worked to make these projects a reality, mainly ESA, European Commission, member States and national agencies, in particular the main contributors to these projects, which are Italy and France. Through its strong presence in the two countries, Thales Alenia Space has been the key industrial actor of this cooperation in the field of satellites”, declared Herve Derrey, CEO of Thales Alenia Space.

Massimo Claudio Comparini Senior Executive Vice President Observation, Exploration and Navigation at Thales Alenia Space, commented: “Integration of space optical and radar sensors is essential to monitor Earth, its evolution and pattern of life. Thales Alenia Space covers full range of innovative solutions and heavily contributes to the incredible industrial challenge posed by Copernicus extension for a sustainable planet. We are fully committed to the projects, and thanks to advanced instruments and highly reliable space systems, Thales Alenia Space will play a key role in enabling the future of climate monitoring and an efficient and safe exploitation of Earth’s resources”.

CHIME mission will carry a unique visible to shortwave infrared spectrometer. It will provide routine hyperspectral observations to support new and enhanced services for sustainable agricultural and biodiversity management, as well to characterise soil properties, which is key to healthy vegetation. The high technology payload will benefit from Leonardo and OHB experience in hyperspectral instruments.

Carrying a novel ‘conically-scanning’ multi-frequency microwave radiometer, CIMR mission will measure sea-surface temperature, sea-ice concentration and sea-surface salinity. It will also observe a wide range of other sea-ice parameters such as sea-ice thickness and sea-ice drift. CIMR is being developed in response to high-priority requirements from key Arctic user communities and will support the EU Integrated Policy for the Arctic. This mission will be developed with OHB as main industrial partner.

Artistic views: © Thales Alenia Space/Briot

ABOUT THALES ALENIA SPACE

Drawing on over 40 years of experience and a unique combination of skills, expertise and cultures, Thales Alenia Space delivers cost-effective solutions for telecommunications, navigation, Earth observation, environmental management, exploration, science and orbital infrastructures. Governments and private industry alike count on Thales Alenia Space to design satellite-based systems that provide anytime, anywhere connections and positioning, monitor our planet, enhance management of its resources, and explore our Solar System and beyond. Thales Alenia Space sees space as a new horizon, helping to build a better, more sustainable life on Earth. A joint venture between Thales (67%) and Leonardo (33%), Thales Alenia Space also teams up with Telespazio to form the parent companies’ Space Alliance, which offers a complete range of services. Thales Alenia Space posted consolidated revenues of approximately 2.15 billion euros in 2019 and has around 7,700 employees in nine countries. www.thalesaleniaspace.com

THALES ALENIA SPACE – PRESS CONTACTS

Sandrine Bielecki

Tel: +33 (0)4 92 92 70 94

sandrine.bielecki@thalesaleniaspace.com

Tarik Lahlou

Tel: +33(0)6 87 95 89 56

tarik.lahlou@thalesaleniaspace.com

Cinzia Marcanio

Tel: +39 (0)6 415 126 85

cinzia.marcanio@thalesaleniaspace.com

Marija Kovac

Tel: +39 (0)6 415 129 91

marija.kovac-somministrato@thalesaleniaspace.com"
Thales is proud to offer its patronage to the Innotrophées 2020 - Thales,"Mon, 02 Nov 2020 08:00:00 GMT",https://news.google.com/rss/articles/CBMifGh0dHBzOi8vd3d3LnRoYWxlc2dyb3VwLmNvbS9lbi93b3JsZHdpZGUtbWFya2V0LXNwZWNpZmljLXNvbHV0aW9ucy9taWNyb3dhdmUtaW1hZ2luZy1zdWItc3lzdGVtcy9uZXdzL3RoYWxlcy1wcm91ZC1vZmZlci1pdHPSAQA?oc=5&hl=en-US&gl=US&ceid=US:en,"Thales is proud to offer its patronage to the Innotrophées 2020 Radiology Medical Imaging Innovation Share this article



LinkedIn

Thales is proud to announce that it will be the main patron in the 11th edition of the Innotrophées 2020, organized by the CCI (Chamber of Commerce and Industry) of Grenoble and its Ecobiz network. This award ceremony, which takes place on TéléGrenoble on Saturday November 28th at 9 PM, will give recognition to the region’s best innovations in categories such as technological innovation.

Thales is a world leader in providing radiology system innovations, and is a strong believer in revolutionising medical technology to better suit the evolving needs of our world. Within the current context of COVID-19, healthcare innovations are now valued more than ever, and the demand for medical imaging solutions has significantly increased. It is for these reasons that we seek to benefit from our strong presence in France for the better good.

Our participation in the Innotrophées 2020 strongly reinforces our strategy to collaborate with local startups. With the largest European site dedicated to radiology, this provides us with an excellent playing field for succeeding in future joint projects. Together, we can make a bigger difference by providing solutions that combine both of our expertise.

Thales has 60 years of experience in the region producing cutting-edge products and digital services that are made in France itself. As the only European manufacturer for radiology technology, Thales and its subsidiary Trixell are experts in their field for designing and manufacturing detectors. Innovation is still evolving at Moirans site and we are now developing nanotechnology-based X-ray sources, image processing, and preparing the future based on cloud connectivity, big data, cyber security or artificial intelligence for new value-added services for patients and healthcare.

See what Laurent Chevallier, our Head of Partnerships, who will represent us in the awards, has to say about Thales’ participation:"
Ariane 5: One chapter closes…Another one opens - Thales,"Thu, 19 Nov 2020 08:00:00 GMT",https://news.google.com/rss/articles/CBMiYGh0dHBzOi8vd3d3LnRoYWxlc2dyb3VwLmNvbS9lbi93b3JsZHdpZGUvc3BhY2UvbmV3cy9hcmlhbmUtNS1vbmUtY2hhcHRlci1jbG9zZXNhbm90aGVyLW9uZS1vcGVuc9IBAA?oc=5&hl=en-US&gl=US&ceid=US:en,"Ariane 5: One chapter closes…Another one opens Thales Alenia Space Share this article



LinkedIn

It is with a sense of emotion and great pride that Thales Alenia Space’s Belgian teams have delivered the last pieces of equipment to ArianeGroup for the Ariane 5 launch vehicle.

As one textbook launch followed another, Ariane 5 quickly became the benchmark in the commercial geostationary satellite market. We take a moment to reflect on this fantastic adventure, which we’ve been involved in for over 20 years.

In 1987, ESA’s member states agreed to develop Ariane 5 as the replacement for Ariane 4. Europe’s new heavy-lift launcher would serve two objectives. First, orbit the Hermes spaceplane with astronauts aboard; and second, offer a dual payload capability, making it more competitive on the commercial launch services market. Ariane 5 can deliver two satellites to orbit, each weighing up to 5 metric tons. Another version, dubbed ES, launched the ATV (Automated Transfer Vehicle) to deliver supplies to the International Space Station, and can orbit four Galileo navigation satellites at a time.

Recognized Belgian expertise

Drawing on its recognized expertise in launchers, built up since the early 1970s, Thales Alenia Space in Belgium once again supported the European space industry by developing and manufacturing half of the electronics for Ariane 5 at Charleroi — that’s 21 complete subassemblies and four printed circuit boards. These devices perform a variety of functions, including electrical distribution, management of the thrust vectoring nozzles that keep the launcher on course, self-destruction if it veers from its trajectory, calculating its position in space and handling separation of the launcher stages and the fairing that protects the satellites during its flight through the atmosphere.

From 1993 to 2014, about 20 of our staff were permanently based at the European Spaceport in Kourou, French Guiana, to support Ariane 5 launch operations, especially maintaining and testing command, control and IT systems. We also delivered most of the checkout systems for the Ariane family of launchers, from Ariane 1 to 5, including the crucial system that’s used for final checks and liftoff.

An upgradeable launcher

Ariane 5 was designed for upgradeability. In two decades, it has been built in five different versions to keep pace with growing satellites and evolving customer needs. The current model is the Ariane 5 ECA.

Thales Alenia Space has delivered a total of 2,436 components and subassemblies for 116 Ariane 5 launchers, not including modules for the inertial unit.

A human adventure

“Thales Alenia Space in Belgium is a major and long-standing partner of the Ariane 5 program, supplying half of the onboard electronics,” says Christian Deprez, in charge of launchers at Thales Alenia Space in Belgium’s sales department. “The Belgium Federal Science Policy Office (BELSPO) really supported us in our work. I think everyone who worked on Ariane 5 has a feeling of pride… and very poignant memories.”

The last launch is slated for 2023. By then, Ariane 6 will be fully operational and will also take over from Soyuz at Europe’s Spaceport in French Guiana.

With Ariane 6, a new chapter opens — and the Thales Alenia Space teams in Belgium and Spain are proud to be part of it!

Photos © ESA/CNES/Arianespace - © Thales Alenia Space"
#Spaceforlife: ISS celebrates 20 years of life in space! - Thales,"Mon, 02 Nov 2020 08:00:00 GMT",https://news.google.com/rss/articles/CBMiY2h0dHBzOi8vd3d3LnRoYWxlc2dyb3VwLmNvbS9lbi93b3JsZHdpZGUvc3BhY2UvbmV3cy9zcGFjZWZvcmxpZmUtaXNzLWNlbGVicmF0ZXMtMjAteWVhcnMtbGlmZS1zcGFjZdIBAA?oc=5&hl=en-US&gl=US&ceid=US:en,"#Spaceforlife: ISS celebrates 20 years of life in space! Share this article



LinkedIn

The International Space Station, the most extensive scientific collaboration in history for peaceful purposes, is celebrating its milestone 20th anniversary. Since the launch of the first module on November 20, 1998, it has taught us that when countries work together and combine their technological excellence, they can achieve a sustained human presence in space. The first International Space Station crew took up their posts on November 2, 2000, two years after the start of construction.

© @Nasa

The three astronauts/cosmonauts, William (Bill) Sheperd (expedition commander) from the USA, Russian cosmonauts Sergei Krikalev (flight engineer) and Yuri Gidzenko (Soyuz commander), docked at 10 a.m. in the morning and began to build what would become home to an ever-changing international crew of spacefarers.

The ISS at a glance

Since November 2000, 241 individuals from 19 countries have visited the International Space Station, conducting over 2,500 medical, chemical, physical and biological experiments in microgravity. It took more than 50 missions by all kinds of launch vehicles to assemble the 100 major parts of this technological tour de force – one of the most complex and impressive structures ever built. Above all, it meant putting aside the lingering tensions of the Cold War and the space race to deliver the best technologies from across the globe into orbit. From December 1998 to March 2019, for instance, some 78,514 kilos of research equipment was lofted to the station and 23,559 kilos were sent back to Earth.

Why conduct science in space? The space station offers a great vantage point from which we can study the Earth, allows scientists to expose materials to the harsh environment of space – and especially microgravity – and lets us test technologies that could help take us further into space, including the Moon and Mars.

An astronaut’s life

When an astronaut joins the space station, it takes a few hours to get used to the “zero-g”, or weightless environment. They will have undergone countless simulations on the ground, but nothing really compares to the sensations when you reach the ISS and begin floating around. You have to move very carefully, think ahead and decide which of the many handles along the walls you want to grab. A reckless movement can become dangerous for yourself, other astronauts and the delicate instruments aboard.

Our bodies were of course designed to live in a gravity environment – back pain aside! In the almost total absence of gravity, our bodies struggle: during the first few days, the body fluids tend to rise towards the head and upper limbs, which explains why recent arrivals on the ISS often have visibly swollen faces.

Long stays in this type of environment are also detrimental to the musculoskeletal system. For every month on the ISS, an astronaut loses an estimated 2% of their bone mass. What happens is that bones become less dense because they have to support less weight, and consequently the body directs its resources and energy to other areas. This is why astronauts have to exercise for several hours a day to maintain muscle tone and strengthen their bones.

Beyond low Earth orbit, space radiation may place astronauts at significant risk for radiation sickness, and increased lifetime risk for cancer, central nervous system disorders and degenerative diseases. Thales Alenia Space has designed a simple radiation protection vest, which places radiation shielding material over sensitive body parts (e.g., bone marrow) to protect an astronaut in case of a solar particle event.

A window on the Earth

From the Cupola on the International Space Station, astronauts have taken millions of photos of the Earth. The Cupola, as its name suggests, is fully outfitted for astronauts to observe the Earth, including a variety of cameras. By design, this module always faces the Earth, allowing astronauts to observe day or night. They can also set up cameras to automatically shoot photos while they perform other tasks. Once published, these exceptional shots have burnished the Space Station's reputation as an ideal spaceborne observatory.

A dream becomes reality

Today, as we celebrate this milestone anniversary and also plan expeditions to Mars and a return to the Moon, it’s worth remembering the highly ambitious goals of this vast international undertaking. Bringing together the United States, Russia, Canada, Japan and European Space Agency countries, this program has led to the construction of the largest spacecraft ever, a permanent human outpost that occupies an area as large as a football field, with a habitable volume of more than 1,200 cubic meters, more than 40% of which is supplied by Thales Alenia Space.

© ©Thales Alenia Space/@Nasa/Esa

Our company has provided fully half of the pressurized volume on the International Space Station, including Nodes 2 and 3, the Permanent Multipurpose Module, the Multipurpose Logistics Modules, the Cupola and the Columbus lab structure, along with cargo modules for the ATV resupply vessels and the structure for the Bishop commercial airlock from NanoRacks. We also build all pressurized cargo modules for Cygnus resupply vessels on behalf of Northrop Grumman. Twice yearly, they deliver food, water, parts, fuel and science experiments for astronauts on the ISS. Our teams are now capitalizing on their long experience with globally acclaimed exploration programs to address new Moon-related markets.

To the Moon and Beyond

We continue to push back the frontiers of space exploration. Our company was chosen by ESA to develop two key modules for the upcoming Lunar Gateway: I-HAB and the ESPRIT communications and refueling module. In addition, Northrop Grumman recently selected us to develop the pressurized module for HALO (Habitation And Logistic Outpost), one of the first sections of the lunar space station, Gateway, to be launched in 2023.

Thales Alenia Space is part of the consortium led by American company Dynetics, selected by NASA to conduct the initial design and development phase of the pressurized cabin of the Human Landing System (HLS). As the only European partner in the Dynetics consortium, we’re in charge of designing the crew module, drawing on our extensive experience with the International Space Station. The crew module will play a decisive role, since it will house the astronauts and protect them from radiation, micrometeorites and the other hazards of spaceflight. American company CommStar Space Communications is counting on us to deploy a hybrid Earth-Moon communications relay satellite by 2023, and we’ll also be supplying Earth-Moon telecom technologies for NASA’s VIPER rover, which will search for water on the surface. In addition, we’ve been chosen by Axiom Space to provide two key pressurized elements, Node1 and Habitat, which will be the first components in a future commercial space station. Axiom Space has asked French designer Philippe Starck to create interiors for the habitation module on the Axiom Space Station.

Leveraging Thales Alenia Space’s long-standing expertise in space exploration, orbital infrastructures, robotics and space transportation systems, we have become the world leader in the orbital infrastructures market. More than ever, the Moon is at our fingertips!

The next chapter in the Moon chronicles has just begun. Stay tuned for the latest news!"
Cutting-edge technology for the German Navy - Thales,"Fri, 20 Nov 2020 08:00:00 GMT",https://news.google.com/rss/articles/CBMiXGh0dHBzOi8vd3d3LnRoYWxlc2dyb3VwLmNvbS9lbi9ncm91cC9qb3VybmFsaXN0L21hZ2F6aW5lL2N1dHRpbmctZWRnZS10ZWNobm9sb2d5LWdlcm1hbi1uYXZ50gEA?oc=5&hl=en-US&gl=US&ceid=US:en,"Navies across the world are having to adapt to an ever-changing maritime environment, and to face up to threats that are constantly evolving. Within these new operational scenarios, vessels need to be able to defend both themselves and other platforms within a naval task group.

Navy ships, today, are far more than simple sea-going craft – they are veritable communication hubs, connected to multiple sources: headquarters, coalition partners, other armed forces and civil authorities, as well as to other traffic at sea, on land, in the air and in space. These connections compel navies to rely heavily on the availability and reliability of data, meaning that robust cybersecurity had now become just as important as the weapons on the foredeck.

Meeting these needs requires a trusted partner with a proven track record, and that is what the German Navy’s MKS 180 programme found in Thales.

The MKS 180 is a resilient, multi-purpose ship designed for long periods at sea, fulfilling a broad range of low-, medium- and high-intensity missions: monitoring maritime areas, reinforcing sea rescue teams and humanitarian aid efforts or supporting special forces in crisis zones. This adaptability places high demands on the ship’s mission systems in terms of performance, availability, maintainability and ease of use."
PDR Completed By Thales Alenia Space For Space INSPIRE – SatNews - SatNews,"Sun, 29 Nov 2020 08:00:00 GMT",https://news.google.com/rss/articles/CBMiW2h0dHBzOi8vbmV3cy5zYXRuZXdzLmNvbS8yMDIwLzExLzI5L3Bkci1jb21wbGV0ZWQtYnktdGhhbGVzLWFsZW5pYS1zcGFjZS1mb3Itc3BhY2UtaW5zcGlyZS_SAQA?oc=5&hl=en-US&gl=US&ceid=US:en,"Thales Alenia Space, a Joint Venture between Thales (67 %) and Leonardo (33 %), has announced that a major milestone for Space INSPIRE (INstant SPace In-orbit REconfiguration) development has been achieved by the accomplishment of the Preliminary Design Review (PDR).

The Americas at night viewed from space with city lights showing human activity in United States (USA), Canada and Mexico, New York, California. The elements of this image furnished by NASA.

Thales Alenia Space is developing this product line with the aim to allow seamless telecommunication mission and services reconfiguration, instant on-orbit adjustment to the demand, outstanding flexibility for video broadcasting and broadband connectivity services while maximizing the efficiency & effective use of the satellite resources.

This product line is supported by France’s space agency (CNES) with which a contract for satellite system engineering and development for phase CD activities has just entered into force in the frame of Space Inspire PIA (Plan d’Investissement d’Avenir) and by the European Space Agency through a dedicated Partnerships Project contract which has also entered into force and which will develop several building blocks outside France within an extensive European supply chain.

Space Inspire product line will embark on the following major innovations…

A new design and architecture to fully fit new satellites communication environment, in particular regarding flexible payload and multi launches capability

A new industrial approach enabling series production designed to lower cost satellites and reduced procurement schedule

Major breakthroughs with disruptive technologies to allow European industries to take the lead on major innovations

Following this Preliminary Design Review, Space Inspire product line is now entering into final design and qualification phases involving an industrial consortium all across Europe.

Executive Comments

“We are delighted to put on track our Space Inspire product line thanks to the fruitful partnership and strong involvement of all the industries and agencies teams. Mixing extremely high capacity, unique agility, on-orbit reconfiguration, flexible coverage, this solution is perfectly adapted to operators’ expectations in the evolving telecommunication market,” said Marc-Henri Serre, EVP Telecommunications at Thales Alenia Space."
