Titre,Date de publication,URL,Contenu,sentiment_finbert,sentiment_label,sentiment_score,sentiment_numerique
Thales Alenia Space selected by Telesat to build its broadband 298-satellite constellation Lightspeed - Thales,"Tue, 09 Feb 2021 08:00:00 GMT",https://news.google.com/rss/articles/CBMieWh0dHBzOi8vd3d3LnRoYWxlc2dyb3VwLmNvbS9lbi93b3JsZHdpZGUvc3BhY2UvcHJlc3MtcmVsZWFzZS90aGFsZXMtYWxlbmlhLXNwYWNlLXNlbGVjdGVkLXRlbGVzYXQtYnVpbGQtaXRzLWJyb2FkYmFuZC0yOTjSAQA?oc=5&hl=en-US&gl=US&ceid=US:en,"Thales Alenia Space selected by Telesat to build its broadband 298-satellite constellation Lightspeed Thales Alenia Space Telecommunications Satellite constellations Share this article



LinkedIn

With this historical contract, Thales Alenia Space confirms its position as the industrial benchmark in global satellite constellations offering the world’s most efficient services for mobile connectivity (maritime, in-flight), backhauling of 4G and 5G communications, government networks and enterprise communications.

Cannes, February 9, 2021 – Thales Alenia Space, a joint venture between Thales (Euronext Paris: HO) (67%) and Leonardo (Milan stock exchange: LDO) (33%), has signed an agreement with leading global satellite operator Telesat to be the prime contractor on the construction of Lightspeed, its advanced LEO network, a multi-billion dollar project initially comprised of a fleet of 298 satellites.

This agreement has been signed in the presence of Bruno Le Maire, Minister of the Economy, Finance and Recovery of France.

Following the intense work done on Lightspeed’s innovative design, this selection represents a major step in the deployment of the project, as Telesat and Thales Alenia Space significantly increase the momentum of activities in parallel with the finalization of the Lightspeed project’s financial close.

Telesat will rely on Thales Alenia Space not only to provide the space and mission segments, but also to be responsible for the end-to-end network performance and related specifications of the system.

Lightspeed’s space segment will initially be comprised of 298 satellites, in the 700-750 kg class. The network will deliver multiple terabits per second across the globe for secure, low-latency, high-performing broadband professional services.

Lightspeed is based on an innovative architecture and next generation technologies, providing a very high level of flexibility in capacity allocation. The constellation is built on a unique combination of advanced on-board satellite equipment – sophisticated active antennas that can dynamically refocus beams a thousand times per second, powerful and flexible processors able to address a range of bandwidth, optical laser links between satellites to create a true global mesh coverage of the world – and a mix of on-board and on-ground software ensuring the optimal use of the system resources. The flexibility brought by this system is the key to true competitiveness as it optimizes sellable capacity in relation to the location of demand, which can vary significantly across time and between hot spots such as airports and low-density areas such as remote communities. The optical laser link interconnections between the constellation satellites will provide global, mesh coverage around the world, including above the oceans and poles, with a high level of security for end-to-end services. It will optimize the ground segment with a lower number of gateway sites, more freedom on gateway locations, and the ability to deploy gateways in line with the loading of the system.

The first satellites are expected to be ready for launch in two years.

“I want to warmly thank Telesat for putting its trust in our company, and we are proud to have been selected after successfully going through a very demanding competitive process,” said Hervé Derrey, President and CEO of Thales Alenia Space. “Thales Alenia Space is mastering end-to-end flight proven systems, digitalization of payloads, inter-satellite links, management of international organization as well as industrial capabilities dedicated to constellations, and we are honored to capitalize on all this expertise to serve this major program”.

“With our design and engineering work complete, we’re excited to move forward with Thales Alenia Space as our Prime Contractor to manufacture Lightspeed, the world’s most advanced and capable LEO network, stated Dan Goldberg, President and CEO of Telesat. “Thales Alenia Space has an impressive track record and proven success in delivering innovative satellite constellations. We are grateful for the excellent work they have done to date on our project and look forward to working closely together to transform and redefine space-based communications with the Lightspeed network.”

“Telesat's Lightspeed constellation will be at the highest level of global space connectivity. I am happy with the selection of Thales Alenia Space as industrial prime contractor for this ambitious project supported by a strong partnership between France and Canada. This selection also illustrates the excellence of the French and European space industry,” said Bruno Le Maire, Minister of the Economy, Finance and Recovery of France.

Franck Riester, French Minister Delegate for Foreign Trade and Economic Attractiveness, is pleased with this major contract, which strengthens ties between France, Europe and Canada in the space sector: “In France, for the next 5 years, this contract will mobilize Thales Alenia Space, which I visited last January, as well as a large number of French companies. This reflects the quality of our industrial and technological know-how.""

In connection with the agreement Thales Alenia Space and Telespazio made a capacity commitment on Lightspeed.



With GlobalStar 2, O3B and Iridium NEXT, Thales Alenia Space has developed all of the Low and Medium Earth Orbit telecommunications constellations in full operational service today. The company has leveraged on this long-standing experience to address additional new markets such as high revisit earth observation, the surveillance of space from space, space debris tracking and the Internet of Things.

Artistic Views © Thales Alenia Space/Master Image Programmes

ABOUT THALES ALENIA SPACE

Drawing on over 40 years of experience and a unique combination of skills, expertise and cultures, Thales Alenia Space delivers cost-effective solutions for telecommunications, navigation, Earth observation, environmental management, exploration, science and orbital infrastructures. Governments and private industry alike count on Thales Alenia Space to design satellite-based systems that provide anytime, anywhere connections and positioning, monitor our planet, enhance management of its resources, and explore our Solar System and beyond. Thales Alenia Space sees space as a new horizon, helping to build a better, more sustainable life on Earth. A joint venture between Thales (67%) and Leonardo (33%), Thales Alenia Space also teams up with Telespazio to form the parent companies’ Space Alliance, which offers a complete range of services. Thales Alenia Space posted consolidated revenues of approximately 2.15 billion euros in 2019 and has around 7,700 employees in nine countries. www.thalesaleniaspace.com

THALES ALENIA SPACE – PRESS CONTACTS

Sandrine Bielecki

Tel: +33 (0)4 92 92 70 94

sandrine.bielecki@thalesaleniaspace.com

Tarik Lahlou

Tel: +33(0)6 87 95 89 56

tarik.lahlou@thalesaleniaspace.com

Cinzia Marcanio

Tel: +39 (0)6 415 126 85

cinzia.marcanio@thalesaleniaspace.com

Marija Kovac

Tel: +39 (0)6 415 129 91

marija.kovac-somministrato@thalesaleniaspace.com","{'label': 'Neutral', 'score': 0.9986553192138672}",neutral,0.9986553192138672,0
Thales Alenia selected to build Telesat's broadband constellation - SpaceNews,"Tue, 09 Feb 2021 08:00:00 GMT",https://news.google.com/rss/articles/CBMiV2h0dHBzOi8vc3BhY2VuZXdzLmNvbS90aGFsZXMtYWxlbmlhLXNlbGVjdGVkLXRvLWJ1aWxkLXRlbGVzYXRzLWJyb2FkYmFuZC1jb25zdGVsbGF0aW9uL9IBAA?oc=5&hl=en-US&gl=US&ceid=US:en,"WASHINGTON — Canadian satellite operator Telesat announced Feb. 9 it has selected Thales Alenia Space to manufacture 298 satellites for a broadband network in low-Earth orbit.

Telesat also announced that its constellation, named Lightspeed, will start offering services in 2023.

The selection of European manufacturer Thales Alenia caps a yearslong evaluation of competing providers. Thales Alenia Space in 2018 teamed with Maxar Technologies in a joint bid to take on Airbus Defense and Space. Thales Alenia and Maxar later split up and the Telesat constellation became a three-way competition.

Dan Goldberg, president and CEO of Telesat, told SpaceNews that Thales Alenia Space was selected for its satellite design but also for its engineering and ground services. The $3 billion deal is for the production of 298 satellites, network management software and for the integration of the satellites with gateways to be deployed around the world. The entire investment projected for Lightspeed is $5 billion.

Goldberg said Telesat and Thales Alenia have been working on the bus design for more than two years. He said Telesat was impressed by Thales Alenia’s performance as the prime contractor of the Iridium NEXT constellation and by the satellites it produced for SES’ O3B network. “That was a big part of our decision to select them,” he said.

Details about where the satellites will be manufactured have yet to be announced. “We expect that soon,” said Goldberg. “There will be significant job creation in Canada and in Europe.” Launches will start in 2022. The plan is to produce a satellite a day.

Telesat in 2019 signed an agreement with Jeff Bezos’ Blue Origin for launch services on the New Glenn rocket but it’s not exclusive, said Goldberg. “We’ll be working with other launch providers too.”

Telesat’s 700-kilogram satellites will be launched to polar and inclined orbits — 78 satellites will deploy to a polar orbit with 13 satellites in six planes at an altitude of 1,015 kilometers. The other 220 will go to an inclined orbit with 11 satellites in 20 planes at an altitude of 1,325 kilometers. The architecture was designed for pole-to-pole global coverage, concentrating capacity in some areas where more demand is expected, the company said.

Goldberg said Telesat’s target markets are network operators, internet service providers, the maritime industry and governments. He insisted that Telesat does not view SpaceX’s massive internet constellation Starlink as a direct competitor. “Our focus is very different,” he said. “We’re a business to business provider, consumer broadband is not our focus.”

Telesat said it is developing several types of user terminals for different markets.

Each Telesat satellite will have four laser communications terminals for inter-satellite and space-to-ground connectivity. That will allow Telesat to offer capacity on its network for customers to move data, including the U.S. government.

“With optical inter-satellite links we can route traffic all over the world,” said Goldberg. “This minimizes the number of gateways we need.”

Having high-bandwidth data links creates a market opportunity, Goldberg said. Companies or government organizations that operate their own spacecraft and have compatible optical links can hop onto Telesat’s network “and we can move traffic for them,” he said.

This capability is of interest to the U.S. Defense Advanced Research Projects Agency and the Space Development Agency which are building mesh networks in low-Earth orbit. Telesat was selected by DARPA’s Blackjack program to demonstrate optical inter-satellite link technology in orbit. The company also teamed with Lockheed Martin to study the interoperability between Telesat’s LEO constellation and satellites Lockheed Martin is building for the Space Development Agency.

“That is certainly a big part of the work we’ve been doing with DARPA to demonstrate how the U.S. government could have their own satellites that could leverage the global optical network,” said Goldberg. “This would give them a more flexible and cheaper option to deploy capabilities.”","{'label': 'Neutral', 'score': 0.9999985694885254}",neutral,0.9999985694885254,0
Thales NS50 Radar Bringing Game Changing Features for Vessels of All Sizes - Naval News,"Mon, 08 Feb 2021 08:00:00 GMT",https://news.google.com/rss/articles/CBMieGh0dHBzOi8vd3d3Lm5hdmFsbmV3cy5jb20vbmF2YWwtbmV3cy8yMDIxLzAyL3RoYWxlcy1uczUwLXJhZGFyLWJyaW5naW5nLWdhbWUtY2hhbmdpbmctZmVhdHVyZXMtZm9yLXZlc3NlbHMtb2YtYWxsLXNpemVzL9IBAA?oc=5&hl=en-US&gl=US&ceid=US:en,"Thales NS50 Radar Bringing Game Changing Features for Vessels of All Sizes Following the recent announcement that the NS50 was selected for 12 next generation Mine Counter Measures Vessels, we contacted Thales to find out what makes this radar unique.

4D and Fire control capabilities are true unique features of NS50

According to Thales, the NS50 provides for the first time a complete and superior level of self-protection capability against air and surface threats for this category of high value MCM vessels. A strategic choice for small to medium vessels, the NS50 offers dual functions between air and surface surveillance and fire control.

Contacted by Naval News, Commander Bultot, Project Leader of the BE-NL rMCM program said :

The Belgian and Royal Netherlands Navy are very pleased with the acquisition of the NS50 Radar. This advanced full 4D radar will provide the necessary features to our rMCM vessels to be able to perform their tasks in complex environments. The radar has very valuable features such as extended detection ranges, full aerial compilation picture for tracking our legacy UAV and other targets, excellent stabilization features, …

Pauline Clausard Leblais , Sales Manager for MCMV at Thales said during a phone interview:

This is an important contract for Thales because it gives us the opportunity to establish the NS50 in a market segment today which includes 2D radars exclusively. So we are happy with this contract award. We are very active on this market segment and of course we have several customers showing a great interest in the NS50.

Hugo Anbeek, NS50 product manager at Thales added:

“I think there is a very strong interest in the NS50 since we launched it at Euronaval 2018. We are pursuing several opportunities at this moment .”

Delivery of the first radar is planned for 2023 and while the last one is expected to be handed over to the customer before 2033, the contract spanning over a period of 10 years.

“We are currently in the final stage of the NS50 development. During this phase, we developed, produced and tested NS50 elements. The NS50 today has passed successfully all the major engineering design validation stages and we are now preparing for the series production of the radar” added Pauline Clausard Leblais.

The initial NS50 radar will be tested first at the Thales site of Hengelo (in the Netherlands) and then at the Naval Group shipyard in Brittany for the integration and tests of the radar with the combat system of the first-in-class MCM vessel for the Belgian Navy.

It has to be noted that unlike NS100 and NS200, Thales systematically delivers NS50 with a radome.

NS family of radars

Thales’ NS100 Naval Air and Surface surveillance radar (Credit: Thales Group)

An important aspect of the NS50 is that Thales maximized the use of components and software from the existing NS family of radars. “If you look at the below deck equipment, the commonality is almost 100%. The physical, electrical and data interfaces are almost identical. This helps the shipyards and integrators during construction of the ship, but it also helps us a lot in the development phase” explained Hugo Anbeek.

NS50 is an X-band radar, while NS100 and NS200 are S-band, therefore the transmitter receiver part is unique. There are four customers to date for the rest of the NS family of radars: The NS100 has been procured by the Republic of Singapore Navy (While Thales can not comment on this information but the RSN website indicates the Littoral Mission Vessels as the platform), the Royal Netherlands Navy (HNLMS Rotterdam and HNLMS Johan de Witt LPDs) and recently the Royal Navy (Type 31 frigates). The NS200 has been procured by the Royal Netherlands Army and is fitted on trucks.

Fire control

According to Pauline Clausard Leblais, what makes the NS50 unique is its fire control capability. Thanks to this new mode, customers don’t need to procure a dedicated fire control radar. With NS50 they pretty much get two radars in one. On the MCM motherships of the Belgian and Royal Netherlands Navies, the NS50 will be used to provide fire control data for the main gun (which is set to be the BAE Systems Bofors 40Mk4 as Naval News understands). There will be no dedicated fire control radars aboard these vessels.

“This is what makes the NS50 unique, it is a game changer. We bring dual performances in a single radar: Both surveillance and fire control. This is more affordable for the navies in terms of procurement. It also has advantages in terms of foot print and performances”.



Pauline Clausard Leblais

2D vs 4D

Thales calls the NS50 a “4D” radar. Thales image.

NS50 was designed to replace the Variant in Thales portfolio of naval radars. The Variant however, like all radars so far in this market segment (i.e. radar for MCM vessels, OPVs, Fast Attack Craft…) is a 2D radar while Thales defines the NS50 as being a “4D” AESA radar. Legacy 2D radars were limited to providing range and azimuth information only. In comparison, NS50 now brings:

Range

Azimuth

Altitude

Doppler / time on target

With NS50, Thales gives the end user the ability to electronically scan with the radar beams (dual axis multi beam technology): Thanks to the multiple beams in azimuth, the radar can spend more time on target and more effectively see and measure the target. This is yes another unique and game changing capability in this radar segment.

“NS50 is scalable. We can adapt the number of TR modules depending on customer requirements that means that NS50 can also be a good candidate for small corvette types of platforms”.



Hugo Anbeek

NS50 future upgrades and applications

Thales NS50 4D AESA radar scale-model showcased at LIMA 2019. Naval News picture.

A future upgrade of NS50 might bring a staring mode, where the radar stops from spinning and tracks the target more accurately, a technology inherited from the SMART-L MM which uses this mode for anti-ballistic missions. NS50 also inherits the latest radar technology from Thales development on the APAR Blk2.

Naval News understands that the NS50 could be used as a secondary, dedicated X-band radar aboard larger surface combatants (supplementing an S-band radar) in a similar fashion to Northrop Grumman’s SPQ-9B which is fitted aboard several classes of U.S. Navy and JMSDF vessels. Such a X-band radar has the capability to detect and track low-flying, high-speed, small Radar Cross Section anti-ship missile targets in heavy clutter environments…

Hugo Anbeek told us “That is an area where X-band radars excels over S-band radars because you have better performance against surface target, you have a better overall accuracy and resolution. For sure, we imagine NS50 being used in such a role for larger ships. We also see NS50 as a possible secondary radar, completing a NS100 or NS200”.

Naval News believes vessels such as Germany’s MKS180, Germany and Netherlands’ LCF replacement, Netherlands’ ASWF (M frigates replacement) and even Italy and France’s Horizon-class (post MLU) could feature NS50 in a similar role to SPQ-9B.

Right now Thales is focused on the naval market with NS50, but that doesn’t mean that it will not have a future in the land domain. This was the case of the NS200, initially unveiled at Euronaval 2016 for naval customers but the Netherlands Army ended up procuring it (as GM200 MMC).

About rMCM program

The Belgian Ministry of Defense officially notified the consortium Belgian Naval & Robotics (formed by Naval Group & ECA Group) on May 22, 2019, a contract to supply 12 motherships and associated equipment to the Belgian and Dutch Navies.

According to Commander Bultot, rMCM Project Leader, the first steel cut of the first-in-class ship is set to take place at the Kership (Piriou) shipyard in Concarneau, France, on 21 June 2021.

Designed by Naval Group, the MCM mothership has one port and one starboard LARS located slightly aft of midship, close to the ship’s centre of gravity. Each LARS consists of a pivoting A-Frame davit with the USV, weighing up to 18t, housed in a floating cradle. It allows the simultaneous launch of two USVs with maximal safety. For the Belgian-Dutch mine countermeasure (MCM) program, conducted by Belgium Naval Robotics – a Naval Group and ECA Group consortium -, they will be used to operate two ECA’s Inspector 125 USV.

The Inspector 125 USV has a length of about 12 meters, a beam of about 4 meters and a full load weight of 18.1 tons. According to ECA Group, the Inspector 125 is designed to receive a wide range of payload with easy and quick reconfiguration capability. It can carry, deploy and recover the A18 mid-size AUV, the T18 LARS for seafloor survey or MCM detection operation or 2x SEASCAN + 6x K-STER C for MCM identification and neutralization operations. The Inspector 125 has an endurance of 40 hours, a maximum speed of 25 knots and an operational range of 12 nautical miles (from the mother-ship).

The mothership itself is 82 meters long with a displacement of 2,500 tons and a crew complement of 30 sailors (total accommodation for 63 people). It is fitted with a Bofors 40Mk4 40m main gun system, FN Herstal’ Sea deFNder 12.7mm remote weapon stations, an NS50 radar by Thales, Sea Eagle EO/IR by Chess Dynamics, Saab TactiCall Communication System, and a platform for SKELDAR V-200 VTOL UAV.","{'label': 'Positive', 'score': 0.9999877214431763}",positive,0.9999877214431763,1
Paula Stinson: Fired Thales Academy physical education teacher accused of indecent liberties with child - WTVD-TV,"Sat, 13 Feb 2021 08:00:00 GMT",https://news.google.com/rss/articles/CBMiTGh0dHBzOi8vYWJjMTEuY29tL3RoYWxlcy1hY2FkZW15LXBhdWxhLXN0aW5zb24tdGVhY2hlci1hcnJlc3RlZC1wZS8xMDMzNDY2MS_SAVBodHRwczovL2FiYzExLmNvbS9hbXAvdGhhbGVzLWFjYWRlbXktcGF1bGEtc3RpbnNvbi10ZWFjaGVyLWFycmVzdGVkLXBlLzEwMzM0NjYxLw?oc=5&hl=en-US&gl=US&ceid=US:en,"Fired Thales Academy physical education teacher accused of indecent liberties with child

The WCSO said investigators learned that Stinson and the 14-year-old were exchanging text messages that were intercepted by the boy's parents who then turned them over to authorities.

The WCSO said investigators learned that Stinson and the 14-year-old were exchanging text messages that were intercepted by the boy's parents who then turned them over to authorities.

The WCSO said investigators learned that Stinson and the 14-year-old were exchanging text messages that were intercepted by the boy's parents who then turned them over to authorities.

The WCSO said investigators learned that Stinson and the 14-year-old were exchanging text messages that were intercepted by the boy's parents who then turned them over to authorities.

ROLESVILLE, N.C. (WTVD) -- A former Thales Academy physical education teacher is under investigation by the Wake County Sheriff's Office after being accused of having an 'inappropriate relationship' with a 14-year-old student.

Paula Louise Stinson, 30, of Wake Forest, is facing twelve counts of indecent liberties with a child, according to the sheriff's office.

The Wake County Sheriff's Office said on Saturday that investigators learned that Stinson and the 14-year-old boy were exchanging several text messages that were intercepted by the boy's parents who then turned them over to authorities. During the investigation, authorities also learned that Stinson had engaged in 'inappropriate interactions' with the student both at the school and at the boy's home over a two-week period.

Bob Luddy, the founder and chairman of the private school in Rolesville wrote Friday that Stinson had been ""terminated as an employee of Thales Academy effectively immediately.""

The school said it is actively working to find someone to fill her position as the investigation continues.","{'label': 'Neutral', 'score': 0.9996521472930908}",neutral,0.9996521472930908,0
