Titre,Date de publication,URL,Contenu
"In-flight broadband reaches new highs with 4G solution from Thales in the UK, Nokia and SkyFive - Thales","Tue, 27 Oct 2020 07:00:00 GMT",https://news.google.com/rss/articles/CBMigAFodHRwczovL3d3dy50aGFsZXNncm91cC5jb20vZW4vZ3JvdXAvam91cm5hbGlzdC9wcmVzcy1yZWxlYXNlL2ZsaWdodC1icm9hZGJhbmQtcmVhY2hlcy1uZXctaGlnaHMtNGctc29sdXRpb24tdGhhbGVzLXVrLW5va2lhLWFuZNIBAA?oc=5&hl=en-US&gl=US&ceid=US:en,"In-flight broadband reaches new highs with 4G solution from Thales in the UK, Nokia and SkyFive Share this article



LinkedIn

Following successful rollout across Europe, Thales in the UK, Nokia and SkyFive are launching a new 4G LTE Air to Ground (A2G) solution to a global market. Delivering a fibre like connectivity experience, A2G significantly improves the inflight access to web, streaming and on-line games to passengers. In addition to improved passenger experiences, aircraft operators will benefit from significantly shortened installation times, minimising the time aircraft are out of operation.

© Thales

Improved connectivity, enhanced experience

Offering seamless connectivity with speeds up to 100Mbps and latency of less than 50ms, this 4G LTE solution connects aircraft to high-speed Wi-Fi from the ground up. Utilising existing 4G technology, A2G connects aircrafts with the nearest purpose-built on-ground towers, seamlessly handing over between masts mid-flight to create consistently fast 4G connectivity throughout journeys. The high speeds and reduced latency are achieved through the impressive 4G LTE performance, combined with the short distances between the aircraft and towers, which are densely grouped to prevent aircrafts sharing bandwidth. The network's design also means A2G has greater capacity per km2 than current satellites.

Aboard A2G enabled aircraft, the experience for passengers will be comparable to using a 4G mobile phone service on the ground. The easy-to-access connection will make it possible for passengers to make uninterrupted video-conferencing calls, watch live TV or stream the latest series in HD from their own handset.

Easy installation, savings for airlines

As the aviation sector emerges from its biggest challenge yet, A2G presents an opportunity for carriers to make significant savings, improve customer experiences and increase ancillary revenues. Compared with SATCOM systems, the compact nature of the 4G antenna reduces CO2 emissions and cuts installation times down to just 12 hours, meaning aircraft spend less time out of operation while technology is installed.

Once installed, new 4G enabled in-flight capabilities will create an aircraft environment for an Internet of Things in which operational efficiencies such as engine offload data can be viewed in real time, customer experience can be measured and targeted advertising can be introduced. Better connectivity can also support the facilitation of new COVID-19 safety protocols as they are implemented.

Collaborating to create a safe, global network

The technology is being rolled out in regions around the world where domestic and international carriers will be able to use the 4G masts on land. It has been developed through a collaborative partnership with Thales providing the onboard terminal (modem+RF) and antenna; Nokia responsible for on-ground infrastructure and SkyFive’s patented software algorithms ensuring that aircraft can reliably connect at high speeds, high altitudes and across long ranges. With 30 years of experience in connecting airlines and proven European Aviation Network success, Thales has leveraged its expertise to ensure the benefits of the faster speeds do not come at the expense of a secure platform.

Andy Humphries, Managing Director, Flight Avionics at Thales in the UK, commented: ""For airlines, passenger connectivity and operational efficiency have been strategic imperatives in the past and are even more pronounced in the wake of the COVID-19 crisis. At Thales, we have used our expertise to deliver proven fast and reliable aircraft hardware and software solutions underpinned by a robust worldwide support network. Combined with SkyFive's specialism in A2G services and Nokia's mobile network infrastructure, the project will bring industry disrupting performance for passengers and airlines alike, with reliable Wi-Fi and low transmission latency delivered with low upfront investment and operational costs. We believe A2G will help to expedite the recovery of the sector by transforming the air travel experience while reducing costs as people start flying again."""
Start of the production of the Skylark constellation - Thales,"Mon, 26 Oct 2020 07:00:00 GMT",https://news.google.com/rss/articles/CBMiY2h0dHBzOi8vd3d3LnRoYWxlc2dyb3VwLmNvbS9lbi93b3JsZHdpZGUvc3BhY2UvcHJlc3NfcmVsZWFzZS9zdGFydC1wcm9kdWN0aW9uLXNreWxhcmstY29uc3RlbGxhdGlvbtIBAA?oc=5&hl=en-US&gl=US&ceid=US:en,"Start of the production of the Skylark constellation Constellations Satellite constellations Space debris Share this article



LinkedIn

Thales Alenia Space, LeoStella and NorthStar Earth and Space launch the development and production of the early satellites for the first constellation dedicated to monitor and track space debris

Cannes, Tukwila, October 27th, 2020 – Thales Alenia Space, the Joint Venture between Thales (67 %) and Leonardo (33 %), signed the first phase of a contract with NorthStar Earth and Space Inc., the Canadian space-based information services company, to start the development and production of the first three smallsat satellites that are part of the world’s first and most advanced commercial space-based environmental and near-space monitoring system.

© NorthStar

In November 2018, the Space Alliance, formed by Telespazio (Leonardo 67 % and Thales 33 %) and Thales Alenia Space announced to have taken a stake in NorthStar Earth and Space. Today, the industrial journey begins for the Skylark constellation, with Thales Alenia Space being responsible for the space system activities by providing the payloads alongside with LeoStella (a joint venture between BlackSky and Thales Alenia Space) providing the satellite platform and the assembly, integration and test facilities based in Tukwila for final assembly and delivery.

“Through the Space Alliance, Thales Alenia Space is proud to play a key role in the NorthStar’s success. NorthStar’s Skylark space-based system will generate unique and outstanding data to build value added services for Space Situational Awareness. Skylark signifies a first step in providing much needed timely and precise information to the satellite operators”, declared Herve Derrey, CEO of Thales Alenia Space.

The ability to view, understand and map the physical location of natural and man-made objects in orbit around the Earth (currently there are more than 600 thousand objects in low Earth orbit with billions of dollars of space assets at risk from collisions) is now becoming a real concern for all private or governmental satellite owners and operators. Tracking resident space objects from space with optical sensors will enhance and complement existing systems. By observing from multiple perspectives in space, Skylark satellites will significantly improve tracking of objects, the number of detected debris and the ability to predict potential collisions.

""NorthStar welcomes the world class expertise of Thales Alenia Space and LeoStella to our mission of delivering safe spaceflight operations in the New Space Economy. Together we look forward to achieving a future of peaceful and sustainable space for all”, added – Stewart Bain, CEO and co-founder, NorthStar Earth & Space.

The Skylark smallsats will be based on LeoStella’s LEO-100 Multi-Mission Bus and a compact optical instrument.

“The NorthStar space situational awareness constellation brings unique capabilities of free-flying Non-Earth Imaging satellites to the commercial sector. LeoStella is proud to be part of the team and to bring our multi-mission satellite platforms to support this important mission.” concluded Mike Hettich CEO of LeoStella.

About Thales Alenia Space

Drawing on over 40 years of experience and a unique combination of skills, expertise and cultures, Thales Alenia Space delivers cost-effective solutions for telecommunications, navigation, Earth observation, environmental management, exploration, science and orbital infrastructures. Governments and private industry alike count on Thales Alenia Space to design satellite-based systems that provide anytime, anywhere connections and positioning, monitor our planet, enhance management of its resources, and explore our Solar System and beyond. Thales Alenia Space sees space as a new horizon, helping to build a better, more sustainable life on Earth. A joint venture between Thales (67%) and Leonardo (33%), Thales Alenia Space also teams up with Telespazio to form the parent companies’ Space Alliance, which offers a complete range of services. Thales Alenia Space posted consolidated revenues of approximately 2.15 billion euros in 2019 and has around 7,700 employees in nine countries. www.thalesaleniaspace.com

THALES ALENIA SPACE – PRESS CONTACTS

Sandrine Bielecki Tel: +33 (0)4 92 92 70 94 sandrine.bielecki@thalesaleniaspace.com

Tarik Lahlou Tel: +33 (0)6 87 95 89 56 tarik.lahlou@thalesaleniaspace.com

Marija Kovac Tel: +39 (0)6 415 126 85 marija.kovac-somministrato@thalesaleniaspace.com

Cinzia Marcanio Tel: +39 06 41512685 cinzia.marcanio@thalesaleniaspace.com

About LeoStella

LeoStella is a state-of-the-art satellite design and manufacturing company transforming constellation construction by building smallsats cost-effectively and at scale. Based in Tukwila, Wash., LeoStella is a joint venture between Thales Alenia Space and BlackSky. The company was founded to meet the growing demand for efficient satellite development and manufacturing arising from the increasing number of constellations. For more information, visit https://www.leostella.com/.

LeoStella Press Contact:

Coleen Moffitt

colleen@communiquepr.com

Tel: 206-282-4923 ext. 113"
"Investigating Jupiter with KaT, a state-of-the-art transponder - Thales","Fri, 02 Oct 2020 07:00:00 GMT",https://news.google.com/rss/articles/CBMiY2h0dHBzOi8vd3d3LnRoYWxlc2dyb3VwLmNvbS9lbi93b3JsZHdpZGUvc3BhY2UvbmV3cy9pbnZlc3RpZ2F0aW5nLWp1cGl0ZXIta2F0LXN0YXRlLWFydC10cmFuc3BvbmRlctIBAA?oc=5&hl=en-US&gl=US&ceid=US:en,"Investigating Jupiter with KaT, a state-of-the-art transponder Thales Alenia Space Space Exploration Share this article



LinkedIn

Thales Alenia Space has just delivered a Ka-band transponder (KaT) to the European Space Agency (ESA) for integration in the 3GM, or Gravity & Geophysics of Jupiter and Galilean Moons radio package. The 3GM is one of the instruments on Europe’s upcoming JUICE mission (JUpiter ICy moons Explorer), enabling scientists to study the gravity field at Ganymede, the extent of the internal oceans on the icy moons, and the structure of the neutral atmosphere and ionosphere of Jupiter and its moons. KaT provides highly accurate two-way range and range-rate measurements at Ka band. In turn, the gravity experiment relies on the Ka-band radio link to help unveil the interior structure of Ganymede, in particular inferring the size of the subsurface ocean by measuring the moon's gravity field and tidal response.

Our engineers and technicians have continued critical operations for our customers in recent months despite the coronavirus pandemic, while complying with all health and safety measures.

Looking into Jupiter and its icy moons

Scheduled for launch in 2022 and expected to reach Jupiter in October 2029, the JUICE spacecraft is designed and built by Airbus Defence and Space as prime contractor. An ESA mission, with a major contribution from the Italian space agency ASI, JUICE will study Jupiter and its three large, icy moons: Ganymede, Callisto and Europa.

Discovered by Galileo in 1610, the moons hold out fascinating possibilities because they’re thought to have vast oceans of water beneath their surfaces, making them potentially habitable environments. The mission will explore the surface and inner layers of the moons, investigating the conditions for the emergence of life. Thales Alenia Space’s contribution also includes the Deep Space Transponders (DST) for telemetry, tracking and command, and the Radar for Icy Moons Exploration (RIME), one of the 10 instruments.

© Thales Alenia Space

RIME (photo of the team in January 2020) is considered a key to mission success, because of its ability to directly identify and map the internal structure of the ice layers. Using a 16-meter antenna, which is provided by Space Tech GmbH under contract to Airbus Defense and Space, and working at a central frequency of 9 MHz, RIME is designed to penetrate the ice surface down to a depth of 9 kilometers, with vertical resolution of up to 30 meters in ice, to help determine the subsurface structure of the three moons’ oceans. ASI is funding radar development, including a contribution from NASA, with the University of Trento in charge of scientific aspects.

Technology Heritage

Venus, Mars, Mercury, Saturn, the Moon, Jupiter, asteroids and comets… Thales Alenia Space’s technology is a critical part of deep space probes such as Mars Express and the ExoMars Trace Gas Orbiter (currently in orbit around Mars); Venus Express; Cassini-Huygens (the Cassini probe completed its mission to Saturn in 2017 by burning up in the atmosphere); Rosetta, which has gathered data to characterize this comet’s environment and nucleus, thus providing clues to the origin of the Solar System; Gaia, which is mapping the Milky Way with unprecedented accuracy; Lisa Pathfinder, which paved the way for in-flight testing of gravitational wave detection; BepiColombo, now on its way to Mercury; and Solar Orbiter, which will take a close look at the Sun, in a way previously thought impossible.

All these spacecraft communicate with Earth from a distance of several Astronomical Units (millions of km) (ndt: AU = mean distance from Earth to Sun, 149.6 million km), while relying on the compact Deep Space Transponder from Thales Alenia Space, which combines state-of-art microwave technology.

KaT was designed and developed by Thales Alenia Space in Italy in cooperation with the University of Rome-La Sapienza prof. Luciano Iess, and with ASI funding, to perform a radio-science experiment. This concept draws on our experience with the Cassini mission. The Ka-band Translator was the first to use a radio-link in the Ka band (32–34 GHz), thus offering outstanding frequency stability among other advantages. This instrument enabled the Italian scientific community to verify the relativistic deflection of a radio signal fifty times more accurately than any made previously (see the article in Nature, September 25, 2003). In 2008 we supplied a KaT for NASA’s Juno mission. The KaT used on BepiColombo went even further, because it was the first radio-science device to employ an innovative broadband (50 MHz) pseudo-noise ranging technique that provided two-way range measurements to an accuracy of within a centimeter at 50 million kilometers from Earth (see “Report on first in-flight data of BepiColombo’s Mercury Orbiter Radio-science Experiment”, IEEE Transactions on Aerospace and Electronic Systems, July 2020).



The novel KaT designed and developed for JUICE (see photo) represents a further upgrade, since radiation-hardening hasbeen increased to cope with the harsh environment around Jupiter.

© Thales Alenia Space"
The naval combat of tomorrow will be collaborative - Thales,"Tue, 13 Oct 2020 07:00:00 GMT",https://news.google.com/rss/articles/CBMiZGh0dHBzOi8vd3d3LnRoYWxlc2dyb3VwLmNvbS9lbi9ncm91cC9qb3VybmFsaXN0L21hZ2F6aW5lL25hdmFsLWNvbWJhdC10b21vcnJvdy13aWxsLWJlLWNvbGxhYm9yYXRpdmXSAQA?oc=5&hl=en-US&gl=US&ceid=US:en,"Interview with Admiral Stéphane Verwaerde, Thales Group defence advisor (naval)

Admiral Verwaerde, when people talk about overseas military interventions, the first thing they think about is boots on the ground rather than naval operations. Does that mean the seas and oceans are calm, geopolitically speaking?

Quite the opposite. Repeated incidents in the South China Sea and recent tensions in the Eastern Mediterranean are clear reminders that the maritime space is an important nexus of confrontation when nations have conflicting ambitions. Instances of provocation and intimidation at sea are frequent, and there is an increasing risk that these tactics could lead to direct, high-intensity confrontation. It's also important to remember that maritime threats have changed a great deal in recent years. For all these reasons, maritime powers continue to invest in their fleets, and particularly in the development of new systems and weapons to counter these threats and assert their maritime sovereignty.

Can you tell us more about the new threats?

The new threats come from new types of weapons, new platforms and developments in the electromagnetic environment. Let's start with the weapons. There is now a new generation of long-range hypersonic sea-skimming or steep-dive missiles. Often fired in salvo mode, these weapons are equipped with complex guidance systems and their missile seekers are so sophisticated that current warships struggle to deal with them. The Russian Tzirkon missile, for example, has a range of 1,000 km and flies at nine times the speed of sound!

Likewise, supercavitating torpedoes are capable of travelling huge distances at speeds of more than 200 knots, compared with no more than about 50 knots* for a conventional torpedo.

As for platforms, stealth technology has come a long way in recent years. Aircraft are harder and harder to detect with radar and have smaller infrared signatures, surface ships have flat superstructures that reflect radar signals less effectively, and so on. Submarines are also becoming more and more discreet. They are covered with anechoic tiles to absorb the signals emitted by enemy sonars, and they can stay immersed for long periods thanks to new propulsion technologies like AIP (Air Independent Propulsion), which don't rely on an outside air supply.

Unmanned systems in the air, on the surface and underwater are another challenging new threat, especially when they're deployed in swarms.

The electromagnetic environment is becoming more congested and harder to manage, especially close to coastlines (5G, IoT, etc.). Even in low-level crises, naval radars, communications and satellite navigation systems are jammed more and more frequently. And cyberattacks are a major threat to maritime forces, given their reliance on high-quality data.

As you can see, it is becoming extraordinarily complex to establish and maintain maritime dominance.

How can navies respond to these increasingly sophisticated threats?

The key to success is to detect the threat early and react as quickly as possible. And detecting a threat early, particularly in a naval context, means detecting it at long range. So the conventional response is to equip warships with higher-performance sensors and effectors, such as the Sea Fire radar, which can track large numbers of targets simultaneously, very wideband sonars for submarines, long-range infrared sensors, optical systems relying on artificial intelligence to automatically recognise moving targets, and electronic warfare systems that can detect targets at long distances and automatically identify the radars used by hostile missiles and platforms.

Communications are of such huge importance that counter-jamming and area jamming capabilities are an indispensable way to deny the adversary exclusive control of the electromagnetic spectrum. And for naval units to be resilient, they need to be shielded from cyberthreats, with proven cybersecurity and warning systems and the ability to reconfigure quickly after an attack.

Are unmanned systems part of this ""conventional"" response?

Of course. Using unmanned systems increases the number of sensors we can deploy, helping us to detect threats earlier and offsetting the shortage of conventional warships. Because most Western navies have drastically reduced the number of frigates available for action, and can no longer deploy them in large numbers at the same time on the same mission in the same theatre of operations.

What about effectors?

Surface vessels can be equipped with missiles and rapid-fire guns to destroy hostile missiles or swarms of unmanned systems. Submarines can deploy underwater decoys and anti-torpedo torpedoes. There are also active electronic countermeasures, including jammers to deceive or destroy incoming missiles. Non-lethal, directed-effect weapons (laser, electromagnetic, etc.) will also be a useful way to thwart hostile detection systems, dazzle optical guidance systems or disable the electronics in incoming missiles. These weapons don't require munitions, but the vessels need large amounts of onboard electrical power. They are also effective against asymmetrical attacks by unmanned surface or air vehicles, or by swarms of small, fast boats with crews on board.

Will these enhanced capabilities be sufficient?

We need to go further. Naval combat must become collaborative. This approach is the best, if not the only, way to deal with these new threats.

In such complex environments, informational superiority — in other words, having a complete understanding of the maritime and tactical situation over as wide an area as possible — is absolutely crucial.

Keeping the upper hand in a naval combat situation can be a question of seconds. With missiles that fly at more than 3 km a second, reaction times are infinitesimally short — less than 10 seconds, compared with 30–60 seconds before.

To protect the most high-value warships (aircraft carriers, helicopter carriers, amphibious assault ships, etc.), the first thing to do is to minimise the time it takes to detect a threat. To control as wide an area as possible, this means deploying a combination of radar picket ships, unmanned air, surface and underwater systems, manned aircraft, helicopters and submarines that can operate at long distance while remaining within the range of communication systems. And to detect attacks early enough to respond, sensor quality is paramount.

Most importantly, we need to speed up the tempo of information exchanges to optimise the effectiveness of our sensors and effectors. Ships and their sensors need to interact in real time if they are to fully exploit the enormous data flows generated by today's digital sensors.

Which capabilities need to be developed to achieve this?

I see four main types: secure connectivity, data security, data storage and analytics, and artificial intelligence. These technologies are the key to processing huge and growing volumes at the speed of light. We must focus on guaranteeing the resilience and autonomy of a naval force at sea. That translates into a need for distributed ship/shore architectures, with onboard data hosting and processing capabilities and equipment that is reliable, robust and easy to deploy and use.



Are crews ready for these new challenges? Can they deal with this time pressure?

The question of crew instruction and training is extremely relevant. Until now, frigate crews, for example, underwent training at sea several times a year under real operational conditions. Today it is no longer conceivable for every crew of every ship to be trained to respond to a salvo of hypersonic missiles, for example, in the same way.

Training at sea is still indispensable, of course, but it needs to be complemented by sophisticated simulation systems. The only practical way to train ops room and bridge personnel is to combine at-sea training with simulator-based training ashore and alongside. These interconnected training solutions are crucial to the crews' ability to deal with new threats.

*1 knot = 1 nautical mile per hour (1,852 m/h)."
