Titre,Date de publication,URL,Contenu
Thales and Nexter RAPIDFire Gun System Chosen for Future French Navy Warships - Overt Defense -,"Thu, 05 Nov 2020 08:00:00 GMT",https://news.google.com/rss/articles/CBMidmh0dHBzOi8vd3d3Lm92ZXJ0ZGVmZW5zZS5jb20vMjAyMC8xMS8wNS90aGFsZXMtYW5kLW5leHRlci1yYXBpZGZpcmUtZ3VuLXN5c3RlbS1jaG9zZW4tZm9yLWZ1dHVyZS1mcmVuY2gtbmF2eS13YXJzaGlwcy_SAQA?oc=5&hl=en-US&gl=US&ceid=US:en,"Pin 0 Shares

A consortium formed by Thales and Nexter has been selected by the French defense procurement agency to supply their RAPIDFire CT40 gun system to equip future French Navy vessels, providing close-in defense capability against air and surface threats.

RAPIDFire offers high precision thanks to its optronic fire control system integrated onto the turret and uses the new 40 mm gun developed by CTAI, the international subsidiary of Nexter Systems and BAE Systems. This has a firing rate of up to 200 rounds per minute using airburst ammunition and an effective firing range of 4,000 meters against air targets and up to 2,500 meters against surface threats. It can fire in a fully autonomous mode and is equipped with infrared and daylight TV channels, as well as a laser range finder.

Thomas Got, Vice-President Integrated Airspace-protection Systems at Thales, said that:

“We’re delighted to be supporting the French Navy as it enhances the self-defence capabilities of its warships. With its combination of fast-into-action time and firing accuracy, RAPIDFire, developed in cooperation with Nexter, provides the best response for protecting Navy vessels against modern threats. It has the potential to become a key component of our offering of advanced force protection solutions.”.

First delivery of RAPIDFire is scheduled for 2022. Once in production Thales and Nexter expect to offer land-based version of the system, allowing joint-service use of components and ammunition.

With the efficiency of loitering munitions and drones being all too clearly demonstrated in current conflicts, it may be that the consortium find that demands for an ”off-the-shelf” solution to close range, rapid-response precision air defence issues may be quite popular."
Thales Systems for MKS 180 - European Security & Defence,"Wed, 18 Nov 2020 08:00:00 GMT",https://news.google.com/rss/articles/CBMiUGh0dHBzOi8vZXVyby1zZC5jb20vMjAyMC8xMS9hcnRpY2xlcy9leGNsdXNpdmUvMTk5MzQvdGhhbGVzLXN5c3RlbXMtZm9yLW1rcy0xODAv0gEA?oc=5&hl=en-US&gl=US&ceid=US:en,"Damen Schelde Naval Shipbuilding and Thales have signed a contract for the delivery and full integration of Thales’s Mission and Combat System on the four MKS 180 frigates contracted by the German Navy. The system will be designed by Damen and completely built by German shipyards, under Damen’s project management. Valued at €1.5Bn, the contract illustrates Thales’s leading position in global naval integration. It will be executed by Thales’s naval Centers of Excellence in Hengelo (the Netherlands), Kiel and Wilhelmshaven (Germany) in cooperation with a substantial number of German subcontractors.

Underpinning this contract is the proven cooperation of the German and Dutch naval industries, including numerous joint opportunities for Damen and Thales in the Netherlands to innovate within naval shipbuilding projects, often with the participation of the Netherlands’ Ministry of Defence. The project underscores Damen’s and Thales’s ambition to build further cooperation with shipyards and partnering industries in high-end European naval programmes.

Thales Systems"
SCORPION: GRIFFON command post is qualified - Thales,"Tue, 24 Nov 2020 08:00:00 GMT",https://news.google.com/rss/articles/CBMiZWh0dHBzOi8vd3d3LnRoYWxlc2dyb3VwLmNvbS9lbi9ncm91cC9qb3VybmFsaXN0L3ByZXNzX3JlbGVhc2Uvc2NvcnBpb24tZ3JpZmZvbi1jb21tYW5kLXBvc3QtcXVhbGlmaWVk0gEA?oc=5&hl=en-US&gl=US&ceid=US:en,"SCORPION: GRIFFON command post is qualified Scorpion® Defence Land forces OMFV Share this article



LinkedIn

On 13 November 2020, the French Delegation for Armaments (DGA) qualified the command post vehicle (EPC) variant of the GRIFFON vehicle. At the same time, the first examples are being submitted for acceptance by the DGA's quality department at the Roanne site. Therefore, the three first GRIFFON EPC have been delivered to the Army technical section (STAT) which will continue the operational evaluation of this equipment with its rapid deployment within the regiments in sight. The GME (temporary grouping of companies) EBMR (Engins Blindés Multi-Rôles) comprised of Nexter, Arquus and Thales is fully mobilized on the production of the first 20 series GRIFFON EPCs to be presented to verification operations by the end of 2020. Ultimately, the SCORPION program calls for the acquisition of 333 units of this variant, half of which will be delivered by 2025. As a reminder, the SCORPION program aims to modernize the Army's combat capabilities and in particular to improve command through new information resources.

© ©Nexter

The GRIFFON EPC can accommodate a pilot and a gunner in the front, and five soldiers in the rear of the vehicle. From an external point of view, the silhouette of the EPC does not differ from the VTT Félin variant (troop transport vehicle). Only the armament changes, with the integration on the roof of a new-generation T2 remotely operated turret armed with a 7.62mm caliber. Inside, on the other hand, the GRIFFON EPC is fully equipped to accommodate a command post: communication means, large screens, a board and a printer. This variant is designed to accommodate latest-generation electronic equipment for collaborative combat: the vetronics common to the SCORPION platforms, the CONTACT joint radio, the SCORPION Combat Information System (SICS), the ANTARES optronic system offering the crew a 360° vision of the environment, as well as a gunfire location detector (or SLA, for Acoustic Localization System). In addition, the air-conditioning system adapts to all environments to guarantee crew’s comfort and the proper functioning of onboard electronics.

Thanks to its level of protection and mobility, the EPC variant of the GRIFFON enables a command post to be deployed quickly at the heart of operations. The force commander can thus conduct an engagement or monitor the progress of a regimental or brigade-level action. The arrival of the GRIFFON EPC is complementary to the GRIFFON VTT Félin, with the goal of projecting a joint battle group (GTIA) into a foreign theatre of operations by 2021.

Stéphane Mayer is delighted, on behalf of the GME formed by the three companies Arquus, Thales and Nexter (of which he is Chairman and CEO), that this new milestone has been reached on time: ""this qualification marks a new stage in the modernization of the French Army's equipment"".

About Nexter

Nexter, the leading French land defense company and third European player in the ammunition sector is part of the KNDS Group. The scope of its business includes as well the supply of weapon systems and ammunition for air and naval forces. Nexter also provides systems and protection solutions in the field of homeland security. The group continues to apply its international development policy with 69% of the order intake in 2019 intended for the export market. In France, Nexter is fully committed to meeting the objectives of the SCORPION program, through the upgrade of the Leclerc tank and the development of the VBMR Griffon and EBRC Jaguar vehicles within the temporary business venture between Nexter, Thales and Arquus, as well as the Lightweight VBMR. Nexter's 2019 turnover amounted to €1,1 billion, of which 16% is allocated to Research and Development activities. The group's range of products also includes TITUS® and VBCI armored vehicles, CAESAR® and 105LG1 artillery systems, smart ammunition (BONUS), robots, many equipment, as well as customer service, support and revaluation. More information on www.nexter-group.fr

Press contact

Louis Dosseur

+33 1 39 49 32 31

l.dosseur@nexter-group.fr

About Arquus

Arquus is a French Defense company, leader of land mobility solutions. Historical partner of the armies, Arquus has more than 25,000 vehicles currently in service in the French Army, 20,000 of which are supported by the company. Arquus takes part in the VBMR GRIFFON and EBRC JAGUAR programs, which are the new generation of the French Army’s combat vehicles, in the framework of a Temporary Grouping of Companies. Arquus is notably in charge of designing and delivering the drivelines and the self-defense weapon systems for these two vehicles. Arquus also takes charge of all the logistics for the spare parts and organs of the VBMR and EBRC vehicles of the SCORPION program, thanks to its new logistics facility in Garchizy. Expert of support solutions, with more than 20,000 vehicles serviced daily, Arquus presents complete support offers, built on the company’s historical knowledge. These solutions rely on a global logistics network, supported by the Volvo Group, Arquus’ parent company. Building on innovation, Arquus invests in major fields such as vehicle architecture, survivability, mobility, energy, robotization, weaponization, and support. Systems conceptor and integrator, Arquus also offers remote-controlled weapon stations (the Hornet range, developed as part of the SCORPION program), vetronics solutions (Battlenet) and mobility capabilities (4x4, 6x6, 8x8 drivelines). Arquus is present in more than 60 countries worldwide. To learn more about Arquus: https://www.arquus-defense.com

Press contact

Marin Tollet

+33 (0)6 51 00 04 18

marin.tollet@arquus-defense.com

About Thales

Thales (Euronext Paris: HO) is a global high technology leader investing in digital and “deep tech” innovations –connectivity, big data, artificial intelligence, cybersecurity and quantum technology – to build a future we can all trust, which is vital to the development of our societies. The company provides solutions, services and products that help its customers –businesses, organisations and states – in the defence, aeronautics, space, transportation and digital identity and security markets to fulfil their critical missions, by placing humans at the heart of the decision-making process.

With 83,000 employees in 68 countries, Thales generated sales of €19 billion in 2019 (on a basis including Gemalto over 12 months)."
"Arquus-Nexter-Thales: Scorpion, Griffon command post is qualified - EDR Magazine","Thu, 26 Nov 2020 08:00:00 GMT",https://news.google.com/rss/articles/CBMiWmh0dHBzOi8vd3d3LmVkcm1hZ2F6aW5lLmV1L2FycXV1cy1uZXh0ZXItdGhhbGVzLXNjb3JwaW9uLWdyaWZmb24tY29tbWFuZC1wb3N0LWlzLXF1YWxpZmllZNIBAA?oc=5&hl=en-US&gl=US&ceid=US:en,"November 23, 2020 – On 13 November 2020, the French Delegation for Armaments (DGA) qualified the command post vehicle (EPC) variant of the GRIFFON vehicle. At the same time, the first examples are being submitted for acceptance by the DGA’s quality department at the Roanne site. Therefore, the three first GRIFFON EPC have been delivered to the Army technical section (STAT) which will continue the operational evaluation of this equipment with its rapid deployment within the regiments in sight. The GME (temporary grouping of companies) EBMR (Engins Blindés Multi-Rôles) comprised of Nexter, Arquus and Thales is fully mobilized on the production of the first 20 series GRIFFON EPCs to be presented to verification operations by the end of 2020. Ultimately, the SCORPION program calls for the acquisition of 333 units of this variant, half of which will be delivered by 2025. As a reminder, the SCORPION program aims to modernize the Army’s combat capabilities and in particular to improve command through new information resources.

The GRIFFON EPC can accommodate a pilot and a gunner in the front, and five soldiers in the rear of the vehicle. From an external point of view, the silhouette of the EPC does not differ from the VTT Félin variant (troop transport vehicle). Only the armament changes, with the integration on the roof of a new-generation T2 remotely operated turret armed with a 7.62mm caliber. Inside, on the other hand, the GRIFFON EPC is fully equipped to accommodate a command post: communication means, large screens, a board and a printer. This variant is designed to accommodate latest-generation electronic equipment for collaborative combat: the vetronics common to the SCORPION platforms, the CONTACT joint radio, the SCORPION Combat Information System (SICS), the ANTARES optronic system offering the crew a 360° vision of the environment, as well as a gunfire location detector (or SLA, for Acoustic Localization System). In addition, the air-conditioning system adapts to all environments to guarantee crew’s comfort and the proper functioning of onboard electronics.

Thanks to its level of protection and mobility, the EPC variant of the GRIFFON enables a command post to be deployed quickly at the heart of operations. The force commander can thus conduct an engagement or monitor the progress of a regimental or brigade-level action. The arrival of the GRIFFON EPC is complementary to the GRIFFON VTT Félin, with the goal of projecting a joint battle group (GTIA) into a foreign theatre of operations by 2021.

Stéphane Mayer is delighted, on behalf of the GME formed by the three companies Arquus, Thales and Nexter (of which he is Chairman and CEO), that this new milestone has been reached on time: “this qualification marks a new stage in the modernization of the French Army’s equipment”.

Photo courtesy GME EBMR"
Brilinta Wins Indication in Recurrent Stroke Prevention - Medpage Today,"Sat, 07 Nov 2020 08:00:00 GMT",https://news.google.com/rss/articles/CBMiNGh0dHBzOi8vd3d3Lm1lZHBhZ2V0b2RheS5jb20vbmV1cm9sb2d5L3N0cm9rZXMvODk1MzPSAQA?oc=5&hl=en-US&gl=US&ceid=US:en,"FDA granted ticagrelor (Brilinta) an indication for secondary prevention in stroke and high-risk transient ischemic attack (TIA), AstraZeneca announced.

The P2Y12 inhibitor is to be used as part of a dual antiplatelet regimen along with a daily maintenance dose of 75-100 mg aspirin for the reduction of recurrent stroke risk.

The expanded indication was based on the THALES trial, which was published in July in the New England Journal of Medicine.

In the trial with more than 11,000 participants, minor stroke and TIA patients randomized to ticagrelor plus aspirin had lower 30-day composite stroke and death rates than those randomized to aspirin alone (5.5% vs 6.6%, HR 0.83, 95% CI 0.71-0.96).

The benefit had been driven by fewer ischemic strokes (5.0% vs 6.3%, HR 0.79, 95% CI 0.68-0.93), with no significant difference in mortality rates between groups (0.7% vs 0.5%, HR 1.33, 95% CI 0.81-2.19).

Ticagrelor did, however, lead to more severe bleeding (0.5% vs 0.1%, HR 3.99, 95% CI 1.74-9.14) and more intracranial hemorrhage (0.4% vs 0.1%, HR 3.33, 95% CI 1.34-8.28).

THALES investigators estimated a number needed to treat (NNT) of 92 to prevent one stroke or death and a number needed to harm of 263 for severe bleeding.

""One in four patients who have had a stroke will experience a second one, with the risk particularly high within the first 30 days. The approval of Brilinta in combination with aspirin is an important advancement to reduce the risk of recurrent stroke and much-awaited good news for physicians and patients,"" said THALES lead investigator S. Claiborne Johnston, MD, PhD, of the University of Texas at Austin, in a press release.

Following FDA approval of the new indication, Johnston's group released a secondary analysis of THALES, which showed ticagrelor associated with fewer disabling strokes, from either the progression of the index event or a new stroke.

Incidence of recurrent disabling stroke (with modified Rankin Scale [mRS] scores 2+) or death at 30 days reached 4.0% in the ticagrelor plus aspirin group and 4.7% of those taking aspirin alone (HR 0.83, 95% CI 0.69-0.99).

The NNT was 133 to prevent one disabling stroke or death and 112 to prevent one disabling or fatal ischemic stroke, the investigators reported in JAMA Neurology in conjunction with presentation at the European Stroke Organization/World Stroke Organization virtual conference.

The reduction of disabling stroke was consistent across prespecified subgroups with the exception of people with diabetes. This finding may be due to chance or could reflect hypofibrinolysis in these individuals, Johnston and colleagues suggested.

Ticagrelor did not significantly reduce recurrent non-disabling strokes (mRS 0-1) or death at 30 days in the trial (1.3% vs 1.6%, HR 0.79, 95% CI 0.57-1.08).

Overall, treatment with ticagrelor was associated with less disability when recurrent strokes did occur. In patients with recurrent ischemic stroke, the resulting disability burden favored ticagrelor over aspirin alone (OR 0.77, 95% CI 0.65-0.91).

Independent predictors of recurrent disabling stroke were baseline NIH Stroke Scale score 4 to 5, ipsilateral stenosis of at least 30%, Asian race, older age, and higher systolic blood pressure.

Johnston's team cautioned that residual confounding was possible in the secondary analysis. There was also no disability assessment at day 90, though authors argued that 30-day mRS is highly correlated with 90-day mRS scores.

Ticagrelor's new indication for stroke prevention joins its other existing indications: reduction of risk of cardiovascular death, MI, and stroke in patients with acute coronary syndrome or a history of MI; and reduction of the risk of a first MI or stroke in high-risk patients with coronary artery disease.

Notably, ticagrelor is more expensive than clopidogrel (Plavix), another P2Y12 inhibitor used in secondary stroke prevention.

Unlike ticagrelor, however, clopidogrel did not significantly reduce disabling ischemic strokes when added to aspirin in the POINT trial. It took a pooling of the CHANCE and POINT trials to suggest such a benefit, Johnston and colleagues noted.

The CHANCE-2 trial directly comparing the two P2Y12 inhibitors is ongoing.

Nicole Lou is a reporter for MedPage Today, where she covers cardiology news and other developments in medicine. Follow

Please enable JavaScript to view the comments powered by Disqus."
FDA Broadens Ticagrelor Indication to Stroke Prevention - Medscape,"Fri, 06 Nov 2020 08:00:00 GMT",https://news.google.com/rss/articles/CBMiK2h0dHBzOi8vd3d3Lm1lZHNjYXBlLmNvbS92aWV3YXJ0aWNsZS85NDA1NTHSAQA?oc=5&hl=en-US&gl=US&ceid=US:en,"The US Food and Drug Administration (FDA) has approved the antiplatelet agent ticagrelor (Brilinta) to reduce the risk for stroke in patients with acute ischemic stroke with a National Institutes of Health Stroke Scale (NIHSS) score of ≤5 or high-risk transient ischemic attack (TIA).

The new indication for stroke prevention is based on positive results from the phase 3 THALES trial, published in The New England Journal of Medicine last summer.

THALES was conducted in more than 11,000 patients who had experienced a minor acute ischemic stroke or high-risk TIA and for whom treatment was initiated within 24 hours of the onset of symptoms. The patients were randomly assigned to receive aspirin plus ticagrelor (90 mg twice daily) or aspirin alone for 30 days.

The trial demonstrated that ticagrelor plus aspirin reduced the rate of the primary composite endpoint of stroke and death by 17% (absolute risk reduction, 1.1%; hazard ratio, 0.83; 95% CI, 0.71 – 0.96; P = .015), compared to aspirin alone.

This was a statistically significant and clinically meaningful reduction. The primary composite endpoint was driven by a reduction in stroke, the company said in a news release.

The risk for severe bleeding events was 0.5% among patients taking aspirin plus ticagrelor and 0.1% for those taking aspirin alone. The results are in line with the known safety profile of ticagrelor, the company notes.

""One in four patients who have had a stroke will experience a second one, with the risk particularly high within the first 30 days,"" Clay Johnston, MD, lead investigator for the THALES trial and dean of the Dell Medical School at the University of Texas in Austin, said in the company news release. ""The approval of Brilinta in combination with aspirin is an important advancement to reduce the risk of recurrent stroke and much-awaited good news for physicians and patients.""

Last spring, the FDA cleared ticagrelor for use with aspirin to cut the risk for a first myocardial infarction (MI) or stroke in high-risk patients with coronary artery disease but no history of MI or stroke.

Ticagrelor is also indicated to reduce the risk for cardiovascular death, MI, and stroke in patients with acute coronary syndrome or a history of MI.

For more Medscape Neurology news, join us on Facebook and Twitter."
