Titre,Date de publication,URL,Contenu,sentiment_finbert,sentiment_label,sentiment_score,sentiment_numerique
Thales to Launch New Airport Security Scanner - Travel News Asia,"Fri, 10 Jun 2022 07:00:00 GMT",https://news.google.com/rss/articles/CBMiP2h0dHBzOi8vd3d3LnRyYXZlbG5ld3Nhc2lhLmNvbS9uZXdzMjIvMTA2LUFpcnBvcnRTZWN1cml0eS5zaHRtbNIBAA?oc=5&hl=en-US&gl=US&ceid=US:en,"(10 June 2022, 11:48 +07) Thales has developed a new airport security scanner designed to upgrade the airport experience for both passengers and airline companies.

Helixview, based on Thales' expertise in Artificial Intelligence (AI) and Cybersecurity, is a stationary, compact, and lightweight EDS CB C3-compliant scanner (the next standard applied to the certification for EDS CB) that combines X-ray nanotechnology-based electronic scanning and 3D imaging reconstruction.

Thales is aiming for Helixview certification by the end of 202

With this solution installed at checkpoints, passengers would no longer need to remove items from luggage. The technology is fine-tuned to detect all forms of prohibited items, whether explosives, knives and even weapons that have been dismantled and positioned in separate parts across several bags.

Artificial Intelligence is used to detect and interpret threats, instantly providing the operator with a threat/no threat instruction for the bag.

“I am sure that passengers will appreciate the new smoother and faster security checks using attractively and ergonomically-designed systems. This new technology will bring higher security and comfort with an optimal cost-performance ratio,” said Yannick Assouad, Thales.

Thales is aiming for Helixview certification by the end of 2023.

See also: Thailand Yacht Show Pattaya 2022 - Interview with Andy Treadwell, CEO of Verventia, iAqua Adventures Interview with Nick Murphy at Thailand Yacht Show 2022 in Pattaya, Jetboard Thailand Interview with Marilin Poonsiri at Thailand Yacht Show 2022 in Pattaya, TYS Pattaya 2022 Interview with Khun Sutiwas Chaisrivichiean, MD of MF Group (Thailand), Is Siam Seaplane Ready for Take Off? Interview with Dennis Keller, Chief Business Officer, New CEO at Pattana Sports Resort in Chonburi, Thailand - Interview with Bodintorn Juangroongruangkit, Sport and Fitness Training at Pattana Sports Resort in Chonburi, Thailand - Interview with Craig Wood, HD Video Interviews from Miss International Queen 2022 in Pattaya, Thailand and Mövenpick Siam Hotel Na Jomtien Pattaya - Interview with Dmitry Chernyshev, GM.","{'label': 'Neutral', 'score': 0.9999796152114868}",neutral,0.9999796152114868,0
PT Len and Thales to reinforce Indonesia's air defence capabilities - APDR - Asia Pacific Defence Reporter,"Wed, 01 Jun 2022 07:00:00 GMT",https://news.google.com/rss/articles/CBMiamh0dHBzOi8vYXNpYXBhY2lmaWNkZWZlbmNlcmVwb3J0ZXIuY29tL3B0LWxlbi1hbmQtdGhhbGVzLXRvLXJlaW5mb3JjZS1pbmRvbmVzaWFzLWFpci1kZWZlbmNlLWNhcGFiaWxpdGllcy_SAQA?oc=5&hl=en-US&gl=US&ceid=US:en,"Indonesia’s state-run defence industry holding, Defend ID, was recently launched to strengthen and modernise the country’s defence capabilities. In less than a month since its inception, PT Len and Thales have marked Defend ID’s first milestone by signing a contract for Thales GM403 radars that will help Indonesia achieve superior situational awareness and modernise its sovereign airspace.

Bobby Rasyidin, president director of PT Len Industri, and Frederique miller, vice president for Sales, Land and Air Systems at Thales, signed the contract at Thales’ headquarters in Paris on 17 May. The contract will span the next few years with Thales building the radars and Command and Control and PT Len constructing the radar stations, providing the installation and integration of the systems and managing civil works for the program, supported by Thales. Certain components on the radars will be locally manufactured by PT Len, and the project will involve the transfer of radar technology and building of local indigenous capabilities, enabling Indonesia to further strengthen its local defence industry.

The GM403 is currently in service with 17 nations worldwide and is a proven and reliable radar that provides superior situational awareness that help armed forces enhance airspace sovereignty amidst constantly evolving threats. Featuring full digital stack beam technology, the GM403 can detect and track threats such as low-flying UAVs while simultaneously detecting higher-altitude targets from stealth aircraft to fighter bombers at distances of over 500 kilometres. The digital architecture of the GM403 ensures that the radars remain resilient to new threats, cyber-attacks and electronic warfare tactics. When fully implemented into service, Thales radars will increase protection over the Indonesian airspace.

“Our working relationship with Thales which dates back several decades gives us the confidence that Thales is the right partner to help us drive Defend ID forward. This new radar contract is a further testament to our strong partnership and aligned vision to build expertise locally. Through this project, PT Len will be building the next generation of defence engineers in Indonesia,” said Rasyidin.

“Through this contract, Thales is delighted to help Indonesia safeguard and enhance the sovereignty of its airspace with one of the world’s most advanced air surveillance radars, capable of detecting new threats in a rapidly changing airspace. Our commitment to Indonesia goes beyond just providing equipment. With this contract and the strategic partnership agreement signed last month, we are excited to deepen our strategic partnership with PT Len to define a roadmap for Indonesia’s defence modernisation, including the development of a national Command & Control (C2) centre and to build local radar MRO activities,” said Miller.","{'label': 'Positive', 'score': 0.9999845027923584}",positive,0.9999845027923584,1
"Arquus, Thales and NTGS Launch the New Sherpa A2M (Advanced Mobile Mortar) - Force Magazine","Wed, 15 Jun 2022 07:00:00 GMT",https://news.google.com/rss/articles/CBMiV2h0dHBzOi8vZm9yY2VpbmRpYS5uZXQvYXJxdXVzLXRoYWxlcy1udGdzLWxhdW5jaC1uZXctc2hlcnBhLWEybS1hZHZhbmNlZC1tb2JpbGUtbW9ydGFyL9IBAA?oc=5&hl=en-US&gl=US&ceid=US:en,"On June 14th, Arquus, Thales and NTGS officially presented the new Sherpa A2M (Advanced Mobile Mortar) during a ceremony organised at Arquus’ booth at Eurosatory 2022.

The Sherpa A2M is an adequate answer to the tactical challenges met and created by artillery in high-intensity warfare—mobility, protection, close support to the troops on the ground and mobile counter-battery options at the fraction of the price of a Self-Propelled Gun (SPG).

The alliance of Arquus, NTGS and Thales allows the application of a truly complete solution delivering a unique indirect fire support solution, suitable for infantry support, collaborative armed forces troops and Special Forces, as well as autonomous artillery units looking for a high level of mobility and protection.









The Sherpa A2M combines the excellent mobility of a Sherpa Light, the proven Deployable Mortar System by NTGS and the 120mm rifled mortar barrel by Thales, into one full fully integrated new solution.

The vehicle embeds 120 mm rifled ammunition and in the future the mortar laser-guided ammunition. The rifled mortar barrel is three times more precise than smoothbore mortar.

Due to this superior efficiency and accuracy, it can achieve similar operational effects with much fewer shots; around 4 times fewer rounds than for a smoothbore mortar.","{'label': 'Positive', 'score': 0.9991599321365356}",positive,0.9991599321365356,1
"Eurosatory 2022: Arquus, Thales and NTGS present the new Sherpa A2M – MILMAG - MILMAG","Tue, 14 Jun 2022 07:00:00 GMT",https://news.google.com/rss/articles/CBMiV2h0dHBzOi8vbWlsbWFnLnBsL2VuL2V1cm9zYXRvcnktMjAyMi1hcnF1dXMtdGhhbGVzLWFuZC1udGdzLXByZXNlbnQtdGhlLW5ldy1zaGVycGEtYTJtL9IBAA?oc=5&hl=en-US&gl=US&ceid=US:en,"On June 14th, 2022, Arquus, Thales and NTGS have officially presented the new Sherpa A2M (Advanced Mobile Mortar), during a ceremony organized on Arquus’ booth at Eurosatory 2022. The Sherpa A2M is an adequate answer to the tactical challenges met and created by artillery in the high-intensity warfare: mobility, protection, close support to the troops on the ground and mobile counter-battery options at the fraction of the price of a Self-Propelled Gun (SPG).

On June 14th, 2022, Arquus, Thales and NTGS have officially presented the new Sherpa A2M (Advanced Mobile Mortar), during a ceremony organized on Arquus’ booth at Eurosatory 2022

The alliance of Arquus, NTGS and Thales allows the application of a truly complete solution delivering a unique indirect fire support solution, suitable for infantry support, collaborative armed forces troops and Special Forces, as well as autonomous artillery units looking for a high level of mobility and protection.

The Sherpa A2M combines the excellent mobility of a Sherpa Light, the proven Deployable Mortar System by NTGS and the 120mm rifled mortar barrel by Thales, into one full fully integrated new solution.

Thanks to Thales capability, the vehicle embeds 120 mm rifled ammunition and in the future the mortar laser guided ammunition. The rifled mortar barrel is three times more precise than smoothbore mortar. Due to this superior efficiency and accuracy, it can achieve similar operational effects with much less shots; around 4 times less rounds needed than for a smoothbore mortar.

NTGS provides its skills in global systems with the fire control system in the back of the vehicle. This system conveys information about targets and points of interest, which represents a significant strategic advantage. Thanks to their expertise, the A2M Sherpa delivers control across all mission operations and is already combat proven. The mortar and tube from NTGS and Thales are qualified both by NATO and by different armies.

Photos: Arquus

The Sherpa Light is a multipurpose, 4×4 armored vehicle, designed by Arquus to provide with a wide array of versions and customizations for all needs and missions, built on a single, proven base for increased commonality and ease of maintenance. It is a modern, mature, new-generation vehicle, which is built on many years of industrial experience, operational deployments on the battlefield and maintenance. It is protected against ballistic and mine as well as improvised explosive device threats with a STANAG 4569-certified protection, which ensures a high level of safety for the crew inside the vehicle during operations.

The Sherpa A2M can carry 40 rounds of 120mm mortar ammunition in the rear and possibly additional ammunition in the cabin, depending on user requirements. It has a range up to 8,2 km with standard rifled ammunition and up to 13km with a rocket assisted projectile, allowing it to enhance the protection of the embarked soldiers by engaging units without being hit (Shoot & Scoot).

Combining the expertise of these three companies’ expertise ensures the highest level of quality for each of the Sherpa A2M’s features: protected tactical mobility, ruggedness, superior firepower and accuracy, as well as easy deployable systems and intuitive fire control.

At Eurosatory 2022, the Sherpa A2M is presented with a Hornet Lite RCWS fitted with a 7.62mm MG for the vehicle’s self-protection. The Sherpa A2M can be seen on the Arquus booth, Hall 5A F281.

Press release","{'label': 'Positive', 'score': 0.999785840511322}",positive,0.999785840511322,1
NAVER Cloud hosts Korea's first sovereign cloud-based HSM service – Intelligent CIO APAC - Intelligent CIO,"Thu, 23 Jun 2022 07:00:00 GMT",https://news.google.com/rss/articles/CBMicGh0dHBzOi8vd3d3LmludGVsbGlnZW50Y2lvLmNvbS9hcGFjLzIwMjIvMDYvMjMvbmF2ZXItY2xvdWQtaG9zdHMta29yZWFzLWZpcnN0LXNvdmVyZWlnbi1jbG91ZC1iYXNlZC1oc20tc2VydmljZS_SAQA?oc=5&hl=en-US&gl=US&ceid=US:en,"Thales has announced it is helping NAVER Cloud launch the first Korean sovereign cloud Hardware Security Module (HSM)-as-a-service powered by Thales’ Luna Network Hardware Security Module.

The new service helps businesses meet the strict regulatory and industry mandates for control of their data and encryption as they transition from on-premises environments to a cloud or hybrid environment.

The new NAVER Cloud HSM-as-a-service allows customers to maintain independent ownership of their encryption keys, thus improving security management, control and convenience.

NAVER Cloud performs all the required configuration and management so customers can focus on the services they provide.

Raymond Yeung, Senior Director, Greater China and Korea, Data Protection Products at Thales, said: “Luna Network HSM is a highly certified and proven solution in the market for over two decades. Through the partnership with NAVER Cloud, Korean customers can leverage Luna Network HSM to enhance their data security by HSM-as-a-Service.

“We are excited to support the security needs of domestic industry through collaboration with more Korean companies, and to help Korean customers to ensure data sovereignty.”

Thales’ Luna Network HSM enables encryption and decryption functions, fast and powerful performance as well as flexibility across environments including hybrid and multi-cloud.

Click below to share this article","{'label': 'Positive', 'score': 0.9999889135360718}",positive,0.9999889135360718,1
Thales to deliver train control system to Romania's Softronic - SeeNews,"Fri, 17 Jun 2022 07:00:00 GMT",https://news.google.com/rss/articles/CBMiXGh0dHBzOi8vc2VlbmV3cy5jb20vbmV3cy90aGFsZXMtdG8tZGVsaXZlci10cmFpbi1jb250cm9sLXN5c3RlbS10by1yb21hbmlhcy1zb2Z0cm9uaWMtNzg4NTI00gEA?oc=5&hl=en-US&gl=US&ceid=US:en,"June 17 (SeeNews) - France-based multinational company Thales said on Friday it has been commissioned by Romanian locomotive manufacturer Softronic to deliver and equip five LEMA locomotives with level 2 European Train Control System (ECTS).

The contract also stipulates the delivery of PZB cab signalling system for transnational operation of Softronic locomotives in Romania, Hungary, Slovenia and Croatia, Thales said in a press release.

The vehicles will also be equipped with the national train control system MIREL that will be implemented by Slovenia's HMH.

""We are very pleased about this first ETCS Level 2 on-board system project in the Balkans as it opens up new possibilities for further business activities in a high-potential ETCS market,"" Thales Deutschland VP for main line signaling business Markus Fritz said.

""Together with our partner Softronic, we lay the foundation of a successful and long-term cooperation in the Romanian market, and thus shape the future of modern and safe rail transportation.""

Paris-headquartered Thales Group designs and builds electrical systems and provides services for the aerospace, defence, transportation and security markets. The group employs 81,000 in 68 countries, including Romania, where it employs some 800.

Headquartered in Craiova, in southern Romania, Softronic is the only manufacturer of electric multiple unit trains and electric locomotives in Southeast Europe.","{'label': 'Positive', 'score': 0.9996711015701294}",positive,0.9996711015701294,1
Sera Ingenierie showcases its new UGV Phobos armed with Thales rocket launcher | Eurosatory 2022 News Official ... - Army Recognition,"Thu, 16 Jun 2022 07:00:00 GMT",https://news.google.com/rss/articles/CBMiigFodHRwczovL2FybXlyZWNvZ25pdGlvbi5jb20vZXVyb3NhdG9yeV8yMDIyX25ld3Nfb2ZmaWNpYWxfb25saW5lX2RhaWx5L3NlcmFfaW5nZW5pZXJpZV9zaG93Y2FzZXNfaXRzX25ld191Z3ZfcGhvYm9zX2FybWVkX3dpdGhfdGhhbGVzLmh0bWzSAQA?oc=5&hl=en-US&gl=US&ceid=US:en,"SERA Ingénierie, a subsidiary of SOGECLAIR group, specializing in the design and manufacture of special vehicles for civil and military applications, announces the release of PHOBOS, its new Unmanned Ground Vehicle.

Follow Army Recognition on Google News at this link



The Phobos Unmanned Ground Vehicle at Eurosatory, France. (Picture source: Army Recognition)

PHOBOS, like a satellite of Mars, God of War, is a remotely operated modular robotic carrier of less than two tons net weight, and with a one-ton payload. It has been designed to accommodate various tools and sensors: surveillance, acquisition, reconnaissance, intelligence, armament, etc.

The two guiding principles of this design are mobility and autonomy. Mobility is reflected in the 4-wheel drive with reinforced suspensions that allow it to easily follow the tracks of armored vehicles in service on the all-terrain.

Autonomy is ensured by a diesel engine and a large tank that supply electrical and hydraulic energy to all embedded equipment. The Phobos can be armed with a rocket launcher made by Thales.

SERA Ingénierie is exhibiting PHOBOS and SOUVIM-XP during the Eurosatory exhibition from June 13 to 17, 2022 at Paris Villepinte Exhibition Center.","{'label': 'Neutral', 'score': 0.9999959468841553}",neutral,0.9999959468841553,0
Thales Glasgow factory evacuated after pro-Palestine activists storm roof - HeraldScotland,"Wed, 01 Jun 2022 07:00:00 GMT",https://news.google.com/rss/articles/CBMicWh0dHBzOi8vd3d3LmhlcmFsZHNjb3RsYW5kLmNvbS9uZXdzLzIwMTgwNjIwLnRoYWxlcy1nbGFzZ293LWZhY3RvcnktZXZhY3VhdGVkLXByby1wYWxlc3RpbmUtYWN0aXZpc3RzLXN0b3JtLXJvb2Yv0gEA?oc=5&hl=en-US&gl=US&ceid=US:en,"They say they are currently occupying the building, rendering it unusable and forcing workers to evacuate.

Inside the factory, they say they have dismantled and destroyed factory equipment and facilities.

The group claim Thales is ""one of the world's largest arms companies - producing armoured vehicles, missile systems and military UAVs (drones) - in particular, the Watchkeeper drone, used for surveillance and combat on captive populations"".

Police Scotland officers are currently at the scene.

A force spokesperson said: ""Around 6.25am on Wednesday, June 1, police were called to a report of a demonstration within the grounds of a business premise in Linthouse Road, Govan, Glasgow. Officers remain at the scene.

""Police Scotland is a rights-based organisation that puts our values of integrity, fairness, respect and a commitment to upholding human rights at the heart of everything we do.

""We have a duty under the European Convention on Human Rights to protect the rights of people who wish to peacefully protest or counter-protest balanced against the rights of the wider community.""

A Thales spokesperson said: “We can confirm we are working with the police to resolve this incident at our Glasgow site. The safety of our employees remains our primary concern at this time.

“The defence sector is proud to support our Armed Forces and security services with the equipment they need to protect our national security.

“Defence companies in Scotland and across the UK provide thousands of rewarding, high value, and long-term jobs. The sector works within UK ethical and transparency standards that are among the most robust of any country in the world.”","{'label': 'Neutral', 'score': 0.9996685981750488}",neutral,0.9996685981750488,0
"Orascom, Colas Rail and Thales to build the Cairo Metro Line 4 Phase 1 in a $686m project - WAYA","Sun, 26 Jun 2022 07:00:00 GMT",https://news.google.com/rss/articles/CBMia2h0dHBzOi8vd2F5YS5tZWRpYS9vcmFzY29tLWNvbGFzLXJhaWwtYW5kLXRoYWxlcy10by1idWlsZC10aGUtY2Fpcm8tbWV0cm8tbGluZS00LXBoYXNlLTEtaW4tYS02ODZtLXByb2plY3Qv0gEA?oc=5&hl=en-US&gl=US&ceid=US:en,"Orascom, Colas Rail and Thales have been granted a contract valued at $686m to design and build Line 4 for Cairo Metro after gaining all approvals from the Egyptian National Authority for Tunnels (NAT).

This phase of the Cairo Metro will be of a 19km length, including 16 stations essentially connecting between the centre of Greater Cairo and the Giza Pyramids complex. The second phase will have an addition of 19 stations and 92 trains, further facilitating the transportation in the heavily-congested Greater Cairo, targeting tourists in particular with its Grand Egyptian Museum and Giza Pyramids stations.

Thales will be providing its Integrated Communication and Supervision systems, which consist of multiple technical services such as security systems’ equipment, Multi Service Network, operations control system and more.

“This contract confirmed again the trust and the long-lasting relationship with NAT, built during the last 30 years. We are delighted to bring the latest generation of our Integrated Communications and Supervision systems associated with our innovative ticketing system to Egypt.” said Benoît COUTURE, Vice-President for Integrated Communications and Supervision activities at Thales.

Colas Rail, being this consortium’s leader, will be supervising on the project and ensuring a smooth implementation, as well as “install the power supply and help build the track and signaling”, as per their press release.

Read more: Egypt signs a deal with Siemens, Orascom and Arab Contractors to build high-speed rail","{'label': 'Neutral', 'score': 0.9995260238647461}",neutral,0.9995260238647461,0
Thales Australia appoints new CEO - Australian Defence Magazine,"Wed, 15 Jun 2022 07:00:00 GMT",https://news.google.com/rss/articles/CBMiT2h0dHBzOi8vd3d3LmF1c3RyYWxpYW5kZWZlbmNlLmNvbS5hdS9idXNpbmVzcy90aGFsZXMtYXVzdHJhbGlhLWFwcG9pbnRzLW5ldy1jZW_SAQA?oc=5&hl=en-US&gl=US&ceid=US:en,"Thales Australia and New Zealand has announced the appointment of Jeff Connolly as CEO following the decision by current CEO Chris Jenkins to retire after 14 years in the role.

Connolly will take up the role on 1 September 2022, with Jenkins agreeing to continue to serve Thales and its customers as a non-executive director after a period of leave.



Australian-born Connolly will join Thales from multinational technology and engineering company Siemens AG, where he has been Executive Chairman and CEO of Siemens Australia and New Zealand for the past 10 years. In a 30-year career at Siemens, Mr Connolly has held senior executive roles throughout Australia, Europe and Asia.



Thales Australia and New Zealand Chair, Belinda Hutchinson, said the company was delighted to welcome a highly regarded senior business leader of Connolly’s calibre to Thales.

“As an experienced, passionate and committed supporter of Australian research, innovation and modern manufacturing, Jeff has the strategic and operational capability to deliver for our customers and support our employees and other stakeholders,” Hutchinson said.



“Among other notable achievements, Jeff established and chaired the Prime Minister’s Industry 4.0 Taskforce, now known as the AiGroup Industry 4.0 Forum, and he remains on the Executive Council. More recently, Jeff chaired the Federal Government’s Research Commercialisation Taskforce, the recommendations of which led to the $2.2 billion University Research Commercialisation Action Plan to drive industry and university innovation and collaboration.”



Connolly said: “I am excited by the opportunity to lead one of Australia’s most innovative and trusted companies at a time when demand for its mission-critical services has never been more acute. I look forward to continuing to build on Thales’ well-earned reputation for innovation and world-class support for its defence and commercial customers in Australia, throughout the Asia-Pacific region and beyond.”



Hutchinson thanked Jenkins for his significant contribution to Thales over 35 years, including 14 years as the Thales Australia and New Zealand CEO.

“Chris is an outstanding leader who has served the company with distinction, growing Thales into one of Australia’s largest suppliers and exporters of mission-critical products and services. The board is pleased that Chris, after a period of leave, will rejoin the company as a non-executive director continuing his strong advocacy for Australian engineering, technology, design and manufacturing.”","{'label': 'Positive', 'score': 0.6789730191230774}",positive,0.6789730191230774,1
