Titre,Date de publication,URL,Contenu,sentiment_finbert,sentiment_label,sentiment_score,sentiment_numerique
Thales selected by Airservices Australia to carry out drone surveillance trials at Sydney airport - Thales,"Thu, 09 Jun 2022 07:00:00 GMT",https://news.google.com/rss/articles/CBMidmh0dHBzOi8vd3d3LnRoYWxlc2dyb3VwLmNvbS9lbi93b3JsZHdpZGUvYWVyb3NwYWNlL3ByZXNzX3JlbGVhc2UvdGhhbGVzLXNlbGVjdGVkLWFpcnNlcnZpY2VzLWF1c3RyYWxpYS1jYXJyeS1vdXQtZHJvbmXSAQA?oc=5&hl=en-US&gl=US&ceid=US:en,"Thales selected by Airservices Australia to carry out drone surveillance trials at Sydney airport Aerospace in Australia Share this article



LinkedIn

Airservices Australia has chosen Thales as its primary system integrator for an Integrated Drone Surveillance System (IDSS) trial at Sydney Kingsford Smith Airport.

The system of systems provided by Thales for the IDSS program integrates several sensors and an advanced command and control system to classify, recognise and identify potential threats in airspace around aerodromes.

At the core of the system, is a 3D holographic radar system, trusted by customers from international airports around the world including the United Kingdom, South East Asia and Oceana, for its safety, reliability, and excellent detection performances and classification of all types and sizes of drones.





Thales has been selected by Airservices Australia, an Australian Government-owned organisation responsible for the safe and efficient management of 11 per cent of the world’s airspace, as the prime systems integrator to launch an Integrated Drone Surveillance Trial utilising the company’s advanced drone surveillance solution.

With the use of drones for commercial and leisure purposes expected to grow exponentially, it is becoming a necessity to identify and efficiently manage their activity near airports.

A world leading systems-of-systems and solutions integrator for over 50 years, Thales is pushing technology boundaries with partners and airports to deliver advanced integrated drone surveillance systems for any airport configuration. Thales will commence a trial in 2022 at Sydney Kingsford Smith Airport, one of the busiest aerodromes in the world. ​

Thales’ solution uses a multi-layered sensor approach and advanced command and control for the detection, monitoring and identification of drones, as well as being able to pinpoint the location of the drone pilot. The entire system provides a comprehensive picture of the airspace in real time around the airport. At the core of the system is a radar, designed to detect, track and classify small, slow, low UAVs from the smallest remote-piloted drones to more sophisticated autonomous drones, in particular for the glide path where the biggest risk exists. ​

Since its launch in 2019, the solution has been deployed at several airports around the world in Europe, America and Asia. For more than 30 years, Airservices Australia has trusted and relied on Thales as the supplier of key ATM infrastructure and solutions, including the OneSKY program, the largest transformation of Australian ATM systems to date.

“Airservices, in partnership with Australian Government agencies, implemented drone detection capabilities at major airports across Australia several years ago. As uncrewed aircraft technologies continue to evolve and increase in use, we are investing in solutions that keep pace with latest developments. Our partnership with Thales allows us to trial next-generation drone detection capabilities to enhance the safe operation of crewed and uncrewed flights operating together in Australian airspace.” Peter Curran, Chief Customer Experience and Strategy Officer, Airservices Australia.

“We are looking forward to starting trials in partnership with Airservices Australia, to enhance their detection capabilities of drones. This partnership strengthens our collaboration of more than 30 years and represents a key building block for our strategy. Over the years, Thales has developed a strong expertise and experience to master the entire drone ecosystem to offer cutting-edge solutions. Indeed, we have demonstrated our ability to be a strong player in the field of airport air surveillance and anti-drone systems, through various worldwide references to date and our 3D holographic radar system solution is becoming a ‘game changer’ in protecting aircraft from rogue drones whilst maintaining airport operations.”Christophe Salomon, Executive Vice President Land and Air Systems, Thales.","{'label': 'Neutral', 'score': 0.9999576807022095}",neutral,0.9999576807022095,0
Thales Alenia Space at the 2022 Congress of the International Society for Photogrammetry and Remote Sensing - Thales,"Fri, 10 Jun 2022 07:00:00 GMT",https://news.google.com/rss/articles/CBMifmh0dHBzOi8vd3d3LnRoYWxlc2dyb3VwLmNvbS9lbi93b3JsZHdpZGUvc3BhY2UvbmV3cy90aGFsZXMtYWxlbmlhLXNwYWNlLTIwMjItY29uZ3Jlc3MtaW50ZXJuYXRpb25hbC1zb2NpZXR5LXBob3RvZ3JhbW1ldHJ5LWFuZNIBAA?oc=5&hl=en-US&gl=US&ceid=US:en,"Thales Alenia Space at the 2022 Congress of the International Society for Photogrammetry and Remote Sensing Thales Alenia Space Earth Observation Share this article



LinkedIn

The 24th Congress of the International Society for Photogrammetry and Remote Sensing, also encompassing space information sciences, took place this week in Nice. Thales Alenia Space was one of the event sponsors, and our teams showcased the company’s wide range of solutions, innovations and technologies in these areas.

Earth observation and remote sensing

We provided an overview of European programs involving Earth observation satellites and sensors, including imagers, spectrometers and interferometers. One of the leading programs is of course Copernicus, conducted by the European Commission, with a series of Sentinel satellite families developed by the European space industry for the European Space Agency (ESA). These spacecraft play a key role in environmental monitoring for Europe. Our company contributes to 11 of the 12 Copernicus missions, working hand in hand with ESA and the entire European space industry.

There are now six families of Sentinel satellites: Sentinel-1 provides radar data continuity with ERS and Envisat; Sentinel-2 and -3 monitor land and oceans; the Sentinel-4 and -5 instruments are designed for meteorology and climatology missions; and Sentinel-6 ensures operational continuity with Jason altimetry satellites.

Thales Alenia Space is prime contractor for the Sentinel-1 and -3 families (4 satellites each): in charge of the image ground segment for Sentinel-2; contributes to the imaging spectrometer on Sentinel-5P and the Poseidon-4 radar altimeter for Sentinel-6. In addition, we have been chosen for five of the six new Copernicus Expansion missions, as prime for three of these missions (CIMR, ROSE-L and CHIME), and payload supplier for two more (CO2M and CRISTAL). These new satellites will be used to measure carbon dioxide in the atmosphere from human activities, to check the thickness of the ice pack and overlying snow, to support advanced new services for the sustainable management of farms and biodiversity, to monitor sea surface temperature and salinity, as well as ice pack concentration, and to strengthen land monitoring capacity and emergency management services.

About smart space telescopes

In recent decades, government programs have developed state-of-the-art optical technologies and equipment combining high value and industrial efficiency. Thales Alenia Space has built on its long legacy in high and very-high resolution optics to deliver extremely competitive and high-performance smart telescope solutions. These telescopes are perfectly suited to the emerging market of spaceborne optical observation spacecraft featuring high revisit rates.

MTG infrared sounder

The congress also allowed us to focus on a state-of-the-art instrument, the infrared sounder, that will pave the way to future Earth observation systems. We reviewed the latest test results of the central spectrometer to spotlight its radiometric and spectral performance qualities.

The Meteosat Third Generation (MTG) family comprises six satellites: four imagers and two atmospheric sounders, capable of providing a 3D map of the atmosphere. This is a world first and a transformational breakthrough. These sounders will allow us to detect extreme climate phenomena a full half-day earlier than before. Also, by using the entire MTG system, meteorologists will be able to fine-tune weather forecasts up to eight days in advance – a major step forward in warning communities at risk when dangerous events are detected. MTG will not only help save lives, but also pave the way for new types of services that will benefit people in both Europe and Africa. Once the entire MTG fleet is in orbit, Eumetsat will deliver the world’s best-performing weather forecasting services.

Flexible satellite solutions, configurable in orbit

New platforms must meet market expectations and the specific requirements for remote sensing payloads. The key criteria that have to be designed into any new project include agility, flexibility, durability, innovation and a drastic reduction in development time and cost. We have been able to solve this difficult equation by applying co-engineering and co-production approaches with the other companies involved, through partnerships.

Artificial intelligence on observation satellites: examples, results in orbit and outlook

Thales Alenia Space, along with partners in the Saint-Exupéry Technological Research Institute (IRT), coordinated and funded the Responsive and Autonomous Imaging Chain (CIAR) project. CIAR tests the technologies needed to deploy artificial intelligence for image processing by embedded systems, whether on robots, satellites, drones or other vehicles.

The project was chosen for ESA’s OPS-SAT technology demonstrator, which aims to show the improvements in mission capability once satellites are equipped with computers as powerful as those down on Earth. This cubesat is a real flying lab, used to test new techniques concerning mission control and onboard systems. The program was conducted by the Austria’s Graz University of Technology as prime contractor, in conjunction with European partners.

In 2021, the CIAR consortium, working with ESA, successfully downloaded a neural network via a field programmable gate array (FPGA) device in a satellite. This was the first time a neural network had been deployed in orbit on this type of equipment – an achievement spotlighted during the previous congress.

This year, we’re focusing on another application: the detection and classification of vessels from space (architectures used, performance before and after deployment).

AI will allow us, for example, to process and/or analyze images, detect any potential anomalies, obtain information concerning the trajectory of a platform, and analyze communications signals to detect jamming. Used in Earth observation, satellite navigation or telecommunications, AI would significantly expand the scope of application. AI will of course make satellites even smarter. Tomorrow’s satellites with AI-based technologies could carry out tasks such as automated detection of anomalies, predictive maintenance and root cause analyses, even up to decision making. In short, artificial intelligence is an unrivaled gateway to autonomous satellite operation.

Video © Thales Alenia Space/Master Image Programmes - Illustrations: © Thales Alenia Space - © Thales Alenia Space/Imag[IN] - © ESA","{'label': 'Neutral', 'score': 0.9999984502792358}",neutral,0.9999984502792358,0
A deeper understanding - Thales,"Wed, 22 Jun 2022 07:00:00 GMT",https://news.google.com/rss/articles/CBMiggFodHRwczovL3d3dy50aGFsZXNncm91cC5jb20vZW4vdW5pdGVkLWtpbmdkb20vbmV3cy9kZWVwZXItdW5kZXJzdGFuZGluZy10aGFsZXMtYW5kLXBsZXhzeXMtam9pbi1mb3JjZXMtc3VwcG9ydC1uZXh0LWdlbmVyYXRpb24tYWly0gEA?oc=5&hl=en-US&gl=US&ceid=US:en,"A deeper understanding: Thales and Plexsys join forces to support the next-generation Air Force Share this article



LinkedIn

Military training for pilots has evolved a lot in recent years, with services and solutions becoming ever-more digitally oriented. And in signing a Memorandum of Understanding (MoU) with Plexsys, a leading simulation platform provider, Thales in the UK will be looking to accelerate this evolution.

The MoU will enable both companies to collaborate closely to develop a unique set of complementary expertise, tools and capabilities that offer even more advanced integrated training and simulation solutions to MOD customers – particularly in the air domain, but also across land, sea, and space.

Plexsys’ Advanced Simulation Combat Operations Trainer (ASCOT) 7 offers a cutting-edge, dynamic and intuitive computer-generated forces (CGF) platform, simplifying the development of complex scenarios to create the most high-fidelity immersive background in today’s synthetic battle-space.

Combined with Thales in the UK’s own immersive digital simulation systems, AI, training, data capture, modelling, and integration expertise, the partnership will look to develop truly unique services and products that solve real-world challenges for today’s forward-thinking multi-domain Armed Forces.

By joining forces to compete for larger contracts, Thales in the UK and Plexsys are laying the foundations for a successful partnership. One that promises the highly advanced multi-domain solutions the MOD demands.

Leading the charge

Daz Rawlins OBE is MD of Thales Training and Simulation in the UK. He moved straight into industry after serving 29 years in the RAF. As a Staff Officer, he specialised in training, capability development, and requirements management. With operational tours in the Falklands Islands, East Timor, Iraq and Afghanistan, he happily admits the military training he received saved his life on numerous occasions. He’s now passionate about providing next-generation training solutions to support the complex requirements of current and future warfighters.

Like all good partnerships, this MoU is a great example of the sum being greater than its parts. Ultimately, it’s about fostering an environment for real innovation across the multi-domain training ecosystem, so we can develop the advanced solutions our customers need.

Daz Rawlins OBE, Managing Director, Thales Training and Simulation, UK

Sanjay Khetia is Director of Plexsys Interface Products in the UK, which serves as the hub for growth and operations in the UK and EMEA regions. Recognised nationally and internationally as an authoritative expert within the field of modelling, simulation and training, Sanjay’s career spans over 20 years, with a demonstrable track record of designing, developing and delivering solutions that are innovative and progressive to a variety of sectors globally.

“We are excited about the alliance between Thales and Plexsys. Together, we’re well placed to provide high-fidelity training by matching Live, Virtual and Constructive (LVC) training readiness requirements with innovative product and world-class support, ensuring that all our defence and non-defence customer ambitions are realised.”

Sanjay Khetia, Director, Plexsys Interface Products, UK

The MoU with Plexsys is the first step in a series of MoUs Thales in the UK will be announcing in the near future, as it looks to expand its strategic partnerships with leading SMEs in operational analysis, digital twins, and next-generation operational training.","{'label': 'Positive', 'score': 0.9905542731285095}",positive,0.9905542731285095,1
National Shipbuilding Strategy - Thales,"Thu, 02 Jun 2022 23:19:43 GMT",https://news.google.com/rss/articles/CBMiaGh0dHBzOi8vd3d3LnRoYWxlc2dyb3VwLmNvbS9lbi9hbWVyaWNhcy9jYW5hZGEvb3VyLW1hcmtldHMvZGVmZW5jZS1jYW5hZGEvbmF0aW9uYWwtc2hpcGJ1aWxkaW5nLXN0cmF0ZWd50gEA?oc=5&hl=en-US&gl=US&ceid=US:en,"The National Shipbuilding Strategy is a long-term project to renew Canada's federal fleet of combat and non-combat vessels. It is delivering much-needed vessels to the Royal Canadian Navy and the Canadian Coast Guard, providing significant economic benefits to Canadians, and rebuilding a sustainable Canadian shipbuilding industry.

Since signing its first contract under the National Shipbuilding Strategy (NSS) in 2012, Thales has been a vital Tier-1 partner, supporting the development and delivery of Canada’s non-combatant fleets as the Electronic Systems Integrator (ESI) for the Royal Canadian Navy and the Canadian Coast Guard.

A ship without systems is like a human body without a heart.

- Chris Pogue, CEO Thales Canada

Thales Canada has been the Tier-1 ESI for the first two classes of CCG ships built under the NSS, responsible for the selection, procurement and integration of the electronic systems and equipment on the vessels being constructed, including radar, communications, bridge and mission systems.

Over ten years, we have continuously advanced our capabilities, honed our project management experience and applied lessons learned to drive value, innovation and excellence.

We have successfully reduced Time-to-Install by 50% to where we are today delivering integrated systems, both on-time and on-budget.

Thales is today the only systems integrator in Canada with the innovation infrastructure, staff and engineering maturity to fulfill the ESI role.



Thales is supporting the development of a sovereign and sustainable shipbuilding capability, having invested millions in developing Canadian talent, creating hundreds of jobs and engaging a diverse supply chain of 70+ companies that extends across Canada.



As the Electronic Systems Integrator for the Coast Guard’s newest fleet of vessels, we know that science and sustainability are vital considerations as they embark on more missions and operations in precarious conditions to ensure Canada’s safety, security, resiliency, and sovereignty.

We look forward to continued collaboration to further enable and support the Coast Guard in that ever-evolving process of innovation and transformation.

The success of the NSS is built on people – and trust, which takes time to build and a commitment to sustain and grow. We’ll keep doing our part.

- Chris Pogue, CEO Thales Canada

If you are a supplier with an interest in providing equipment, systems or services to Thales Canada Defense and Security , please download the Supplier Questionnaire from the link below, and return it (in its native Microsoft Excel format) to the Procurement Department at procurement@thalesgroup.com with “TCDS Supplier Questionnaire” in the subject line.

Download Supplier Questionnaire","{'label': 'Positive', 'score': 0.9995002746582031}",positive,0.9995002746582031,1
"Faces of Thales: Meet Emma Coen, our local rocket scientist - Thales","Mon, 20 Jun 2022 07:00:00 GMT",https://news.google.com/rss/articles/CBMic2h0dHBzOi8vd3d3LnRoYWxlc2dyb3VwLmNvbS9lbi9jb3VudHJpZXMtYXNpYS9hdXN0cmFsaWEvbmV3cy9mYWNlcy10aGFsZXMtbWVldC1lbW1hLWNvZW4tb3VyLWxvY2FsLXJvY2tldC1zY2llbnRpc3TSAQA?oc=5&hl=en-US&gl=US&ceid=US:en,"This week we’re celebrating International Women in Engineering Day and we spoke to Emma Coen to learn more about her journey from chemist to rocket scientist! With a passion for scientific study and research, as well as a life-long love affair with target rifle shooting, Emma Coen says the path that led her to work as a Senior Research and Design Engineer in the Research & Development Team in Australian Munitions was one of many happy accidents. Moving from the bright lights of Sydney to regional New South Wales, Emma has spent the last 15 years contributing to an industry she loves and is proud to be a part of. Here is her story.

Emma started her professional career as a theoretical polymer chemist, applying her knowledge in the pharmaceutical industry by developing inhalable insulin for a biotechnology start-up in the early 2000s. During this time, she also obtained a PhD from the University of Sydney and a Post Doctorate from the University of New South Wales, conducting research into high pressure gases and their unusual properties. Emma then moved into pharmaceutical formulations, in a biotechnology start-up. As with many start-ups, the company was experiencing financial challenges and Emma decided to pursue opportunities elsewhere. When Emma saw an ad for a position at Australian Defence Industries, she thought to herself “it’s a far cry from my work in polymers but I’ve been target rifle shooting since I was 14 so I know a bit about bullets.”

In 2007, she started working as a Product Development Scientist in the Research & Development team for Thales Australia in regional NSW. She was heavily involved in the development of mining boosters, a product that become very commercially successful. “When you’re in the lab mixing things in a beaker, you’re so concentrated on the job at hand, you don’t think much about the flow on effects. However, it’s been very gratifying to know I was part of something that has hugely benefited Thales and led to job creation, which is so important in small country towns.” During this time, she was selected to study and obtain a Master of Science in Explosive Ordnance Engineering from Cranfield University in the United Kingdom. “I’m never one to shy away from taking on extra studies to increase my knowledge so I loved my time there and am very grateful to have been given the opportunity.”

After another two years, Emma started to look for new opportunities within Thales to broaden her skills and experience. “I didn’t have to look very far or hard because as soon as I saw the high explosives plant, it was love at first sight.” She took on the role of Production Engineer – High Explosives and considers learning to be a shift engineer for the plant as one of her career highlights, likening it to driving a cruise ship - “challenging but so, so beautiful.” As much as Emma enjoyed her role, she realised that shift production work is difficult as a single mother with an energetic five-year-old and made the decision to return to her former team of Research & Development, in the role of Senior Research and Development Engineer.

One of the major projects she’s currently working on is the bilateral collaboration between Defence Science and Technology Group (DSTG), the Advanced Rocket Motor Technology Demonstrator. Emma explains that DSGT had spent eight years developing advanced rocket motor technology in the lab - Thales is now industrialising it to be made on a commercial and industrial scale. Emma is working on the propellant for larger rocket systems - one of the challenges when scaling up is ensuring the rocket fuel interacts properly with the rocket because the fuel starts curing as it is being made, “we have to mix the propellant ingredients fairly quickly to make sure we can pour it into the cases before it hardens,” explains Emma, ‘also, to ensure we keep a safe distance, we are in a building that’s a fair distance away when the ingredients are being mixed together, which means we can’t physically see and check its consistency. We have to rely heavily on advanced process control, and on our experience.”

Once the rockets are made, the team will start the testing program – both static burning and flight trials, in conjunction with DSTG and our Australian SMEs supporting this program. “If the rockets perform as we expect, then we may look to make even larger rockets. It’s a long-term strategically importance program, and is very exciting.”

More broadly, Emma and the team are looking to bring in the next generation of scientists and engineers into the Research & Development Team to support growth in sovereign capability. There is no university in Australia that teaches explosive ordnance engineering and so the Thales Australia’s strategy is to hire smart, passionate people to train and mentor whilst working with the education ecosystem to develop these courses. “It’s such a fascinating field and I encourage anyone who is interested in the field to just go for it,” Emma says before adding “It’s a male dominated industry, no doubt about that, but in all the years I’ve been in the industry, no one’s ever told me I couldn’t do something because of my gender. The Research & Development team hires talent based on merit and intellect. We value people who are passionate and are creative problem solvers.”

Find out more about the collaboration with DSTG here.

Find out more about Careers at Thales here.","{'label': 'Neutral', 'score': 0.5851074457168579}",neutral,0.5851074457168579,0
