Titre,Date de publication,URL,Contenu
Thales to Provide Mobile Driver Licenses to State of Florida - Thales,"Fri, 16 Oct 2020 22:21:10 GMT",https://news.google.com/rss/articles/CBMiUmh0dHBzOi8vd3d3LnRoYWxlc2dyb3VwLmNvbS9lbi90aGFsZXMtcHJvdmlkZS1tb2JpbGUtZHJpdmVyLWxpY2Vuc2VzLXN0YXRlLWZsb3JpZGHSAQA?oc=5&hl=en-US&gl=US&ceid=US:en,"Thales to Provide Mobile Driver Licenses to State of Florida

Thales is to provide the Florida Department of Highway Safety and Motor Vehicles with a nationally and internationally compliant mobile Driver License service.

Thales will act as a Credential Service Provider, at the heart of the state’s identity verification and online authentication programs.

Thales will also provide a mobile Driver License solution for Floridians to verify their identity, including proof of age as well as driving rights.



The State of Florida will be the first state in the United States to provide mobile Driver Licenses with leading-edge security mechanisms, fully compliant with rigorous national and international standards. Thales will supply the Florida Department of Highway Safety and Motor Vehicles with mobile Driver License verification services, as well as a mobile Driver License solution for residents.

In 2021, Florida residents will be able to apply for new mobile Driver Licenses that are easily accessible on a variety of devices, including smartphones and tablets. These mobile Driver Licenses meet the national and international standards from the American Association of Motor Vehicle Administrators and the International Organization for Standardization, meaning they can be used across the United States and internationally.

These new mobile Driver Licenses have the same validity as traditional driver’s licenses to verify identity, including proof of age and driving privileges. It also provides an additional role as a strong authentication tool, enabling Floridians to securely prove who they are online for a variety of services.

Now, to complement the traditional use of driver licenses to prove their identity, Florida residents will be able to simply activate their mobile identification application, select the type of verification needed, and hold up their mobile device. The mobile device never leaves the owners hand, making it a contact-free and convenient way to show ID.

“I’m excited for this innovation project that will make the state of Florida a national leader in offering secure and trusted mobile identification, which is a priority for our Governor, Ron DeSantis,” said Terry L. Rhodes, Executive Director of the Florida Department of Highway Safety and Motor Vehicles. “We have made a sustained commitment to the modernization of nearly every aspect of what our department does and how customers access our services, and Thales will be a great partner as Florida now steps into the future of mobile identification.”

“As ID fraud becomes more frequent and sophisticated, we made it a priority to reinforce ID verification by adding extra software security technologies. In the future, enterprises such as airports, hotels, car rental companies etc, in Florida will be able to rely on Thales to identify customers, while guaranteeing their privacy”, said Tony Lo Brutto, VP NORAM, Identity and Biometric Solutions at Thales.

These mobile Driver Licenses are harder to counterfeit, as they host a secure digitized credential whose authenticity can be checked rather than simply displaying a digital image of a driver license that could be easily manipulated.

For stronger privacy, users of mobile Driver Licenses control what information is displayed from the app depending on the context. For example, to enter a casino it only needs to show that the individual is old enough and the mobile Driver License will just display that information – not the individual’s name, date of birth, or address.

The Florida mobile Driver License program builds on Thales’ strong foundation of supporting state identity programs for 11 other U.S. states and five Canadian provinces.

Note to Editors

Thales, a leader in mobile driver’s license technology, successfully conducted the first U.S. mobile Driver’s License or Digital Driver’s License pilots across multiple states through a partnership and grant awarded in 2016 by the U.S. National Institute of Standards and Technology. Thales has recently been nationally recognized for the Digital ID Wallet, which incorporates the mobile Driver’s License solution, by Frost & Sullivan and ABI Research.

About Thales

Thales (Euronext Paris: HO) is a global technology leader shaping the world of tomorrow today. The Group provides solutions, services and products to customers in the aeronautics, space, transport, digital identity and security, and defence markets. With 83,000 employees in 68 countries, Thales generated sales of €19 billion in 2019.

Thales is investing in particular in digital innovations — connectivity, Big Data, artificial intelligence and cybersecurity — technologies that support businesses, organisations and governments in their decisive moments.

"
#Humpspotter Alert: ThinKom Ka antenna breaks cover on Spirit mod - Runway Girl Network,"Sun, 18 Oct 2020 07:00:00 GMT",https://news.google.com/rss/articles/CBMiZmh0dHBzOi8vcnVud2F5Z2lybG5ldHdvcmsuY29tLzIwMjAvMTAvaHVtcHNwb3R0ZXItYWxlcnQtdGhpbmtvbS1rYS1hbnRlbm5hLWJyZWFrcy1jb3Zlci1vbi1zcGlyaXQtbW9kL9IBAA?oc=5&hl=en-US&gl=US&ceid=US:en,"Rumors have long swirled that ThinKom Solutions was helping Thales rectify the problems plaguing its long-delayed Ka-band inflight connectivity program for Spirit Airlines – problems described by Spirit CEO Ted Christie to Runway Girl Network as “technical glitches”.

Thales batted away the notion last fall, telling Runway Girl Network at the Airline Passenger Experience Association exhibition in Los Angeles: “For Spirit, the configuration remains the same. As you mentioned, there has been some hiccup in the program. We are overcoming all the difficulties. And now we work very closely with Spirit as far as the installation of all the aircraft from their fleet.”

And, as recently as May 2020, it seemed that Thales’ antenna was still being employed. After RGN broke the news about Thales layoffs in Florida and California, a source told us that the French aerospace manufacturer was still using “the TCS antenna” for the Spirit program, in apparent reference to hardware made by the Thales division once known as Thales Communications & Security (TCS).

“They had a problem with a polarity switch and then with moisture getting into the antenna and not getting out. Supposedly that issue was fixed last fall 2019,” said the source, noting: “They did have a ThinKom [antenna] but stopped qualifying it.” Neither ThinKom nor Thales has confirmed this information.

Now, however, ThinKom’s Ka2517-branded antenna hardware appears to be in play. Ryan Vaughn, who works as certification project engineer/ODA unit member – structures at Thales, recently revealed to his followers on LinkedIn that Thales is nearing completion of “Thales’ latest in-flight Ka-band connectivity system at STS Mod Center in Melbourne, FL. Next step is electromagnetic interference (EMI) testing then STC issuance!”

Notably the image he shared showed the signature slimline disks of ThinKom’s mechanically steered, phased array VICTS-based antenna. As the saying goes, “A picture is worth a thousand words.” Unfortunately, the post – with photo – was later removed.

However, before the post was removed, Vaughn was asked if the image represents the complete configuration of the antenna. ThinKom CTO Bill Milroy answered the question, saying on the thread: “Yes. 18 dB/K broadside G/T, full ITU TX and RX band coverage, GSO/NGSO interoperable, and with the ability to reliably close links down to 10 degree elevation (….but without the yellow protective shipping covers of course!)”

For its part, MRO provider STS has said it will equip more than 100 Airbus aircraft with Thales Wi-Fi systems over the next 12 months at its Melbourne, Florida facility. “The first aircraft to be a part of this program, an A321, arrived a few days ago and installation work is already underway,” said Mark Smith, president of STS Aviation Group in a statement last week.

The Ka-band connectivity system, which will initially transmit via Hughes Ka satellites, and ultimately via the high-capacity SES-17 satellite, is a long time in coming for Spirit Airlines. In the spring of 2018, the ultra-low-cost carrier first announced plans to partner with Thales to bring the provider’s FlytLIVE-branded solution to its fleet later that year.

In terms of price points, the carrier said it would offer two products to start with – a web and texting tier, and a streaming tier. The web and texting service will be, on average, $6.50, and the streaming will be $9.00, it said.

“Actual costs may be lower or higher based on the route and demand,” according to Spirit’s latest online statement. The entire fleet equipage program is now expected to be finished in 2021, roughly two years later than originally planned.

News that the IFC retrofit program is finally progressing will be welcomed by Spirit passengers, who have shown a strong interest in being connected.

But Spirit management might also be eager to flip the switch. It is generally not widely known by the traveling public that point-of-sale devices used to transact food/beverage and retail sales on board aircraft without connectivity do not authorize credit cards in real time. Rather, these transactions occur when the aircraft lands and arrives at the gate, and when passengers are long gone.

Some passengers have cottoned on to the fact that Spirit is unable to process credit card transactions in real time. That can make onboard theft a concern.

ThinKom, meanwhile, is certainly not new to the IFC game. Its Ku-band antenna hardware is white labeled by Gogo as 2Ku, and is installed on thousands of aircraft. MRO provider GDC Technics also recently announced it has installed ‘all-in’ Ka-band IFC package for a Hillwood Airways-operated Boeing 737-700 in collaboration with ThinKom Solutions, Kontron and Hughes Network Systems. These partners stand at the ready to support additional Ka IFC programs.

Related Articles:"
RAPIDFire: Thales and Nexter to equip French Navy ships with new CIWS system - Naval News,"Tue, 27 Oct 2020 07:00:00 GMT",https://news.google.com/rss/articles/CBMieWh0dHBzOi8vd3d3Lm5hdmFsbmV3cy5jb20vbmF2YWwtbmV3cy8yMDIwLzEwL3JhcGlkZmlyZS10aGFsZXMtYW5kLW5leHRlci10by1lcXVpcC1mcmVuY2gtbmF2eS1zaGlwcy13aXRoLW5ldy1jaXdzLXN5c3RlbS_SAQA?oc=5&hl=en-US&gl=US&ceid=US:en,"RAPIDFire: Thales and Nexter to equip French Navy ships with new CIWS system The RAPIDFire system developed by the consortium formed by Thales and Nexter has been chosen by the French defence procurement agency (DGA) to equip future French Navy vessels with new artillery. This new system will provide the Navy’s surface vessels with an effective close-in defence capability against modern air and surface threats.

RAPIDFire is an innovative, versatile close-in weapon system designed to protect naval vessels against modern air and surface threats.

Thales / Nexter press release

Naval forces are exposed to several threats with complex behaviours, such as unmanned air and surface vehicles, light aircraft and missiles. RAPIDFire leverages the combined expertise of Thales and Nexter to meet the very short-range defence requirements of the armed forces. The solution features a latest-generation multi-threat (air and surface), multi-environment (land and naval) gun system, with a cost of engagement commensurate with the value of the threats.

RAPIDFire is a gun system that offers high precision thanks to its optronic fire control system integrated onto the turret, its advanced algorithms, powerful gun and automatic ammunition management system allowing the best reactivity and efficiency for the operator. RAPIDFire incorporates the new reference medium calibre 40 mm gun developed by CTAI, the international subsidiary of Nexter Systems and BAE Systems. The system is compatible with the full range of ammunitions developed for land forces programmes and is predisposed to the use of future ammunition as the smart Anti Aerial Airburst (A3B) round.

RAPIDFire is predisposed to the use of future ammunition such as the smart Anti Aerial Airburst (A3B) round.

Nexter and Thales formed a temporary consortium for RAPIDFire as part of a work programme and roadmap put in place 10 years ago. The programme is currently in the development phase. When development is complete, the weapon systems will enter production, and the first delivery is scheduled for 2022. Developed in a surface-to-air approach allowing use at sea but also from land, the project also provides an option to prepare for future use on land carriers. RAPIDFire, a true joint solution, will thus be a gun system capable of equipping naval, land and air forces.

“We’re delighted to be supporting the French Navy as it enhances the self-defence capabilities of its warships. With its combination of fast-into-action time and firing accuracy, RAPIDFire, developed in cooperation with Nexter, provides the best response for protecting Navy vessels against modern threats. It has the potential to become a key component of our offering of advanced force protection solutions.”



Thomas Got, Vice-President Integrated Airspace-protection Systems, Thales

“The 40 CTA has unrivalled power and compactness, making it a gun system that is particularly suitable for protecting surface vessels. With RAPIDFire, Nexter is delighted to extend the CTA40’s range of use in cooperation with Thales and the French Navy.”



Michel Vatrey, Systems and Programmes Director, Nexter

-End-

Naval News comments

The Chevallier-class replenishment tankers will be fitted with two RAPIDFire CIWS

As Naval News previously reported, the first two French Navy ship classes set to be fitted with this new close in weapon system (CIWS) are:

the Chevallier-class replenishment tankers ( also known as BRF )

) the future class of OPV (currently known as the Patrouilleurs Océanique program)

Future platforms will likely include the European Patrol Corvette (EPC) and the 6 mine warfare motherships for UAV/USV/UUV known as “bâtiments de guerre des mines” (BGDM).

The move to procure (and fund the development of) a new CIWS can be perceived as a doctrinal change for the French Navy: Unlike many NATO navies, Marine Nationale vessels did not use close in weapon systems as a last resort protection against incoming missiles, relying instead on advanced and powerful electronic warfare jammers. That being said, the RAPIDFire based on the 40 mm gun developed by CTAI won’t be just a CIWS but a “hybrid” system: Unlike the Phalanx or Goalkeeper (both 20mm and 30mm Gatling systems), RAPIDFire comes with a full range of ammunition and can be fitted as the main naval gun system on smaller displacement vessels."
Solving the Thales Ka-band antenna conundrum - PaxEx.Aero,"Fri, 16 Oct 2020 07:00:00 GMT",https://news.google.com/rss/articles/CBMiSWh0dHBzOi8vcGF4ZXguYWVyby90aGFsZXMta2EtYmFuZC1hbnRlbm5hLXRoaW5rb20ta2EyNTE3LXNwaXJpdC1haXJsaW5lcy_SAQA?oc=5&hl=en-US&gl=US&ceid=US:en,"The Thinkom ThinAir 2517 Ka-band antenna system is in the STC process on a Spirit Airlines A321, part of the Thales Ka-band offering

Late last year Thales conceded defeat. The company acknowledged that its Ka-band antenna solution was not living up to the challenges of delivering the new in-flight connectivity service to airline customers. It would require a “rip-and-replace” upgrade to meet its goals.

Now, with the resumption of installations at STS Aero Mod in Melbourne we’re learning just what that rip-and-replace means. The new Thales system will fly with the Thinkom Ka2517 antenna kit on board, not Thales’s in-house solution.

This is a huge boost for Thinkom, recognizing the efficiency and reliability of its mechanically steered, phased array solution. And using the separate antennae for transmit (17″) and receive (25″) similar to the 2Ku approach Gogo pioneered with Ku-band on commercial aircraft furthers the efficiency of the offering.

Since late 2018 PaxEx.Aero has been following reports of Thinkom’s progress in gaining customers for the Ka2517 kit on commercial aircraft. Gogo suggested late last year that it could roll out Ka-band services on its existing fleet and upped the speculation on that front in May 2020 when it announced an option to swap from 2Ku to 2Ka on a short maintenance visit, trading the Ku-band apertures on board for the smaller Ka-band options while retaining the rest of the installation infrastructure.

We’ve also followed stories of multiple A320 and 737 family STC programs, including the installation of the ThinAir Ka2517 system on private aircraft.

But now we know that at least one Spirit Airlines plane has the Ka2517 kit on the roof. And this is where things become even more interesting.

There’s more to the story…Dig deeper with a PaxEx.Aero Premium Subscription

A favor to ask while you're here... Did you enjoy the content? Or learn something useful? Or generally just think this is the type of story you'd like to see more of? Consider supporting the site through a donation (any amount helps). It helps keep me independent and avoiding the credit card schlock."
Thales launches small AESA radar for small aircraft - Defense News,"Fri, 16 Oct 2020 07:00:00 GMT",https://news.google.com/rss/articles/CBMiYWh0dHBzOi8vd3d3LmRlZmVuc2VuZXdzLmNvbS9jNGlzci8yMDIwLzEwLzE2L3RoYWxlcy1sYXVuY2hlcy1zbWFsbC1hZXNhLXJhZGFyLWZvci1zbWFsbC1haXJjcmFmdC_SAQA?oc=5&hl=en-US&gl=US&ceid=US:en,"PARIS – Thales launched on Oct. 16 its new AirMaster C, a compact, active electronically scanned array (AESA), airborne surveillance radar for small and medium-sized platforms.

Although the radar’s design phase has been finalized it still needs testing airborne. Nevertheless, Stéphane Lavigne, a sales director at Thales, said that the French Armed Forces Ministry had already notified its intention to buy the equipment for the future light joint army helicopter, the Guépard, developed by Airbus Helicopters and due to enter service in 2026.

Jon Bye, Thales' head of customer marketing, said that the AirMaster C would ensure customers got “that great picture, first time, every time.”

The active antenna radar is based on SiGe (silicon-germanium) technology fully validated in 2019. Thales says SiGe is “much more energy efficient than other technologies used for AESA radars, and allows the radar to self-cool.”

RELATED

François Arpagaus, the company’s airborne surveillance product line director, said that AirMaster C is easy to integrate, less complex to operate and would allow users to “see more, more of the time” thanks to “multi-polarization” which allows the radar to automatically select the optimal settings for each mission.

The radar was designed for a small footprint, making it 30 percent lower in size, weight and power than other radars in its class. It is small, no bigger than two A4 pages side by side, weighs less than 20 kg (45 lbs) and uses about 1 Kw of power. “It’s perfect for small and medium-sized platforms, both manned and unmanned,” Arpagaus said.

Lavigne said the sensor had been designed with a lot of input from radar users. “The program is launched, we are ready to take orders,” he said, adding that typical delivery time from contract signing would happen within two years.

Christina Mackenzie was the France correspondent for Defense News.

Share:"
