Titre,Date de publication,URL,Contenu,sentiment_finbert,sentiment_label,sentiment_score,sentiment_numerique
Thales to provide new-generation sonar suite for French Navy's nuclear-powered ballistic-missile submarines (SSBNs) - EDR Magazine,"Fri, 19 Feb 2021 08:00:00 GMT",https://news.google.com/rss/articles/CBMiiwFodHRwczovL3d3dy5lZHJtYWdhemluZS5ldS90aGFsZXMtdG8tcHJvdmlkZS1uZXctZ2VuZXJhdGlvbi1zb25hci1zdWl0ZS1mb3ItZnJlbmNoLW5hdnlzLW51Y2xlYXItcG93ZXJlZC1iYWxsaXN0aWMtbWlzc2lsZS1zdWJtYXJpbmVzLXNzYm5z0gEA?oc=5&hl=en-US&gl=US&ceid=US:en,"19 February 2021 – Minister for the Armed Forces Florence Parly on Friday 19 February announced the launch of the full-scale development phase of the SNLE 3G programme to build France’s third-generation nuclear-powered ballistic-missile submarines (SSBNs).

As part of the SNLE 3G programme, the French defence procurement agency (DGA) has signed an MoU with Thales for the development of a complete sonar suite including a broad range of sonar arrays and associated processing systems.

The technological innovations planned for the various sonars will lead to order-of-magnitude increases in data volumes compared to current systems, which will require the use of artificial intelligence and Big Data algorithms.

With the launch of full-scale development of France’s third generation of nuclear-powered ballistic-missile submarines (SNLE 3G), Thales is developing a new sonar suite based on disruptive technologies that represent a significant break from the systems in service today.

Thales will provide new-generation flank arrays and bow-mounted sonars, a towed linear array based on optical technology (ALRO), and all the other equipment making up the sonar suite (intercept arrays, echo-sounders, underwater telephones). The size of the arrays and the frequency bands they use will deliver unparalleled performance in terms of 3D (azimuth, elevation, range) detection precision.

The ALICIA sensor data processing system (Analyse, Localisation, Identification, Classification Intégrées et Alertes), with a user interface designed to handle the diversity and volume of available data, will optimise operator workload and provide decision support.

The new sonar suite will be deployed incrementally, with the first technological building blocks and system versions due to be installed on second-generation SSBNs (SNLE 2G) from 2025, and on the third-generation submarines (SNLE 3G) from 2035.

“Thales teams have been especially focused on the SNLE 3G project to ensure that it benefits from our very best sonar innovations, which have been taking shape over the last five years as part of nearly 50 years of consistent investments in sovereign R&D to guarantee the invulnerability of France’s SSBNs. New sovereign sonar array, processing and Big Data technologies will deliver unparalleled performance for the third-generation SSBNs and will also be of benefit to the modernised Triomphant-class second-generation SSBNs. We thank the Ministry for the Armed Forces for the trust they have place in us, and we are happy to be working hand in hand with Naval Group on this major national project.” Alexis Morel, Vice President, Underwater Systems, Thales.

Picture courtesy Naval Group","{'label': 'Positive', 'score': 0.9989284873008728}",positive,0.9989284873008728,1
"Stuttgart, the new heart of European rail transport - Thales","Tue, 16 Feb 2021 08:00:00 GMT",https://news.google.com/rss/articles/CBMiVWh0dHBzOi8vd3d3LnRoYWxlc2dyb3VwLmNvbS9lbi9ncm91cC9uZXdzL3N0dXR0Z2FydC1uZXctaGVhcnQtZXVyb3BlYW4tcmFpbC10cmFuc3BvcnTSAQA?oc=5&hl=en-US&gl=US&ceid=US:en,"Stuttgart, the new heart of European rail transport Share this article



LinkedIn

In 2008, the city of Stuttgart unveiled a new slogan describing itself as ""Das neue Herz Europas"" (""The new heart of Europe"") and launched an ambitious plan to transform rail transport in and around the metropolitan area.

As part of this plan, Thales was recently awarded a major contract (worth 127 million euros) to digitalise the signalling system for the Stuttgart rail node. Oliver Dörre, Chief Executive Officer and Country Director, Thales Deutschland, describes the project and explains how it is expected to be a blueprint and a decisive impulse for digitalisation of the entire German rail network.

Mr. Dörre, what does the Thales contract involve?

Deutsche Bahn, one of our most important customers in transportation, has selected Thales to comprehensively digitalise the Stuttgart rail node. Specifically, it involves installing a digital signalling system and deploying the latest European Train Control System (ETCS) Level 2 system, as well as an Automatic Train Operations (ATO) system with driver. This includes more than 6,000 electronic kilometre markers (balises), at least 1,300 axle counting points and approximately 650 point machines for real-time traffic supervision and guidance.

What are the main benefits for rail users?

The Stuttgart metropolitan region is one of the most densely populated in Germany, with about 2.7 million inhabitants, and has a high volume of road traffic. Furthermore, building new lines within the city limits is out of the question. By digitalising the signalling system, we will help boost the capacity of existing rail infrastructure by 20%.

How will you do that?

Digital signalling systems enable train operators to safely reduce the headway between trains, while maintaining maximum operational safety. That means they can run more passenger and freight trains, with better on-time performance and improved comfort, without building a single kilometre of new track.

And how will the operator, Deutsche Bahn, benefit?

Deutsche Bahn will benefit in many ways: by carrying more passengers and freight on the same rail infrastructure, reducing its carbon footprint and maintenance costs, increasing customer satisfaction, boosting revenues and improving the competitive performance of rail transport compared with other modes of transportation. More broadly, the project will support Europe's ambition to become carbon-neutral by 2050 through the promotion of greater rail transport use.

How important is the environmental dimension?

It's very important, particularly for Stuttgart region. By making rail transport more attractive, Deutsche Bahn and we are convinced that people will be encouraged to leave their cars at home and take the train instead — and that will bring significant reductions in CO2 emissions for us all.

“This demanding project will be a reference for European and worldwide major cities”.

What makes this particular contract so special for you?

For several reasons. First, it's a complex, challenging undertaking, in which we are able to demonstrate one of our core expertises, namely the handling of complexity at all technical levels. It's much harder to modernise an existing rail infrastructure, especially a high-density infrastructure like this, than to build a new one! You need to install a brand-new signalling system with minimum disruption to train service, and of course without compromising safety in any way. We are a renowned specialist in modernising legacy signalling infrastructure, as we have a lot of global experience not only with this type of operation on rail systems in general, but also in particular with Stuttgart, where we have been present for many years. What we are aiming to do is deliver top-notch technology from Stuttgart to Stuttgart itself.

That's also why the Stuttgart contract, which relies on very advanced technologies, is a co-innovation project with the operator. We have built a lot of mutual trust with our strategic customer Deutsche Bahn over the years, and in this case we will be working together even more closely because Thales's main competence centre for mainline rail is also located in Ditzingen, near Stuttgart.

Last, but not least, this contract is also the first stage in an even more ambitious programme. Stuttgart will be a blueprint for the digitalisation of Germany's entire rail network, and is likely to serve also as a shining reference for metropolitan regions all over the world.

“With our dual competencies in rail signalling and cybersecurity, Thales is exceptionally well placed to manage this type of large-scale project”.

What about cybersecurity?

Cybersecurity is clearly of paramount importance – it's something we design into the system from Day 1 and take into account at every subsequent stage of the project. We call this “Cyber-secured by design”. With our dual competencies in rail signalling and cybersecurity, Thales is exceptionally well placed to manage this type of large-scale project.

When will the project be delivered?

The Stuttgart node digitalisation project is scheduled to be completed by 2025. As of that date, long-distance, regional and suburban S-Bahn trains will all travel on a network equipped with the latest digital technology. Digitalisation of the entire German rail network is scheduled for completion in 2035.

[PRESS RELEASE] Thales will digitize Deutsche Bahn Stuttgart signalling system Read the Press Release","{'label': 'Positive', 'score': 0.9999563694000244}",positive,0.9999563694000244,1
"Thales reveals new high-fidelity cab mock up, receiving thumbs up from train operators - Thales","Fri, 26 Feb 2021 08:00:00 GMT",https://news.google.com/rss/articles/CBMifWh0dHBzOi8vd3d3LnRoYWxlc2dyb3VwLmNvbS9lbi91bml0ZWQta2luZ2RvbS9uZXdzL3RoYWxlcy1yZXZlYWxzLW5ldy1oaWdoLWZpZGVsaXR5LWNhYi1tb2NrLXJlY2VpdmluZy10aHVtYnMtdHJhaW4tb3BlcmF0b3Jz0gEA?oc=5&hl=en-US&gl=US&ceid=US:en,"Thales reveals new high-fidelity cab mock up, receiving thumbs up from train operators ETCS Mainline Rail Network Rail Share this article



LinkedIn

Train operators and owners had the chance to experience for themselves the latest on-board train control system by Thales.

The recent unveiling of a high-fidelity cab mock-up was an important milestone for Thales, not only confirming progress in an on-going project to retrofit three first-in-class (FiC) Class 43 power-cars, but also in establishing the company’s reputation as a supplier of train control systems in the UK.

Thales’s solution is set to modernise the on-board systems of the Class 43 power-cars which are owned by Porterbrook; this is an important step in Network Rail’s plans to introduce European Train Control System (ETCS) technology across Britain’s rail network.

The mock-up cab, located at Thales’s Birmingham site, gives drivers from train operating companies (TOCs) hands-on experience of how the system will look and feel. It also provides the opportunity for valuable user feedback to be fed into the Thales project team.

“We’ve received extremely positive feedback from the customers so far,” said Thales’s Senior Project Manager, Lokesh Anand. “Our stakeholders are able to experience the final solution and they are happy that we have taken on board their comments and feedback from the previous stage and that we are actively listening to them.”

“We have a state-of-the-art product, with proven, user-friendly technology and our solution provides the end user with the continuous speed supervision and real-time information about the state of the railway ahead”.

The positive response from end-users enables Thales to take a big step forward towards closing out final design phase and proceed towards commencing the fitting of the system to Porterbrook’s Class 43 power-cars, which are operated by a number of Britain’s TOCs as well as Network Rail. Installation of the systems is due to be completed and ready for integration testing this summer.

State-of-the-art technology

ETCS is the signalling and train control component of the European Rail Traffic Management System (ERTMS), which is being adopted throughout Europe and beyond. Thales’s ETCS compliant system makes use of standard trackside equipment and wireless controlling equipment in the train to receive line-side information, removing the reliance on the driver to watch track-side signals.

The ETCS technology lets TOCs operate more trains on the same line safely. The implementation will aim to increase railways operators’ operational performance through enhanced capacity and speed and improved track utilisation.

Thales in Germany has developed the on-board systems combining established ETCS technology with additional technological features including enhanced automation, cyber-security and engineering assurance. In the UK, Thales is responsible for integrating the equipment into the Class 43 rolling stock with project partners Ricardo Rail, with installation by Thales’s project partners, Yellow Rail, located in Derby.

Overcoming challenges

Thales is a global technology company specialising in designing and installing safety-critical transport systems but this project has faced challenges, not least the remote working restrictions imposed by Covid-19.

“The number of stakeholders and suppliers involved, and the safety critical nature of the work makes this a very complex project,” said Mr Anand. “Covid-19 meant that we had to bring together many dispersed groups in different ways; even visits to the mock-up cab had to be arranged observing strict social distancing rules. We are, however, delighted to have brought everything together and all of this would not have been possible without the dedication and resilience shown by each member of this project team.”

Opening new opportunities for Thales

By confirming customer confidence in its ability to deliver on time and to specification, the success of the demonstration is important for Thales, which is establishing its ETCS technology in the market.

Thales is working towards securing potential customers across parts of the world where ETCS technology is being implemented and the UK is considered a flagship reference market for future customers around the world.

“Establishing supply chains and increasing design maturity for a new safety-critical product solution for the UK is always challenging,” said Mr Anand. “However, we are very confident that the product maturity continues to build, and we’re delighted to have reached this milestone in the project.”

Find out more about our wide range of rail signalling solutions for main line rail including the European Train Control System.","{'label': 'Positive', 'score': 0.998829185962677}",positive,0.998829185962677,1
Qatar Airways upgrades 787-8 IFE to Thales AVANT - PaxEx.Aero,"Tue, 02 Feb 2021 08:00:00 GMT",https://news.google.com/rss/articles/CBMiMWh0dHBzOi8vcGF4ZXguYWVyby9xYXRhci1haXJ3YXlzLWF2YW50LWlmZS03ODctOC_SAQA?oc=5&hl=en-US&gl=US&ceid=US:en,"The Qatar Airways 787-8 fleet is getting an upgrade. The carrier will swap out the in-flight entertainment system on board its oldest Dreamliners to the Thales AVANT platform.

With the latest in-flight technology, including lightweight screens, greater content storage and full HD touch screens, we are delighted to work with Thales in bringing the most advanced AVANT IFE system on board our Boeing 787-8 fleet. – Ms. Salam Al Shawa, Qatar Airways Senior Vice President, Marketing & Corporate Communications

The new AVANT system gives business class passengers a 17″ HD touch screen. Economy class travelers will get the 12″ version.

The new screens are 2-3x brighter than the prior generation while also significantly lighter. They also consume less power and give off less heat.

On the server end the AVANT kit being installed on the Qatar 787-8s includes more than a terabyte of storage for content, including HD movies, TV shows and music.

The retrofit process sees the screens and servers on board swapped out but keeps the existing seats and other infrastructure in place. This allows for the upgrade to occur without disrupting aircraft utilization and minimizing time out of service. Thales developed a turnkey upgrade process that includes all the hardware and certifications required to effect the upgrade.

The AVANT solution replaces the older i5000 platform on this fleet. While it was relatively advanced when introduced, the UX on the i5000 offering, particularly around the handset control and the menus, left a lot to be desired. It launched during the PED/tablet transition era where consumers quickly adjusted their behaviors and expectations with respect to digital interactions. And, as always, aircraft systems lagged badly in keeping up with the changes.

Fortunately the new system run on an updated processor, interface, and operating system.

A favor to ask while you're here... Did you enjoy the content? Or learn something useful? Or generally just think this is the type of story you'd like to see more of? Consider supporting the site through a donation (any amount helps). It helps keep me independent and avoiding the credit card schlock.","{'label': 'Neutral', 'score': 0.9995470643043518}",neutral,0.9995470643043518,0
Make in India: BEL delivers transmit/receive modules to Thales for Rafale RBE2 Radar - Thales,"Wed, 03 Feb 2021 08:00:00 GMT",https://news.google.com/rss/articles/CBMie2h0dHBzOi8vd3d3LnRoYWxlc2dyb3VwLmNvbS9lbi9pbmRpYS9wcmVzc19yZWxlYXNlL21ha2UtaW5kaWEtYmVsLWRlbGl2ZXJzLXRyYW5zbWl0cmVjZWl2ZS1tb2R1bGVzLXRoYWxlcy1yYWZhbGUtcmJlMi1yYWRhctIBAA?oc=5&hl=en-US&gl=US&ceid=US:en,"Make in India: BEL delivers transmit/receive modules to Thales for Rafale RBE2 Radar Make in India Aero India Share this article



LinkedIn

03 February 2021, Bengaluru, India: As part of Thales’ Offsets commitments under the Rafale India contract, and in line with the Make in India policy, Navratna Defence PSU Bharat Electronics Ltd (BEL) has manufactured T/R (transmit/receive) modules for the RBE2 radar on the Dassault Aviation Rafale and delivered them to Thales.

Thales is demonstrating its commitment to the Make in India policy through transfers of technology and production, and associated training for BEL engineers in France. BEL has implemented a set of rigorous industrial processes and played an active role in the transfer programme.

Thales is an active stakeholder in the Make in India policy, promoted by the Indian Government, and in the Offsets

conditions included in the Rafale India programme. In November 2020, the first RBE2 AESA (active electronic scanning array) radar with a front end manufactured by BEL in India was delivered by Thales to Dassault Aviation. BEL implemented a set of rigorous processes at its Bangalore facility in order to achieve this key milestone.

Specifically developed for Rafale, the RBE2 is the first in-service European AESA radar and has been combat proven on Rafale aircraft operated by the French Air Force. It was developed in close partnership with Dassault Aviation and the French Defence Procurement Agency (DGA) to meet the requirements of air forces, and uses innovative technologies to combine advanced fire control radar functions and target tracking capabilities. The T/R (transmit/receive) modules are key to the RBE2 radar’s active electronic scanning performance, enabling it to steer the radar beam with the speed of an electronic chip.

Initiated at the end of 2017, the transfer of technology to BEL has included validation of the company’s technical capacity to deliver prototypes, qualify the various technologies involved in the wiring process, set up a dedicated SMC wiring production line with a preproduction run, train BEL engineers in France and install test benches for microwave characterisation at the BEL facility. The modules produced in India are then integrated with the RBE2 radar in France. BEL and Thales teams are, thus working closely to transfer advanced technological know-how.

Building on Thales’s 50+ years of expertise with earlier generationsof radars for combat aircraft, the RBE2 gives the Rafale a number of key advantages. Compared to radars with conventional antennas, the RBE2 delivers an unprecedented level of tactical situational awareness, faster detection and tracking of multiple targets, and can also implement several radar modes instantaneously.

“We’re delighted to see our collaboration with BEL delivering results, with the radar transmit/receive modules for the Rafale India programme being produced in Bangalore in line with the Make in India policy. The Thales teams are fully mobilised alongside our partners Dassault Aviation in France and BEL in India,” said Emmanuel De Roquefeuil, VP and Country director, Thales in India.

“We are happy to be associated with Thales in delivering the Transmit/Receive modules for the prestigious Rafale programme. The Thales and BEL teams ensured that the ToT happened seamlessly. We have augmented our facility in Bangalore to meet the requirements of manufacturing this state-of-the-art sub-system. We look forward to working together on many more such challenging assignments with Thales,” said Mr M V Gowtama, Chairman & Managing Director, BEL.

About Thales

Thales (Euronext Paris: HO) is a global high technology leader investing in digital and “deep tech” innovations – connectivity, big data, artificial intelligence, cybersecurity and quantum technology – to build a future we can all trust, which is vital to the development of our societies. The company provides solutions, services and products that help its customers –businesses, organisations and states – in the defence, aeronautics, space, transportation and digital identity and security markets to fulfil their critical missions, by placing humans at the heart of the decision-making process.

With 83,000 employees in 68 countries, Thales generated sales of €19 billion in 2019 (on a basis including Gemalto over 12 months).

About Thales in India

Present in India since 1953, Thales is headquartered in Noida, Uttar Pradesh and has other operational offices and sites spread across Delhi, Gurugram, Hyderabad, Bengaluru, and Mumbai, among others. Over 1,800 employees are working with Thales and its joint-ventures in India. Since the beginning, Thales has been playing an essential role in India’s growth story by sharing its technologies and expertise in Defence, Transport, Aerospace and Digital Identity and Security markets. Thales has two engineering competence centres in India - one in Delhi NCR focused on digital identity and security business and the other one in Bengaluru focused on hardware, software and systems engineering capabilities for both the civil and defence sectors, serving global needs.","{'label': 'Neutral', 'score': 0.9999690055847168}",neutral,0.9999690055847168,0
"France orders joint forces' tactical SIGINT system from Thales, Airbus - Defense Brief","Fri, 12 Feb 2021 08:00:00 GMT",https://news.google.com/rss/articles/CBMiZWh0dHBzOi8vZGVmYnJpZWYuY29tLzIwMjEvMDIvMTIvZnJhbmNlLW9yZGVycy1qb2ludC1mb3JjZXMtdGFjdGljYWwtc2lnaW50LXN5c3RlbS1mcm9tLXRoYWxlcy1haXJidXMv0gEA?oc=5&hl=en-US&gl=US&ceid=US:en,"Defense technology majors Thales and Airbus will be working together on upgrading the French Armed Forces’ critical signals monitoring, direction finding and spectrum analysis capabilities.

The two companies were awarded a contract from French defense procurement agency (DGA) for the delivery of a new joint tactical signals intelligence (SIGINT) system that will provide an expanded tactical electronic support measures (ESM) capability.

The 10-year contract will equip the three armed forces branches with a common information system and set of sensors and is designated a high-impact program (PEM1), alongside CONTACT and Scorpion, under France’s defense spending plan.

This new system will consist of a range of sensors that will be able to be combined in the form of modules, adapted to the needs of theaters of operations and the required projection environment, whether land, naval or air.

Referred to as renseignement d’origine électromagnétique (ROEM) in French, the system will equip the electronic support vehicles of the French Army’s 54th Signals Regiment (Scorpion program), the French Navy’s front-line warships and the Atlantique 2 maritime patrol aircraft, and could be deployed to protect air bases on military operations overseas. All three services will rely on the same logistics infrastructure to simplify training of specialist operators and optimize through-life support delivery.

The first 160 million euro contract under the program was awarded in 2020, while delivery of the first systems is scheduled for 2023. End of development, and a full operational capability are expected sometime in 2025.

The first phase of the program will provide the three armed forces branches with an initial operational capability for signals monitoring, with subsequent optional tranches to significantly increase the number of units in service. New functions (new data analytics functions for the information system, expanded detection and technical analysis capabilities, etc.) will be added incrementally over the term of the contract.

“As risks evolve and expand, reliable intelligence is an essential element of sovereignty and a strategic asset for operational decision-making, force protection, territorial integrity and civil security,” Marc Darmon, executive vice president, secure communications and information systems, Thales, said.

“Combined with aerial and satellite imagery and other sources, these new electronic intelligence capabilities will make it possible to identify these threats, and above all to characterize them with significantly greater precision,” François Lombard, director of the intelligence business, Airbus Defence and Space, added.","{'label': 'Neutral', 'score': 0.9110852479934692}",neutral,0.9110852479934692,0
