Titre,Date de publication,URL,Contenu,sentiment_finbert,sentiment_label,sentiment_score,sentiment_numerique
Lithgow Arms launches Defence Industry Collaboration and Cooperation Centre in regional NSW - Thales,"Wed, 08 Jun 2022 07:00:00 GMT",https://news.google.com/rss/articles/CBMiggFodHRwczovL3d3dy50aGFsZXNncm91cC5jb20vZW4vYXVzdHJhbGlhL3ByZXNzLXJlbGVhc2UvbGl0aGdvdy1hcm1zLWxhdW5jaGVzLWRlZmVuY2UtaW5kdXN0cnktY29sbGFib3JhdGlvbi1hbmQtY29vcGVyYXRpb24tY2VudHJl0gEA?oc=5&hl=en-US&gl=US&ceid=US:en,"Wednesday, 8 June, Lithgow, NSW - Thales Australia’s Lithgow Arms business in regional New South Wales has thrown open its doors - establishing a Small Arms Collaboration and Cooperation Centre (C3) to support and help grow the capabilities of its Australian SME and industrial partners.

The C3, housed inside the Lithgow Arms small arms factory, is designed to break down costly barriers to entry for SMEs and industrial partners by providing ready access to Lithgow Arms resources and equipment, engineering skills and expertise. Fostering an interest-based learning model, collaborators within the C3 are able to securely share areas of expertise to advance skills, collaborate on research and design, and seek manufacturing support to accelerate sovereign small arms innovation and design in support of the Australian Defence Force (ADF), commercial, and export markets.

Early adopters of the C3 - Southern Cross Small Arms (SCSA), Hosico, A.W. Bell and Wedgetail Industries, are currently working with the Lithgow Arms team to gain support in areas such as prototyping, test and evaluation, qualification, industrialisation and advanced manufacturing – supporting the advancement of their respective product capabilities to pursue programs in domestic commercial and law enforcement, as well as export.

Current projects underway within the C3 include creating 100% Australian made commercial products for sporting shooters and the farming industry. By leveraging and combining the Australian intellectual property, unique expertise and skills of Lithgow Arms, SCSA, Hosico, A.W. Bell and Wedgetail Industries, the group is able to achieve an increase in Australian industry content to achieve their business objectives. Work is also being done within the C3 with FN Herstal, to explore Australian manufacture and support of FN Herstal weapon’s systems.

The most notable success story of the C3 is the recent collaboration of Thales Australia, Rheinmetall Defence Australia and SME, A.W. Bell, that led to the successful Australian manufacture of key components for Rheinmetall’s Mk30-2 cannon by Lithgow Arms in support of the Australian Defence Force’s Land 400 program. A.W. Bell are now applying their class leading casting expertise, working directly with Rheinmetall, to explore an increase in component manufacture for armoured vehicles in Australia.

Following Thales Australia’s recent $6.5 million investment in the first phase of an industrial plan to transform its Lithgow Arms facility in regional New South Wales, the establishment of the C3 is a critical next step in delivering the Lithgow Arms masterplan. The new development will expand the world-leading precision-manufacturing capability of Lithgow Arms to support new sovereign manufacturing partnerships for strategic ADF programs.

Matt Duquemin, Director Integrated Weapons and Sensors, Thales Australia said, “Opening the C3 inside the Lithgow Arms factory is critical in achieving the vision of the Lithgow Arms masterplan and redevelopment. The future of our business here in Lithgow is not just about building an advanced manufacturing precinct – it’s about growing a sustainable and competitive sovereign industry capability in regional New South Wales to ensure the Australian Defence Force is ready now, future ready.”

Thales Australia’s investment to expand the size and capability of the Lithgow Arms facility, including the recent opening of the C3, is a clear demonstration of the company’s long-term commitment to growing and maintaining an enduring, sustainable and resilient sovereign industrial capability for the Australian Defence Force in regional New South Wales.","{'label': 'Positive', 'score': 0.674976646900177}",positive,0.674976646900177,1
New horizons in sight for advanced manufacturing firm Mincham - Thales,"Wed, 01 Jun 2022 07:00:00 GMT",https://news.google.com/rss/articles/CBMiZGh0dHBzOi8vd3d3LnRoYWxlc2dyb3VwLmNvbS9lbi9hdXN0cmFsaWEvbmV3cy9uZXctaG9yaXpvbnMtc2lnaHQtYWR2YW5jZWQtbWFudWZhY3R1cmluZy1maXJtLW1pbmNoYW3SAQA?oc=5&hl=en-US&gl=US&ceid=US:en,"As a business at the forefront of new technologies, South Australian SME, Mincham have a bright future ahead and have their sights firmly fixed on the horizon. This year the company has experienced unprecedented growth, seen the development of a new facility, and is partnering with Australian Defence industry to further develop its advanced manufacturing capability, in order to contribute to Defence’s strategic programs.

Accelerating the development of a sovereign Guided Weapon and Explosive Ordnance (GWEO) Enterprise in Australia is critical to the ADF’s long range strike and deterrent objectives, as per the 2020 Defence Strategic Update.

The Defence Science Technology Group (DST) Advanced Rocket Motor Technology Demonstrator (ARMTD) Program, with phase 1 underway with Thales as the Industry lead, is helping to grow a genuine partnership between the Australian Defence Force and Industry. The program plans to build an Australian industry network to support sovereign advanced rocket motor capability and the growth of Australian industry and local jobs.

Working with Australian SMEs, Thales will deliver the first phase of the transition to industry military-relevant rocket motor systems. This plans to be a demonstration of an advanced military-relevant rocket motor capable of hypersonic flight, manufactured locally.

The catalyst for this program was the push by the Federal Government to invest in local supply chains and create local jobs within the industry.

Thales, a trusted partner of the ADF, has long worked with SMEs to support more than 2,000 jobs within the supply chain. Utilising the local capabilities for the ARMTD program has given Thales the opportunity to make a strong contribution to Australian sovereign capability.

“We are proud to support the expertise and impressive capabilities of the Australian Defence industry. Having partnered with various SMEs for decades, we hope to continue the growth of local manufacturers and suppliers.” Said Duncan Watt, General Manager of Guided Weapon Systems at Thales Australia.

Mincham has been a leader in the development and production of advanced light-weight solutions for the defence, aerospace and high-tech industries. With over 25 years of experience, Mincham has been a core supplier and partner of upgrades and developments of Australian military platforms and systems. At the cutting edge of new technologies, Mincham produces products and services such as autonomous aerial delivery systems, aeromedical, composite radomes and suppressor systems.

With advanced engineering design capabilities, experience with composites, specialised and bespoke machining solutions, and painting and finishing services, Mincham is a competitive end-to-end supplier.

“I come from a structural aerospace background in the Australian Airforce and I really enjoy the challenges of contributing to cutting edge science as well as watching young engineers harness opportunities in this industry,” said Darryl Mincham, Managing Director of Mincham.

With a current team of 25 and a brand-new purpose-built facility, Mincham is expecting to grow 50% within the next six to twelve months due to the opportunities in Defence and Aerospace, including the ARMTD program, which will provide a residual industry capability able to produce intermediate scale rocket motors suitable for high performance Defence missions across all domains. This will ultimately lead to a growth in specialised skills and Australian jobs.

Offering a veteran hiring program which enables ex Defence personnel to re-skill, Mincham has made growing their workforce a priority. There has also been significant investment in developing their Research and Development (R&D) and specialised Defence industry production experience .

This investment has centred around unmanned systems, rocket technologies, aerial delivery systems and high-end specialised technologies. To support this strategy, Mincham has invested millions in expanding their manufacturing and maintenance footprint as well as making an investment in new computer numerical control (CNC) machines and large composite equipment. These large-scale investments and the building of a strong and agile workforce is positioning Mincham to pursue similar programs to the ARMTD in the near future.

“Through this alliance, the Defence minister asked us to condense a 10-year development cycle down to 2 years,” said Darryl.

“Small, agile SMEs in Australia are well placed to respond to this, and we’re excited to be able to contribute to building an advanced manufacturing industry that is supporting Defence here in Australia.”

Contact Thales to find out how you can partner with us to deliver Australia’s Sovereign Guided Weapons Enterprise program and contribute to local job creation and industry growth.

Find out more about Mincham: mincham.com.au","{'label': 'Positive', 'score': 0.9999935626983643}",positive,0.9999935626983643,1
"Scorpion programme: Nexter, Arquus, Thales and the DGA presented a GRIFFON integrating lithium-ion batteries to ... - EDR Magazine","Mon, 20 Jun 2022 07:00:00 GMT",https://news.google.com/rss/articles/CBMikAFodHRwczovL3d3dy5lZHJtYWdhemluZS5ldS9zY29ycGlvbi1wcm9ncmFtbWUtbmV4dGVyLWFycXV1cy10aGFsZXMtYW5kLXRoZS1kZ2EtcHJlc2VudGVkLWEtZ3JpZmZvbi1pbnRlZ3JhdGluZy1saXRoaXVtLWlvbi1iYXR0ZXJpZXMtdG8tdGhlLWFybXnSAQA?oc=5&hl=en-US&gl=US&ceid=US:en,"06/16/2022 – The GME EBMR (composed of Nexter, Arquus and Thales) and the DGA jointly presented the results of the risk-reduction study on the integration of lithium-ion batteries in military vehicles in presence of all project stakeholders and representatives of the Army Technical Section (STAT), the Operational Energy Service (SEO) and the Integrated Structure for Maintenance of Land Equipment in Operational Condition (SIMMT). This day, organized on the Nexter site in Satory, featured a Griffon EPC vehicle equipped with lithium-ion batteries.

The Griffon EPC was also equipped with a screen dedicated to the presentation, which displayed the remaining autonomy of the vehicle in standby with the combustion engine off, or the time remaining before full recharging when the combustion engine is started. This screen has made it possible to highlight the increase by 2 or even 3 times of the standby time allowed by lithium-ion technology compared to current acid/lead technology.

These new batteries will be able in the future to power more electrical equipment while maintaining the current standby time, and recharging twice as fast. The study began in early 2019 with the choice of two standard and mature models on the market: the 6 TE model from SAFT and the BT-0939 model from Brentronics. A theoretical analysis of the lithium-ion technology as well as an extensive test campaign was then carried out by Arquus with the Serma laboratory. This analysis enabled Nexter to identify the risks as well as the means to be implemented for safe integration into the vehicle.

Hutchinson presented its know-how on reducing the risk of lithium-ion battery fires spreading. Nexter then studied with Arquus and Thales an architecture for the Griffon vehicle. A model and a prototype on Griffon were used to test the complete system with the DGA Techniques Terrestres (DGA TT) and GME EBMR teams. The GME EBMR would like to salute the proactive spirit that prevailed during this risk-reduction study, making it possible to consider the use of these technologies on new vehicle fleets.","{'label': 'Neutral', 'score': 0.9999922513961792}",neutral,0.9999922513961792,0
A Roof in Return: Delivering safe and secure housing to veterans - Thales,"Thu, 30 Jun 2022 07:00:00 GMT",https://news.google.com/rss/articles/CBMidGh0dHBzOi8vd3d3LnRoYWxlc2dyb3VwLmNvbS9lbi9jb3VudHJpZXMtYXNpYS9hdXN0cmFsaWEvbmV3cy9yb29mLXJldHVybi1kZWxpdmVyaW5nLXNhZmUtYW5kLXNlY3VyZS1ob3VzaW5nLXZldGVyYW5z0gEA?oc=5&hl=en-US&gl=US&ceid=US:en,"Thales Australia, as a trusted partner of the Australian Defence Force, is deeply committed to supporting veterans and their families.

This support is provided through a range of initiatives, such as the Thales Veterans Mentoring Programs, special veterans leave as well as the backing of veteran-focussed charities.

One such charity is ‘A Roof in Return.’ A Roof in Return is a not-for-profit charity delivering safe and secure housing options to veterans through Tenancy Facilitation, Bond Loan, Tenancy Guarantee, Rental Assistance, Interim Accommodation and Overnight Accommodation Services.

In Australia, 1 in 20 homeless individuals are military veterans. Many returned veterans struggle to adjust to post-war life and can suffer prolonged physical impairments and mental illness such as post-traumatic stress disorder. This can lead to difficulty maintaining employment, financial stress, domestic violence, substance abuse and family breakdown; all of which lead to a greater risk of homelessness. A Roof in Return’s housing assistance enables these members of society to secure short to medium term housing when in need, which provides our veterans with the support and dignity they deserve.

Thales’ contribution to A Roof in Return was made through our Veterans Committee, a group within Thales designed to provide advice and governance to leadership and employees on issues facing veterans and their families.

“As one of the country’s leading defence and technology companies, a strategic pillar of Thales Australia’s Corporate Social Responsibility Policy is the continued and sustainable support of veterans and their families, including but not limited to employment opportunities as well as support for various veteran focussed charities. On behalf of the Thales Veterans committee, I am delighted to announce our support for ‘A Roof in Return; supporting homeless veterans through providing safe and secure housing options.” Dan Keighran VC, Key Account Manager Joint Capability, Veterans Committee Member.

“I’d like to sincerely thank Thales for their ongoing support of A Roof In Return. Thales was our founding sponsor when we launched in 2020 and has again, through the Veterans Committee, provided funding to us. This latest support has allowed us to modernise our website, making it easier to navigate and importantly significantly easier to make single or ongoing donations.’ Business, particularly Defence Industry, are at the heart of our sustainable solutions. Corporate contributions, like those we have received from Thales, drive measurable social impact and directly support our ability to provide housing solutions for military veterans and their direct family members who are homeless or at risk of homelessness.” Kylie Rogers, CEO and Managing Director, A Roof in Return

Click here to learn more about A Roof in Return","{'label': 'Neutral', 'score': 0.9880643486976624}",neutral,0.9880643486976624,0
Covivio strengthens partnership with Thales in the Vélizy-Meudon business hub - Covivio,"Thu, 09 Jun 2022 07:00:00 GMT",https://news.google.com/rss/articles/CBMikgFodHRwczovL3d3dy5jb3ZpdmlvLmV1L2VuL2dyb3VwL2dyb3VwLWNvbW11bmljYXRpb25zL3ByZXNzLXJlbGVhc2VzL2Nvdml2aW8tc3RyZW5ndGhlbnMtcGFydG5lcnNoaXAtd2l0aC10aGFsZXMtaW4tdGhlLXZlbGl6eS1tZXVkb24tYnVzaW5lc3MtaHViL9IBAA?oc=5&hl=en-US&gl=US&ceid=US:en,"Covivio and Thales, a long-term real estate partnership

The story began in 2003 with Covivio’s acquisition of an 18-hectare plot of land in the Vélizy-Meudon business district, where Thales was historically based.

In line with its strategy of developing scalable turnkey campuses for key accounts on this site, Covivio signed an agreement with Thales in 2012 on the development of an initial 46,750 m2 campus called “Hélios”, which was delivered in 2014.



Surrounded by 10,000 m² of landscaped areas, Hélios offers users over 10,000 m² of service facilities including a 400-seat conference hall, a business centre, a fitness room, a concierge service, various catering areas, a training centre and the “Thales Learning Hub” university. In addition to its comprehensive service offering, Hélios features functional, bright and ergonomic work and relaxation areas with interior design by Saguez & Partners. The “Hélios” campus is currently owned under a joint investment partnership with Crédit Agricole Assurances.



It was built alongside a first historical building of 41,520 m², owned by Covivio and occupied by Thales, and located on the adjacent plot.



Today, the partnership continues with the signing of an agreement on the construction of a new 37,900 m2 building, “Hélios 2” (7 floors + 3 basement levels), which will offer workspaces, communal areas including a restaurant, showrooms and service areas, and datarooms. The building’s tenants will also have access to over 9,000 m² of green spaces.



Eventually, the Thales campus will bring together more than 4,000 employees across the various buildings.



The new 12-year firm off-plan lease agreement signed between Covivio and Thales will come into effect on delivery of the extension, scheduled for the first quarter of 2026.

Meanwhile, the two partners have extended the term of the existing leases: for “Hélios” until 2037 and for the historical building until the end of 2034.



In line with Covivio’s CSR ambitions, this building is intended to be exemplary in environmental terms and aims for the highest levels of certification: HQE Sustainable Building – Excellent, OsmoZ and R2S accreditation.

An agreement that confirms the dynamism of the Vélizy-Meudon business hub

Vélizy-Meudon is the second largest business hub in the Paris region housing nearly 50,000 employees and 1,000 international companies. This new project reinforces the attractiveness of this area, which is an integral part of the Paris-Saclay science and technology cluster, which meets companies’ current demands for diversity, accessibility, performance and services. “Hélios 2” is a further addition to the iconic projects already completed by Covivio on this site: the Dassault Systèmes Campus (98,000 m2), Ducasse Education (5,100 m2) and the Campus Eiffage (33,000 m2 sold at the end of 2021).

Key features of the extension project

Total surface area of 37,900 m² (in addition to the existing 88,300 m²), including:","{'label': 'Neutral', 'score': 0.999997615814209}",neutral,0.999997615814209,0
"Thales delivers the 1000th Air Traffic Surveillance worldwide radar milestone, a co-mounted primary TRAC NG and ... - ATC Network","Tue, 21 Jun 2022 07:00:00 GMT",https://news.google.com/rss/articles/CBMi8QFodHRwczovL3d3dy5hdGMtbmV0d29yay5jb20vYXRjLW5ld3MvdGhhbGVzL3RoYWxlcy1kZWxpdmVycy10aGUtMTAwMHRoLWFpci10cmFmZmljLXN1cnZlaWxsYW5jZS13b3JsZHdpZGUtcmFkYXItbWlsZXN0b25lLWEtY28tbW91bnRlZC1wcmltYXJ5LXRyYWMtbmctYW5kLXNlY29uZGFyeS1yc20tc3VydmVpbGxhbmNlLXJhZGFyLXRvLWRlY2VhLXRoZS1icmF6aWxpYW4tZGVwYXJ0bWVudC1vZi1haXJzcGFjZS1jb250cm9s0gEA?oc=5&hl=en-US&gl=US&ceid=US:en,"Safe skies means safe transit through a number of given airspaces. It means that, at any given point in time, Air Traffic Control Operators (ATCO) must be aware of aircrafts’ position in their airspace to deliver efficient Air Traffic Management (ATM). Surveillance solutions are the “Eyes” of the ATCO. It means relying on a wide network of ground sensors enabling such coordination so that safety and punctuality can go hand-in-hand. It also means the detection capacity of non-cooperative aircrafts, playing a major role in air surveillance.

Since the first delivery in the 70’s, Thales’ portfolio is contributing to air safety with a full range of radars to manage air surveillance and control airport/airbase terminal areas. The range includes primary and secondary radars; the STAR NG (Primary Surveillance Radar for Approach) and the TRAC NG (Primary Surveillance Radar for En-Route) to detect non-cooperative aircrafts, aircrafts without transponders or with faulty transponders, capable of detecting targets of all sizes of aircrafts over an extended operational range coverage (more than 250 NM/460 km) and conducting wind farm mitigation and high clutter suppression to be resistant to harsh environment. And the Secondary Surveillance portfolio with the renowned RSM and latest innovation the RSM NG (for both Approach control and En-Route) to detect and identify cooperative aircrafts from commercial or military aviation.

At the forefront of new technologies, investing in R&D and capitalizing on 50 years of ATC experience, Thales has introduced many leading innovations for airspace safety to accompany evolving customer needs in both civil and military domains, as well as ensuring compliance with the latest safety regulations to provide safe and accurate, Approach and En-Route surveillance.

Upgrades and innovations include a family of radars with higher performances, especially for precision and detection, development of new features such as electronic protection measures, 3D, detection of zero speed aircrafts (such as helicopters), high speed/high maneuverability aircrafts (such as fighters) or merging traditional Mode S with ADS-B detection to enhance sensor performance, including a sustainable solar powered radar station.

“As the Brazilian Air Force incorporates another radar for the defense and control of Brazilian airspace, Thales celebrates the production and installation of its thousandth air traffic surveillance radar, in Forte Príncipe da Beira. This is an acquisition that demonstrates the FAB's concern in controlling the 22 million square kilometers of our airspace as well as defending our borders. This is an extremely important equipment, as it will enable the identification and interception of non-collaborative aircraft”, declares the Director General of DECEA, Air Lieutenant Brigadier João Tadeu Fiorentini.

“The 1000Th Thales air traffic surveillance radar worldwide reference is a demonstration of customers’ confidence and Thales’s track record to detect at all times - ensuring critical air safety and air surveillance - we thank all our clients for their trust. With more than 130 installed air surveillance radars in Brazil, and a 20 year relationship between Omnisys - a Thales company and DECEA we are proud to share the 1000th Air traffic surveillance radar milestone in Brazil. The 1000th milestone is a testimony to Thales Air traffic surveillance radars with a solid reputation for performance and reliability” Lionel de Castellane, Vice President Civil Segment Radars, Thales.","{'label': 'Neutral', 'score': 0.9849121570587158}",neutral,0.9849121570587158,0
Passenger Terminal Expo: Thales to supply manual border inspection units for the new Schengen 'Entry Exit System' in ... - Passenger Terminal Today,"Thu, 16 Jun 2022 07:00:00 GMT",https://news.google.com/rss/articles/CBMimQFodHRwczovL3d3dy5wYXNzZW5nZXJ0ZXJtaW5hbHRvZGF5LmNvbS9uZXdzL3B0ZXBhcmlzLXRoYWxlcy10by1zdXBwbHktbWFudWFsLWJvcmRlci1pbnNwZWN0aW9uLXVuaXRzLWZvci10aGUtbmV3LXNjaGVuZ2VuLWVudHJ5LWV4aXQtc3lzdGVtLWluLXNwYWluLmh0bWzSAQA?oc=5&hl=en-US&gl=US&ceid=US:en,"By the end of this year, Schengen member states will be required to have a biometric entry and exit system to register non-European citizens crossing an external EU border. Thales, in collaboration with Zelenza, has been selected by Spain’s Ministry of the Interior to provide more than 1,500 manual border control inspection units across all border-crossing points. The company made the announcement during Passenger Terminal Expo 2022 , in Paris, France, where it is displaying the units for the first time.

Those units located at the border officer’s control point will be equipped with Thales EES Border Control Clearance Software and Thales devices such as document readers with embedded document verification, fingerprint scanners and face pods with a facial capture system. Combined, these integrated systems will deliver a fast and secure identity enrolment and clearance process for non-EU citizens at borders.

The contract will be executed over the next eight months, with systems deployed at airports, ports and land crossings throughout Spain. Funded by the EU’s Internal Security Fund, the new system will facilitate the border clearance of travelers while increasing the security at the Schengen borders, following the European Union’s adoption in 2017 of a new directive for the deployment of a biometric Entry-Exit registration system (EES) for member states.

Speaking exclusively to Passenger Terminal Today at Passenger Terminal Expo, Francoise Bergasse, market manager, biometric border and travel solutions, Thales, said, “The regulation stipulates very specific, high quality requirements with regard to face and fingerprint capture, as well as document verification, which are far higher than those governing current passport photos. We have paid particular attention to lighting, while also ensuring that the units are compatible with passengers of all heights, whether short or tall. We also use two high-res cameras to speed the process – it only takes one minute for each passenger to enroll and be fully verified.”

Thales is currently trialling the system at Paris-Orly. Visitors to Passenger Terminal Expo can try it out for themselves on Booth Z1.3000.","{'label': 'Neutral', 'score': 0.9999885559082031}",neutral,0.9999885559082031,0
