Titre,Date de publication,URL,Contenu,sentiment_finbert,sentiment_label,sentiment_score,sentiment_numerique
Thales Alenia Space to provide Integrated Transponder for TeamIndus Moon Mission - Thales,"Wed, 03 May 2017 07:00:00 GMT",https://news.google.com/rss/articles/CBMifmh0dHBzOi8vd3d3LnRoYWxlc2dyb3VwLmNvbS9lbi93b3JsZHdpZGUvc3BhY2UvcHJlc3MtcmVsZWFzZS90aGFsZXMtYWxlbmlhLXNwYWNlLXByb3ZpZGUtaW50ZWdyYXRlZC10cmFuc3BvbmRlci10ZWFtaW5kdXMtbW9vbtIBAA?oc=5&hl=en-US&gl=US&ceid=US:en,"© @TeamIndus

has been chosen by TeamIndus to provide the Integrated S Band Transponder on board its Lunar Landing Spacecraft system to transmit video and images from the Rover. Thales Alenia Space is the world leader in space communications systems, with customers including space agencies and satellite manufacturers from around the world.“We are proud of being chosen by TeamIndus to participate in this thrilling lunar adventure, thanks to our comprehensive experience in Spain in communications systems for satellites and interplanetary space probes,” said Eduardo Bellido, CEO of Thales Alenia Space Spain.Rahul Narayan, Fleet Commander of TeamIndus said, “The TeamIndus spacecraft is designed to deliver 20kg of payload to the Moon’s surface, and it relies upon robust subsystems for its flight and surface operations. When it came to the transponder we are excited to have Thales Alenia Space as a valued partner for this critical subsystem.”Ana Pérez, Project Manager at Thales Alenia Space in Spain, added, “It is very exciting to be part of this great challenge of being the first privately-funded team to land on the Moon and transmit videos and images back to Earth.”

A space race for the private sector



TeamIndus is one of the five finalists in the Google Lunar XPRIZE® competition. TeamIndus signed a commercial launch contract with Antrix Corporation for a PSLV launch vehicle and had previously won a $1 Million Terrestrial milestone prize recognizing its technical maturity and progress.

About Thales Alenia Space

Thales Alenia Space brings over 40 years of experience to the design, integration, testing and operation of innovative space systems for telecommunications, navigation, Earth observation, environmental management, exploration, science and orbital infrastructures. A joint venture between Thales (67%) and Leonardo-Finmeccanica (33%), Thales Alenia Space also teams up with Telespazio to form the parent companies’ “Space Alliance”, which offers a complete range of services and solutions. Thales Alenia Space has built up unrivaled expertise in dual (civil-military) missions, constellations, flexible high-throughput payloads, altimetry, meteorology, and high-resolution radar and optical observation. The company capitalizes on its strong legacy, while also making innovation a key to its strategy. By offering a continuous stream of new products and expanding its global footprint, Thales Alenia Space has established its leadership in today’s fast-evolving space sector.Thales Alenia Space posted consolidated revenues of about 2.4 billion euros in 2016 and has 7,980 employees in nine countries. www.thalesaleniaspace.com



Thales Alenia Space in Spain

Thales Alenia Space is well represented in Spain and is the country’s leading space company in export markets, with over 28 years of experience in the design, development and sale of advanced space systems and equipment. It has contributed to more than 500 satellites, space probes and vehicles used in telecommunications, Earth observation, science, exploration, navigation and orbital infrastructure missions. Thales Alenia Space in Spain offers a wide range of solutions spanning the design and integration of payloads and subsystems for telecommunications, data transmission and TT&C (tracking, telemetry and command), optical observation instruments, radiofrequency equipment, data processing and digital electronics, and network management systems for the ground segment.

Thales Alenia Space Press Contact:



Sandrine Bielecki Tel: +33 (0)4 92 92 70 94 sandrine.bielecki@thalesaleniaspace.com



Chrystelle Dugimont Tel: +33 (0)4 92 92 74 06 chrystelle.dugimont@thalesaleniaspace.com



Oriol Casas Thió Tel: +34 91 807 7806 oriol.casasthio@thalesaleniaspace.com","{'label': 'Positive', 'score': 0.9952715039253235}",positive,0.9952715039253235,1
Teledyne Delivers Space-Grade Processors to Thales Alenia Space - Via Satellite,"Fri, 19 May 2017 07:00:00 GMT",https://news.google.com/rss/articles/CBMicmh0dHBzOi8vd3d3LnNhdGVsbGl0ZXRvZGF5LmNvbS9pbm5vdmF0aW9uLzIwMTcvMDUvMTkvdGVsZWR5bmUtZGVsaXZlcnMtc3BhY2UtZ3JhZGUtcHJvY2Vzc29ycy10aGFsZXMtYWxlbmlhLXNwYWNlL9IBAA?oc=5&hl=en-US&gl=US&ceid=US:en,"Teledyne has enabled Thales Alenia Space to gain a 10-fold increase in the processing speed and power for its On-Board Computers (OBC), with the design and qualification process cut by up to four years, according to the company. Teledyne e2v’s re-engineered PC7448 microprocessors will be used at the heart of Thales Alenia Space’s OBC that serve the Lightning Imager (LI) systems on Eumetsat’s Meteosat Geostationary Orbit (GEO) meteorological satellites.

Thales Alenia Space will equip four Meteosat MTG 1 satellites, scheduled for launch from 2019, with LI systems that will place a major demand on their OBCs to deliver the sensitivity and discrimination required for near real-time lightning detection over the Earth’s full hemisphere. Teledyne e2v has helped Thales Alenia Space meet this challenge by re-engineering commercial grade PC7448 1.3 GHz processors in accordance with NASA’s MIL-PRF-38535 Class Y (QML Y) quality standard. Now, according to the company, Thales Alenia Space can use a microprocessor offering the same performance as the latest desktop PCs in a spaceflight-ready version capable of surviving the rigors of a 15-year mission.

The satellite LI systems will facilitate the monitoring and tracking of active convective areas and storm life cycles critical for nowcasting and very short range forecasting of severe weather events. Monitoring of lightning also helps assess the impact of climate change on thunderstorm activity.","{'label': 'Neutral', 'score': 0.7802098393440247}",neutral,0.7802098393440247,0
Thales Alenia Space expands exploration with larger 3D printed parts - 3D Printing Industry,"Thu, 18 May 2017 07:00:00 GMT",https://news.google.com/rss/articles/CBMia2h0dHBzOi8vM2RwcmludGluZ2luZHVzdHJ5LmNvbS9uZXdzL3RoYWxlcy1hbGVuaWEtc3BhY2UtZXhwYW5kcy1leHBsb3JhdGlvbi1sYXJnZXItM2QtcHJpbnRlZC1wYXJ0cy0xMTM1NzQv0gEA?oc=5&hl=en-US&gl=US&ceid=US:en,"Franco-Italian aerospace company Thales Alenia Space aims to expand its 3D printed space exploration.

The company has recently supported the launches of the Telkom 3S, SGDC and KOREASAT-7 satellites with metal 3D printed parts, and will now scale up production for larger structures.

The number of metal 3D printed parts launched into space by the Franco-Italian company now totals 79 – 47 of which are different designs. Additionally, Thames Alenia Space has sent hundreds of 3D printed polymer tube supports thus far.

Earlier in 2017, Thales Alenia Space worked on the Iridium NEXT satellites which signified the first flight application of 3D printed thermoplastic through its propulsion system tube supports.

Largest 3D printed space parts

Thames Alenia Space’s use of 3D printing began two years ago with the launch of its first 3D printed aluminium antenna support. At the time, the aluminium antenna brackets were the largest 3D printed parts to be launched in space. Since then, all of Thames Alenia Space’s telecommunication satellites have incorporated additive manufactured antenna supports.

Thames Alenia Space uses laser beam melting machines to produce the metal parts and previously made use of a Concept Laser Xline 1000R machine to create initial antenna brackets.

This year, Thames Alenia Space will look to expand the use of 3D printing to again create larger parts. The company explains it is currently working on dual antenna supports for a new telecom satellite which will launch in the near future. These dual antenna supports will be large in size at 480 x 378 x 364 mm (18.9 in x 14.9 in x 14.3 in).

Part consolidation and widespread use

Satellite launches are increasing the incorporation of 3D printing for weight reductions and enhanced design freedom. Satellite brackets in particular have shown significant application for 3D printing with other programs such as Canada Makes working on a 3D printed bracket to launch later in 2017.

Additive manufacturing also enables parts to be produced with increased functionality, as Florence Montredon additive manufacturing technology development manager at Thames Alenia Space explains. Montredon states the company’s “development efforts are now focusing on integrating several functions in a single part, such as mechanical, thermal and radio-frequency functions.”

Reducing the number of parts is another key benefit of the technology as it reduces assembly time and simplifies the design process. Californian rocket manufacturers, Aerojet Rocketdyne has successfully reduced parts in its Bantam rocket engine from 100 to just 3 additive manufactured parts.

To stay up-to-date with the latest aerospace 3D printing news, subscribe to our newsletter, follow us on twitter and like us on Facebook.

Featured image shows production of the Iridium NEXT satellite. Image via Thales Alenia Space/ImagIN.","{'label': 'Neutral', 'score': 0.9839206337928772}",neutral,0.9839206337928772,0
Thales Alenia Space launches multiple 3D-printed parts for space apps - Optics.org,"Thu, 18 May 2017 07:00:00 GMT",https://news.google.com/rss/articles/CBMiH2h0dHBzOi8vb3B0aWNzLm9yZy9uZXdzLzgvNS8zNi_SAQA?oc=5&hl=en-US&gl=US&ceid=US:en,"Applications

Thales Alenia Space launches multiple 3D-printed parts for space apps

18 May 2017

Most commonly used technique is laser beam melting on bed of metal powders including aluminum and titanium.

With the recent launches of the Telkom 3S, SGDC and KOREASAT-7 satellites (see below), plus satellites in the Iridium Next constellation, Thales Alenia Space (TAS) has now sent into orbit at least 79 metal parts made by additive manufacturing (3D printing) and 350 polymer tube supports so created for chemical propulsion systems.

The work started two years ago, in April 2015, with the first 3D-printed aluminum antenna support, sent into orbit on the TurkmenAlem MonacoSat satellite. Since then, all of the company’s telecommunications satellites employ lightweight 3D-printed antenna supports and reflector fittings.

In mid-January 2017, with the successful launch of the first Iridium NEXT satellites, TAS also launched into orbit satellites with propulsion system tube supports, the first flight application of thermoplastic additive manufacturing.

TAS says its next step will be the manufacture of larger parts using this process, such as dual antenna supports for a new telecom satellite, ""to be launched shortly"".

These parts measure 480 x 378 x 364 mm, which the company says represents ""a real challenge from the manufacturing standpoint"".

“Our development efforts are now focusing on integrating several functions in a single part, such as mechanical, thermal and radio-frequency functions,” said Florence Montredon, Additive Manufacturing Technology Development manager at TAS. “The challenge lies as much in the design process as in the production technique.”

Space benefits

TAS believes that additive manufacturing provides real benefits for spaceborne products. For example, it allows the design and manufacture of single-piece structures, as opposed to a conventional manufacturing approach, which entails the assembly of several different parts to form a structure.

The consequecne is a significant reduction in weight, along with cost savings. The tube support illustrates the technique's ability to replace several parts with a single-piece structure, thanks to additive manufacturing, while also introducing new functions.

Additive manufacturing also means greater design freedom and the absence of tooling, which makes it ideal for producing complex parts – with curves, holes or cavities – that are typically produced in small runs or on a one-off basis.

KOREASAT-7 telecommunications satellite.

Out of the total of 79 parts produced by AM so far, 47 have different designs and are used on the satellites, where they carry out 13 different functions. TAS adds that some of these parts are design variants for a given function. The tube supports are made of a polymer and are all identical, with 35 used on each of the ten satellites launched to date.

TAS generally focuses on metallic materials for this process, including aluminum and titanium. The most commonly used technique is laser beam melting (LBM), with a bed of metallic powder. One or several lasers progressively melt the powder, layer by layer, in a controlled atmosphere.

This technology demands a high level of expertise to control the various design restrictions and the “printing” machine’s complex settings. Producing a part may take several hours or even days of continuous printing.

About SGDC and KOREASAT-7

SGDC is a dual (civil-military) satellite for the customer Visiona, a joint venture of aircraft manufacturer Embraer and Brazil’s telecommunications operator, Telebras. It will provide sovereign and safe means for the strategic communications of the government and the defense and reduce the digital divide in Brazil by giving internet access to the whole country.

This program reflects the close collaboration between Thales Alenia Space and Brazil, which includes the training of 30 Brazilian engineers in space industry techniques as well as the integration aboard the satellite of a structure panel made by the Brazilian company CENIC.

KOREASAT-7 was launched for the South Korean telecom/media service provider KT Sat. The satellite will provide Internet access, multimedia, broadcasting and fixed communications services for South Korea, Philippines, Indonesia and India. The KOREASAT-5A satellite is now being integrated by Thales Alenia Space and will later join KTSAT’s fleet.","{'label': 'Positive', 'score': 0.5835608243942261}",positive,0.5835608243942261,1
Some Turntables At AXPONA 2017 - AnalogPlanet.com,"Tue, 02 May 2017 07:00:00 GMT",https://news.google.com/rss/articles/CBMiQGh0dHBzOi8vd3d3LmFuYWxvZ3BsYW5ldC5jb20vY29udGVudC9zb21lLXR1cm50YWJsZXMtYXhwb25hLTIwMTfSAQA?oc=5&hl=en-US&gl=US&ceid=US:en,"In the video below you’ll see a new $449 (MSRP) Audio-Technica AT LP5 direct drive turntable with aluminum platter, complete with MM cartridge and built-in switchable MM/MC phono preamp and A/D converter.

In the Needle Doctor room on a Clearaudio Innovation turntable you’ll see the much talked about $750 Hana SL cartridge that includes a Shibata stylus, playing through a Musical Surroundings Super Nova 3 battery powered phono stage ($5000).

On the lower level, in the Kyomi Audio room featuring Vivid Audio Giya G1 Series II loudspeakers ($68,00/pr) see the least expensive TechDas turntable, the Air Force 3, costing around $29,750. The turntable includes an air bearing platter, vacuum hold-down and an outboard motor. Mounted on the ‘table are the Graham Elite ($12,000) and new Graham Phantom 3.0 tone arms. Electronics are by Jadis (JA200 MKII monoblocks ($33,900/pr, JP200MC tube preamplifier with MC phono stage $32,900) .

In veteran retailer Galen Carol’s room we saw the Basis Signature turntable and the SA-9 Super Arm, the final arm design from the late A.J. Conti.

In another room we saw and heard the new $2,200 (with arm) VPI Scout Prime fitted with Ortofon 2M Black cartridge in a system with Rogue Audio electronics and a pair of new Revel speaker system. In the background, the new Intervention Records reissue of The Flying Burrito’s Gilded Palace of the Sun.

The Swiss Thales TTT compact ‘table ($14,500) and Simplicity tangential tracking pivoted arm ($9200) fitted with an Ikeda KAI ($8500) cartridge was producing sweet sound through the Ypsilon VPS-100 tube-based phono preamp ($26,000) and MC 26L step-up transformer ($6200) feeding a Ypsilon Phaeton Integrated amplifier ($25,000), driving a pair of Wilson-Benesch Discovery II speakers ($28,000/pr). The speaker features an unusual “let it all hang out” configuration that mounts the woofer from the bottom of the baffle, with the basket and magnet exposed and seemingly in need of an athletic supporter—ok maybe that’s just me. The “spare tire” on the floor is a W-B subwoofer.

The Kronos Pro turntable with its unique counter-rotational platters (circa $35,000, add $8500 for the Black Beauty arm) was in the David Michael Audio room along with Nagra electronics and “classic” Graham Audio speakers including the ones shown, which were the BBC LS 5/9 stand-mount monitors.

The big news in the Technics room was the final pricing of the SL-1200GR introduced at CES 2017. Technics was hoping to bring it in “under $2000” and they’ve managed to do it for $1699.

The beautiful recently introduced $34,000 Bergmann Galder turntable (a tired Angie mistakenly identifies it as the “Magne”) features an air bearing platter with vacuum hold down and an air bearing tangential tracking arm. Angie says base is “stainless steel” but she means aluminum. The cartridge is a $6000 Phasemation PP-2000. The rest of the system features the Sutherland Audio Phono Block four chassis phono preamplifier ($10,000). Amplification was via the AvantGarde XA integrated amp that outputs 1 watt Class A and 150 watts of Class A/B power. The speakers are the powered woofer, DSP controlled Avantegarde Acoustics Zero TA covered in our CES 2017 show report.

Unfortunately I forgot to go back on Sunday to the Oracle room so I missed the The sheet proclaims an $18,660 Origine turntable with Oracle tonearm and of course the famous Delphi 2nd generation 'table ($10,160) plus electronics including the PH100 phono preamplifier $720).

The photo at the top shows the Kronos Pro turntable with optional battery power speed controller and the CH Precision P1 Phono Preamplifier ($31,000).","{'label': 'Neutral', 'score': 0.9999988079071045}",neutral,0.9999988079071045,0
Two Thales Alenia Space satellites in orbit - Thales,"Fri, 05 May 2017 07:00:00 GMT",https://news.google.com/rss/articles/CBMiaWh0dHBzOi8vd3d3LnRoYWxlc2dyb3VwLmNvbS9lbi9tb25kZS9zcGFjZS9wcmVzcy1yZWxlYXNlL2RldXgtc2F0ZWxsaXRlcy1kZS10aGFsZXMtYWxlbmlhLXNwYWNlLWVuLW9yYml0ZdIBAA?oc=5&hl=en-US&gl=US&ceid=US:en,"SGDC and KOREASAT-7 satellites successfully launched

Cannes, May 5th, 2017 – The SGDC and KOREASAT-7 telecommunications satellites, built by Thales Alenia Space for Brazil and South Korea respectively, were successfully orbited today by Arianespace in a dual launch using an Ariane 5 heavy launcher.

SGDC is a dual (civil-military) satellite for the customer Visiona, a joint venture of aircraft manufacturer Embraer and Brazil’s telecommunications operator, Telebras. It will provide sovereign and safe means for the strategic communications of the government and the defense and reduce the digital divide in Brazil by giving internet access to the whole country. This program reflects the close collaboration between Thales Alenia Space and Brazil, which includes the training of 30 Brazilian engineers in space industry techniques as well as the integration aboard the satellite of a structure panel made by the Brazilian company CENIC.

KOREASAT-7 was launched for the South Korean telecom/media service provider KT Sat. The satellite will provide Internet access, multimedia, broadcasting and fixed communications services for South Korea, Philippines, Indonesia and India. The KOREASAT-5A satellite is now being integrated by Thales Alenia Space and will later join KTSAT’s fleet.

“This dual launch reflects the excellent teamwork between Thales Alenia Space and our customers Visiona and KT SAT,” said Bertrand Maureau, Vice President, Telecommunications Business Line at Thales Alenia Space. “It also shows our ability to concurrently carry out launch campaigns for different customers, along with our wealth of services, the broad range of our telecom satellites, and our global business profile.”

Telespazio, a joint venture between Leonardo (67%) and Thales (33%), supported Thales Alenia Space throughout the installation, configuration and set-up of the SGDC 13-meters antennas for TT&C (Telemetry, Tracking and Control) activities and to provide the equipment of both SGDC control centres in Brasilia (main) and Rio de Janeiro (backup). Telespazio's Fucino Space Centre, in co-operation with the Thales Alenia Space teams in Cannes, will manage the activities to put both satellites, SGDC and KOREASAT-7, into orbit.

Photo copyrights:

Artistic view: ©Thales Alenia Space/Briot

SGDC: © Thales Alenia Space/Imag[IN] - KOREASAT-7: ©Thales Alenia Space/Briot

About Thales Alenia Space

Thales Alenia Space brings over 40 years of experience to the design, integration, testing and operation of innovative space systems for telecommunications, navigation, Earth observation, environmental management, exploration, science and orbital infrastructures. A joint venture between Thales (67%) and Leonardo-Finmeccanica (33%), Thales Alenia Space also teams up with Telespazio to form the parent companies’ “Space Alliance”, which offers a complete range of services and solutions. Thales Alenia Space has built up unrivaled expertise in dual (civil-military) missions, constellations, flexible high-throughput payloads, altimetry, meteorology, and high-resolution radar and optical observation. The company capitalizes on its strong legacy, while also making innovation a key to its strategy. By offering a continuous stream of new products and expanding its global footprint, Thales Alenia Space has established its leadership in today’s fast-evolving space sector.Thales Alenia Space posted consolidated revenues of about 2.4 billion euros in 2016 and has 7,980 employees in nine countries. www.thalesaleniaspace.com

Thales Alenia Space Press Contacts:

Sandrine Bielecki

Tel: +33 (0)4 92 92 70 94

sandrine.bielecki@thalesaleniaspace.com

Chrystelle Dugimont

Tel: +33 (0)4 92 92 74 06

chrystelle.dugimont@thalesaleniaspace.com

","{'label': 'Neutral', 'score': 0.9998733997344971}",neutral,0.9998733997344971,0
Radar station production plant starts operation in Kazakhstan - Astana Times,"Thu, 11 May 2017 07:00:00 GMT",https://news.google.com/rss/articles/CBMiXmh0dHBzOi8vYXN0YW5hdGltZXMuY29tLzIwMTcvMDUvcmFkYXItc3RhdGlvbi1wcm9kdWN0aW9uLXBsYW50LXN0YXJ0cy1vcGVyYXRpb24taW4ta2F6YWtoc3Rhbi_SAQA?oc=5&hl=en-US&gl=US&ceid=US:en,"ASTANA – The Granit-Thales Electronics plant, a joint Kazakh-French venture, has started production of the new generation Ground Master 400 radar equipment in Kazakhstan. The project is being implemented for the first time in the Central Asian region and will meet all state requirements.

“The station is constantly on duty, operating day and night. It showed itself as really good equipment, overlapping almost half of the central region,” said military expert and air defence forces senior engineer Tair Rakhimzhanov.

The first radar station prototype, produced in Kazakhstan in 2014 and tested for three years, has been guarding the capital for the same amount of time. The Ministry of Defence has plans that domestic radar stations will be able to place the entire country under their protection in the near future. The second station will be delivered to Karaganda this year.

In total, the plant will produce four radars per year. New stations will be installed in West Kazakhstan to protect the Caspian region and Almaty. The stations, with a maximum range reaching 500 kilometres, have a market price of approximately $22 million.

Kazakhstan is one of nine countries which received the French technology for radar station production. The Ground Master 400 is used in Germany, Canada and Finland. Recently, the North Atlantic Alliance received 10 French stations.

The Officials at the Kazakh Ministry of Defence see great potential in the systems to not only to cover the nation’s requirements, but also for export.

“A good understanding of this system and improving it is the way to enter the world market. The creation of other locators with medium, short range for border guards will give us prospects in the future,” said Granit-Thales Electronics deputy general director Marat Amanzholov.

Ground Master 400 uses digital beam-forming technology. Thales, its developer, combines the expertise of 64,000 employees and operations in 56 countries, which has made the company a key player in guarding vital infrastructure and protecting the national security interests of dozens of countries.","{'label': 'Neutral', 'score': 0.9999735355377197}",neutral,0.9999735355377197,0
