Titre,Date de publication,URL,Contenu
SPAINSAT NG programme successfully passes Preliminary Design Review (PDR) - Thales,"Thu, 22 Oct 2020 07:00:00 GMT",https://news.google.com/rss/articles/CBMigAFodHRwczovL3d3dy50aGFsZXNncm91cC5jb20vZW4vd29ybGR3aWRlL3NwYWNlL3ByZXNzLXJlbGVhc2Uvc3BhaW5zYXQtbmctcHJvZ3JhbW1lLXN1Y2Nlc3NmdWxseS1wYXNzZXMtcHJlbGltaW5hcnktZGVzaWduLXJldmlld9IBAA?oc=5&hl=en-US&gl=US&ceid=US:en,"SPAINSAT NG programme successfully passes Preliminary Design Review (PDR) Share this article



LinkedIn

SPAINSAT NG programme successfully passes Preliminary Design Review (PDR)

• Important milestone successfully achieved on schedule despite Covid-19

• Spanish industry assumes leadership of communications payload for first time, including integration of both satellites’ payloads in Spain

• Advanced technologies for Next Generation secure communications satellites

@AirbusSpace @Thales_Alenia_S #Hisdesat @Defensagov #SpaceMatters #SpaceforLife @esa @Partner_InOrbit

Madrid, 22 October 2020 – The SPAINSAT NG programme, owned and operated by Hisdesat, has successfully passed the preliminary design review (PDR) of the payloads and the full satellite, including PDR of Pacis 3 elements. SPAINSAT NG is being manufactured by a consortium of four co-primes from Airbus in Spain and France, and Thales Alenia Space in Spain and France.

© ©Hisdesat

This important milestone confirms the soundness of the preliminary design and technical capabilities of the SPAINSAT NG satellite system.

It was achieved in the expected timeframe despite the difficulties caused by the Covid-19 health crisis, thanks to the commitment of all project teams who have continued to work at full capacity, combining remote work with face-to-face activity in the workplace.

“Successfully passing the satellite and payloads PDR, including Pacis 3, in the planned schedule shows the outstanding commitment and performances of all the teams working in this challenging program. I really much appreciate the efforts of anyone, from our main end customer and partner in the SPAINSAT NG PPP the Spanish Ministry of Defense and the Spanish Ministry of Industry, Trade and Tourism as lender of the program, till CDTI, ESA, Hisdesat, Airbus DS, Thales Alenia Space and the rest of the industry working in the program”, said Miguel A. García Primo, Hisdesat CEO.

The SPAINSAT NG programme comprises two satellites, SPAINSAT NG I and II which will be situated in different geostationary positions to operate in X, military Ka and UHF bands.

The communication payloads of both satellites are provided by Spanish industry, including integration of the Communications Module in Spain, a major step forward for Spanish industry. Airbus in Spain is responsible for the X band payload, while Thales Alenia Space in Spain is responsible for the UHF and Ka band payloads. Other companies from Spanish space industry are also involved. The UHF payload is a new development in Spain, positioning the country at the forefront of the few countries in the world with national systems in the military UHF band.

The satellites are based on the Eurostar Neo platform, Airbus’ new geostationary telecommunications satellite product, a significant evolution of the highly reliable and successful Eurostar series with an entire range of major innovations. SPAINSAT NG includes an X band fully flexible payload, employing active antennas with in orbit reconfiguration capability, an onboarddigital processor that will interconnect the X and Ka band payloads for cross-banding, and a dedicated high speed service link enabling fast re-configuration.

“The successful PDR is an important milestone for the development of the SPAINSAT NG programme, which is on-track and on-schedule thanks to the huge professionalism and commitment of the project team,” said Eduardo Bellido, CEO of Thales Alenia Space in Spain. “For the first time we lead in Spain the development and integration of the payloads for a programme like SPAINSAT NG, which positions us at the forefront of space technology with the capacity to integrate large space systems. This will allow us to take the lead of new payloads and instruments in future missions.”



“Spain has always been at the centre of Airbus’ space activities. This milestone represents an extraordinary achievement as it clearly validates we have succeeded in further developing our expertise and capabilities on new technologies,” said Fernando Varela, Head of Airbus Space in Spain. “We are now ready for the next stage and on track with the integration of the communication modules in our clean rooms.”

The development of SPAINSAT NG is supported by the Spanish Centre for the Development of Industrial Technology (CDTI) in the framework of a Partnership Project (PP) between the European Space Agency (ESA) and the satellite operator Hisdesat, called Pacis 3.

ESA Partnership Project supports the development and integration of innovative satellite payload elements, such as the reconfigurable transmit and receive X-band active antennas, and the deployable pallet with individually steerable Ka-band antennas. The Partnership Project will de-risk the partner’s investments to answer market needs through the development of sustainable end-to-end system up to in-orbit validation. It will also demonstrate novel pooling and sharing concepts to ultimately provide more affordable, flexible and secure communications services for governmental users in Europe.

“The Pacis 3 Partnership Project with Hisdesat is an important step within the Govsatcom Precursor project, part of ESA’s Space Systems for Safety and Security Program” stated Elodie Viau, ESA’s Director of Telecommunications and Integrated Applications. “Pacis 3 shows how the European space industry can respond to a globally emerging market of secure satellite communications. Partnership Projects, provide an effective and collaborative environment to introduce innovative systems and services, up to in-orbit validation.”

New AIT facility

© Thales Alenia Space

The construction of a new clean room in Thales Alenia Space site in Madrid is progressing on-schedule to be ready for the SPAINSAT NG payload assembly, integration and test activities. This unique, cutting-edge facility in Spain will add more than 600 m2 clean area to the existing 2000 m2. With a free height of 12.5 meters in the inside, the facility is equipped with bridge cranes with lifting capacity up to 12 tons each, prepared for the integration of payloads and instruments of large dimensions for all type of space missions, spanning telecommunications, navigation, Earth observation and science.

The first of these New Generation SPAINSAT satellites will be launched at the end of 2023 and the second one a year later, guaranteeing the continuity of secure communications services.

The SPAINSAT NG satellites will have an operational lifetime of 15 years, remaining in service up to 2039.

About Airbus

Airbus is a global leader in aeronautics, space and related services. In 2019, it generated revenues of € 70 billion and employed a workforce of around 135,000. Airbus offers the most comprehensive range of passenger airliners. Airbus is also a European leader providing tanker, combat, transport and mission aircraft, as well as one of the world’s leading space companies. In helicopters, Airbus provides the most efficient civil and military rotorcraft solutions worldwide.

Contacts for the media

Ralph HEINRICH

Airbus Defence and Space

+49 (0)171 30 49 751

ralph.heinrich@airbus.com

Francisco LECHON

Airbus Defence and Space

+34 630 196 993

francisco.lechon@airbus.com

About Hisdesat

Hisdesat was born in 2001 as an operator of satellite government services to act fundamentally in the areas of defense, security, intelligence and external services. Since 2005, the company provides secure satellite communications services to government agencies in different countries and since September 2018, it provides Earth observation services with radar technology through the PAZ satellite, successfully launched on February 22nd. At present, the company is developing new constellations of maritime Satellite Traffic Information Satellites (AIS). More information: www.hisdesat.es

For further information:

Araceli Serrano

PR Communications Director

Tel: +34 91 4490149

aserrano@hisdesat.es

About Thales Alenia Space

Drawing on over 40 years of experience and a unique combination of skills, expertise and cultures, Thales Alenia Space delivers cost-effective solutions for telecommunications, navigation, Earth observation, environmental management, exploration, science and orbital infrastructures. Governments and private industry alike count on Thales Alenia Space to design satellite-based systems that provide anytime, anywhere connections and positioning, monitor our planet, enhance management of its resources, and explore our Solar System and beyond. Thales Alenia Space sees space as a new horizon, helping to build a better, more sustainable life on Earth. A joint venture between Thales (67%) and Leonardo (33%), Thales Alenia Space also teams up with Telespazio to form the parent companies’ Space Alliance, which offers a complete range of services. Thales Alenia Space posted consolidated revenues of approximately 2.15 billion euros in 2019 and has around 7,700 employees in nine countries. www.thalesaleniaspace.com

Thales Alenia Space – press contacts:

Sandrine Bielecki Tel: +33 (0)4 92 92 70 94 sandrine.bielecki@thalesaleniaspace.com

Catherine des Arcis Tel: +33 (0)4 92 92 72 82 catherine.des-arcis@thalesaleniaspace.com

Oriol Casas Thió Tel: +34 91 807 78 06 oriol.casasthio@thalesaleniaspace.com

Marija Kovac Tel: +39 (0)6 415 126 85 marija.kovac-somministrato@thalesaleniaspace.com"
NorthStar orders three satellites to collect space situational awareness data - SpaceNews,"Tue, 27 Oct 2020 07:00:00 GMT",https://news.google.com/rss/articles/CBMiZGh0dHBzOi8vc3BhY2VuZXdzLmNvbS9ub3J0aHN0YXItb3JkZXJzLXRocmVlLXNhdGVsbGl0ZXMtdG8tY29sbGVjdC1zcGFjZS1zaXR1YXRpb25hbC1hd2FyZW5lc3MtZGF0YS_SAQA?oc=5&hl=en-US&gl=US&ceid=US:en,"WASHINGTON — NorthStar Earth and Space, a Canadian company planning a satellite constellation to track other satellites, has selected Thales Alenia Space to build its first satellites.

Montréal-based NorthStar announced Oct. 27 that Thales will build its first three Skylark satellites, working in conjunction with LeoStella, its smallsat manufacturing joint venture with BlackSky. The satellites, based on LeoStella’s LEO-100 bus and assembled at its factory near Seattle, are scheduled for launch in 2022. The companies did not disclose terms of the satellite contract.

Each satellite, operating in a polar orbit at an altitude of 575 kilometers, will carry an optical payload that will scan orbits ranging from low Earth orbit to geostationary orbit to track satellites. NorthStar plans to use those observations to provide customers with space situational awareness (SSA) services.

NorthStar has been working on this concept for several years, originally pitching it as a dual-use system, with satellites also carrying hyperspectral sensors for Earth observation. The Skylark satellites, though, will be devoted to SSA.

“We’ve convinced ourselves that we’re in a good place with clients, with our partners, with our manufacturing plant. It’s time to start building the satellites and start getting the services up and running,” Stewart Bain, chief executive of NorthStar, said in an interview.

The three satellites ordered now are the beginning of a constellation of at least 12 NorthStar plans to launch by 2024. Bain said the company will launch them three at a time into different orbital planes to enhance its coverage.

NorthStar is entering an increasingly crowded market for SSA and related services. Companies like ExoAnalytics and LeoLabs already provide SSA data using ground-based telescopes and radars, and use that data to provide services for satellite operators and other customers. Others, like AGI’s Commercial Space Operations Center, take data from a variety of sources to provide space traffic management services.

Bain said that NorthStar’s key difference is that its data will come from satellites. “The perspective of space gives you high revisit on objects, and filling out the whole view of space and everything that is going on in space is done in a matter of hours,” he claimed. “Because we’re in space we’re not limited by atmosphere and weather.”

He declined to specify how small of an object that the system will be able to track other than it will be able to see those that are “multiple centimeter sized.” The newest radars operated by LeoLabs can track objects as small as two centimeters across in LEO, the company has stated.

Bain expects the service to win business from both commercial and government organizations. That includes the U.S. Office of Space Commerce, which is tasked with space traffic management responsibilities and is working on what it calls an “open architecture data repository” that will combine SSA data from a variety of sources. “We’re very motivated to support the U.S.’s endeavors in space traffic management and provide them with necessary information to do that,” he said.

NorthStar raised $65 million in 2018, and Bain said the company’s current funding is sufficient to start work on the Skylark system. The company declined to discuss any ongoing fundraising efforts, citing restrictions in Canadian law.

While the initial satellites are focused on SSA, NorthStar has not ruled out pursuing Earth observation, part of its original plans, in the future. Hyperspectral imagers, Bain said, would require far more capital to develop, hence the initial focus on SSA. “Raising the capital necessary for 40 satellites with hyperspectral imagers is a much bigger challenge.”

“Launching the SSA system allows us to become a revenue generating enterprise rather than just a startup,” he said. “We felt the right focus was to get the Skylark system up and running, be the first in space, deliver the services. There is a demand for that right now.”"
Thales Alenia Space to deliver Europe’s main modules for lunar space station - SatelliteProME.com,"Wed, 14 Oct 2020 07:00:00 GMT",https://news.google.com/rss/articles/CBMibGh0dHBzOi8vc2F0ZWxsaXRlcHJvbWUuY29tL25ld3MvdGhhbGVzLWFsZW5pYS1zcGFjZS10by1kZWxpdmVyLWV1cm9wZXMtbWFpbi1tb2R1bGVzLWZvci1sdW5hci1zcGFjZS1zdGF0aW9uL9IBAA?oc=5&hl=en-US&gl=US&ceid=US:en,"The station, weighing about 40 metric tons, will be automatically assembled piece by piece in a near rectilinear halo orbit (NRHO) around the moon.

The European Space Agency has chosen Thales Alenia Space to develop two key modules for the upcoming Lunar Orbital Platform-Gateway (LOP-G) de la NASA. These are the I-HAB (International Habitat) and the ESPRIT communications and refuelling module.

These two modules are the European contribution for this Gateway. The first tranche of I-HAB contract, (worth $42.2m) has been signed with the European Space Agency (ESA), while ESPRIT development has already started under Authorisation To Proceed (ATP) with a contract signature expected by the end of the year.

This Gateway, a manned lunar orbital infrastructure, is one of the pillars of NASA’s Artemis programme, designed to return humans to the moon by 2024. It is being implemented through international cooperation, currently involving NASA (United States), ESA (Europe), JAXA (Japan) and CSA (Canada) with each partner in charge of the development of complementary elements, to be assembled and operated in lunar orbit as from 2024.

The station, weighing about 40 metric tons, will be automatically assembled piece by piece in a near rectilinear halo orbit (NRHO) around the moon. The final configuration is still partly under final consolidation, but it will mainly comprise habitation modules for the crew, docking capabilities for visiting vehicles and the Orion space capsule, logistics modules, communications with the Earth and Moon, EVA airlocks for scientific experiments and crew extravehicular activities (EVA), as well as a robotic arm.

It is not intended for permanent occupancy but will be able to host four-person crews for periods of one to three months. Gaining new experiences on and around the moon will prepare NASA to send the first humans to Mars in the coming years, and the Gateway will play a vital role in this process.

I-HAB will mark the transition from the ISS to a new generation of space infrastructures for deep space exploration. It will meet evolving requirements and performances for lighter structures and optimized micrometeorites protection system evolved docking systems and hatches, enhanced functional and avionic architectures, more efficient thermal control system with deployable radiators to ensure full autonomous capability of heat rejection, innovative conditioning systems. The I-HAB will experience for the first time long exposure in the deep space environment, offering the opportunity to test and prove potential design solutions for protection against cosmic radiations. Being unmanned for most of its time on orbit, it will also require dedicated solutions for the robotic operations, either on board or externally.

One of the key evolving steps with respect to the ISS will be focussed on designing, with the support of virtual reality technique, more comfortable internal accommodations, with the exploitation of modular and reconfigurable solutions to optimise room and comfort for the crew.

The module will be provided by Europe with contributions from the other space agencies like environmental and life support system from JAXA, avionics and software parts from NASA and robotic components from CSA; the integration of all these elements in I-HAB will leverage on the large experience already acquired by Thales Alenia Space during the ISS Nodes 2 and 3 activities already developed in cooperation. I-HAB is slated for launch in 2026.

ESPRIT (European System Providing Refueling, Infrastructure and Telecommunications) consists in two main elements. The first, named HLCS (Halo Lunar Communication System), ensures the communications between the Gateway and the moon. The launch is planned for 2024 with HALO, the first habitation and logistics module, supplied by the US, and derived from the Cygnus resupply cargo, for which Thales Alenia Space has been selected to provide its primary structure and micrometeoroid protection system.

ESPRIT includes a second part named ERM (ESPRIT Refueling Module) which combines the refuelling of the Gateway with a small pressurised module with windows. ERM will provide active refuelling of the Gateway with xenon and chemical propellants to extend its life but also prepare for re-usable Lunar Lander or Deep Space Transport (to Mars).

ERM’s pressurised tunnel provides wide windows offering a 360° view on space, moon, earth and on the Gateway. This pressurised volume will also contain various logistics and other elements for the crew. Delivery is planned for 2026, with launch the following year.

Commenting on the contract, Hervé Derrey, CEO of Thales Alenia Space said: “We would like to thank our customer ESA for continuing to place their trust in our ability to build Europe’s two main contributions to the lunar space station, as well as national space agencies in particular CNES and ASI for their support in these two programs. Through our contributions to the ISS, the Axiom commercial space station and now the lunar space station, we are expanding the possibilities in this field, not only in terms of technology but also for the safety and comfort of astronauts.”

Massimo Claudio Comparini Senior Executive Vice President Observation, Exploration and Navigation at Thales Alenia Space, added: “Through these contracts, Thales Alenia Space will call on the full sum of our expertise to expand our knowledge base and push back the frontiers of the cislunar exploration. Looking further ahead, this space station will be a jumping-off point for future human missions into deep space, including Mars.”"
