Titre,Date de publication,URL,Contenu
Damen and Thales to build the German MKS 180 frigate of the future - EDR Magazine,"Wed, 18 Nov 2020 08:00:00 GMT",https://news.google.com/rss/articles/CBMiXWh0dHBzOi8vd3d3LmVkcm1hZ2F6aW5lLmV1L2RhbWVuLWFuZC10aGFsZXMtdG8tYnVpbGQtdGhlLWdlcm1hbi1ta3MtMTgwLWZyaWdhdGUtb2YtdGhlLWZ1dHVyZdIBAA?oc=5&hl=en-US&gl=US&ceid=US:en,"Hengelo, 18 November 2020 – Damen Schelde Naval Shipbuilding and Thales signed on November 17, 2020,the contract for the delivery and full integration of Thales’s Mission and Combat System for the four MKS 180 class frigates contracted by the German Navy. The system will be designed by Damen and completely built by German shipyards, under Damen’s project management.

Valued at €1.5B, the contract illustrates Thales’s leading position in global naval integration. It will be executed by Thales’s naval Centers of Excellence in Hengelo (the Netherlands), Kiel and Wilhelmshaven (Germany) in cooperation with a substantial number of German subcontractors.

Underpinning this contract is the proven cooperation of German and Dutch naval industries, including numerous joint opportunities for Damen and Thales in the Netherlands to innovate within naval shipbuilding projects, often with the participation of the Netherlands’ Ministry of Defence. The project underscores Damen’s and Thales’s ambition to build further cooperation with shipyards and partnering industries in high-end European naval programmes.

Thales’s Mission and Combat System includes the comprehensive Tacticos Combat Management System and the AWWS (Above Water Warfare System) Fire Control Cluster. The contract includes four ship systems, logistic services and multiple land-based test and training sites, as well as the option for one or two additional ships.

AWWS is a cutting-edge warfare suite that helps the ship crews to counter and neutralise complex saturation attacks by continuously analysing and optimising the tactical environment and deployment of resources. AWWS will be combined with APAR* Bl2, the evolved version of Thales’s proven AESA* multifunction radar. In 2019, Thales signed an AWWS development contract for the new M-frigates for the Belgian and Dutch Navies.

In the past years, Thales has been awarded several large contracts by European NATO navies, thanks to innovative solutions and its proven reliability as an industrial partner. These contracts have made Thales the de facto naval combat system partner of NATO.

The first ship of the MKS 180 class will be operational in 2028. The entire programme will run for over ten years.

“Winning such a substantial contract within the strict framework of an objective scoring system reinforces our global leading position in high-end naval integration. Thanks to our innovative capabilities, the German Navy will be able to execute both current and future tasks whilst substantially contributing to stability in the operational theatres all over the world.” Gerben Edelijn, CEO of Thales Netherlands.

“As a partner in the MKS 180 programme, Thales Deutschland not only contributes to a high German value-added share, but also brings many years of experience in European cooperation and proven systems expertise. This programme will create new, high-quality jobs in Germany, within an exemplary framework of European defence cooperation. We will also contribute to maintaining the German Navy’s operational capability at the highest level within the alliance,” Dr. Christoph Hoppe, CEO of Thales Deutschland.

“We are very honoured by this notification which further solidifies our long-standing cooperation with the German Navy and Damen. We sincerely thank our customers for their continued trust. This huge contract anchors our position as global leader in high-end naval systems integration. The German Navy will benefit from cutting-edge technological systems thanks to the diversity of talents at Thales”.Patrice Caine, Chairman and CEO of Thales.

* APAR: Active Phased Array Radar

* AESA: Active Electronically Scanned Array

Images courtesy Damen and Thales"
Mitsubishi contracts Thales for sonar deliveries for Japan Navy UUVs - Defense Brief,"Tue, 24 Nov 2020 08:00:00 GMT",https://news.google.com/rss/articles/CBMiZWh0dHBzOi8vZGVmYnJpZWYuY29tLzIwMjAvMTEvMjQvbWl0c3ViaXNoaS1jb250cmFjdHMtdGhhbGVzLWZvci1zb25hci1kZWxpdmVyaWVzLWZvci1qYXBhbi1uYXZ5LXV1dnMv0gEA?oc=5&hl=en-US&gl=US&ceid=US:en,"Japan Maritime Self-Defense Force (JMSDF) OZZ-5 mine-hunting unmanned underwater vehicles (UUV) will soon be equipped with SAMDIS high-resolution synthetic aperture sonars from Thales.

According to a Thales announcement, the UUVs will combine high frequency sonars from Thales and Japanese low frequency synthetic aperture sonar technology that will allow operators to detect suspected mines regardless of the varied or unvaried condition.

“This contract agreement is the starting point of a long-term program with Japan Maritime Self-Defense Force as end-user and potentially opens the door to export markets. The continuous and successful collaboration between Thales and MHI in Japan has been, once again, strengthened by the order of SAMDIS HFSAS to equip MHI’s OZZ-5 UUV,” Thales said in the announcement.

“Equipping the OZZ-5 underwater vehicle with our high frequency sonar evidences our strong relationship with MHI which started years ago with the development of the OZZ-X prototype. It materializes the continuation of the ongoing Japan/ France bilateral long-term cooperation. Thales is really enthusiastic to bring its field proven expertise for the benefit of national and foreign defense forces through this successful alliance with MHI.” Cyrille Dupont, president and CEO of Thales Japan.

“We are very proud to be onboard the OZZ-5 mine warfare UUV with Thales SAMDIS HFSAS and to contribute to the OZZ-5 outstanding operational performances and unique positioning on this highly competitive market segment. This contract demonstrates Thales’ capability to tailor its offerings to any type of vehicle and navy requirement and will pave the way for future achievements with our MHI partner.” Alexis Morel, VP underwater activities, Thales.

According to Japan’s defense ministry, the OZZ-5 UUV measures 4 meters in length and has an endurance of over 9 hours. It has been in use or trials with the JMSDF since at least 2018. According to several reports, the UVV will also be deployed from the new generation of JMSDF 30FFM frigates, the first of which was launched earlier this month."
Thales provides the combat system for the Germany’s MKS 180 frigate programme - EDR Magazine,"Fri, 20 Nov 2020 08:00:00 GMT",https://news.google.com/rss/articles/CBMiZ2h0dHBzOi8vd3d3LmVkcm1hZ2F6aW5lLmV1L3RoYWxlcy1wcm92aWRlcy10aGUtY29tYmF0LXN5c3RlbS1mb3ItdGhlLWdlcm1hbnlzLW1rcy0xODAtZnJpZ2F0ZS1wcm9ncmFtbWXSAQA?oc=5&hl=en-US&gl=US&ceid=US:en,"By Luca Peruzzi

The Damen Schelde Naval Shipbuilding, as prime contractor for the German MoD’s Mehrzweckkampfschiff 180 (MKS 180) multi-purpose frigates programme, has signed with Thales a € 1.5 billion contract on 17 November in Vlissingen’s Damen site (the Netherlands), for the full integration and delivery of the ‘Mission & Combat System’ on board the new ships for the German Navy.

“The third largest contract ever awarded to Thales”, said Philippe Duhamel, executive vice-president Defence Mission Systems for Thales in a press conference call, it will see Thales taking the responsibility for combat system integration and the supply of its main elements on all four MKS 180 ships, including the various third party systems and subsystems procurement, in addition to logistics and training services, and two land-based test and training sites in Germany. The contract also includes the option for one or two additional ships.

Damen was awarded the MKS 180 multi-purpose frigates design and construction contract valued € 4.6 billion by the German’s Bundesamt fur Ausrüstung, Informationstechnik und Nutzung der Bundeswehr (BAAINBw) in June 2020. Alongside Thales, Dutch-owned Damen will deliver the MKS 180 programme in co-operation with Lürssen (the latter working in co-operation with Kiel-based German Naval Yards) and Blohm + Voss. Damen will be responsible for the MKS 180 design, but the vessels will all be built in Germany under Damen’s project management. With a displacement of around 9,000 tonnes and a length at waterline of around 155 meters , the MKS 180 platforms have been conceived as large, multi-purpose surface combatant ships able to reconfigure thanks to modular bays capable to accommodate different modules according to the missions to be accomplished.

“Thales is the combat system integrator, having the responsibility for the integration of all combat system that will equip the ships”, Duhamel said. “That will include the TACTICOS combat management system (CMS) and the AWWS (Above Water Warfare System) fire control cluster incorporating the APAR Block 2 multifunction radar, in addition to other sensors and the integrated communications – part of which we will supply – and the cyber security solution. Thales will also be responsible for the procurement of other combat system elements from various suppliers, except for the government-furnished equipment involved. Activities on the package have already started by Thales”, the group representative said.

The contract will be executed by Thales’ Naval Centre of Excellence in Hengelo (the Netherlands), Kiel and Wilhelmshaven (Germany), in cooperation with a substantial number of German subcontractors, with approximately 70% of the work to be performed in Germany.

Thales will supply the latest version of the TACTICOS CMS, which is already in service in previous iterations with the German Navy, managing all the sensors and systems provided by both Thales and third parties. The MKS 180 contract marks the first production contract for the Thales AWWS and the latest generation APAR Block 2 X-band multifunction radar. Already under development by Thales Nederland for the Netherlands/Belgium Vervanging M-fregatten (M-frigate replacement) programme, the AWWS will combine an advanced fire-control suite with the APAR Block 2 radar, which four face antennas will be distributed between the two main mast superstructures. According to Thales, the TACTICOS CMS with the full integration of the AWWS will provide the capability to defeat current and future stressing multiple simultaneous threats in complex scenarios. On board the MKS 180, the latter will provide guidance support for the Raytheon Evolved SeaSparrow Missile (ESSM) Block 2 local area anti-air missile, the prime air defence system equipping the new ships. The APAR Block 2 also supports the future Standard Missile family. Thales will also provide the Gatekeeper 360° non-rotating surveillance IR/TV suite with systems distributed between the two main mast superstructures as well as the Mirador Mk2 EO fire control system for observation and tracking in addition to components of the integrated communications suite, of which SATCOM multiple dishes satellite comms have been identified so far. Thales will also be responsible and provide the cyber security integrated into the combat system solution, complying with strict security standards and German national regulations.

The TACTICOS CMS will also manage the remaining sensors, systems and weapon package, which according to information provided by the German MoD and the video released by Thales, include the Hensoldt four fixed faces variant of the TRS-4D C-band volume and surveillance radar and the Rohde & Schwarz GEDIS Kora RESM/CESM suite, in addition to Lockheed Martin two 8-cell Mk 41 VLS launchers for ESSM Block 2 missiles, two RAM (Rolling Airframe Missile, Raytheon/RAM-System) guided missile inner-layer defence systems, Kongsberg NSM (Naval Strike Missile) anti-ship missiles (according to images a total of eight munitions) and the Leonardo 127/64 mm LightWeight (LW) Vulcano main gun, the latter capable to fire Vulcano long-range guided ammunitions. The ships will also be equipped with smaller caliber remote controlled guns as indicated by the German MoD. Images provided by Damen also feature Rheinmetall Defence MASS (Multi Ammunition Softkill System) family decoy launching systems. The new multi-purpose frigates will also be equipped an underwater warfare suite, which selection remains to be finalized.

According to German Government documentation, a total of around € 5.7 billion have been put aside in the national defence budget for the MKS 180 programme. The delivery of the four multi-purpose frigates for the German Navy will start in mid-2028 to be completed in mid-2032.

Images courtesy Damen and Thales"
"Rail News - Rail supplier news from Hitachi, Hatch, LTK, AECOM, Thales and Ensco (Nov. 2). For Railroad Career ... - Progressive Rail Roading","Mon, 02 Nov 2020 08:00:00 GMT",https://news.google.com/rss/articles/CBMijAFodHRwczovL3d3dy5wcm9ncmVzc2l2ZXJhaWxyb2FkaW5nLmNvbS9zdXBwbGllcl9zcG90bGlnaHQvbmV3cy9SYWlsLXN1cHBsaWVyLW5ld3MtZnJvbS1IaXRhY2hpLUhhdGNoLUxUSy1BRUNPTS1UaGFsZXMtYW5kLUVuc2NvLU5vdi0yLS02MTk4N9IBAA?oc=5&hl=en-US&gl=US&ceid=US:en,"11/2/2020

Rail News: Railroading Supplier Spotlight

Photo – Mitsubishi Corp.



Hitachi Ltd., Hitachi Rail STS SpA and Mitsubishi Corp. have signed an $883 million contract with HPH Consortium, the prime contractor for Panama Metro’s Line 3 in Panama City. Under the contract, Hitachi and Hitachi Rail will provide 28 six-car vehicles (168 cars), the signaling systems, telecommunication systems, power systems, control center, platform screen doors and depot equipment for the monorail. Mitsubishi will manage the project's administration. Line 3 is a 15.5-mile, elevated double-track system that will cross over the Panama Canal. It will include 14 stations and open in 2025, Hitachi officials said in a press release.

Hatch completed its merger with LTK. The integration of Hatch and LTK will allow Hatch to broaden its U.S. capabilities and deliver solutions to clients globally, Hatch officials said in a press release. LTK’s focus on rail and rail systems combined with Hatch’s integrated, multidisciplinary transportation expertise will provide clients with comprehensive options across the entire supply chain and lifecycle of their operations, officials said. AEC Advisors initiated the merger transaction and served as the financial advisor to Hatch.

AECOM named Antonino Marino associate vice president and senior program manager, and Anthony Chionchio AVP and senior electrical technical leader. Marino and Chionchio will be focus on major transportation infrastructure projects and programs across the New York region. Previously, Marino served as deputy chief of design for the Port Authority of New York and New Jersey (PANYNJ). Chionchio previously served as PANYNJ’s chief electrical engineer.

SNCF Reseau in France tasked the Argos innovation partnership with upgrading and developing pre-series production signal interlockings. The interlockings are scheduled for commissioning at the end of 2023. The Argos partnership is made up of Thales, Engine Solutions, Vossloh, Alstom, Hitachi Rail, Eiffage Energie SAS and Systra.

The U.S. Pipeline and Hazardous Material Safety Administration (PHMSA) announced it will continue a program to evaluate public safety awareness technologies. As part of the program, Ensco Inc. and a research team from the University of South Florida’s Center for Urban Transportation Research and TrueSafety Evaluation LLC will identify emerging technologies that may mitigate inherent risks to pedestrians and trespassers in railroad, transit and highway transportation systems. Ensco also is identifying testbeds that can be used to evaluate candidate technologies, produce a streamlined test protocol and develop strategies for implementing technologies nationwide. The initiative is a collaboration among PHMSA, the Federal Highway Administration, Federal Railroad Administration, Federal Transit Administration and National Highway Traffic Safety Administration."
Fivecast: An Australian SME providing world-leading open source intelligence solutions - Thales,"Fri, 20 Nov 2020 08:00:00 GMT",https://news.google.com/rss/articles/CBMieGh0dHBzOi8vd3d3LnRoYWxlc2dyb3VwLmNvbS9lbi9jb3VudHJpZXMtYXNpYS9hdXN0cmFsaWEvbmV3cy9maXZlY2FzdC1hdXN0cmFsaWFuLXNtZS1wcm92aWRpbmctd29ybGQtbGVhZGluZy1vcGVuLXNvdXJjZdIBAA?oc=5&hl=en-US&gl=US&ceid=US:en,"Fivecast, based in Adelaide South Australia, is a world-leading provider of cutting-edge open source intelligence (OSINT) solutions with the mission to enable a safer world. Fivecast’s customers in national security, defence and law enforcement utilise their solutions to explore masses of digital data; gaining insights into threats which are critical in protecting global communities.

Fivecast Founders

Founded by Dr. Brenton Cooper, Ross Buglak, Duane Rivett and Dave Blockow in 2017, the idea for Fivecast was spun out of the Data to Decisions Cooperative Research Centre (D2D CRC) which brought together some of the best and brightest research minds in AI and machine learning across industry, Government and Universities to tackle the big data challenges that faced Australian and global national security agencies.

“Fivecast was built from the ground up to specifically address big data challenges faced by the world’s most important organizations. We’re proud that the work initiated by the D2D CRC has been further developed by Fivecast and is now helping organizations both in Australia and the US uncover actionable insights to solve complex intelligence challenges of the utmost significance,” said Dr. Brenton Cooper, CEO of Fivecast.

Although only established formally for less than three years, in that time, Fivecast have enjoyed significant success including securing funding from the Commonwealth’s Accelerating Commercialisation grants in 2017 and in exporting their market-leading OSINT solution, Fivecast ONYX, into the international market.

“In a relatively short space of time, Fivecast has successfully established itself as a market leader in open-source intelligence in Australia and has established a presence in the US, already working with key customers in law enforcement and intelligence in that market. Our product roadmap includes new OSINT capabilities and use cases that will enable us to serve new markets and support continued growth,” mentioned Dr. Brenton Cooper.

There are two major elements of Fivecast’s key solution, Fivecast ONYX. Firstly, targeted data collection enables masses of structured and unstructured data to be gathered across open source platforms, including text, images and video. Secondly, AI-enabled analytics is applied to this data to quickly filter through the noise, identify the most risky data, uncover networks and analyse trends and changes across different risk elements.

“If a human was to analyse the data that’s collected, it would take weeks, at a minimum, to uncover the critical information. By automating the data collection process and applying AI and machine learning to risk analysis, we’re reducing the time constraints of manual data analysis, removing the potential for human error and acting as a force multiplier for analyst teams that are often under-resourced,” explained Dr. Brenton Cooper

In addition to helping overcome big data challenges, Fivecast’s AI enabled risk analytics are able to detect changes in behaviour, sentiment and emotion. This capability is of particular importance when their customers require a solution that identifies red flags in behaviours and changes in a person’s online activity.

Thales and Fivecast’s relationship started around 18 months ago with Thales Australia’s Industry Engagement Unit (IEU) actively looking for innovative SMEs that fit well with Thales’ Group product portfolio, as part of the Australian Governments Global Supply Chain (GSC) Program.

Fivecast are now embedded in Thales Australia’s own suite of digital intelligence tools which are in use by customers in Australia and overseas. “We have found that the synergy of operational activity between the Thales intelligence Analysts’ capabilities combined with the use of Fivecast platforms, provides a unique curated capability for the Defence, National Security, Critical Infrastructure and law enforcement customers both locally in Australia and globally,” said Jason Legge, Thales Australia’s Director of Digital Innovation.

Read more on Fivecast here."
MMCM Program Enters Manufacture Stage with Initial Production Contract Award - Naval News,"Thu, 26 Nov 2020 08:00:00 GMT",https://news.google.com/rss/articles/CBMifmh0dHBzOi8vd3d3Lm5hdmFsbmV3cy5jb20vbmF2YWwtbmV3cy8yMDIwLzExL3Vrcy1tbWNtLXByb2dyYW0tZW50ZXJzLW1hbnVmYWN0dXJlLXN0YWdlLXdpdGgtaW5pdGlhbC1wcm9kdWN0aW9uLWNvbnRyYWN0LWF3YXJkL9IBAA?oc=5&hl=en-US&gl=US&ceid=US:en,"MMCM Program Enters Manufacture Stage with Initial Production Contract Award The Franco-British Maritime Mine Counter Measures (MMCM) project today reached the manufacture stage, with a £184M contract awarded to Thales UK. The contract is for three sets comprising portable operation center, UUV, towed sonar & mine neutralization system.

A £184 million contract will support more than 200 jobs and give the Royal Navy increased capability to remotely detect and neutralise sea mines, the UK MoD Defence Equipment & Support agency announced on Nov. 26.

More than 200 UK jobs will be supported by a newly-signed contract to build technologically advanced autonomous systems able to defeat modern sea mine threats while reducing risks to life during Royal Navy mine hunting operations.

Following a successful demonstration phase and trials, the UK has invested £184 million in the Maritime Mine Counter Measures (MMCM) programme through a joint production contract with France.

The investment will see around 215 jobs supported in the UK at Thales sites in Templecombe (Somerset) and Plymouth as well as in the wider supply chain including L3 Harris in Portsmouth, Stonehaven in Aberdeen and Alba Ultrasound in Glasgow.

When operational, the new system will give the Royal Navy increased capability to remotely detect and neutralise sea mines. It is designed to potentially replace conventional crewed minehunting vessels, such as the Royal Navy’s Hunt and Sandown-class ships, with autonomous systems.

The UK element of the production contract was negotiated by the Mine Hunting Capability (MHC) team at DE&S.

“We are constantly working with industry to identify innovative equipment that will provide the Royal Navy with cutting-edge capability. This system is an exciting development and the collaborative working between DE&S, industry, the Royal Navy and our French colleagues is helping make it a reality”



Barry Miller, MHC team leader

The contract sees the purchase of three sets of equipment. Each set comprises a portable operation centre, an autonomous surface vessel, towed sonar and a mine neutralisation system.

Sea mines constitute a growing threat and users of this system will be able to detect and neutralise mines from miles away ensuring they can keep vital sea lanes open with much-reduced risk to ships and the lives of sailors.

DE&S CEO Sir Simon Bollom said: “This ground-breaking technology brings with it a step-change in capability for the Royal Navy which is a bold step into the digital and autonomous world. I’m incredibly proud of DE&S and the Royal Navy team who have worked tirelessly with our French colleagues to deliver on this contract.”

DE&S picture

The MMCM programme was set up to deliver cutting-edge minehunting equipment to the navies in the UK and France. The programme contract will be placed by the Organisation for Joint Armament Co-operation (OCCAR) acting as the Contracting Management Authority on behalf of both nations.

First Sea Lord Admiral Tony Radakin said: “I am enormously excited by the potential of the future mine hunting capability. This will allow us to deliver mine hunting more effectively, more efficiently and more safely, and to integrate even more closely with our French counterparts in this important area.”

The first equipment is due to be delivered in late 2022. It will commence operational evaluation prior to entering service with the Royal Navy.

Naval News comments:

The French Minister of the Armed Forces, approved last month the launch of the SLAMF (Système de lutte anti-mines futur) Future Mine Warfare System Program. The SLAM-F / MMCM mine warfare system will allow French and British sailors to operate remotely and stay out of the mine field through the use of unmanned systems. However, many questions remain regarding the exact type of UUVs and USVs France and the Royal Navy plan to procure."
