Titre,Date de publication,URL,Contenu
Indonesia acquires 11 Airbus Helicopters AS565 MBe Panther to enhance its ASW capabilities - Navy Recognition,"Thu, 13 Nov 2014 08:00:00 GMT",https://news.google.com/rss/articles/CBMi1QFodHRwczovL25hdnlyZWNvZ25pdGlvbi5jb20vaW5kZXgucGhwL25hdmFsLW5ld3MvbmF2YWwtZXhoaWJpdGlvbnMvMjAxNC1hcmNoaXZlLW5hdmFsLWV4aGliaXRvbnMvaW5kb21hcmluZS0yMDE0LzIxNjgtaW5kb25lc2lhLWFjcXVpcmVzLTExLWFpcmJ1cy1oZWxpY29wdGVycy1hczU2NS1tYmUtcGFudGhlci10by1lbmhhbmNlLWl0cy1hc3ctY2FwYWJpbGl0aWVzLmh0bWzSAQA?oc=5&hl=en-US&gl=US&ceid=US:en,"This order will add to the Indonesian Armed Forces’ fleet of Airbus Helicopters rotorcraft serving the country’s defense on land, at sea and in the air. The fleet includes the light EC120 Colibris for training; the Fennecs and BO-105 for light attack missions; the Panthers for anti-submarine warfare missions; and the Pumas and Super Pumas operated by the Air Force who will soon also receive the EC725 for combat search and rescue missions.



The agreements were secured by PT Dirgantara Indonesia as a result of its long-standing cooperation and strategic alliance with Airbus Helicopters. The President of PT Dirgantara Indonesia, Budi Santoso explained, “This latest contract demonstrates the strength and efficiency of our commercial and industrial partnership with Airbus Helicopters. Together, we are able to identify and deliver the most modern and cost-effective solutions for the Indonesian Government and at the same time associate the significant involvement of the Indonesian industry.”"
PICTURE: Airbus brings A350 on Asian demonstration tour - Flightglobal,"Mon, 17 Nov 2014 08:00:00 GMT",https://news.google.com/rss/articles/CBMiYmh0dHBzOi8vd3d3LmZsaWdodGdsb2JhbC5jb20vcGljdHVyZS1haXJidXMtYnJpbmdzLWEzNTAtb24tYXNpYW4tZGVtb25zdHJhdGlvbi10b3VyLzExNTE2Ni5hcnRpY2xl0gEA?oc=5&hl=en-US&gl=US&ceid=US:en,"Airbus has deployed one of its A350-900 aircraft on a demonstration tour to five Asian countries, starting from 17 November.

The tour comes after the completion of the A350-900 flight test campaign, which led to the aircraft gaining certification from the European Aviation Safety Agency and the US Federal Aviation Administration, says Airbus.

Airbus

The aircraft, MSN5, will visit Seoul Gimpo, Tokyo Haneda, Hanoi, Bangkok and Kuala Lumpur between now and 28 November. It is equipped with a fully functional cabin featuring 265 seats across two classes. Earlier this year, the same aircraft visited Australia, Hong Kong and Singapore on a route proving certification exercise.

Airbus adds that the Asia-Pacific represents a third of the A350 orders won to date, with 750 orders from 39 customers worldwide. Delivery of the first aircraft to Qatar Airways is also expected by the end of 2014.

Source: Cirium Dashboard"
A320 v 737: the sales winner is.... - Leeham News and Analysis,"Mon, 17 Nov 2014 08:00:00 GMT",https://news.google.com/rss/articles/CBMiQWh0dHBzOi8vbGVlaGFtbmV3cy5jb20vMjAxNC8xMS8xNy9hMzIwLXYtNzM3LXRoZS1zYWxlcy13aW5uZXItaXMv0gEA?oc=5&hl=en-US&gl=US&ceid=US:en,"It’s one of the bitterest rivalries in the industrialized world: Airbus vs Boeing.

Despite being world-class companies, executives at each often snipe at each other’s airplanes, claiming superiority in economics and passenger appeal. Like lawyers arguing a court case, data is typically selectively used to advance the claims.

One of the most hotly debated issues between the two companies is which is the best single-aisle airplane, the ones that fly the most routes in the world and which carry more passengers than any other type: the Airbus A320 or Boeing 737 families.

Boeing’s marketing and communications team has done a superb job of claiming its 737 is the best selling jetliner of all time and with 12,257 firm orders since the first program, the 737-100/200, was launched in 1964. The 737 edges out the A320 family’s 11,021 orders. (These figures exclude options and MOUs.)

But the A320 was launched in 1984, 20 years after the 737. A even-up comparison should begin in March 1984 comparing the A320 family with the 737 Classic from then to the end of the Classic’s production run; and with the 737 Next Generation from its program launch in November 1993; followed by the A320neo and the 737 MAX.

When the count is adjusted to start from the A320’s program launch, Airbus can correctly claim it has sold more A320 Family members than Boeing has sold 737 Classics, NGs and MAXes over the same period.

The 737, which entered service in 1968, had a solid customer base built up in the 16 years before Airbus launched the A320 program in March 1984. The so-called 737 Classic (300/400/500) is no longer in production, having been superseded by the 737 Next Generation (NG), launched in November 1993. The NG and the ceo are still in production. Coming from nowhere, with no customer base, Airbus captured 47.5% of the firm orders and 48.9% of the firm orders plus options, letters of intent and memorandums of understanding.

Airbus launched its re-engined A320neo (New Engine Option) in December 2010. Boeing launched the 737 MAX. the following July. These each come in three sub-types. Airbus is the runaway-market winner.

Boeing points out that Airbus had a seven month head-start on program launch and claims that since the MAX was launched, it’s won 50% of the campaigns. The website PDXlight.com provides an independent look at sales in the days since launch; the A320neo consistently outsells the 737 MAX.

The first of the A320neos is scheduled to enter service in October next year. The first 737 MAX is scheduled to enter service in July 2017.

Boeing’s dominance in the single-aisle is a thing of the past, and it won’t return for at least another decade and perhaps a decade and a half—certainly not until Boeing designs an entirely new, “clean sheet” airplane and this even depends on the Airbus response.

Boeing CEO Jim McNerney, asked about the market share on the third quarters earnings call Oct. 22, maintained Boeing’s long-running statements that it will recover to obtain a 50% share of the A320-737 market.

Airbus’ isn’t concerned about the prospect of a Boeing NSA, or New Single Aisle airplane. Kiran Rao, Airbus’ executive vice president of sales and marketing, and John Leahy, chief operating officer-customers, said on several occasions that there won’t be enough technological advances in engines and airframes to support a new, clean sheet airplane before a 2030 entry into service, or EIS. It’s possible that by 2025 an NSA could be designed and into service with 25%-30% lower operating costs than today’s A320s and 737s. But if the benchmark is changed to the new A320neo and 737 MAX, each predicted to be 14% better than today’s airplanes, there is a huge challenge to achieve 25% or better by 2030, let alone 2025. It can’t be done by the earlier date, Rao and Leahy say.

“We’re comfortable with the A320neo,” Rao says.

Boeing claims its 737-800 and successor the 737-8 are about 8% more economical per seat. Airbus makes counter-claims, but airlines that evaluated the planes and some that operate both the A320ceo and 737NG say Boeing has an operating cost advantage of only 2%. But customers, whose opinions count far more than the hype promulgated by Airbus and Boeing, say the A321neo is a superior airplane to the 737-9 and sales figures support this.

On Oct. 21, Airbus upped the ante. Airbus confirmed to the on-line newsletter Leeham News and Comment that it now is offering an A321neo high gross weight that will replace the Boeing 757-200 on 3,900nm routes that are too “thin” for long-range twin-aisle airplanes like the Airbus A330 or Boeing 787 that carry twice the passengers of the 757. Boeing’s 737-9, with a basic design dating to the 1960s, can’t be further developed to match the new A321neoLR (Long Range).

The A321neoLR will further marginalize the 737-9.

At the low end of the Airbus and Boeing offerings, the smallest A319ceo and 737-700 on their last legs. There have been few recent sales and the backlog for each is winding down as deliveries are made. Their replacements, the A319neo and the 737-7, are largely regarded in the industry as placeholders, rear guard action to serve as a road-block, if one is needed, against the new, clean-sheet 135-seat Bombardier CS300 and Embraer 122-seat E-195 E2. The strategy is more illusionary than real. There are more than 180 firm orders for the CS300 (EIS late 2015 or early 2016) and 50 for the slightly smaller E-195 E2; the latter is still in its infancy, with an EIS of 2019. There are just 49 orders for the A319neo (EIS 2017) and 55 for the 737-7 (EIS 2019). There are two identified customers for the A319neo, Frontier Airlines and Columbia’s Avianca, and 12 orders listed as Unidentified customer(s). Frontier is transitioning to an Ultra Low Cost Carrier and will likely opt for the larger A320neo or even the A321neo, the largest member of the family. Avianca needs the hot-rod performance of the high-powered, light-weight A319neo for its South American service and will probably take the order.

The 737-7, on the other hand, is problematic. Southwest Airlines in the USA has 30 on order and Canada’s Westjet the other 25. When the time comes to “cut metal” about 2018, it’s quite possible each will upgauge to the larger 737-8.

This leave Boeing in quite the quandary: a 737 MAX family with a good-selling -8, a non-existent -7 and a poor selling -9.

At the October European conference of the International Society of Transport Aircraft Traders, a poll was taken of the 1,200 delegates asking if Boeing or Airbus had the more competitive single-aisle airplane. Fifty percent of the audience voted for Airbus; just 23% for Boeing. It’s quite the comedown for the proud Boeing.

Airbus has neatly mouse-trapped Boeing.

Share this: Print

Email

Twitter

Pinterest

Facebook

WhatsApp

LinkedIn

Tumblr

Reddit

"
Germany unveils Ebola plane - DW (English),"Thu, 27 Nov 2014 08:00:00 GMT",https://news.google.com/rss/articles/CBMiUWh0dHBzOi8vd3d3LmR3LmNvbS9lbi9nZXJtYW55LXVudmVpbHMtZWJvbGEtZXZhY3VhdGlvbi1wbGFuZS1pbi1iZXJsaW4vYS0xODA5MjUzNdIBUWh0dHBzOi8vYW1wLmR3LmNvbS9lbi9nZXJtYW55LXVudmVpbHMtZWJvbGEtZXZhY3VhdGlvbi1wbGFuZS1pbi1iZXJsaW4vYS0xODA5MjUzNQ?oc=5&hl=en-US&gl=US&ceid=US:en,"The first Airbus refitted to serve as an Ebola evacuation plane has been unveiled in the German capital, Berlin. Foreign Minister Frank-Walter Steinmeier said he hopes to see it seldom used.

Germany's Health Minister Hermann Gröhe and Foreign Minister Frank-Walter Steinmeier officially presented the first specially-adapted Ebola evacuation Airbus at Berlin Tegel airport on Thursday.

The aircraft is ""an important contribution"" to the fight against Ebola, Gröhe said. Named after the celebrated German physician and pioneering microbiologist Robert Koch, the plane, according to Lufthansa, is a world first.

Intensive care

Aircrafts previously used to transport Ebola-infected patients were much smaller and unable to always provide the necessary care. Steinmeier stressed, however, that the specially-adapted Airbus A340-300 ""Robert Koch"" guaranteed medical care under ""optimal conditions.""

The machine is nearly 64 meters (210 feet) long, and its passenger seats and the rest of the cabin interior were removed and replaced by a ""patient transportation isolation unit.""

Inside the specially-built airtight tent, an Ebola patient can be cared for to the same extent as in intensive care at hospital, without pathogens escaping and endangering the rest of the crew. The aircraft can also accommodate up to 19 attendants, including technicians for special equipment, officials and doctors.

Lufthansa said that more than 700 pilots and flight attendants have volunteered to work as crew aboard the Ebola Airbus.

""It's probably the one Lufthansa aircraft that we hope to rarely see used,"" said Steinmeier.

'Ecouraging' clinical trials

Also on Thursday, Ebola vaccine researchers said that they were ""encouraged"" by the results of an initial clinical trial, in which volunteers developed antibodies needed to fight the virus. The end product, however, is still some time away.

In the worst-ever outbreak of Ebola, the virus has killed some 5,500 people this year, predominantly in West Africa.

ksb/nm (AFP, dpa)"
Airbus to expand oversize air transport capability - Skies Magazine,"Mon, 17 Nov 2014 08:00:00 GMT",https://news.google.com/rss/articles/CBMiUWh0dHBzOi8vc2tpZXNtYWcuY29tL3ByZXNzLXJlbGVhc2VzL2FpcmJ1c3RvZXhwYW5kb3ZlcnNpemVhaXJ0cmFuc3BvcnRjYXBhYmlsaXR5L9IBVWh0dHBzOi8vc2tpZXNtYWcuY29tL3ByZXNzLXJlbGVhc2VzL2FpcmJ1c3RvZXhwYW5kb3ZlcnNpemVhaXJ0cmFuc3BvcnRjYXBhYmlsaXR5Lz9hbXA?oc=5&hl=en-US&gl=US&ceid=US:en,"Airbus’ current Beluga fleet is based on the A300 and is responsible for the

transport of large aircraft components between production sites in Europe.

Airbus Photo

To industrially accompany the A350 XWB ramp-up and other aircraft production rate increases, Airbus took the decision to launch the development and production of five new Belugas.

The new Beluga will be based on the A330 with a large re-use of existing components and equipment. The distinctive looking lowered cockpit, the cargo bay structure and the rear-end and tail will be amongst the items which will be newly developed.

The first of the five new Belugas will enter in service in mid-2019. The existing Beluga fleet will operate in parallel, and will be progressively retired through to 2025.

The current Beluga fleet of five aircraft is based on the A300. The “Beluga”, is Airbus’ unique method for transporting large aircraft components– between company production sites in Europe.

Airbus had already l launched “the Fly 10000” project aiming at doubling the current Beluga capacity by 2017. However the current capacity is limited and the new Beluga fleet will close this capacity gap.

With its flexibility and short transport lead-times, oversize air transport is a cornerstone of Airbus’ industrial operations."
Bond Air Services receives first U.K. EC145 T2 - Vertical Magazine,"Tue, 18 Nov 2014 08:00:00 GMT",https://news.google.com/rss/articles/CBMiQ2h0dHBzOi8vdmVydGljYWxtYWcuY29tL25ld3MvYm9uZGFpcnNlcnZpY2VzcmVjZWl2ZXNmaXJzdHVrZWMxNDV0Mi_SAQA?oc=5&hl=en-US&gl=US&ceid=US:en,"Bond Air Services has received the first Airbus Helicopters EC145 T2 for the United Kingdom. Bond Photo

The first Airbus Helicopters EC145 T2 to be operated in the United Kingdom arrived at Bond Air Services in Staverton on Nov. 14. The helicopter will receive medical equipment to become a fully functioning air ambulance, according to Bond.

The EC145 T2, which arrived under German test registration D-HADM, has yet to receive specific operator livery. Given the yellow paint scheme and medical equipment, however, it is likely headed for East Anglian Air Ambulance, which ordered an EC145 T2 in 2011."
ANALYSIS: What do recent production rate changes mean? - Flightglobal,"Fri, 21 Nov 2014 08:00:00 GMT",https://news.google.com/rss/articles/CBMiYGh0dHBzOi8vd3d3LmZsaWdodGdsb2JhbC5jb20vYW5hbHlzaXMtd2hhdC1kby1yZWNlbnQtcHJvZHVjdGlvbi1yYXRlLWNoYW5nZXMtbWVhbi8xMTUyMDEuYXJ0aWNsZdIBAA?oc=5&hl=en-US&gl=US&ceid=US:en,"Richard Evans, senior consultant, who recently joined Ascend from Rolls-Royce, examines recent announcements about production rate changes at Airbus and Boeing

We have seen two production rate changes announced recently, so it seems a good time to summarise the current production outlook from Airbus and Boeing. Individual programmes will have specific drivers of change, but it is also worth reviewing how the airframers’ plans stack up against overall market numbers.

Production rates are often described as Rate 5 or Rate 10, for example, which simply refers to the number of aircraft manufactured per month. For Boeing products, the annual production is 12 times this figure. At Airbus, because of the summer holiday period, the quoted rates are maintained for 11 or 11.5 months a year. For example, Rate 10 on the A330 programme equates to an annual production of 110 aircraft.

The first announcement was made by Boeing on 2 October, when it said that it “will increase production on the 737 programme to 52 airplanes per month in 2018 in response to strong market demand from customers worldwide”. Once this increase is implemented, more than 620 airplanes per year are expected to be built under the 737 programme, “the highest rate ever”.

Boeing is currently building 42 737NGs per month, and had already said this would be increased to 47/month in 2017. The primary reason behind the latest announcement appears to be the need to create additional slots for the 737 Max. The slots are valuable because the 737 Max is running about two years behind the competing A320neo, making availability an issue in key strategic campaigns.

This means that based on production rates, Boeing will maintain a delivery advantage over Airbus in the single-aisle sector for the rest of the decade. In 2018, the implication is that Boeing will have a delivery market share of about 54%, building 620 737s versus 500 A320s. This is despite the fact that Airbus has a firm backlog of 4,721 A320s to Boeing’s backlog of 4,011 737s, giving Airbus a 54% share. Taking only firm orders, Airbus has a 59% share of the re-engined variants.

IMPLICATIONS FOR SINGLE-AISLE DELIVERIES

The increased delivery slot availability from Boeing gives it more flexibility to go out and win new customers for the 737 Max, but slots alone will not determine the eventual market share. It remains to be seen if Airbus will respond with an increased rate on the A320neo. Ascend assumes that Boeing would have switched over production entirely to 737 Max by early 2019, so the new rate is also a challenge for CFM, which will have to ramp up Leap-1B production from zero in 2016 to about 1,400 engines three years later.

A320 and 737 production rates, when combined, will mean about 1,200 deliveries in 2018/19, up from 933 last year. The chart below shows how this compares to the Flightglobal Fleet Forecas for single-aisle aircraft.

It can be seen that the combined Airbus and Boeing production closely matched the overall single-aisle forecast before the latest Boeing announcement, but it now exceeds our forecast by 5-10% – or more should Airbus also raise rates. Airbus’s own forecast for single-aisle deliveries is 22,000 over the next 20 years, which averages at 1,100 per annum. Boeing has a slightly higher forecast of about 1,250 a year.

This is arguably within the margin of error of any top-down forecast, but the implication is that there is no room for the delivery plans of the new entrants, the Bombardier CSeries, Comac C919 and Irkut MC-21. Programme delays may give greater opportunity to Airbus and Boeing here. However, it is entirely possible that aircraft retirements could be the balancing figure to enable these deliveries to happen. With a current fleet of 13,000 aircraft, growing to around 18,000 by the end of the decade, it is not difficult to imagine that a few hundred extra retirements will occur, balancing supply and demand in the process. This would have a limited impact on average retirement age and, hence, residual values.

The Flightglobal Fleet Forecast also takes the view that Airbus will win a market share of >50% against the 737, based on the current firm backlog, and we will only change this if customer orders move in favour of Boeing in the next few years.

A330 AND 777 CHALLENGE

The increased delivery slot availability from Boeing gives it more flexibility to go out and win new customers for the 737 Max, but slots alone will not determine the eventual market share. It remains to be seen if Airbus will respond with an increased rate on the A320neo. Ascend assumes that Boeing would have switched over production entirely to 737 Max by early 2019, so the new rate is also a challenge for CFM, which will have to ramp up Leap-1B production from zero in 2016 to about 1,400 engines three years later.

A320 and 737 production rates, when combined, will mean about 1,200 deliveries in 2018/19, up from 933 last year. The chart below shows how this compares to Ascend’s Flightglobal Fleet Forecast for single-aisle aircraft.

The second announcement was of Airbus reducing A330 manufacturing from Rate 10 to Rate 9 from Q4 2015. This should not have come as a major surprise given the decline in book-to-bill ratios in the last few years. Indeed, the backlog for the A330 has been declining ever since 2008, and now stands at 230, compared with 425 at the beginning of 2009.

The launch of the A330neo has been a huge positive for the overall A330 programme, and we expect the letters of intent (LoIs) signed to be converted to firm orders shortly. However, the new variant, with first delivery in December 2017, has created quite a production gap to fill.

In addition to successfully converting LoIs, Airbus would need to secure up to 150 further orders for the A330ceo in order to fill the gap before entry of the A330neo, assuming Rate 9 is continued. Our fleet forecast implies that further production rate cuts are likely, down to an eventual production of about six per month from 2019 onwards. Any delay to entry into service (EIS) or ramp-up of the A330neo will increase the challenge.

The 777 has arguably an even greater challenge to “bridge the gap” to the 777-X. EIS is not until 2020, over two years later than the A330. The current GE90-powered versions still have an impressive backlog of 275 aircraft, but that has declined from 356 at the end of 2012.

In order to maintain the current level of production, Boeing would need to win around 330 new orders (including 90 option/LoI conversions). There is no plan as yet for a 777-X freighter version (although a version of the -8 is expected in the 2020s), so the 777-200 Freighter is part of the solution to bridging that gap, but the cargo market remains in the doldrums. Hence the vast majority of additional orders must come from 777-300ERs. The Ascend forecast indicates that a production rate cut is highly likely, perhaps down to Rate 6 between 2017 and the EIS of the 777-X.

Interested in finding out more about production developments at Airbus and Boeing? View our Commercial Aircraft Values and Market Outlook webinar here.

Source: Cirium Dashboard"
