Titre,Date de publication,URL,Contenu
The A330's continued commercial success leads to a new production rate increase - Airbus,"Wed, 24 Feb 2016 08:00:00 GMT",https://news.google.com/rss/articles/CBMidWh0dHBzOi8vd3d3LmFpcmJ1cy5jb20vZW4vbmV3c3Jvb20vbmV3cy8yMDE2LTAyLXRoZS1hMzMwcy1jb250aW51ZWQtY29tbWVyY2lhbC1zdWNjZXNzLWxlYWRzLXRvLWEtbmV3LXByb2R1Y3Rpb24tcmF0ZdIBAA?oc=5&hl=en-US&gl=US&ceid=US:en,"Airbus has announced a production rate increase for its A330 Family, responding to new commercial successes that underscore this versatile widebody product line’s popularity with customers around the globe.

Taking effect in January 2017, the change will raise production from its current level – six aircraft per month – to a monthly rate of seven. As of 31 January, Airbus had booked orders for 1,610 A330s, of which 1,261 had been delivered.

“The A330 has enjoyed additional commercial success in China, Saudi Arabia and South Africa among other countries. Add to that healthy demand for the MRTT military derivative and you have an order book that can easily absorb an increase of one aircraft per month,” said Eric Zanin, Head of the A330 Family Programme.

Airbus’ A330 Family has five in-service members: the A330-200 and longer-fuselage A330-300 commercial jetliner versions, A330-200F freighter, ACJ330 corporate jet and A330 multi-role tanker transport (MRTT) aircraft; along with two highly-efficient A330neo (New Engine Option) versions in development: the A330-800neo and A330-900neo.

Planned for first deliveries in the fourth quarter of 2017, the A330neo aircraft will expand operators’ market opportunities with a range capability increase of up to 400 nautical miles, and offer better economics than its competitors while also providing an inch greater seat-width in economy class for improved passenger comfort.

Zanin said the increase will become “real” mid-way through 2016 when component production reaches the new level."
Airbus starts A350-1000 final assembly - Airbus,"Wed, 10 Feb 2016 08:00:00 GMT",https://news.google.com/rss/articles/CBMiYGh0dHBzOi8vd3d3LmFpcmJ1cy5jb20vZW4vbmV3c3Jvb20vcHJlc3MtcmVsZWFzZXMvMjAxNi0wMi1haXJidXMtc3RhcnRzLWEzNTAtMTAwMC1maW5hbC1hc3NlbWJsedIBAA?oc=5&hl=en-US&gl=US&ceid=US:en,"Summary

Largest member of A350 XWB Family becomes reality

Airbus started final assembly of the first A350-1000 on schedule at the A350 XWB final assembly line in Toulouse, France, beginning in February 2016

Airbus has started final assembly of the first A350-1000 on schedule at the A350 XWB Final Assembly Line (FAL) in Toulouse, France. This A350-1000, one of three flight test aircraft to be built, will take to the skies for its maiden flight before the end of 2016. A350-1000 deliveries will start in mid-2017.To ensure the smooth integration of the A350-1000 into the FAL while A350-900 production is ramping-up, Airbus has added three additional final assembly stations. For maximum flexibility, all stations in the A350 XWB FAL can be used for both models.Currently in “Station 50” for fuselage join-up and nose landing gear installation, the first A350-1000 will next move to “Station 40” where the wings, main landing gear, pylons and tail planes will be installed. To save time and optimise the A350 assembly process, Airbus starts the cabin furnishing and first electrical power-on in parallel to the structural assembly work. After this stage is completed, the aircraft continues through the FAL process, with final structural activities, ground tests, painting, cabin & cockpit completion and engines installation before being transferred to the flight test centre.While having a very high degree of commonality with the A350-900, the A350-1000, measuring nearly 74 meters from nose to tail, is the longest fuselage version of Airbus’ all-new family of wide body jetliners. The A350-1000 will be powered by Rolls Royce Trent XWB-97 engines, the most powerful engine developed for an Airbus aircraft. The A350-1000 comfortably seats 366 passengers in a typical 3-class configuration and flies on routes of up to almost 8,000 nautical miles which represents a significant revenue-generating advantage for operators. So far, Airbus has won 181 A350-1000 orders from 10 customers."
"Civil helicopter sales in SE Asia are declining, Airbus says | AIN - Aviation International News","Mon, 15 Feb 2016 08:00:00 GMT",https://news.google.com/rss/articles/CBMic2h0dHBzOi8vd3d3LmFpbm9ubGluZS5jb20vYXZpYXRpb24tbmV3cy9kZWZlbnNlLzIwMTYtMDItMTUvY2l2aWwtaGVsaWNvcHRlci1zYWxlcy1zZS1hc2lhLWFyZS1kZWNsaW5pbmctYWlyYnVzLXNheXPSAQA?oc=5&hl=en-US&gl=US&ceid=US:en,"Civil helicopter sales in SE Asia are declining, Airbus says

Factors include the impact of the Chinese economy, airspace regulation and oil price"
"Airbus Helicopters updates Executive Committee, puts stronger focus on Customer Support & Services - Airbus","Sun, 28 Feb 2016 08:00:00 GMT",https://news.google.com/rss/articles/CBMifGh0dHBzOi8vd3d3LmFpcmJ1cy5jb20vZW4vbmV3c3Jvb20vcHJlc3MtcmVsZWFzZXMvMjAxNi0wMi1haXJidXMtaGVsaWNvcHRlcnMtdXBkYXRlcy1leGVjdXRpdmUtY29tbWl0dGVlLXB1dHMtc3Ryb25nZXItZm9jdXPSAQA?oc=5&hl=en-US&gl=US&ceid=US:en,"Summary

Ben Bridge appointed new Executive Vice President Global Business

Marignane - Ben Bridge (44) has been appointed Executive Vice President Global Business while Matthieu Louvot (41) becomes Executive Vice President Customer Support & Services, in a move aimed at consolidating Airbus Helicopters’ leading position while remaining as close as possible to its customers. Both Global Business and Support & Services functions are now sitting at the company’s Executive Committee. These appointments are effective 1 April 2016.Ben Bridge, who will report to Airbus Helicopters President and CEO Guillaume Faury, joins from BAE Systems where he acted as Regional Managing Director Europe & Americas, and previously as Managing Director Middle East & Africa. He brings a 17-year experience with BAE Systems in international sales & marketing and will drive business growth for Airbus Helicopters.Matthieu Louvot currently serves as Head of Customer Support & Services. He will now join the Executive Committee and report to Guillaume Faury.“This updated approach will allow us to put an even stronger emphasis on Support & Services, a key element of our strategy to go from the biggest to the best in the rotorcraft industry”, said Guillaume Faury. ""I want to thank Dominique Maudet for the great work he achieved by ensuring the commercial success of Airbus Helicopters and supporting our customers in a challenging market environment"".Dominique Maudet (59), who had held the position Executive Vice-President Global Business & Services since May 2011, is appointed as Head of Airbus Group Strategic Defence Relations, also effective 1 April 2016. In this position he will report to Marwan Lahoud, Executive Vice-President International, Strategy & Public Affairs and Member of the Group Executive Committee.Airbus Helicopters is a division of Airbus Group. The company provides the most efficient civil and military helicopter solutions to its customers who serve, protect, save lives and safely carry passengers in highly demanding environments. Flying more than 3 million flight hours per year, the company’s in-service fleet includes nearly 12,000 helicopters operated by more than 3,000 customers in 154 countries. Airbus Helicopters employs more than 22,000 people worldwide and in 2015 generated revenues of 6.8 billion Euros. Airbus Helicopters’ ambition is to go from the biggest to the best, becoming the benchmark in the industry for helicopter manufacturing."
First Alabama-made Airbus moves from production to paint | Made in Alabama - Made In Alabama,"Thu, 25 Feb 2016 08:00:00 GMT",https://news.google.com/rss/articles/CBMiQGh0dHBzOi8vd3d3Lm1hZGVpbmFsYWJhbWEuY29tLzIwMTYvMDIvZmlyc3QtYWxhYmFtYS1tYWRlLWFpcmJ1cy_SAQA?oc=5&hl=en-US&gl=US&ceid=US:en,"The first Alabama-made Airbus aircraft should make a maiden flight in Mobile this spring, followed by delivery to its owner, JetBlue Airways. That delivery will be followed by six other Alabama-made A321 aircraft, all with the conventional engine option (ceo), to be delivered to American Airlines, according to Airways News.

Airbus’ Alabama workforce started assembling the first aircraft shortly after the plane’s major components arrived at the Port of Mobile last June via cargo ship from Europe. Assembly was already well under way in September, when France-based Airbus held a grand-opening ceremony for its only U.S. manufacturing facility.

“Mobile is our industrial home,” Airbus Group Chairman and CEO Allan McArtor said at the time.

Airbus has said the Alabama manufacturing facility will be initially dedicated to producing the A321, the largest variant of its twin-engine, narrow-body A320 family. By the end of 2017, Airbus plans to reach a production rate of four aircraft per month in Mobile.

Airbus U.S. Manufacturing Facility Mobile: 1st aircraft now out of production and in paint. Congrats to the team! pic.twitter.com/Az0YtE8hzD — Airbus In the U.S. (@AirbusInTheUS) February 23, 2016

MAAS PAINT FACILITY

This week, MAAS broke ground on a project to build a separate twin-bay paint facility at the Aeroplex to serve the maintenance, repair and overhaul, or MRO, market. The project at the Mobile industrial complex – sometimes called Brookley, after the U.S. Air Force Base that once operated there — was announced during the 2015 Paris Air Show.

“These are momentous times for MAAS Aviation and the construction of this painting facility here at Brookley represents the largest single investment undertaken in the history of our company,” Tim Macdougald, vice president of MAAS Aviation USA, said this week.

“Brookley will be our U.S. headquarters, and we look forward to providing world-class levels of service to aircraft operators and owners located throughout the Americas right here in Mobile from the end of 2016.”"
Airbus Delivers Final C-295 to Philippines - Defense News,"Tue, 16 Feb 2016 08:00:00 GMT",https://news.google.com/rss/articles/CBMieWh0dHBzOi8vd3d3LmRlZmVuc2VuZXdzLmNvbS9kaWdpdGFsLXNob3ctZGFpbGllcy9zaW5nYXBvcmUtYWlyc2hvdy8yMDE2LzAyLzE2L2FpcmJ1cy1kZWxpdmVycy1maW5hbC1jLTI5NS10by1waGlsaXBwaW5lcy_SAQA?oc=5&hl=en-US&gl=US&ceid=US:en,"SINGAPORE — Airbus Defence and Space has delivered the third and final C-295 medium transport destined for the Philippines Air Force, the company announced at the Singapore Airshow Tuesday.

The aircraft was ferried recently from the Airbus Seville, Spain, assembly line to Clark Air Base to take up airlift duties.

The Philippines joins Vietnam and Indonesia as a C-295 customer in the region.

See full coverage of the Singapore Airshow

Further orders for the aircraft from the Philippines are possible. Market analysts Forecast International say the C-295 is a leading contender alongside its Airbus stablemate, the smaller CN-235, to be acquired for maritime patrol duties monitoring Chinese activity around disputed islands in the South China Sea. Forecast International said six maritime patrol aircraft (MPA) aircraft are required with funding for the first two units already approved.

The C-295 is a multirole platform that has already secured MPA orders from Chile, Portugal and Oman. The analysts said that last year, the Philippines was also reported to be in talks with Japan over buying second-hand Lockheed Martin P-3Cs.

In another development, Airbus announced it had made its first C-295 sale of the year with a deal for one winglet-equipped transport aircraft to the Mali Air Force. The performance-improving winglets are now standard on the C-295.

Delivery to the African country is scheduled for the second half of this year, said Airbus.

Email: achuter@defensenews.com

Andrew Chuter is the United Kingdom correspondent for Defense News."
Airbus strengthens leadership position in Asia-Pacific region - Airbus,"Tue, 16 Feb 2016 08:00:00 GMT",https://news.google.com/rss/articles/CBMid2h0dHBzOi8vd3d3LmFpcmJ1cy5jb20vZW4vbmV3c3Jvb20vcHJlc3MtcmVsZWFzZXMvMjAxNi0wMi1haXJidXMtc3RyZW5ndGhlbnMtbGVhZGVyc2hpcC1wb3NpdGlvbi1pbi1hc2lhLXBhY2lmaWMtcmVnaW9u0gEA?oc=5&hl=en-US&gl=US&ceid=US:en,"Airbus strengthened further its market leading position in Asia-Pacific in 2015, winning 421 net orders from 17 airlines and lessors in the region during the year. This represented 39 per cent of the company’s net order intake in 2015 for 1,080 aircraft.



In addition, the manufacturer delivered 282 new aircraft to 40 operators across the region over the twelve month period, either directly or via leasing companies. This was 44 per cent of the company’s total output of 635 aircraft during the year, reflecting the importance of the region to the manufacturer.



The regional results were announced today by Fabrice Brégier, Airbus President and CEO and John Leahy, Chief Operating Officer, Customers on the opening of the Singapore Air Show.



“The Asia-Pacific region has traditionally been one of our strongest markets,” said Fabrice Brégier. “In recent years we have consolidated our position with our complete range of modern and efficient products. We expect this trend to continue in the coming years, especially in the widebody market where the A350 XWB is setting new standards in the 300 - 400 seat category.”



Looking to the future, Airbus expects the Asia-Pacific region to continue to lead demand for new aircraft over the next 20 year period.



Presenting the company’s latest forecast for the region, John Leahy said that an annual increase in passenger traffic of 5.6% would contribute to a requirement for some 12,800 new aircraft valued at USD 2 trillion. This represents 40% of global demand for 32,600 aircraft over the next 20 years, and includes almost half of all widebody deliveries worldwide and over a third of all single aisle aircraft.



“Asia-Pacific will continue to experience stronger growth than any other world region as more people fly more often,” said John Leahy. “Airbus will be especially well placed to respond to this demand in every size category. From 100 to over 500 seats, and for everything from short regional flights to the world’s longest commercial services, we have the right products to meet the needs of airlines in this fast-growing market.”



Over the past 10 years Airbus has recorded the leading share of sales in the Asia-Pacific region in both the single aisle and widebody markets. This has seen the A320 Family account for 64 per cent of net orders in the single aisle category, while the Airbus widebody aircraft, the A330, A350 XWB and A380 have together won 56 per cent of orders during this timeframe.



The complete Airbus product line comprises the best-selling A320 Family in the single aisle market, the popular A330 and all-new A350 XWB in the mid-size widebody category and the flagship A380 in the very large aircraft segment. In the freight market Airbus currently offers the new-build A330-200F and the A330 Passenger-to-Freighter (A330P2F) programme.

Asia-Pacific 20 Year Market Forecast - Headline Figures• 5.6% annual growth in passenger traffic (global average 4.6%)• Asia-Pacific fleet will grow from 5,600 today to 14,000• Demand for 12,810 new aircraft valued at USD 2 trillion• 40% of total world demand for 32,600 aircraft over next 20 years• 3,760 twin aisle and 720 very large aircraft = 46% of global widebody demand (9,600)• 8,330 single aisle aircraft = 36% of global single-aisle demand (23,000)



Net orders 2006 - 2015 in Asia-Pacific region• Single aisle - Airbus: 2,924 out of a total of 4,589 = 64%• Widebody - Airbus: 666 out of a total of 1,187 = 56%"
Airbus CEO sees nonstop demand in Asia - CBS News,"Tue, 16 Feb 2016 08:00:00 GMT",https://news.google.com/rss/articles/CBMiRGh0dHBzOi8vd3d3LmNic25ld3MuY29tL25ld3MvYWlyYnVzLWNlby1zZWVzLW5vbnN0b3AtZGVtYW5kLWluLWFzaWEv0gFIaHR0cHM6Ly93d3cuY2JzbmV3cy5jb20vYW1wL25ld3MvYWlyYnVzLWNlby1zZWVzLW5vbnN0b3AtZGVtYW5kLWluLWFzaWEv?oc=5&hl=en-US&gl=US&ceid=US:en,"SINGAPORE - The chief executive of Airbus said Tuesday growth in airline passengers in Asia is likely to remain strong despite the current uncertainty about global economic growth prospects.

Speaking at the Singapore Airshow, Fabrice Bregier said Airbus and its competitors are not facing a downturn in orders from airlines. Stock markets and oil have slumped since the beginning of the year, in a sign of investor anxiety about the health of the world economy.

""I think it is simple and it is clear that there are tensions around the world. And so people try to project themselves into the future and impact on air traffic,"" he said. ""As a matter of fact, we don't see it, our competitors don't see it, our customers don't see it. We've never been so healthy.""

The company forecasts demand for 12,810 new airplanes in the Asia-Pacific area, valued at $2 trillion over the next 20 years. That represents 40 percent of forecast global demand for about 32,600 airplanes over the same period.

Airbus expects passenger numbers in Asia to grow by 5.6 percent annually, with China forecast to post double-digit growth.

Bregier was presenting the manufacturer's latest outlook on the first day of the Singapore Airshow, which ends Feb. 21. More than 1,000 companies, including Airbus and Boeing (BA) are participants. The previous show in 2014 generated deals worth $32 billion.

John Leahy, an Airbus chief operating officer, said the manufacturer was not seeing any deferrals of jet orders in the region, whose middle class is driving growth in the airline industry.

""They fly for business, they have disposable income, they fly for pleasure, and they are the ones who are sitting in the seats of airliners around the world,"" he said. ""There's a growing middle class in China. The middle class in Asia Pacific will be driving the world going forward.""

Airbus adjusted its 2015 numbers, saying it had 1,080 net orders compared with the previously announced 1,036. It has a backlog of 6,831 orders worth $1 trillion at list prices, though customers usually negotiate discounts.

Boeing said Monday that it had no deferrals in Asia and forecasts demand for 3,750 new airplanes in Southeast Asia alone, valued at $550 billion over the next 20 years. Of the forecast demand, 76 percent will be for single-aisle aircraft such as the Boeing 737 and Airbus A320."
Airbus Helicopters selects Thales and Helisim for its H160 full flight simulator deployment - Thales,"Wed, 10 Feb 2016 08:00:00 GMT",https://news.google.com/rss/articles/CBMigwFodHRwczovL3d3dy50aGFsZXNncm91cC5jb20vZW4vd29ybGR3aWRlL2Flcm9zcGFjZS9wcmVzcy1yZWxlYXNlL2FpcmJ1cy1oZWxpY29wdGVycy1zZWxlY3RzLXRoYWxlcy1hbmQtaGVsaXNpbS1pdHMtaDE2MC1mdWxsLWZsaWdodNIBAA?oc=5&hl=en-US&gl=US&ceid=US:en,"- Airbus Helicopters has partnered with Thales and Helisim to develop and deploy the full flight simulator (FFS) for the H160. In line with the “born ready” strategy implemented by the H160 since the beginning of its development, the FFS will be available to support the H160’s entry into service.This partnership between experienced and recognized companies will offer to future H160 operators a complete range of training services based on a level D FFS using Airbus Helicopters’ Simulation Package “Expertise”.“This partnership is an essential milestone in the H160 program and key to meeting the needs of our customers in order to prepare the smooth introduction of H160 into their operations” explained Bernard Fujarski, head of the H160 Program at Airbus Helicopters, “The first FFS will be installed at the Helisim simulation centre in Marignane, France and additional simulators will be deployed worldwide in line with market needs” he added.Helisim has been the world’s foremost simulation centre for Airbus Helicopters platforms for more than 15 years.The new generation 5.5 to 6-tonne twin-engine H160 helicopter will be tailored for a wide range of applications, including oil & gas operations, emergency medical services, public service, and private and business aviation.To accompany the innovative H160 design, the FFS will be based on the Thales Reality H series, the most advanced helicopter training simulator on the market. Reality H is perfectly suited to respond to the training needs of the H160, as it produces the most vivid synthetic environments of any civilian based training scenarios and is fast becoming a mainstay for all type of mission-readiness within training centres around the world.



"
Commercial Airbus Lands Safely After In-Flight Explosion - FLYING,"Thu, 04 Feb 2016 08:00:00 GMT",https://news.google.com/rss/articles/CBMiU2h0dHBzOi8vd3d3LmZseWluZ21hZy5jb20vY29tbWVyY2lhbC1haXJidXMtbGFuZHMtc2FmZWx5LWFmdGVyLWluLWZsaWdodC1leHBsb3Npb24v0gEA?oc=5&hl=en-US&gl=US&ceid=US:en,"The passengers of a commercial Airbus A321 operated by Daallo Airlines experienced a frightening flight on Tuesday when what appears to have been an explosion ruptured a large hole in the side of the fuselage. According to a statement from Daallo Airlines, the incident occurred about 15 minutes after the A321 departed the Aden Adde International Airport in Mogadishu, Somalia, on its way to Djibouti.

Despite the ruptured fuselage, the pilots were able to safely land the airplane back in Mogadishu, where all passengers except one disembarked safely, the airline said. Two passengers suffered minor injuries and one passenger appears to have been ejected from the airplane. According to the statement, this is the first fatality in the airline’s 25-plus-year history.

News outlets have speculated that a bomb caused the rupture. Local authorities are investigating the incident.

Several passengers aboard the flight shot videos from inside the airplane. Here is what they saw."
