Titre,Date de publication,URL,Contenu
Airbus and Dassault Systèmes embark on strategic partnership to create the European aerospace industry of tomorrow - Dassault Systèmes,"Wed, 06 Feb 2019 08:00:00 GMT",https://news.google.com/rss/articles/CBMikQFodHRwczovL3d3dy4zZHMuY29tL25ld3Nyb29tL3ByZXNzLXJlbGVhc2VzL2FpcmJ1cy1hbmQtZGFzc2F1bHQtc3lzdGVtZXMtZW1iYXJrLXN0cmF0ZWdpYy1wYXJ0bmVyc2hpcC1jcmVhdGUtZXVyb3BlYW4tYWVyb3NwYWNlLWluZHVzdHJ5LXRvbW9ycm930gEA?oc=5&hl=en-US&gl=US&ceid=US:en,"Toulouse, 6 February 2019 – Airbus and Dassault Systèmes have signed a five-year Memorandum of Agreement (MOA) to cooperate on the implementation of collaborative 3D design, engineering, manufacturing, simulation and intelligence applications. This will enable Airbus to take a major step forward in its digital transformation and lay the foundation for a new European industrial ecosystem in aviation.

Under the MOA, Airbus will deploy Dassault Systèmes’ 3DEXPERIENCE platform, which delivers digital continuity, from design to operations, in a single data model for a unified user experience, making digital design, manufacturing and services (DDMS) a company-wide reality for all Airbus divisions and product lines.

DDMS paves the way for breakthroughs in new product design, operational performance, support and maintenance, customer satisfaction and new business models, as it represents a move from sequential to parallel development processes. Instead of first focusing on product performance, Airbus will be able to co-design and develop the next generation of aircraft with the manufacturing facilities that will produce them, reducing costs and time to market.

“We are not just talking about digitalisation or a 3D experience, we are rethinking the way aircraft are designed and operated, streamlining and speeding up our processes with customer satisfaction in mind,” said Guillaume Faury, President Airbus Commercial Aircraft. “DDMS is a catalyst for change and with it we are building a new model for the European aerospace industry with state of the art technology. Our target is a robust production setup that offers a reduction in product development lead time.”

“Nothing exemplifies the intersection of technology, science and art more than aviation. When we reflect on how the industry has evolved to where it is today, it’s a blend of technical prowess, digital precision and inspiration,” said Bernard Charlès, Vice Chairman and CEO, Dassault Systèmes. “The Aerospace industry has a proven track record of fast transformation, faster than in most industries. It delivers high quality innovation and new services for operations in highly complex and regulated environments. The 3DEXPERIENCE platform will accelerate the digital transformation of Airbus. Airbus can capture insights and expertise from across its ecosystem to deliver new experiences that only the digital world makes possible.”"
Too big to sell: Airbus bids pained adieu to superjumbo A380 - The Associated Press,"Thu, 14 Feb 2019 08:00:00 GMT",https://news.google.com/rss/articles/CBMiO2h0dHBzOi8vYXBuZXdzLmNvbS9hcnRpY2xlLzAzNTI4MzE2NjU3MjQ3Zjc4ZThkZDlhMzdhOTI5Nzc50gEA?oc=5&hl=en-US&gl=US&ceid=US:en,"TOULOUSE, France (AP) — To passengers, the A380 feels immediately different — spacious, smooth and oddly elegant for a jet so gargantuan. Yet to Airbus, it’s become a burden so super-sized that the European manufacturer is ending its production for good.

The A380 is simply too big to sell. With funereal faces, Airbus CEO Tom Enders and other executives made a stunning yet long-anticipated admission Thursday that it was the wrong product at the wrong time, created to feed a demand for 800-seat jets that never materialized.

Less than 14 years after its maiden flight, barely a decade after it started carrying passengers, the A380 is being mothballed.

Just 17 more of the planes will be completed, wrapping up in 2021. Emirates, its last and most loyal customer, said Thursday it’s switching to smaller planes instead.

Distraught fans — even within Airbus’ own ranks — decried the decision. Unions in Britain, Spain and France fear for the 3,500 jobs Airbus says it might threaten.

One of the jetliner’s first test pilots took a more philosophical view. While he’s “feeling a bit sad” about the news, Claude Lelaie says the giant plane will be remembered for pushing the barriers of aviation, like the supersonic Concorde.

“Both made history and allowed progress, technological progress,” he told The Associated Press from the southern French city of Toulouse, the cradle of Airbus’ worldwide operations. “That’s business — you have to ensure the success of the company.”

This isn’t how things were supposed to pan out for the world’s biggest passenger jet.

Development talks for the plane began in 2000, meant to be Airbus’ 21st-century answer to rival Boeing’s 1960s-era 747, and one of the most ambitious endeavors in aviation. Its Rolls Royce engines were quieter than ever, far out on the extra-long wings. Carbon-fiber technology was used for the body to make it lighter and easier to maneuver. Its double-decker construction allowed room for bars, duty-free shops and even showers.

Lelaie was a co-pilot aboard the maiden flight of the superjumbo in 2005, 101 years after the Wright brothers’ first flight.

Despite its huge size and weight, he called the A380 a “very nice aircraft to fly” — even on special low-speed flights when they deliberately stalled the plane to test its reactions.

Then French President Jacques Chirac hailed the plane as “a symbol of what Europeans can do together.” Airbus’ then chief salesman, John Leahy, called it “game-changing” for the industry.

Yet to detractors, the A380 smacked of hubris, a vanity project by managers who saw bigger as better despite an uncertain market for a plane so huge that airports had to modify their runways and gates.

It faced repeated production setbacks and cost overruns. Order cancellations led to a restructuring at Airbus that saw thousands of job cuts.

One emblematic problem: a standoff between German and French engineers over which software to use to design the cockpit. The company lost a quarter of its market value in a single day in 2006 when the resulting delays became public.

Enders says the A380 wasn’t a flight of folly but a carefully studied gamble.

“We didn’t stumble into it,” he said. “Little did we know how the world would look in 2010, in 2019.”

Airlines in fact seemed more interested in mid-size planes for regional routes, notably in Asia, where travel within the region has boomed in recent years. Even on longer routes, airlines seemed to prefer smaller planes that were easier to fill.

Salesman Leahy spent much of the 2000s trying to persuade customers not to cancel orders. The last major order was in 2013, from trusted Emirates.

Enders said he was “knee-deep” in the A380, and personally suffered from its failures, but the only way to get out of this “trap” was to say good-bye.

“The 380 may have just been too large of a step for the market to handle,” said Rob Watts, CEO of aviation consulting company Aerotask.

The end came Thursday, as Airbus and Emirates announced that the airline had decided to transfer existing orders for A380s to smaller A350s and A320s.

The chairman and CEO of Emirates, Sheikh Ahmed bin Saeed al Maktoum, said: “While we are disappointed to have to give up our order, and sad that the program could not be sustained, we accept that this is the reality of the situation.”

The A380 has been the backbone of the Emirates fleet, based out of Dubai, the world’s busiest airport for international travel.

The pall of grief at Airbus headquarters was tinged with a hint of relief, after years of straining to keep the A380 alive.

Airbus quietly prepared for the decision a year ago, building in the 463 million euros ($522 million) in losses the A380 cost the company last year into its 2018 financial results, announced Thursday. The company posted a jump in profit and upbeat forecast for the coming year despite a slew of challenges, including Britain’s pending exit from the European Union without a new trade deal.

Even though the A380 wiped billions off Airbus profits in its development phase, Chief Financial Officer Harald Wilhelm says the company is expecting to break even on the overall program before it’s scrapped.

Airbus, which has some 130,000 employees worldwide, is focusing on its many other planes, made in facilities from Mobile, Alabama, to Tianjin, China.

Among those who foresaw the A380’s demise was analyst Richard Aboulafia of Washington-based Teal Group.

“But thanks to the strength of the market right now, and the strength of Airbus’s other products, the damage will not have a huge impact on the industry,” he told the AP. “For Boeing, it has been a very long time since they needed to worry about the A380 as a competitive factor.”

The A380 is still among the youngest aircraft in the skies, and Airbus will maintain the more than 230 planes currently in service for years to come. Guillaume Faury, who takes over from Enders as CEO in April, promised: “It will continue to fly.”

___

Associated Press writers John Leicester in Paris and Jon Gambrell in Dubai, United Arab Emirates, contributed to this report."
Why did the Airbus A380 fail? - WIRED,"Sat, 16 Feb 2019 08:00:00 GMT",https://news.google.com/rss/articles/CBMiMGh0dHBzOi8vd3d3LndpcmVkLmNvbS9zdG9yeS9haXJidXMtYTM4MC1mYWlsdXJlL9IBAA?oc=5&hl=en-US&gl=US&ceid=US:en,"Getty Images

The rapid demise of the Airbus A380 is a complex tale of missed connections, a changing market and, ultimately, a staggering lack of demand for the largest commercial airplane ever built. And, as a result, this giant of the skies could well be the last of its kind.

The decision to stop production on the A380 came after Emirates, which operates more than half of all flights using the plane, halved its latest order. After being in production for a little over 12 years, the A380 will go down as one of the shortest-lived models in aviation history. But why did it fail?

To understand that, you first need to understand how Airbus hoped it would succeed. The thought process behind the aircraft’s design – specifically, its size – had two major threads. The first, argues John Grant, director of JG Aviation Consultants, was “a strategic desire to distance themselves from being just another Boeing.” (Boeing had released a smaller aircraft, the 787 Dreamliner, at the same time back in 2007). To an extent, that worked. So far so good.

The second problem was a gamble on the future of the market. “It was designed to solve an expected problem”, says Keith Mason, Professor of Air Transport Management at Cranfield University, who assessed Boeing and Airbus’s differences in philosophy back in 2007. Airbus’s logic here was simple: if the industry continued to grow at the expected rate – Mason says passenger numbers typically double every 15 years – then airports would be overwhelmed by the sheer number of people. A large plane, so the argument went, would help ease this bottleneck by picking up more people per flight while also maximising value for pricey landing slots. This prediction proved to be wrong. “Airport congestion hasn’t happened,” says Mason. In fact, airport capacity in many markets, especially Asia, has grown.

The A380’s failure is also a result of a switch in the aviation world towards smaller, more efficient aircraft. Boeing’s B787, for example, seats around half as many passengers as the A380. In fact, Emirates, as it cut back on the A380, placed a large order of Airbus’s own saller A350 and A330. Grant points out that these aircraft offer “better operating economics, lower costs, smaller capacity and therefore less pressure to fill every seat”.

The sheer size and luxury of the A380 also played a role in its undoing. The plane, which is estimated to have cost $25bn (£19.4bn) to develop, runs on a capacity of 320,000 litres of fuel, packs four 70,000lb thrust engines, carries 555 passengers over two decks and 500 square meters of floor space, and has a duty free shop, bar restaurant and beauty salon."
Stepping into the virtual world to enhance aircraft maintenance - Airbus,"Fri, 08 Feb 2019 08:00:00 GMT",https://news.google.com/rss/articles/CBMicmh0dHBzOi8vd3d3LmFpcmJ1cy5jb20vZW4vbmV3c3Jvb20vc3Rvcmllcy8yMDE5LTAyLXN0ZXBwaW5nLWludG8tdGhlLXZpcnR1YWwtd29ybGQtdG8tZW5oYW5jZS1haXJjcmFmdC1tYWludGVuYW5jZdIBAA?oc=5&hl=en-US&gl=US&ceid=US:en,"Determining the best way to maintain, repair or replace an aircraft component in crowded or tight environments – such as the avionics compartment or an engine pylon – could be a challenge. With digital technologies, it’s as easy as putting on a pair of virtual reality glasses.

​Virtual reality (VR) brings real benefits and value, making it possible to simulate and reproduce situations in a safe environment that would otherwise be costly, complex or even dangerous. In recent years, virtual and augmented reality have become more mobile and easier to use than ever, creating the potential to completely transform many areas of business.

Airbus has been at the forefront of virtual and augmented reality technologies in the industry, implementing VR software tools throughout the aircraft design process, as well as on the digital shop floor and for inspection purposes.

Adapting existing Airbus VR programmes for new maintenance operations

During an aircraft’s design and development phases – and when modifications or updates are implemented – Airbus engineers need to check and improve the feasibility of the related maintenance activities. The aim is to support high levels of operational reliability and minimise direct maintenance costs for airlines.

This has generally been done with traditional digital technologies such as CATIA (a computer-based modelling system), and the DMU (digital mock-up). Depending on the situation, physical verification also can be performed on the aircraft for more complicated items and processes at a later phase in the development. The downsides of these traditional verification methods are their requirements in cost, time and engineers’ experience.

To seek more efficient maintenance validation methods, Stephane Benazet, Head of Fuselage and Pylon Operability and Design Maturity, worked with Airbus’ IT teams to explore new technologies – partnering with augmented and virtual reality architect Xavier Laville to adapt existing Airbus virtual reality programmes in meeting the needs of an operability engineer.

For many years, Airbus' RHEA (Realistic Human Experiment Analysis) rooms have offered a full-scale, immersive experience based on the aircraft's digital mock-up – where cameras are used to track sensors installed on the user's arms and legs, while the headset accurately displays the body movements. Now, the team has created a “portable RHEA” kit that includes a virtual reality mask, touch pads and two infrared cameras, allowing users to work in a similar immersive environment without leaving their desks.

Virtual reality is truly helping us with our real daily tasks, while reducing time and costs.

- Stephane Benazet, Head of Fuselage and Pylon Operability and Design Maturity

""This technology puts you in the place of an airline mechanic,"" explains Benazet. ""If there's an issue that does not let you gain access or remove a component – the system won't let you do it.""

In addition to portability, the VR-based system has further advantages: learning how to use it takes just one day. “The feedback has been great,"" says Laville. ""It's a beautiful technology that enables users to perform verification and validation activities in just 25% of the time needed for traditional CATIA and DMU methods.""

Training and deployment are set to begin in 2019. ""We can optimise procedures and tasks included in service bulletins – such as those before launching retrofits on in-service aircraft, for pre-design, or for system architecture reviews,” added Benazet. “We have engineers in multiple countries, so the portability and accessibility of RHEA lets us deploy the system wherever we have people, reducing onboard physical verification."""
Airbus A380: from high-tech marvel to commercial flop - The Conversation,"Tue, 19 Feb 2019 08:00:00 GMT",https://news.google.com/rss/articles/CBMiV2h0dHBzOi8vdGhlY29udmVyc2F0aW9uLmNvbS9haXJidXMtYTM4MC1mcm9tLWhpZ2gtdGVjaC1tYXJ2ZWwtdG8tY29tbWVyY2lhbC1mbG9wLTExMjA4NtIBAA?oc=5&hl=en-US&gl=US&ceid=US:en,"This time it really is over. Airbus chief executive, Tom Enders, recently announced the end of the A380, the largest commercial aircraft ever built. Despite reported investments of more than €14 billion, this iconic European project has not been as successful as was originally hoped. With only 234 units delivered out of 313 ordered over 13 years, it is far from the break-even point – originally estimated at 1,200 aircraft over 20 years. With orders drying up and production already running at a minimum, it was time for Airbus to stop the damage.

Long before its launch date, the A380 appeared to represent the future of Airbus, which anticipated that air traffic would double in the next 20 years. That’s why it is both big – it can carry anywhere from 550 to more than 800 passengers on two full decks – and luxurious, with options such as private rooms, restaurants and bars – even an in-flight casino. Its engines are on average 30% more powerful than those of the Boeing 747 and are worth €13 million each – the value of a ton of gold for all four.

To keep the overall weight down, the A380’s designers used groundbreaking composite structure, including carbon ribs within aluminium wings. Equipped with the most advanced navigation system in commercial aviation, it can operate for more than 13 hours and fly more than 9,000 miles.

The aircraft is built on a continental scale: the wings are made in Wales, engines are made in England (Rolls Royce) or the US (Engine Alliance), the fuselage and the vertical stabiliser is built in Germany and the horizontal stabiliser in Spain. Final assembly is carried out in France. Each wing weighs 6.5 tons and is composed of tens of thousands of components, carrying the fuel, supporting the fuselage and channelling the power of the engines.

Niche market

If the A380 is undeniably one of the most impressive aircraft of all time, its unique design and distributed production system created numerous technical and coordination problems. The initial launch was delayed 18 months by a range of difficulties, and the ability of airlines to customise the aircraft proved to be an additional source of delays.

While the A380’s first flight – on April 7 2005 – was a success, the market was already changing. Airlines that initially favoured big hubs such as Singapore and Dubai began to offer more direct flights from a significant number of middle-sized airports. The rise of low-cost airlines brought in influential new players and weakening the long-time leaders that had been seen as big prospects for the A380.

Most importantly, the 2008 economic crisis seriously cut into the growth in air traffic. While growth has returned, the market is smaller than expected, making it harder to fill a wide-body aircraft, much less a double-deck one. It is simply not profitable for an airline to have flights with less than 80% of the seats filled. Emirates, which owns half of all operating A380s, has the financial resources to take on this risk, but not other carriers.

It was Airbus’ mimicry of its historic competitor, Boeing, that led to the gap between supply and a considerably evolved demand. While some experts claimed that the A380 was 10 to 20 years ahead of the market, Airbus executives now admit that the plane was 10 years too late. As Enders said when announcing the A380’s demise: “What we are seeing here is the end of the large four-engine aircraft.”

With A380 sales lagging, Airbus launched its new mid-size flagship, the A350, in 2014. It and Boeing’s 787 Dreamliner, both of which have only two engines yet can fly great distances, were preferred because they had lower costs and fewer constraints than the A380.

A380 orders started to dry up in 2015 and persistent rumours suggested that the end was near. There were no orders from US carriers, few in Asia and even Air France halved its anticipated A380 fleet. On January 15 2018, John Leahy, Airbus’ chief commercial officer, declared that if Emirates didn’t order at least 30 more A380s, it wouldn’t be possible to keep the program alive. British Airways, which owns a dozen A380s, has suggested that it could acquire others, but only if Airbus was “aggressive on the pricing”. Whatever the result of those discussions, they are unlikely to alter the company’s decision.

An inevitable disaster?

Today, the very design of the A380 is being questioned – that it was in many ways a delusion of grandeur by Airbus, which wanted at all costs to beat the Boeing 747. But its four engines consumed too much fuel, and being able to carry more passengers wasn’t enough to make up the difference. The A380’s immense size and double-deck layout also require airport investments not needed for other airliners.

Without the support of Emirates, which has made the A380 its flagship and is probably the only company that will regret its end, the decision to cease production would have been made a long time ago. Emirates has agreed to convert part of its latest order to A330neo and A350 aircraft, remaining faithful to Airbus. The last delivery is scheduled for 2021 and there will be no new versions brought into service. Meanwhile, the Boeing 747 celebrates 50 years of service – though it too is ending production, marking the end of an era for airline behemoths.

The end of the A380 is not necessarily good news for Boeing: it releases Airbus from a weight that has long prevented it from delivering its full potential. Resources and skills can be better allocated and thousands of workers may be offered jobs on other production lines. If the end of the A380 is a hard blow, the end of the story has yet to be written for Airbus."
