Titre,Date de publication,URL,Contenu
New Airbus design includes circular theatre-style rows - Daily Mail,"Thu, 27 Nov 2014 08:00:00 GMT",https://news.google.com/rss/articles/CBMimAFodHRwczovL3d3dy5kYWlseW1haWwuY28udWsvdHJhdmVsL3RyYXZlbF9uZXdzL2FydGljbGUtMjg1MTUwNy9OZXctQWlyYnVzLWRlc2lnbi1pbmNsdWRlcy1jaXJjdWxhci10aGVhdHJlLXN0eWxlLXJvd3MtbWVhbi1wYXNzZW5nZXJzLWZseS1CQUNLV0FSRFMuaHRtbNIBnAFodHRwczovL3d3dy5kYWlseW1haWwuY28udWsvdHJhdmVsL3RyYXZlbF9uZXdzL2FydGljbGUtMjg1MTUwNy9hbXAvTmV3LUFpcmJ1cy1kZXNpZ24taW5jbHVkZXMtY2lyY3VsYXItdGhlYXRyZS1zdHlsZS1yb3dzLW1lYW4tcGFzc2VuZ2Vycy1mbHktQkFDS1dBUkRTLmh0bWw?oc=5&hl=en-US&gl=US&ceid=US:en,"A round theatre-like design for seating is the latest idea being floated by one plane manufacturer - and it could revolutionise how passengers travel by air.

Airbus has filed a patent to go with a concept for a circle of seats on board its aircraft, a complete change in direction to the usual row formation used today.

According to the application, the circular seating 'allows structure to be more resistant to loads induced by the cabin pressurization'.

Airbus' plan for seating will see rows replaced by a circular plan where customers will face each other

The seating plans by Airbus are the latest in a long line of changes being explored for air travel (File Photo)

It means that because aircraft come under great pressure front and back when airborne, frames and support are needed to balance the load, thus limiting the amount of space available for passengers.

Airbus believes that a circular design for seating will help to distribute the pressure more evenly and in turn increasing space for more seats.

For airlines, more passengers means more profit - but the new design raises the question of comfort for passengers facing each other, especially for hours during long-haul flights.

And, as every seat will be facing a different angle, the sensation of flying backwards, or even sidewards, may not appeal to many.

Could seats that face backwards really be the future of flying - and more importantly, would anyone be willing to travel this way?

Award-winning designer James Lee's concept improves passenger seating with new-look designs Includes dual armrest, foot rest, tablet stand and cup holder

The plan is the latest in a long-line of prospective redesigns on board aircraft.

A host of intriguing blueprints were recently revealed at the influential Aircraft Interiors Expo, held in Hamburg in northern Germany earlier this year.

An armrest that is suitable for two will be seen as a huge bonus to passengers

These include the ground-breaking concept of a row of seats where two of the chairs look in one direction, while the third, in the middle of the trio, gazes to the rear.

Drawn up by Paris-based Zodiac Aerospace, this design would supposedly allow passengers more room to move, without disturbing their neighbours.

Just as interesting when it comes to flights without clashing limbs and knocked arms is the two-tier armrest created by Hong Kong-based company Paperclip Design.

A clever creation, yet one so simple that you might be amazed it has not been thought of before, the armrest allows two passengers to perch their funny-bones on the partition between seats at the same time – without invading each other’s personal spaces.

The same firm has also concocted the imaginative ‘Caterpillar Convertible’ seat – which has already won awards thanks to its versatility.

Futuristic and flexible, the Caterpillar can be both a cheaper seating option in the economy cabin – or can be reconfigured as something rather more exclusive in business class, with the capacity to spread out as a flat bed.

And James Lee, who has won accolades for his forward-thinking concepts, revealed his plans for new long-haul seats with Hong Kong-based company Paperclip Design.

As well as seats with a reclining backrest and a tray with a tablet stand, holidaymakers would also be able to relax on flights with a footrest under the chair in front of them.

Potentially spelling the end to elbow wars among travellers sitting next to each other, Lee's Meerkat seat concept also includes a dual-use armrest."
IndiGO gets 100th aircraft completing its first order of many Airbus A-32 - The Economic Times,"Tue, 04 Nov 2014 08:00:00 GMT",https://news.google.com/rss/articles/CBMiqgFodHRwczovL20uZWNvbm9taWN0aW1lcy5jb20vaW5kdXN0cnkvdHJhbnNwb3J0YXRpb24vYWlybGluZXMtLy1hdmlhdGlvbi9pbmRpZ28tZ2V0cy0xMDB0aC1haXJjcmFmdC1jb21wbGV0aW5nLWl0cy1maXJzdC1vcmRlci1vZi1tYW55LWFpcmJ1cy1hLTMyL2FydGljbGVzaG93LzQ1MDM3ODU3LmNtc9IBAA?oc=5&hl=en-US&gl=US&ceid=US:en,"



(You can now subscribe to our

(You can now subscribe to our Economic Times WhatsApp channel

NEW DELHI: Major no-frills carrier IndiGo today inducted its 100th airplane, completing its first order of many Airbus A-320 aircraft placed with the French manufacturer in 2005.The A-320 plane landed at the Indira Gandhi International Airport this morning, enabling IndiGo, which holds India's largest aviation market share, to join the league of Air India and Jet Airways which also have over 100 planes in their respective fleets.The completion of its first order came weeks after it placed the largest global aircraft order for 250 of the latest Airbus A-320 neo aircraft worth over USD 25.5 billion or Rs 1.55 lakh crore.In 2011, IndiGo had placed its second order of 180 A-320 neos planes worth about $ 11 billion, which was the largest-ever at that time.The Gurgaon-based no-frills airline, which commenced operations in August 2006, had placed its first order of 100 A-320s at the Paris Air Show in 2005 and took the delivery of the first aircraft on July 28, 2006 and the last one today.With a market share of 32.8 per cent in September, IndiGo offers 542 daily flights connecting 36 domestic and international destinations and has flown over 80 million passengers since its launch in 2006.The airline celebrated the induction of 100th aircraft by launching a programme to sponsor the education and nurturing of 100 underprivileged children. The programme called '6E Scholar' is being carried out in partnership with an NGO, Mensa India.IndiGo President Aditya Ghosh said ""this is truly a milestone for IndiGo as we fulfil the promise of a 100 airplanes."
Airplane Art - American Airines Airbus A330-200 - Economy Class & Beyond - Kevin Marshall,"Sun, 23 Nov 2014 08:00:00 GMT",https://news.google.com/rss/articles/CBMiaGh0dHBzOi8vZWNvbm9teWNsYXNzYW5kYmV5b25kLmJvYXJkaW5nYXJlYS5jb20vMjAxNC8xMS8yMy9haXJwbGFuZS1hcnQtYW1lcmljYW4tYWlyaW5lcy1haXJidXMtYTMzMC0yMDAv0gEA?oc=5&hl=en-US&gl=US&ceid=US:en,"It’s Sunday again, and it must be time for some more airplane art.

This week, sitting in the sun on a Frankfurt morning is an American Airlines Airbus A330-200 awaiting its next duty.

Hold it? An American Airlines A330-200?

As the merger continues, the new American is painting up its planes into the “new” American Airlines livery. This is but one of them.

American-US Airways operate 15 Airbus A330-200s, and 9 Airbus A330-300s as part of the long haul fleet.

More Airplane art next week!

Welcome to Economy Class and Beyond – The new name for GhettoIFE (and a lot more pronounceable). Expect in-depth coverage, analysis, route news as well as humour and madness as I only know how.

Follow me on Twitter at @EconomyBeyond for the latest updates!

Also remember that as well as being part of BoardingArea, we’re also part of BoardingArea.eu, delivering frequent flyer news, miles and points to European readers."
11 Coastal Alabama Leaders You Should Know: David Trent - AL.com,"Sun, 30 Nov 2014 08:00:00 GMT",https://news.google.com/rss/articles/CBMiTGh0dHBzOi8vd3d3LmFsLmNvbS9uZXdzL21vYmlsZS8yMDE0LzExLzExX2NvYXN0YWxfYWxhYmFtYV9sZWFkZXJzX3lvdV80Lmh0bWzSAQA?oc=5&hl=en-US&gl=US&ceid=US:en,"Airbus Americas Engineering Site Director David Trent has been at the forefront of the company's growth, and is a strong advocate for education programs as well.

Trent, a product of the California coast and the ""other L.A.,"" has held the same position since joining Airbus nine years ago, a job he said is ever-changing.

""It's been a really exciting opportunity to be kind of the flagship for what Airbus is trying to do in Mobile,"" Trent said.

His office also focuses on ""backyard schools."" Trent led employees in adopting Gilliard Elementary School, Pillans Middle School and B.C. Rain High School to participate in educational programs such as the Reading Buddies Program.

""If all of the businesses in Mobile would focus on their backyard, our backyards would intersect and we could cover this city relative to making education and the advancement of our youth important,"" Trent said.

He also encourages employees to be active outside of the office. Trent, current president of the board of trustees for The Gulf Coast Exploreum, said his dedication to the Exploreum aligns well with his other passion.

""There's such a need for organizations like the Exploreum in this town, and it all goes to the passion of education.""

__________

Age: 54

Occupation: Site director, Airbus Americas Engineering, Inc.

City of residence: Mobile

Family: Wife, Michon; children, Jessica and Jill

Civic affiliations: Member, Government Street Presbyterian Church; President, Gulf Coast Exploreum Board of Trustees; President, Board of Trustees for the United Way of South Alabama; Secretary, Alabama Aerospace Industries Association; member, University of South Alabama School of Engineering Industrial Advisory Board; member, Coastal Alabama Partnership.

What is your favorite quote? ""Do unto others as you'd have them do unto you.""

Best theoretical dinner party of four: you and who? Abraham Lincoln, Albert Einstein and Wynton Marsalis.

Best advice you ever got? Don't forget where you came from.

Best book you ever read and why? ""Switch,"" by Dan and Chip Heath. This book deals with change: Why is change so hard and what you can do to lead successful change in your life and community.

Latest accomplishment? Equipped a team of Airbus Americas Engineering employees to adopt three public schools (Gilliard Elementary School, Pilans Middle School and B.C. Rain High School) in the Brookley Aeroplex ""backyard"" to assist in the areas of increased reading capability (through the Reading Buddies program), engineering as part of the middle school curriculum (through the Engaging Youth in Engineering Program) and aerospace literacy in the high school (as part of the Aviation Academy).

Best thing mom or dad ever taught you? Be nice.

Guilty pleasure? Time with friends on my back porch with a good glass of wine and a great conversation."
Panthers to assume ASW role in Indonesia - Defense Update,"Wed, 05 Nov 2014 08:00:00 GMT",https://news.google.com/rss/articles/CBMiMWh0dHBzOi8vZGVmZW5zZS11cGRhdGUuY29tLzIwMTQxMTA1X2FzNTY1bWJlLmh0bWzSAQA?oc=5&hl=en-US&gl=US&ceid=US:en,"Airbus Helicopters has been selected to provide 11 AS-565 MBe Panther helicopters for the Indonesian Navy, Airbus announced today. These rotorcraft will to be used for naval anti-submarine warfare (ASW) missions, supporting operations from land bases and ships. The helicopters are scheduled for delivery within three years to Indonesia, where they will be outfitted for their ASW mission, before delivery to the Indonesian Navy. The mission equipment include the Helicopter Long-Range Active Sonar (HELRAS) dipping sonar and torpedo launching system.

Panther now becomes one of the world’s most capable light/medium anti-submarine warfare platforms, with an advanced ASW suite and the capability to operate from corvettes or small frigates

HELRAS DS-100 produced by L-3 comprises a descending vertical transmit array of seven projector elements and a receive array of eight hydraulically driven arms that expand to a diameter of 2.6 meters when deployed. The total weight of the system is about 350 kg. The AS-565 is configured to carry the Raytheon Mk 46 or Whitehead A.244/S lightweight ASW torpedoes.

The DS-100 is A 1.38 kHz version of the popular AQS-18A dipping sonar. The DS-100 is capable of operating at depths to 500 meters designed for long-range surveillance and underwater search. Using high resolution doppler processing and long shaped pulses, it can detect submarines even very low speed (near zero doppler signal). According to L-3, the DS-100 is also suited to redetection, target localization and weapon delivery against submarines at deep and shallow waters. The HELRAS is used with several types of helicopters, including the Italian Navy EH-101 and SH-3. A version of the system is also tailored for the ASW variant of the European NH-90.

“The Panther now becomes one of the world’s most capable light/medium anti-submarine warfare platforms, with an advanced ASW suite and the capability to operate from corvettes or small frigates,” said Philippe Monteux, Head of Region South East Asia & Pacific at Airbus Helicopters.

He added that the Panther’s ASW capability would meet the naval requirements of other countries in the region.

Although the Panther has been available for many years, the new contract represents its first penetration to the Asian market. The reason for its slow entry to market is probably the competition form the Chinese built variant – Harbin Z-9 which was based on the SA-565 civilian variant – Dauphin. Beyond the Chinese Army and Navy the Z-9 is operating with Cambodia, Laos and Pakistan.

This order will add to the Indonesian Armed Forces’ fleet of Airbus Helicopters rotorcraft serving the Indonesian military, which currently operates the light EC120 Colibris for training; the Fennecs and BO-105 for light attack missions and the Pumas and Super Pumas operated by the Air Force. The Indonesian Air Force is expecting to receive the EC725 for combat search and rescue missions.

PT Dirgantara, Airbus’ strategic industrial partner in Indonesia is also involved in other programs, including the C-295 military transport. The agreements were secured by PT Dirgantara Indonesia as a result of its long-standing cooperation and strategic alliance with Airbus Helicopters. The President of PT Dirgantara Indonesia, Budi Santoso explained, “This latest contract demonstrates the strength and efficiency of our commercial and industrial partnership with Airbus Helicopters. Together, we are able to identify and deliver the most modern and cost-effective solutions for the Indonesian Government and at the same time associate the significant involvement of the Indonesian industry.”"
Airbus starts A330 Beluga development | News | Flight Global - Flightglobal,"Mon, 17 Nov 2014 08:00:00 GMT",https://news.google.com/rss/articles/CBMiUWh0dHBzOi8vd3d3LmZsaWdodGdsb2JhbC5jb20vYWlyYnVzLXN0YXJ0cy1hMzMwLWJlbHVnYS1kZXZlbG9wbWVudC8xMTUxNTkuYXJ0aWNsZdIBAA?oc=5&hl=en-US&gl=US&ceid=US:en,"Airbus has launched the development of an A330-based successor for its five-strong A300-600ST Beluga transport fleet.

The Toulouse-based manufacturer says it will build five “new Belugas”, the first of which is scheduled to enter service in mid-2019.

Like its predecessor, the new aircraft will feature a lowered cockpit section to facilitate transport of large airframe segments on the main deck in an extended cargo bay structure.

Airbus

But Airbus says it will be able to use a “large” extent of existing component and equipment for the A330 series.

Meanwhile, the existing Beluga fleet is to be gradually retired until 2025.

The General Electric CF6-powered aircraft were manufactured between 1994 and 2001, Flightglobal’s Ascend Fleets database shows.

Airbus

Airbus is aiming to double the capacity of that fleet by 2017 through initiatives, such as the construction of dedicated hangars that permit loading of the aircraft in all weather conditions.

But the manufacturer says it needs additional capacity for the production ramp-up of the A350 and other programmes.

Source: Cirium Dashboard"
Finnair to add Chicago to its network - Economy Class & Beyond - Kevin Marshall,"Fri, 14 Nov 2014 08:00:00 GMT",https://news.google.com/rss/articles/CBMiYGh0dHBzOi8vZWNvbm9teWNsYXNzYW5kYmV5b25kLmJvYXJkaW5nYXJlYS5jb20vMjAxNC8xMS8xNC9maW5uYWlyLXRvLWFkZC1jaGljYWdvLXRvLWl0cy1uZXR3b3JrL9IBAA?oc=5&hl=en-US&gl=US&ceid=US:en,"Finnair have been building and growing their network in Asia for some time. However, it has turned its eyes over to the west, and the United States of America, with the announcement of a new service between Helsinki and Chicago O’Hare International



Finnair Airbus A330 at New York JFK – Image Economy Class and Beyond

The route to Chicago will not have an aggressive start, with only three services a week between the two cities from June 2015.

The timetable looks like this:

AY009 DEPART HEL 17:25 ARRIVE ORD 18:40 AY010 DEPART ORD 22:00 ARRIVE HEL 14:50+1 Operates Mondays, Wednesdays and Saturdays in both directions Booked Equipment: Airbus A330-300 Commences: 13th June 2015 Data: Airlineroute

A three-time-a-week service is akin to dipping your toes in the water to see what the temperature is like – is it going to be too cold or too hot (so that a service isn’t viable), or is it just right, or is there room for the service to expand in the future.

None the less, it’s an interesting addition to the network, where they serve New York, Miami (from December) and Toronto (seasonally).

Finnair is also a member of the Atlantic Joint Business Agreement between American Airlines, British Airways, Iberia and US Airways, allowing cross selling and coordination of routes and fares.

More options are always welcome across the Atlantic, and if this opens up new flows of traffic from Europe and Asia – the better.

Welcome to Economy Class and Beyond – The new name for GhettoIFE (and a lot more pronounceable). Expect in-depth coverage, analysis, route news as well as humour and madness as I only know how.

Follow me on Twitter at @EconomyBeyond for the latest updates!

Also remember that as well as being part of BoardingArea, we’re also part of BoardingArea.eu, delivering frequent flyer news, miles and points to European readers."
Air Berlin increases summer 2015 services to the USA - Economy Class & Beyond - Kevin Marshall,"Tue, 04 Nov 2014 08:00:00 GMT",https://news.google.com/rss/articles/CBMib2h0dHBzOi8vZWNvbm9teWNsYXNzYW5kYmV5b25kLmJvYXJkaW5nYXJlYS5jb20vMjAxNC8xMS8wNC9haXItYmVybGluLWluY3JlYXNlcy1zdW1tZXItMjAxNS1zZXJ2aWNlcy10by10aGUtdXNhL9IBAA?oc=5&hl=en-US&gl=US&ceid=US:en,"Air Berlin is going through change as we all know, and it’s still trying to strengthen itself in terms of flights and income.

One way its planning of doing it is to increase frequency on two of its routes from Düsseldorf to the USA, with two services being boosted for the Summer 2015 season.



Air Berlin Airbus A330-200 at Chicago O’Hare International – Image Economy Class and Beyond.

Both New York and Los Angeles will gain more flights, with New York going from 10 flights a week to 14, and Los Angeles converting to a daily service from four days a week.

The expanded timetables look like this:

Düsseldorf to New York

AB7450 DEPART DUS 13:05 ARRIVE JFK 15:30 AB7480 DEPART DUS 17:00 ARRIVE JFK 19:25 AB7451 DEPART JFK 17:15 ARRIVE JFK 06:55+1 AB7481 DEPART JFK 21:25 ARRIVE JFK 11:05+1 Operates 14 times a week from 10th May 2015 Booked Equipment Airbus A330-200

Düsseldorf – Los Angeles

AB7430 DEPART DUS 13:20 ARRIVE LAX 16:10 AB7431 DEPART LAX 17:55 ARRIVE DUS 13:40+1 Operates daily from 7th May 2015 Booked Equipment Airbus A330-200

Data: Airlineroute

It’s an interesting move by Air Berlin to boost its network. Whilst it feeds to its part owner Etihad, the airlines network – both short and longhaul do need to stand up on its own two legs and show it can deliver loads and yields to the airline.

Adding flights on popular routes like this is a good way to do it – providing there are passengers who pay the higher fares… and don’t want to fly Lufthansa.

Flights are loaded in the booking system

These flights could be a good value Avios redemption due to the low taxes. That’s providing you can get seats…

Welcome to Economy Class and Beyond – The new name for GhettoIFE (and a lot more pronounceable). Expect in-depth coverage, analysis, route news as well as humour and madness as I only know how.

Follow me on Twitter at @EconomyBeyond for the latest updates!

Also remember that as well as being part of BoardingArea, we’re also part of BoardingArea.eu, delivering frequent flyer news, miles and points to European readers."
First 242 tonne take-off weight A330 starts final assembly - Skies Magazine,"Fri, 07 Nov 2014 08:00:00 GMT",https://news.google.com/rss/articles/CBMiVmh0dHBzOi8vc2tpZXNtYWcuY29tL3ByZXNzLXJlbGVhc2VzL2ZpcnN0MjQydG9ubmV0YWtlb2Zmd2VpZ2h0YTMzMHN0YXJ0c2ZpbmFsYXNzZW1ibHkv0gFaaHR0cHM6Ly9za2llc21hZy5jb20vcHJlc3MtcmVsZWFzZXMvZmlyc3QyNDJ0b25uZXRha2VvZmZ3ZWlnaHRhMzMwc3RhcnRzZmluYWxhc3NlbWJseS8_YW1w?oc=5&hl=en-US&gl=US&ceid=US:en,"The Airbus A330 242 tonne MTOW offers an extended range of up to 500 nautical

miles and up to two per cent reduced fuel consumption. Airbus Photo

The final assembly of Airbus’ first A330 with the new 242 tonne maximum take-off-weight (MTOW) capability is underway at the A330 Final Assembly Line in Toulouse, France. The aircraft is currently completing its structural assembly before the cabin integration phase and will be used for certification flight trials. A second aircraft is being assembled in parallel which is destined for entry in service in Q2 2015 with launch customer for the new weight variant, Delta Air Lines.

Patrick Piedrafita, Airbus’ head of the A330 program said: “I am very proud to see the first 242 tonne A330 at the final assembly stage only two years after launch. This newest, enhanced variant of our popular A330 Family is the basis for the future A330neo and is a concrete example of Airbus’ incremental innovation strategy in action.” He added: “Airlines operating the new 242 tonne A330 will be able to carry additional payload on longer routes, while at the same time enjoying a very high operational reliability of 99.4 per cent.”

Thanks to an aerodynamic package reducing aircraft drag and the latest engine improvements, the 242 tonne MTOW offers an extended range of up to 500 nautical miles and up to two per cent reduced fuel consumption. The 242 tonne A330-300 is capable of flying missions up to 13 hours and 15 hours for the 242 tonne A330-200. So far, nine customers worldwide have already selected this option since the launch in November 2012.

The A330 Family includes Freighter, VIP, and Military Transport/Tanker variants, has now attracted more than 1,300 orders. Over 1,100 A330 Family aircraft are flying with more than 100 operators worldwide. The A330 is one of the world’s most efficient aircraft with best in class operating economics. With numerous on-going product enhancements entering service in the coming years, the A330 Family remains the most cost-efficient and capable widebody aircraft, averaging operational reliability above 99 percent. These enhancements include the more capable 242 tonne take-off-weight variant (available for both the A330-200 and the A330-300), the A330 optimised for regional and domestic routes and the A330neo, The A330 belongs to the successful Airbus Widebody aircraft Family, which comprises the A330, A350 XWB and A380, and uniquely spans the 250 to over 500 seats segment."
Indian submarine periscopes to be serviced in-country - UPI News,"Wed, 19 Nov 2014 08:00:00 GMT",https://news.google.com/rss/articles/CBMib2h0dHBzOi8vd3d3LnVwaS5jb20vRGVmZW5zZS1OZXdzLzIwMTQvMTEvMTkvQWlyYnVzLWJ1aWxkaW5nLXBlcmlzY29wZS1tYWludGVuYW5jZS1wbGFudC1pbi1JbmRpYS8yMTUxNDE2MzczMTkzL9IBAA?oc=5&hl=en-US&gl=US&ceid=US:en,"U.S. Navy personnel on submerged submarine use periscopes to view surface activity. (U.S. Navy photo: Mass Communication Specialist 2nd Class Ronald Gutridge)

UNTERSCHLEISSHEIM, Germany, Nov. 18 (UPI) -- A facility for the maintenance and repair of Indian Navy submarine periscopes is being built in India by Airbus Defense and Space's Optronics business unit. Airbus Defense and Space said the contract is worth more than $16.2 million and that the facility will be completed in September of 2016. Advertisement

""The maintenance facility contract demonstrates Airbus Defense and Space's commitment to not only supply systems and technologies to customers, but also to equip them with the necessary operational maintenance capability,"" the company said.

The company's local partners for building the plant are Tata Consultancy Services and H&H Precision Pvt Ltd.

Indian Navy technicians will be trained in India and Germany by the company to perform the maintenance and repair work on the periscopes, which were manufactured by Airbus Defense and Space.

""When a product is serviced, a lot of time is lost during the transport between different facilities,"" said Harald Hansen, director of Business Development Sea at Airbus Defense and Space's Optronics business. ""Once maintenance work can be done locally, the operators can speed up this process and enhance the operational readiness of the Indian fleet."""
