Titre,Date de publication,URL,Contenu,sentiment_finbert,sentiment_label,sentiment_score,sentiment_numerique
Airbus Military focusing on African market - defenceWeb,"Wed, 23 May 2012 07:00:00 GMT",https://news.google.com/rss/articles/CBMiY2h0dHBzOi8vd3d3LmRlZmVuY2V3ZWIuY28uemEvaW5kdXN0cnkvaW5kdXN0cnktaW5kdXN0cnkvYWlyYnVzLW1pbGl0YXJ5LWZvY3VzaW5nLW9uLWFmcmljYW4tbWFya2V0L9IBAA?oc=5&hl=en-US&gl=US&ceid=US:en,"Airbus Military expects to sell 70 light and medium military aircraft to Africa over the next decade, as it shifts it focus to the African continent and other emerging markets. Ghana, Cameroon and Gabon are some of the nations that are in the midst of buying new aircraft or are about to sign, whilst South Africa is a leading potential customer for the C295.

Airbus Military said that countries in sub-Saharan Africa will buy 50 light and medium aircraft over the next ten years, and that countries on the whole continent (excluding those in the Middle East) will purchase a total of 70.

Antonio Rodriguez Barberan, Senior Vice President: Commercial at Airbus, told defenceWeb that Airbus was in very preliminary discussions with Ghana for the acquisition of two more C295 transports. Ghana took delivery of its second C295 on April 25 and has a requirement for another two. Barberan said the Ghana Air Force was making good use of its new aircraft, flying them around Africa. Ultimately, it wants to base two transports in the capital Accra and another two in Tamale. Airbus said that Ghana may order another two C295s next year.

In August last year the contract for Ghana’s two C295s was announced, and the first was delivered in November. The C295s are being used for troop transport, medical evacuation, paratrooping, training and humanitarian operations, including United Nations peace missions.

Barberan said that an impending order for CN235s is coming from Cameroon, which recently signed a contract but had problems financing the new aircraft. A few weeks ago Cameroon obtained financing for the order, which will soon be announced by Airbus Military once it is firmed up.

Meanwhile, Gabon is one of several nations interested in acquiring C295s to be operated on behalf of the United Nations. The United Nations has also expressed interest in acquiring the C-295 to replace its old, inefficient Russian aircraft. Last year the UN invited Airbus to demonstrate the C-295 in the DRC, which Airbus duly did in July. Another demonstration took place this year. The United Nations does not own its own aircraft, but operates aircraft leased by contributor nations. Airbus Military, the United Nations and its partner nations are discussing possible procurement of the C-295, with Gabon emerging as a likely customer.

In October 2010 Egypt signed a contract for three C295s, and received its first in September last year. Airbus Military told journalists at its annual Trade Media Briefing in Spain that Egypt this year placed an order for an additional three C295s.

Airbus recently flew a C295 out to Africa for a demonstration tour, showing the aircraft to Kenya and Tanzania, amongst others. At the moment there is “no real interest” in the C295 from African countries following the tour, but Barberan is confident that orders will materialise. During its demonstration tour, Airbus Military demonstrated the C295 to the South African Air Force in April, in the hopes of receiving orders to fulfil its transport and maritime patrol requirements.

“Airbus Military has a long established partnership with South Africa and the SA Air Force. By bringing the C-295 to South Africa, we are able to demonstrate the aircraft’s capabilities in typical SANDF [South African National Defence Force] mission configurations for tactical transport, medevac, anti-piracy, countersmuggling and Economic Exclusion Zone protection operations,” Barberan said at the time.

On Monday Airbus Military announced that Oman had ordered eight C295s, including five configured as tactical transports and three as maritime patrol aircraft, for delivery in 2013. This setup could be emulated by South Africa, which could acquire the Fully Integrated Tactical System (FITS) mission suite for maritime patrol duties. This comprises a search radar, electro-optical/infrared sensor, magnetic anomaly detector and hardpoints for torpedoes and depth charges.

Head of Airbus Military, Domingo Urena-Raso, yesterday told defenceWeb that there are several key countries his company is targeting in Africa, including Egypt, Algeria, Morocco and South Africa. He said that although most African countries order only a few aircraft, when put together Africa offers a very reasonable volume of business.

Urena-Raso said that South Africa is a market for both the C295 as well as the A400M and that even though the South African government cancelled its previous order, the A400M “will come later” to South Africa. Airbus Military recently started marketing the airlifter to foreign countries, and sent it on a sales tour to Asia and Latin America.

After South Africa ordered the A400M, Denel Saab Aerostructures (Denel Aerostructures today) and other local companies began manufacturing components for the aircraft. Urena-Raso said that Airbus Military was satisfied with Denel’s performance and will continue to work with the company as far as they keep performing. In fact, Airbus Military and Denel Aerostructures have negotiated a new contract that will be signed in the coming weeks and will see Denel increase A400M component production.

Total Airbus Military sales in sub-Saharan Africa to the first quarter of this year include two C295s, six CN235s and 42 C212s with 14 customers in 11 countries.

Guy Martin is in France as a guest of Airbus Military and is attending the Trade Media Briefing 2012.

","{'label': 'Neutral', 'score': 0.9999895095825195}",neutral,0.9999895095825195,0
Airbus flights from Gannavaram airport soon - The New Indian Express,"Wed, 16 May 2012 07:00:00 GMT",https://news.google.com/rss/articles/CBMiemh0dHBzOi8vd3d3Lm5ld2luZGlhbmV4cHJlc3MuY29tL3N0YXRlcy9hbmRocmEtcHJhZGVzaC8yMDExL0F1Zy8wNS9haXJidXMtZmxpZ2h0cy1mcm9tLWdhbm5hdmFyYW0tYWlycG9ydC1zb29uLTI3ODYzMi5odG1s0gGEAWh0dHBzOi8vd3d3Lm5ld2luZGlhbmV4cHJlc3MuY29tL2FtcC9zdG9yeS9zdGF0ZXMvYW5kaHJhLXByYWRlc2gvMjAxMS9BdWcvMDUvYWlyYnVzLWZsaWdodHMtZnJvbS1nYW5uYXZhcmFtLWFpcnBvcnQtc29vbi0yNzg2MzIuaHRtbA?oc=5&hl=en-US&gl=US&ceid=US:en,"In all, 465 acres of land is necessary for expansion of the runway up to 10,000 feet. The Krishna district administration is likely to issue a notification for land acquisition soon. If the land is allotted for development of the airport, the construction of terminal building will be taken up. Instrument landing facility at the airport will be provided within two months to facilitate night landing of aircraft, he said.","{'label': 'Neutral', 'score': 0.9999926090240479}",neutral,0.9999926090240479,0
Lack of competition on BFA - Australian Defence Magazine,"Fri, 11 May 2012 07:00:00 GMT",https://news.google.com/rss/articles/CBMiRGh0dHBzOi8vd3d3LmF1c3RyYWxpYW5kZWZlbmNlLmNvbS5hdS9uZXdzL2xhY2stb2YtY29tcGV0aXRpb24tb24tYmZh0gEA?oc=5&hl=en-US&gl=US&ceid=US:en,"Yesterday when ADM asked the Minster Smith “What happened to the competition?” in the wake of the announcement about the C-27J FMS purchase, he confidently answered that one had been run.

In response to this, Airbus Military has released the statement below:

“Airbus Military is obliged to place on the public record our disappointment at the Minister’s choice of words, because there was no tender process and certainly no competition.

“We are even more disappointed that this decision appears not to have been made out of rigorous evaluation of tender-quality information for which Australia is justly renowned and which is normally required before such large sums of taxpayer dollars are spent. The Department of Defence seems to have rejected its own tried, tested and proven process of evaluating competing platforms. Following the selection last year of a new naval combat helicopter, the Department of Defence stated publicly that holding a competition between the two contenders had resulted in a 25 per cent savings in acquisition cost.

“We certainly do not begrudge the ADF making decisions about preferred capability and platforms following careful consideration of tender-quality and commercially-binding information. But on this occasion, selection of the C-27J for $1.4 billion seems to have been based largely on the RAAF’s own desktop assessments. When compared to other projects with similar size price tags that go through an arduous process of tender responses and deep investigation of all areas concerning ownership of a capability, this effort falls short of a full evaluation process.

“Airbus Military proposed the C-295 aircraft as the Caribou replacement. The C-295, like the C-27J, has recognised strengths and weaknesses. The C-295 is the world’s most popular battlefield airlifter, with global sales at 100 units. It is cheaper to buy and operate than the C-27J. For the RAAF’s fleet of 10 Battlefield Airlifters, a C-295 purchase, offered at 400 million AUD would have provided savings of $1 billion compared to the C-27J FMS. In addition, the industry involvement Airbus Military had committed to the Department of Defence and Industry had substantial components for Australian Small/Medium Enterprises (SME’s) we doubt could be complied through an FMS case.

“In the current climate of fiscal restraint and public concerns over Government waste and expenditure, it is surprising that the opportunity to save at least $1 billion AUD of taxpayer’s money was not sufficient justification to hold a competition to determine which aircraft option represented the best overall value for money.

“It should also be noted that Australia has committed $1.4 billion to an aircraft that will be delivered in 2015 only, representing a three year time gap. Airbus Military is of the opinion a competition could have been done in this period, complying with the same schedule, as the C295 could be available in a six months time period.”","{'label': 'Neutral', 'score': 0.9994557499885559}",neutral,0.9994557499885559,0
