Titre,Date de publication,URL,Contenu
Airbus Helicopters delivers first three AS565 MBe Panther to Indonesia - Airbus,"Mon, 21 Nov 2016 08:00:00 GMT",https://news.google.com/rss/articles/CBMidmh0dHBzOi8vd3d3LmFpcmJ1cy5jb20vZW4vbmV3c3Jvb20vcHJlc3MtcmVsZWFzZXMvMjAxNi0xMS1haXJidXMtaGVsaWNvcHRlcnMtZGVsaXZlcnMtZmlyc3QtdGhyZWUtYXM1NjUtbWJlLXBhbnRoZXItdG_SAQA?oc=5&hl=en-US&gl=US&ceid=US:en,"Summary

First three of 11 AS565 MBe Panther helicopters handed over to PT Dirgantara Indonesia

This follows the contract signature in late 2014 with PT Dirgantara Indonesia for 11 AS565 MBe helicopters. The delivery of the remaining helicopters will run through to 2018.“We are excited to witness the handover of the first three AS565 MBe helicopters to our partner today”, said Janick Blanc, Head of the Panther programme at Airbus Helicopters. “The AS565 MBe has been developed using state-of-the-art processes and this enhanced variant of the Panther will benefit from an increased maximum take-off weight at 4,500kg. This will provide increased mission capabilities, specifically for the anti-submarine warfare missions these rotorcraft are expected to perform”, he added.Under the agreement, Airbus Helicopters will supply the AS565 MBe helicopters to its Indonesia industrial partner PT Dirgantara Indonesia, who will reassemble and outfit these rotorcraft in-country, acting as the design authority. This will notably cover the installation of the anti-submarine warfare (ASW) suite which includes a dipping sonar and torpedo launch systems, allowing the Indonesian Navy to carry out its most demanding missions.This Indonesian MBe Panther programme is the latest of a long-standing relationship between Airbus Helicopters and PT Dirgantara Indonesia, who celebrated their 40 years of strategic partnership earlier this month. The two companies have delivered more than 190 helicopters together, through joint programmes over the last four decades.“We have been working with Airbus Helicopters on numerous projects for many years by now, and this milestone today further illustrates the commitment both companies have towards this programme”, said Budi Santoso, CEO and President of PT Dirgantara Indonesia. “We look forward to receiving these green helicopters in Bandung, as we ready to start the installation of the mission equipment, and the subsequent qualification and certification of our future anti-submarine warfare helicopters”, he added.Recognised as one of the world’s most capable light/medium anti-submarine warfare platforms, the AS565 MBe is equipped with two Safran Arriel 2N engines, which enhance the helicopter’s performance in high and hot conditions, while enabling it to achieve a top speed of 165 kt and a range of 780 kilometres. It also boasts a new main gearbox, the latest-generation tail rotor and a 4-axis autopilot that reduces crew workload and makes the most demanding missions easier to perform.Airbus Helicopters, a division of Airbus Group, provides the most efficient civil and military helicopter solutions worldwide. Its in-service fleet includes nearly 12,000 helicopters operated by more than 3,000 customers in 154 countries. Airbus Helicopters employs more than 22,000 people worldwide and in 2015 generated revenues of 6.8 billion euros."
"French Defense Chief, Airbus Spar Over 'Tactical' A400M Deliveries - Defense News","Thu, 10 Nov 2016 08:00:00 GMT",https://news.google.com/rss/articles/CBMia2h0dHBzOi8vd3d3LmRlZmVuc2VuZXdzLmNvbS9haXIvMjAxNi8xMS8xMC9mcmVuY2gtZGVmZW5zZS1jaGllZi1haXJidXMtc3Bhci1vdmVyLXRhY3RpY2FsLWE0MDBtLWRlbGl2ZXJpZXMv0gEA?oc=5&hl=en-US&gl=US&ceid=US:en,"PARIS -- French officials are in tough talks with Airbus Defense & Space for a timely delivery of a more capable ""tactical"" version of the A400M military transport plane, French Defense Minister Jean-Yves Le Drian said.





""The problem is the company,"" Le Drian told the defense committee of the lower house National Assembly on Nov. 2, the official minutes of which were recently released. ""Today, the A400Ms delivered are not operational – and the problem does not concern just France: that is the case everywhere.





""As this meeting is public, perhaps my remarks will reach Mr. Enders. It can be said that the talks I have with the Airbus executives are … lively.""





Tom Enders is chief executive of Airbus group. The Air Force is flying the A400M in its basic version as a cargo plane into secure airbases.





""I have asked for a plan to catch up, both for the aircraft's capabilities and delivery rate,"" Le Drian told members of parliament. The delivery delays were unacceptable and the lack of capabilities for parachute drops, self defense and landing on short runways caused concern.





The ministry has reached an agreement for 2016, he said. ""I hope it will be upheld,"" he said. ""In any case, we have an extremely close dialog with the company.""





France had ordered four Hercules C-130J transport planes to meet urgent requirements and tackle the problems of an aging fleet, but that purchase had not been planned at the outset, he said.





The French Air Force expects to receive by the end of the year six A400Ms of the ""tactical"" version, Air Chief of Staff Gen. André Lanata told the French Senate Foreign Affairs, Defense and Armed Forces Committee on Oct. 12. Parachute drops are key to that tactical model, he said.





A tactical model is equipped with a protected cabin and a self-defense system to protect the aircrew and aircraft when flying over hostile zones.





""We expect the company concerned to make every single effort to allow us to undertake our very many operational commitments,"" Lanata said.





The A400M engine is now the major concern for the service, as the motors require an inspection every 80 hours, an unsustainable rate leading to fleet availability shortages, he said.





An interim solution to the engine will be delivered between now and Spring 2017 until a permanent remedy is ready, which will make the situation manageable – which it is not right now, he said.





Airbus D&S declined comment on the issue.





Of the six tactical aircraft, three will be new units and three will be retrofits of the A400M aircraft already in service with the Air Force. The service flies eight of these as cargo lifters into secure areas.





France was the first country to receive a tactical version with the June 8 delivery to the Direction Générale de l'Armement procurement office. That plane included cockpit protection for the flight crew, among the contracted tactical capabilities.

The engine problems stem from the Avio propeller gearbox on the TP400-D6 engine from Europrop International, a consortium comprising ITP, MTU Aero Engines, Rolls-Royce and Safran Aircraft Engines.





Avio and its parent General Electric are delivering a modified pinion on the gearbox to fix cracks detected on the gearbox.





Airbus announced July 27 a further €1 billion ($1.1 billion) of financial charges on the A400M program due to the problems on the engine and fuselage. That came on top of €5 billion of charges previously booked for work on the airlifter.

The French Air Force has asked for the A400M to drop a full complement of 116 paratroopers jumping from both sides of the fuselage, with 58 from each side door. The requirements also include refueling helicopters in-flight and self-defense equipment. The service expects to have 11 units by the end of the year, with the three new units boosting the present eight-strong fleet."
Airbus's largest A350 jet stages maiden flight - Business Insider,"Thu, 24 Nov 2016 08:00:00 GMT",https://news.google.com/rss/articles/CBMiVWh0dHBzOi8vd3d3LmJ1c2luZXNzaW5zaWRlci5jb20vYWlyYnVzcy1sYXJnZXN0LWEzNTAtamV0LXN0YWdlcy1tYWlkZW4tZmxpZ2h0LTIwMTYtMTHSAVlodHRwczovL3d3dy5idXNpbmVzc2luc2lkZXIuY29tL2FpcmJ1c3MtbGFyZ2VzdC1hMzUwLWpldC1zdGFnZXMtbWFpZGVuLWZsaWdodC0yMDE2LTExP2FtcA?oc=5&hl=en-US&gl=US&ceid=US:en,"Europe's largest twin-engined passenger jet, the Airbus <AIR.PA> A350-1000, took to the skies for the first time on Thursday, seeking to grab the spotlight from Boeing's popular 777.

Advertisement

The lightweight carbon-fiber plane, 7 meters longer and able to carry 40 more people than A350s already in service, began a three-hour debut flight at 0942 GMT (4:52 a.m. ET), watched by some of the airline bosses who have invested in the $356 million jet.

The 366-seat A350-1000 is designed to break Boeing's <BA.N> virtual monopoly in the lucrative ""mini-jumbo"" segment, typically involving large twin-engined jets carrying 350 people.

It is a larger cousin to the new-generation A350-900, which entered service last year. Both are built from similar advanced materials to Boeing's mid-sized 787 Dreamliner in a race between planemakers for fuel savings and better passenger comfort.

The aircraft involved in Thursday's Toulouse debut is one of three test planes facing 1,600 hours of intensive flight testing before the A350-1000 enters service in the second half of 2017.

Advertisement

Fabrice Bregier, chief executive of the planemaking division of Airbus Group, told Reuters he was confident the A350-1000 would be delivered on time to launch customer Qatar Airways.

""It makes me very happy and very proud. We are flying according to the timetable we had planned,"" he said moments after the jet, weighing 230 tonnes, took off under leaden skies to applause from factory workers.

While the first flight of its latest model took place on time, Airbus is grappling with delivery delays to the earlier A350-900, clusters of which remain dotted around the airport in Toulouse, France, due to shortages of cabin equipment.

Related stories

Smaller A320neo jets are also parked with missing engines, due to delays in supplies from Pratt & Whitney, highlighting the strain on the industry of adding new technology while securing record production targets.

Advertisement

Airbus programs chief Didier Evrard said the planemaker continued to scrutinize its suppliers, notably France's Zodiac Aerospace <ZODC.PA>, which said this week it was on a path to recovery following a production crisis at its factories.

Asked about the progress displayed by cabin and other suppliers for the A350 family, Evrard told Reuters: ""It has improved, but it is not where it should be and we are watching them very carefully.""

He said the planemaker was working hard to achieve a target of 50 A350-900 deliveries for this year, having reached 34 so far, with a further plane due to be delivered later on Thursday.

""I have already cancelled my holidays,"" he added.

Advertisement

Airbus

Airbus says the A350-1000 will be 25 percent cheaper to operate than the competing Boeing 777-300ER, an older aircraft which weighs more but which has more seats in some layouts.

Boeing has responded to the A350-1000 by developing an even larger version of 777 able to seat over 400 people, making it the largest twin-engined jet when it enters service in 2020.

Airbus is also considering whether to go up in size with a further stretch of the A350, but senior marketing vice president Francois Caudron said it did not currently deem this necessary.

Industry sources say Airbus is nonetheless offering the potential ""A350-2000"" to influential buyers including Singapore Airlines <SIAL.SI> and British Airways <ICAG.L>.

Advertisement

Such a jet would need an enhancement of the Rolls-Royce <RR.L> Trent XWB engine that powers the A350-1000, already one of the industry's largest with a fan case large enough to swallow the fuselage of the now defunct Concorde.

Chris Young, programs director at the embattled UK engine manufacturer, which is in the midst of restructuring, said it would always be ready if needed to upgrade its engines or add new ones according to the needs of airplane manufacturers."
Aircalin orders two A330neo and two A320neo aircraft - Airbus,"Tue, 29 Nov 2016 08:00:00 GMT",https://news.google.com/rss/articles/CBMibmh0dHBzOi8vd3d3LmFpcmJ1cy5jb20vZW4vbmV3c3Jvb20vcHJlc3MtcmVsZWFzZXMvMjAxNi0xMS1haXJjYWxpbi1vcmRlcnMtdHdvLWEzMzBuZW8tYW5kLXR3by1hMzIwbmVvLWFpcmNyYWZ00gEA?oc=5&hl=en-US&gl=US&ceid=US:en,"Summary

New Caledonia selects world’s most fuel-efficient aircraft to upgrade its fleet

Aircalin CEO Didier Tappero: “Aircalin has made a strategic decision to renew its complete fleet with the A320neo and the A330neo to grow routes and connect New Caledonia to the region”

Aircalin, the Noumea based carrier in the French territory of New Caledonia has signed an agreement (MoU) for two A320neo single-aisle and two A330-900 wide-body aircraft. The agreement was finalised and signed at a ceremony in the capital Noumea attended by airline officials and Airbus executives.The A320neo engine choice will be made at a later date as will the cabin configuration of both aircraft types. The A320neo will be deployed on existing regional routes to Australia, New Zealand and the Pacific Islands. With the A330neo, Aircalin will boost services to Japan for onward connections and the possible opening of new routes such as to China.“As part of our plan to boost tourism to New Caledonia, Aircalin has made a strategic decision to renew its complete fleet with the A320neo and the A330neo to grow routes and connect New Caledonia to the region,” said Didier Tappero, Aircalin CEO. “The NEO aircraft with its state-of-the-art technology will burn less fuel, lower our operational costs and offer our loyal passengers the highest standards in cabin comfort.”Bernard Deladrière, Chairman of the Board and Member of New Caledonia Government asserted, “Aircalin is taking on an even more strategic step for its future, as it is about its profitability and its competitiveness.”“We are delighted that Aircalin has embraced our best-selling A330neo and A320neo Family aircraft to secure a successful, profitable future, and to grow tourist traffic to New Caledonia,” said Christopher Buckley, Airbus Executive Vice President, Europe Africa and Pacific. “Thanks to the unique commonality between all variants of the A320 and the A330, Aircalin will benefit from a seamless and cost effective transition to these exciting new aircraft, continuing with all the efficiencies they currently enjoy with their existing fleet.The A330neo is the most cost-efficient in its size category, offering a reduction in fuel burn of 14 percent per seat, an increase in non-stop flying range of up to 4000 nautical miles and the lowest maintenance costs of any aircraft.The A320 Family is the world’s best-selling single aisle product line with over 12,500 orders since launch and more than 7,000 aircraft delivered to some 400 customers and operators worldwide. Thanks to their widest cabin, all members of the A320 Family offer unmatched comfort in all classes and Airbus’ 18” wide seats in economy as standard."
Airbus looks to define A320 Airspace with tick-tock model in play - Runway Girl Network,"Tue, 08 Nov 2016 08:00:00 GMT",https://news.google.com/rss/articles/CBMiaGh0dHBzOi8vcnVud2F5Z2lybG5ldHdvcmsuY29tLzIwMTYvMTEvYWlyYnVzLWxvb2tzLXRvLWRlZmluZS1hMzIwLWFpcnNwYWNlLXdpdGgtdGljay10b2NrLW1vZGVsLWluLXBsYXkv0gEA?oc=5&hl=en-US&gl=US&ceid=US:en,"At the recent APEX EXPO in Singapore, the talking points from Airbus EVP strategy & marketing Kiran Rao and VP cabin marketing Ingo Wuggetzer were around the way key elements in aircraft cabins work together – from inflight connectivity, seatback entertainment and inflight power to the wider passenger experience and the benefits of the Internet of Things – and how advancements adopted on one type can trickle down (or indeed up) in the airframer’s portfolio.

The Airbus A350 version of this discussion is centered on the fact that the twinjet is a naturally “digital native aircraft”, while the A330 and re-engined A330neo will achieve their digital cred through Airbus’ “high-bandwidth connectivity” strategy, which now provides multiple high-speed Internet options to airlines.

Airbus is flight-testing its new High-Bandwidth Connectivity architecture, with retrofit orders from Finnair & Iberia. #PaxEx #APEXEXPO pic.twitter.com/RrP4QAzd39 — John Walton • @thatjohn.bsky.social (@thatjohn) October 25, 2016

As such, the European airframer’s work has begun to echo the “tick-tock” model followed by Intel, Apple and others, where one series of technological and #PaxEx innovations is made on the blanker canvas of the A350 platform, and then rolled out to the legacy A330 and A330neo architecture, as evidenced by the new Airspace cabin for these twinjets. Now Airbus is eyeing Airspace elements for the A320 family of narrowbody aircraft.

The golden thread of this work stretches back through the various A350 and A330neo cabin improvements announced over the past few years, from the recessed seat track power and entertainment cabling to the overhead bins, monuments and overall cabin presentation. Whether this is a carefully planned evolution of the message from Airbus for a twice-yearly cabin interiors news cycle, or whether it is reactive to developments — or perhaps a little of both — is difficult to determine. But the intertwining of the two aircraft is perhaps something that, while not expected, has reaped benefits.

“If you look at how we sold the A330 in the past, how we sold the A350, we tend to sell the aircraft in a pair,” Rao told Runway Girl Network. “So the airlines that buy A350s tend to buy A330s. Airlines that have already bought the A330s tend to buy A350s. And now that we are going into A330neos, airlines are tending to look at if they’ve already got an A350, then they’ll look at an A330neo. The concept that we’ve given to the airlines is that whole look and feel where you feel that you are in the same airplane. It’s right down to the minute detail of the latches on the lavatory doors or on the bins, the lighting features, etcetera. So now when passengers board the airplane, they get that same experience.”

“As you evolve something on the A330neo,” Rao said, “you will evolve it onto the A350. And then we’ll get to a point where we will transfer that down onto the A320s and we’ll transfer stuff up to the A380s. It will all evolve together, and it will take us a while to get to that stage, but let’s say when we get to the 2020s, you’ll start to then see all of the airplanes coming out — looking and feeling — with the Airspace brand.”

So when, RGN asked Rao, will the A320 Airspace cabin start appearing?

“The first A320s with an Airspace, we are already working on today. So we’re looking at what we would do to the entrance area. We are looking what we could do with the bins. We’ve had a program review with customers as to what they are expecting from the new shape of bins. Are they expecting passengers to bring more bags? Is turnaround time so important?”

All of these questions are being addressed at the moment. “So we are marching towards actually defining what an A320neo Airspace cabin would look like,” confirmed Rao.

Wuggetzer was more bullish on the definition dates. “At the latest by 2020,” he said.

With both the development of the A320neo Airspace cabin, and the work Boeing is doing for the 737 MAX family, the next three years look to be ripe with passenger experience developments.

Related Articles:"
H135 receives EASA certification for Helionix avionics suite - Airbus,"Tue, 15 Nov 2016 08:00:00 GMT",https://news.google.com/rss/articles/CBMidmh0dHBzOi8vd3d3LmFpcmJ1cy5jb20vZW4vbmV3c3Jvb20vcHJlc3MtcmVsZWFzZXMvMjAxNi0xMS1oMTM1LXJlY2VpdmVzLWVhc2EtY2VydGlmaWNhdGlvbi1mb3ItaGVsaW9uaXgtYXZpb25pY3Mtc3VpdGXSAQA?oc=5&hl=en-US&gl=US&ceid=US:en,"Summary

H135 joins Airbus Helicopters’ Helionix family. The new cockpit system reduces workload

Axel Humpert, Head of H135 Programme said: “The certification of the H135 with Helionix marks another milestone in the permanent evolution of this helicopter. The Helionix cockpit system with 4-axis autopilot significantly reduces the workload of the pilot and brings the H135 to an unrivalled level of safety due to the additional functions and mission features it adds to the H135’s capability.”Besides the 4-axis autopilot, Helionix offers an innovative cockpit layout which helps to increase situational awareness. Designed with three large electronic displays, the cockpit is Night Vision Goggle (NVG) compatible and includes a First Limit Indicator which highlights the appropriate engine instrument data for the pilot in one indicator. Thanks to two touchscreen GPS/Nav/Comm GTN-750, Helionix ensures an all-in-one GPS navigation and communication system. The Traffic Advisory System TAS620A, a system which improves flight safety by assisting pilots in detecting and avoiding aircraft intersecting their flight path, is another key feature delivered by the Helionix avionics suite.Initial deliveries of the H135 with Helionix cockpit will occur in 2017. Among the first commercial operators will be Norsk Luftambulanse AS, a Helicopter Emergency Medical Services (HEMS) operator. Ascent Flight Training, the UK Ministry of Defence’s (MOD) appointed Training Service Partner delivering for the UK’s Military Flying Training System (UKMFTS) selected Airbus Helicopters as the Aircraft Service Provider for the rotary wing element in May 2016. The UK MOD will be the first military customer.The H135 is the unbeaten market leader in light, twin-engine, multi-purpose helicopters. Traditional missions for this class of helicopters include emergency medical services, law enforcement, VIP and business passenger transport, maintenance of industrial wind parks and military training.Airbus Helicopters has delivered around 1,200 H135s to customers around the globe who have logged a total of more than four million flight hours.Airbus Helicopters, a division of Airbus Group, provides the most efficient civil and military helicopter solutions worldwide. Its in-service fleet includes nearly 12,000 helicopters operated by more than 3,000 customers in 154 countries. Airbus Helicopters employs more than 22,000 people worldwide and in 2015 generated revenues of 6.8 billion euros."
Airbus expects to sell around 670 jets in 2016 - Business Insider,"Wed, 02 Nov 2016 07:00:00 GMT",https://news.google.com/rss/articles/CBMiWGh0dHBzOi8vd3d3LmJ1c2luZXNzaW5zaWRlci5jb20vci1haXJidXMtZXhwZWN0cy10by1zZWxsLWFyb3VuZC02NzAtamV0cy1pbi0yMDE2LTIwMTYtMTHSAVxodHRwczovL3d3dy5idXNpbmVzc2luc2lkZXIuY29tL3ItYWlyYnVzLWV4cGVjdHMtdG8tc2VsbC1hcm91bmQtNjcwLWpldHMtaW4tMjAxNi0yMDE2LTExP2FtcA?oc=5&hl=en-US&gl=US&ceid=US:en,"Airbus's logo is seen during Japan Aerospace 2016 air show in Tokyo Thomson Reuters

HONG KONG (Reuters) - Airbus expects to sell around 670 aircraft this year, matching its planned deliveries, Mark Pearman-Wright, head of leasing and investor marketing, told the Airline Economics conference in Hong Kong on Wednesday.

Advertisement

Airbus Group officially targets more than 650 commercial deliveries, but the company's finance director last week told analysts that it actually would deliver more than 670.

Airbus posted 566 gross orders between January and September.

(Reporting by Tim Hepher; Editing by Muralikumar Anantharaman)"
