Titre,Date de publication,URL,Contenu
Airbus crafts 'disruptive' technology - AOPA,"Wed, 19 Nov 2014 08:00:00 GMT",https://news.google.com/rss/articles/CBMiTmh0dHBzOi8vd3d3LmFvcGEub3JnL25ld3MtYW5kLW1lZGlhL2FsbC1uZXdzLzIwMTQvbm92ZW1iZXIvMTkvYWlyYnVzLWlubm92YXRlc9IBAA?oc=5&hl=en-US&gl=US&ceid=US:en,"Airbus crafts 'disruptive' technology Aerospace giant backs aircraft large and small

The multinational giant whose name is long associated with airlines has invested recently in a few notable aviation development efforts on a smaller scale. The electric E-Fan, an all-electric prototype that made its first flight in March, will be certified as a two-seat trainer and four-seat general aviation aircraft, the company announced in July —the same month that a partnership with the Perlan Project , a team building a high-altitude glider primarily for scientific research, was announced . Less than two months later, Aerion, a company working to bring a supersonic business jet to market in 2021, announced it has also secured Airbus backing, an agreement that will provide engineering and certification support from Airbus that promises to accelerate Aerion’s effort .

One might think Airbus is suddenly aiming small, so to speak, perhaps establishing a beachhead in general aviation that Wichita, Kansas, companies might worry about.

All of that begged a question: Is Airbus moving into the turf of Textron, Cirrus, and the like? Not exactly, said Chairman and CEO Allan McArtor, who oversees Airbus Group, Inc. operations and strategy in North America and Latin America.

“Our intent really is not to enter the general aviation market per se,” McArtor said in a telephone interview. “That would be really a departure from our core business.”

The E-Fan project (presented in detail on the Airbus Group website) will indeed be built by a subsidiary created for the purpose, and “it might spin off rather interestingly,” McArtor said. Scaled up to 50 or 100 seats, however, it could become a hot ticket for airlines seeking a low-noise, zero emission people-mover that requires no jet fuel. “Now we’re talking.”

McArtor said a dedicated team is working with Aerion to develop and certify the Mach 1.4 business jet envisioned. Airbus Group will learn much along the way, though McArtor does not envision that particular aircraft being scaled up for the transportation market. Airlines, said the former airline executive and FAA administrator, are primarily focused on seat mile cost rather than speed.

“The sonic modeling that they’ve done, sonic laminar flow, is very interesting to us,” McArtor said. “We have no intention of building or offering a supersonic business jet, but we like their business plan … for the first mover, the first guy, there’s a legitimate market.”

McArtor said Perlan II, the plan to build a carbon fiber glider able to reach 90,000 feet or higher, is interesting because of the data it will be able to collect to advance understanding of the uppermost reaches of the atmosphere. It didn’t hurt that some members of the Airbus Group leadership team are glider enthusiasts, McArtor added.

These projects are higher visibility than some, but by no means the sum total of Airbus Group investments in innovation. McArtor said the company is backing research that goes beyond aviation and aerospace, and the Airbus Group website offers details on many efforts that extend beyond aviation and aerospace. (Airbus, meanwhile, offers a look at future concepts for commercial aviation here.)

“What we’re really well-known for is innovation,” McArtor said. “For more than 40 years that’s been our value add to the industry. I think you’ll see Airbus more visible in the future as we continue to explore these very, very interesting and some very disruptive technologies.”

Disruptive, you say?

McArtor offered a couple of teasers about what else is in the pipeline: antennas being developed to significantly improve satellite connectivity for aircraft, and laser-based measurement of airspeed and angle of attack that could prove particularly useful for helicopters, replacing pitot static systems unable to provide precise or accurate airspeed information below 40 knots.

Airbus Group opened an innovation and research hub on the campus of California Polytechnic State University in San Luis Obispo, California, in 2012, and McArtor said that is one of many collaborations with universities, laboratories, and other centers of innovation that promise to raise the company profile as a technology engine in the coming years.

“Best to just say stay tuned,” McArtor said."
Airbus applies to patent 'flying saucer' plane - CNBC,"Mon, 17 Nov 2014 08:00:00 GMT",https://news.google.com/rss/articles/CBMiUWh0dHBzOi8vd3d3LmNuYmMuY29tLzIwMTQvMTEvMTcvYWlyYnVzLWFwcGxpZXMtdG8tcGF0ZW50LWZseWluZy1zYXVjZXItcGxhbmUuaHRtbNIBVWh0dHBzOi8vd3d3LmNuYmMuY29tL2FtcC8yMDE0LzExLzE3L2FpcmJ1cy1hcHBsaWVzLXRvLXBhdGVudC1mbHlpbmctc2F1Y2VyLXBsYW5lLmh0bWw?oc=5&hl=en-US&gl=US&ceid=US:en,"The Airbus patent design Credit: espacenet

Aircraft manufacturer Airbus is hoping to patent a new plane that looks more like a doughnut or flying saucer than the usual cylinder-shaped passenger plane.



The France-based company filed a patent application at the end of October for a new type of aircraft, structured to limit the strain of cabin pressurization. The design also offers space for more passengers, who will sit in a 360 degree cabin, rather like an amphitheater. In the U.S. patent application, citing the investors as Patrick Lieven, Romain Delahaye and Catalin Perju, Airbus said that the usual ""cylindrical geometry"" of aircraft increased pressure at the front and back of planes and limited passenger-carrying capacity. ""The purpose of the invention is particularly to provide a simple, economic and efficient solution to these problems to at least partially overcome the above-mentioned disadvantages,"" the filing said.

Credit: espacenet"
Airbus Group Sells Part of Its Stake in Dassault Aviation - Airbus,"Fri, 28 Nov 2014 08:00:00 GMT",https://news.google.com/rss/articles/CBMic2h0dHBzOi8vd3d3LmFpcmJ1cy5jb20vZW4vbmV3c3Jvb20vcHJlc3MtcmVsZWFzZXMvMjAxNC0xMS1haXJidXMtZ3JvdXAtc2VsbHMtcGFydC1vZi1pdHMtc3Rha2UtaW4tZGFzc2F1bHQtYXZpYXRpb27SAQA?oc=5&hl=en-US&gl=US&ceid=US:en,"Airbus Group (stock exchange symbol: AIR) in an off-market block trade has sold to Dassault Aviation a total of 810,072 Dassault Aviation shares at a price of € 980 per share, representing a total amount of around € 794 million pre transaction costs.

The French State has agreed to waive its rights under the shareholder agreement with Airbus Group, which provides in particular a right of first offer to its benefit, for this block trade, which represents approximately 8 percent of Dassault Aviation’s share capital.

After this transaction, Airbus Group will hold 38.32 percent of Dassault Aviation’s share capital and associated voting rights and then following the cancellation by Dassault Aviation of 9 percent of treasury shares, Airbus Group will own 42.11 percent of the Dassault shares with associated voting rights. In this context, Airbus Group will solicit from the Autorité des marchés financiers (AMF) an exemption to the requirement to launch a public offer.

Further to today’s block trade, Airbus Group has provided a best efforts commitment until 30 June 2015 to sell up to 10 percent of Dassault Aviation’s share capital, subject to market conditions. This additional transaction should take place in the form of an accelerated book-building through either one or several placements. Airbus Group will have the ability to increase the size of the placements beyond this 10 percent of Dassault Aviation’s share capital.

Dassault Aviation has committed to support the implementation of these efforts and will place an order on 50 percent of the size of such placements, within a global limit of 5 percent of Dassault Aviation’s share capital, at a maximum price of € 980 per share. Airbus Group has committed to serve Dassault Aviation with 50 percent of the shares sold and within the same global limit of 5 percent of Dassault Aviation’s share capital, at the price of the relevant placement. Should the placement price be higher than € 980, the price of the Dassault Aviation shares sold at the same time to Dassault Aviation would be capped thereat while the price of the shares sold to third parties would remain the same.

“This transaction marks an important step in our stated intentions to monetise our stake in Dassault Aviation. Furthermore, we have retained market and timing flexibility, together with support from Dassault Aviation, that should allow us to optimise further monetisation steps during 2015,” said Marwan Lahoud, Airbus Group Chief Strategy and Marketing Officer.



About Airbus Group

Airbus Group is a global leader in aeronautics, space and related services. In 2013, the Group – comprising Airbus, Airbus Defence and Space and Airbus Helicopters – generated revenues of € 57.6 billion (restated) and employed a workforce of around 138,000 (restated).

Contacts:

Martin Agüera + 49 (0)175 227 4369 Rod Stone + 33 (0) 6 30 52 19 93 Matthieu Duvelleroy + 33 (0) 1 42 24 24 25

Summary"
"Airbus interview: research, innovation and the future of aviation - ComputerWeekly.com","Tue, 04 Nov 2014 08:00:00 GMT",https://news.google.com/rss/articles/CBMibmh0dHBzOi8vd3d3LmNvbXB1dGVyd2Vla2x5LmNvbS9uZXdzLzIyNDAyMzM5NDgvQWlyYnVzLUludGVydmlldy1yZXNlYXJjaC1pbm5vdmF0aW9uLWFuZC10aGUtZnV0dXJlLW9mLWF2aWF0aW9u0gEA?oc=5&hl=en-US&gl=US&ceid=US:en,"Research and innovation is at the core of the Airbus business strategy. From creating lighter, quieter aircraft to implementing augmented reality for passengers in the cabin, the aircraft manufacturer is on the bleeding edge of design and technology. And IT plays a substantial role in creating the aircraft of the future.

Airbus research and development spend is among the highest in the world, standing at €3.1bn. Some 800 researchers work on its technical excellence strategy, which is shaped around 20 key technology strategies.

Simon Bradley, vice-president head of global innovation network, systems and product architecture and engineering at Airbus Group, said one of the really interesting areas is advanced manufacturing and the factory of the future, which uses processes and tools including 3D printing in the aerospace industry.

“The challenge is the things we make are very large and there’s a lot of investment involved in building an aircraft,” says Bradley.

He explains that it can be challenging to introduce disruptive technologies such as 3D printing to production lines which already work very well, often churning out 40 aircraft every month.

And the design, development, production and ongoing support process is enormously long. “When you look at the life of an aircraft, from the time someone puts it on a piece of paper, designs, tests and puts it into the world – it could potentially be 75 years,” says Bradley.

Software and hardware And 75 years is a long time when it comes to software. The Airbus A380 has 120 million lines of code. “When considering 120 million lines of software over a 75-year period, think about safety and quality – you can’t just bring it back for a quick software upgrade,” says Bradley. “And the international space station, the software that went up there, barring some updates, it has to work – you can’t send a software engineer into space.” More on Airbus Airbus deploys modular datacentre strategy to boost HPC capacity

British Airways unveils its new Airbus A380

CIO interview: Guus Dekkers, Airbus CIO

Airbus looks north to reduce datacentre energy costs

Air France Airbus crash: its last few minutes? When building the A300 craft, Airbus had to maintain a complete library of all the code that was around in the 1970s. Additionally, aircraft require single-core processors which, in a smart technology market, are not easy to get hold of. “When building an aircraft, we have to stock up and buy lots of single-core processors, which is a major challenge,” he says, explaining that chip manufacturers no longer have an interest in making single-core processors. When building a new craft, Airbus stockpiles a lot of single-core processors, meanwhile the manufacturer also owns its own clean rooms and component manufacturing facilities to build some of these rare computing parts. “We’re working with some of the chip manufacturers on getting multi-core certified for flight, but there are a lot of hoops and we represent a small part of the market compared with smartphones,” he says. “It’s supply and demand.”

Big data While on-board software aids in aircraft operations, the planes are also fitted with thousands of sensors which store information. An Airbus 320 takes off or lands every 2.5 seconds somewhere in the world. Every 30 minutes they generate 1TB of information – that’s a lot of terabytes Simon Bradley, Airbus Group “If you fly from London to Paris, typically you’ll be on an Airbus 320 small family aircraft. One of those takes off or lands every 2.5 seconds somewhere in the world. Every 30 minutes they generate 1TB of information – that’s a lot of terabytes,” says Bradley. Gathering this volume of data helps Airbus manage fleet maintenance, predict weather patterns, plan efficient routes and maximise flight efficiency. While some information gets transmitted back to base while in flight, the majority of maintenance information isn’t considered a priority and is gathered as the plane approaches the gate. Using this information, Airbus can look at a specific part that will soon need replacing, say in three months’ time, and can find out in advance where that plane is going to be so the part can be shipped to the designated airport. This use of data is called predictive maintenance. Airbus also uses predictive maintenance for its defence and space craft. “The interesting big data challenges are not in the production, but the design of a product,” says Bradley. “If you want to change the shape of a wing or helicopter body, it traditionally takes two to three days to recompute all of the design parameters. We’re looking at new mathematical algorithms to reduce that to 30 minutes.” Many airlines recognise the benefits of a big data strategy, according to Bradley.

Customer experience Meanwhile, airlines are also using big data to improve passengers’ journey through the airport and provide them with information about their flight. “Quite a few people don’t bother with boarding cards, using their smartphones instead,” notes Bradley. “Five years ago, that concept didn’t exist, but BA now shows where I’ve flown in the past 10 years, how many times, where I’m going – it’s all about improving the customer experience.” Airbus is also concentrating on the customer experience factor, by researching how to create next-generation cabins at its innovation centre in Hamburg. Bradley says the company is looking to augmented reality to help improve the passenger experience, as well as lighting technologies to change the interior lights to match the time zone to reduce jet lag. “We’re also looking at state-of-the-art OLED screens for the side of the aircraft so you can look out and picture the destination you’re going to,” he says. “You could then use your tablet to find information. For example, if you’re flying to Singapore we could give you a tour projected onto the back of the seat in front of you.”"
Flying doughnut: Airbus files patent for new plane - MPR News,"Mon, 17 Nov 2014 08:00:00 GMT",https://news.google.com/rss/articles/CBMiNmh0dHBzOi8vd3d3Lm1wcm5ld3Mub3JnL3N0b3J5LzIwMTQvMTEvMTcvYWlyYnVzLXBhdGVudNIBAA?oc=5&hl=en-US&gl=US&ceid=US:en,"Airbus' patented design for amphitheater-like seating.

Airbus has filed a patent for a new plane that looks decidedly more Star Trek Enterprise than airplane.

The Financial Times dubbed it ""flying doughnuts."" According to the patent application, the craft would address a long-standing problem for plane designers — pressurized cabins, which stress planes on the front and back ends and require heavy, reinforced frames.

The patent says the new design would distribute that pressure in a way that would be more ""economic and efficient.""

Airbus says the design also has an additional benefit: Seating passengers in a circle, doughnut-style, allows for more fliers than the old-fashioned paper-towel-holder-with-two-wings.

Create a More Connected Minnesota MPR News is your trusted resource for the news you need. With your support, MPR News brings accessible, courageous journalism and authentic conversation to everyone - free of paywalls and barriers. Your gift makes a difference.

""An approximately cylindrical geometry limits possibilities for increasing the passenger carrying capacity of the aircraft,"" the patent says.

Airbus spokesman Justin Dubon, though, told NPR that the design is not currently in production — and may never be. Dubon says the company files more than 600 patents every year.

""Some of these become the seed for other ideas with practical use,"" he says.

Still, Dubon says, ""There are some very clever people here that have fantastic ideas. And who knows? Maybe one day they will come to light.""

In the meantime, Airbus may want to start redesigning the drink carts to handle curves. Copyright 2019 NPR. To see more, visit https://www.npr.org."
"Airbus Aims to Boost Capacity, Quality with New Mobile Facility - Aviation Pros","Tue, 25 Nov 2014 08:00:00 GMT",https://news.google.com/rss/articles/CBMilwFodHRwczovL3d3dy5hdmlhdGlvbnByb3MuY29tL3Rvb2xzLWVxdWlwbWVudC9pbnN1cmFuY2UtZmluYW5jZS9haXJjcmFmdC9hcnRpY2xlLzExNzA2MjQzL2FpcmJ1cy1haW1zLXRvLWJvb3N0LWNhcGFjaXR5LXF1YWxpdHktd2l0aC1uZXctbW9iaWxlLWZhY2lsaXR50gEA?oc=5&hl=en-US&gl=US&ceid=US:en,"Labeling the A320 family “the hottest-selling … in the industry,” Allan McArtor, chairman and CEO of Airbus Group Inc., says business in the airframer’s single-aisle arena is “disturbingly good” – so good that it faces a “huge backlog.”

Cutting that backlog – and improving quality – are key reasons Airbus opted to build a final assembly facility at Mobile Aeroplex at Brookley, the site of a former Air Force base. Airbus’ piece of the price is $600 million.

“We’ve got to get our capacity up,” says McArtor. “The Mobile assembly facility will allow us to increase our monthly rate on the [A320] family…significantly. It’s coming along exactly at the right time.”

Consider, as of August 2014 Airbus had booked firm orders for some 3,257 A320-family neos [new engine option] aircraft. That’s a significant slice of the 10,500-plus overall orders booked to date in a program first launched back in 1984.

Quantity drove Airbus to embrace the Gulf Coast. “We think it’s going to allow us to increase our market share in the U.S.,” says the man who oversees Airbus companies in the Americas. But the impetus for the move had more to it than that. “To be honest with you, we’re struggling with quality and on-time delivery in some of our European assembly facilities,” says McArtor. “We’re looking to Mobile to set a new standard for quality, and on-time deliveries.”

Construction of the facility is well underway on the shores of Mobile Bay. Plans are for assembly to begin in 2015, followed by delivery of Mobile-assembled aircraft in 2016. The goal is for four A320-family aircraft to roll off that assembly line per month by 2017.

That projection is predicated on the premise “that the supply chain can stay up” with demand says McArtor. In keeping with Airbus’ policy of spreading major component assembly (MCA) manufacturing among various countries, MCAs will be shipped to nearby docks abutting Mobile Bay – wings, fuselages, empennages, nose sections, and such. Then there are shipping containers packed with parts and engine pylons. The latter will be mated to the powerplants themselves close to the Brookley facility.

Slow, Measured Start-up

While the hot new A319, A320, and A321neos – with available fuel-efficient engine options of either Pratt & Whitney PW1100Gs or CFM LEAP1As – are dominating the order book just now, McArtor says Mobile will start out by producing traditional A320-family ceo, or current engine option, aircraft.

McArtor says Airbus is going that route “in order to make sure that the jigs and tools in Hamburg are mature for the neo … It’s not really a work force issue. It’s tooling. We don’t want to run the tooling for both ceo and neo” at the same time.

It appears the first craft off the Mobile line will be bound for nearby Atlanta-based Delta Air Lines. McArtor says the carrier recently increased its A320ceo order by 15 airplanes. “They’re to be delivered in 2017, and they want them out of Mobile.”

Plans are to finish the Delta order and then convert the line to an all-neo affair. McArtor thinks most of the subsequent aircraft will be the stretched A321 variant, and that they’ll sport fuel-saving ‘sharklet’ wingtips.

The 116-acre facility aims to be as efficient as possible, producing as many as 50 narrowbodies per year by 2018. One of the ways Airbus intends to do that is by eliminating a couple to station stops along the line says McArtor. The idea is to do “more precise, more efficient and high-quality work at each stop” along the final assembly line. Enabling that added quality, he says, is that “We’ll have better alignment tools available to us.”

The hoped-for result: the most efficient assembly process “in our entire global system,” asserts McArtor – this by virtue of incorporating lessons learned at other Airbus facilities.

Why Mobile?

Airbus has a history when it comes to Mobile. It was at Brookley that the airframer proposed to build its A330 tanker variant for the United States Air Force, a contract that ultimately went to Boeing. It thoroughly vetted Mobile’s proposal – geographically and demographically – before settling on Mobile Aeroplex at Brookley for the hoped-for tanker work. “We needed access to a deep-water port, as well as an airport,” says McArtor. The icing on the cake was that the seaport and airport were right next to one another.

After the tanker loss Airbus decided “not just to fold the tent” on future relationships with Mobile says McArtor. The idea was to “see what else we might be able to do” at the prime piece of Gulf Coast property. It took a year for the company to work up a business case for a single-aisle line at Brookley. The fact that the site would serve the largest single-aisle market on the planet, the United States, didn’t hurt. Nor did Mobile’s southern U.S. proximity to growing Latin American demand.

The Gulf Coast givith, and it taketh away – the latter often in spectacularly catastrophic fashion.

On September 12, 1979, Hurricane Frederic swept into normally placid Mobile Bay, producing winds in excess of 125 miles per hour and a storm surge of between 12 and 15 feet. Before it arrived, a half-million residents fled. By the time it departed billions of dollars in damage lay in its withering wake.

Airbus is not unaware of this. “Nothing’s hurricane-proof,” accedes McArtor. But, “We’re very comfortable with the fact that the facility and its infrastructure will be as solid as we can possibly make it.”

Airbus’ America’s chief believes the real risk lies less with the disruption the wind and tides wreak themselves as with what would happen with the work force.

Airbus intends to employ about 1,000 people at Mobile Aeroplex at Brookley. While McArtor insists, “the facility itself is very survivable,” he says worker access to Brookley, power supply and the infrastructure of the city itself in the wake of a hurricane could pose the biggest problems.

Such are the geographics. Demographically, Airbus is recruiting the lion’s share of its employees from the Gulf Coast. So far, competition has been keen. McArtor says there have been some 100 applicants for every job vacancy. “We were encouraged by the talent attracted to the automobile industry in Alabama.”

He contends, “The level of talent has been remarkable,” and not just when it comes to sheet metal folks. He notes that while some European Airbus people assumed highly skilled positions such as quality assurance engineer would have to go to European expatriates assigned to America, “To their surprise” they discovered the southeastern regional talent pool in the U.S. contains not just applicants of comparable talents, “but probably better talent than [Airbus has at its facilities] in Hamburg and Toulouse.”

Most of the Mobile jobs require experience, and that – so far – Airbus hasn’t had any problems in filling positions. Down the road it’s working with Alabama Industrial Training, or ADIT to keep the talent flow going. “They’ve created a training facility on-site [at Mobile Aeroplex at Brookley]. “It’s a beautiful facility for skills training,” says McArtor. “And they have a relationship with junior colleges and vocational/technical schools.”

Geography, demography, and an insistent demand for more airplanes. Allan McArtor and Airbus believe they auger well. “The [Mobile] program’s got legs,” he says. “It will be around for a long time.”"
