Titre,Date de publication,URL,Contenu
Airplane rivals launch joint biofuel project - Phys.org,"Thu, 22 Mar 2012 07:00:00 GMT",https://news.google.com/rss/articles/CBMiQGh0dHBzOi8vcGh5cy5vcmcvbmV3cy8yMDEyLTAzLWFpcnBsYW5lLXJpdmFscy1qb2ludC1iaW9mdWVsLmh0bWzSAT9odHRwczovL3BoeXMub3JnL25ld3MvMjAxMi0wMy1haXJwbGFuZS1yaXZhbHMtam9pbnQtYmlvZnVlbC5hbXA?oc=5&hl=en-US&gl=US&ceid=US:en,"Plane makers and bitter rivals Airbus of Europe, Boeing of the US and Embraer of Brazil announced on Thursday a joint plan to develop affordable biofuels for the airplane industry.

Plane makers and bitter rivals Airbus of Europe, Boeing of the US and Embraer of Brazil announced on Thursday a joint plan to develop affordable biofuels for the airplane industry.

The airplane sector leaders agreed to seek opportunities ""to speak in unity"" to government and biofuel producers ""to support, promote and accelerate the availability of sustainable new jet fuel sources,"" a joint statement from the companies said.

The collaboration is intended to come up with a so-called ""drop in"" technology that all airplane models could use, regardless of the make.

Airbus and Boeing have already launched programmes independently to develop alternatives to kerosene, a major greenhouse gas pollutant, to power its airplanes.

""We are all committed to take a leading role in the development of technology programmes that will facilitate aviation biofuels development and actual application faster than if we were doing it independently,"" said Paulo César Silva, Embraer chief executive.

The planemakers said they were committed to reducing the industry's substantial carbon footprint, the term commonly used for emissions of greenhouse gases.

""We've achieved a lot in the last 10 years in reducing our industry's (carbon) CO2 footprint -- a 45 percent traffic growth with only three percent more fuel consumption,"" Airbus chief executive Tom Enders said.

Airbus on Wednesday announced a collaboration with airline Virgin Australia to explore biofuel production from eucalyptus leaves that grow in arid regions.

(c) 2012 AFP"
King Juan Carlos I of Spain becomes first head of state to fly in Airbus Military A400M - Skies Magazine,"Fri, 02 Mar 2012 08:00:00 GMT",https://news.google.com/rss/articles/CBMiZmh0dHBzOi8vc2tpZXNtYWcuY29tL3ByZXNzLXJlbGVhc2VzL2tpbmctanVhbi1jYXJsb3MtaS1vZi1zcGFpbi1iZWNvbWVzLWZpcnN0LWhlYWQtb2Ytc3RhdGUtdG8tZi1odG1sL9IBamh0dHBzOi8vc2tpZXNtYWcuY29tL3ByZXNzLXJlbGVhc2VzL2tpbmctanVhbi1jYXJsb3MtaS1vZi1zcGFpbi1iZWNvbWVzLWZpcnN0LWhlYWQtb2Ytc3RhdGUtdG8tZi1odG1sLz9hbXA?oc=5&hl=en-US&gl=US&ceid=US:en,"King Juan Carlos I of Spain has today become the first head of state to fly in the Airbus Military A400M new-generation military airlifter which is assembled in Seville. With Airbus Chief Test Pilot Military, Edward “Ed” Strongman, and Experimental Test Pilot, Ignacio Nacho Lombo, the King of Spain made a local flight of some 40 minutes from the Torrejon base near Madrid.

During the flight the King, who qualified as a military pilot, took control of the aircraft for 20 minutes at around 10,000 feet altitude and performed a series of manoeuvres including turns and a simulated delivery of humanitarian supplies.

The King was accompanied by the Spanish Industry Minister, Jose Manuel Soria, the president and CEO of Airbus, Tom Enders, the president and CEO of Airbus Military, Domingo Ureña and the Head of Flight and Integration tests of Airbus, Fernando Alonso.

The picture shows His Majesty with the Head of Flight and Integration tests of Airbus, Fernando Alonso, inside the cockpit of the A400M.





About A400M

The A400M is an all-new military airlifter designed to meet the needs of the world’s Armed Forces in the 21st Century. Thanks to its most advanced technologies, it is able to fly higher, faster and further, while retaining high manoeuvrability, low speed, and short, soft and rough airfield capabilities. It combines both tactical and strategic/logistic missions. With its cargo hold specifically designed to carry the outsize equipment needed today for both military and humanitarian disaster relief missions, it can bring this material quickly and directly to where it is most needed. Conceived to be highly reliable, dependable, and with a great survivability, the multipurpose A400M can do more with less, implying smaller fleets and less investment from the operator. The A400M is the most cost efficient and versatile airlifter ever conceived and absolutely unique in its capabilities.

About Airbus Military

Airbus Military is the only military and civic/humanitarian transport aircraft manufacturer to develop, produce, sell and provide support and services for a comprehensive family of airlifters with a payload range of three to 45 tonnes. An Airbus subsidiary, Airbus Military is responsible for the A400M programme, the A330 Multi Role Tanker Transport (MRTT) and further military derivatives based on Airbus civil aircraft. These, together with the smaller ‘Light & Medium’ C295, CN235 and C212, make Airbus Military the global leader in the market for military transport, tanker and surveillance aircraft capable of performing the most varied types of missions. Altogether, Airbus Military has sold more than 1,000 aircraft to some 130 military, civil and governmental customers. More than 800 of these aircraft have been delivered. Airbus is an EADS company."
A330 MRTT (Multi-Role Tanker Transport) adds two new combat types: UAE Mirage 2000 and F-16 Block 60. And does ... - The Aviationist,"Tue, 27 Mar 2012 07:00:00 GMT",https://news.google.com/rss/articles/CBMiN2h0dHBzOi8vdGhlYXZpYXRpb25pc3QuY29tLzIwMTIvMDMvMjcvYTMzMC1tcnR0LXRhbmtlci_SAQA?oc=5&hl=en-US&gl=US&ceid=US:en,"Airbus Military has been very busy recently adding another two combat types able to be refueled from its A330 MRTT tanker aircraft, which has been ordered in three examples by the UAE Air Force.

The company, which is part of the EADS conglomerate, has performed several test flights out of Al Dhafra airbase near Abu Dhabi with the UAE AF F-16 Block 60 and the Mirage 2000 fighters. The tests, which included aerial refueling during climbs, descents, turns as well as straight and level flight were performed at a range of altitudes and speeds.

Even if the F-16 has already been qualified to be refueled from the A330 tanker this was the first time a Block 60 with the large conformal fuel tanks and a slightly different wake footprint than the older version of the F-16, has taken on fuel. Tests have involved aircraft in various loadouts.

The same tests were also performed on the Mirage 2000, including the two seat version with different loadouts as well as different fuel loads.

During the refueling tests of the Mirage the two underwing refuelling pods were used both to refuel a single jet and two jets at the same time. The F-16, that in the past were tested with a removable IFR (In-Flight Refueling) probe to take fuel from a hose-and-drogue tanker, used the Air Refuelling Boom System (ARBS).

For those interested in tracking some air-to-air refueling flights, please consider that they often appear on both Planefinder and Flightradar24 since the A330 MRTT broadcasts full ADS-B data from its Mode-S transponder.

For instance, using the radio callsign “CASA 013” the A330 EC-339 could tracked on Mar. 20, 2012 performing a refueling mission between FL240 and FL280. Click here to see the route followed by the MRTT during that sortie.

The track flown on Mar. 19, 21, 22 and 25 can be found as well using the playback feature of FR24.com.

Antonio Caramazana, Vice President Programme Director Airbus Military Derivatives, said: “It is very satisfying to qualify another two aircraft type as receivers for the A330 MRTT and we look forward to entry into service with the UAE Air Force later this year.”

The air crew training for the A330 with UAE pilots is currently taking place in Spain with the first two MRTT’s due to be delivered before the end of the year. The training of the aircrew takes place at Airbus’ training facility near Madrid and included not just the pilots but the refuelling operators too all using state of the art simulators.

Written with The Aviationist’s Editor David Cenciotti



Image by Richard Clements"
‘An Airbus as Sai Baba museum’ - The Indian Express,"Sun, 25 Mar 2012 07:00:00 GMT",https://news.google.com/rss/articles/CBMiUWh0dHBzOi8vaW5kaWFuZXhwcmVzcy5jb20vYXJ0aWNsZS9pbmRpYS9sYXRlc3QtbmV3cy9hbi1haXJidXMtYXMtc2FpLWJhYmEtbXVzZXVtL9IBVmh0dHBzOi8vaW5kaWFuZXhwcmVzcy5jb20vYXJ0aWNsZS9pbmRpYS9sYXRlc3QtbmV3cy9hbi1haXJidXMtYXMtc2FpLWJhYmEtbXVzZXVtL2xpdGUv?oc=5&hl=en-US&gl=US&ceid=US:en,"An Airbus A-320 riding atop what is reported to be a 100-wheel trailer brought traffic to a halt on the GT Karnal Road on Saturday,leading to a jam almost 50-km-long.

The owner of the aircraft,Pitampura-based property dealer Rakesh Dikshit (40),says he had bought it as scrap in an Air India auction almost two months ago. The airplane,says Dikshit,cost him Rs 18 lakh.

The businessman has novel plans for his new purchase  he got the possession on Friday. A devotee of Shirdi Sai Baba,Dikshit wants to station the aircraft shell in Alipur and convert it into a museum of Shirdi Sai Baba.

Advertisement

What Dikshit did not factor in was the transportation of the airplane,whose wings and tail have been clipped off and seats and baggage space have been removed.

I dont know much about planes. This is the first I bought and its name is A-320. I was transporting it today in a big open truck,which has as many as 100 tyres. The trailer could not turn at the Alipur crossing,just before the Kondli border. So the traffic got stuck, Dikshit told Newsline over the phone.

He says he was then informed that he could not transport something so big before midnight.

The Delhi Traffic Police said the pile-up was reported around noon. This man was allegedly bringing the scrap plane from the airport and it got stuck at a turn just beyond the Palla Mor. He was prosecuted for dangerous driving and asked to resume transportation at a lean (traffic) period, said Satyendra Garg,Joint CP (Traffic).

Advertisement

DCP (Outer) B S Jaiswal told Newsline there was no law and order situation,only a lot of curiosity,which led to a long traffic jam.

The initial rumours were that a plane has crash landed in that area. People are just interested in looking at a plane,nothing else, said Jaiswal.

Till late evening,the aircraft was parked by the Alipur road.

Dikshit says he plans to have a museum as grand as the temple in Shirdi for Sai Baba. I will have idols,pictures,literature,utensils and all the things used by Sai Baba, he says.

He has thought out all

Advertisement

the details. There is a Sai Baba temple in Alipur. The land is of Sai Baba Trust,and the trust is mine. Why should anyone stop me from keeping this plane,which I bought as scrap,on my own land? Or do what I wish to do with it? I have as much as 2,100 square yards to keep the plane and make my museum, he says.

An Air India spokesperson said auctions are held of aircraft older than 20 years and out-of-use. We auction parts that are of no use. If there is anything that can be taken out or used,it is. What is auctioned as scrap is just the outer shell, he said.

Another AI official said there are at least nine scrap aircraft of the airline at the hangers of IGI Airport. We give out two types of contracts  garbage and scrap. This was scrap, the official said."
Junk Airbus Bought By Delhi Scrap Dealer Reaches Sai Baba Temple - India TV News,"Sun, 25 Mar 2012 07:00:00 GMT",https://news.google.com/rss/articles/CBMicmh0dHBzOi8vd3d3LmluZGlhdHZuZXdzLmNvbS9uZXdzL2luZGlhL2p1bmstYWlyYnVzLWJvdWdodC1ieS1kZWxoaS1zY3JhcC1kZWFsZXItcmVhY2hlcy1zYWktYmFiYS10ZW1wbGUtMTUxNzQuaHRtbNIBdmh0dHBzOi8vd3d3LmluZGlhdHZuZXdzLmNvbS9hbXAvbmV3cy9pbmRpYS9qdW5rLWFpcmJ1cy1ib3VnaHQtYnktZGVsaGktc2NyYXAtZGVhbGVyLXJlYWNoZXMtc2FpLWJhYmEtdGVtcGxlLTE1MTc0Lmh0bWw?oc=5&hl=en-US&gl=US&ceid=US:en,"Follow us on junk airbus bought by delhi scrap dealer reaches sai baba temple

New Delhi, Mar 25: The junk Airbus A320 bought for Rs 18 lakh from Air India by a Pitampura based scrap dealer Rakesh Dixit ultimately reached its destination - the Sai Baba temple on Alipur Main Road on Sunday morning.

The Airbus scrap was held up at Narela on Saturday morning after it caused huge traffic snarls with hundreds of onlookers obstructing the path of the truck trailer carrying the aeroplane scrap.The 18-wheel 150-feet long trailer proceeded last midnight towards Alipur and reached the Sai Baba temple this morning.An elated priest of the temple Pandit Surendra Mishra said, Sai portraits will be kept inside the plane and prayers would take place.Rakesh Dixit had got the temple built several years ago through a trust. He decided to buy the Airbus scrap from Air India to create, what he calls, a museum.Dixit says he bought the aeroplane scrap from Air India two months ago for Rs 18 lakhs, but he got permission to remove it only on Friday.The Airbus A320 is 125 feet long and 114 feet wide and weighs 26 tonnes. The wings alone measure 100 feet. The seats and other fittings were removed before the auction.Dixit says it will take at least six months to make the aeroplane Sai Museum at a cost of Rs 10-15 lakh additionally.The Airbus A320 was grounded after serving Air India for over 20 years."
Hopes up for Airbus C295 battlelifter for ADF - Australian Defence Magazine,"Fri, 09 Mar 2012 08:00:00 GMT",https://news.google.com/rss/articles/CBMiX2h0dHBzOi8vd3d3LmF1c3RyYWxpYW5kZWZlbmNlLmNvbS5hdS9uZXdzL2hvcGVzLXVwLWZvci1haXJidXMtYzI5NS1iYXR0bGVsaWZ0ZXItZm9yLWFkZi1wcmVtaXVt0gEA?oc=5&hl=en-US&gl=US&ceid=US:en,"Airbus Military has signed a firm contract with the Ministry of Defence of Kazakhstan, to supply two C295 military transport aircraft plus the related service support package for spare parts and ground support equipment.

The aircraft will be operated by the Kazakh Air Force in support of transport missions throughout the nation’s vast territory.

Additionally, a Memorandum of Understanding (MOU) has been signed for a further six C295 aircraft, for which separate firm contracts will be signed progressively over the next few years.

The first two aircraft will be delivered by April 2013 and for the remaining six aircraft a delivery schedule will be defined over the following years.

All of which brings us to Australia's own requirement for a battle lifter to replace the Caribou and improved prospects for the C-295 versus the Alenia C-27J – a mini-C130 which, due to its acquisition by the US military and thus the opportunity for interoperability support benefits, was preferred by the RAAF.

But US defence cuts have forced the early retirement of the C-27J fleet and thus raised concerns about long term support and the future availability of spares.

Indeed the head of Alenia is reported as saying the company would refuse to support the 21 C-27J aircraft that the US has bought so far (from an original 145 aircraft deal) if onsold to another country such as Australia, Canada or Taiwan.

Alenia has since released information to the effect that it would support an Australian C-27J regardless of the acquisition strategy the government pursues.

The Australian government announced last year that the C-27J was first choice because it could perform the Caribou role and was in US service.

But the head of Airbus Military's Australian program, Valentin Merino, says the claimed benefits of Australia buying the C-27J through FMS were fast disappearing with questions now over sustainment and supportability of the Australian fleet.

In a briefing to journalists this week, Airbus Military was keen to emphasise the importance of a competition that would generate tender quality data for the commonwealth to work from.

This would also give the C295 a chance to see if the carrying of a single G Wagon was really the priority concern cited by the RAAF.

Given that the new G Wagon is unable to be reversed into a C130J, let alone either a C295 or C-27J, thanks to the height of the new modules on the back, the company has questioned the doctrine behind such a consideration.

When would a single G Wagon be deployed?

Given the Air 8000 will be going to government for consideration in the coming months, we shall watch with baited breath to see what road government pursues."
IN FOCUS: Manufacturers aim for more comfortable cabin climate - Flightglobal,"Mon, 19 Mar 2012 07:00:00 GMT",https://news.google.com/rss/articles/CBMiaWh0dHBzOi8vd3d3LmZsaWdodGdsb2JhbC5jb20vaW4tZm9jdXMtbWFudWZhY3R1cmVycy1haW0tZm9yLW1vcmUtY29tZm9ydGFibGUtY2FiaW4tY2xpbWF0ZS8xMDQ0MzEuYXJ0aWNsZdIBAA?oc=5&hl=en-US&gl=US&ceid=US:en,"Higher cabin pressurisation and air humidification levels are heralded as major improvements in passenger comfort made possible by the shift from aluminium to carbonfibre airframes. Boeing and Airbus have different technological strategies to enhance the air quality on board the 787 and A350, but the jury is still out on which will be the more effective approach, and whether a better cabin climate really depends on the fuselage material.

Boeing decided to build the 787 largely from carbonfibre reinforced plastic (CFRP) because of the lighter weight and better fatigue behaviour of composite versus traditional metal. It is this latter point that allows higher fuselage pressurisation - and thus a lower cabin altitude - on regular flights.

Conventional aluminium aircraft can be inflated beyond their operational standards, but the greater structural strain will reduce their lifetime. For the 787, Boeing was able to lower the maximum cabin altitude from 8,000ft (2,440m) on previous models to 6,000ft.

© Boeing Boeing has installed an environmental control system on the 787 which should provide more even humidity levels

Airbus followed suit by launching the carbon composite A350 in 2006, also targeting a maximum cabin altitude of 6,000ft. The manufacturer had already lowered this ceiling on the A330, A340 and A380 to about 7,500ft, while the A320 family remained at 8,000ft. The upper limit is reached only when the aircraft flies at the maximum cruising altitude of 40,000ft and otherwise stays typically below 7,000ft, says Claire Nurcombe, aircraft interiors marketing manager at Airbus.

But more recent research has showed that lowering the cabin altitude from 8,000ft to 6,000ft will not significantly affect passenger comfort. The UK's Building Research Establishment (BRE) conducted a European-funded laboratory project with Airbus and other partners in 2009, in which a series of 8h flights were simulated with different pressure, temperature, noise and ventilation settings.

The Ideal Cabin Environment (ICE) project concluded that although there was ""evidence of combined effects of environmental parameters on subject health and comfort"", there was ""no consistent evidence of improvement to health and comfort from a decrease in the cabin equivalent altitude"". Different pressurisation levels indicated no significant impact on ""the development of venous thrombosis, inflammation, respiratory embarrassment or passenger distress"", the researchers added.

DEVELOPMENT CYCLES

""The development cycles for new aircraft are not always in line with the research cycles, which the European Commission is funding,"" says Nurcombe. ""The research came out after the decision had already been made to lower the cabin altitude on the A350."" But, given the fact that most of the world's population lives within a few hundred feet of mean sea level, she adds: ""Lower is always better.""

Blake Emery, director of differentiation strategy at Boeing Commercial Airplanes, says the US airframer observed a ""knee"" in the comfort level curve of its climatic chamber studies with the University of Oklahoma at around 6,000ft, above which symptoms such as headaches and muscular aches appeared.

However, the rate at which the cabin is pressurised appears to have a significant impact on passenger comfort. Nurcombe says this was not part of the ICE project, but Airbus undertook literature studies and then refined the software algorithms controlling the pressurisation systems. The result is that the cabin altitude changes more smoothly and at a different pace than the aircraft's climb or descent rate. If the aircraft climbs towards its cruising level, the pressurisation rate slows as the cabin nears its maximum altitude.

Nicolas Bonleux, executive vice-president of sales and marketing at air management system supplier Liebherr Aerospace, says the technical challenges are twofold: to design software that can calculate comfortable cabin altitude changes, and to develop the components with a quick reaction time.

Surprisingly, the ICE project found that neither ratings by the test participants - 1,400 people with varying health conditions - nor physiological markers showed a ""preference between relative humidity conditions"". The researchers trialled relative humidity levels of 10%, 25% and 40%, and a floating condition based on a constant moisture content.

MOISTURE LEVEL

But the airframers and humidification system manufacturers are sure cabin air moisture level has an impact on comfort and physiological wellbeing. Both Airbus and Boeing offer active, water-based air humidifiers for the flightdeck and crew rest compartments on the A350 and 787. The fact that most Dreamliner customers have selected this optional equipment for the cockpit - and so appear to think it will benefit pilots - proves there is a need for increased humidity, says Peter Landquist, vice-president sales and marketing at Swedish humidifier specialist CTT.

But it is a different story for the passenger cabin. On any aircraft without active humidifiers, the only source of moisture during cruise is the breathing and transpiration of passengers and crew and vaporisation from hot food and drinks, because at 40,000ft the outside air has a relative humidity of less than 1%.

Ironically, the air gets drier with increasing exclusivity because the moisture level depends on passenger density. Relative humidity in economy class is typically between 10% and 15%, but it can drop as low as 5% in premium accommodation, says Landquist.

This is why many widebody VIP aircraft have been equipped with active humidification systems. Relative humidity in natural environments depends on the geographical location and season, but typically varies between 15% in deserts to over 90% in tropical regions.

Boeing has installed an environmental control system on the 787 which manages the air recirculation and use of fresh air better than on other aircraft and maintains 10-15% humidity throughout the cabin, says Emery. He stresses that the system does not add moisture through active humidifiers.

Airbus offers such equipment as an option for first and business class on the A350. Landquist says this will raise humidity to 20% to 25% in those respective areas and could, via the recirculation of cabin air, lift moisture levels in economy class by 3% to 4%. But the water vapour needs to be captured by cabin air drying systems to prevent condensation in the aircraft structure and water accumulation in the insulation mats.

After developing a new-generation air humidifier for business jets about five years ago, Liebherr also wants to introduce the system to passenger airlines, both as OEM and retrofit equipment, says Bonleux.

Corrosion is quoted widely as a reason why humidifiers are not installed on metal aircraft, but this is not the main concern. All aircraft, whether made of aluminium or carbonfibre, suffer from condensation around the airframe structure. As the fuselage skin typically cools to about -25˚C during cruise, the ambient cabin air temperature falls below its dew point and condenses. Concorde was different in this respect because its skin heated up to an average of 90˚C due to air friction, which kept the supersonic jetliner dry.

So far, CTT has supplied zonal driers for about 450 (metal) passenger aircraft to avoid, at worst, ""rain in the plane"". Although the degree of condensation depends on operational circumstances, Landquist says it is not unusual for a narrowbody to accumulate 200kg (440lb) of water in its insulation material. Boeing installs two zonal driers on the 787 as standard equipment, and the A350 requires such a system because of its humidifiers.

Metal passenger aircraft can be fitted with humidifiers if requested by airlines. Apart from increasing complexity in the crown area above the cabin, which is tightly packed with air conditioning and passenger services systems, the problem with moisturisers is that they require water, which adds weight. Between 50 and 100 litres are typically required to humidify a widebody's premium accommodation on a 10-hour flight, says Nurcombe. ""The crucial issue for humidification systems is the extra weight of the water.""

Revisit our history of the Boeing 787 programme, published to mark the first handover

Source: Flight International"
