Titre,Date de publication,URL,Contenu
Airbus adds new service Verde to its precision farming portfolio - Airbus,"Mon, 04 Feb 2019 08:00:00 GMT",https://news.google.com/rss/articles/CBMiemh0dHBzOi8vd3d3LmFpcmJ1cy5jb20vZW4vbmV3c3Jvb20vcHJlc3MtcmVsZWFzZXMvMjAxOS0wMi1haXJidXMtYWRkcy1uZXctc2VydmljZS12ZXJkZS10by1pdHMtcHJlY2lzaW9uLWZhcm1pbmctcG9ydGZvbGlv0gEA?oc=5&hl=en-US&gl=US&ceid=US:en,"Innovative solution to deliver detailed crop analytics already adopted by DataFarming

@AirbusDefence #Verde #data_farming #API

Toulouse, 04 February 2019 – Airbus launched an innovative service called Verde that delivers detailed crop analytics from satellite imagery, perfectly clipped to the field and accurately de-clouded. Served as plug and play API to any precision agriculture portal, Verde provides reliable and quantified measures of the vegetation, consistent over time and space, whatever the satellite used.



The new service primarily addresses in-season monitoring, to help anomalies detection, optimise field scouting, irrigation, seeding, fertilization, and crop protection. It is also of interest for off-season analysis, thanks to multi-year series of analytics, in order to review the farming strategy, define management zones based on persistent growth patterns and improve practices over the long run. Verde targets the entire chain of precision farming consulting providers, from the smallest start-ups to the largest machinists, seeds and fertilizers companies.

“With Verde, we underline our ambition to become the reference layer for precision agriculture portals. Both leveraging our wide imagery harvesting and our unrivalled crop analysis capacities, we are offering a totally different way to derive agronomic information from satellite imagery”, says François Lombard, Head of Intelligence Business at Airbus Defence and Space.

Verde has already been adopted by DataFarming, an Australian agtech company based in the regional city of Toowoomba, Queensland, delivering precision agriculture solutions for farmers and agronomists around the world.

“We are looking at expanding our product offering to our 7,500 farm user base who want more detail about the crop, beyond just NDVI. Having higher resolution on some of the data is also a key value proposition. This is where VERDE fits quite nicely. We have already processed 4,000,000 hectares of NDVI to date, and want to leverage our user base to offer this value added service. Crops such as cotton, rice, and sugarcane will certainly benefit” says Tim Neale, Managing Director of DataFarming.

Verde is a solution powered by OneAtlas, the digital platform of Airbus Defence and Space Intelligence.

OneAtlas is an industry-leading collaborative environment, designed with and for users to access premium imagery, perform large-scale image processing, extract industry-specific insights and develop the smartest geospatial solutions.

Register now to attend the Verde launch webinar on February 5 by clicking here

For more information, visit the Verde webpage

* * *

About Airbus



Airbus is a global leader in aeronautics, space and related services. In 2017 it generated revenues of € 59 billion restated for IFRS 15 and employed a workforce of around 129,000. Airbus offers the most comprehensive range of passenger airliners from 100 to more than 600 seats. Airbus is also a European leader providing tanker, combat, transport and mission aircraft, as well as one of the world’s leading space companies. In helicopters, Airbus provides the most efficient civil and military rotorcraft solutions worldwide."
Airbus may kill production of A380 superjumbo jet - Marketplace,"Wed, 13 Feb 2019 08:00:00 GMT",https://news.google.com/rss/articles/CBMiV2h0dHBzOi8vd3d3Lm1hcmtldHBsYWNlLm9yZy8yMDE5LzAyLzEzL2FpcmJ1cy1tYXkta2lsbC1wcm9kdWN0aW9uLWEzODAtc3VwZXItanVtYm8tamV0L9IBAA?oc=5&hl=en-US&gl=US&ceid=US:en,"Once touted as an aircraft for the future, the Airbus A380 was supposed to offer international carriers with an appealing, if massive, option for long-haul flights. Now the A380 appears to be on life support. Emirates airlines has scaled back purchases of the aircraft, and Airbus is expected to fully shut down production soon. Airlines are turning to smaller, more fuel-efficient planes to meet the needs of customers and airports. Reduced demand for the Airbus A380 might seem like a positive for Boeing, but plane manufacturers have few guarantees in the air travel industry.

Click the audio player above to hear the full story."
Farewell to the A380: Why It Became a Drag for Airbus - Knowledge@Wharton,"Thu, 28 Feb 2019 08:00:00 GMT",https://news.google.com/rss/articles/CBMidGh0dHBzOi8va25vd2xlZGdlLndoYXJ0b24udXBlbm4uZWR1L3BvZGNhc3Qva25vd2xlZGdlLWF0LXdoYXJ0b24tcG9kY2FzdC9ob3ctY2hhbmdpbmctdHJhdmVsLXRyZW5kcy1raWxsZWQtdGhlLWEzODAv0gEA?oc=5&hl=en-US&gl=US&ceid=US:en,"More than 50 years ago, the Beatles told us that ‘All You Need Is Love.’ But Roger W. Clark, visiting professor at Rutgers University Law School where he teaches aviation law, said that statement didn’t quite live up to its promise in the case of the A380 aircraft, the largest commercial jetliner, which manufacturer Airbus said earlier this month that it plans to stop producing beginning in 2021.

“If all you needed was love, the A380 would be flying forever because it probably has the most comfortable ride,” said Clark, who has practiced aviation law for more than three decades and is also founding member and managing partner of the Clark Law Group, which has offices in California and Florida. “It’s silent. It has a very stable platform. You have an incredible amount of room, and bars and showers in first class. It’s a passenger paradise.”

As it turned out, the A380 needed some business logic as well to survive. Kenneth Button, public policy professor at George Mason University’s Schar School of Policy and Government and an expert on transportation policy, recalled a meeting he once had with the president of Air France, which was buying an A380 at the time. “I asked the [Air France] president why he was buying one. He simply used one word: politics.”

The A380 was supposed to revolutionize commercial air travel, and was launched in 1990 as a response to Boeing’s 747. The first deliveries of the A380 began in 2007 to Singapore Airlines, and the aircraft had its prime years between 2012 and 2014. Airbus announced the end of the A380 in a press release about Emirates reducing its A380 order book from 162 to 123 aircraft. Earlier this month, Australian airline Qantas, too, canceled its order for eight A380 aircraft.

Clark and Button examined the causes behind the discontinuation of the A380 on the Knowledge at Wharton radio show on SiriusXM. (Listen to the podcast at the top of this page.)

Misreading the Market

For starters, Airbus had overestimated sales of the wide-bodied, 544-seat jet. Also, the A380 is designed for passenger transport and cannot accommodate cargo, although cargo transportation was a fast-growing market, they said. The A380 also fell victim to Open Skies agreements, where airlines could respond to market demands and not be subject to political arrangements between countries on how many landings and takeoffs they would permit. Alongside, Airbus also did not anticipate the rapid growth of intermediary or secondary cities, and the ability of smaller jets to directly service them, bypassing the megacity hubs, according to a Reuters report.

Perhaps the biggest mistake Airbus made was wrongly forecasting demand for the A380. Clark noted that while Airbus expected to have about 1,500 A380s in service by 2020, it has thus far delivered fewer than 300 of them. As of January 2019, Airbus had 313 firm orders for the aircraft.

Missing the cargo market with the A380 was another failure of Airbus. “It’s not a cargo plane and it’s very difficult to convert,” said Button, adding that its main competitor, the Boeing 747, continues production of the cargo version. “[Airbus] misjudged the type of traffic that is growing.”

Although Airbus has invested an estimated $25 billion over the years to develop the A380, it targeted a relatively limited market niche. “You can’t use it for smaller routes,” said Button. “The planes which are successful and where you make your money [are those] that you can continually evolve, change, modify and stretch, like the Boeing 737. When you go for a specialized plane like the Concorde or the A380, you are really risking an awful lot on basically one type of market.”

“If all you needed was love, the A380 would be flying forever because it probably has the most comfortable ride.” –Roger Clark

The Open Skies Factor

The A380 was designed to serve large hubs in megacities, “but the markets are different now,” said Button. “There are a lot of gateways into America, and ditto when you fly to Europe or the Middle East, or from the Middle East to Asia. It’s not all going to the major hubs anymore. The world has changed quite considerably and that’s what Boeing was actually banking on and that’s what their forecasts told them would happen. Airbus didn’t get the forecast right.”

While Airbus was banking on the hub-and-spoke model for the A380, the aircraft made its market touchdown at a time “when Open Skies began to kick off,” said Clark. Under Open Skies agreements, countries agree to open up their airspace to market dynamics as opposed to trying to control the entry, routing, landings and takeoffs based on political allocations, he explained. Europe, the U.S. and many other countries are now in the Open Skies environment, he pointed out. “That was a political [development] that I think Boeing was anticipating. Airbus, I think, anticipated the wrong way, and that was one of the nails that went into the coffin of the A380.”

The industry is under a lot of pressure to get away from the hub-and-spoke model “because of the continued increase in passenger traffic of more than 5% per year,” Clark added. “JFK, Philadelphia and Logan [in Boston] can only take so many landings per day per day, so you need to find other locations that are more convenient to passengers and have point-to-point service.”

Advantage Boeing

Airbus’s debacles have often benefited Boeing, its biggest competitor. That would be the case this time around as well, and Boeing’s new aircraft line, the 777-9, which can carry 414 passengers, is in line to fill the market that the A380 would vacate, according to Clark. “Airlines that may have been going for the A380 will probably now be looking at the 777- 9 because it is specifically designed to be more fuel-efficient,” he said.

Fuel efficiency is critical to the bottom lines of airlines, according to Button. He noted that airlines gain 1% more fuel efficiency every year when they buy new aircraft, although some aircraft allow the requisite technology to be fitted in retroactively. “Airlines want fuel economy and reliability, but they also want in particular aircraft which fit into their network systems,” he said. “Boeing markets many of its airplanes specifically on that particular feature [of fuel efficiency].” It doesn’t help the A380 that it requires “quite a lot of downtime because of the nature of the network it serves,” he added.

“When you go for a specialized plane like the Concorde or the A380, you are really risking an awful lot on basically one type of market.” –Kenneth Button

Next Strategies at Boeing and Airbus

Aircraft design and manufacturing entails long-term strategies and planning, and orders for planes arrive up to 15 years in advance, Button noted. “It releases resources for speeding up production of existing models,” he said. “There are always some bottlenecks in these production lines for different planes; [the A380 phase-out] may allow development and refinements of existing planes to take place more rapidly. One assumes that this decision was made within a larger strategic plan. So, Boeing has got to somehow second-guess what Airbus will do and adjust its strategy accordingly.” As it happens, Airbus’s stock price actually rose after the announcement of the decision to phase out the A380, Clark pointed out.

Meanwhile, optimism rules the broader aircraft market. “Both Boeing and Airbus are bullish on the future of the commercial market,” said Clark. He noted that while the current worldwide fleet of commercial aircraft is an estimated 20,000, Airbus and Boeing are forecasting that market to go up to 40,000 over the next several decades. About 70% of those are expected to be narrow-bodied aircraft, and not the wide-bodied version, he added.

Clark pointed in particular to increasing aircraft demand from China and India, which typically serve regional markets. In response to the growing demand from regional markets, Airbus and Boeing have partnered with relatively smaller players to produce aircraft variants. Boeing has a partnership with Embraer of Brazil, while Airbus has a partnership with Bombardier of Canada.

As with all closures, layoffs are on the horizon at Airbus. Airbus has said it will begin discussions with its partners in the next few weeks on how to deal with the 3,000 to 3,500 positions that will be potentially impacted over the next three years by its A380 decision. It noted that “the ongoing A320 ramp-up and the new wide-body order from Emirates Airline will offer a significant number of internal mobility opportunities.”"
Are A380s now heading for the scrapheap? - CNN,"Sat, 16 Feb 2019 08:00:00 GMT",https://news.google.com/rss/articles/CBMiTWh0dHBzOi8vd3d3LmNubi5jb20vdHJhdmVsL2FydGljbGUvYWlyYnVzLWEzODAtc2NyYXBoZWFwLXNjbGktaW50bC9pbmRleC5odG1s0gEA?oc=5&hl=en-US&gl=US&ceid=US:en,"CNN —

A whopping great beast of an aircraft, the double-decker Airbus A380 – the biggest passenger airplane the world has ever known – is an incredible sight whether on land or in the air.

Such gravity-defying proportions combined with the genuinely enjoyable experience of flying in one have won it legions of admirers since its first commercial voyage in 2007.

So it was no surprise that there was widespread consternation at the February 14 announcement that Airbus intends to cease production of the A380 in 2019, effectively placing an expiry date on an aircraft that was once seen as the future of aviation.

But how quickly are A380s going to vanish from our skies? Is widespread affection for the huge aircraft enough to keep it flying well into its dotage, in the way many classic planes continue flying well beyond their service life?

Commercially, the superjumbo’s days are clearly numbered. Airbus’s announcement follows the cancellation of several orders by key airlines despite a decade of efforts by the aircraft’s manufacturer to persuade them the aircraft was part of a new revolution in air travel.

That said, with Airbus continuing to offer mechanical support, the A380 potentially has many more years of flying ahead of it. Such modern machines typically have a lifespan of at least two decades, meaning we could still be boarding them in the 2040s, maybe even later.

Heading for the bone yard

Singapore to Sydney -- Singapore Airlines: The first ever commercial voyage on an A380 aircraft was from Singapore to Sydney. Today, it's still a great route -- plus the First Class suites, pictured, are pretty swanky. Courtesy Singapore Airlines Dubai to Auckland -- Emirates: Dubai-based airliner Emirates has the most A380s and operates the longest Airbus A380 route, from Dubai to Auckland. Courtesy Emirates London Heathrow to Boston -- British Airways: We can't guarantee your superjumbo will glide past Britain's famous White Cliffs of Dover, but this is a pretty great route to experience. Courtesy British Airways Paris to New York -- Air France: The Final Assembly Line for the A380 is in Toulouse in France. Flying from Paris to New York allows you to see an A380 on its home turf. Courtesy Air France Honolulu to Tokyo -- Al Nippon Airways: From May 2019, passengers traveling from Tokyo to Hawaii can enjoy this bright colored A380 -- dubbed the ""Flying Honu"" aircraft. Honu is a term used for sea turtles in Hawaii. Courtesy Airbus Frankfurt to Shanghai -- Lufthansa: Lufthansa A380s have automatic cabin humidifiers. Flying from Frankfurt airport is great too, it's been well-equipped to manage the A380 experience. Adam Berry/Getty Images Dubai to Sao Paolo -- Emirates: A380s have been flying to and from South America since 2016, thanks to Emirates. Sao Paulo International Airport was upgraded to handle the aircraft. STR/AFP/Getty Images Sydney to Hong Kong -- Qantas: Qantas is associated with quality -- and its A380 experience is no exception. Courtesy Qantas Abu Dhabi to London -- Etihad Airways: On board Etihad's A380 passengers can enjoy ""The Residence"" an opulent three-room suite, pictured. Courtesy Ethiad The best A380 superjumbo routes and airlines to experience Prev Next

But some experts believe it could be heading off to the bone yard far sooner. In death, as well as life the A380 seems doomed to an ignominious fate.

You wouldn’t think that from the initial reaction to news of its demise.

“A very sad day for an amazing aircraft which pilots & passengers love,” wrote British Airways pilot Dave Wallsworth, who regularly blogs about his experiences helming the airplane.

“It is absolutely sad,” says CNN anchor and aviation expert Richard Quest. “I covered this from the days when it was still a project known as the A3XX and even before that, right through to its maiden flight and entry into service.

The reason for such affection is partly down to size. The flying leviathan’s hulking presence would, in its early days, draw crowds of spectators to airfields. Pilots of other airplanes would deliberately slow down while taxiing to give their passengers a better drive-by gawp.

‘An amazing plane’

Airlines have pivoted to smaller planes instead of superjumbo jets. Alexander Hassenstein/Getty Images

At 79.75 meters, the A380’s wingspan is only beaten by the Antonov An-225 Mriya, the world’s largest aircraft by weight, length and wingspan. It can hold up to 853 passengers in a single-class economy configuration, although most of its operators opt for a more spacious 450 to 500 passenger layout.

“From a purely technological point, everyone agreed this was an amazing plane,” says CNN’s Quest. “When they designed it, they could require changes to jetways and to terminals, they could require changes to taxiways to allow two planes to pass each other, but they couldn’t require larger runways.

“Instead, they had to build a plane that could take off on length of about 10,000 feet or 3,000 meters. So they did it by use of the wings and the engines, an incredible achievement.”

And then there’s the experience of actually flying in an A380.

“It is an exceptionally quiet plane,” says Quest. “I flew recently sitting on the upper deck, behind the wings and those huge engines, and you could hold a normal conversation. There was virtually no noise.

The promise of greater luxury in the sky was one of the great selling points of the A380 for fliers more used to the cramped conditions of smaller aircraft or tight seating configurations even in bigger machines like the Boeing 747.

Ironically, the 747 – the original jumbo – first flew 50 years ago this month, February 1969. For decades it helped make international air travel available to more people than perhaps any other airliner.

Nonetheless it’s still in production, as Boeing cranks out the 747-8 model in modest numbers while major airlines have been phasing 747s out of service. It’s remarkable that the 747’s production life will outlive the A380s – perhaps adding more truth to the argument that making a superjumbo was an old-fashioned idea to begin with.

Flying in the lap of luxury

Etihad's ""The Residence"" offers a double-bed, en suite bathroom and living room. Courtesy Etihad Airways

When the A380 launched in 2007, there was talk of marketing it to high rollers by installing onboard casinos and double bed suites, such was the amount of available space. While Virgin founder Richard Branson later backtracked on the casino idea, double beds have been installed on many planes.

Some carriers used it to set the gold standard for their first class offerings, with Singapore Airlines, the A380’s launch partner, pioneering its award-winning hotel-suite style accommodation on its superjumbos.

Gulf carrier Etihad is among airlines offering an onboard shower to first class A380, passengers, as well as an exclusive premium concept known as “The Residence” an entire apartment located in the corner of the upper deck, replete with a living room, double bedroom, ensuite shower and its own dedicated butler.

“To build such an extravagance into a commercial passenger jet just shows how much space airlines have to play with on these aircraft,” says CNN Travel’s global editor Barry Neild, who toured a “Residence” during a 2017 flight from London to Abu Dhabi.

But who flies in such opulence? According to airline staff it’s a combination of the super rich and aviation fanatics seeking the best experiences they can find in the sky, sometimes cashing in stockpiles of air miles to ride in style.

Naked at 40,000 feet

Inevitably for a UAE-based carrier, a lot of the custom comes from the country’s wealthy royalty.

“The butler on the aircraft I flew in told me that some sheiks prefer The Residence to their own private jets,” Neild adds. “Sometimes they’ll have their private jet follow on behind, so they can enjoy the comfort of long haul on the A380, and the convenience of their own plane for short hops at their destination.”

And is it worth it?

“I was given permission to take a shower in the residence during the journey,” says Neild. “Apart from the dubious bragging rights to being naked on a plane at 40,000 feet, it was a whole new level of airplane comfort that instantly blitzes the weariness of red-eye flight.

“It’s somewhat depressing to go back to economy class on a normal airplane after trying something like that.”

A victim of fashion

Emirates' A380s featured a lounge bar. STR/AFP/Getty Images

Airports too, bought into the A380 vision as experts conjured up a future in which air travel congestion would be eased by large airplanes ferrying passengers between major hubs like London, Dubai or Atlanta, where they’d then connect to short-haul flights on smaller jets.

Gates, sometimes entire terminals were reconfigured to accommodate the bigger planes.

However, despite huge rises in the number of people traveling by air – and the continued rise of airport superhubs – things haven’t quite turned out the way many imagined.

As with Concorde before it, the A380’s problem is one of economics. Had airlines been able to fill every flight to capacity, it would’ve been a success story – carrying more people at lower per-passenger cost.

“It’s always easy to be wise in retrospect, but Airbus’s gamble on the A380 went horribly wrong,” says Murdo Morrison, head of strategic content at aviation intelligence specialist FlightGlobal.

“The strategy of most airlines demanded smaller, more efficient widebodies that they could operate point-to-point on more frequent schedules,”

Instead, airlines shifted their interest to lighter, more fuel-efficient passenger jets, meaning that as of 2019, Airbus has sold less than a quarter of the 1,200 A380s it predicted it would sell.

Airbus’ A350 and Boeing’s 787 Dreamliner have already proved this. And the upcoming Boeing 777-9 will seat more than 400 passengers – thanks to the addition of huge, lightweight carbon fiber wings, hastening the A380s demise.

‘Too bloody big’

“Airbus has spent the last decade and a half trying to convince skeptical airlines and the media that the A380’s moment is nigh,” said Morrison. “In the end, simple economics won out.”

So how long with the A380 keep flying? Despite the decades of service life left in newer models, that future could again be determined by economics. Already the first superjumbos have reportedly been decommissioned and earmarked for salvage.

FlightGlobal’s Morrison says that with little demand in the secondhand market the lifespan of the giant plane will be shorter than smaller models.

“The early customers of the aircraft, Emirates included, have already made plans to retire their oldest A380s,” he said. “Many more will be heading for the scrapheap throughout the 2020s.”

But will the A380 follow the trajectory enjoyed by supersonic jet Concorde, enjoying an afterlife through the veneration of its supporters?

Already one A380 has been installed in the Le Bourget Aerospace Museum near Paris, but CNN’s Quest says other airplanes are unlikely to follow.

“Concorde conjured up an aspiration, it was something that only a few could fly on but everyone wanted to fly on,” he says. “And it did something that no other aircraft did. This cannot be said of the 380.

“Instead we’ll probably end up with a giant scrapheap of 380s, unless Airbus comes up with a deal to buy them back.

“It’s certainly too bloody big for a museum.”"
