Titre,Date de publication,URL,Contenu,sentiment_finbert,sentiment_label,sentiment_score,sentiment_numerique
Roger Béteille: from Pilot to Airbus Founding Father - Airways Magazine,"Tue, 26 Apr 2022 07:00:00 GMT",https://news.google.com/rss/articles/CBMiO2h0dHBzOi8vYWlyd2F5c21hZy5jb20vcm9nZXItYmV0ZWlsbGUtcGlsb3QtYWlyYnVzLWZvdW5kZXIv0gEA?oc=5&hl=en-US&gl=US&ceid=US:en,"Roger Béteille: from Pilot to Airbus Founding Father

DALLAS – Roger Béteille is considered the mastermind behind the major developments that made Airbus the world’s largest commercial airframer.

Béteille was born in Aveyron, France in 1921 and studied at Supáero in Toulouse before joining SNCASE in 1943, known as Sud-Aviation. By 1945, he had received his pilot’s license, before becoming a flight test engineer for Sud in 1952, being on the test team for the Caravelle’s first flight.

The Airbus A300B was launched in 1969. In July 1967, an idea to develop a 300-seater all-new widebody jet came to fruition: Mr. Béteille was appointed as the chief engineer for the A300 program at Sud-Aviation. However, launch customers Lufthansa (LH) and Air France (AF) opted for a smaller plane. So, in 1968, Béteille started working in secret on what would become the A300B.

The A300B then came along, a 250 seater with a hold large enough to accommodate two standard containers side by side. The innovative fuselage cross-section he designed is still in use today on the A330. But more was to come from Béteille.

Photo: Airbus

The Creation of Airbus Industrie

At the turn of the decade, Béteille and the first production director of Airbus, Felix Kracht, drew up the workshare, which is what we see today as the Airbus European Production System that is still used by the company. At the time, Béteille said, “I wanted to use all the available talents and capacities to their utmost without worrying about the color of the flag or what language was spoken.”

Through this workshare and the grouping of economic interests, Airbus Industrie was created in 1970, with Béteille becoming the new senior vice president of engineering. Béteille pushed for the headquarters of Airbus to be close to the Toulouse Final Assembly Line so then customers could see the aircraft in production.

1972 saw the first flight of the A300B take place. Even during the OPEC Oil Crisis in the 1970s, Béteille’s understanding of global customers enabled the securing of its first U.S. customer, Eastern Airlines, in 1977.

To the understanding of customers, Béteille was never the one for optimism or confidence. “I was convinced that Airbus would never take off with a single aircraft. Potential customers would wonder if we’d still be around in ten or 20 years’ time.”

In 1984, Béteille achieved his lifelong dream of managing the formal launch of the A320.

Roger Béteille. Photo: Airbus

A Visionary at Airbus

The reason why Béteille was a visionary at Airbus was because of his instrumental input into the famous Fly-By-Wire (FBW) controls that we see today.

Fly-By-Wire increased flight safety and also began the process of cockpit commonality and cross-crew qualification for pilots, which is something that Airbus continues to boast about today.

In 1985, Béteille’s career at Airbus came to an end by retiring as the company’s president. In line with the A350XWB launch in 2012, the final assembly line in Toulouse was named in his honor as the aircraft still uses the systems he introduced over 30 years ago.

Photo: Airbus

Legacy

Béteille’s success with the use of Fly-By-Wire has enabled Airbus to secure a significant backlog of 7,023 jets (March 2022), of which 6,357, or 91%, were A220 and A320ceo/neo family, all of which use FBW. In February, the company said it expected to deliver 720 commercial aircraft in 2022, up from 611 in 2021, after announcing a record net profit for 2021.

Without this system and the benefits that came with it, Airbus may not have thrived as well as it has done in the last two decades.

As we celebrate World Pilots’ Day, Airways remembers Béteille not only as the visionary that he was, but as the person that spearheaded the success that Airbus currently enjoys.

Featured image: Airbus","{'label': 'Neutral', 'score': 0.9999946355819702}",neutral,0.9999946355819702,0
Airbus Helicopters: Safety is an unwavering priority - Vertical Magazine,"Fri, 29 Apr 2022 07:00:00 GMT",https://news.google.com/rss/articles/CBMiTWh0dHBzOi8vdmVydGljYWxtYWcuY29tL2FpcmJ1cy1oZWxpY29wdGVycy1zYWZldHktaXMtb3VyLXVud2F2ZXJpbmctcHJpb3JpdHkv0gEA?oc=5&hl=en-US&gl=US&ceid=US:en,"Helicopters perform essential missions daily, and we at Airbus Helicopters are constantly innovating the technologies of tomorrow — to reduce the carbon footprint of our products, to make them safer and easier to maintain, and to expand our customers’ mission capabilities.

At this year’s Heli-Expo 2022 in Dallas, Texas, attendees saw first-hand our latest products and services and learned about how we are pioneering sustainable aerospace for a safe and united world. Showgoers were able to visit the H160, alongside the emergency medical services market leader H135, the versatile H125, and the best-selling ACH145.

A major milestone for the H160 was achieved in December 2021 when the world’s first H160 was delivered to Japanese operator All Nippon Helicopter. In addition, this next-generation multi-role helicopter recently saw its first law enforcement customer, the French Gendarmerie Nationale, with an order of 10 helicopters — the first of which will be delivered in 2024 prior to the Olympic Games in Paris.

The H160 will become a versatile workhorse for operators, and is also a flagship aircraft for Airbus Helicopters’ decarbonization roadmap, as its Safran Arrano engines provide a 15 percent reduction in fuel consumption.

Another important part of our decarbonization strategy is the use of sustainable aviation fuel (SAF) that is derived from waste material. The majority of Airbus helicopters are certified to fly with a 50 percent blend of SAF, which represents a 40 percent reduction of emissions.

We launched a flight campaign in November 2021 with 100 percent SAF powering one of the H225’s two engines, an important step toward certifying the use of SAF blends that exceed today’s 50 percent limit. In order to accelerate the use of biofuels, we launched a SAF user group for those in the rotary-wing industry who are interested in developing the use of SAF to join forces in accelerating its implementation in the industry.

On the innovation front, we also began in-flight tests on our Flightlab, the platform-agnostic flying laboratory aimed at testing and maturing techno-bricks, such as the engine back-up system (EBS), that will equip future fleets. The EBS can provide electrical power for 30 seconds in the event of engine failure and is a key first step toward a future hybrid propulsion system, as well as a safety enhancer by allowing a smoother autorotation maneuver to the ground.

Another safety feature that Flightlab is testing is health and usage monitoring systems (HUMS). HUMS can provide advanced detection of any technical issues on the helicopter, easing aircraft maintenance and enhancing flight safety.

Among the disruptive technologies tested on Flightlab, multiple solutions are designed to be applicable to eVTOLs. CityAirbus NextGen, Airbus’ fully electric prototype, is currently in a detailed design phase, in order to provide communities and citizens with an urban air transport service this decade. With a maiden flight planned in 2023, Airbus has started to partner with a selection of suppliers to develop the aircraft’s components, such as Thales and Diehl who will provide CityAirbus NextGen’s flight control computers.

On the support and services side, we continue to adapt and improve our offerings to better meet the unique demands of our customers and their missions, wherever they operate. The former HCare Easy, HCare Smart, and HCare Infinite have been replaced by a new structure.

This restructuring simplifies the customer’s choice of support and services with a new flexible, customer-centric approach. Each pillar is aligned with a stage of the customer journey, and packages together the optimal group of support and services for each stage, which could be upon aircraft acquisition, or several years after a fleet enters service.

The HCare First package will still be available for specific fleets of Airbus Corporate Helicopters (ACH) aircraft, and HCare Classics for the serialized legacy fleet (H120, Dauphin, Puma, and Gazelle). Retrofits and upgrades continue to add value — not only can they extend the service life of legacy aircraft, but they can also give the current range a boost. A case in point: the H125 power upgrade increases the single-engine bestseller’s power by up to 10 percent, making full use of the engine’s available power.

In the private and business sectors, ACH continues to meet the needs and tastes of the most discerning customers. It’s where world-class aeronautical engineering expertise meets design values centered on comfort, aesthetics, and a concentration on satisfying individual customer requirements.

ACH proposes tailored and refined interiors and innovative solutions. The concept is crystallized particularly clearly with in-house designs, such as ACH Line and ACH Exclusive, and through partnerships with luxury automobile manufacturers, such as Mercedes-Benz and Aston Martin. The eight-passenger ACH145 Mercedes-Benz style interior offers extraordinary comfort with an underlying energy. The partner companies have just signed a renewal of their relationship, and a facelift of the helicopter is already underway to further reflect contemporary design values.

The ACH130 Aston Martin edition — a product of a cooperation between ACH and Aston Martin Lagonda — is lean, elegant, and at the sportier end of the Airbus range. It has proven a remarkable success and encapsulates the sheer pleasure and freedom that helicopter flying can bring.

Look out this year for the entry into service of the ACH160, bringing to the corporate marketplace the comfort and enhanced safety features of the most technologically advanced helicopter in service today.","{'label': 'Positive', 'score': 0.9994199275970459}",positive,0.9994199275970459,1
Boliviana de Aviación becomes Airbus' newest operator in Bolivia - Airbus Aircraft,"Thu, 07 Apr 2022 07:00:00 GMT",https://news.google.com/rss/articles/CBMifmh0dHBzOi8vYWlyY3JhZnQuYWlyYnVzLmNvbS9lbi9uZXdzcm9vbS9wcmVzcy1yZWxlYXNlcy8yMDIyLTA0LWJvbGl2aWFuYS1kZS1hdmlhY2lvbi1iZWNvbWVzLWFpcmJ1cy1uZXdlc3Qtb3BlcmF0b3ItaW4tYm9saXZpYdIBAA?oc=5&hl=en-US&gl=US&ceid=US:en,"Santiago, 7 April 2022 – Boliviana de Aviación (BoA) has become the newest Airbus operator in Bolivia, by selecting leased A330-200 for its long-haul fleet renewal. The selection was announced at the FIDAE Airshow, the biggest aerospace event in Latin America. The airline will operate leased aircraft from Avolon and ORIX Aviation to fly international routes such as Santa Cruz - Madrid and Santa Cruz - Miami.

The A330-200 is part of the most popular and reliable Airbus aircraft family. The robust A330 Family will be a leap to state of the art technology for BoA. Its modern cabin will enhance passenger experience through direct aisle access in business and the widest economy class seats in the market. Bringing world class comfort and entertainment with its modern In Flight Entertainment (IFE) to long-haul flights for all passengers.

“After a long and in-depth technical, commercial and financial analysis, Boliviana de Aviación concluded that the A330-200 aircraft will allow BoA to provide a better quality of service to our users on long-range routes. Without a doubt, this important project will allow BoA to make a technological leap”, said Ronald Casso, CEO of Boliviana de Aviación.

“We are proud to welcome Boliviana de Aviación to the Airbus Family of operators in Latin America. We are fully committed to supporting BoA during the entry into service, transition and the whole in service life of these and future aircraft through our competitive services package and dedicated customer support.” said Arturo Barreira, President of Airbus Latin America and the Caribbean.

The A330 benefits from the combination of fly-by-wire technology, with modern onboard systems and excellent aerodynamics for a proven, highly productive aircraft. Airbus continues to heavily invest in the A330 Family to maintain its technological lead.

BoA, the main operator in Bolivia, integrates the entire country and connects the region and the world. With the incorporation of these aircraft, the user experience on flights to Europe and North America will be improved, encouraging the development of international traffic to and from Bolivia.

In Latin America and the Caribbean, Airbus has sold over 1,100 aircraft and has a backlog of over 500, with more than 700 in operation throughout the region, representing almost 60 percent market share of the in-service fleet. Since 1994, Airbus has secured approximately 70 percent of net orders in the region.","{'label': 'Positive', 'score': 0.9999383687973022}",positive,0.9999383687973022,1
Qantas to break London flight barrier with Airbus jet order -sources - Yahoo Finance,"Sat, 30 Apr 2022 07:00:00 GMT",https://news.google.com/rss/articles/CBMiTGh0dHBzOi8vZmluYW5jZS55YWhvby5jb20vbmV3cy9xYW50YXMtb3JkZXItbG9uZy1yYW5nZS1haXJidXMtMDIxMDA2NTg3Lmh0bWzSAQA?oc=5&hl=en-US&gl=US&ceid=US:en,"By Jamie Freed and Tim Hepher

SYDNEY (Reuters) -Qantas Airways Ltd is set to announce a landmark order for Airbus SE A350-1000 jets capable of nonstop flights from Sydney to London as part of a wider deal with the European planemaker, industry sources told Reuters.

The multibillion-dollar order, to be unveiled in a Sydney airport hangar on Monday, brings the Australian carrier a step closer to launching record-breaking direct flights of nearly 20 hours on the lucrative ""Kangaroo route"" by mid-2025.

Qantas has touted plans for the world's longest commercial flights for more than five years, but delayed its ""Project Sunrise"" due to the coronavirus pandemic.

The deal is a breakthrough for veteran Qantas Chief Executive Alan Joyce who has described nonstop Sydney-London flights as the Holy Grail for the 101-year-old carrier.

The Australian airline launched the route in 1947 with Lockheed Constellations, when it took several stops and 58 hours of flying. Today's one-stop flights take almost 24 hours.

The expansion comes days after Boeing Co further delayed development of its 777X jetliner, which had at one stage been in contention to allow direct flights from Australia's east coast to London and New York.

An Airbus-owned A350-1000 was flying on Sunday from Toulouse to Perth, tracking service FlightRadar24 showed.

Qantas, which has said it would make a significant announcement on Monday about the future of its network, declined to comment. Airbus also declined to comment.

On Sunday, the West Australian newspaper said, without citing sources, that the Qantas order would include 12 A350s, 20 A321XLRs and 20 A220s as well as purchase rights for 106 more airplanes spread among the different types.

Qantas in December selected Airbus as the preferred supplier for a major order to renew its ageing narrowbody fleet, in a blow to its incumbent supplier Boeing.

An airBaltic A220 was parked in Sydney on Sunday, FlightRadar24 showed. That destination is not on a normal route for the European carrier. Australia has no A220 operators at present.

(Reporting by Jamie Freed in Sydney and Tim Hepher in Paris; Editing by William Mallard and Clarence Fernandez)","{'label': 'Neutral', 'score': 0.9999946355819702}",neutral,0.9999946355819702,0
See PLAY's bare-bones Airbus A321neo flying between Iceland and the US - Business Insider,"Thu, 21 Apr 2022 07:00:00 GMT",https://news.google.com/rss/articles/CBMiYWh0dHBzOi8vd3d3LmJ1c2luZXNzaW5zaWRlci5jb20vcGxheS1haXJsaW5lLWZseWluZy1iZXR3ZWVuLWljZWxhbmQtdXMtd2l0aC1haXJidXMtYTMyMW5lby0yMDIyLTTSAWVodHRwczovL3d3dy5idXNpbmVzc2luc2lkZXIuY29tL3BsYXktYWlybGluZS1mbHlpbmctYmV0d2Vlbi1pY2VsYW5kLXVzLXdpdGgtYWlyYnVzLWEzMjFuZW8tMjAyMi00P2FtcA?oc=5&hl=en-US&gl=US&ceid=US:en,"Baltimore is the first US market the airline will fly to, with Boston, Orlando, and New York's Stewart International Airport joining the route map later this year.

PLAY sign at Stewart International Airport ahead of the inaugural flight on June 9. Taylor Rains/Insider

A new European low-cost airline is launching its first route to Florida this fall with fares to Europe starting at $129 — here's what passengers can expect","{'label': 'Neutral', 'score': 0.9980528354644775}",neutral,0.9980528354644775,0
An Airbus powered by cooking oil: Is sustainable aviation fuel the future of aviation? - Climate Champions,"Tue, 19 Apr 2022 07:00:00 GMT",https://news.google.com/rss/articles/CBMieWh0dHBzOi8vY2xpbWF0ZWNoYW1waW9ucy51bmZjY2MuaW50L2FuLWFpcmJ1cy1wb3dlcmVkLWJ5LWNvb2tpbmctb2lsLWlzLXN1c3RhaW5hYmxlLWF2aWF0aW9uLWZ1ZWwtdGhlLWZ1dHVyZS1vZi1hdmlhdGlvbi_SAQA?oc=5&hl=en-US&gl=US&ceid=US:en,"Climate Champions

We’re in a Race.

A race against time and against ourselves. Against the dangerous idea that we can’t do this, that there is no way.

Unlike most races, it won’t have one winner. In this race we all win, or we all lose. Winning it requires a radical, unprecedented level of collaboration, from all corners of our world. From our cities, businesses, regions and investors. From people everywhere.

Together we’re racing for a better world. A zero carbon and resilient world. A healthier, safer, fairer world. A world of wellbeing, abundance and joy, where the air is fresher, our jobs are well-paid and dignified, and our future is clear.

To get there we need to run fast, and get faster. We need more and more people to join the race, and right now. This is not about 2050, it’s about today.","{'label': 'Positive', 'score': 0.9880408644676208}",positive,0.9880408644676208,1
SAS Scandinavian Airlines chooses Digital Alliance's Skywise Predictive Maintenance solution for its A320 Family fleet - Airbus Aircraft,"Tue, 26 Apr 2022 07:00:00 GMT",https://news.google.com/rss/articles/CBMitAFodHRwczovL2FpcmNyYWZ0LmFpcmJ1cy5jb20vZW4vbmV3c3Jvb20vcHJlc3MtcmVsZWFzZXMvMjAyMi0wNC1zYXMtc2NhbmRpbmF2aWFuLWFpcmxpbmVzLWNob29zZXMtZGlnaXRhbC1hbGxpYW5jZXMtc2t5d2lzZS1wcmVkaWN0aXZlLW1haW50ZW5hbmNlLXNvbHV0aW9uLWZvci1pdHMtQTMyMC1mYW1pbHktZmxlZXTSAQA?oc=5&hl=en-US&gl=US&ceid=US:en,"Dallas TX – April 26 2022 – The Digital Alliance has welcomed SAS Scandinavian Airlines as its first customer for its Skywise Predictive Maintenance (SPM) solution. The new solution chosen by the airline is called “SPM Alliance” and will enhance the operations of its A320 Family fleet of around 70 aircraft.

This is the first solution from the Digital Alliance combining predictive maintenance algorithms from Airbus as OEM, Delta TechOps as an MRO and operational expert and GE Digital as software expert. It encompasses a wide scope of components for aircraft and engines produced by various manufacturers.

“SAS is proud to be the launch customer of SPM Alliance and we look forward to using its powerful analytics”, said Marko Rudic, Head of Technical Operations at SAS. “Thanks to SPM Alliance, we will be able to pre-empt operational disruptions and accelerate maintenance decisions by predicting potential in-service issues across our large A320 Family fleet. This is the proactive approach to fleet technical management that SAS wants to take.”

“As airlines are on the path to recovery, it is more important than ever to support them in saving costs and optimising their fleets’ availability. This is precisely what SPM Alliance does: covering a wide scope of equipment, our new solution brings another dimension to predictive maintenance that will considerably reduce unplanned maintenance, said Lionel Rouby, SVP Digital Solutions, Airbus.”

The Digital Alliance was initiated with Delta TechOps in 2019 and then strengthened in 2021 with the arrival of GE Digital; it aims at developing a portfolio of nose-to-tail and cross-fleet solutions that will harness each member’s respective analytics capabilities expertise for airframes, systems and engines, to be accessed via a unified portal through the Skywise platform.","{'label': 'Positive', 'score': 0.9869727492332458}",positive,0.9869727492332458,1
Airbus locks in Air-France KLM order for new A350 freighter - FreightWaves,"Tue, 12 Apr 2022 07:00:00 GMT",https://news.google.com/rss/articles/CBMiXWh0dHBzOi8vd3d3LmZyZWlnaHR3YXZlcy5jb20vbmV3cy9haXJidXMtbG9ja3MtaW4tYWlyLWZyYW5jZS1rbG0tb3JkZXItZm9yLW5ldy1hMzUwLWZyZWlnaHRlctIBYWh0dHBzOi8vd3d3LmZyZWlnaHR3YXZlcy5jb20vbmV3cy9haXJidXMtbG9ja3MtaW4tYWlyLWZyYW5jZS1rbG0tb3JkZXItZm9yLW5ldy1hMzUwLWZyZWlnaHRlci9hbXA?oc=5&hl=en-US&gl=US&ceid=US:en,"Air France-KLM on Monday confirmed it will move ahead with an order for four A350 large freighters, the new aircraft Airbus brought to market late last year to challenge Boeing in the manufacture of cargo jets.

Air France-KLM, has an option for four additional aircraft, said the A350 freighters are needed to meet growing demand for cargo lift. They will be based at Paris-Charles de Gaulle Airport, where Air France-KLM has a 150,000-square-foot global cargo hub. The airline currently operates two Boeing 777 freighters and utilizes the belly capacity of more than 100 widebody passenger aircraft for cargo.

Air France-KLM’s familiarity with the A350 played a big role in its decision. The order comes with full substitution rights to Airbus A350 passenger aircraft, which constitute the new flagship of Air France’s long-haul fleet. The airline currently operates 15 A350s and has another 23 on order.

“This order embodies Air France-KLM’s determination to strengthen its position on the buoyant cargo business,” said CEO Benjamin Smith. “The Airbus A350 passenger version has been instrumental to the improvement of our economic and environmental performance, while proving to be a passenger’s favorite. We are thrilled to be among the launch customers of its freighter version, which will significantly increase our capacity and give us the means to continue to provide the best service to our customers around the world.”



","{'label': 'Positive', 'score': 0.9991825222969055}",positive,0.9991825222969055,1
Airbus Tests Futuristic Wings - Manufacturing Business Technology,"Tue, 26 Apr 2022 07:00:00 GMT",https://news.google.com/rss/articles/CBMiSWh0dHBzOi8vd3d3Lm1idG1hZy5jb20vdmlkZW8vdmlkZW8vMjIxOTc0NDMvYWlyYnVzLXRlc3RzLWZ1dHVyaXN0aWMtd2luZ3PSAQA?oc=5&hl=en-US&gl=US&ceid=US:en,"Airbus recently completed wind-tunnel tests of the eXtra Performance Wing demonstrator.

Launched in September, the project turns to nature to improve wing aerodynamics and performance.

The hope is that the wings can be compatible with any future aircraft configuration and propulsion system.

The concept was first introduced for AlbatrossONE, a project that tested semi-aeroelastic hinged wings that unlocked during wind gusts or turbulence.

The new prototype will add gust sensors, pop-up spoilers and multifunctional trailing edges, to enable the active control of the wing.

For the test, the wings will be outfitted to a remote-controlled Cessna Citation VII business jet.

The company wants to validate the concept in low-speed wind-tunnel testing before moving towards flight tests.

The demonstrator is an Airbus UpNext project, the subsidiary created to fast-track future technologies.","{'label': 'Positive', 'score': 0.9909963607788086}",positive,0.9909963607788086,1
"Airbus, ITA Airways To Partner on eVTOL Work in Italy | AIN - Aviation International News","Wed, 27 Apr 2022 07:00:00 GMT",https://news.google.com/rss/articles/CBMibGh0dHBzOi8vd3d3LmFpbm9ubGluZS5jb20vYXZpYXRpb24tbmV3cy9haXItdHJhbnNwb3J0LzIwMjItMDQtMjcvYWlyYnVzLWl0YS1haXJ3YXlzLXBhcnRuZXItZXZ0b2wtd29yay1pdGFsedIBAA?oc=5&hl=en-US&gl=US&ceid=US:en,"Airbus, ITA Airways To Partner on eVTOL Work in Italy

An agreement between Airbus and ITA calls for recruiting partners to participate in the launch of the CityAirbus NextGen eVTOL operations in Italy.","{'label': 'Neutral', 'score': 0.9999790191650391}",neutral,0.9999790191650391,0
