Titre,Date de publication,URL,Contenu,sentiment_finbert,sentiment_label,sentiment_score,sentiment_numerique
Air Canada Selects Pratt & Whitney GTF™ Engines to Power Up to 44 Airbus A320neo Family Aircraft - PR Newswire,"Tue, 26 Apr 2022 07:00:00 GMT",https://news.google.com/rss/articles/CBMilgFodHRwczovL3d3dy5wcm5ld3N3aXJlLmNvbS9uZXdzLXJlbGVhc2VzL2Fpci1jYW5hZGEtc2VsZWN0cy1wcmF0dC0td2hpdG5leS1ndGYtZW5naW5lcy10by1wb3dlci11cC10by00NC1haXJidXMtYTMyMG5lby1mYW1pbHktYWlyY3JhZnQtMzAxNTMyNzUxLmh0bWzSAQA?oc=5&hl=en-US&gl=US&ceid=US:en,"EAST HARTFORD, Conn., April 26, 2022 /PRNewswire/ -- Pratt & Whitney, a division of Raytheon Technologies Corp. (NYSE: RTX) and Air Canada have announced the selection of Pratt & Whitney GTF™ engines to power 30 firm and 14 purchase right Airbus A321XLR aircraft. Pratt & Whitney will also provide Air Canada with engine maintenance through an EngineWise® Comprehensive service agreement. The first aircraft is expected to be delivered in the first quarter of 2024.

Air Canada has selected Pratt & Whitney's GTF engines to power 30 firm and 14 purchase right Airbus A321XLR aircraft. Pratt & Whitney will also provide Air Canada with engine maintenance through an EngineWise® Comprehensive service agreement.

""The Pratt & Whitney GTF family of engines have saved operators more than 600 million gallons of fuel and helped avoid six million metric tons of carbon emissions since it entered service in 2016,"" said Rick Deurloo, Chief Commercial Officer at Pratt & Whitney. ""What's good for the environment is also good for business, and marquee operators such as Air Canada will continue to serve their customers with the most efficient engines on offer today.""

In 2020, Air Canada became the first airline in Canada to operate the Airbus A220 family and the first in North America to operate A220-300 aircraft. The airline currently operates 28 A220-300 aircraft with an additional 17 on order. Pratt & Whitney has a long history with Air Canada, dating back to the airline's first aircraft, a Lockheed Model 10 Electra with Pratt & Whitney Wasp engines. Prior to the A220, Pratt & Whitney powered Air Canada's fleet of Boeing 767 aircraft.

""Air Canada is pleased to be partnering with Pratt & Whitney by selecting GTF engines for our new fleet of Airbus A321neo aircraft. The GTF's efficiency and reliability will help us lower costs and also allow us to expand our network. As well, the GTF's state-of-the-art technology will advance our environmental program by reducing emissions and noise,"" said Richard Steer, Senior Vice President, Operations and Express Carriers, at Air Canada.

The Pratt & Whitney GTF™ engine is the only geared propulsion system delivering industry-leading sustainability benefits, mature dispatch reliability and world-class operating costs. GTF engines for the Airbus A320neo family reduce fuel consumption and carbon emissions by 16 percent, regulated emissions by 50 percent and noise footprint by 75 percent. The engine's revolutionary geared fan architecture is the foundation for more sustainable aviation technologies in the decades ahead, with advancements like the Pratt & Whitney GTF Advantage™ engine and beyond. Learn more at pwgtf.com.

About Pratt & Whitney

Pratt & Whitney is a world leader in the design, manufacture and service of aircraft and helicopter engines, and auxiliary power units. To learn more visit www.prattwhitney.com. To receive press releases and other news directly, please sign up here.

[email protected]

+1 860 565 9600

SOURCE Pratt & Whitney","{'label': 'Positive', 'score': 0.9974870681762695}",positive,0.9974870681762695,1
Airbus to Explore Future of Travel Through Metaverse; Crowdsources with HeroX - PR Newswire,"Tue, 26 Apr 2022 07:00:00 GMT",https://news.google.com/rss/articles/CBMihAFodHRwczovL3d3dy5wcm5ld3N3aXJlLmNvbS9uZXdzLXJlbGVhc2VzL2FpcmJ1cy10by1leHBsb3JlLWZ1dHVyZS1vZi10cmF2ZWwtdGhyb3VnaC1tZXRhdmVyc2UtY3Jvd2Rzb3VyY2VzLXdpdGgtaGVyb3gtMzAxNTMyOTA0Lmh0bWzSAQA?oc=5&hl=en-US&gl=US&ceid=US:en,"Challenge Seeks Novel Ideas to Improve Travel Experience in the Metaverse with Prize Purse of $30,000

LEIDEN, Netherlands, April 26, 2022 /PRNewswire/ -- Airbus, the pioneer of sustainable aerospace for a safe and united world, and HeroX , the leading platform and open marketplace for crowdsourced solutions, today launched the crowdsourcing competition "" Metaverse and the Future of Flight ."" The challenge seeks innovative ways to use the metaverse to reimagine and elevate the traveler experience from departure to destination.

Challenge Seeks Novel Ideas to Improve Travel Experience in the Metaverse with Prize Purse of $30,000.

The digital world continues to grow in sophistication with tools like augmented reality or virtual reality and can now provide us a venue for experimenting and enhancing real-life experiences like travel. With this in mind, Airbus is looking for out-of-the-box thinkers to reenvison air travel by leveraging the metaverse's infinite range of possibility and potential.

""Innovation is part of our DNA,"" said Marc Fischer, SVP Cabin and Cargo Engineering, Airbus. ""We have a long history of pioneering new technologies. Metaverse is an unknown world and we'd like to understand how it can elevate our passengers' experience. This challenge is a perfect start.""

""We are on the verge of exciting travel breakthroughs, and the HeroX community of solvers is the perfect group to tap for innovative ideas,"" said Kal K. Sahota, CEO, HeroX. ""I am eager to see what the metaverse and their ingenuity can offer the everyday traveler.""

The Challenge: The Challenge is looking for immersive, experiential ways in which a passenger can interact with the metaverse during the travel process.

The Prize: Up to 5 participants submitting the top ideas will share a total prize purse of $30,000.

Eligibility to Compete and Win Prize(s): The prize is open to anyone aged 18 or older participating as an individual or as a team. Individual competitors and teams may originate from any country, as long as Official Sanctions do not prohibit participation (some restrictions apply).

To accept the challenge, visit www.Herox.com/AirbusMetaverse .

ABOUT HEROX

HeroX is a platform and open marketplace for crowdsourcing innovation and human ingenuity, co-founded in 2013 by serial entrepreneur, Christian Cotichini and XPRIZE Founder and Futurist, Peter Diamandis. HeroX offers a turnkey, easy-to-use platform that supports anyone, anywhere, to solve everyday business and world challenges using the power of the crowd. Uniquely positioned as the Social Network for Innovation, HeroX is the only place you can build, grow and curate your very own crowd.

Explore the latest challenges at www.herox.com/explore .

Media Contact:

Alexandra Pony

[email protected]

250.858.0656

SOURCE HeroX","{'label': 'Neutral', 'score': 0.5830854773521423}",neutral,0.5830854773521423,0
Delta (DAL) to Introduce Its Airbus A321neo Next Month - Yahoo Finance,"Mon, 04 Apr 2022 07:00:00 GMT",https://news.google.com/rss/articles/CBMiUGh0dHBzOi8vZmluYW5jZS55YWhvby5jb20vbmV3cy9kZWx0YS1kYWwtaW50cm9kdWNlLWFpcmJ1cy1hMzIxbmVvLTE0NTYwMjA2Ny5odG1s0gEA?oc=5&hl=en-US&gl=US&ceid=US:en,"To modernize its fleet, Delta Air Lines, Inc. DAL announced that it will start operating its first of 155 new Airbus A321neo aircraft from May 20, 2022. The debut flight using a new aircraft will take off from Delta's Boston hub and head for San Fransisco. In the coming months, Delta will further expand flight services on the Airbus A321neo plane to include destinations like Denver, San Diego and Seattle. While flights to Seattle will begin operating on Aug 11, services to San Diego and Denver will commence from Aug 20.

The Airbus A321neo being the latest addition to Delta is a fuel-efficient new-generation aircraft to help reinforce the airline’s position as an industry leader in executing environmentally-sustainable endeavors. Further, it enhances and elevates the passenger experience through the carrier's many investments in cabin configurations and products. Equipped with a total seating capacity of 194 (20 customers in First Class, 42 in Delta Comfort+ and 132 in the Main Cabin), the new jets will be deployed primarily across Delta’s extensive domestic network.

Delta will operate up to 155 daily nonstop flights to 53 locations this summer (more than 20% increase in capacity since its pre-pandemic peak in October 2019). By mid-August, Delta will serve each of Boston’s 20 most popular markets nonstop, including a nonstop service to five additional sites, namely Tel Aviv, Athens, Baltimore, Denver and San Diego.

Currently, DAL has purchase commitments for a total of 155 A321neos and will take delivery of these aircraft through 2027, mainly from the Airbus US Manufacturing Facility in Mobile, AL. Delta now has 235 new aircraft purchase commitments, including both widebody and narrowbody jets. This strengthens its strategic fleet objectives to streamline operations and drive productivity in a much sustainable fashion.

Such customer-friendly fleet-modernization exercises are expected to attract more and more traffic, thereby aiding top-line growth.

Story continues

Zacks Rank & Stocks to Consider

Delta currently carries a Zacks Rank #3 (Hold). Some better-ranked stocks in the broader Zacks Transportation sector are Expeditors International of Washington, Inc. EXPD, Old Dominion Freight Line, Inc. ODFL and Triton International Limited TRTN.

Expeditors delivers a surprise of 34.2%, on average, with its earnings having surpassed the Zacks Consensus Estimate in all the last four quarters. The uptick is contributing to the carrier’s airfreight revenues. We are optimistic about EXPD’s buyout of the Fleet Logistics’ Digital Platform. The acquisition boosted its online LTL shipping platform Koho. The move is in line with its focus on Digital Solutions.

EXPD currently sports a Zacks Rank #1 (Strong Buy). You can see the complete list of today’s Zacks #1 Rank stocks here.

The long-term expected earnings per share (EPS) (three-to-five years) growth rate for Old Dominion is pegged at 16%. ODFL is benefiting from the strong performance of its LTL segment owing to improved freight conditions. In 2021, revenues from the LTL services segment increased 30.7% on a year-over-year basis.

Driven by the tailwinds, the stock has risen 13.1% in the past year. ODFL currently carries a Zacks Rank #2 (Buy).

The long-term expected EPS (three-to-five years) growth rate for Triton is pegged at 10%. Gradual increases in trade volumes and container demand bode well for TRTN. With easing coronavirus-led restrictions in the United States and Europe, the company saw a strong rebound in its business in the third and the fourth quarter of 2020 as well as in each of the four quarters of 2021.

Driven by these positives, the stock has rallied 25.1% in the past year. TRTN currently carries a Zacks Rank of 2.





Want the latest recommendations from Zacks Investment Research? Today, you can download 7 Best Stocks for the Next 30 Days. Click to get this free report



Delta Air Lines, Inc. (DAL) : Free Stock Analysis Report



Expeditors International of Washington, Inc. (EXPD) : Free Stock Analysis Report



Old Dominion Freight Line, Inc. (ODFL) : Free Stock Analysis Report



Triton International Limited (TRTN) : Free Stock Analysis Report



To read this article on Zacks.com click here.



Zacks Investment Research","{'label': 'Positive', 'score': 0.8897007703781128}",positive,0.8897007703781128,1
"Airbus Weighs Further Delay in A350 Ramp-Up on Russia War, Qatar Legal Fight - Bloomberg","Mon, 04 Apr 2022 07:00:00 GMT",https://news.google.com/rss/articles/CBMicmh0dHBzOi8vd3d3LmJsb29tYmVyZy5jb20vbmV3cy9hcnRpY2xlcy8yMDIyLTA0LTA0L2FpcmJ1cy13ZWlnaHMtZnVydGhlci1kZWxheS1pbi1hMzUwLXJhbXAtdXAtZHVlLXRvLXJ1c3NpYS1xYXRhctIBAA?oc=5&hl=en-US&gl=US&ceid=US:en,"Airbus SE is weighing a further delay in its production plan for A350 widebody jets after sanctions on Russia and a legal fight with Qatar Airways weakened the outlook for deliveries, according to people familiar with the matter.

A goal of building six A350s a month by early 2023, which had been reiterated as recently as February, may now slide to the end of that year, said the people, who asked not to be named because the plans haven’t been set.","{'label': 'Negative', 'score': 0.9999988079071045}",negative,0.9999988079071045,-1
"Sanctioned oligarch linked to Airbus jet, $600 million yacht: photos - Business Insider","Sun, 24 Apr 2022 07:00:00 GMT",https://news.google.com/rss/articles/CBMibGh0dHBzOi8vd3d3LmJ1c2luZXNzaW5zaWRlci5jb20vb2xpZ2FyY2gtcnVzc2lhLXNhbmN0aW9ucy1haXJidXMtbWVnYXlhY2h0LWtyZW1saW4tNjAwLW1pbGxpb24tcGhvdG9zLTIwMjItNNIBcGh0dHBzOi8vd3d3LmJ1c2luZXNzaW5zaWRlci5jb20vb2xpZ2FyY2gtcnVzc2lhLXNhbmN0aW9ucy1haXJidXMtbWVnYXlhY2h0LWtyZW1saW4tNjAwLW1pbGxpb24tcGhvdG9zLTIwMjItND9hbXA?oc=5&hl=en-US&gl=US&ceid=US:en,"Sutton Place Estate

Sutton Place, Surrey. daves_archive_1/Wikimedia Commons.

The UK government said that Usmanov owned Sutton Place, a 16th-century estate located in Surrey, in the south of England.

The property is estimated to be valued at $40.5 million and is listed as a Grade I historic building, according to the OCCRP's asset tracker.

The mansion was owned by a series of wealthy men in the 20th century, per OCCRP, including the oil magnate J. Paul Getty.

The estate is not listed as belonging to an individual but instead to two companies in Cyprus, according to the tracker. A recent investigation by the Financial Times found a number of business links connecting Usmanov to the property, but could not trace it directly back to him.

A spokesperson for Usmanov told Insider that Sutton Place is not ""owned or used by Mr. Usmanov.""

""It is the property of the trusts whose beneficiary is his sister, and who has a family of her own. We have already stated that long ago, Mr. Usmanov transferred his real estate and other property into irrevocable family trusts. We have also emphasised that this had nothing to do with sanctions or an attempt to hide anything, but was driven by the wish to care for his relatives,"" the statement added.

The spokesperson said that Usmanov started to establish trusts 15 years ago, renouncing any rights he held to the assets he transferred into them.

It is not clear when the assets related to Sutton Place Estate were transferred into the trust.","{'label': 'Neutral', 'score': 0.9999980926513672}",neutral,0.9999980926513672,0
Second ocean-monitoring satellite completes environmental tests - Airbus,"Thu, 07 Apr 2022 07:00:00 GMT",https://news.google.com/rss/articles/CBMicmh0dHBzOi8vd3d3LmFpcmJ1cy5jb20vZW4vbmV3c3Jvb20vc3Rvcmllcy8yMDIyLTA0LXNlY29uZC1vY2Vhbi1tb25pdG9yaW5nLXNhdGVsbGl0ZS1jb21wbGV0ZXMtZW52aXJvbm1lbnRhbC10ZXN0c9IBAA?oc=5&hl=en-US&gl=US&ceid=US:en,"Friedrichshafen, 07 April 2022 - The ""Copernicus Sentinel-6"" mission is already delivering high-precision measurements of the topography of ocean surfaces through the first of two satellites, named “Sentinel-6 Michael Freilich”, launched in November 2020 and Airbus has just completed the environmental test campaign for the second satellite, Sentinel-6B. It will now be returned to its home base at Airbus’ satellite integration centre in Friedrichshafen (Germany) to make the final touches to the spacecraft.

The mission’s two satellites are built to measure the distance to the sea surface to an accuracy of a few centimetres and map it in a 10-day rhythm over a mission duration of up to seven years. Their purpose is to record changes in the height of the sea surfaces, variations in sea levels and analyse and observe ocean currents. Accurate observation of sea surface height changes provides information about global sea levels, the speed and direction of ocean currents and the heat stored in the oceans. The measurements – obtained from 1336 km above the Earth – are crucial for ocean modelling and predicting sea level rise.

This information helps governments and institutions establish effective protection for coastal regions. The data is also valuable for disaster management organisations, and for authorities carrying out urban planning, flood protection schemes, or dyke construction.

As a result of global warming, global sea levels are currently rising by an average of 3.3 millimetres per year - with potentially dramatic consequences for countries with densely populated coasts. On 22 March 2022 “Sentinel-6 Michael Freilich”, became the official reference satellite for global sea level measurements. This means that sea surface height data collected by other satellites will be compared to the information produced by “Sentinel-6 Michael Freilich” to ensure their accuracy.

Part of Europe’s Copernicus, Sentinel-6 is an international collaboration between ESA (European Space Agency), NASA (National Aeronautics and Space Administration), NOAA (National Oceanic and Atmospheric Administration) and Eumetsat (European Organisation for the Exploitation of Meteorological Satellites).

@AirbusSpace @ESA_EO @NASAJPL @CopernicusEU #Sentinel-6B #Friedrichshafen #sealevel #NextSpace #Sentinel6","{'label': 'Neutral', 'score': 0.9999833106994629}",neutral,0.9999833106994629,0
Airbus-led Digital Alliance Lands SAS As Launch Customer - Aviation Week,"Tue, 26 Apr 2022 07:00:00 GMT",https://news.google.com/rss/articles/CBMiaGh0dHBzOi8vYXZpYXRpb253ZWVrLmNvbS9zaG93cy1ldmVudHMvbXJvLWFtZXJpY2FzL2FpcmJ1cy1sZWQtZGlnaXRhbC1hbGxpYW5jZS1sYW5kcy1zYXMtbGF1bmNoLWN1c3RvbWVy0gEA?oc=5&hl=en-US&gl=US&ceid=US:en,"DALLAS—SAS Scandinavian Airlines will be the launch customer of a product developed by the Airbus-led Digital Alliance venture that targets predictive maintenance and other data-driven operational efficiency drivers, signing up for the partnership’s Skywise Predictive Maintenance Alliance (SPMA) offering.

The deal, announced at Aviation Week’s MRO Americas, will see SAS use the product to track parameters from various components on its Airbus A320-family fleet.

“Thanks to SPM Alliance, we will be able to pre-empt operational disruptions and accelerate maintenance decisions by predicting potential in-service issues across our large A320-family fleet,” said SAS Head of Technical Operations Marko Rudic. “This is the proactive approach to fleet technical management that SAS wants to take.”

The airline’s primary goals include providing its operations center team more visibility into each aircraft’s maintenance status. Aircraft that may need certain parts or services can be kept close to stations that can support them, for example, or off “high value” routes that the airline wants to protect from even slight disruptions, Rudic said. More broadly, knowing when components are approaching failure will help cut down on schedule disruptions.

The SAS deal gives the partnership its first customer for its debut product less than a year after the current, three-member alliance was rounded out.

Airbus and Delta Tech Ops launched it in 2019, with the manufacturer providing its Skywise data analytics platform and visibility into thousands of customer aircraft—including many non-Airbus models.

“Forty percent of the data coming into Skywise comes from non-Airbus aircraft,” said Airbus SVP Digital Solutions Lionel Rouby, adding that access to the data of its 125 customers is strictly controlled. “All of the data from our partners and customers is fully protected,” he said.

As an operator and a maintenance provider, Delta validates reliability and repair algorithms that are key to ensuring predictive maintenance works as advertised, said Mahendra Nair, Delta SVP fleet and tech ops supply chain.

In 2021, GE Digital joined the alliance, bringing with it data from about 50% of the commercial fleet via its array of products, including flight data monitoring and fuel management, said Andrew Coleman, president of GE Digital’s Aviation Software business.

Each company was diligently working on its own data-driven maintenance projects before the alliance. Delta in 2015 launched Airbus’ Prognostics and Risks Management service, while both GE Digital and Airbus have customer-facing products. Improvements in technology, including how to create effective algorithms for major data-analysis projects, and demand for a broad, product-agnostic suite of products, drove the group to team up.

“As airlines are on the path to recovery, it is more important than ever to support them in saving costs and optimizing their fleets’ availability,” Rouby said. “This is precisely what SPM Alliance does: covering a wide scope of equipment, our new solution brings another dimension to predictive maintenance that will considerably reduce unplanned maintenance.”

The joint effort will likely expand, as companies from both within aviation and the tech world are taking notice of the alliance’s work, Coleman said.

“It’s not a closed ecosystem just between the three of us,” he added.","{'label': 'Neutral', 'score': 0.9170509576797485}",neutral,0.9170509576797485,0
Airbus Ventures Invests in Swiss Cleantech Startup Bcomp - Business Wire,"Tue, 05 Apr 2022 07:00:00 GMT",https://news.google.com/rss/articles/CBMicWh0dHBzOi8vd3d3LmJ1c2luZXNzd2lyZS5jb20vbmV3cy9ob21lLzIwMjIwNDA1MDA1NDc5L2VuL0FpcmJ1cy1WZW50dXJlcy1JbnZlc3RzLWluLVN3aXNzLUNsZWFudGVjaC1TdGFydHVwLUJjb21w0gEA?oc=5&hl=en-US&gl=US&ceid=US:en,"Founded by Christian Fischer and Julien Rion, the Bcomp team photographed above at the company’s headquarters and production facility in Fribourg, Switzerland. (Source: Bcomp)

MENLO PARK, Calif.--(BUSINESS WIRE)--Airbus Ventures announces its investment in Bcomp’s oversubscribed Series B financing of CHF 32.4 million alongside a group of mobility, financial, and impact investors led by BMW i Ventures. An advanced provider of eco-efficient Natural Fibre Composites (NFCs) for performance and weight reducing applications, Bcomp will use this new funding to scale its workforce, increase its domestic and global production capacity, and strengthen its commercial footprint.

Traditional materials such as carbon fibres, glass fibres and plastics are energy intensive to produce and often hard to separate and recycle. In response to these environmental challenges, Bcomp’s natural fibre-based solutions enable weight reduction, dematerialisation, use of renewable raw materials, and viable end-of-life options.

“The success of this investment round is a testament to the many years of hard work from the entire team,” remarks Bcomp Founder and CEO Christian Fischer. “We are pleased to welcome Airbus Ventures into our group of investors, dedicated to supporting Bcomp’s ambitious global strategy and advancing our collective contribution to the circular economy.”

Bcomp’s proprietary NFCs stemmed from a garage project in 2011 with a mission to create lightweight, high-performance skis. A decade later, the company now powers a wide array of advanced applications across automotive, aerospace, mobility, maritime, and athletics. Their customer portfolio includes collaborations with BMW, Volvo Cars, and Porsche AG.

“Driven by a remarkable team, Bcomp’s new class of low-carbon materials has new and exciting potential to energise aerospace and adjacent industries,” explains Airbus Ventures’ Financial Officer, Claas Kohl. “We at Airbus Ventures are eager to advance technologies committed to addressing our planet’s greatest challenges, and we are honoured to help fuel Bcomp’s next growth phase on their important journey to generating long-term, measurable impact.”

Harnessing the properties of natural fibres, Bcomp’s ampliTex™ and powerRibs™ technologies can be used to produce composites that are light and stiff, while reducing cradle-to-gate emissions. Used in several high-profile applications, they offer significantly better vibration damping than other commonly used composites.

“As a firm, we’re consciously focused on investing in companies, like Bcomp, devoted to sustainably benefiting and protecting planet Earth, in-line with the fund’s maturing ESG objectives,” notes Airbus Ventures Managing Partner Thomas d’Halluin. “Together with our entrepreneurs we aim to leverage our shared international platform to help amplify critical capabilities for collaboration, tackle immediate planetary system needs, and help establish more equitable and sustainable system futures.”

Learn more about Airbus Ventures’ platform and vision here.

About Bcomp

Bcomp™ is a Swiss cleantech company and ESG-enabler that develops and sells sustainable lightweighting solutions. Its proprietary natural fibre-based reinforcement technologies ampliTex™ and powerRibs™ reduce environmental impact in a wide range of high-performance sectors, including automotive, infrastructure, aerospace, and athletics. The Bcomp team offers its customers cutting-edge engineering support from idea to final part, out of its Fribourg headquarters. More information: www.bcomp.ch/

About Airbus Ventures

Headquartered in Silicon Valley, with offices in Toulouse and Tokyo, Airbus Ventures is a fast-moving, early-stage venture capital company that independently funds and supports startups set to shift both the aerospace industry and our planetary system to a sustainable future. Airbus Ventures has helped aspiring innovators reach new dimensions of achievement since 2015.","{'label': 'Positive', 'score': 0.9482797384262085}",positive,0.9482797384262085,1
