Titre,Date de publication,URL,Contenu
Airbus Safran Launchers and Dassault Systèmes Confirm Collaboration for the Design and Development of Ariane 6 - Business Wire,"Tue, 29 Nov 2016 08:00:00 GMT",https://news.google.com/rss/articles/CBMirAFodHRwczovL3d3dy5idXNpbmVzc3dpcmUuY29tL25ld3MvaG9tZS8yMDE2MTEyODAwNTQzOC9lbi9BaXJidXMtU2FmcmFuLUxhdW5jaGVycy1hbmQtRGFzc2F1bHQtU3lzdCVDMyVBOG1lcy1Db25maXJtLUNvbGxhYm9yYXRpb24tZm9yLXRoZS1EZXNpZ24tYW5kLURldmVsb3BtZW50LW9mLUFyaWFuZS020gEA?oc=5&hl=en-US&gl=US&ceid=US:en,"VELIZY-VILLACOUBLAY, France--(BUSINESS WIRE)--Dassault Systèmes (Paris:DSY) (Euronext Paris: #13065, DSY.PA), the 3DEXPERIENCE Company, world leader in 3D design software, 3D Digital Mock Up and Product Lifecycle Management (PLM) solutions, today announced that it confirms its long-standing collaboration with Airbus Safran Launchers, developer and supplier of solutions for civil and military space launchers and the industrial prime contractor of Ariane 6, the European Space Agency’s next generation launcher. More than 700 engineers working on the development of Ariane 6 across multiple sites in Europe, including partners, are using Dassault Systèmes’ solutions for the systems architecture, the detailed design definition and the validation of propulsions and the space vehicle.

Dassault Systèmes’ “Winning Program” industry solution experience has been a key enabler to perform multiple trade-off studies, explore a greater number of alternatives and accelerate the decision-making process to select the most competitive configurations for Ariane 6. The selected architecture, an Airbus Safran Launchers digital asset, will be optimized and continuously validated during the overall development phases.

Such digital assets are created and validated from a collaborative digital mock up that helps avoid errors, minimize changes and contribute to reducing months from the development and industrial ramp-up phases. Dassault Systèmes’ applications are being used for design in context processes, internal and transnational co-design reviews, and program reviews leveraging virtual reality that enable the accurate definition of all complex manufacturing operations.

“For Ariane 6, Airbus Safran Launchers continues to build on the accomplishment and value created with Dassault Systèmes’ solutions that contributed to the design of Ariane 5,” said Alain Charmeau, CEO, Airbus Safran Launchers. “These solutions, based on a high-fidelity digital mock up shared by our partners, remain at the heart of our industrial model to develop the launcher across Europe.”

The space sector is subject to fierce competition as never before. Startups worldwide and companies in emerging markets are forcing more established businesses to transform their operations in order to provide versatile, high-performing, and cost competitive launchers. “Winning Program” was designed for aerospace and defense companies looking to optimize early program phases and program development using design, simulation and collaboration. With advanced levels of engineering detail and shared knowledge available in the conceptual design phase, “Winning Program” can significantly improve adherence to program costs, performance and schedule.

“We are proud to bring our partnership for innovation and performance with Airbus Safran Launchers to an upper level. In times of consumerization of space, our collaboration aims to design and develop a new experience-focused model for space launch, and know from the earliest stages that Ariane 6 can be delivered on budget, to specification and on time,” said Bernard Charlès, Vice Chairman and CEO, Dassault Systèmes. “Dassault Systèmes’ unmatched Aerospace and Defense industry solution experiences enable Airbus Safran Launchers to explore the possible, collaborate with clients and through all disciplines and stakeholders within the ecosystem, and configure the right concept. Together we can harness the power of design and digital heritage to transform the industry.”

For more information on Dassault Systèmes’ industry solution experiences for Aerospace & Defense, visit: http://www.3ds.com/industries/aerospace-defense

###

About Dassault Systèmes

Dassault Systèmes, the 3DEXPERIENCE Company, provides business and people with virtual universes to imagine sustainable innovations. Its world-leading solutions transform the way products are designed, produced, and supported. Dassault Systèmes’ collaborative solutions foster social innovation, expanding possibilities for the virtual world to improve the real world. The group brings value to over 210,000 customers of all sizes, in all industries, in more than 140 countries. For more information, visit www.3ds.com.

3DEXPERIENCE, the Compass logo and the 3DS logo, CATIA, SOLIDWORKS, ENOVIA, DELMIA, SIMULIA, GEOVIA, EXALEAD, 3D VIA, BIOVIA, NETVIBES and 3DEXCITE are registered trademarks of Dassault Systèmes or its subsidiaries in the US and/or other countries."
Peach Aviation orders 10 A320neo and three A320ceo - Airbus,"Fri, 18 Nov 2016 08:00:00 GMT",https://news.google.com/rss/articles/CBMibGh0dHBzOi8vd3d3LmFpcmJ1cy5jb20vZW4vbmV3c3Jvb20vcHJlc3MtcmVsZWFzZXMvMjAxNi0xMS1wZWFjaC1hdmlhdGlvbi1vcmRlcnMtMTAtYTMyMG5lby1hbmQtdGhyZWUtYTMyMGNlb9IBAA?oc=5&hl=en-US&gl=US&ceid=US:en,"Summary

Airline to become first low cost carrier in Japan to operate A320neo

With a firm order for 10 A320neo aircraft (along with three A320ceo versions) signed on 18 November 2016, Peach Aviation will be the first low cost carrier in Japan to operate the latest member of Airbus’ popular A320 Family

Japan’s Peach Aviation has signed a firm order with Airbus for the purchase of 10 A320neo and three A320ceo. The order was announced at a signing ceremony in Tokyo today, attended by Shinichi Inoue, Managing Director and CEO, Peach Aviation and Fabrice Brégier, Airbus President and CEO.The newly-ordered aircraft will join an existing A320 Family fleet at Peach currently comprising 18 A320ceo and another two on order. With the addition of the A320neo, the airline will become the first low cost carrier (LCC) in Japan to operate the latest member of the popular A320 Family.“Our A320 fleet is growing as our route network expands, not only in the domestic market but also to various Asian cities,” said Shinichi Inoue. “By introducing the A320neo to our fleet we will enhance even further our profitability while continuing to offer our passengers greater comfort with 18-inch wide seats.” We believe that the A320neo will strengthen our position in the competitive Japanese aviation market.”“We are pleased that Peach Aviation has placed this additional order for the A320 Family,” said Fabrice Brégier. “This further strengthens the position of the A320 Family as the preferred choice of airlines in the low cost sector in Japan. We are honoured by the confidence Peach Aviation has once again placed in our products and are sure that the A320 Family will contribute to the airline’s ongoing success as it expands in the domestic and regional markets.The A320 Family is the world’s best-selling single aisle product line. To date, the Family has won about 12,800 orders and more than 7,250 aircraft have been delivered to some 400 customers and operators worldwide.The A320neo Family incorporates the latest engines and aerodynamic enhancements, delivering more than 15 percent in fuel savings per seat. These features have seen the A320neo Family capture a market share of over 60 per cent in its category, with about 4,800 orders received since its launch in 2010 from 88 customers, including Peach Aviation.Featuring the widest cabin in the single aisle market, all members of the A320 Family offer unmatched comfort in all classes with 18” wide seats in Economy as standard. With one aircraft in four sizes (A318, A319, A320, and A321), the A320 Family seats from 100 to 240 passengers, seamlessly covering the entire single-aisle segment from low to high-density domestic to longer range routes."
Airbus A350-1000 takes maiden flight – Business Traveller - Business Traveller,"Thu, 24 Nov 2016 08:00:00 GMT",https://news.google.com/rss/articles/CBMiYmh0dHBzOi8vd3d3LmJ1c2luZXNzdHJhdmVsbGVyLmNvbS9idXNpbmVzcy10cmF2ZWwvMjAxNi8xMS8yNC9haXJidXMtYTM1MC0xMDAwLXRha2VzLW1haWRlbi1mbGlnaHQv0gEA?oc=5&hl=en-US&gl=US&ceid=US:en,"Airbus is today carrying out the maiden flight of its A350-1000 aircraft, ahead of its scheduled entry into service next year.

The aircraft is the manufacturer’s largest twin-engined airliner ever, and can accommodate 40 more passengers than the existing A350-900.

The new variant also features “a modified wing trailing-edge, new six-wheel main landing gears and more powerful Rolls-Royce Trent XWB-97 engines”.

The first flight took off from Blagnac, Toulouse at 1042 local time, with six crew including three in the cockpit, and a further three monitoring test parameters at the flight-test-instrumentation station behind the cockpit.

Airbus said it had benefitted from the experience of the A350-900 test campaign, resulting in a shorter development programme for the A350-1000.

Qatar Airways is the launch customer for the aircraft– a total of 11 customers have placed orders for 195 A350-1000s.

airbus.com"
A Success: Airbus' First A350-1000 Completes Its Maiden Flight in Toulouse - AirlineGeeks.com,"Thu, 24 Nov 2016 08:00:00 GMT",https://news.google.com/rss/articles/CBMiTmh0dHBzOi8vYWlybGluZWdlZWtzLmNvbS8yMDE2LzExLzI0L2FpcmJ1cy1hMzUwLTEwMDAtc3VjY2Vzc2Z1bC1tYWlkZW4tZmxpZ2h0L9IBAA?oc=5&hl=en-US&gl=US&ceid=US:en,"[ Planes ] By Thomas Gilpin

Airbus reached a key goal in the development of the A350-1000 after a successful maiden flight was made from Toulouse-Blagnac airport today. The initial flight was scheduled to take place at approximately 10:30 a.m. local time and, after waiting briefly at a holding position, the aircraft took-off at 10:42 a.m. from Runway 32L, shadowed closely by a Dassault Falcon 20 chase plane. The aircraft then turned onto a southbound heading of 190, climbing to 10000 feet, to start its initial flight testing.

This was followed by a test flight lasting four hours over southwest France. In the cockpit were experimental test pilots Hughes Van Der Stitchel and Frank Chapman, along with Test Flight Engineer Gerard Maisonneuve. For approximately 3 hours, they flew at 10,000 feet and kept to around 250 knots, then tested some higher speeds and climbed to 25,000 feet, before returning to 10,000 feet and back to Toulouse-Blagnac.

During the flight, Christophe Cail, the Airbus Chief Test Pilot said, “The first flight is going very well, it took off around three hours ago. It climbed to 10,000 feet and is still at that level, exploring the flight envelope of the aircraft from low speed, high speed, all the flap configuration. And so far, so good; everything is working well.”

With a stretched version of the A350-900 fuselage, the A350-1000 is the longest in the A350XWB family, and the largest twin-engine aircraft made by Airbus. Previously, the company had plans for a smaller A350-800, but these were canceled due to the A330neo development.

Notable external appearance differences of the A350-1000 to the A350-900 include the 74-meter fuselage, making it seven meters longer, and the switch from four wheels to six wheel bogies for the main undercarriage. There are also key differences in the overall operational performances.

Among these differences are a longer range of 7950 nautical miles, a standard layout allowing for 366 passengers (including 18-inch seats in economy), and a 25% lower operating cost compared to various competitors.

The aircraft is powered by a higher-thrust version of the Rolls-Royce Trent XWB-97 engines, producing 97000 lbs of takeoff thrust, and is designed for high efficiency, maximum reliability, and optimized performance.

Viewed as a replacement for the A340 and possibly the A330 family, the A350 already has regulatory approval for a common type rating between the two aircraft. The first A350 aircraft to take to the skies was the A350-900, on 14th June 2013, with type certification given just over a year later in September 2014. With the introduction of the A350-1000, the aircraft is now in direct competition with the Boeing 777.

Published figures from Airbus currently show that 195 aircraft are on order, spread between 11 operators from five continents, with the first planned delivery to Qatar Airways in the second half of 2017.

With the success of this fight, further testing can now begin in earnest. Due to experience with the A350-900, this is expected to take only around a year with a three aircraft test fleet.

Commenting on these test aircraft, Christophe Cail added, “The first one was MSN059 and this model is equipped with a heavy flight test installation. There is no cabin in the back, so on this aircraft we have indicated to open the flight envelope, to test braking systems, to test the engines, to do lot a lot of tests on the aircraft. We have a second one with a heavy flight test installation, MSN071. This one will fly in the coming weeks and will help the first aircraft just to continue tests on the wire system. And there will be a third one, MSN065, and this one, unlike the others, will be fitted with a cabin. It will mainly test the air conditioning the cabin, the pressurization of the aircraft.”

After the completion of the flight, Airbus President and CEO Fabrice Brégier said, “We have seen today the world’s most modern and efficient passenger aircraft – the A350-1000 – in action for the very first time, adding soon to the successful A350 Family. My congratulations and thanks go to all the teams who have contributed to make today’s flight happen.”

*All photos provided by Airbus

Author Thomas Gilpin From a very young age, Thomas has been passionate about everything related to aviation. Beginning with air show attendance and flight simulation, this evolved into a desire to adopt a profession in the industry. After achieving a degree in Air Transport Operations and Management, Thomas worked for easyJet, in an operational safety role, before changing to a ground operations role at Swissport. With aviation filling both his time of work and of play, his mind is never far from the subject."
Shocking photos reveal damage to Airbus caused by a bird strike - Daily Mail,"Wed, 23 Nov 2016 08:00:00 GMT",https://news.google.com/rss/articles/CBMiqAFodHRwczovL3d3dy5kYWlseW1haWwuY28udWsvdHJhdmVsL3RyYXZlbF9uZXdzL2FydGljbGUtMzk2NDM5OC9QbGFuZS1sYW5kcy1haXJwb3J0LWRlYWQtZWFnbGUtZW1iZWRkZWQtd2luZy1TaG9ja2luZy1waG90b3MtcmV2ZWFsLWRhbWFnZS1BaXJidXMtY2F1c2VkLWJpcmQtc3RyaWtlLmh0bWzSAawBaHR0cHM6Ly93d3cuZGFpbHltYWlsLmNvLnVrL3RyYXZlbC90cmF2ZWxfbmV3cy9hcnRpY2xlLTM5NjQzOTgvYW1wL1BsYW5lLWxhbmRzLWFpcnBvcnQtZGVhZC1lYWdsZS1lbWJlZGRlZC13aW5nLVNob2NraW5nLXBob3Rvcy1yZXZlYWwtZGFtYWdlLUFpcmJ1cy1jYXVzZWQtYmlyZC1zdHJpa2UuaHRtbA?oc=5&hl=en-US&gl=US&ceid=US:en,"Shocking photos have revealed the damage to a Saudi Arabian Airlines plane caused by a bird strike.

A passenger on the tarmac spotted a gaping hole in the Airbus A333’s left wing and on closer inspection staff discovered a dead bird - seemingly an eagle - embedded in the aircraft.

The passenger jet had landed at Jeddah, Saudi Arabia, from Dammam on the east coast of the country, reportedly without incident.

A passenger on the tarmac spotted a gaping hole in the Airbus A333’s left wing

According to Aviation Herald, flight SV-771 ‘performed a seemingly uneventful flight’ despite the creature becoming lodged in the plane.

The website claims that Arabic media are reporting that the damage was only spotted by a flyer as crew prepared the aircraft for a domestic flight to Riyadh.

As a result passengers on flight SV-550 were delayed for three hours before boarding a replacement A330 aircraft.

Graphic pictures above show the dead bird being removed from the wing

The incident took place on November 16 and the aircraft has reportedly remained on the ground since the discovery.

Graphic pictures have emerged of the dead bird being removed from the wing.

MailOnline has contacted Saudi Airlines for comment."
Emirates airline says Rolls-Royce's Airbus A380 engines not up to standard - The National,"Sat, 19 Nov 2016 08:00:00 GMT",https://news.google.com/rss/articles/CBMie2h0dHBzOi8vd3d3LnRoZW5hdGlvbmFsbmV3cy5jb20vYnVzaW5lc3MvZW1pcmF0ZXMtYWlybGluZS1zYXlzLXJvbGxzLXJveWNlcy1haXJidXMtYTM4MC1lbmdpbmVzLW5vdC11cC10by1zdGFuZGFyZC0xLjIyNDIzMdIBAA?oc=5&hl=en-US&gl=US&ceid=US:en,"Emirates, the world’s biggest long-haul airline, said it’s unhappy with performance shortfalls afflicting US$6.1 billion’s worth of Rolls-Royce engines ordered to power a batch of 50 Airbus A380 superjumbos.

Feedback on the Trent 900 powerplants indicates “technical issues” that need to be resolved before the first plane is delivered to Emirates next month, Tim Clark, the Dubai-carrier’s president, said on Friday in Frankfurt.

“We have a new engine coming on and there are some issues with that at the moment,” Mr Clark said at a media briefing. “We want the engines as promised in the contract.”

Emirates last year ordered 217 Trent 900s - sufficient to power the 50 four-engine A380s, plus spares - after previously purchasing GP7000 powerplants from an alliance of General Electric and Pratt & Whitney for its first 90 superjumbos. The deal with Rolls included unspecified “quality improvements”.

Mr Clark said Emirates will “hopefully” still take the first Rolls-Royce powered plane on December 2 as planned, adding that talks are under way with the manufacturer on resolving the performance problems and whether it should compensate the airline.

London-based Rolls-Royce said in an email that it is “working with Emirates and Airbus to meet the planned entry into service of the Trent-powered A380 within the Emirates fleet”.

Mr Clark said that officially deferring delivery of the planes isn’t an option since doing so would impact the model’s entire supply chain. Emirates is due to take 25 Rolls-powered A380s between now and 2019, plus 25 more from 2021 on.

While the Trent 900 had its first test flight in 2004 and has a greater spread of A380 operators than the GE-Pratt model, it had previously been excluded from the world’s largest superjumbo fleet. Emirates switched supplier on the understanding that Rolls would help develop an upgraded and re-engined “Neo” version to help pare operating costs and extend the model’s lifespan.

A lack of interest in buying more double-deckers among other carriers has effectively killed off that plan, and Airbus is now planning to slow production to just one plane per month in 2018 to eke out the backlog and keep its options open in case demand revives.

Emirates took delivery of its 85th A380 this month and operates almost 250 aircraft in total, all of them either superjumbos or Boeing 777s.

* Bloomberg"
Aircalin inks first Airbus A330neo order in Oceania market - Airline Ratings,"Tue, 29 Nov 2016 08:00:00 GMT",https://news.google.com/rss/articles/CBMiX2h0dHBzOi8vd3d3LmFpcmxpbmVyYXRpbmdzLmNvbS9uZXdzL2FpcmNhbGluLWlua3MtZmlyc3QtYWlyYnVzLWEzMzBuZW8tb3JkZXItaW4tb2NlYW5pYS1tYXJrZXQv0gEA?oc=5&hl=en-US&gl=US&ceid=US:en,"The toe-to-toe battle for aircraft sales in the Pacific region continues with Airbus registering a win on Tuesday with a maiden A330neo deal in the Oceania market.

New Caledonian carrier Aircalin signed an agreement for two A320neos and two A330-900 aircraft at a ceremony in the French territory but has yet to reveal details about engines or cabin configuration.

The narrow bodies will be deployed on existing regional routes such as Australia and New Zealand, while the A330neos will boost services to Japan as well as potentially open new routes to destinations such as China.

Airbus touts the A330neo as the most cost-efficient aircraft in its size category, offering a 14 per cent reduction in fuel burn, a longer non-stop flying range of up to 4000 nautical miles and the lowest maintenance costs of any aircraft.

It hopes other airlines will take note of the Aircalin decision.

“They may only be a small airline but I think they’re well known for being very well run, very dependable and all of that,’’ Airbus executive vice president Europe, Africa and the Pacific Christopher Buckley told AirlineRatings from Noumea. “Hopefully it will lead to a few other A330neos elsewhere … so it’s an important one for us.’’

Although not the biggest of markets, Oceania — which includes Australia, New Zealand and the Pacific islands — is still forecast to require more than 1000 new aircraft over the next 20 years worth $US160 billion. Passenger traffic in the region is expected to grow at a respectable clip of 4.7 per cent per year.

Both major manufacturers are counting coup wherever they can and Buckley conceded competition was tough.

Boeing announced last week that Fiji Airways had inked a deal to replace five Boeing 737s with five B737 MAX’s to be used on the carrier’s short- and medium- haul network to destinations such as Australia, New Zealand, Hawaii, Kiribati, Samoa, Solomon Islands, Tonga and Vanuatu. The first two of the five brand new B737 MAX 8 aircraft will arrive in 2018 with the others coming a year later.

Fiji Airways chief executive Andre Viljoen said the decision had been made after “an extremely exhaustive procurement and selection process’’ that highlighted improved operating economics and product enhancements as compelling reasons for the decision.

It was a similar story at Aircalin on Tuesday as chief executive Didier Tappero outlined the reasons for sticking with Airbus.

“As part of our plan to boost tourism to New Caledonia, Aircalin has made a strategic decision to renew its complete fleet with the A320neo and the A330neo to grow routes and connect New Caledonia to the region,” Tappero said. “The neo aircraft, with its state-of-the-art technology, will burn less fuel, lower our operational costs and offer our loyal passengers the highest standards in cabin comfort.”

Buckley argues his US rival is competing even more aggressively because it needed to fill 737 MAX production slots as it continues to ramp up the rate at its Seattle factory. But he said Airbus was still ahead.

He cited one Airbus advantage as the flexibility provided by the bigger A321neo, a plane taken by Air New Zealand and which gives the A320 family a variety of ranges and capacities. He also believed the A320 family was best for the passengers and had superior economics.

“We never underestimate the competition out there,’’ he said. “We just have to make sure the airlines understand exactly what our aircraft can do. ‘’

One sale Airbus is keen to make in Oceania was highlighted on Friday when latest version of Airbus A350, the bigger A350-1000, took to the air on its first test flight.

The A350-900 is already in service and Buckley said the manufacturer was pleased with the way it was travelling, despite some “little niggles’’.

“It wouldn’t be any secret to say we’d certainly love to see some 350s in this part of the world,’’ he said, noting there were long-term opportunities for he aircraft as Boeing 777 replacement at Air New Zealand and as a Boeing 747 replacement at Qantas.

Airbus is particularly interested in Qantas plans for ultra long-haul routes to destinations such as Europe and is introducing a ULR version of the A350-900 for Singapore Airlines.

“We’d be extremely interested in trying to make something work at Qantas with future derivatives, what we might call an ultra-long range version of the 350-900s and potentially the -1000 as well,’’ he said, noting that the question was what Airbus could offer in the gap between its A380 superjumbo and the Boeing 787-9.

“So in the long term, and I think it is quite the long term, there is a window of opportunity.’’"
