Titre,Date de publication,URL,Contenu
Airbus and JSAT sign cooperation agreement for the third SpaceDataHighway node - Airbus,"Fri, 08 Feb 2019 08:00:00 GMT",https://news.google.com/rss/articles/CBMicmh0dHBzOi8vd3d3LmFpcmJ1cy5jb20vZW4vbmV3c3Jvb20vcHJlc3MtcmVsZWFzZXMvMjAxOS0wMi1haXJidXMtYW5kLWpzYXQtc2lnbi1jb29wZXJhdGlvbi1hZ3JlZW1lbnQtZm9yLXRoZS10aGlyZNIBAA?oc=5&hl=en-US&gl=US&ceid=US:en,"@AirbusSpace

Tokyo, 8 February 2019 – Airbus and Japanese telecommunications satellite operator SKY Perfect JSAT have signed a cooperation agreement for the design preparation of the EDRS-D node. This third communication node of the SpaceDataHighway system is to be positioned over the Asia-Pacific region before 2025. EDRS-D will lead to a significant increase in the system’s communication capacity and considerably expand its coverage.

This agreement concerns the co-financing of design and development studies for the satellite payload, as well as of the system as a whole, in addition to the marketing of the SpaceDataHighway service by SKY Perfect JSAT in Japan. With this agreement, the total amount of the investment in the extension of the SpaceDataHighway stands at nearly € 15 million.

The future EDRS-D payload will consist of three next-generation laser communication terminals (LCT) to allow simultaneous communication with several satellites, as well as aircraft and UAVs. These laser terminals will have broader bandwidth, bi-directional and interoperable communication capability with Japanese laser terminals. Thus, enabling a greater range for geo-geo crosslinks with another geostationary SpaceDataHighway satellites at a distance of up to 75,000 km. This will to offer near real-time relaying of data from the other side of the world.

The SpaceDataHighway is the world’s first ‘optical fibre’ network in the sky based on cutting-edge laser technology. It will be a unique system of geostationary satellites permanently fixed over a network of ground stations, with the first – EDRS-A – already in space. Each day, it can relay up to 40 terabytes of data acquired by observation satellites, UAVs and manned aircraft, at a rate of 1.8 Gbit/s.

The relay satellites are designed to lock on to low-orbiting earth observation satellites via laser and collect their data as they travel thousands of kilometres below, scanning land and oceans. The SpaceDataHighway system then immediately sends the collected data down to Earth from its higher position hovering in geostationary orbit, acting as a data relay node. This process allows the observation satellites to continuously downlink the information they are gathering, instead of having to store it until they travel over their own ground station. That way, they can send down more data, more quickly.

Since the end of 2016, the SpaceDataHighway system has, on a daily basis, been transmitting the images of Earth acquired by the Copernicus programme’s four Sentinel observation satellites. It has increased the amount of data the satellites relay down to Europe by around 50% for Sentinel-1, and reducing the revisit time to map the whole world from 10 days to 5 days for Sentinel-2.



The SpaceDataHighway is a public–private partnership between the European Space Agency (ESA) and Airbus, with the laser terminals developed by Tesat-Spacecom and the DLR German Space Administration. EDRS-A, the first SpaceDataHighway relay satellite launched in January 2016, offers coverage from the American East Coast to India. A second satellite will be launched in mid-2019. It will double the system’s capacity and extend the coverage and redundancy of the system.

http://spacedatahighway.airbus.com/



About Airbus

Airbus is a global leader in aeronautics, space and related services. In 2017 it generated revenues of € 59 billion restated for IFRS 15 and employed a workforce of around 129,000. Airbus offers the most comprehensive range of passenger airliners from 100 to more than 600 seats. Airbus is also a European leader providing tanker, combat, transport and mission aircraft, as well as one of the world’s leading space companies. In helicopters, Airbus provides the most efficient civil and military rotorcraft solutions worldwide."
Airbus to stop production of A380 - Northwest Arkansas Democrat-Gazette,"Fri, 15 Feb 2019 08:00:00 GMT",https://news.google.com/rss/articles/CBMiU2h0dHBzOi8vd3d3Lm53YW9ubGluZS5jb20vbmV3cy8yMDE5L2ZlYi8xNS9haXJidXMtdG8tc3RvcC1wcm9kdWN0aW9uLW9mLWEzODAtMjAxOTAv0gEA?oc=5&hl=en-US&gl=US&ceid=US:en,"TOULOUSE, France -- Airbus will cease production of its mammoth A380 passenger jet, an engineering marvel that nevertheless couldn't keep up with shifts in the way people fly, the European aircraft-maker said Thursday.

Citing reduced orders from Emirates Airline, a major customer, and an inability to find other buyers, the company said it would halt deliveries of the jumbo jetliner in 2021, although it said it would continue to support existing A380s.

""As a result of this decision we have no substantial A380 backlog and hence no basis to sustain production, despite all our sales efforts with other airlines in recent years,"" the company's chief executive, Tom Enders, said in a statement. ""Today's announcement is painful for us and the A380 communities worldwide.""

The decision will lead to job cuts at Airbus, potentially affecting as many as 3,500 of its 134,000 employees over the next three years. Airbus said it would start discussions in the next few weeks about the consequences for its workforce.

The announcement overshadowed the company's announcement on Thursday of its full-year results. Its net income rose 29 percent in 2018 to about $3.5 billion.

Development talks for the plane began in 2000, meant to be Airbus' 21st-century answer to rival Boeing's 1960s-era 747, and one of the most ambitious endeavors in aviation. Its four Rolls-Royce engines were quieter than ever, far out on the extra-long wings. Carbon-fiber technology was used for the body to make it lighter and easier to maneuver. Its double-decker construction allowed room for bars, duty-free shops and even showers.

From its inception, the A380 was a grand European project. The wings, like those of all Airbus aircraft, came from the U.K., and components were ferried across the continent from production sites in Germany and France. The giant fuselage tubes were taken by barge and flatbed truck to the main facility in Toulouse, and the planes were then painted and kitted out in Hamburg. Teams from across the region joined colleagues at other sites during crunch times, the bulbous Beluga freight planes would crisscross countries with parts, and the A380 was a popular backdrop at air shows for politicians celebrating Europe's achievements.

Airbus spent $25 billion developing the aircraft, which can carry more than 500 passengers. It was built for a time when crowded airports would demand that planes carry more people to reduce congestion.

But flight traffic instead shifted to smaller planes, which are cheaper to maintain, flying to regional airports, a move that reduced demand for larger aircraft.

Emirates, the Dubai-based airline, was Airbus' main customer for the jumbo jet, with a fleet of more than 100, but the airline has scaled back its plans and will take delivery of just 14 more over the next two years.

One of the jetliner's first test pilots took a philosophical view. While he's ""feeling a bit sad"" about the news, Claude Lelaie said the giant plane will be remembered for pushing the barriers of aviation, like the supersonic Concorde.

""Both made history and allowed progress, technological progress,"" he told The Associated Press from the southern French city of Toulouse, the cradle of Airbus' worldwide operations. ""That's business -- you have to ensure the success of the company.""

Lelaie was a co-pilot aboard the maiden flight of the superjumbo in 2005, 101 years after the Wright brothers' first flight.

Yet to detractors, the A380 smacked of hubris, a vanity project by managers who saw bigger as better despite an uncertain market for a plane so huge that airports had to modify their runways and gates.

It faced repeated production setbacks and cost overruns. Order cancellations led to a restructuring at Airbus that saw thousands of job cuts.

""The 380 may have just been too large of a step for the market to handle,"" said Rob Watts, CEO of aviation consulting company Aerotask.

The chairman and CEO of Emirates, Sheikh Ahmed bin Saeed al Maktoum, said: ""While we are disappointed to have to give up our order, and sad that the program could not be sustained, we accept that this is the reality of the situation.""

The fate of the superjumbo has been in question for at least a year, and Enders acknowledged in January 2018 that the company would not be able to continue production of the plane without an order from Emirates.

Airbus was thrown a lifeline with a $16 billion order from Emirates a few days later, but Airbus confirmed last month that it was in discussions about whether that deal would ever be realized. The A380 took another hit last week as Qantas canceled its order from 2006 for eight of the planes.

Emirates is not abandoning Airbus, however. The plane manufacturer said Thursday that the airline would emphasize two smaller models instead, the A330-900 and the A350-900.

Airbus was at pains to emphasize that A380s will not disappear anytime soon. ""Keep in mind that A380s will still roam the skies for many years to come, and Airbus will of course continue to fully support the A380 operators,"" Enders said.

Information for this article was contributed by Amie Tsang of The New York Times, by Angela Charlton of The Associated Press and by Benjamin Katz and Benedikt Kammel of Bloomberg News.

Business on 02/15/2019"
Why Airbus A380 Cancellation Is a Good Thing: Expert - Business Insider,"Fri, 15 Feb 2019 08:00:00 GMT",https://news.google.com/rss/articles/CBMiSmh0dHBzOi8vd3d3LmJ1c2luZXNzaW5zaWRlci5jb20vd2h5LWFpcmJ1cy1hMzgwLWVuZC1wcm9kdWN0aW9uLWdvb2QtMjAxOS0y0gEA?oc=5&hl=en-US&gl=US&ceid=US:en,"By clicking “Sign Up”, you accept our Terms of Service and Privacy Policy . You can opt-out at any time.

Access your favorite topics in a personalized feed while you're on the go. download the app

Sign up to get the inside scoop on today’s biggest stories in markets, tech, and business — delivered daily. Read preview

On Thursday, Airbus announced that production of its flagship A380 superjumbo airliner would end in 2021. The European aviation giant made the decision after Emirates, the aircraft's most loyal customer, decided to reduce its A380 order to 123 planes from 162.

""As a result of this decision we have no substantial A380 backlog and hence no basis to sustain production, despite all our sales efforts with other airlines in recent years,"" Airbus CEO Tom Enders said in a statement. ""This leads to the end of A380 deliveries in 2021.""

This story is available exclusively to Business Insider subscribers. Become an Insider and start reading now.

Even though the A380 proved to be immensely popular with travelers, its size and expense made the plane persona non grata with airlines.

""The market wasn't there, and I never understood why they launched it,"" longtime aviation-industry analyst Richard Aboulafia said in an interview with Business Insider. ""Big is not good.""

Advertisement

Read more: The end is near for the Airbus A380 superjumbo jet. Here's how it went from an airline status symbol to reject in just 10 years.

""If you're looking for international long-haul aircraft, you want 250 to 300 seats,"" he added. ""That's what the markets want, and there doesn't appear to be a lot of deviation from that.""

The A380 usually flies with 470 to 600 seats.

An Emirates A380. Airbus

The latest tally from Airbus shows that it has delivered 234 A380s to customers, including 109 to Emirates.

Advertisement

Aboulafia, the vice president of analysis at Teal Group, said there were only 17 undelivered A380s left before Airbus would shudder its production line in 2021. Of those, 14 are designated for Emirates and three for Japan's All Nippon Airways.

Related stories

The analyst says Airbus made the right call to bring the A380 program to an end.

""Rip off the Band-Aid — it feels better that way,"" he said. ""With this out of the way, they can take advantage of all of the other market segments with their far more important products.""

Specifically, the end of the $25 billion A380 program allows Airbus to concentrate its time and resources on other more lucrative segments of the market like its hot-selling single-aisle A320neo family of jets or a clean-sheet middle-of-the-market aircraft to bridge the gap between its large single-aisle jets and its smaller twin-aisle offerings.

Advertisement

The A380's loss is the A330neo's gain

One of the positives to come from the end of the A380 is the shot in the arm Emirates gave to the underperforming A330neo program.

The Dubai, United Arab Emirates-based airline announced an order for 40 A330neos, an updated version of the popular A330ceo airliner.

A rendering of an Emirates Airbus A330neo. Airbus

Sales have been hard to come by for the A330neo, with several potential suitors opting for the rival Boeing 787 Dreamliner. Apart from Delta, AirAsia, and TAP Portugal, few major airlines have gone for the plane. Last year, Hawaiian Airlines canceled its A330neo order in favor of the Dreamliner. One of the reasons cited by Hawaiian's CEO was the lack of market acceptance for the Airbus.

Read more: We flew in first class on the Delta Airbus jet that Boeing tried to keep out of the US. Here's what it was like.

Advertisement

The A330neo's reputation is certainly bolstered by the addition of Emirates to its customer base. ""It helps a lot,"" Aboulafia said.

Does the end of the A380 program mean Airbus is out of the business of big twin-aisle jets? For now, yes.

""Right now, no one wants a bigger twin-aisle, but in a few years, they aren't going to want to cede the market to the Boeing 777-9X,"" Aboulafia said. ""They'll do a growth version of the A350-1000.""

The Boeing 777-9X is expected to enter service in 2020. With the discontinuation of the A380 in 2021, the 777-9X is set to be the largest passenger plane in production."
Boeing's 777X Will Benefit From the Airbus A380's Demise - The Motley Fool,"Mon, 18 Feb 2019 08:00:00 GMT",https://news.google.com/rss/articles/CBMiX2h0dHBzOi8vd3d3LmZvb2wuY29tL2ludmVzdGluZy8yMDE5LzAyLzE4L2JvZWluZy03Nzd4LXdpbGwtYmVuZWZpdC1mcm9tLWFpcmJ1cy1hMzgwLWRlbWlzZS5hc3B40gEA?oc=5&hl=en-US&gl=US&ceid=US:en,"Airbus will stop building the A380 jumbo jet in 2021 -- which should boost demand for Boeing's new 777X aircraft family.

Last week, Airbus (EADSY -3.02%) announced that it will wind down production of its A380 jumbo jet by 2021, confirming recent media reports. Airbus' vision of rising airport congestion forcing airlines to adopt ever larger airplanes was undermined by the growing popularity of small widebodies, such as Boeing's (BA -1.90%) 787 Dreamliner, which have enabled airlines to operate more point-to-point routes that bypass the most congested hubs.

That said, there is still a market for large widebody aircraft -- particularly if they can offer a unit cost advantage over their smaller brethren. Boeing's new 777X aircraft family is set to dominate this market in the coming years, capitalizing on the failure of Airbus' A380.

An overlapping customer base

The Boeing 777X is an updated version of Boeing's highly successful 777 aircraft family that will enter service next year. It promises to offer additional range and better fuel efficiency, thanks to a new wing and state-of-the-art engines. The smaller 777-8 model is roughly similar in size to the current 777-300ER model, as well as Airbus' competing A350-1000. Meanwhile, the larger and more popular 777-9 version is the largest twin-engine plane on the market and has no direct competitors.

Like the A380, the 777-9 will enable airlines to expand at congested airports where it's not practical to add lots of new flights. But the 777-9 should have significantly lower unit costs than the A380, while also being easier to fill, on account of being smaller.

Check out the latest Boeing earnings call transcript.

Given that the two planes are designed to perform similar missions, it's not surprising that there is a huge amount of customer overlap between the A380 and 777X. Of the roughly 250 A380s that Airbus will ultimately deliver, Emirates will have taken 123. Its two regional rivals -- Qatar Airways and Etihad Airways -- along with Singapore Airlines and Lufthansa together account for another 58 deliveries.

These same five airlines account for 275 of the 326 firm orders in Boeing's 777X backlog. As with the A380, Emirates is the dominant customer for the 777X, with 150 firm orders.

Unsteady demand for the 777X

While demand for A380s has fallen off a cliff in recent years, the 777X hasn't been much more popular. The proliferation of low-cost long-haul airlines has held down fares for international travel, making most airlines wary of committing to ambitious growth plans. As a result, Boeing has received only one significant order for the 777X since the beginning of 2015: a 20-plane deal with Singapore Airlines signed two years ago.

Meanwhile, falling oil prices, cutthroat competition for connecting traffic, and pockets of weakness in the global economy have pressured results at Emirates, Qatar Airways, and Etihad in recent years. This situation has made it clear that they need to radically scale back their ambitious growth plan, calling into question whether they need as many 777Xs as they have ordered.

The death of the A380 is a huge tailwind

Fortunately for Boeing, the end of A380 production could lead to a wave of 777X orders in the coming years. Emirates is already contemplating ordering at least 20 more 777Xs, according to Bloomberg, despite having 150 on order.

Emirates doesn't need to grow at a breakneck pace to justify an expanded 777X order book. The carrier currently has about 250 777-300ERs and A380s in its fleet, and the 777X is likely to be the airline's main replacement for both models. Emirates tends to retire its planes at a younger age than most airlines, so it will probably replace the vast majority of its current fleet by 2030.

Similarly, Singapore Airlines has already retired its oldest A380s, and Qatar Airways recently confirmed that it only expects to keep its A380s for a total of 10 years. As more airlines retire their A380s, maintenance costs are likely to rise, encouraging other major operators like Qantas to follow suit.

Boeing could still see some 777X order cancellations by Etihad Airways, which is dramatically restructuring its business. But on the flip side, it has a legitimate shot at snaring new orders from Qantas, Turkish Airlines, and some of the big airlines in East Asia.

In recent years, airlines have shown a clear preference for the smaller Boeing 787 and A350 families over the largest widebody jets. Nevertheless, with the A380 out of the picture, Boeing's 777X should be able to carve out a profitable niche for itself."
Emirates Ditches Airbus A380: Opinions - Bloomberg,"Sat, 16 Feb 2019 08:00:00 GMT",https://news.google.com/rss/articles/CBMiZGh0dHBzOi8vd3d3LmJsb29tYmVyZy5jb20vbmV3cy9uZXdzbGV0dGVycy8yMDE5LTAyLTE2L2VtaXJhdGVzLWRpdGNoZXMtYWlyYnVzLWEzODAtb3BpbmlvbnMtanM3aHBicnfSAQA?oc=5&hl=en-US&gl=US&ceid=US:en,"Emirates may be about to deal a fatal blow to the world’s largest aircraft.

Dubai’s national airline is considering switching 20 orders for Airbus SE A380 double-decker jets for the smaller A350 or new-engine variant of the A330, Benjamin Katz and Layan Odeh of Bloomberg News reported this month, citing people familiar with the matter. [Editor’s note: A few days later, Airbus announced it would cease production of the A380 altogether.]"
Airbus scraps production of A380 superjumbo - DW (English),"Thu, 14 Feb 2019 08:00:00 GMT",https://news.google.com/rss/articles/CBMiTGh0dHBzOi8vd3d3LmR3LmNvbS9lbi9haXJidXMtc2NyYXBzLXByb2R1Y3Rpb24tb2YtYTM4MC1zdXBlcmp1bWJvL2EtNDc1MTEwMjbSAUxodHRwczovL2FtcC5kdy5jb20vZW4vYWlyYnVzLXNjcmFwcy1wcm9kdWN0aW9uLW9mLWEzODAtc3VwZXJqdW1iby9hLTQ3NTExMDI2?oc=5&hl=en-US&gl=US&ceid=US:en,"European aviation giant Airbus says it will stop making its superjumbo A380 in 2021 after struggling to sell the world's biggest passenger jet. Thousands of jobs in Germany and France are at stake.

European aircraft manufacturer Airbus on Thursday announced it will end production of the A380 double-decker passenger jet by 2021.

The Franco-German company had hoped the superjumbo would challenge Boeing's 747 and revolutionize air travel in the 21st century.

""Without Emirates, Airbus has no substantial order backlog and no basis to sustain A380 production after 2021,"" said Guillaume Faure, who is taking over as Airbus CEO from Tom Enders this spring.

The annoucement was made alongside the news that Airbus net profit had risen 29 percent in 2018 after strong demand for its smaller planes. Airbus managed to make these profits despite 899 million euros ($1 billion) in losses from the A380 aircraft.

The company's stocks fared well in trading later on Thursday, rising 4.5 percent with investors apparently relieved by the decision to cut the cord on a losing venture.

What the company said:

Key client Emirates had informed Airbus it was cutting orders from 162 to 123 aircraft

That left the company with no substantial A380 backlog and no basis to sustain production

Shutdown costs are estimated at €463 million ($521 million) with a billion euros of European government loans forgiven

It will still produce 17 A380s including 14 for Emirates and 3 for Japanese airline ANA

CEO Enders said talks with trade unions about any potential impact on jobs would follow in the coming weeks

Read more:

Airbus's spurned A380 superjumbos to be stripped for parts

Emirates disappointed

The Dubai-based Emirates airline is the biggest A380 customerand built its global brand around the model. The A380 will remain a central part of the Emirates fleet into the 2030s, the airline said.

""Emirates has been a staunch supporter of the A380 since its inception,"" said Emirates Chairman Sheikh Ahmed bin Saeed al-Maktoum. ""While we are disappointed to have to give up our order, and sad that the program could not be sustained, we accept that this is the reality of the situation."" Emirates has ordered 40 A330-900neo jets and 30 A350-900 aircraft instead.

Airbus CEO Tom Enders called the superjumbo an ""outstanding technical and industrial achievement,"" adding that the announcement was ""painful for us and A380 communities around the world.""

Airbus A380 landing in Frankfurt Image: picture-alliance/dpa/S. Stein

What was the problem with the A380? The world's biggest passenger jet started flying in 2008. With two decks of cabins and room for 544 people in standard layout, airlines were reluctant to commit to the costly plane and airports had to build new runways and modify terminals to accommodate it. The project suffered production delays and cost overruns right from the outset. The company was forced to restructure, costing thousands of jobs.

Enders said Airbus would continue to support the A380 for as long as it remains in service.

What effect will it have on earnings? Despite losses of €899 million ($1 billion) on the A380, Airbus on Thursday announced a 29 percent rise in profits for 2018. Net profit increased from €2.4 billion to €3.1 billion.

Airbus will book a €463 million in shutdown costs but expects to be forgiven a billion euros of outstanding European government loans under a funding system which has been central to its trade dispute with its US rival Boeing.

Overall, Airbus expects to deliver 880 to 890 planes this year after 800 last year, with steady demand for the midsize A320 which carries out short and medium-range flights.

What happens next? Airbus said it would start talks in the coming weeks with unions over the 3,500 jobs that could be at risk.

rt/jm (AP, dpa, Reuters)

Every evening at 1830 UTC, DW's editors send out a selection of the day's hard news and quality feature journalism. You can sign up to receive it directly here."
