Titre,Date de publication,URL,Contenu
Airbus A380: from European dream to white elephant - Yahoo Finance,"Wed, 13 Feb 2019 08:00:00 GMT",https://news.google.com/rss/articles/CBMiTmh0dHBzOi8vZmluYW5jZS55YWhvby5jb20vbmV3cy9haXJidXMtYTM4MC1ldXJvcGVhbi1kcmVhbS13aGl0ZS0wNjI4MDQ3NTMuaHRtbNIBAA?oc=5&hl=en-US&gl=US&ceid=US:en,"FILE PHOTO: The damaged right-hand wing-tip of the Airbus A380, the world's largest jetliner with a wingspan of almost 80 metres, is seen on the tarmac during the Paris Air Show in Le Bourget airport, near Paris, June 20, 2011. REUTERS/Pascal Rossignol/File Photo

By Tim Hepher

TOULOUSE, France (Reuters) - Loved by passengers, feared by accountants, the world's largest airliner has run out of runway after Airbus decided to close A380 production after 12 years in service due to weak sales.

The decision to halt production of the A380 superjumbo is the final act in one of Europe's greatest industrial adventures and reflects a dearth of orders by airline bosses unwilling to back Airbus's vision of huge jets to combat airport congestion.

Air traffic is growing at a near-record pace but this has mainly generated demand for twin-engined jets nimble enough to fly directly to where people want to travel, rather than bulky four-engined jets forcing passengers to change at hub airports.

And while loyal supporters like top customer Emirates say the popular 544-seat jet makes money when full, each unsold seat potentially burns a hole in airline finances because of the fuel needed to keep the huge double-decker structure aloft.

""It's an aircraft that frightens airline CFOs; the risk of failing to sell so many seats is just too high,"" said a senior aerospace industry source familiar with the programme.

Once hailed as the industrial counterpart to Europe's single currency, the demise of a globally recognised European symbol coincides with growing political strains between Britain, France, Germany and Spain where the plane is built.

That's in stark contrast to the display of European unity and optimism when the engineering behemoth was unveiled in front of European leaders under a spectacular light show in 2005.

British Prime Minister Tony Blair called the A380 a ""symbol of economic strength"" while Spanish premier Jose Luis Rodriguez Zapatero called the rollout ""the realisation of a dream"".

Passengers marvelled at the European giant with room for 70 cars on its wings, looking rather like the hump-backed Boeing 747 but with the top section stretching all the way to the back.

Airlines had initially rushed to place orders, expecting it to lower operating costs and boost profits as the industry crawled out of a slowdown in tourism since September 2001.

Story continues

Airbus boasted it would sell 700-750 A380s, which nowadays cost $446 million at list prices, and render the 747 obsolete.

In fact, A380 orders barely crossed the 300 threshold and the 747 has outlived its rival, after reaching the age of 50 this week.

FALL FROM GRACE

The seeds of the A380's fall from grace were already present behind the scenes of the 2005 launch party, insiders say.

Despite public talk of unity, the huge task was about to expose fractures in Franco-German co-operation that sparked an industrial meltdown. When the delayed jet finally reached the market in 2007, the global financial crisis was starting to bite. Scale and opulence were no longer wanted. Sales slowed.

At the same time, engine makers who had promised Airbus a decade of unbeatable efficiencies with their new superjumbo engines were fine-tuning even more efficient designs for the next generation of dual-engined planes, competing with the A380.

Finally, a restless Airbus board started demanding a return and stronger prices just when the plane desperately needed an aggressive relaunch and fresh investment, insiders said.

""It was a triple whammy,"" said a person close to the debate.

As demand see-sawed, so did the plane's marketing: starting with luxuries including showers, then vaunting its green credentials with the messianic slogan 'Saving The Planet One A380 at a Time"" before joining the race to squeeze in more people and cut costs.

Yet despite its own deep industrial problems, Boeing was winning the argument with its newest jet, the 787 Dreamliner. It was designed to bypass hubs served by the A380 and open routes between secondary cities: a strategy known as ""point to point"".

Airbus fought back, arguing that travel between megacities would nonetheless dominate air transport.

But economic growth would splinter in ways Airbus did not predict. Intermediary cities are growing almost twice as fast as megacities, according to a 2018 paper posted by the Organisation for Economic Co-Operation and Development.https://bit.ly/2P28F3h

That's a boon for twinjets like the Boeing 787 and 777 or Airbus's own A350, which has outsold the A380 three to one.

Airbus Chief Executive Tom Enders, who was rarely seen as an enthusiastic backer of the A380, toyed with ending the project about two years ago but was persuaded to give it a last chance.

But with Emirates unable to hammer out an engine deal needed to confirm its most recent A380 order, time had finally run out.

""Airbus tends to think of it as a flagship; Enders looks at it and sees a lack of orders,"" said a person close to the German-born CEO, who steps down in April.

Some insiders worry that Airbus will lose a valuable symbol of pride and commercial audacity when production ends in 2021.

Now, airline bosses are seeking assurances that Airbus will support the A380 with spare parts for years to come. Many invested in the A380 as their flagship while airports also spent heavily on new facilities.

Some customers like Air France and Lufthansa may not shed too many tears, analysts say.

They too invested in the A380 but may also be relieved to see a potent weapon removed from Gulf rivals like Emirates, whom they accuse of flooding the market.

Emirates insists it plays fairly and has called the A380 a ""passenger magnet,"" misunderstood and badly marketed by rivals.

Its chairman said on Thursday he was disappointed in the A380's demise, but added ""we accept that this is the reality of the situation"".

(Reporting by Tim Hepher; Editing by Keith Weir)"
Airbus May Assemble Newest Jet in China to Secure Far East Deals - Fortune,"Thu, 28 Feb 2019 08:00:00 GMT",https://news.google.com/rss/articles/CBMiOWh0dHBzOi8vZm9ydHVuZS5jb20vMjAxOS8wMi8yOC9haXJidXMtamV0LWFzc2VtYmx5LWNoaW5hL9IBAA?oc=5&hl=en-US&gl=US&ceid=US:en,"Airbus SE is looking at assembling its newest A330neo wide-body jet in China as part of a bid to win orders for the plane in one of the world’s fastest-growing aviation markets, according to people with knowledge of the matter.

Airbus may expand its existing plant in Tianjin to accommodate the model, but a decision has not been made with the business case yet to be established, said the people, who asked not to be named because the discussions are private. The plan may not go ahead, they cautioned. A spokesman for Airbus declined to comment.

Airbus previously offered to build its A380 superjumbo in China in exchange for orders from the country’s airlines, but that pitch was rejected amid concerns about the double-decker plane’s suitability for the local market, according to two of the people. The smaller, more fuel-efficient A330neo is potentially a better fit, with more than 200 of the original-generation model already sold in the Asian nation.

The move to extend the Tianjin plant — which currently assembles Airbus’ single-aisle A320 workhorse — comes as Rolls-Royce Holdings Plc is said to be offering to establish a Chinese plant to secure an engine deal for the wide-body plane being developed by Commercial Aircraft Corp. of China Ltd., or Comac. The U.K. company is pitching a derivative of the Trent 7000 turbine for that aircraft, which is also the only option on the A330neo.

Biggest Market

China is set to become the world’s biggest plane market next decade and will need almost 8,000 aircraft worth $1.2 trillion over 20 years, according to Boeing Co. estimates. President Xi Jinping has also earmarked aerospace as a priority industry, encouraging Western producers to set up shop in the country.

The A330neo — abbreviated from new engine option -— assembly plant would add to an existing completion and delivery center for Airbus’ original A330, where planes get final touches before being shipped to the customers.

The upgraded aircraft entered service last year but has been battling for orders with Boeing’s more advanced 787 Dreamliner. Airbus has secured sales for 230 A330-900s but just eight smaller -800s, losing contracts from Hawaiian Airlines Inc. and American Airlines Group Inc. along the way as they switched to the Boeing aircraft.

The Toulouse, France-based company has since won a 40-jet deal from Emirates, though only after the Dubai carrier canceled the bulk of orders for the A380, which Airbus announced earlier this month was being wound up. The company is also targeting a follow-on contract for 44 planes from Malaysia’s AirAsia that was announced but never signed."
Airbus proposing X³ offshoot for U.S. Army FARA program - Vertical Magazine,"Wed, 20 Feb 2019 08:00:00 GMT",https://news.google.com/rss/articles/CBMiWWh0dHBzOi8vdmVydGljYWxtYWcuY29tL25ld3MvYWlyYnVzLXByb3Bvc2luZy14JUMyJUIzLW9mZnNob290LWZvci11LXMtYXJteS1mYXJhLXByb2dyYW0v0gEA?oc=5&hl=en-US&gl=US&ceid=US:en,"Airbus is proposing an aircraft that utilizes technology developed from its X³ hybrid demonstrator program for the U.S. Army’s Future Attack Reconnaissance Aircraft Competitive Prototype (FARA CP) program.

The X³ was a highly successful demonstrator for Airbus, setting several speed records through its use of two propellers on short wings either side of a Dauphin-based fuselage, topped by a five-bladed main rotor. The aircraft logged more than 155 flight hours over 199 flights, reaching a level flight speed of 255 knots (472 km/h) on June 7, 2013.

The Army launched the FARA competition in October 2018 when it issued a formal program solicitation, with the aim of finding a new armed scout aircraft for the service.

“This platform is the ‘knife fighter’ of future Army Aviation capabilities, a small form factor platform with maximized performance,” the solicitation stated.

Airbus was among those to submit a proposal in December 2018, with the first of four potential phases of program development scheduled to begin in June 2019.

“Yes, we are looking at the FARA demonstrator program, based on the technology we have developed . . . in terms of [a] high-speed platform based on the X³ in particular,” Bruno Even, CEO of Airbus Helicopters, told journalists during a media briefing ahead of HAI Heli-Expo. “These competencies, this technology, we have developed years [ago]. Clearly we want to leverage them in order to propose a competitive solution first at a demonstrator phase for the U.S. DoD [Department of Defense] program.”

The Army will select four to six bidders to take part in the program’s initial phase, which will give candidates nine months to develop preliminary designs and provide data supporting their bid. From there, two or more will be downselected to take part in a detailed design, build and test phase.

If selected for the second phase, the contenders will receive about $735 million to cover their aircraft’s development from 2020 to 2023, with an anticipated first flight in November 2022.

Since the X³’s retirement in 2013, Airbus has continued the type’s legacy in the form of the Racer — a high-speed demonstrator intended for commercial applications.

“You can also envision a military path for that technology as well,” said Scott Tumpak, head of military programs in North America for Airbus. “We’re in a competitive phase right now, so we don’t want to get too far out in front by going into too much detail as to what the specific offer is.”

The Army’s parameters for the aircraft include a 40-foot rotor disc and a speed of 180 knots.

When questioned as to whether the rotor disc of an X³ offshoot could fit in that space, Tumpak said it would be one of the discussion points the manufacturer will have with the Army.

“The answer is always, you could, but at what cost to your tradespace and other areas?” he said. “In our mind, that is what the major purpose is of this initial design review is — to have that dialogue of what the tradespace is with the end customer.”

Sikorsky and Bell have also declared their interest in the program, with the former highlighting the suitability of its X2 technology for the armed reconnaissance mission."
"Airbus invests €25 million in the future of its aerospace site in Ottobrunn/Taufkirchen, near Munich - Airbus","Mon, 11 Feb 2019 08:00:00 GMT",https://news.google.com/rss/articles/CBMifGh0dHBzOi8vd3d3LmFpcmJ1cy5jb20vZW4vbmV3c3Jvb20vcHJlc3MtcmVsZWFzZXMvMjAxOS0wMi1haXJidXMtaW52ZXN0cy1ldTI1LW1pbGxpb24taW4tdGhlLWZ1dHVyZS1vZi1pdHMtYWVyb3NwYWNlLXNpdGUtaW7SAQA?oc=5&hl=en-US&gl=US&ceid=US:en,"@Markus_Soeder #satellite @AirbusSpace

Ottobrunn/Taufkirchen, 11 February 2019 – Airbus is expanding its aerospace activities at its site in Ottobrunn/Taufkirchen, near Munich. Today, it has reached two new milestones, with Bavarian Minister-President Markus Söder and Dirk Hoke, CEO of Airbus Defence and Space, giving the green light for the modernisation of solar array production for satellites, and for the commissioning of expanded clean rooms for optical satellite instruments. In total, the company will be investing approximately €25 million.

In February 2019, Airbus will begin building an Industry 4.0 factory to automate and digitalise the production of solar arrays for satellites. This will entail a complete revamp of the production building, during which it will be expanded by 800 m2 to a total of 5,500 m2. A robotic assembly line will also be introduced. This €15 million investment demonstrates the company’s ability to remain competitive on the world market, while the automated assembly line will allow throughput times and costs to be halved. This state-of-the-art technology will safeguard 170 jobs and position the company to maximise future growth opportunities such as satellite constellations or ‘New Space’ approaches. Furthermore, ongoing cutting-edge research will be supported, particularly in the area of scientific satellites, such as the Jupiter mission or missions to the Sun or Mercury.

In addition Airbus will use the clean room (expanded by 250 m2 to a total of 1,700 m2) for the integration of satellite-based optical instruments, an area in which Airbus has invested over €10 million at its Ottobrunn/Taufkirchen site. The new clean room will be used by some of the 150 employees in the Optical Instruments business unit to build the MERLIN instrument (Methane Remote Sensing Lidar Mission). MERLIN is a Franco-German satellite project to measure the methane concentration in Earth’s atmosphere to improve understanding of climate change.

“The aerospace site in Ottobrunn/Taufkirchen has not only shaped the history of cutting-edge technology over the last 60 years, it is also actively shaping the future. Today, our solar array production marks our entry into the age of Industry 4.0, with the site now boasting the largest clean room for optical satellite integration in Germany. This will improve our competitive standing worldwide and will contribute towards safeguarding local jobs,” said Dirk Hoke, CEO of Airbus Defence and Space.

* * *

About Airbus

Airbus is a global leader in aeronautics, space and related services. In 2017 it generated revenues of € 59 billion restated for IFRS 15 and employed a workforce of around 129,000. Airbus offers the most comprehensive range of passenger airliners from 100 to more than 600 seats. Airbus is also a European leader providing tanker, combat, transport and mission aircraft, as well as one of the world’s leading space companies. In helicopters, Airbus provides the most efficient civil and military rotorcraft solutions worldwide."
Airbus to stop production of A380 | Arkansas Democrat Gazette - Arkansas Online,"Fri, 15 Feb 2019 08:00:00 GMT",https://news.google.com/rss/articles/CBMiWGh0dHBzOi8vd3d3LmFya2Fuc2Fzb25saW5lLmNvbS9uZXdzLzIwMTkvZmViLzE1L2FpcmJ1cy10by1zdG9wLXByb2R1Y3Rpb24tb2YtYTM4MC0yMDE5MC_SAQA?oc=5&hl=en-US&gl=US&ceid=US:en,"TOULOUSE, France -- Airbus will cease production of its mammoth A380 passenger jet, an engineering marvel that nevertheless couldn't keep up with shifts in the way people fly, the European aircraft-maker said Thursday.

Citing reduced orders from Emirates Airline, a major customer, and an inability to find other buyers, the company said it would halt deliveries of the jumbo jetliner in 2021, although it said it would continue to support existing A380s.

""As a result of this decision we have no substantial A380 backlog and hence no basis to sustain production, despite all our sales efforts with other airlines in recent years,"" the company's chief executive, Tom Enders, said in a statement. ""Today's announcement is painful for us and the A380 communities worldwide.""

The decision will lead to job cuts at Airbus, potentially affecting as many as 3,500 of its 134,000 employees over the next three years. Airbus said it would start discussions in the next few weeks about the consequences for its workforce.

The announcement overshadowed the company's announcement on Thursday of its full-year results. Its net income rose 29 percent in 2018 to about $3.5 billion.

Development talks for the plane began in 2000, meant to be Airbus' 21st-century answer to rival Boeing's 1960s-era 747, and one of the most ambitious endeavors in aviation. Its four Rolls-Royce engines were quieter than ever, far out on the extra-long wings. Carbon-fiber technology was used for the body to make it lighter and easier to maneuver. Its double-decker construction allowed room for bars, duty-free shops and even showers.

From its inception, the A380 was a grand European project. The wings, like those of all Airbus aircraft, came from the U.K., and components were ferried across the continent from production sites in Germany and France. The giant fuselage tubes were taken by barge and flatbed truck to the main facility in Toulouse, and the planes were then painted and kitted out in Hamburg. Teams from across the region joined colleagues at other sites during crunch times, the bulbous Beluga freight planes would crisscross countries with parts, and the A380 was a popular backdrop at air shows for politicians celebrating Europe's achievements.

Airbus spent $25 billion developing the aircraft, which can carry more than 500 passengers. It was built for a time when crowded airports would demand that planes carry more people to reduce congestion.

But flight traffic instead shifted to smaller planes, which are cheaper to maintain, flying to regional airports, a move that reduced demand for larger aircraft.

Emirates, the Dubai-based airline, was Airbus' main customer for the jumbo jet, with a fleet of more than 100, but the airline has scaled back its plans and will take delivery of just 14 more over the next two years.

One of the jetliner's first test pilots took a philosophical view. While he's ""feeling a bit sad"" about the news, Claude Lelaie said the giant plane will be remembered for pushing the barriers of aviation, like the supersonic Concorde.

""Both made history and allowed progress, technological progress,"" he told The Associated Press from the southern French city of Toulouse, the cradle of Airbus' worldwide operations. ""That's business -- you have to ensure the success of the company.""

Lelaie was a co-pilot aboard the maiden flight of the superjumbo in 2005, 101 years after the Wright brothers' first flight.

Yet to detractors, the A380 smacked of hubris, a vanity project by managers who saw bigger as better despite an uncertain market for a plane so huge that airports had to modify their runways and gates.

It faced repeated production setbacks and cost overruns. Order cancellations led to a restructuring at Airbus that saw thousands of job cuts.

""The 380 may have just been too large of a step for the market to handle,"" said Rob Watts, CEO of aviation consulting company Aerotask.

The chairman and CEO of Emirates, Sheikh Ahmed bin Saeed al Maktoum, said: ""While we are disappointed to have to give up our order, and sad that the program could not be sustained, we accept that this is the reality of the situation.""

The fate of the superjumbo has been in question for at least a year, and Enders acknowledged in January 2018 that the company would not be able to continue production of the plane without an order from Emirates.

Airbus was thrown a lifeline with a $16 billion order from Emirates a few days later, but Airbus confirmed last month that it was in discussions about whether that deal would ever be realized. The A380 took another hit last week as Qantas canceled its order from 2006 for eight of the planes.

Emirates is not abandoning Airbus, however. The plane manufacturer said Thursday that the airline would emphasize two smaller models instead, the A330-900 and the A350-900.

Airbus was at pains to emphasize that A380s will not disappear anytime soon. ""Keep in mind that A380s will still roam the skies for many years to come, and Airbus will of course continue to fully support the A380 operators,"" Enders said.

Information for this article was contributed by Amie Tsang of The New York Times, by Angela Charlton of The Associated Press and by Benjamin Katz and Benedikt Kammel of Bloomberg News.

Business on 02/15/2019"
