Titre,Date de publication,URL,Contenu,sentiment_finbert,sentiment_label,sentiment_score,sentiment_numerique
IN FOCUS: How C-295 efficiency drive will help A400M programme - Flightglobal,"Mon, 14 May 2012 07:00:00 GMT",https://news.google.com/rss/articles/CBMiaWh0dHBzOi8vd3d3LmZsaWdodGdsb2JhbC5jb20vaW4tZm9jdXMtaG93LWMtMjk1LWVmZmljaWVuY3ktZHJpdmUtd2lsbC1oZWxwLWE0MDBtLXByb2dyYW1tZS8xMDUyMTcuYXJ0aWNsZdIBAA?oc=5&hl=en-US&gl=US&ceid=US:en,"Landing at Seville's San Pablo airport is a similar experience to that encountered when visiting any number of European cities, with EasyJet and Ryanair among the airlines running regular services to the location, along with Spanish low-cost specialist Vueling and the recently-established Iberia Express.

What makes the location unique can be seen on the southern side of its single runway, where several massive new hangars dominate the skyline. The ramp outside is dotted with a variety of military transport aircraft, ranging in size from Airbus Military's diminutive C-212, flown around the globe for almost 40 years, up to the A400M ""Grizzly"", which is less than 12 months away from entering use.

© Airbus Military First flown in Seville in 2010, A400M development aircraft ""Grizzly 2"" shone in recent high-altitude tests in Bolivia

The reason for choosing Spain's fourth-largest city to house the final assembly line (FAL) for Europe's new-generation military airlifter stems from the nation's rich heritage in this sector, which was built by the then-CASA company. It also reflects a strong desire by parent company EADS to establish a new airlift centre of excellence in Seville, with support and financial backing also coming from the Andalucian authorities.

Major investment in the San Pablo site has included the construction of assembly lines for both the A400M and Airbus Military's light and medium transports, plus flight-test facilities, a paint shop and a major international training centre.

PRODUCTION FOCUS

The signature in May 2003 of a development and production contract for an original 180 aircraft was the catalyst for creating the facility for completing the A400M. Major structures arrive aboard Airbus A300-600ST Beluga transports, with five development examples having been flown and the first two production aircraft now on the line.

Production should hit its planned maximum rate of 30 per year during 2015, with deliveries to be made to launch nations Belgium, France, Germany, Luxembourg, Spain, Turkey and the UK, plus export buyer Malaysia.

While the new aircraft is the largest to have been assembled in Seville, the expertise required to run the line draws in no small part from Airbus Military's success with the C-212, CN-235 and C-295. These are completed in a spacious hangar just behind that built for the larger type, and where the effects of a new transformation programme are beginning to have a major impact.

November 2013 will bring the 30th anniversary of the CN-235's first flight, while its stretched-fuselage and re-engined C-295 stablemate made its debut sortie in 1998. A combined 375 of the twin-turboprops have now been sold, including 100 of the newer design, accounting for more than one-third of Airbus Military's total of 1,060-plus transports.

The company's production rate for the light and medium types averaged 18 per year between 2007 and 2011, a period during which it also expanded the number of special mission variants on offer. These now include maritime patrol and anti-submarine warfare aircraft, plus an airborne early warning and control system version being offered to a prospective launch customer with Israeli partner Elta Systems.

© Airbus Military The C-295 is now offered as an airborne early-warning asset

With multiple versions of the CN-235 and C-295 typically to be found in the facility's four work stations and with parts arriving from locations including Chile, Indonesia, Poland, Portugal and Turkey, Airbus Military faced a serious challenge in managing its production flow, says Ricardo Rojas, head of the FAL for light and medium products.

""Every station is organised like a small factory, with logistics and control,"" Rojas says. ""We have to manage the workload, with a tack-time of 10 days to move to the next position."" Each station on the pulse line has between 40 to 50 people working on it, depending on the version of aircraft being completed. ""It's very difficult to manage that,"" he says. ""You need to have flexibility in your people.""

Two shifts of about 300 people each work on the light and medium FAL, with its total staffing level being around 700.

The company has recently established a basic reference group (GBR) model, under which all C-295s will be manufactured with certain equipment and wiring installed. This will enable any aircraft to be adapted for tasks beyond the air transport mission from a wide range of options. As a result, Rojas says the time needed to accommodate such requests can be cut by up to 30% for some versions, with the step also reducing costs. A further 10% saving could follow, along with reduced non-recurring costs for new versions.

SALES TARGET

The first aircraft to have been completed using the new model was delivered to Ghana last month, the 87th C-295 produced. While it will split production equally between the type and the CN-235 this year, largely because of a follow-on French order for the smaller model, under current plans only three CN-235s are likely to be completed in 2013.

With the production model transformed, Airbus Military is stepping up its efforts to boost the current build rate. ""At 18 a year we are in a comfort zone, but we aim to increase deliveries up to 25,"" says Jerónimo Amador, head of market development for light and medium transport aircraft. ""The production line is ready for that.""

The target is to deliver 20 per year for the next three years, with sales opportunities including an Indian air force deal to replace 56 Hawker Siddeley 748 transports. The company is also looking to broaden the variety of special mission variants of the C-295 that it can offer to its existing and new customers. In all, Amador says Airbus Military aims to sell about 215 aircraft between 2012 and 2021.

Beyond the new efficiency being enjoyed by customers of the medium transport, the GBR transformation has already had an impact on the A400M. An initial 15 personnel from the light and medium FAL were transferred in January to work on the new project, another 25 will follow during November.

Work on the A400M line is now focused on completing assembly of the first of at least 172 production aircraft. To be delivered to the French air force around the end of this year, MSN7 is in the Station 35 position undergoing system tests before having its Europrop International TP400-D6 engines installed. First flight will occur ""during the summer"", Airbus Military says.

All parts for aircraft MSN8, France's second of 50 A400Ms, are already in the hangar, with assembly work due to commence soon. The next aircraft, to be put together from early next year, will be delivered to the Turkish air force.

© Airbus Military An efficiency drive will cut 30% off the time needed to assemble some CN-235/C-295s

Airbus Military's workforce in Seville has been sourced from within the region. ""The employees are local people,"" Rojas says. ""We are always measuring their skills and launching training to get the level that we want."" A new assessment process for all members of staff this year will define the skills required to perform each type of job.

New assembly-line staff receive instruction in Andalucia, where an aeronautical engineering degree course is now available in Seville, before arriving as specialists in areas such as electrics or mechanics. On-the-job training will enable them to broaden their expertise, which Rojas says is vital for the long-term: ""In the future we want people who are capable of doing everything.""

The company is studying whether to also introduce the GBR concept with the CN-235, but a decision will be driven by its future orders intake.

One possibility is that further development could be performed in partnership with PT Dirgantara Indonesia, using a model already being introduced with the C-212. All parts for the -400 version are already made in Indonesia, and Airbus Military is preparing to assemble its last-ever example in Spain. Components are due to arrive in San Pablo during June, with the transport to be delivered to Vietnam in December. All subsequent examples will be completed in Indonesia.

""We are now analysing the potential for an aircraft in the C-212 category,"" Amador says, identifying the need to support commercial operators flying on ""pioneer routes"" to remote parts of Indonesia. ""We believe the C-212 is still a good product for this utility market.""

A long-term partner to Airbus Military and CASA before it, Jakarta also signed a February order for nine C-295s, the last two of which should be assembled in the customer nation.

Although it was first flown 14 years ago, Amador says the C-295's sales performance to date, and its growing range of special mission applications, mean Airbus Military is in no hurry to launch work on a ""C-2XX"" successor, but it continually assesses the market need.

""Our view is that the C-295 with continued development is a solid product for the next 15 to 20 years,"" he says. ""We don't see now a significant need for a new development.""

INTERNATIONAL TRAINING CENTRE WELCOMES ALL-COMERS

As production aircraft MSN7 takes shape on the A400M final assembly line, Airbus Military is also working to ready the training system which will prepare the first pilots and loadmasters to operate Europe's new-generation airlifter.

With the first aircraft due to be delivered to the French air force around the end of this year, the company is making preparations to begin training the service's first four pilots, up to six loadmasters and maintainers using the international training centre (ITC) at its San Pablo site near Seville.

Opened in October 2010 and already supporting customers for Airbus Military's light and medium transports, the 12,000m2 (130,000ft2) facility has 22 training rooms and will eventually house six full-flight simulators, including at least one for the A400M.

""We plan to complete training on the first two French air force crews before the end of this year,"" says Ian Burrett, Airbus Military's head of training and aircrew operations. ""We have got a lot to do in the next seven months, but are very much on track to do that.""

© Airbus Military Airbus Military trains about 1,000 people a year at its ITC

The first equipment needed to deliver the course is nearing readiness, with a computer-based training system now going through validation testing.

Procedural and maintenance trainers will follow, with a Thales-built full-flight simulator to be in use around August but only able to support operations from about the end of the year. To enter use as a Level C device, the simulator will later be certificated to the Level D standard, potentially enabling pilots to achieve a zero flight-time conversion to the A400M.

A CAE cockpit-maintenance trainer will also enter use in August, and a Rheinmetall-produced cargo hold trainer will be available from March 2013. The latter will support loadmaster instruction, including for applications such as airdrop.

With the initial work for France to be at its most intensive between October and December, the company will employ other assets, including its ""aircraft zero"" systems simulator and production-standard development aircraft MSN6.

Early training for all A400M nations will be conducted using the ITC. In-country facilities will follow for the French air force and UK Royal Air Force at their Orléans and Brize Norton bases, with Germany yet to announce the location for its domestic infrastructure. Belgium, Luxembourg and Spain will send personnel to Seville, while Turkey's plans are yet to be confirmed.

The annual throughput at the ITC is about 1,000 people, including pilots, maintainers and mission system operators from nations including Chile, Egypt and Indonesia, who can also learn in Seville while using their own aircraft.

""Once at full speed on the A400M it will probably be around 2,000,"" Burrett says. ""The students also learn from each other, which is a real benefit of a multinational programme.""

Source: Flight International","{'label': 'Positive', 'score': 0.828561544418335}",positive,0.828561544418335,1
RAF accused over multi-billion pound Voyager contract - BBC.com,"Thu, 10 May 2012 07:00:00 GMT",https://news.google.com/rss/articles/CBMiJGh0dHBzOi8vd3d3LmJiYy5jb20vbmV3cy91ay0xODAyMDgwOdIBKGh0dHBzOi8vd3d3LmJiYy5jb20vbmV3cy91ay0xODAyMDgwOS5hbXA?oc=5&hl=en-US&gl=US&ceid=US:en,"But ""an order of 14 aircraft would have attracted an even more significant discount"", he said, suggesting that the price would have been in the region of £40m each at the time the contract had been signed.","{'label': 'Neutral', 'score': 0.9993884563446045}",neutral,0.9993884563446045,0
Scrapped A320 planes spark row in Air India - Business Today,"Mon, 14 May 2012 07:00:00 GMT",https://news.google.com/rss/articles/CBMicWh0dHBzOi8vd3d3LmJ1c2luZXNzdG9kYXkuaW4vaW5kdXN0cnkvYXZpYXRpb24vc3Rvcnkvc2NyYXBwZWQtYTMyMC1wbGFuZXMtc3Bhcmstcm93LWluLWFpci1pbmRpYS0zMDY2OS0yMDEyLTA1LTE00gEA?oc=5&hl=en-US&gl=US&ceid=US:en,"14 Airbus A320 aircraft of state-run Air India were scrapped



$20 mn is the cost of over 1,150 parts in each Airbus A320 when bought new



$210 mn is value of parts which should have been removed from scrapped A320s





A major controversy has erupted in Air India (AI) over expensive usable components not being removed from 13 Airbus A320s which were scrapped and could have enabled the cash-strapped airline to save crores of rupees.Official records accessed byshow the Hyderabad region of AI handled one of the 14 Airbus A320s that were scrapped and removed 1,158 parts for subsequent use in the A320s being used for regular flights. Proper records have also been maintained of these cannibalised spare parts in Hyderabad. However, the Delhi region, which insiders say handled the removing of 13 vintage A320 aircraft, removed only 650 components from each plane. Sources disclose each vintage aircraft has over 1,150 costly components which cost $15 to $20 million when new.These parts can be removed and serviced for repair and maintenance of the regular airline fleet, which helps save money. The total value of the components that should have been removed works out to $210 million (Rs 1,100 crore).The Delhi region, by not removing as many as 500 components in each scrapped plane, is reported to have caused a huge loss to the airline. According to an official statement sent by the carrier to: ""A list of items that needed to be cannibalised was firmed up based on experience viz. their regular usage (fast moving), commonality with new fleet, etc. As against the aircraft in Delhi, the aircraft at Hyderabad happened to be cannibalised more since the cannibalisation list was firmed up at Delhi later. Therefore, more items were cannibalised at Hyderabad as compared to Delhi.""Insiders also allege that even several removed parts do not tally with records of AI and are suspected to be missing. However, the management denies this. The official statement said, ""All the removed items have been well accounted for. Items are located at different locations due to handling procedures viz. installation on aircraft, bench check in the shops, some awaiting dispatch for repair to vendors and some in transit between various locations. Hence, saying that the items had gone missing is a wrong perception.""Interestingly, it took Mail Today nearly three weeks of repeated emails and phone calls to get the AI version on the issue.

Courtesy: Mail Today","{'label': 'Neutral', 'score': 0.9989206790924072}",neutral,0.9989206790924072,0
Why business travellers will love the Airbus A350 - Executive Traveller,"Fri, 25 May 2012 07:00:00 GMT",https://news.google.com/rss/articles/CBMiWGh0dHBzOi8vd3d3LmV4ZWN1dGl2ZXRyYXZlbGxlci5jb20vd2h5LWJ1c2luZXNzLXRyYXZlbGxlcnMtd2lsbC1sb3ZlLXRoZS1haXJidXMtYTM1MC14d2LSAQA?oc=5&hl=en-US&gl=US&ceid=US:en,"There's a new Airbus coming to town, and we think business travellers will love it.

That plane is the Airbus A350 XWB, which like the Boeing 787 is an advanced next-generation design with over 50% of the aircraft built composite materials such as carbon fibre.

It'll start commercial flights from 2014 on airlines including Cathay Pacific, Emirates, Singapore Airlines and Qatar.

And the reasons you'll love it? Here are three of them.

'Just right' size: bigger than an A330, smaller than a 777

You won't be surprised that a plane whose initials standing for ""Extra Wide Body"" is wide. Really wide.

But the design decisions Airbus has made -- including creating a noticeably tall plane with an oval-shaped cabin -- mean extra room where it counts: from hip to shoulder.

In pure cabin width, the A350 is broader than the A330 that you'll have travelled on with Qantas or Virgin Australia, and eighteen inches wider than the Boeing 787 Dreamliner, its closest competitor.

At 5.96m (19 feet 6 inches) across, long haul business class will mostly be a 1-2-1 configuration, while regional business class is most likely to end up as 2-3-2, with a dreaded middle seat.

Find out more about Airbus' plans for A350 business class in the pointy end and economy class down the back of the bus.

Frequent flyers will cheer Airbus' new design for overhead bins, which ditches the old slam-door style in favour of super-sized swing bins similar to those introduced by Boeing.

Enough space for five rollaboard carry-on bags in each overhead bin is promised, with Airbus claiming that this is one extra bag per larger A350 bin compared with a 787 bin.

New construction methods provide a new cabin 'feel'

Since the A350 is made out of an increased proportion of modern composite materials rather than metal, the cabin pressure can be lower than previous generations, down to 6000 feet from the previous 8000 feet.

That means, like the 787, that the effects of altitude on your body are less, making travelling less tiring and jetlag less disruptive to your system.

Windows on board the A350 are extra-wide too: wider than the 787's but not as tall. Travellers who enjoy looking out the window will be pleased by the improvements from current aircraft.

You won't see Boeing 787 Dreamliner style polarising windowshades on board the A350, though.

Airbus has opted for conventional pull-up shades, saying the tried-and-tested technology is faster and more effective at blocking out light.

Fourth-generation inflight entertainment

Without getting too technical, Airbus is promising an even more all-singing, all-dancing entertainment system than you'd find today.

Panasonic's eX3 and Thales' TopSeries AVANT are currently the two options available for A350s, which provide more entertainment than you'll know what to do with.

To remain connected, Airbus is promising SBB (Swift Broadband) standard, plus Ku band currently available and next-gen Ka band when it's available.

See also:

John Walton travelled to Toulouse to attend the Airbus Innovation Days as a guest of Airbus. Catch up with all the news from the Innovation Days!

For more news, reviews and the very latest info for business travellers, follow us on Twitter: we're @AusBT.","{'label': 'Neutral', 'score': 0.99982750415802}",neutral,0.99982750415802,0
Qatar Airways makes $7 billion Airbus order - The New Indian Express,"Wed, 16 May 2012 07:00:00 GMT",https://news.google.com/rss/articles/CBMibGh0dHBzOi8vd3d3Lm5ld2luZGlhbmV4cHJlc3MuY29tL2J1c2luZXNzLzIwMTEvTm92LzE2L3FhdGFyLWFpcndheXMtbWFrZXMtNy1iaWxsaW9uLWFpcmJ1cy1vcmRlci0zMTA3NTIuaHRtbNIBdmh0dHBzOi8vd3d3Lm5ld2luZGlhbmV4cHJlc3MuY29tL2FtcC9zdG9yeS9idXNpbmVzcy8yMDExL05vdi8xNi9xYXRhci1haXJ3YXlzLW1ha2VzLTctYmlsbGlvbi1haXJidXMtb3JkZXItMzEwNzUyLmh0bWw?oc=5&hl=en-US&gl=US&ceid=US:en,"Al Bakar said that this long-awaited purchase by Qatar Airways was delayed due to some ""legal issues in the deal with Airbus."" He, however, did not elaborate. The deal increased the total order value at the 12th Dubai Airshow to almost $50 billion.","{'label': 'Neutral', 'score': 0.8317463994026184}",neutral,0.8317463994026184,0
"Boeing turns around with new orders, new planes - The New Indian Express","Wed, 16 May 2012 07:00:00 GMT",https://news.google.com/rss/articles/CBMicGh0dHBzOi8vd3d3Lm5ld2luZGlhbmV4cHJlc3MuY29tL2J1c2luZXNzLzIwMTEvTm92LzE4L2JvZWluZy10dXJucy1hcm91bmQtd2l0aC1uZXctb3JkZXJzLW5ldy1wbGFuZXMtMzExNDcxLmh0bWzSAXpodHRwczovL3d3dy5uZXdpbmRpYW5leHByZXNzLmNvbS9hbXAvc3RvcnkvYnVzaW5lc3MvMjAxMS9Ob3YvMTgvYm9laW5nLXR1cm5zLWFyb3VuZC13aXRoLW5ldy1vcmRlcnMtbmV3LXBsYW5lcy0zMTE0NzEuaHRtbA?oc=5&hl=en-US&gl=US&ceid=US:en,"Boeing expects demand for 11,450 planes in the Asia-Pacific region over the next 20 years, more than in any other part of the world. That number includes planes made by Boeing and competitors such as Airbus and new entrants into the market. Airbus has already booked 1,268 firm orders for its A320neo, so named for its ""new engine option.""","{'label': 'Neutral', 'score': 0.9948758482933044}",neutral,0.9948758482933044,0
Up to airlines to promote pilotless aircraft – Airbus - Australian Aviation,"Fri, 25 May 2012 07:00:00 GMT",https://news.google.com/rss/articles/CBMiXmh0dHBzOi8vYXVzdHJhbGlhbmF2aWF0aW9uLmNvbS5hdS8yMDEyLzA1L3VwLXRvLWFpcmxpbmVzLXRvLXByb21vdGUtcGlsb3RsZXNzLWFpcmNyYWZ0LWFpcmJ1cy_SAQA?oc=5&hl=en-US&gl=US&ceid=US:en,"Airbus says it is ready and able to build a pilotless airliner but is says it is up to the airlines to sell the concept to the public.

Addressing global media at Airbus Innovation Days Airbus executive vice president of strategy and future programs Christian Scherer said that “airlines are pressing it to reduce costs on a plane “and pilots are the highest costs aside from fuel.”

This content is available exclusively to Australian Aviation members. Login Become a Member To continue reading the rest of this article, please login. Username or Email Address Password Keep me signed in on this device Forgot password? To unlock all Australian Aviation magazine content and again unlimited access to our daily news and features, become a member today!

A monthly membership is only $5.99 or save with our annual plans. PRINT $49.95 for 1 year Become a Member See benefits Australian Aviation quarterly print & digital magazines

Access to In Focus reports every month on our website MOST POPULAR PRINT + DIGITAL $99.95 for 1 year Become a Member $179.95 for 2 years Become a Member See benefits Unlimited access to all Australian Aviation digital content

Access to the Australian Aviation app

Australian Aviation quarterly print & digital magazines

Access to In Focus reports every month on our website

Access to our Behind the Lens photo galleries and other exclusive content

Daily news updates via our email bulletin DIGITAL $5.99 Monthly Become a Member $59.95 Annual Become a Member See benefits Unlimited access to all Australian Aviation digital content

Access to the Australian Aviation app

Australian Aviation quarterly print & digital magazines

Access to In Focus reports every month on our website

Access to our Behind the Lens photo galleries and other exclusive content

Daily news updates via our email bulletin View more offers and details","{'label': 'Positive', 'score': 0.9917235970497131}",positive,0.9917235970497131,1
Photos: Airbus A350 business class designs showcase long-haul luxe - Executive Traveller,"Fri, 25 May 2012 07:00:00 GMT",https://news.google.com/rss/articles/CBMiY2h0dHBzOi8vd3d3LmV4ZWN1dGl2ZXRyYXZlbGxlci5jb20vYWlyYnVzLWZ1bGx5LWZsYXQtYmVkcy1saWUtZmxhdC1zZWF0cy1pbi1hMzUwLXh3Yi1idXNpbmVzcy1jbGFzc9IBAA?oc=5&hl=en-US&gl=US&ceid=US:en,"Airbus is planning ultra-comfortable seats for long distance flights on its new A350 XWB when the plane makes its debut in 2014.

Zuzana Hrnkova, Airbus' cabin interiors exec, confirmed to Australian Business Traveller that both fully flat beds and angled lie-flat seats are on the cards for the XWB (or ""Extra Wide Body"") airliner.

Airbus' early A350 models used the Sogerma Solstys seat as a demonstrator. That's a very comfortable, very spacious fully flat bed in the staggered layout with direct aisle access.

The Solstys is the business class seat you'll see on Etihad's flights to and from Australia, and is a similar kind of layout to Emirates' A380 business class, in a staggered 1-2-1 configuration.

For shorter routes, Airbus is also planning to offer Sogerma's Equinox seat in a 2-2-2 layout across the A350's extra wide body.

Passengers on Cathay Pacific -- an early A350 customer -- will be pleased to see that Cathay's new business class, a modified Sicma Zodiac Cirrus, is on the cards.

Sicma Zodiac is ""soon to become [an] Airbus Contracted Supplier"" and is planning a 1-2-1 reverse herringbone configuration (which Cathay Pacific modified to make its very popular new business class).

For shorter regional flights, Sicma Zodiac's 2-3-2 layout Arcus seats are ""under study"", while Jamco's Journey 2-3-2 seats have also been approved for installation.

John Walton travelled to Toulouse to attend the Airbus Innovation Days as a guest of Airbus. Catch up with all the news from the Innovation Days!

For more news, reviews and the very latest info for business travellers, follow us on Twitter: we're @AusBT.","{'label': 'Neutral', 'score': 0.9999865293502808}",neutral,0.9999865293502808,0
