Titre,Date de publication,URL,Contenu
Airbus faces €105m repair bill for A380 superjumbos' cracked wings - The Guardian,"Thu, 08 Mar 2012 08:00:00 GMT",https://news.google.com/rss/articles/CBMiV2h0dHBzOi8vd3d3LnRoZWd1YXJkaWFuLmNvbS9idXNpbmVzcy8yMDEyL21hci8wOC9haXJidXMtY29tcGVuc2F0aW9uLWEzODAtY3JhY2tlZC13aW5nc9IBV2h0dHBzOi8vYW1wLnRoZWd1YXJkaWFuLmNvbS9idXNpbmVzcy8yMDEyL21hci8wOC9haXJidXMtY29tcGVuc2F0aW9uLWEzODAtY3JhY2tlZC13aW5ncw?oc=5&hl=en-US&gl=US&ceid=US:en,"Airbus faces a repair bill of €105m (£87m) to fix cracks in the wings of its global fleet of A380 superjumbos.

Airbus's parent, the European aerospace and defence group EADS, revealed the cost at its annual results in Paris on Thursday morning, a month after safety checks for the state-of-the-art aircraft were extended to all 67 in service. The European Aviation Safety Agency has warned that if they are not detected the cracks inside the wings ""may lead to reduction of the structural integrity of the aeroplane"".

The EASA directives apply to two types of crack. The most serious defect, located in a specific area of the A380 wings, relates to brackets that attach the A380's wing ribs – the elongated, oval-shaped frames that run along the width of the wing – to the wing's metal skin. The cracks were caused by the stress generated when the brackets were fastened to the skin – a strain that was exacerbated by the flexing of the wings during flight.

A380 wings are built at the Airbus factory in Broughton, Wales, but it is understood that the most serious cracks are a design fault. The main Airbus wing design facility is at Filton near Bristol although the brackets at the centre of the safety scare were not made there. So far 18 planes have been checked for the most serious defect, dubbed a ""type two"" crack, and every plane must be checked before it reaches 1,300 flights in service. Aviation sources said that type two cracks had not been discovered in every inspection to date, although they had been found in some checks.

The A380's biggest customer is Dubai-based airline Emirates, which operates 20 of the 525-seater jets, followed by Singapore Airlines with 15, Qantas with 12, Lufthansa eight, Air France six, Korean Air five and China Southern two. The repair bill includes covering the cost of the checks and, if necessary, replacing cracked parts with new fittings. If serious cracks are detected, the flawed part is cut out and replaced by engineers.

EADS revealed on Thursday that 2011 sales rose 7% to €49.1bn from €45.7bn the year before, beating analysts' expectations of around €47.9bn. Full-year profit at the group, where Airbus is the biggest unit, grew 87% to just over €1bn."
Increase in news rattles confidence in plane makers | Arkansas Democrat Gazette - Arkansas Online,"Sun, 04 Mar 2012 08:00:00 GMT",https://news.google.com/rss/articles/CBMiY2h0dHBzOi8vd3d3LmFya2Fuc2Fzb25saW5lLmNvbS9uZXdzLzIwMTIvbWFyLzA0L2luY3JlYXNlLW5ld3MtcmF0dGxlcy1jb25maWRlbmNlLXBsYW5lLW1hLTIwMTIwMzA0L9IBAA?oc=5&hl=en-US&gl=US&ceid=US:en,"— When Airbus disclosed in January that it had discovered dozens of hairline cracks in a wing component of several of its A380 superjumbo jets, the news precipitated worrying headlines and digital missives that ricocheted online.

“Airbus A380 fleet should be grounded, say engineers,” the BBC reported on its website. “Airbus in damage control,” The Daily Telegraph of Australia announced. “Wing and a prayer?” The Associated Press wrote, unable to resist an ominous pun.

The fact that those cracks did not, in the view of aviation regulators or independent safety experts, pose an imminent safety risk was noted in most of those reports. But the impression of a potential emergency lingered.

Such problems are nothing new in aviation, industry executives said. With new planes — like the A380, which entered commercial service in 2007, or the Boeing 787 Dreamliner, which carried its first passengers last year — the discovery of design weaknesses and performance issues is quite common early in the life of an aircraft.

What has changed is the availability of this type of information for a public that until quite recently heard about air safety only after a publicly reported safety lapse or, worse, a crash.

That may come as a small comfort to airline passengers, many of whom struggle to place in context dispatches on the latest possible problem with a plane they are about to ride. Yet industry executives, regulators and safety advocates emphasize that aircraft are more closely scrutinized today than ever before.

“Every aircraft that goes into service has something that crops up that’s unforeseen,” said Kevin Hiatt, chief operating officer of the Flight Safety Foundation in Alexandria, Va. “Every new airframe, or even an engine or a component, goes through a process of breaking itself in.”

It is an oversight process that still unfolds largely within the confines of maintenance hangars and test beds, involving teams of engineers, mechanics and designers who scour millions of hours of flight data in search of anomalies that might one day develop into a concern over performance or safety.

“No industry is more comprehensively overviewed as aviation,” said David Learmount, operations and safety editor at Flight International magazine. “That has been the case since the Second World War.”

Both Airbus and Boeing, which build the majority of the world’s large passenger planes, said they received tens of thousands of service messages each year from airlines, of which only a fraction were related to safety issues. In 2011, for example, Airbus recorded about 80,000 of these service events, like the discovery of the A380 wing bracket cracks and a landing-gear tire wearing out before it should have. Boeing, which did not provide data for any specific years, said it typically logged 100,000 to 200,000 such reports annually.

Most incidents are the result of actions by flight crews or maintenance staff and are unrelated to airworthiness, the companies and regulators said. But some do warrant deeper investigation. Airbus said that last year it identified about 1,700 such incidents, just over 2 percent of the total. Boeing said it classified about 2,000 events each year as “reportable” to regulators, equivalent to 1 percent to 2 percent of all occurrences.

More than 95 percent of these more significant issues are ultimately addressed with a proposed technical or procedural modification, which is communicated directly to the airlines and their maintenance providers, both Boeing and Airbus said. A full analysis of the problem is also provided to safety regulators, but it is still up to the airline to decide whether, and when, to make the recommended inspections or repairs.

Regulators step in to order remedial action only when a problem is identified that could create a safety issue if uncorrected. According to the Federal Aviation Administration, which oversees Boeing, and the European Aviation Safety Agency, which regulates Airbus, each company is subject to no more than about 100 such airworthiness directives across its fleet each year.

Every airworthiness directive, or AD in industry shorthand, includes a technical description of the problem and the required inspections or repairs. They are published on the regulators’ websites with specified deadlines for compliance that reflect the urgency of the safety risk: days, weeks, months or even several years.

“The AD process is helpful because it requires action by operators,” Corky Townsend, director of aviation safety at Boeing, said in an e-mailed response to questions. “Manufacturers can only ask and recommend that operators follow service bulletins, but regulators can compel action.”

A significant share of those directives tend to arise in the early part of an airplane’s 25-to 30-year average working life, safety experts said. Dominique Fouda, a spokesman for the European Aviation Safety Agency in Cologne, Germany, described a trend line that regulators say is consistent across many aircraft types and models, whereby the number of airworthiness directives climbs sharply over the first few years of service, then drops and plateaus for a decade or more. The airworthiness directives rise again in later years as wear and tear begin to take their toll.

“We have models that have proven to be extremely safe, like the Boeing 737 or the Airbus A320, that have flown hundreds of millions of hours without any major safety issues,” Fouda said. “However, those types received in their early days a similar or higher number of ADs at the same stage of their lifecycle than, for example, an A380.”

Since entering service five years ago, the Airbus A380, which has a current fleet of 69 planes, has been subject to 43 airworthiness directives, an average of nine per year. That includes one that followed the midair explosion in 2010 of one of its four engines during a Qantas Airways flight and prompted an emergency landing in Singapore. That failure was traced to a faulty component in the engine, which was built by Rolls-Royce of Britain.

By comparison, the fourengine Boeing 747 jumbo jet, with an active fleet of nearly 800 planes, has faced 840 airworthiness directives since it began flying passengers in 1969, averaging 21 per year.

Boeing’s 777 twin-engine, twin-aisle jet averages 18 directives annually. The Airbus A330, also with two engines and two aisles, has been the subject of 349 directives since 1994, or an average of 20 per year.

Analysts attributed the strong safety records of modern jets to major improvements in aerospace engineering over the past decade.

“Designs are getting better because of computer-aided design and manufacturing that enables engineers to calculate stresses before the first metal is cut,” said Learmount of Flight International. “When an airplane goes into service today, it has been more carefully trialed than in the old days. There are fewer potential unknowns.”"
Airbus A380 superjumbo under fire AGAIN as engine failure forces Singapore Airlines to turn back three hours i - Daily Mail,"Wed, 28 Mar 2012 07:00:00 GMT",https://news.google.com/rss/articles/CBMijQFodHRwczovL3d3dy5kYWlseW1haWwuY28udWsvbmV3cy9hcnRpY2xlLTIxMjE2NTcvQWlyYnVzLUEzODAtc3VwZXJqdW1iby1BR0FJTi1lbmdpbmUtZmFpbHVyZS1mb3JjZXMtU2luZ2Fwb3JlLUFpcmxpbmVzLXR1cm4taG91cnMtZmxpZ2h0Lmh0bWzSAZEBaHR0cHM6Ly93d3cuZGFpbHltYWlsLmNvLnVrL25ld3MvYXJ0aWNsZS0yMTIxNjU3L2FtcC9BaXJidXMtQTM4MC1zdXBlcmp1bWJvLUFHQUlOLWVuZ2luZS1mYWlsdXJlLWZvcmNlcy1TaW5nYXBvcmUtQWlybGluZXMtdHVybi1ob3Vycy1mbGlnaHQuaHRtbA?oc=5&hl=en-US&gl=US&ceid=US:en,"Airbus A380 superjumbo under fire AGAIN as engine failure forces Singapore Airlines to turn back three hours into flight



Double-decker £250m plane was carrying 430 passengers to Germany

Forced to turn back when crew reported surge in one of four engines

Latest safety concern to hit world's largest passenger jet



Airbus' new A380 superjumbo has come under scrutiny over its safety record yet again - after Singapore Airlines had to shut down an engine mid-air and turn back three hours into a flight.



The double-decker plane, which was carrying 430 passengers to Frankfurt, Germany, yesterday was in the air for three hours when crew reported a surge in one of its four Rolls-Royce engines.



Pilots shut down the engine, turned flight SQ26 around and landed safely back in Singapore using the three other engines, the airline said.

Scrutiny: Airbus' new A380 superjumbo has come under fire again, after Singapore Airlines had to shut down an engine and return a flight to Singapore yesterday

The Airbus A380 is a superjumbo that took its first flight on April 2005. There are a total of 115 A380s in operation as of November 2013. It is a double decker jet with a wingspan of 79.75 metres

The passengers were transferred to another plane which later took off to Frankfurt.



'The aircraft is capable of flying safely on three engines and at no time was the safety of our customers and crew compromised,' Singapore Airlines said in a statement.



It did not specify the model of the engine involved, but the airline and Rolls-Royce said they would thoroughly inspect it and investigate what happened.

A Rolls-Royce spokesman said: 'We are aware of the situation and working with our customer to investigate.'



It is the latest safety incident to hit the world's biggest passenger plane, which cost a staggering £250million each.



Earlier this month Airbus said it would need years to get past problems with wing cracks, which were traced to a small component engineered in its design centre in Filton, Bristol.

First class travel: Inside the A380's first class cabins. It is the latest safety incident to hit the world's biggest passenger plane, which cost a staggering £250million each

Stretching out: There are just fourteen berths in the first class section of each A380. The plane can seat up to 853 passengers

The manufacturer was forced to order a global recall fix for the offending aluminium brackets which hold the wing’s skin to the structure, affecting the entire fleet of 69 planes currently flying.

The minor cracks - no more than two centimetres long - were discovered after Qantas ordered a fleet-wide inspection.

It came following the explosion of a Rolls-Royce engine during a flight over Indonesia in late 2010 and saw Australia's leading carrier grounding its superjumbo fleet for nearly a month.



BEHEMOTH OF THE SKIES Wingspan: 261ft 8in

Length: 239ft 4in

Height: 79ft 7in

Maximum capacity: 853 *

Cost: £250million

Maximum speed: 647mph

Maximum weight: 560 tonnes

Fuel capacity: 68,188 gallons

Fuel capacity: 0.145 mpg

Range: 9,200 miles

Internal wiring: 300 miles

* If all seats are in economy class configuration

Airbus feared the issue could cost it more than £80million in compensation, but insisted there was no threat to safety posed by the flaw.

It also added that safety agencies on both sides of the Atlantic had given the planes the all clear to continue flights.

But it said it would bring in the aircraft for the fix after about 1,300 flights when the enormous stress of thousands of hours of airtime start to exacerbate the problem.

It also said that these kind of problems were common in the first few years of a new aircraft, but they would eventually be ironed out.



The A380 made by Airbus, a unit of European Aeronautic Defence & Space Co.,was hailed as the next generation of planes which would save the longhaul flight industry.

It was designed to carry around 800 passengers more efficiently a cheaper than any aircraft ever before.

The A380 aircraft are in use by Qantas, Singapore Airlines, Emirates, Air France, Lufthansa, Korean Airlines and China Southern.

SIA, Singapore's flagship carrier, has 16 in service and three more scheduled for delivery this year. It was the first airline to take delivery, with the debut passenger flight taking place in October 2007.

The planes have been in service for five years. In total, 238 of the aircraft have been ordered by 17 airlines worldwide. British Airways is due to take delivery of 12 A380s next year, while the first of Virgin’s eight superjumbos will arrive in 2015.

Superjumbo services to Heathrow began in March 2008, with Manchester airport services starting in September 2010. Shares in Airbus parent EADS were up 0.3 per cent at 30.9550 euros at 0820am, while Rolls-Royce shares were 0.2 per cent higher.

"
Airbus Military lands C-295 deal with Kazakhstan | News | Flight Global - Flightglobal,"Thu, 01 Mar 2012 08:00:00 GMT",https://news.google.com/rss/articles/CBMiXGh0dHBzOi8vd3d3LmZsaWdodGdsb2JhbC5jb20vYWlyYnVzLW1pbGl0YXJ5LWxhbmRzLWMtMjk1LWRlYWwtd2l0aC1rYXpha2hzdGFuLzEwNDMwMi5hcnRpY2xl0gEA?oc=5&hl=en-US&gl=US&ceid=US:en,"Kazakhstan's air force is to receive up to eight C-295 medium transports under the terms of a new agreement signed with Airbus Military.

The nation's state-owned Kazspetsexport agency has signed a contract for two aircraft to be delivered by April 2013, plus a separate memorandum of understanding covering a planned further six, Airbus Military said on 1 March.

The production order also includes support services, spare parts and ground support equipment, according to the European manufacturer.

© Airbus Military The C-295 is already operated by users including the Spanish air force

""Separate firm contracts will be signed progressively over the next few years,"" said Airbus Military, with the company to also deliver technical training to enable Kazakh personnel to support the type independently in the future.

The Kazakhstan air force's current airlift fleet includes a combined 10 Antonov An-12, An-24/26 and An-72 transports, as recorded by Flightglobal's MiliCAS database.

Source: Flight International"
787 Dreamliner vs A380: cockpit comparisons - Aerospace Technology,"Tue, 13 Mar 2012 07:00:00 GMT",https://news.google.com/rss/articles/CBMiXGh0dHBzOi8vd3d3LmFlcm9zcGFjZS10ZWNobm9sb2d5LmNvbS9mZWF0dXJlcy9mZWF0dXJlZHJlYW1saW5lci12cy1hMzgwLWNvY2twaXQtY29tcGFyaXNvbnMv0gEA?oc=5&hl=en-US&gl=US&ceid=US:en,"The rivalry between Airbus and Boeing, the chief competitors for the passenger airline market, has only been exacerbated by the launch of their comparatively-sized new age airliners. Despite Boeing’s numerous problems in launching the Dreamliner, it has still gone toe-to-toe with Airbus’ A380 airliner at every turn, competing for orders across the globe.

While this competition has led to both aircraft being compared to each other in terms of passenger comfort, environmental and economical efficiency, little attention has been paid to the design features included by Boeing and Airbus for the benefit of those tasked with flying the aircraft.

With new technology, innovative designs and the return of favoured features, the cockpits and flight decks of the Dreamliner and A380 have been produced to make piloting passengers to their destinations as pain-free as possible.

A380 flight displays

The Airbus A380 cockpit has eight 15x20cm LCD displays



Perhaps the most noticeable innovation in the Airbus A380 cockpit has been the introduction of a total of eight 15x20cm interchangeable LCD displays. The system consists of two primary flight displays, two navigation displays, an engine parameter display, one system display and two multifunction displays which can be customised to cater for the pilot’s preference.

The eight-screen display replaces the previous method of using three multifunction control and display units, with the screens placed around the pilot’s eye line. Multifunction displays are of particular interest, as they play a vital role in hosting the information stored in the Network Systems Server, which stores all flight information.

Dreamliner flight displays and HUD

The Dreamliner cockpit uses primary flight displays and HUD displays

The Dreamliner cockpit displays information on primary flight displays located in front of the pilot, showing all necessary flight information and an artificial horizon to aid in pilot navigation.

The four-screen design provides 50% more display room than the five-screen design used on Boeing’s 777 aircraft. What sets the Dreamliner apart from rival airliners is the head-up displays (HUD), with one each for the pilot and captain.

The HUDs, retractable display units that can slide into the pilot’s eye line, provide flight data such as air speed, speed deviation and altitude for use by both pilots, and have become standard equipment aboard the Dreamliner.

Dreamliner controls: facing the familiar

The yoke controls of the Dreamliner (left) will be familiar to Boeing pilots

The controls aboard the Dreamliner are typically Boeing. The yokes are positioned front and centre for both the captain and first officer, designed to resemble the common cockpit layout for other Boeing aircraft. This has been an intentional design characteristic in order to increase pilot familiarity, allowing pilots to transition from previous Boeing-built aircraft and into the Dreamliner with a minimal amount of training.

As a result, experienced pilots tend to transition into the Dreamliner after days of training, rather than weeks.

With the aircraft on the ground, pilots can direct and steer the aircraft as it taxies using the tiller, which is located beside the pilot’s exterior leg (left for the captain, right for the first officer).

A380 controls: flying by wire

The Airbus A380 has adopted a fly-by-wire control system

In comparison, the A380 uses a fly-by-wire flight control system that is linked to side-sticks, located to the right or left of the pilot depending upon his position in the aircraft. This flight-envelope control system retains complete flight control, preventing pilots from flying outside of performance limits.

This has allowed Airbus to tailor computer flight control laws, greatly increasing flight safety and decreasing crew workload. The system was cited as a substantial help when a Qantas Airbus A380 suffered a major engine failure over the Philippines, forcing it to return to Singapore.

Controls on the centre console

The central consoles of the A380 cockpit (left) and Dreamliner (right)

The central consoles in both airliners are largely similar aside from a few unique features. The central consoles on-board both the A380 and the Dreamliner are largely dominated by the array of navigation and communication buttons, but differ due to the new addition of a keyboard control unit that comes in addition to the pull-out keyboard that sits in front of the pilot’s lap on the A380.

This keyboard control unit is used to manipulate the flight management system, bringing up a range of information on yet more screens that are situated to the side of the pilot’s knee.

Screens can show flight information or live video footage captured from cameras situated on both the nose and tail fin of the aircraft, depending on the pilot’s preference.

The power levers dominate the centre console aboard the Dreamliner, used to control the power to the engines despite the use of autothrottles dictating that a pilot could go through an entire flight without needing to touch them. Thrust reverse levers are situated just in front for use during the landing sequence, while the speed brakes are situated just to left, compiling all the necessary levers for the aircraft in one space.

New features for new pilots

One of the new features on the A380 is its entirely paperless cockpit, designed to reduce the amount of clutter contributed to by reams of flight maps, charts and technological manuals.

Related content Towards a paperless cockpit

Advances in portable computers and smart phones are making the concept of a ‘paperless’ cockpit more popular than ever.

Aboard the A380, all these documents have been replaced with the Network Systems Server, converting all necessary information into electronic documents that are aggregated into the server for instant access whenever they’re required.

The Network Systems Server connects to the multifunction displays, allowing either pilot to bring up information, such as navigation charts, equipment lists or performance calculations onto one of the displays, rather than sift through documents to find relevant information.

While retaining a substantial amount of commonality with previous Boeing-built flight decks, the Dreamliner does possess a number of characteristics that set it aside from its rivals. The Dreamliner’s four-screen display has resulted in 546 square inches of display space, twice as much as that of the 777.

One new feature that can make use of this increased screen space is the introduction of moving airport maps, consisting of detailed layouts of common airport destinations, allowing safer ground taxi operations. Pilots will also benefit from the maximum cabin pressure of just 6,000 feet, as opposed to the previous 8,000 feet, resulting in less fatigue during long haul flights.

Related content

The A380 superjumbo is the world’s first twin-deck, twin-aisle airliner.

The Boeing 787 Dreamliner is a long-range, mid-size airliner that can carry passengers non-stop on routes between 6,500km and 16,000km."
