Titre,Date de publication,URL,Contenu
"Asia-Pacific is a key A380 market today, and for the future - Airbus","Wed, 17 Feb 2016 08:00:00 GMT",https://news.google.com/rss/articles/CBMiamh0dHBzOi8vd3d3LmFpcmJ1cy5jb20vZW4vbmV3c3Jvb20vbmV3cy8yMDE2LTAyLWFzaWEtcGFjaWZpYy1pcy1hLWtleS1hMzgwLW1hcmtldC10b2RheS1hbmQtZm9yLXRoZS1mdXR1cmXSAQA?oc=5&hl=en-US&gl=US&ceid=US:en,"Asia-Pacific is a major market for the A380: half of the global customer base for Airbus’ 21st century flagship jetliner is located there, while all of the other world’s operators utilise A380s on routes to destinations in the area

The A380 has literally changed the shape of air transportation in Asia-Pacific, and will continue to play an important role as this region’s dynamic passenger traffic develops during the years to come.Asia-Pacific is a major “home” for the A380: almost half of the global customer base for Airbus’ 21st century flagship jetliner is located there, while all of the other world’s operators utilise A380s on routes to destinations in the area.Singapore Airlines introduced the first A380 commercial service in 2007, and is now flying an expanding fleet of the airliners from its base at Changi Airport – located next to the Changi Exhibition Centre, where this week’s Singapore Airshow is being held.The other Asia-Pacific A380 operators are South Korea’s Asiana Airlines, China Southern, Korean Air, Malaysia Airlines, Qantas Airways in Australia and Thai Airways International (THAI). The list of Asian customers will expand following the recent announcement of an order for the aircraft by Japan’s All Nippon Airways (ANA).“While airline passenger traffic doubles worldwide every 15 years, such a doubling occurs each 10 years in Asia – so A380’s market importance will continue as airlines respond to the growing demand,” explained David Dufrenois, head of Airbus’ A380 Market Development Platform.Routes flown by A380 have clearly demonstrated the jetliner’s capability to meet a full range of operational needs. In addition to connecting the world’s major airport hubs on long-range flights, the A380 is increasingly used for more regional routes, such as between Singapore and Hong Kong; Singapore and New Delhi; Singapore and Mumbai; Singapore and Tokyo; Seoul to Hong Kong; and Seoul to Bangkok.Another example of the A380’s adaptability is Malaysia Airlines’ deployment of the aircraft for Hajj pilgrimage trips to Saudi Arabia – a type of operation that could open wider opportunities for the A380 in the future, according to Dufrenois.The “A380 effect” also has been seen in markets where one carrier’s presence lead to other services in a region. This occurred after the 2014 approval of A380 flights to India, where Singapore Airlines began routes into the country, followed by Emirates, Etihad and Lufthansa opening their own A380 service to Indian destinations. “Similarly, we expect to see more and more A380 flights for China, both into the country and within its borders, driven by air traffic growth,” he added.Passengers continue to show their preference for the A380, often paying a premium when they can choose from aircraft types on a specific route, Dufrenois said. He also noted that the jetliner is becoming an even greater enabler for airlines with today’s lower fuel costs.Airbus has delivered some 180 A380s to 13 airlines so far, with these aircraft carrying a combined total of approximately 120 million passengers to date. An A380 takes off or lands somewhere in the world every three minutes.The number of A380-compatible airports today now stands at 120 globally, including major destinations throughout Asia-Pacific – ensuring this jetliner’s distinctive shape will be an increasingly familiar sight in the region."
Airbus Zephyr: The eternal high-altitude surveillance sun-drone - Ars Technica,"Thu, 18 Feb 2016 08:00:00 GMT",https://news.google.com/rss/articles/CBMic2h0dHBzOi8vYXJzdGVjaG5pY2EuY29tL2luZm9ybWF0aW9uLXRlY2hub2xvZ3kvMjAxNi8wMi90aGUtYW1hemluZy1ldGVybmFsLXN1bi1kcm9uZS13aWxsLXRoZS16ZXBoeXItc2hpbmUtb3ItYnVybi_SAQA?oc=5&hl=en-US&gl=US&ceid=US:en,"In the near future, we are told, the UK's Ministry of Defence is set to shell out £10.6 million to buy a truly unusual drone. The Zephyr, for that is the name of this mythical winged beast, has been described by its creator as an “eternal” aircraft. It has the “endurance of a satellite,"" according to its manufacturer, being able to stay airborne for astonishingly long periods—but it could be better than a satellite, and potentially costs a lot less too.

How can this be?

Well, like most satellites, the Zephyr is solar powered. But it’s not a spacecraft: it’s an aeroplane, which uses electric motors to turn its propellers. During the day, sunlight on its solar-panel wings provides energy not only for the motors, but to charge up the banks of lithium-sulphate batteries which keep the Zephyr powered through the night. Zephyr already holds the world records for longest un-refuelled flight by any aeroplane and longest flight by an unmanned air system, which it set with a 14-day sortie in 2010.

It's a pseudo satellite, sir

According to Airbus Defence and Space, the European arms’n’aerospace mammoth which owns the Zephyr, the robot sun-plane “delivers a truly unique real-time satellite like capability."" The company, indeed, prefers to call Zephyr a “pseudo satellite” rather than an unmanned air system.

Jonathan Dixon, head of engineering at the Zephyr project team, goes further. An Earth satellite, by its nature, operates at an altitude of at least 100 miles, whereas the Zephyr is intended to fly about 12 miles (65,000 feet) above Earth, and can naturally see things in more detail. A satellite in low orbit is also compelled to circle the Earth rapidly, meaning that it zooms briefly across the sky at long intervals, whereas the Zephyr can keep circling above a point on the surface for as long as its operators want.

Advertisement

“It’s truly disruptive,” enthuses Dixon. Apart from surveillance, he says the Zephyr is excellent for the purpose of communications relay. During trial flights it has been able to provide line-of-sight hookups between ground transceivers 400 kilometres apart. “It worked—straightforwardly,” Dixon tells Ars.

Achieving all this isn’t simple. In order to generate a significant amount of solar power, the Zephyr has to be huge: the latest version has a wingspan of 25 metres (82 feet)—as broad as a small airliner. But this enormous aircraft weighs just 60 kilograms (132 pounds), half of which is batteries, so the structure—despite being made of super-strong carbon fibre—is very fragile. If one were to pick up a Zephyr at its midpoint or wingtips, it would break into pieces. Instead, it is launched by a team of people stationed along the length of its huge wings, who pick it up together and run forward very carefully to bring the delicate machine to takeoff speed.

Even once it’s in the air, the Zephyr’s limited power means that it can’t go very fast: maximum speed is just 9.5 metres per second, or about 20mph, and it generally goes slower than that to preserve battery charge.

This is why a Zephyr has to fly so high: its fragile structure can only survive in the lower atmosphere when the air is unusually calm, and it is so slow that it would likely be carried off who-knows-where by the wind if it spent any large amount of time below the so-called “wind bucket” found above 60,000 feet, where wind speeds are much slower than they are at lower altitudes.

“As Zephyr is so light, it is very susceptible to gusts which could knock it off course or cause the aircraft to break,” writes Annabel Rapinett, who worked with the Zephyr team as a grad student, and whose dissertation is viewable online (PDF).

“In order to overcome these winds, launch has to take place in perfect weather conditions in order to minimise risk of wind. This is one of the reasons the previous flight trials have occurred in the deserts of Australia and the USA as the desert provides still air and minimum turbulence.”

Advertisement

Once you successfully get it up to 60,000 feet, though...

You have to say that an aircraft which can only be launched on a freakishly calm day from the middle of a desert might not be quite the military’s cup of tea. But hold on—this is an “eternal plane,"" remember. The idea would be to have Zephyrs up there in the wind bucket at all times, ready to head off and spy on someone or set up a communications relay station wherever might be required. Airbus points out that Zephyrs fitted with satellite communications “can be controlled across the world from a central control station.""

In theory, then, you could have a group of “eternal” Zephyrs lurking at the ready above the UK and send them off around the world when a spying or comms-relay job came up. At 20mph they could be above the Arabian Gulf, for instance, seven days after getting the word to go. In reality this would probably take a good bit longer, but on the other hand there would be no need to keep your Zephyrs above the UK. They could be parked above international waters anywhere you liked without permission from anyone.

Actually, though, not quite anywhere: certainly not above the UK. And, in rather a lot of places, not for large parts of the year either.

“As Zephyr is powered by solar energy it is essential that it is flown when there is enough solar power,” Rapinett tells us. “In the northern hemisphere this is during the three months surrounding the summer solstice (May, June and July).”

Another reason that all the Zephyr’s flight trials so far have taken place in hot deserts is that it needs to be near the Equator so that the Sun will pass high overhead. Unlike ground based solar panels, the Zephyr’s wings cannot be kept tilted towards the Sun, and even ground panels lose a lot of power when the sunlight must travel a long way through the atmosphere at a shallow angle rather than coming straight down.

Funnily enough, the Zephyr’s record-breaking two week flight in 2010 took place in Arizona, just nine degrees of latitude from the Tropic of Cancer, at northern midsummer—the best time and position on the planet for solar power."
Airbus and SIAEC to establish joint venture in Singapore - Airbus,"Wed, 17 Feb 2016 08:00:00 GMT",https://news.google.com/rss/articles/CBMicmh0dHBzOi8vd3d3LmFpcmJ1cy5jb20vZW4vbmV3c3Jvb20vcHJlc3MtcmVsZWFzZXMvMjAxNi0wMi1haXJidXMtYW5kLXNpYWVjLXRvLWVzdGFibGlzaC1qb2ludC12ZW50dXJlLWluLXNpbmdhcG9yZdIBAA?oc=5&hl=en-US&gl=US&ceid=US:en,"Summary

New heavy maintenance facility for Airbus widebody aircraft

Airbus’ 21st century flagship A380 – which was the centre of attention during its Farnborough International Airshow flying display – is the world’s largest and most efficient jetliner

Airbus and SIA Engineering Company (SIAEC) have signed an agreement to form a joint venture based in Singapore. The company will provide airframe maintenance, cabin upgrade and modification services for Airbus A380, A350 and A330 aircraft to airlines in the Asia-Pacific.This joint venture marks SIAEC’s first collaboration with a major aircraft manufacturer for airframe maintenance. The agreement is subject to regulatory approvals being obtained in the relevant jurisdictions. Under the agreement, SIAEC will hold a 65% equity stake in the joint venture, with Airbus holding the remaining 35%.The joint venture will leverage on the synergy of SIAEC’s extensive maintenance experience and expertise with Airbus’ depth of technical and engineering knowledge as an airframe manufacturer. The joint venture will lease two hangar bays from SIAEC for its operations, with plans to add another two hangar bays over the next six years.“The joint venture will be Airbus’ Centre of Excellence in Asia for the heavy maintenance of the world’s largest commercial airliner, the A380, and the latest aircraft from Airbus, the A350, said Png Kim Chiang, Chief Executive Officer, SIAEC. “SIAEC is delighted to partner Airbus in providing the airline industry with a focused service and technical support for the A380 and A350 fleet.”“We are pleased to enter into this innovative partnership with SIAEC,” said Fabrice Brégier, Airbus President and Chief Executive Officer. “The Asia-Pacific region is a key market for Airbus widebody aircraft and will continue to drive demand for larger aircraft types such as the A380, A350 and A330 in the coming years. Setting up a world class facility in this region through our joint venture with SIAEC reflects Airbus’ strategy to develop a full range of support services for operators of our aircraft near to their home bases.”SIA Engineering Company (SIAEC) is a major provider of aircraft maintenance, repair, and overhaul (MRO) services in the Asia-Pacific region, with a client base of more than 80 international carriers and aerospace equipment manufacturers.Airbus produces the world’s most modern and comprehensive family of airliners, ranging in capacity from 100 to more than 500 seats and has sold over 16,300 aircraft to more than 380 customers worldwide. Of these, more than 9,500 aircraft have been delivered. Airbus has design and manufacturing facilities in France, Germany, the UK, and Spain, as well as subsidiaries in the US, China, Japan, India and in the Middle East. Airbus also operates spare parts and training centres in Europe, the US and Asia, and provides round-the-clock services to all Airbus operators, helping them enhance the profitability of their fleets."
Airbus Patents Bench Seats for Fat Flyers - Popular Mechanics,"Mon, 22 Feb 2016 08:00:00 GMT",https://news.google.com/rss/articles/CBMiTmh0dHBzOi8vd3d3LnBvcHVsYXJtZWNoYW5pY3MuY29tL2ZsaWdodC9uZXdzL2ExOTU0Ni9haXJidXMtcGF0ZW50LWJlbmNoLXNlYXRzL9IBAA?oc=5&hl=en-US&gl=US&ceid=US:en,"US Patent Office

When news of a new patent for airline seating surfaces, the news is often dreadful. Think of the creative and bizarre solutions we've seen for cramming ever more passengers onto a plane. But this one from Airbus isn't so cringe-inducing. It might actually be smart.

A recent patent filing by the aviation giant imagines airliner seating not as the individual bucket seating we're so accustomed to, but as a bench that's more flexible for people of differing sizes. As the patent's pencil drawings illustrate, a bench could accommodate two rather hefty fellows, three people of average size, or a family of four with the two kids sitting inside mom and dad.

US Patent Office

This is just a patent, of course, and so like many of them it's a rough idea that may never see the light of day. So we're left to wonder how booking and pricing would work for a bench rather than individual seats. Kudos to Airbus, though, for at least imagining a slightly less dystopian future of flying.

Airbus recently filed a separate patent for under-seat storage. In this scenario, you would store your personal item not under the seat in front of you, but rather under your own seat by lifting up the seat cushion. Sounds like a reasonable idea at first, until you consider that this design would probably reduce legroom even further—and require you to stand up if you suddenly need to get something out of your bag.

US Patent Office

Source: Consumerist"
Lufthansa takes delivery of the world's first Airbus A320neo as launching customer - Airbus,"Fri, 12 Feb 2016 08:00:00 GMT",https://news.google.com/rss/articles/CBMieGh0dHBzOi8vd3d3LmFpcmJ1cy5jb20vZW4vbmV3c3Jvb20vcHJlc3MtcmVsZWFzZXMvMjAxNi0wMi1sdWZ0aGFuc2EtdGFrZXMtZGVsaXZlcnktb2YtdGhlLXdvcmxkcy1maXJzdC1haXJidXMtYTMyMG5lby1hc9IBAA?oc=5&hl=en-US&gl=US&ceid=US:en,"Summary

Lufthansa, Airbus and Pratt & Whitney holding a delivery ceremony in Hamburg – First scheduled A320neo flights with better fuel efficiency and more passenger comfort achieved through quieter engines - 40 years of partnership between Lufthansa and Airbus

Lufthansa takes delivery of the world's first Airbus A320neo as launching customer. Robert Leduc, President of Pratt & Whitney, Carsten Spohr, Chairman of the Board and CEO of the Lufthansa Group, Airbus President and CEO Fabrice Brégier

Lufthansa, together with Airbus and the Pratt & Whitney engine manufacturer, celebrates the delivery of the world’s first Airbus A320neo. Carsten Spohr, Chairman of the Board and CEO of the Lufthansa Group, Airbus President and CEO Fabrice Brégier and the President of Pratt & Whitney Robert Leduc invited 700 guests and media representatives to the official delivery at Hamburg-Finkenwerder. Following the ceremonial handover, the first two new-type airplanes were presented to the public. The first A320neo, with the registration D-AINA, has already flown scheduled service since January. The second “neo” is expected to complement the Lufthansa Airbus fleet soon. The first experiences with the A320neo clearly show that the 15 percent lower fuel consumption mark has not only been achieved but even slightly exceeded. The significantly quieter engines also increase customer comfort on-board and provide relief to residents near airports by reducing noise emissions.The development and introduction of the quietest and most fuel-efficient aircraft on short and medium distances is further evidence of the successful cooperation in the aviation industry at European level. “Europe has been a leader in this fascinating industry since the early days of aviation,” says Carsten Spohr. “Lufthansa and Airbus have developed a trusting and productive 40-year partnership. Together we have pushed ahead and brought to market many innovations and contributed to the success of the European aerospace industry. With new and efficient aircraft, such as the A320neo and the A350 XWB, we set new standards for our passengers, while reducing the impact on the environment and, not least of all, on the people living near airports.”“On behalf of everyone at Airbus, I congratulate Lufthansa on being the A320neo launch customer. Together, we’re opening a new chapter in commercial aviation and I am confident that the A320neo will support Lufthansa objective to raise its environmental performance. The A320neo not only cuts emissions at every operational stage but also halves its noise footprint compared to previous generation aircraft,” said Fabrice Brégier, Airbus President and CEO.“At Airbus we are have been proud to support Lufthansa’s growth over the past four decades with our partnership now spanning almost the entire Airbus family, from the A320 right up to the A380.”""Pratt & Whitney is proud to build on its long and deep history with Lufthansa and Airbus by together marking a new era in commercial aviation with the delivery of the A320neo equipped with ultra-high bypass ratio Geared Turbofan engines,"" Pratt & Whitney President Robert Leduc, said. “We applaud Lufthansa for being the first to enjoy the many benefits this aircraft and engine technology affords in terms of fuel efficiency and in reducing noise and emissions.”This afternoon, the A320neo will take off from the Airbus facilities in Hamburg-Finkenwerder as a special flight with flight number LH9917 with guests and media representatives on board and fly with a short stop in Hamburg’s City Airport Fuhlsbüttel towards Frankfurt. The A320neo was fitted with a special logo. “First to fly A320neo - Less noise. Less fuel. Less CO2“ adorns the rear fuselage of the Lufthansa aircraft.Another cause for celebration is the 40-year partnership between Lufthansa and Airbus. On 9 February 1976, Lufthansa received the first Airbus A300 at Hamburg-Finkenwerder. The airlines within the Lufthansa Group have ordered a total of 582 Airbus aircraft in the past 40 years. Lufthansa is the largest Airbus customer with currently 392 aircraft from the European manufacturer, including 284 aircraft from the A320 family and 14 A380.The Lufthansa Group has ordered a total of 116 A320neos and A321neos, to be delivered in the next years. 60 aircraft will be delivered with the new PW1100G-JM engine from Pratt & Whitney. A special intermediary 3:1 gear conversion system ensures optimum speed of the 2.06 meter-cross-section fans and the turbine inside the engine. The new engines and improved aerodynamics allow a significant noise and emission reduction. With the new engine technology, the 85-decibel noise footprint of a new A320neo is only about half the size as a comparable aircraft of the existing fleet. In addition, the A320neo is at least 15 percent more fuel efficient than the previous A320 version. Calculated per-seat, this efficiency advantage increases to as much as around 20 percent, because the A320neo, through improved use of space in the cabin, allows more space in the business class compartment and two more rows with twelve additional seats on board."
