Titre,Date de publication,URL,Contenu,sentiment_finbert,sentiment_label,sentiment_score,sentiment_numerique
Odds and Ends: More from the Airbus Innovation Days - Leeham News and Analysis,"Tue, 29 May 2012 07:00:00 GMT",https://news.google.com/rss/articles/CBMiVWh0dHBzOi8vbGVlaGFtbmV3cy5jb20vMjAxMi8wNS8yOS9vZGRzLWFuZC1lbmRzLW1vcmUtZnJvbS10aGUtYWlyYnVzLWlubm92YXRpb24tZGF5cy_SAQA?oc=5&hl=en-US&gl=US&ceid=US:en,"We have some follow-up to our trip last week to the Airbus Innovation Days:

A350 Program: Aviation Week has this article about the A350 program, noting that the A350-800 seems to be suffering from from benign neglect.

A350 Engineers: There is a lot of buzz “out there” that the A350-900 program is sucking up engineers from the A350-1000. We asked Airbus about this at the Innovation Days. There is no question that the -900 timeline is challenging (see chart) but Didier Evard, EVP of the program, says engineers will be released soon for the 1000.

“This year we have to ramp up the 1000 team,” Evard said. “We have internal plan and to increase the workforce from the outside to start the detail design this year.”

We asked what was the level of engineers assigned to the 900, using the example that if 100% were the norm, was the program at 100% or 125%, for example. Evard didn’t directly address that but said:

“The 900 this year will go down from 100% to around 60% or 70% and be stable.”

A380 Wing Rib Fix: Airbus showed this illustration:

Although the slide shows 60 ribs per wing, in practice, Airbus says only 20 have needed repair.

A320neo affecting A320ceo demand: JP Morgan issued this observation following the Innovation Days:

A320neo EIS is affecting demand for the current version. The imminent introduction of the a more efficient version of the A320, the neo is scheduled to enter service in 4Q2015, should make it more difficult to drum up demand for current generation A320s in 2014/2015. The years immediately preceding the changeover have always seemed like a potential rough patch, both for the A320 and the 737, which will transition from the NG to the MAX, in 2017. According to Ascend, A320 slots are filled for 2014 with 484 aircraft scheduled for delivery, 42/month implies ~480 deliveries, but 2015 is not yet full at 362 A320s. As some customers could walk away ahead of the neo introduction or for other reasons and new orders should be hard to come by, holding the rate at 42/month looks reasonable. Lease rates on current generation A320 family aircraft have been the weakest among major Airbus and Boeing platforms, an indication that the market is not as hungry for more of them as it is for other models.

We heard long ago that Airbus was worried about demand for the ceo, but we also heard the same is quite true for Boeing on the 737NG with respect to MAX sales. This is why we are seeing many Airbus and Boeing deals include the current generation of airplanes with the re-engined models. It’s also why, we believe, we’re seeing pricing on the current generation of airplanes dropping precipitously, which will of course affect residual values and lease rates.

Share this: Print

Email

Twitter

Pinterest

Facebook

WhatsApp

LinkedIn

Tumblr

Reddit

","{'label': 'Neutral', 'score': 0.9996587038040161}",neutral,0.9996587038040161,0
Boeing 'on right trajectory' to catch Airbus in short-haul market - The Guardian,"Mon, 28 May 2012 07:00:00 GMT",https://news.google.com/rss/articles/CBMiTGh0dHBzOi8vd3d3LnRoZWd1YXJkaWFuLmNvbS9idXNpbmVzcy8yMDEyL21heS8yOC9ib2VpbmctY2F0Y2gtYWlyYnVzLTczNy1tYXjSAUxodHRwczovL2FtcC50aGVndWFyZGlhbi5jb20vYnVzaW5lc3MvMjAxMi9tYXkvMjgvYm9laW5nLWNhdGNoLWFpcmJ1cy03MzctbWF4?oc=5&hl=en-US&gl=US&ceid=US:en,"Boeing has stepped up the pressure on Airbus in the battle for control of the short-haul aircraft market after claiming that it is on track to draw neck-and-neck with its arch-rival.

Airbus has stolen a march on its competitor with the launch of the A320neo, an upgrade of the plane that is used by scores of airlines including easyJet. It has received 1,289 firm orders so far but Boeing has hit back with the 737 Max, which follows the strategy of the neo in revamping a tried-and-trusted model.

Randy Tinseth, vice president of marketing at Boeing's commercial unit, said the company is focusing on achieving ""parity"" on orders with the fuel-efficient neo, having received 451 firm orders, from carriers including Dallas-based Southwest, the airline credited with inventing low-cost flying.

""We are on the right trajectory to catch them,"" said Tinseth. ""And that's where we want to be.""

Despite the ongoing Airbus duel, Boeing expects a major emerging market manufacturer to break the two-handed stranglehold on the large passenger aircraft market. The Commercial Aircraft Corporation of China [Comac] is the front-runner to launch a rival to the 737 and A320, with Ryanair agreeing a deal to assist the Chinese company in designing a 200-seater competitor. ""We think the duopoly between Airbus and Boeing will be over,"" said Tinseth. ""But the question is, will they be successful? We think those guys will be later rather than sooner but the market will tell. We have to make our plans assuming that they will be successful.""

A spokesperson for Ryanair, which operates 737 aircraft, said the airline was discussing a new order with Boeing but was not in serious talks with any manufacturer and could still plump for Comac. ""We believe it will be a realistic alternative should we want to make a large order in a number of years' time.""

Russia's challenge as an emerging contender was dealt a blow this month when a Sukhoi Superjet crashed on a promotional flight in Indonesia, killing all 45 people on board. The new 90-seater plane, aimed at regional airlines such as the UK's Flybe, had been launched as a challenger to products sold by Canada's Bombardier and Brazil's Embraer.","{'label': 'Negative', 'score': 0.528842568397522}",negative,0.528842568397522,-1
Will New Airbus Seats Help Airlines Charge More for Wider Seats? - CNBC,"Fri, 25 May 2012 07:00:00 GMT",https://news.google.com/rss/articles/CBMiIGh0dHBzOi8vd3d3LmNuYmMuY29tL2lkLzQ3NTY0ODg30gEkaHR0cHM6Ly93d3cuY25iYy5jb20vYW1wL2lkLzQ3NTY0ODg3?oc=5&hl=en-US&gl=US&ceid=US:en,"""These seats are not meant just for overweight passengers,"" Airbus' aircraft interiors director Zuzana Hrnkova told journalists, before adding, ""Mothers with children may be ready to pay a little more in order to be able to keep their babies in their lap, and large football players may be interested.""

The silver lining, of course, is that the airlines could make as much as $3 million in extra profits over a 15-year period by charging extra for the extra wide seats, the AFP says.

So far, only two as-yet-unidentified American airlines have expressed interest in the extra-wide seats, and there is likely good reason for that.

In recent years, there have been several incidents of American passengers being ""too fat to fly"" on American carriers. Director Kevin Smith was famously booted from a Southwest flight in 2010 because he was too wide for his seat.

Last summer, Kenlie Tiggeman made headlines for calling out Southwest for claiming she was too fat to get on a flight. She decided to sue the airline this month for not having a cohesive policy on the matter. Yet airlines like AirTran and Southwest have created policies to require an overweight passenger to purchase an extra seat if they cannot fit in their assigned seat.

Is this an example of the airlines trying to do right by passengers and dissipate the issues? Or is this a case of the airlines milking the flying public for all they're worth? After all, the the airlines are seemingly comfortable charging for carry-ons and even adjacent seats.","{'label': 'Neutral', 'score': 0.9995720982551575}",neutral,0.9995720982551575,0
Airbus admits no quick-fix for A380 wing-rib crack issue - Flightglobal,"Thu, 24 May 2012 07:00:00 GMT",https://news.google.com/rss/articles/CBMiZGh0dHBzOi8vd3d3LmZsaWdodGdsb2JhbC5jb20vYWlyYnVzLWFkbWl0cy1uby1xdWljay1maXgtZm9yLWEzODAtd2luZy1yaWItY3JhY2staXNzdWUvMTA1NDgyLmFydGljbGXSAQA?oc=5&hl=en-US&gl=US&ceid=US:en,"Airbus is expecting up to 120 A380s to be delivered before the permanent fix for the wing-rib bracket cracking problem on the type is fully in place.

The airframer detailed its proposed solution during a briefing in Toulouse. Its initial retrofit, for aircraft already in service, centres on 23 hybrid ribs mounted in the more lightly-loaded sections of each wing.

Retrofit involves replacing the type-7449 aluminium with a more robust grade, type 7010. This retrofit also involves localised reinforcement and fitting thicker rib brackets. Two ribs in each wing-tip will also be replaced.

But the forward-fit solution will replace these ribs with all-aluminium components, also built from type-7010 material, from the outset. The region around the inspection manholes will be reinforced and the rib feet will be reshaped to make them more forgiving.

Parts will be available to perform the modification on in-service aircraft from the first quarter of 2013 while wing assembly from the end of this year will implement the rib design change. All ribs will be built from type-7010 aluminium, in a similar way to other Airbus programmes. A380s delivered from 2014 onwards will have the new rib design.

Airbus executive vice-president for programmes Tom Williams says the type 7449 aluminium was strong and lightweight but brought a ""degree of brittleness"". Eliminating this material and switching to the 7010 grade gives greater strength but also around 90kg additional weight.

The flight-test programme for certification has not yet been detailed but Williams says the airframer hopes to fly the demonstrator in the autumn. He stresses that the fix will restore the full life capability of the wing without impacting performance.

Williams estimates that 110-120 aircraft will have to be retrofitted. He says the cause of the cracking is ""well established"", the result of material choice plus thermal distortion at extremely low temperatures, and stresses generated during assembly.

""When we were designing the wing, we pushed hard for weight reduction,"" Williams says, adding that the original hybrid design saved 300kg.

But he admits that the airframer, during ground testing of the airframe, made ""assumptions"" on the use of the type-7449 material because it had been used on other programmes.

He adds that the linear, finite-element modelling used to model some ribs on the aircraft assumed that adjacent ribs would behave the same way. Some non-linear modelling tools, which might have helped the analysis, were not available at the time.

Williams also points out that fatigue testing cannot take into account every variation of temperature and pressure to which the aircraft will be subjected in service.

Intensive testing is under way, he says: ""We only want to do this one time. It's very disruptive to customers. If we have to ground [a customer's aircraft] we only want to do it on time.

""It's not a complicated fix by any means, [but] it's about making 110% sure we have the right answer.""

But the airframer is ""still working its way"" through the approach to implementing the fix on in-service aircraft. Williams says a ""nose-to-tail"" grounding is one option, enabling completion in one session, but some customers might opt to split the fix across C-checks.

Source: Air Transport Intelligence news","{'label': 'Neutral', 'score': 0.9998750686645508}",neutral,0.9998750686645508,0
Airbus announces plans to add 2 inches to aeroplane seats - Daily Mail,"Sat, 26 May 2012 07:00:00 GMT",https://news.google.com/rss/articles/CBMiaWh0dHBzOi8vd3d3LmRhaWx5bWFpbC5jby51ay9uZXdzL2FydGljbGUtMjE1MDM4My9BaXJidXMtYW5ub3VuY2VzLXBsYW5zLWFkZC0yLWluY2hlcy1hZXJvcGxhbmUtc2VhdHMuaHRtbNIBbWh0dHBzOi8vd3d3LmRhaWx5bWFpbC5jby51ay9uZXdzL2FydGljbGUtMjE1MDM4My9hbXAvQWlyYnVzLWFubm91bmNlcy1wbGFucy1hZGQtMi1pbmNoZXMtYWVyb3BsYW5lLXNlYXRzLmh0bWw?oc=5&hl=en-US&gl=US&ceid=US:en,"Too fat to fly? Not anymore… Airbus announces plans to add two inches to aeroplane seats

Airline seats are literally growing with demand.

Airbus has announced that it will be providing extra-wide seats for overweight passengers as number of fat Americans creeps up.

One third of the population are currently obese, with the figure expected to reach 42 per cent by 2030.

A tight squeeze: Overweight passengers can cause misery for others (stock image)

Two 20-inch seats will be installed on each side of the aisle, sacrificing the space for three regular 18-inch seats on board the A320 - on Boeing aircraft standard seats are 17 inches.

Extra-large passengers will be able to purchase extra-large seats at an added cost, which will likely prove lucrative to the air travel industry.

Airlines could make as much as $3 million extra in profits over a 15-year period, according to the Huffington Post .



It is the latest money maker after it was announced some airlines would be charging for carry-on luggage or for adjacent seats.

But so far only two American airlines have shown interest in the extra-wide seating.

It seems that others are treading carefully in the wake of recent fury about overweight passengers being kicked off planes.

Latest model: The A320 will have 20-inch seats on either side of the aisle

One woman, Kenlie Tiggeman, this month filed a lawsuit against Southwest after she was told she was too fat to fly and would have to buy another seat.

She is not seeking monetary damages from the airline, Ms Tiggeman has claimed that she wants to enact an industry wide standard for rules to be put in place clearly stating the official policy of all U.S air companies.

'We need to know what the rules are,' she said.

'We need to know if we need one seat or two, because this eyeballing happening at the gate is incredibly discriminatory, and it's so unnecessary.'

In February 2010, director Kevin Smith famously was told he was ‘too wide for the sky.’

According to his Twitter feed, he was removed from the Southwest flight because he was deemed a safety risk.



Too fat to fly? Kenlie Tiggeman (left) was told she was too fat to fly and would have to buy another seat. Kevin Smith (right) was once removed from a flight



The Jay and Silent Bob director was given a $100 voucher by the airline and boarded another flight. Southwest later reached out to apologise.

The airline also booted a thin flier from one of their seats in July of 2010 on a Las Vegas-to-Sacramento flight so an obese 14-year-old could have her seat.



'It didn’t seem right that I should have to leave to accommodate someone who had only paid for one seat,’ she told the Sacramento Bee at the time.","{'label': 'Neutral', 'score': 0.9958809614181519}",neutral,0.9958809614181519,0
"The moving numbers, redux, in the A320-737 game - Leeham News and Analysis","Tue, 29 May 2012 07:00:00 GMT",https://news.google.com/rss/articles/CBMiUGh0dHBzOi8vbGVlaGFtbmV3cy5jb20vMjAxMi8wNS8yOS90aGUtbW92aW5nLW51bWJlcnMtcmVkdXgtaW4tdGhlLWEzMjAtNzM3LWdhbWUv0gEA?oc=5&hl=en-US&gl=US&ceid=US:en,"For two years, Boeing claimed the 737NG was 8% more economical (and here) than the Airbus A320. Boeing told media, analysts, everybody who would listen. Boeing illustrated the point before and after the MAX.

Here is a recent illustration; note the NG advantage over A320ceo is reduced to 6%:

And Randy Tinseth, in Randy’s Journal, writes:

Combining the seat count issue with all our latest improvements gets you to a 6 to 7 percent difference. So, if the aircraft are not at parity today, what does that say about the rest of the story? It’s always fun to have spirited debate with our competitors. But in this case, the numbers really do speak for themselves. I’d love to hear your thoughts.

Our thought was, What happened to 8%? Is this a change in the Boeing messaging? So we asked Tinseth, and through a spokeswoman, the response was, “The 8 percent is our current operating cost per seat advantage over our competition and the other is a measure of fuel burn per seat.”

Airbus, as we’ve noted before, disputes Boeing’s analysis and offers up its own, where numbers are again at the forefront. A key assumption on Airbus’ part is using 157 seats for the 737-800 vs the 162 used by Boeing. Tinseth recently has this to say about that: according to Seatguru.com, Tinseth argues Boeing is closer to right than Airbus–hence his comment above.

Airbus also disputes the 20%-25% maintenance advantage Boeing claims for the 738. Boeing explained here where that comes from.

Here is an Airbus slide from the Innovation Days. Note the seat assumptions in the fine print.

The bouncing around is enough to make one airsick. This is why we remain skeptical of data from both OEMs and prefer to listen to the airlines, who tell use the two airplanes are very close.

Update, 3:30pm PDT: A reader linked this Airbus slide, which was previously posted but forgot about. It addresses Tinseth’s seat issue in the print at the bottom, and was created last year by Airbus.

Share this: Print

Email

Twitter

Pinterest

Facebook

WhatsApp

LinkedIn

Tumblr

Reddit

","{'label': 'Neutral', 'score': 0.9983921647071838}",neutral,0.9983921647071838,0
Airbus Military studies gunship versions of medium transports - Flightglobal,"Thu, 10 May 2012 07:00:00 GMT",https://news.google.com/rss/articles/CBMiaWh0dHBzOi8vd3d3LmZsaWdodGdsb2JhbC5jb20vYWlyYnVzLW1pbGl0YXJ5LXN0dWRpZXMtZ3Vuc2hpcC12ZXJzaW9ucy1vZi1tZWRpdW0tdHJhbnNwb3J0cy8xMDUyMTQuYXJ0aWNsZdIBAA?oc=5&hl=en-US&gl=US&ceid=US:en,"Airbus Military is studying possible new variants of its CN-235 and C-295 medium transports adapted for tasks including combat support and battlefield surveillance, along with performance enhancements for the latter type.

Revealing the company's investigation of a gunship development, head of market development for light and medium transport aircraft Jerónimo Amador says: ""We have seen a growing interest from customers."" This has been prompted by a need to perform counter-piracy operations, participate in low-intensity conflict and provide protection for critical national infrastructure, he adds.

Amador confirms that Airbus Military has held talks with ATK over the US company's work to modify two ex-Spanish air force CN-235s as gunships for Jordan, and that it is ""looking for a partner to allow us to offer an efficient solution"".

Both images © Airbus Military Gunship versions of the CN-235 (top) and C-295 could be offered

Aircraft could be manufactured in a dedicated armed reconnaissance and combat support configuration, to include an electro-optical/infrared sensor, fuselage-housed 30mm (1.2in) cannon and potentially laser-guided rockets and missiles. A surveillance radar could also be carried, along with intelligence-gathering equipment and up to four onboard operator stations. Alternatively, customers could be offered elements of this system as a removable kit.

Potential customers exist in Asia, Latin America and the Middle East, Amador says.

Other applications now being considered for the C-295 include a model equipped with a ground surveillance radar and up to eight onboard operator workstations, a signals intelligence-gathering development and a VVIP transport. Airbus Military is also eyeing a palletised kit, which would enable the aircraft to serve as an inflight refuelling platform for combat helicopters.

Meanwhile, Amador says near-term enhancements to the aircraft could include aerodynamic improvements - winglets were considered as part of a proposed airborne early warning and control system version being offered with Elta Systems - and using more power from its Pratt & Whitney Canada PW127G engines. The latter move could boost the type's rate of climb and cruise speed and offer increased mission flexibility, he says.

Source: Flight International","{'label': 'Neutral', 'score': 0.504551351070404}",neutral,0.504551351070404,0
EBACE: Airbus Corporate Jets steps up its presence at air shows - Flightglobal,"Sun, 13 May 2012 07:00:00 GMT",https://news.google.com/rss/articles/CBMiamh0dHBzOi8vd3d3LmZsaWdodGdsb2JhbC5jb20vZWJhY2UtYWlyYnVzLWNvcnBvcmF0ZS1qZXRzLXN0ZXBzLXVwLWl0cy1wcmVzZW5jZS1hdC1haXItc2hvd3MvMTA1MjY1LmFydGljbGXSAQA?oc=5&hl=en-US&gl=US&ceid=US:en,"Airbus Corporate Jets is stepping up its presence on the air show calendar as it aims to put its narrowbody aircraft in front of as many potential buyers as possible.

The newly-independent Airbus unit will be exhibiting at 11 events this year, up from the regular four to six, says Francois Chazelle, vice president commercial. ""We've come to realise that the best way to sell the aircraft is to show the cabin - the widest and tallest on the market - to as wide an audience as we can,"" he says.

ACJ is at EBACE with an ACJ319, chartered from one of its biggest customers, Comlux. The jet arrived in April from Comlux's own Comlux America completions centre in Indianapolis, having been delivered green last year.

The ACJ319 is certificated to carry 19 passengers and features two private rooms that convert to bedrooms, one with an en-suite bathroom.

In a separate move, the ACJ318 and ACJ319 have been awarded eligibility for FAA Part 135 operations. This means operators can avoid the more stringent Part 121 process, designed for airlines. The development should make it easier for owners in countries such as China and Saudi Arabia, which follow US regulations, to charter their aircraft to paying passengers.

Airbus has secured 60 orders for VIP versions of its widebody airliners since the mid-1980s, and 110 narrowbodies since launching the Airbus Corporate Jet family in 1997.

Airbus is taking orders for sharklet-equipped ACJs. The enhanced winglets are offered as a fuel-saving, range-boosting option. Airbus has not yet received any orders, but one customer has ""provisions"" to add them, says Airbus Corporate Jets.

Source: Flight Daily News","{'label': 'Neutral', 'score': 0.9969923496246338}",neutral,0.9969923496246338,0
