Titre,Date de publication,URL,Contenu,sentiment_finbert,sentiment_label,sentiment_score,sentiment_numerique
Airbus and ITA Airways partner to develop urban air mobility in Italy - Airbus,"Wed, 27 Apr 2022 07:00:00 GMT",https://news.google.com/rss/articles/CBMieWh0dHBzOi8vd3d3LmFpcmJ1cy5jb20vZW4vbmV3c3Jvb20vcHJlc3MtcmVsZWFzZXMvMjAyMi0wNC1haXJidXMtYW5kLWl0YS1haXJ3YXlzLXBhcnRuZXItdG8tZGV2ZWxvcC11cmJhbi1haXItbW9iaWxpdHktaW7SAQA?oc=5&hl=en-US&gl=US&ceid=US:en,"Rome, Airbus and ITA Airways have signed a Memorandum of Understanding to collaborate on urban air mobility (UAM) in Italy. The two companies will explore the creation of tailored UAM services, by identifying strategic use cases for emission-free mobility solutions.



The agreement foresees a joint approach toward local mobility stakeholders in order to onboard additional partners for the safe and sustainable launch of operations with the CityAirbus NextGen electric vertical take-off and landing (eVTOL) aircraft, currently in development. The parties also agree to identify pilot cases with the goal of securing public acceptance of UAM by demonstrating the added value that it can bring to communities.



“The partnership between ITA Airways and Airbus started with the evolution toward more modern, more comfortable and environmentally-friendly commercial aircraft, equipped with cutting-edge technologies”, said Alfredo Altavilla, Chairman of ITA Airways. “With this agreement, our partnership expands to the segment of urban air mobility for a wider, customer-centric, innovative and sustainable offer for our customers.” CityAirbus NextGen is a fully electric vehicle equipped with fixed wings, a V-shaped tail, and eight electrically powered propellers as part of its uniquely designed distributed propulsion system. It is designed to carry up to four passengers - including a pilot - in zero-emission flights for multiple applications. CityAirbus NextGen is being developed to fly with a 80 km operational range and to reach a cruise speed of 120 km/h, making it perfectly suited for a variety of missions.



Guillaume Faury, CEO of Airbus, said: “This agreement is testimony to the strong relationship between Airbus and ITA Airways. It is an opportunity to leverage our shared ambition – pioneering sustainable aerospace – and advance new air mobility solutions for zero-emission vertical flight in support of our cities and communities later this decade.”



ITA Airways is the Italian flag carrier airline. It was created in 2021, with sustainability as one of the fundamental pillars of its business plan. The company has shown a keen interest in innovative projects to decarbonise aviation, such as the development of urban air mobility through eVTOLs. ITA Airways recently directly purchased 28 aircraft from the manufacturer, including seven A220s, 11 A320neos and 10 A330neos. The A350 will also join the company’s fleet this summer.



Since 2014, Airbus has been exploring how electric propulsion can help drive the development of new kinds of aerial vehicles. In September 2021, the Company unveiled its fully electric eVTOL prototype, CityAirbus NextGen. Airbus is developing a UAM solution with eVTOLs not only to offer a new mobility service but also as an important step in its quest to reduce emissions in aviation across its product range.

@Airbus @ITAAirways #CityAirbus #UAM #eVTOL","{'label': 'Neutral', 'score': 0.8139492273330688}",neutral,0.8139492273330688,0
Airbus A380 successfully completes flight powered by cooking oil - Fox Weather,"Mon, 04 Apr 2022 07:00:00 GMT",https://news.google.com/rss/articles/CBMiZ2h0dHBzOi8vd3d3LmZveHdlYXRoZXIuY29tL2VhcnRoLXNwYWNlL2FpcmJ1cy1hMzgwLXN1Y2Nlc3NmdWxseS1jb21wbGV0ZXMtZmxpZ2h0LXBvd2VyZWQtYnktY29va2luZy1vaWzSAWtodHRwczovL3d3dy5mb3h3ZWF0aGVyLmNvbS9lYXJ0aC1zcGFjZS9haXJidXMtYTM4MC1zdWNjZXNzZnVsbHktY29tcGxldGVzLWZsaWdodC1wb3dlcmVkLWJ5LWNvb2tpbmctb2lsLmFtcA?oc=5&hl=en-US&gl=US&ceid=US:en,"TOULOUSE, France – Aviation company Airbus announced that the world's largest passenger airplane, the A380, has successfully completed a test flight powered by 100% Sustainable Aviation Fuel.

The double-decker airplane took off from Blagnac Airport in Toulouse on March 25.

HOW TO WATCH FOX WEATHER ON TV

According to Airbus, the test flight lasted about three hours and used one Rolls-Royce Trent 900 engine that was running on 100% SAF.

The SAF was produced in Normandy and was made from Hydroprocessed Esters and Fatty Acids. The fuel was free from aromatics and sulfur and primarily consisted of used cooking oil and other waste fats.

The airline company said a second test flight using the same aircraft took off from Toulouse on March 29 and headed to Nice, where the SAF was tested during the takeoff and landing.

LIGHTNING STRIKES ON AIRPLANES CAN BE SCARY – JUST ASK MILEY CYRUS

""Increasing the use of SAF remains a key pathway to achieving the industry's ambition of net-zero carbon emissions by 2050,"" Airbus said in a statement.

The company claims that using SAF could contribute between 53%-71% of required carbon reductions to meet that goal.

This marks the third successful test flight of an Airbus aircraft flying on 100% SAF over the past year.

HERE’S WHAT CAUSES TURBULENCE AND WHY YOU SHOULDN’T BE AFRAID OF IT

The first was an A350 last March, followed by an A319neo single-aisle airplane in October.

The company said all Airbus airplanes are certified to fly with up to a 50% blend of SAF mixed with kerosene with a goal of achieving certification for 100% SAF by the end of the decade.","{'label': 'Neutral', 'score': 0.9117818474769592}",neutral,0.9117818474769592,0
Airbus Can Meet Production Targets Despite Russian Titanium Constraints - airlineweekly.skift.com,"Tue, 05 Apr 2022 07:00:00 GMT",https://news.google.com/rss/articles/CBMicGh0dHBzOi8vYWlybGluZXdlZWtseS5za2lmdC5jb20vMjAyMi8wNC9haXJidXMtY2FuLW1lZXQtcHJvZHVjdGlvbi10YXJnZXRzLWRlc3BpdGUtcnVzc2lhbi10aXRhbml1bS1jb25zdHJhaW50cy_SAXZodHRwczovL2FpcmxpbmV3ZWVrbHkuc2tpZnQuY29tLzIwMjIvMDQvYWlyYnVzLWNhbi1tZWV0LXByb2R1Y3Rpb24tdGFyZ2V0cy1kZXNwaXRlLXJ1c3NpYW4tdGl0YW5pdW0tY29uc3RyYWludHMvP2FtcD0x?oc=5&hl=en-US&gl=US&ceid=US:en,"Airbus’ plans to aggressively ramp up aircraft production are on track, despite new constraints on the global supply of Russian titanium, a critical metal for aerospace manufacturing.

The European airframer quashed rumors that its A320 and A350 production increases will be delayed by titanium-supply issues. “We continue to assess the impact of the current situation in detail, but we do not see any issue in the short to medium term,” an Airbus spokesperson said. “Regardless, we are accelerating our efforts to secure alternative sources of supply.”

Airbus previously indicated that it sourced as much as half of its titanium needs from Russia. It continues to buy the metal from the country. “Airbus is directly sourcing titanium from Russia as well as from other countries, and indirectly sourcing it from Tier 1 suppliers,” the spokesperson said. “This is done in accordance with all sanctions and applicable export control regulations in place.”

Airbus plans to increase production of its A320 family to 65 aircraft per month by the middle of next year, an aggressive target that analysts and even Air Lease Corp. Executive Chairman Steven Udvar-Hazy have questioned. Last year, analysts pointed to other supply chain problems, not least of which were staffing issues at the airframer’s suppliers.

But CEO Guillaume Faury stood by the company’s targets and said Airbus can deliver 20 percent more aircraft this year compared with last year. “We are ready,” he said in February before the conflict began.

Before the war in Ukraine, Russia provided up to 20 percent of the world’s raw titanium, and VSMPO-AVISMA is the world’s largest producer of the metal for the aerospace industry. Before the conflict, Boeing and VSMPO-AVISMA were in a joint venture to provide part of the U.S. airframer’s titanium requirements. But European, Japanese, and U.S. sanctions have prompted aerospace firms to avoid Russian supplies of the metal in order to comply with broader sanctions. China, Japan, Kazakstan, and the U.S. produce the balance of the world’s supply of titanium.

Earlier this year, Boeing CEO David Calhoun assured investors that the company’s supply of the metal was secure. “As long as the geopolitical situation stays tame, no problem,” he said on January 26. “If it doesn’t, we’re protected for quite a while, but not forever.”

But the company started diversifying its supply in 2014 after Russia annexed the Crimean Peninsula. Boeing accelerated the process after Russia invaded Ukraine on February 24, and has since suspended all titanium purchases from the country.

“Our inventory and diversity of titanium sources provide sufficient supply for airplane production and we will continue to take the right steps to ensure long-term continuity,” a Boeing spokesperson said. “As aerospace is a longer cycle business, we largely have longer-term agreements that bridge short-term supply issues, which give us priority and protection from the fluctuations in the market.”

Embraer sourced much of its titanium from Russia before the war broke out, raising questions about its ability to meet its delivery targets this year. But in a recent filing with the U.S. Securities and Exchange Commission the Brazilian airframer said it had enough supplies for the near term.

“Embraer informs that there is no immediate concern over the availability of titanium in its supply chain, considering its strong current inventory position and the existing contracts for the provision of this material with companies in other countries,” the company said. “Embraer will continue to monitor its supply chain and to seek alternative sources.”","{'label': 'Neutral', 'score': 0.9952267408370972}",neutral,0.9952267408370972,0
Airbus Wins 80-aircraft A320neo Order from BOC Aviation | AIN - Aviation International News,"Mon, 11 Apr 2022 07:00:00 GMT",https://news.google.com/rss/articles/CBMic2h0dHBzOi8vd3d3LmFpbm9ubGluZS5jb20vYXZpYXRpb24tbmV3cy9haXItdHJhbnNwb3J0LzIwMjItMDQtMTEvYWlyYnVzLXdpbnMtODAtYWlyY3JhZnQtYTMyMG5lby1vcmRlci1ib2MtYXZpYXRpb27SAQA?oc=5&hl=en-US&gl=US&ceid=US:en,"Airbus Wins 80-aircraft A320neo Order from BOC Aviation

Singapore-headquartered leasing group BOC Aviation places the largest order in its history with an 80-unit deal for A320neo narrowbody airliners.","{'label': 'Positive', 'score': 0.9980335831642151}",positive,0.9980335831642151,1
Envision the future of air travel - Airbus,"Tue, 26 Apr 2022 07:00:00 GMT",https://news.google.com/rss/articles/CBMiVGh0dHBzOi8vd3d3LmFpcmJ1cy5jb20vZW4vbmV3c3Jvb20vc3Rvcmllcy8yMDIyLTA0LWVudmlzaW9uLXRoZS1mdXR1cmUtb2YtYWlyLXRyYXZlbNIBAA?oc=5&hl=en-US&gl=US&ceid=US:en,"Airbus and HeroX competition seeks novel ideas to explore the travel experience through the Metaverse

Shared prize fund of $30,000 offered for those who propose the most innovative and impactful “Metaverse and the Future of Flight” visions



The future travel experience



Airbus, pioneer of sustainable aerospace for a safe and united world, and HeroX, leading platform and open marketplace crowdsourced solution provider, have joined forces to launch a “Metaverse and the Future of Flight” competition.

The challenge seeks innovative ways to use the metaverse to explore and elevate the passenger experience from departure to destination.

The metaverse is the composition of multiple virtual 3D environments with a focus on social interactions. This allows people to interact socially and economically, often as avatars in cyberspace, which acts as a kind of metaphor for the real world, breaking down physical and/or economic barriers.

The digital world continues to grow in sophistication with tools like augmented reality and virtual reality, providing us with a venue for experimenting and enhancing real-life experiences like travel.



Ready to take up the challenge?



With this in mind, Airbus is looking for out-of-the-box thinkers to envision air travel by leveraging the metaverse’s infinite range of possibilities and potential.

The Challenge is looking for immersive, experiential ways in which a passenger can interact with the metaverse during the travel process.

Up to 5 participants submitting the top ideas will share a total prize pool of $30,000. The competition launches on April 26th and is open to individuals and teams ages 18 or older. Individual competitors and teams may originate from any country, as long as international or Airbus sanctions do not prevent participation.

To go for the challenge, visit www.herox.com/AirbusMetaverse and find out how to get started.

Interested in bringing your pioneering spirit to Airbus, visit our careers section","{'label': 'Neutral', 'score': 0.9945729374885559}",neutral,0.9945729374885559,0
BOC Aviation orders 80 A320neo Family aircraft - Airbus,"Mon, 11 Apr 2022 07:00:00 GMT",https://news.google.com/rss/articles/CBMiaGh0dHBzOi8vd3d3LmFpcmJ1cy5jb20vZW4vbmV3c3Jvb20vcHJlc3MtcmVsZWFzZXMvMjAyMi0wNC1ib2MtYXZpYXRpb24tb3JkZXJzLTgwLWEzMjBuZW8tZmFtaWx5LWFpcmNyYWZ00gEA?oc=5&hl=en-US&gl=US&ceid=US:en,"Toulouse, 11 April 2022 – Global aircraft operating lessor BOC Aviation (HKEx code: 2588) has signed a firm order for 80 A320neo family aircraft comprising 10 A321XLR, 50 A321neo and 20 A320neo. The latest agreement takes BOC Aviation’s total direct orders with Airbus to 453 aircraft from the single aisle A320 Family to the A330 and A350 widebodies.

“We are proud to continue our long-standing relationship with Airbus, with whom we have partnered for more than 26 years,” said Robert Martin, Managing Director and Chief Executive Officer, BOC Aviation. “This is the largest single order that we have ever placed and it will bring our total Airbus aircraft purchased since inception to 546. It underscores our continued confidence in the A320neo family for its reliability and operational efficiency and reflects the popularity of the aircraft amongst our airline customers. We look forward to continuously providing our customers with such fuel-efficient and technologically advanced aircraft solutions.”

“Airbus thanks BOC Aviation for its unwavering trust and endorsement of the A320neo Family with its single largest order ever placed,” said Christian Scherer Airbus Chief Commercial Officer and Head of Airbus International. “This significant long term order for 80 additional aircraft is a great testimony of the sustained value of our Single Aisle products by one of the world’s leading lessors, BOC Aviation. We salute its vision and foresight in securing future delivery positions of these most desirable assets in the single aisle segment now and in the longer run.”

The A320neo Family incorporates new generation engines and Sharklets, which together deliver at least 20 percent fuel and CO2 savings, as well as a 50 percent noise reduction. The A321XLR version provides a further range extension to 4,700nm. This gives the A321XLR a flight time of up to 11 hours, with passengers benefitting throughout the trip from Airbus’ award-winning Airspace interior, which brings the latest cabin technology and design to the A320 Family.

At the end of March 2022 the A320neo Family had totalled more than 7,900 orders from around 130 customers. Since its Entry into Service six years ago, Airbus has delivered over 2,100 A320neo Family aircraft contributing to 15 million tons of CO2 saving.

@Airbus #A321neo #A321XLR #A320neo","{'label': 'Positive', 'score': 0.9999812841415405}",positive,0.9999812841415405,1
"Airbus, Kawasaki Heavy Industries partner to study use of hydrogen in Japan - Airbus","Tue, 12 Apr 2022 07:00:00 GMT",https://news.google.com/rss/articles/CBMie2h0dHBzOi8vd3d3LmFpcmJ1cy5jb20vZW4vbmV3c3Jvb20vcHJlc3MtcmVsZWFzZXMvMjAyMi0wNC1haXJidXMta2F3YXNha2ktaGVhdnktaW5kdXN0cmllcy1wYXJ0bmVyLXRvLXN0dWR5LXVzZS1vZi1oeWRyb2dlbtIBAA?oc=5&hl=en-US&gl=US&ceid=US:en,"Tokyo, 12 April 2022 – Airbus and Kawasaki Heavy Industries (Kawasaki) have signed a Memorandum of Understanding (MoU) to work together on the preparation of the hydrogen fueled ecosystem. The scope will include different aspects of the hydrogen supply chain, from the production of hydrogen to its delivery to airports and transfer on-board aircraft.

The MoU was signed at a ceremony in Tokyo, attended by Stéphane Ginoux, Head of North Asia region for Airbus and President of Airbus Japan, and Motohiko Nishimura, Executive Officer and Deputy General Manager of Hydrogen Strategy Division, Kawasaki.

Through this initiative, Airbus and Kawasaki will jointly prepare a roadmap to address challenges and define an advocacy plan on hydrogen aviation needs. Both parties will also pioneer the deployment of a hydrogen infrastructure for aviation with a particular focus on the development of Airport Hydrogen Hubs.

“We are very pleased to work with Japan's leading hydrogen supplier Kawasaki. This partnership will obviously accelerate and promote efforts by the Japanese government to achieve a carbon-neutral, decarbonised society from overall aircraft operations in 2050,” said Stéphane Ginoux. “We strongly believe that the use of hydrogen - both in synthetic fuels and as a primary power source for commercial aircraft - has the potential to significantly reduce aviation's climate impact.”

“Hydrogen is a clean energy that emits no CO2 when used and is suitable as sustainable fuel,” said Motohiko Nishikura. “We have specialised in the development of infrastructure for liquefaction, transportation, storage and transport to receiving terminals, contributing to the construction and expansion of supply chains for the hydrogen market. We are confident that our technology will connect the hydrogen production and consumption areas, creating a new road called Hydrogen Road.”

Each partner will leverage their complementary expertise to help define the potential opportunities that hydrogen offers, and support the decarbonisation of the aviation industry. Airbus will provide aircraft characteristics, fleet energy usage, and insight on hydrogen-powered aircraft for ground operations. Kawasaki will provide technology drivers on the various elements of the supply chain while building infrastructure deployment scenarios for the supply of targeted airports.","{'label': 'Neutral', 'score': 0.9859743714332581}",neutral,0.9859743714332581,0
The making of a hero - Airbus,"Wed, 27 Apr 2022 07:00:00 GMT",https://news.google.com/rss/articles/CBMiR2h0dHBzOi8vd3d3LmFpcmJ1cy5jb20vZW4vbmV3c3Jvb20vc3Rvcmllcy8yMDIyLTA0LXRoZS1tYWtpbmctb2YtYS1oZXJv0gEA?oc=5&hl=en-US&gl=US&ceid=US:en,"An auction of A380 parts will be held in October 2022 in Toulouse and online. It will bring much emotion to enthusiasts as well as giving them the opportunity to acquire emblematic elements of the jumbo sized Airbus aircraft.

It's a safe bet that amateurs will be thrilled when Maître Marc Labarbe, the auctioneer chosen by Airbus to lead the sale, will auction off an unique item. An element which, without belonging to the aircraft, is an integral part of the A380 legend.

The auctioneer reported: “Someone will have the chance to acquire one of the famous orange suits worn by Claude Lelaie, one of the two pilots who flew with Jacques Rosay during the flight test campaign of the first A380”.

This iconic outfit recalls the extraordinary human adventure of the aircraft's flight test campaign. “From the very first flight, we were able to see that the plane was well conceived and that it had tremendous potential,” said Claude Lelaie.

A380 first flight - 27th April 2005 show more show less First flight A380

Although the test programme was carried out smoothly and efficiently, it still reserved a few surprises which were not always very pleasant for the crew. ""It's the very nature of testing!"" said one pilot. “Sometimes things don't go as planned, even on the A380. During the first flight, the landing gear failed to lock. We had to adapt and switch to plan B. During another flight, the temperature dropped to zero degrees in the cabin, enough to cool the engineers who had forgotten their little woollen jackets,” the pilot recalls, good humouredly.

Claude Lelaie agreed to donate his jumpsuit for two reasons.

Firstly, I wanted to make this gesture for the Airbus Foundation, which works in the humanitarian field for the benefit of communities and for the young. This resonates with the educational approach that I carry out with schools, with my books on flight testing in the aeronautical profession.

Secondly, it is my way of paying tribute to all the women and men who have made this fantastic program possible, and in particular the Airbus Flight Test team, which I had the honour of directing and who do a remarkable job.





Claude Lelaie's suit will be offered with nearly 500 A380 parts, the vast majority from the cabin of the A380 MSN013*. The items have been selected for their technological and aesthetic interest and include lamps, a bar, vanes, a mini stick, a staircase, a ramp, trolleys, seats, and even the cockpit's emergency rope.

It is now up to fans to prepare to treat themselves in October to a real piece of history, as well as a very unique piece of aviation material!","{'label': 'Neutral', 'score': 0.9884864091873169}",neutral,0.9884864091873169,0
