Titre,Date de publication,URL,Contenu,sentiment_finbert,sentiment_label,sentiment_score,sentiment_numerique
Review: SWISS A220 Business Class (GVA-FRA) - One Mile at a Time,"Sun, 17 Apr 2022 07:00:00 GMT",https://news.google.com/rss/articles/CBMiPWh0dHBzOi8vb25lbWlsZWF0YXRpbWUuY29tL3Jldmlld3Mvc3dpc3MtYTIyMC1idXNpbmVzcy1jbGFzcy_SAQA?oc=5&hl=en-US&gl=US&ceid=US:en,"In the interest of full disclosure, OMAAT earns a referral bonus for anyone that’s approved through some of the below links. These are the best publicly available offers (terms apply) that we have found for each product or service. Opinions expressed here are the author's alone, not those of the bank, credit card issuer, airline, hotel chain, or product manufacturer/service provider, and have not been reviewed, approved or otherwise endorsed by any of these entities. Please check out our advertiser policy for further details about our partners, and thanks for your support!

To kick off our return journey to the United States, we flew SWISS business class from Geneva to Frankfurt on the Airbus A220 (one of my favorite planes). Let’s take a look at what that experience was like.

How I booked our SWISS business class tickets

I booked our flight from Geneva to Frankfurt as a separate ticket from our Singapore Airlines flight from Frankfurt to New York the following day. Specifically, I booked the following in business class for 15,000 Aeroplan points plus $64.30 per person in taxes & fees:

04/06 LX1086 Geneva to Frankfurt departing 6:45PM arriving 7:55PM

Admittedly this is a short flight, so some might not find it worthwhile to redeem for business class (I booked business class largely because I wanted to review it). In this case, Aeroplan would have charged 7,500 points for economy class, so the price was double.

Aeroplan points are easy to come by, as the program partners with American Express Membership Rewards, Capital One, and Chase Ultimate Rewards. On top of that, in the United States, there’s the new Aeroplan® Credit Card (review), which is pretty lucrative.

SWISS business class boarding

In the last installment I reviewed the SWISS Senator Lounge Geneva. Our flight was departing from gate D25, which is about as far from the security checkpoint as you can get.

Terminal at Geneva Airport (GVA)

Terminal at Geneva Airport (GVA)

This is a unique setup, as it’s essentially a circular terminal without jet bridges. Rather planes are parked outside with stairs, and you can walk right up to them. It’s kind of a cool view with the floor-to-ceiling windows, if you ask me.

Terminal at Geneva Airport (GVA)

Boarding for our 6:45PM flight started at 6:20PM, with business class passengers being invited to board first. It was just a short walk from the terminal to the aircraft’s stairs.

SWISS A220-100 Geneva Airport (GVA)

The A220 is such a gorgeous plane, and I loved the opportunity to walk right up to it.

SWISS A220-100 Geneva Airport (GVA)

SWISS A220-100 Geneva Airport (GVA)

SWISS A220-100 Geneva Airport (GVA)

SWISS A220-100 Geneva Airport (GVA)

SWISS A220 business class cabin & seats

We were flying on a SWISS Airbus A220-100, which is the smaller of the two A220 variants. The SWISS A220 features 125 seats, spread across 25 rows in a 2-3 configuration. Not only does the A220 cabin feel incredibly modern and spacious, but you’ve gotta love the 2-3 layout from a passenger comfort standpoint, since there’s only one middle seat per row.

As is standard on intra-Europe flights, economy and business class seats are identical, so the difference just comes down to seat blocking. On this particular flight, the first eight rows of the plane were business class.

SWISS Airbus A220 business class cabin

SWISS Airbus A220 economy class cabin

I assigned us seats behind one another on the left side. Since intra-Europe business class ordinarily has a blocked middle seat, this works out particularly well on the A220, as you get the set of two seats to yourself. So I had seats 7A & 7C, while Ford had seats 6A & 6C.

SWISS A220 business class seats

On the right side of the plane there are three seats, so in business class the center seat is blocked.

SWISS A220 business class seats

The A220 just feels so sleek across the board, including the seat backs.

SWISS A220 business class seats

While the A220 is somewhere between your typical regional jet and your typical mainline jet, the overhead bins are a good size, big enough for a standard carry-on.

SWISS A220 overhead bins

The seatback had a literature pocket and two pouches, which could be used for a water bottle, a pair of glasses, a smartphone, etc. (though on my seat, one of the pouches was missing). Then there’s the tray table, which folds out from the seatback.

SWISS A220 business class seats

SWISS A220 business class tray table

Another nice feature of the Airbus A220 is the windows, which are quite large, bigger than you’d find on a standard jet.

SWISS Airbus A220 windows

I also love the overhead consoles on the A220, which have reading lights, individual air nozzles, and even small screens that show the safety video and a flight map.

SWISS Airbus A220 overhead console

Now, while SWISS’ Airbus A220 cabins are modern, there are two major downsides:

SWISS doesn’t have power ports on Airbus A220s

SWISS doesn’t have Wi-Fi on Airbus A220s

Both of these are standard amenities on newly delivered jets nowadays. In fairness, this isn’t an issue on a 55 minute flight from Geneva to Frankfurt. I’d consider this more of an issue on a longer flight, though.

This flight was mostly full in both business class and economy class. Of the 24 business class seats, only three were empty.

SWISS A220 business class cabin

Waiting at each seat upon boarding was a bottle of water plus a refreshing towel.

SWISS A220 business class water bottle & refreshing towel

There was also a lavatory at the front of the cabin, which was spacious and nicely appointed (and so much nicer than the new lavatories you’ll find on many 737s).

SWISS Airbus A220 lavatory

SWISS departure from Geneva

At 6:35PM boarding was complete, and at that point, the captain made his welcome aboard announcement, informing us of our flight time of 55 minutes. A couple observations:

All announcements were made in French, then English, and then German

Why do PAs on the A220 consistently sound like someone is talking in your ear? They’re so clear and crisp yet loud

At 6:40PM the main cabin door was closed, and at that point the cabin manager made her welcome aboard announcement. At 6:45PM we started our engines and began our taxi (A220 engines are so loud and whiny when starting up). Due to how the stands at this part of the terminal are positioned, there’s no need to push back, but rather you can just taxi straight ahead.

Departing gate at Geneva Airport (GVA)

We taxied fast, but nonetheless it took quite some time to get to the runway.

Taxiing Geneva Airport (GVA)

Taxiing Geneva Airport (GVA)

About 10 minutes later (at 6:55PM), we were short of runway 22, where we were cleared for takeoff.

Taxiing Geneva Airport (GVA)

Taking off from Geneva Airport (GVA)

View after takeoff from Geneva Airport (GVA)

We had beautiful views of Geneva on our climb out…

View after takeoff from Geneva Airport (GVA)

We hit some pretty serious chop after departure, given the thick clouds combined with the mountains. In particular, we hit one pretty big air pocket that made some passengers gasp.

View after takeoff from Geneva Airport (GVA)

View after takeoff from Geneva Airport (GVA)

Fortunately it was a totally different story above the clouds, and about 10 minutes after takeoff the ride smoothed out, at which point the seatbelt sign was turned off.

View after takeoff from Geneva Airport (GVA)

Once the sign was off, the crew first closed the curtains between cabins, and a few moments later, service began.

SWISS Airbus A220 business class cabin

SWISS business class snack service

About 20 minutes after takeoff a light snack was served. There were no choices, but rather each passenger was offered a tray with two finger sandwiches (one had pork and cheese, while the other had beets… I think?), plus a dessert with a berry compote and crumble. It wasn’t much of a snack, especially since I don’t eat pork.

SWISS business class snack service

A separate cart was then brought out with drinks. I had a coffee and a sparkling water.

SWISS business class drink service

After that, chocolates were distributed, as is standard on SWISS.

SWISS business class chocolate

The crew was friendly and efficient, and was quick to clear service items as people finished up.

SWISS arrival in Frankfurt

20 minutes before landing, the first officer informed us that we were starting our descent to Frankfurt and should be landing at 7:50PM. It was a beautiful evening above the clouds, and it was nice to still see some sunshine.

View approaching Frankfurt Airport (FRA)

Just as on departure, it was a different story under a layer of clouds, though. Not only was the sun setting, but it wasn’t particularly clear evening either.

View approaching Frankfurt Airport (FRA)

View approaching Frankfurt Airport (FRA)

View approaching Frankfurt Airport (FRA)

We ended up touching down in Frankfurt at 7:50PM.

Landing at Frankfurt Airport (FRA)

From there we had a literally one minute taxi to our remote stand, which might be a new record for me.

Taxiing at Frankfurt Airport (FRA)

While I usually am not a fan of remote stands, I was impressed that there was a separate bus for business class passengers, so there was no long wait for the bus to fill up, and for that matter people weren’t crammed in the bus either.

Arrival stand at Frankfurt Airport (FRA)

SWISS Airbus A220 at Frankfurt Airport (FRA)

A few minutes later we found ourselves in the terminal. We just had to wait for our checked bag, which showed up within about 20 minutes.

Bottom line

The Airbus A220 is a joy to fly, as it’s such a comfortable and spacious jet. In particular, you’ve gotta love the 2-3 layout, since in intra-Europe business class it means you can have both an aisle and window seat to yourself.

This flight was punctual, and the crew was friendly. My only real criticism is that SWISS hasn’t really invested in the passenger experience of these planes beyond the features of the A220 as such. There are no power ports and no Wi-Fi. That’s not at all an issue for such a short flight, but on a longer flight it would be a different story.

If you’ve flown SWISS’ A220, what was your experience like?","{'label': 'Neutral', 'score': 0.9999860525131226}",neutral,0.9999860525131226,0
airBaltic Takes Delivery of 34th Airbus A220neo - Airways Magazine,"Mon, 25 Apr 2022 07:00:00 GMT",https://news.google.com/rss/articles/CBMiMmh0dHBzOi8vYWlyd2F5c21hZy5jb20vYWlyYmFsdGljLTM0dGgtYWlyYnVzLWEyMjAv0gEA?oc=5&hl=en-US&gl=US&ceid=US:en,"airBaltic Takes Delivery of 34th Airbus A220neo

DALLAS – Latvia’s national carrier, airBaltic (BT), has received its 34th A220-300. BT is currently the world’s largest operator of the type.

YL-ABH is the second of eight A220-300 planes scheduled for delivery to BT in 2022. The airline anticipates having 50 A220s by 2024. Furthermore, the carrier has the option to purchase an additional 30 A220 jets.

Currently, the Airbus A220 is the greenest commercial aircraft in the world, as it is the first aircraft to have a transparent declaration of the life-cycle environmental impact, helping to reduce CO 2 and NOX emissions by 20% and 50% respectively.

airBaltic YL-CSA Airbus A220-300. Photo: Tony Bordelais/Airways

Wet-leasing Part of Its A220 Fleet

After being forced to halt operations in Ukraine and Russia due to the ongoing war, BT announced on April 14 that it would wet-lease 11 of its A220s to other airlines for the summer of 2022.

The Latvian airline has already inked contracts for nine A220s to be leased to Scandinavian Airline Systems (SAS) and Eurowings on an ACMI basis. BT is also in the midst of signing wet-lease agreements for two other aircraft that have been released from Ukrainian and Russian destinations.

Featured image: airBaltic A220-300 YL-ABH. Photo: airBaltic via Twitter","{'label': 'Neutral', 'score': 0.9999939203262329}",neutral,0.9999939203262329,0
Qatar suffers setback in plane dispute with Airbus - Al Jazeera English,"Tue, 26 Apr 2022 07:00:00 GMT",https://news.google.com/rss/articles/CBMiXmh0dHBzOi8vd3d3LmFsamF6ZWVyYS5jb20vbmV3cy8yMDIyLzQvMjYvcWF0YXItc3VmZmVycy1zZXRiYWNrLWluLWFpcnBsYW5lLWRpc3B1dGUtd2l0aC1haXJidXPSAWJodHRwczovL3d3dy5hbGphemVlcmEuY29tL2FtcC9uZXdzLzIwMjIvNC8yNi9xYXRhci1zdWZmZXJzLXNldGJhY2staW4tYWlycGxhbmUtZGlzcHV0ZS13aXRoLWFpcmJ1cw?oc=5&hl=en-US&gl=US&ceid=US:en,"Judge rejects Qatar’s argument that it could not obtain similar aircraft to make up the shortfall in A321neo supply.

A British judge denied a request by Qatar Airways to force Airbus to keep building A321neo jets for the Gulf airline, in a setback to the carrier amid a wider aeroplane dispute that has triggered a major falling out in United Kingdom courts.

Tuesday’s decision means the world’s largest planemaker is free to market the in-demand jets to other airlines while the two sides pursue a separate dispute over the safety of larger A350 jets.

Airbus revoked the A321neo deal in January in retaliation for Qatar’s refusal to take A350s in their core dispute over damage to the painted protective layer of the larger jets.

The judge rejected Qatar’s argument that it could not obtain similar aircraft to make up the shortfall in A321neo supply, for example by turning to the leasing market or by deploying 737 MAX jets that it has provisionally ordered from Boeing.

The decision does not rule out Qatar reinstating the contract at a fuller trial, but means the cost of filling any gap between now and then can only be addressed by financial damages rather than forcing Airbus to build its customised jets.

A hearing in London’s High Court was expected to turn later on Tuesday to the timing of what amounts to a widely watched corporate divorce trial, despite what some sources described as a glimmer of hope of an eventual settlement.

The knock-on decision to cancel the A321neo deal alarmed some airlines, with the head of the International Air Transport Association describing it as a “worrying” development in a corner of the market where Airbus enjoys the bulk of new orders.

The head of Dubai’s Emirates airline has said he is “not unsympathetic” to its main Gulf rival over the A321neo fallout.

Grounded A350s

Airbus says the two contracts are connected by a “cross-default” clause that allows it to pull the plug on one deal when an airline refuses to honour the other.

It has accused Qatar Airways, the A350’s biggest customer, of airing invalid safety concerns to avoid taking jets at a time of weak demand, and to activate a $1bn compensation claim.

Qatar says it was right to stop taking A350 deliveries over what it describes as genuine safety concerns by Doha’s regulator over gaps or corrosion in a sublayer of lightning protection left exposed by cratered paint on more than 20 grounded A350s. It says the cross-default clause does not in any case apply.

Airline officials worry the A321neo case may set a precedent allowing disputes to ricochet from one contract to another, tightening the grip of plane giants Airbus and Boeing.

“People will look at this and take extra care to resist such cross-default clauses,” the head of a large airline fleet said.

Backed by European regulators, Airbus denies any A350 safety flaws, though it has acknowledged that paint peeling is a feature of modern carbon jets, requiring repainting more often.

Qatar Airways says the problem of decaying paint, and the resulting exposure of anti-lightning mesh surrounding the carbon fuselage, results from a defect in the plane’s design.

A Reuters investigation in November revealed the problem affected other carriers though apart from Qatar none has taken planes out of service, except for surface repairs.

The court battle has punctured the secrecy surrounding more than a decade of aircraft negotiations and taken the lid off closely guarded planning methods inside the global jet industry.

Multiple industry sources say it is in neither side’s interest to spark a full-scale trial, producing a flood of further disclosures and testing relations between France and Qatar at a time when Europe urgently seeks new gas supplies.

While neither side has closed the door to a negotiated settlement, Tuesday’s lawyer-packed hearing reflected the gloves-off nature of the row, as one of aviation’s pivotal business relationships unravels in London’s High Court.

The airline was ordered to pay most of Airbus’s costs on the A321neo part of the case.","{'label': 'Neutral', 'score': 0.8953308463096619}",neutral,0.8953308463096619,0
Record orders for Airbus Corporate Helicopters in 2021 - Vertical Magazine,"Thu, 28 Apr 2022 07:00:00 GMT",https://news.google.com/rss/articles/CBMiVGh0dHBzOi8vdmVydGljYWxtYWcuY29tL25ld3MvcmVjb3JkLW9yZGVycy1mb3ItYWlyYnVzLWNvcnBvcmF0ZS1oZWxpY29wdGVycy1pbi0yMDIxL9IBAA?oc=5&hl=en-US&gl=US&ceid=US:en,"Airbus Corporate Helicopters (ACH) recorded its best-ever sales figures last year, as it received 103 orders — representing a 50-percent increase over its previous best year.

The ACH130 Aston Martin Edition features a range of interior and exterior designs created by Aston Martin. Adrien Daste/Airbus Photo

The entity — Airbus’s dedicated private and business aviation (PBA) helicopter brand — revealed the figures as it prepares to mark its fifth anniversary at EBACE, having been established at the event in 2017.

Its launch mirrored that of sister fixed-wing brand Airbus Corporate Jets (ACJ) in 2012.

“What we decided to do five years ago, based on the experience also of ACJ, was to say ‘OK, we want to approach these specific clients of Airbus in a different way,’ ” said Frederic Lemos, head of ACH, at a pre-EBACE briefing.

“Eighty percent of the PBA clients are private individuals, so they don’t have the same expectations [as business customers],” he continued. “They don’t have the same understanding, sometimes, of aviation; they are very demanding; they want to customize. They are not just buying an aircraft, they are buying an asset for their lifestyle, an extension of their lifestyle. What is the helicopter is going to bring me? How easy is it to deal with Airbus? . . . . It is everything that we are bringing behind the scenes to make the experience a very nice experience for our customers and delivering to the promise. And I think, at the end, yes, it’s paying off — it’s paying off in the numbers.”

In its first year, ACH received orders for 53 aircraft, with the following years bringing 68, 66, and 62 orders, respectively.

Lemos said the growth in sales in 2021 was part of an overall market rebound, but also a result of “planting seeds” and “delivering on our commitments.” He then highlighted the importance of the brand’s success in the intermediate single market segment. There, it recorded 68 orders in 2021: 30 ACH125s and 38 ACH130s.

“In this specific market segment, we are very strong, because not only do we have two products, but we have two very strong products,” he said. “We have a lot of owner-pilots in that category of segment, who find themselves more happy flying a 125/130 with all their friends looking in the same direction [with theater-style seating]. The aircraft is very friendly; it’s very fun to operate. The ecosystem [to support and operate it] is everywhere in the world, more or less.”

In January 2020, ACH launched the “Aston Martin Edition” for the ACH130 — a special edition of the type, equipped with a range of four interior and exterior designs created by Aston Martin. ACH has already sold 14 of these, and delivered six. An ACH130 Aston Martin Edition will be the centerpiece of ACH’s display at EBACE, where it will be joined by an Aston Martin car.

The 2021 sales also included nine ACH135s and 13 ACH145s. Lemos highlighted the successful entry into service of the five-bladed version of the ACH145, which will be available for a demonstration flight for prospective customers at EBACE.

Like the ACH130, the ACH145 is available in two versions: the standard “ACH Line” (a fully customizeable catalog offering); and the ACH145 Mercedes Benz Edition. Lemos said the latter will be receiving a “facelift” that will be available to market in 2023.

The ACH145 Mercedes Benz Style Edition. Airbus Photo

Finally, ACH sold 11 of its new medium twin ACH160s, and two ACH175s. Lemos said “several” ACH160s will be delivered this year in different countries around the world. While the type has been certified by the European regulator since July 2020, it is still awaiting approval from the U.S. Federal Aviation Administration. It hopes to have this in hand and deliver the first U.S. H160 this year.

In terms of geographical spread, ACH’s market remains successful in its traditionally strong areas: Europe, Brazil and the U.S. The three regions provide 80 percent of ACH’s orders.

“What you can see is when the ecosystem is favoring helicopters, then helicopters are flourishing; and where there is the wealth, but the ecosystem is not favoring helicopters, then the market is not [growing] as much as the potential shows,” said Lemos.

A prime example of the latter is China, which remains a slow-growing market for the VIP brand.

“The wealth is there, there’s numbers of prospects and clients, the country is large, interconnections will be much easier with a helicopter, but . . . helicopters are not flourishing,” said Lemos. “Aerospace is not free, and showing wealth is not something that you can easily do.”

Despite the positivity from 2021’s figures, Lemos said a couple of factors were likely to impact this year’s numbers. Firstly, the war in Ukraine and the resulting sanctions on Russia have cut a portion of ACH’s business for the foreseeable future.

“Even if it is only a little portion of our market in Europe, still this little portion will not be there,” he said. “I’m confident that this portion overall will grow, so it compensates for the fact that there is no more Russian market out there and no more Russian clients, either.”

Finally, lead times have increased on several platforms, potentially cooling the market a little.

“When you have slots immediately available, the market goes quite fast,” said Lemos, “so it could be a limiting factor to globally have lead times that are slightly longer than what we had in 2020.”","{'label': 'Positive', 'score': 0.9992427825927734}",positive,0.9992427825927734,1
