Titre,Date de publication,URL,Contenu
Wing cracks in A380 superjumbos that sparked global recall blamed on British engineering firm - Daily Mail,"Fri, 02 Mar 2012 08:00:00 GMT",https://news.google.com/rss/articles/CBMiiAFodHRwczovL3d3dy5kYWlseW1haWwuY28udWsvbmV3cy9hcnRpY2xlLTIxMDkxNTAvV2luZy1jcmFja3MtQTM4MC1zdXBlcmp1bWJvcy1zcGFya2VkLWdsb2JhbC1yZWNhbGwtYmxhbWVkLUJyaXRpc2gtZW5naW5lZXJpbmctZmlybS5odG1s0gGMAWh0dHBzOi8vd3d3LmRhaWx5bWFpbC5jby51ay9uZXdzL2FydGljbGUtMjEwOTE1MC9hbXAvV2luZy1jcmFja3MtQTM4MC1zdXBlcmp1bWJvcy1zcGFya2VkLWdsb2JhbC1yZWNhbGwtYmxhbWVkLUJyaXRpc2gtZW5naW5lZXJpbmctZmlybS5odG1s?oc=5&hl=en-US&gl=US&ceid=US:en,"Wing cracks in £250million A380 superjumbos that grounded entire fleet blamed on British engineering



All 69 A380s in service require overhaul to wings to fix faulty part

Airbus insists no threat to safety posed by cracks in UK-built and designed wings



A fault on the new A380 superjumbo which caused the grounding of every one of the jets has been blamed on British engineering.

Airbus has now traced the cause of small cracks developing on the wings of some of the £250million double-decker A380s to a small component engineered in its design centre in Filton, Bristol, it is understood.

The manufacturer has been forced to order a global reacall fix for the offending aluminium brackets which hold the wing’s skin to the structure. It will affect the entire fleet of 69 planes currently flying.

Discovery: Qantas discovered the wing cracks in the A380 after the compnay ordered a complete aircraft inspection following an engine blowout

The Airbus A380 is a superjumbo that took its first flight on April 2005. There are a total of 115 A380s in operation as of November 2013. It is a double decker jet with a wingspan of 79.75 metres

The news is a major blow to British industry.



The wings are the only part of the cutting-edge A380e which are built in the UK. Airbus employs 9,500 people in its Filton design centre and manufacting complex in Broughton, Wales.



The wings are then taken by sea to be assembled in Toulouse from parts built across Europe.

It is feared the issue could cost Airbus more than £80million in compensation.

A senior industry expert told The Times: ‘The issue is around the type of aluminum being used and the fitting which, as a result of the assembly, creates the crack’, with a source close to the problem adding, ‘It is a design and process engineering failure’.

The minor cracks - no more than two centimetres long - were discovered after Qantas ordered a fleet-wide inspection following the explosion of a Rolls-Royce engine during a flight, last year.

Airbus has insisted there is no threat to safety posed by the flaw and safety agencies on both sides of the Atlantic have given the planes the all clear to continue flights.

But Airbus is bringing in the aircraft for the fix after about 1,300 flights when the enormous stress of thousands of hours of airtime start to exacerbate the problem.

Scrutiny: Airbus' new A380 superjumbo has come under fire again, after Singapore Airlines had to shut down an engine and return a flight to Singapore yesterday

First class travel: Inside the A380's first class cabins. It is the latest safety incident to hit the world's biggest passenger plane, which cost a staggering £250million each

Stretching out: There are just fourteen berths in the first class section of each A380. The plane can seat up to 853 passengers

BEHEMOTH OF THE SKIES Wingspan: 261ft 8in

Length: 239ft 4in

Height: 79ft 7in

Maximum capacity: 853 *

Cost: £250million

Maximum speed: 647mph

Maximum weight: 560 tonnes

Fuel capacity: 68,188 gallons

Fuel capacity: 0.145 mpg

Range: 9,200 miles

Internal wiring: 300 miles

* If all seats are in economy class configuration

An Airbus spokesman told MailOnline: 'We are not commenting on individual sites and areas.



'Everyone in the company is absolutely focussed on resolving the issue.



'We are all one Airbus and the issue involves many parts of our global organisation.



'The issue is related to the material being used combined with the way parts are assembled on that specific area of the aircraft.'

The A380 made by Airbus, a unit of European Aeronautic Defence & Space Co.,was hailed as the next generation of planes which would save the longhaul flight industry.

It was designed to carry around 800 passengers more efficiently a cheaper than any aircraft ever before.

Industry experts say it is not unusual for new planes to develop unforeseen faults in the first few years of flight. These are normally quickly identified and ironed out.

The A380 aircraft are in use by Qantas, Singapore Airlines, Emirates, Air France, Lufthansa, Korean Airlines and China Southern.

The planes have been in service for five years. In total, 238 of the aircraft have been ordered by 17 airlines worldwide.

British Airways is due to take delivery of 12 A380s next year, while the first of Virgin’s eight superjumbos will arrive in 2015.

Singapore Airlines, one of the carriers that operates A380s in and out of Heathrow airport, was the first airline to take delivery of a superjumbo, with the debut passenger flight taking place in October 2007."
The best seats in Cathay Pacific premium economy (Airbus A330) - Executive Traveller,"Fri, 09 Mar 2012 08:00:00 GMT",https://news.google.com/rss/articles/CBMiX2h0dHBzOi8vd3d3LmV4ZWN1dGl2ZXRyYXZlbGxlci5jb20vdGhlLWJlc3Qtc2VhdHMtaW4tY2F0aGF5LXBhY2lmaWMtcHJlbWl1bS1lY29ub215LWFpcmJ1cy1hMzMw0gEA?oc=5&hl=en-US&gl=US&ceid=US:en,"Cathay Pacific’s all-new premium economy seats strike a near-perfect balance between economy and business class.

Read our review to find our why, and then use this guide to choosing the very best seats for your journey.

The plane

Cathay Pacific is rolling out premium economy on all new Airbus A330-300 and Boeing 777-300ER aircraft, as well as retrofitting its existing fleet. All of Cathay's flights between Australia and Hong Kong take place on an Airbus A330.

Sydney is the first to see CX premium economy, on the daily CX100/101 Hong Kong service.

Melbourne and Adelaide will get the new premium economy seats from August, with Brisbane and Perth starting in October.

Cathay says that by December 2012, roughly three-quarter of all Australian flights will have the new seats on daily flights.

The premium economy cabin

Cathay Pacific’s premium economy class is sandwiched between business class and economy, from rows 30 through 33.

All four rows have seats in a 2-3-2 layout – the seat lettering is AB-DEG-HK (the photo above shows the 2-4-2 layout of Cathay's Boeing 777).

These premium economy seats can be booked for travel from April 1st 2012, with the price averaging about 50% above full economy fares.

However, through to March 30th, free premium economy upgrades will be offered to 'high-value frequent flyers’ from Cathay's Marco Polo program and oneworld partner airlines (including Qantas Frequent Flyer Platinum and Gold members) who happen to be travelling in economy on CX100 or CX101.

The best seats on the plane

Row 30: The front row once again comes up trumps for business travellers.

With around one metre of sheer legroom from the edge of the seat to the bulkhead wall, plus a built-in footrest, you won’t go wrong with seat in row 30 – even the middle seat 30E is bearable.

The only downside to this row is the location of bassinets at 30AB and 30HK.

But choosing a more rearward seat won’t make much different to the noise level of a screaming infant because the cabin is so small.

Rows 31 to 33 are much of a muchness, except that the closer you are to the rear of the cabin the closer you get to the bassinet positions at the start of economy.

If you prefer a window seat for the view then you’ll want 30A, 30K, 33A or 33K. Each of these boasts a window almost perfectly lined up with the seat: the others have their windows offset, so some craning of the neck is required.

The worst seats on the plane

Any of the ‘E’ seats: the centre seats in the middle block of three – is going to rob you of easy access to the aisle.

The least worst is 30E, in the frot row, because with such copious legroom you can easily step around your seatmates."
S. Korean firm wins $1.2 billion order from Airbus - SKNVibes.com,"Tue, 20 Mar 2012 07:00:00 GMT",https://news.google.com/rss/articles/CBMiMWh0dHBzOi8vbS5za252aWJlcy5jb20vbmV3cy9uZXdzZGV0YWlscy5jZm0vNTUxODXSAQA?oc=5&hl=en-US&gl=US&ceid=US:en,"(Seoul, KOR) - South Korea's Korea Aerospace Industries (KAI) said Tuesday it has won a $1.2 billion deal to produce wing parts for European aviation giant Airbus.

Under the agreement signed in France, KAI said in a statement it will exclusively produce wing bottom panels for the A320 passenger aircraft from 2014 to 2025.

KAI will supply the components for 500 A320s to be built each year, the company said, adding the deal may later be extended to 2030 at which point it will become worth more than $1.7 billion.

KAI, based in the southwestern city of Sacheon, has previously won orders to produce wing parts for the European firm's A350 and Boeing's B787 as well as for the A320.

The plan by Toulouse-based Airbus to shift some of its production from Wales to South Korea, first announced in January, drew fire from British unions which said the move would weaken Britain's aerospace industry.

Airbus said about 200 of the British workers affected by the shift would be retrained and redeployed."
US wants WTO to force end to EU's Airbus subsidies - SKNVibes.com,"Fri, 30 Mar 2012 07:00:00 GMT",https://news.google.com/rss/articles/CBMiMGh0dHA6Ly9tLnNrbnZpYmVzLmNvbS9uZXdzL25ld3NkZXRhaWxzLmNmbS81NTcwONIBAA?oc=5&hl=en-US&gl=US&ceid=US:en,"(Washington, USA) - The United States announced Friday it was asking the World Trade Organization to create a compliance panel to press the European Union to end subsidies to aircraft maker Airbus.

""In December 2011, the EU claimed to have removed the WTO inconsistencies, but provided no evidence to support its claims. However, the EU has not removed its WTO-inconsistent subsidies and has even provided new ones,"" the US trade representative's office said in a statement.

Ron Kirk, the US trade representative, said the EU's aircraft subsidies had cost American aerospace companies tens of billions of dollars in lost revenue, and workers their jobs.

""By taking this action today, we are reiterating the Obama administration's commitment to ensuring that every one of our trading partners plays by the rules, and that American companies can compete on a level playing field,"" Kirk said in the statement.

The US asked for a meeting of the WTO Dispute Settlement Body on April 13 to address the issue.

The US move ratcheted up the pressure in the seven-year-old trade dispute over public aid to France-based Airbus and US rival Boeing.

A parallel pair of subsidy complaints have been making their way through the WTO dispute process.

Friday's action came in response to a WTO ruling last June that found that the EU and four of its member states had provided more than $18 billion in subsidized financing to Airbus, the USTR noted.

The EU was given six months to comply with that ruling.

In December, the EU said it had complied but the US sought more information to verify the claim, holding consultations with the EU in January.

""The EU was unable or unwilling to substantiate its claims to have addressed the WTO inconsistencies, and the consultations failed to resolve the dispute,"" the statement said.

Kirk said the US remained ready ""to engage with the EU in any meaningful efforts that will lead to the goal of ending subsidized financing at the earliest possible date.""

The European Union expressed regret at Washington's move Friday, while alleging that the US itself has not reeled in its WTO-illegal support for Boeing.

""We regret that the US has chosen to take this step, since the EU notified its compliance with its WTO obligations in the package of steps taken at the end of 2011, and the US has yet to do the same in the Boeing case,"" said the European Commission's trade spokesman John Clancy."
Best seats: premium economy on Virgin Atlantic's Airbus A340 - Executive Traveller,"Wed, 14 Mar 2012 07:00:00 GMT",https://news.google.com/rss/articles/CBMiXmh0dHBzOi8vd3d3LmV4ZWN1dGl2ZXRyYXZlbGxlci5jb20vYmVzdC1zZWF0cy1wcmVtaXVtLWVjb25vbXktb24tdmlyZ2luLWF0bGFudGljLXMtYWlyYnVzLWEzNDDSAQA?oc=5&hl=en-US&gl=US&ceid=US:en,"Flying Virgin Atlantic premium economy from Sydney to Hong Kong, or on from Hong Kong to London? The latest in AusBT's extensive series of guides to picking the best seat on the plane is here to help you get the most out of your journey.

The plane and cabin

Virgin Atlantic is one of your three premium economy options between Sydney and Hong Kong (and one of four, with British Airways added, on the overall Sydney-London route).

You'll find 38 premium economy seats on board in a 2-3-2 configuration, starting just in front of the wing of the stretched A340-600 plane.

Seats are among the widest in the premium economy band, at 21"" (53cm).

Each seat has an AC outlet but it's one of those oddly-shaped EmPower sockets so you'll want to be packing the right adaptor for your laptop or tablet.

The best seats on the plane

18A 18C 18H 18K: despite the seat map's layout, these are bulkhead seats with a wall in front (as shown below) rather than exit row seats you can really stretch out in.

That said, they're still the best on board. While you might be disturbed by a baby at the front of the cabin, it's not like the premium economy zone is really big enough for you to avoid that anyway.

18D 18F 18G: these centre three bulkhead seats are a decent deal since the middle seat can nip out without disturbing the aisle passengers.

The worst seats on the plane

23D 23G 22D 22C 22G 22H: these aisle seats right next to the lavatories are a definite no.

Rows 21-23: the rest of these three rows aren't quite as bad, but they're still further back in the cabin -- and thus closer to the relatively noisy loos.

F seats: skip the middle of the three seats if you can and go for an aisle instead."
Emirates boss has a crack at Airbus over A380 problems - Australian Aviation,"Fri, 09 Mar 2012 08:00:00 GMT",https://news.google.com/rss/articles/CBMiYWh0dHBzOi8vYXVzdHJhbGlhbmF2aWF0aW9uLmNvbS5hdS8yMDEyLzAzL2VtaXJhdGVzLWJvc3MtaGFzLWEtY3JhY2stYXQtYWlyYnVzLW92ZXItYTM4MC1wcm9ibGVtcy_SAQA?oc=5&hl=en-US&gl=US&ceid=US:en,"Emirates Airlines President Tim Clark has lashed out at Airbus over its handling of A380 wing cracks, saying the airline will seek compensation for a claimed $90 million in lost revenues.

Emirates is having to temporarily ground six of its 21 A380s at a time while the wing cracks are fixed. Clark told the Financial Times that cracks have been found in 10 A380s so far and that all 21 are likely to need work.

This content is available exclusively to Australian Aviation members. Login Become a Member To continue reading the rest of this article, please login. Username or Email Address Password Keep me signed in on this device Forgot password? To unlock all Australian Aviation magazine content and again unlimited access to our daily news and features, become a member today!

A monthly membership is only $5.99 or save with our annual plans. PRINT $49.95 for 1 year Become a Member See benefits Australian Aviation quarterly print & digital magazines

Access to In Focus reports every month on our website MOST POPULAR PRINT + DIGITAL $99.95 for 1 year Become a Member $179.95 for 2 years Become a Member See benefits Unlimited access to all Australian Aviation digital content

Access to the Australian Aviation app

Australian Aviation quarterly print & digital magazines

Access to In Focus reports every month on our website

Access to our Behind the Lens photo galleries and other exclusive content

Daily news updates via our email bulletin DIGITAL $5.99 Monthly Become a Member $59.95 Annual Become a Member See benefits Unlimited access to all Australian Aviation digital content

Access to the Australian Aviation app

Australian Aviation quarterly print & digital magazines

Access to In Focus reports every month on our website

Access to our Behind the Lens photo galleries and other exclusive content

Daily news updates via our email bulletin View more offers and details"
Airbus says C-295 best choice for Aust - 9News,"Tue, 06 Mar 2012 08:00:00 GMT",https://news.google.com/rss/articles/CBMibWh0dHBzOi8vd3d3LjluZXdzLmNvbS5hdS9uYXRpb25hbC9haXJidXMtc2F5cy1jLTI5NS1iZXN0LWNob2ljZS1mb3ItYXVzdC9iNmQ1ODIwNi02ZGVkLTQ4MTEtYTUxZS0xNDMyMGFmZjZjMDXSAUVodHRwczovL2FtcC45bmV3cy5jb20uYXUvYXJ0aWNsZS9iNmQ1ODIwNi02ZGVkLTQ4MTEtYTUxZS0xNDMyMGFmZjZjMDU?oc=5&hl=en-US&gl=US&ceid=US:en,"Defence company Airbus Military says a US decision to phase out a fleet of C-27J Spartan aircraft makes its C-295 aircraft the best choice to replace Australia's new retired Caribou tactical transport aircraft.

Airbus Military Australian C-295 program head Valentin Merino said the claimed benefits of Australia buying C-27J through a US foreign military sale (FMS) deal - assured availability of spares and operational commonality - were disappearing.

""We say that needs to be taken into account in terms of what is the consequence for sustainment and supportability of the Australian fleet,"" he said.

Australia is looking to acquire up to 10 aircraft to fulfill the battlefield transport role performed by Caribou aircraft from 1964 until their final retirement in 2009.

Both the Airbus Military C-295 and Italian-designed Alenia C-27J are twin-engined medium transport aircraft. Last year the government announced C-27J was first choice on grounds that it could perform the Caribou role and, most importantly, was also in US service.

But in its major defence budget announcement at the end of January, the US revealed it planned to buy no more C-27J aircraft and sell off its current fleet.

Under the original deal the US was to buy up to 145 C-27J aircraft but that number has progressively dwindled to just 21 with 12 so far delivered.

In a further step, the head of Alenia revealed last week the company would refuse to support the 21 US aircraft if onsold to another country such as Australia, Canada or Taiwan.

""Clearly the US termination and disposal of its C-27J fleet is a game changer for Australia,"" Airbus said in a briefing to journalists in Canberra on Tuesday.

The company is calling for a level playing field in choice between C-295 and C-27J, suggesting that some claims of C-27J superiority could not be substantiated.

That includes the ability to carry the new Mercedes-Benz G-Wagon. This vehicle comes in various configurations and those with the larger load modules won't fit on either aircraft.

""We are not saying C-27J is rubbish. It is a good aircraft and it has capability over C-295 in selected areas, as does C-295 over C-27J, "" an Airbus spokesman said.

""We would rather the source selection not be predicated on fairly questionable capability requirements such as vehicles."""
"Govt to hurt more if Kingfisher shuts down - BusinessToday - Issue Date: Mar 18, 2012 - Business Today","Fri, 09 Mar 2012 08:00:00 GMT",https://news.google.com/rss/articles/CBMidGh0dHBzOi8vd3d3LmJ1c2luZXNzdG9kYXkuaW4vbWFnYXppbmUvZmVhdHVyZXMvc3Rvcnkva2luZ2Zpc2hlci1haXJsaW5lcy1jcmlzaXMtZ292ZXJubWVudC1hZmZlY3RlZC0yNzc5My0yMDEyLTAzLTA50gEA?oc=5&hl=en-US&gl=US&ceid=US:en,"Banks effectively own 75% of the airline, and the impact on their books could be devastating if Kingfisher goes under

Employees are furious about not being paid, but say that everyone is not disheartened yet

When he finds time to speak to the media on board, as the champagne flows, he promises the moon. There will be non-stop flights between Bangalore and San Francisco, he says, and Kingfisher will be one of the world's top airlines. Forget Naresh Goyal, Mallya says he has Emirates, the Dubai airline, in the cross hairs.Perhaps the heady mix of champagne, the backing of politicians such as former civil aviation minister Praful Patel , businessmen buddies such as Gautam Singhania of the Raymond Group, and an army of yes-men in his company spurred him to target an airline known for its service and punctuality. Ironically, a few years later, Jet and Kingfisher flirted with each other, albeit unsuccessfully in the end.But at the time, passengers were having a blast. Kingfisher gave each passenger a complimentary kit - a pretty red plastic case containing headphones, a pen and other goodies. The food was excellent. The flight safety demonstration featured Czechborn model Yana Gupta and was shown on seat-back entertainment screens, which were a novelty at the time. Mallya assured passengers that he 'personally' hired the air-hostesses.Model Deepika Padukone, who was not as famous then as she is today, became the airline's brand ambassador. Her image was plastered on billboards across India. But Mallya's political friends could not always help him out Denied the opportunity to start international services before completing the mandatory five years of service, Mallya went hunting for another airline which had international flying rights. His bid to buy Air Sahara was thwarted by Goyal, who bought the carrier for Rs 1,450 crore in April 2007.In December 2007, Mallya turned his attention to Air Deccan, India's first low-cost carrier started by G.R. Gopinath in 2003.Deccan was bleeding money and on the verge of being bought by Anil Ambani , as Gopinath reveals in his autobiography. At the last minute, following an emotional phone call from Mallya to Gopinath - the latter later recalled that the conversation was in Kannada - Kingfisher bought Deccan, and eventually reversemerged itself with the low-cost carrier, acquiring its international rights.Mallya, who cut his teeth in the alcohol business, often likens himself to Richard Branson, the flamboyant owner of Virgin Atlantic. But, in the airline business, as one insider quipped: ""Branson uses flamboyance as a promotional tool; Mallya uses it as a management style.""Since Kingfisher began, three chief executives have come and gone, and the latest holder of the unenviable job, Sanjay Aggarwal, has reportedly found a way out as well.That Kingfisher Airlines was in trouble should have been evident to anyone who has looked at the airline's books: not a single profit-making quarter since inception, the debt burden rising year after year and annual interest payments topping Rs 1,100 crore in 2011.However, Mallya can hardly be accused of not being astute. Much of the airline is funded with bank loans totalling more than Rs 7,000 crore, even after a consortium of private and public sector banks converted Rs 750.09 crore of debt into a 23.37 per cent stake in the airline in mid-2011.With Mallya pledging more than 90 per cent of his 58 per cent stake in the airline, the banks effectively own over three-fourths of the carrier. With bad loans already rising, especially in the infrastructure sector, the impact on the banks' books would be devastating if Kingfisher were to go under. ""Forget bailing out Kingfisher, the banks are bailing themselves out,"" says a government official.The first sign of trouble for the airline came in mid-2008. The merged entity of Kingfisher and Deccan had become the largest Indian carrier with a 27.5 per cent share of the market, and passenger numbers were booming.Despite this, the airline did not take delivery of five Airbus A340-500 ultra long-range aircraft, even though domestic air travel was growing 30 per cent a year. The European manufacturer, left holding a billion dollars worth of aircraft, was livid. In fact, Kingfisher has more than 90 aircraft on Airbus' order books, but not one has been delivered to it since 2008.Kingfisher has said this was because the recession in the United States and rising fuel prices made non-stop flights unviable. But rival Jet Airways has enjoyed profits on its India-North America routes, and even loss-making state-owned carrier Air India makes money on non-stop services to New York and Chicago.""Kingfisher's problems are not external; they're internal,"" says Nikhil Vora, Managing Director, IDFC Securities. ""It is an extremely leveraged company, and the cost structure of the business itself is very high."" Neeraj Monga, Executive Vice President at Veritas Investment Research, whose report of September last year said both the airline and its parent UB Holdings were on the verge of bankruptcy, says the airline's strategy was flawed. ""The business plan was not well thought out,"" he says.{mosimage}""Kingfisher was to be a luxury airline in a country where price is the key characteristic."" Kingfisher's bet on a luxury model runs opposite to the lessons of low-cost carrier IndiGo and Jet Airways' move to increase low-cost offerings on domestic routes.On a recent flight between Delhi and Mumbai, passengers hooted when Mallya's welcome video came on. Entertainment screens do not work on many planes, and the food is abysmal. Many corporations have advised or ordered employees to avoid Kingfisher to avoid the perceived risk of delays and cancellations.Mallya has been blaming the media for giving his airline a bad name. In December, he stormed out of a press conference when asked uncomfortable questions. Other than the occasional moderated show on television, Mallya remains ensconced in his multi-million dollar home on Mumbai's Napean Sea Road."
