Titre,Date de publication,URL,Contenu
New radar ensures superiority of the Eurofighter - Airbus,"Thu, 20 Nov 2014 08:00:00 GMT",https://news.google.com/rss/articles/CBMiamh0dHBzOi8vd3d3LmFpcmJ1cy5jb20vZW4vbmV3c3Jvb20vcHJlc3MtcmVsZWFzZXMvMjAxNC0xMS1uZXctcmFkYXItZW5zdXJlcy1zdXBlcmlvcml0eS1vZi10aGUtZXVyb2ZpZ2h0ZXLSAQA?oc=5&hl=en-US&gl=US&ceid=US:en,"Summary

New capabilities and improved protection of pilots

Captor-E radar on the Eurofighter

The Eurofighter will be equipped with a new generation of radar which will enhance the aircraft’s capabilities and substantially improve the pilots’ ability to survive. During a meeting of the defence state secretaries of the Eurofighter nations (Great Britain, Germany, Italy and Spain) held in Edinburgh, representatives of Eurofighter Jagdflugzeug GmbH and NETMA (NATO Eurofighter and Tornado Management Agency) signed a 1 billion euro contract to develop a new, electronically scanned radar, the so-called “Captor-E”.

Airbus Defence and Space is playing a major role in the development and integration of the radar, via its Military Aircraft and Electronics business lines. “Together with our partners in the Euroradar consortium we are developing the world’s most powerful fighter radar,” said Thomas Müller, head of the Electronics business line at Airbus Defence and Space. “This order will ensure ongoing development of radar technology, which is a core military capability in Germany.”

Berndt Wünsche, head of Combat Aircraft at Airbus Defence and Space, stated in Edinburgh: “This decision ensures that the Eurofighter will continue to be the best combat aircraft available in the world. The Captor-E radar will open up completely new options for deployment and will substantially improve the Eurofighter’s export opportunities.”

The main advantage of the Captor-E is its ability to perform several tasks practically simultaneously. This means that the pilot is able to scan a wide area in front of the aircraft or on the ground, while identifying ground targets or tracking individual flying objects at the same time. The new technology enables an increased range in target acquisition and target tracking and, thanks to the rotating antenna, a considerably larger field of view, compared to other state-of-the-art combat aircraft.

The new radar is being developed by Eurofighter Jagdflugzeug GmbH and the Euroradar consortium comprising Selex ES (Great Britain, Italy), Indra (Spain) and Airbus Defence and Space (Germany). The consortium has already developed and produced more than 400 Captor radars.

More information

http://militaryaircraft-airbusds.com/Aircraft/EurofighterTyphoon.aspx

Airbus Defence and Space

Airbus Defence and Space is a division of Airbus Group formed by combining the business activities of Cassidian, Astrium and Airbus Military. The new division is Europe’s number one defence and space enterprise, the second largest space business worldwide and among the top ten global defence enterprises. It employs some 40,000 employees generating revenues of approximately €14 billion per year."
"Chinese Plane to Compete with Boeing, Airbus Models - IndustryWeek","Fri, 07 Nov 2014 08:00:00 GMT",https://news.google.com/rss/articles/CBMifGh0dHBzOi8vd3d3LmluZHVzdHJ5d2Vlay5jb20vc3VwcGx5LWNoYWluL3RyYW5zcG9ydGF0aW9uL2FydGljbGUvMjE5NjQwMTIvY2hpbmVzZS1wbGFuZS10by1jb21wZXRlLXdpdGgtYm9laW5nLWFpcmJ1cy1tb2RlbHPSAQA?oc=5&hl=en-US&gl=US&ceid=US:en,"SHANGHAI - China is seeking suppliers to develop its own wide-body passenger plane over the next decade, industry executives said, expanding its ambitions and rivalry with Boeing (IW 500/13) (BA) and Airbus (IW 1000/47).

The proposed aircraft -- tentatively called the C929 -- would be state-backed Commercial Aircraft Corp. of China (COMAC)'s largest, according to suppliers that have held discussions with the firm.

It would be a substantial advance on the smaller 158-168 seat narrow-body C919 it is currently developing and the 78-90 seat ARJ21 regional jet, which is undergoing test flights.

The goal is for the C929 -- which could carry several hundred passengers at a time on journeys across Asia -- to take flight after 2020, possibly in 2023.

COMAC's ambitions will be on parade at China's premier airshow, which opens Tuesday in the southern city of Zhuhai, with a huge stand highlighting the C919 and a flying display by a prototype ARJ21.

The technological challenges for China to build its own passenger plane are formidable, with some comparing them to the difficulty of sending a mission to the moon.

But the government considers developing a passenger aircraft industry a national priority that would vault it into an elite club of just a handful of nations.

At the same time Russia has drawn closer to its ally China in the face of Western sanctions over Ukraine and following two years of discussions, the two countries signed an agreement in May to develop what Chinese state media call the ""big plane.""

COMAC's strategic partner for the C929 is Russia's United Aircraft Corp., created in 2006 when Moscow combined the assets of the country's largest state-owned aircraft manufacturers, which have decades of experience.

""Russia and China have been working together, figuring out things, now they're ready to start talking and getting ideas from suppliers,"" said Briand Greer, president of aerospace for Asia-Pacific for U.S. firm Honeywell (IW 500/33) (HON), which already provides components and systems for both the C919 and ARJ21.

COMAC is floating ideas about the design of the plane ahead of making formal information requests to prepare a tendering process, industry sources said.

""We have been talking about this new project, the 929,"" said another supplier to the C919, who declined to be named.

""They have started with design of the plane. They are talking beyond 2020 (for the launch),"" he said.

One possibility for the wide-body -- which has two passenger aisles -- is a plane capable of flying within Asia for journeys of up to about five hours, industry officials said, but not for lengthy intercontinental flights of 12 to 14 hours.

'National Agenda'

Such a concept would compete with the planned regional version of the Airbus A330, they said, which will enter service early next year. Planes in the A330 family hold 200-400 passengers.

Boeing's wide-body offerings include its 767 and 787.

COMAC did not respond to requests for comment.

China has dreamed of building its own civil aircraft since the 1970s when Jiang Qing, Mao Zedong's wife and a member of the notorious ""Gang of Four,"" personally backed the attempt to develop the Y-10. Only three of the lumbering planes were ever built.

But with its deep pockets China can now tap foreign companies, some of them already suppliers to Boeing and Airbus.

The C919, which has a range of up to 3,444 miles, is scheduled to make its first test flight at the end of next year, with deliveries planned for 2018, according to state media, although some doubt the company will meet the target.

""It's a national agenda, it's going to happen,"" Greer said of the C919. ""Timing -- we'll see.""

Its engines are made by CFM International, a venture between France's Safran group (IW 1000/219) and General Electric (IW 500/7) (GE). COMAC has 400 orders for the C919, most from domestic customers with the exception of GE Capital Aviation Services -- a subsidiary of GE.

The ARJ21 regional jet claims 253 orders but the project is years behind schedule, with deliveries originally due in 2009.

COMAC plans to certify the ARJ with China's own civil aviation authority before year-end but approval from the U.S. Federal Aviation Administration is necessary before it can fly in most countries.

The C919 has just started being assembled at a sprawling complex next to Shanghai's Pudong Airport, where workers in blue uniforms fit together pieces of the fuselage, industry officials and media reports say.

Elsewhere on the vast tract of land, COMAC planners have already reserved space for a yet-unbuilt factory to house the C929.

Bill Savadove, AFP

Copyright Agence France-Presse, 2014"
Maverick adds to Airbus Helicopters fleet with 8th EC130 T2 - Vertical Magazine,"Sun, 02 Nov 2014 07:00:00 GMT",https://news.google.com/rss/articles/CBMiWmh0dHBzOi8vdmVydGljYWxtYWcuY29tL3ByZXNzLXJlbGVhc2VzL21hdmVyaWNrYWRkc3RvYWlyYnVzaGVsaWNvcHRlcnNmbGVldHdpdGg4dGhlYzEzMHQyL9IBAA?oc=5&hl=en-US&gl=US&ceid=US:en,"Maverick Aviation Group has ordered another EC130 T2 from Airbus Helicopters. Maverick Helicopters Photo

Las Vegas, Nev.-based Maverick Aviation Group has placed an order with Airbus Helicopters for its eighth EC130 T2. The launch client of the T2, Maverick Helicopters flies the largest fleet of EC130 aircraft in the world. Maverick Aviation Group is the parent company of Maverick Helicopters, Mustang Helicopters and Maverick Airlines.

As the next generation of the EC130, the T2 model features more powerful performance, improved fuel efficiency and excellent visibility. Most importantly, the aircraft was designed for the tourism industry, equipped with superior passenger accommodations. Such features include an active vibration control system for a more comfortable ride, an improved air conditioning system, right-side cabin sliding door and additional interior improvements.

Maverick Helicopters now owns eight EC130 T2 models, contributing to an overall total of 42 helicopters. The company has the largest EC130 fleet in the world and anticipates growing the collection to 47 aircraft within the next year.

Maverick Aviation Group offers expeditions through the Grand Canyon and above the Las Vegas Strip. For more information, visit www.maverickaviationgroup.com."
Airbus A350-900 receives FAA certification - The Dallas Morning News,"Wed, 12 Nov 2014 08:00:00 GMT",https://news.google.com/rss/articles/CBMiY2h0dHBzOi8vd3d3LmRhbGxhc25ld3MuY29tL2J1c2luZXNzL2FpcmxpbmVzLzIwMTQvMTEvMTIvYWlyYnVzLWEzNTAtOTAwLXJlY2VpdmVzLWZhYS1jZXJ0aWZpY2F0aW9uL9IBcmh0dHBzOi8vd3d3LmRhbGxhc25ld3MuY29tL2J1c2luZXNzL2FpcmxpbmVzLzIwMTQvMTEvMTIvYWlyYnVzLWEzNTAtOTAwLXJlY2VpdmVzLWZhYS1jZXJ0aWZpY2F0aW9uLz9vdXRwdXRUeXBlPWFtcA?oc=5&hl=en-US&gl=US&ceid=US:en,"The Federal Aviation Administration on Wednesday gave the Airbus A350-900 its type certification, Airbus said, following the European Safety Agency’s Sept. 30 certification.

Airbus said FAA association administrator of aviation safety Peggy Gillian and Airbus Group chairman Allan T. McArtor were among those at the signing ceremony.

Advertisement

The approval clears the way for delivery of the first A350 to Qatar Airways before year’s end."
Airbus supplies Indonesia military with helicopters - UPI News,"Fri, 07 Nov 2014 08:00:00 GMT",https://news.google.com/rss/articles/CBMiZWh0dHBzOi8vd3d3LnVwaS5jb20vRGVmZW5zZS1OZXdzLzIwMTQvMTEvMDcvSW5kb25lc2lhLXJlY2VpdmVzLWhlbGljb3B0ZXJzLWZyb20tQWlyYnVzLzU2MzE0MTUzODM4MTUv0gEA?oc=5&hl=en-US&gl=US&ceid=US:en,"A French military EC725. (CC/MilborneOne)

MARIGNANE, France, Nov. 7 (UPI) -- Different model helicopters for combat search-and-rescue and light attack missions have been handed over to Indonesia's military by Airbus Helicopters. The aircraft are the EC725 Caracal and Fennec family of helicopters. Advertisement

The EC725 is a long-range tactical transport with a cruise speed of 177 miles per hour and a range of 533 miles.

Airbus Helicopters said the first of six EC725 rotorcraft acquired by Indonesia was handed over during a ceremony in France and will be delivered to the Indonesian Air Force next year after Airbus partner PT Dirgantara Indonesia completes the helicopter's mission equipment outfitting and customization.

""We are pleased to receive this first EC725 from Airbus Helicopters, which will allow us to complete it in the CSAR version to be handed over to the Indonesian Air Force,"" said PTDI President Budi Santoso. ""We will continue to work closely with Airbus Helicopters to ensure the on-time delivery of the remaining units, as we anticipate an additional order from the Air Force for 10 more EC725s to complete its squadron of 16 helicopters.""

The EC725 first entered service in 2005 and has been selected by the military forces of France, Brazil, Mexico, Malaysia, Indonesia and Thailand.

Advertisement

Airbus Helicopters said it has also delivered its lightweight Fennec attack aircraft to the Indonesian Army. The helicopter delivered is the first of 12 Fennecs -- six single-engine and six twin-engine variants -- to be delivered through 2016.

As with the EC725 aircraft, PT Dirgantara Indonesia will conduct the mission equipment outfit, which will include machine guns and rocket launchers.

The Fennec helicopter is a militarized version of Airbus Helicopters' Ecureuil rotorcraft family, and is used by militaries worldwide for combat, combat support, tracking, escort and training operations."
France orders 12 “Phoenix” aerial refuellers from Airbus for €3 Billion - Defense Update,"Fri, 21 Nov 2014 08:00:00 GMT",https://news.google.com/rss/articles/CBMiMmh0dHBzOi8vZGVmZW5zZS11cGRhdGUuY29tLzIwMTQxMTIxX2EzMzBfbXJ0dC5odG1s0gEA?oc=5&hl=en-US&gl=US&ceid=US:en,"Twelve aircraft to be acquired in multi-year programme worth 3 billion Euros. The A330 MRTT has won every major tanker aircraft procurement competition outside the USA since it has entered the market.

Airbus Defence and Space has been selected by the French Ministry of Defence to supply 12 A330 MRTT new generation air-to-air refuelling aircraft for the French Air Force. The first delivery is foreseen for 2018, followed by the second in 2019, and then at a rate of one or two per year. According to the French ministry of Defense the contract amount is about 3 billion euros. The French Air Force chose to name the new aircraft“Phoenix”.

According to Airbus, the contract agreed between the French procurement agency (DGA) and Airbus Defence and Space is now ready for official award. The contract covers the development and qualification of the specific French configuration as well as the associated support and training systems, such as spares, ground support equipment, training devices and five years of in-service support from first delivery.

The A330 MRTT has won every major tanker aircraft procurement competition outside the USA since it has entered the market. France’s choice of the A330 MRTT makes it the sixth nation to order the type following Australia, Saudi Arabia, Singapore, the United Arab Emirates, and the United Kingdom which have ordered a total of 34 aircraft. In addition, India and Qatar have selected the MRTT and are in the final stages of contractual negotiations for six and two aircraft respectively. A total of 22 aircraft are currently in service and the aircraft has been battle-proven in recent coalition actions.

In French service the A330 MRTT will replace the KC-135F currently operated by the French Air Force. The A330 will be powered by Rolls-Royce Trent 700 engines, and be equipped with a combination of the Airbus Refuelling Boom System and underwing hose-and-drogue refuelling pods. It will be configured in a variety of layouts carrying up to 271 passengers or flying MEDEVAC or medical treatment arrangements, including the French MORPHEE intensive care module carrying up to ten patients as well as 88 passengers."
Frontier Adds to the Herd with Order of Nine Airbus A321 Aircraft - NYCAviation - NYCAviation,"Mon, 24 Nov 2014 08:00:00 GMT",https://news.google.com/rss/articles/CBMiXGh0dHBzOi8vd3d3Lm55Y2F2aWF0aW9uLmNvbS8yMDE0LzExL2Zyb250aWVyLWFkZHMtaGVyZC1vcmRlci1uaW5lLWFpcmJ1cy1hMzIxLWFpcmNyYWZ0LzM3MjM00gEA?oc=5&hl=en-US&gl=US&ceid=US:en,"Frontier Airlines is continuing its development into an ultra-low cost carrier with an order of nine Airbus A321 aircraft. Known for their animal adorned tail flashes, this is Frontier’s first order of the largest member of the A320 family.

Frontier started its transition to an all-Airbus fleet in 2001 and currently operates a fleet of 35 A319 and 20 A320 aircraft. It also has 89 Airbus single aircraft on order, including 80 A320neo aircraft.

It really isn’t that surprising to see Frontier utilize the A320 family of aircraft as it competes in the low cost sector of the airline industry. The success of JetBlue alone has demonstrated the incredible versatility and utility of this family of aircraft when it comes to offering low fares on a plane that still provides a quality flight experience.

“We continue to come back for more A320 Family aircraft because they fulfill our mission of providing low fares through low operating costs,” said David Siegel, Frontier Airlines CEO. The A321 is a natural fit with our unique brand of Low Fares, Done Right and will continue to help meet our customers’ expectations for a safe and reliable travel experience while allowing us to provide low fare service to more of the country.”

Adding the A321 to its fleet gives Frontier an aircraft option with an increased seating capacity as well as additional range as it continues to develop its position in the ultra-low cost sector. With the announcement last week that Frontier will be reducing the number of flights that operate into and out of Denver, these new aircraft will open up opportunities to focus operations in areas that are less centralized than its Denver hub.

The A321 offers a seating capacity of up to 220, which is comparable to many widebody aircraft while maintaining the Airbus standard of at least 18-inch wide seats. This increased capacity as compared to the A319 (156 seats) and A320 (180 seats) allow the A321 to offer the best seat mile costs of any single-aisle aircraft.

Ultra-low cost carriers operate on such razor thin margins that they must maximize their efficiency in every way possible, so acquiring the A321 only makes sense. It will be interesting to see where exactly these aircraft go into service and how they aid Frontier as their operations become less focused on Denver and move to less centralized locations.

The engine option and seating configuration that Frontier will utilize were not part of the announcement.

David Lynn is a C-130 navigator in the USAF and a proud avgeek. You can follow him on twitter @davidvlynn or via his blog AviationGuy.com."
Delta's Choice of the A330neo and A350 For Its Widebody Fleet May Seem a Little Peculiar – Cranky Flier - Cranky Flier,"Tue, 25 Nov 2014 08:00:00 GMT",https://news.google.com/rss/articles/CBMie2h0dHBzOi8vY3Jhbmt5ZmxpZXIuY29tLzIwMTQvMTEvMjUvZGVsdGFzLWNob2ljZS1vZi10aGUtYTMzMG5lby1hbmQtYTM1MC1mb3ItaXRzLXdpZGVib2R5LWZsZWV0LW1heS1zZWVtLWEtbGl0dGxlLXBlY3VsaWFyL9IBAA?oc=5&hl=en-US&gl=US&ceid=US:en,"We’ve been waiting a long time for Delta to decide what widebodies it would order to replace its 747s and 767s, and now we finally know. The A330-900neo and the A350-900 have both been chosen. That’s kind of strange considering they have nearly the same capacity, but as always, there is a method to Delta’s madness.

Twenty-five A350-900s are being bought to replace the 747s in the fleet (moment of silence, please). Delta has already started retiring those, and we know that the airline feels there’s too much capacity out there. So it’s going smaller. The A350-900 should seat around 315 in a typical configuration, and it can fly 7,500 nautical miles (nm). Today, Delta’s 747s carry 376 people and can fly about 6,500nm. So the A350 gives better range but carries fewer people. That’s exactly what Delta wants. This airplane will be used to fly primarily US-Asia routes, as the 747 does today.

Twenty-five A330-900neos are going to replace the 767-300s in the fleet, at least internationally. These airplanes usually seat 310 people (only 5 fewer than the A350-900) and will go about 6,200nm. Meanwhile, Delta’s international 767-300s seat between 208 and 226 today. They also fly between 5,400 and 5,700nm at most. This is going to be used to fly from the US to Europe, so mostly shorter-haul international operations. There could be some west coast-Asia flying as well. In this case, Delta is looking to add a lot of seats to what it has today but it doesn’t need the range of the A350.

What could Boeing have offered? Well, there’s the 787-10 which would seat about 10 more people or the 787-9 which is just a bit smaller. The first strike on the 787-10 is that first delivery isn’t scheduled until 2018. The 787-9 is flying but has a hefty backlog. Delta wanted airplanes sooner with the A350 coming in 2017. The second strike? It’s one airplane to fill two roles, unlike the Airbus offering.

I was told by a wise fleet planner that you should only buy the range you need. Otherwise, you’re wasting your money. For European flying, 6,200nm is plenty. In fact, a route like LA to Amsterdam doesn’t even crack 5,000nm. So why buy more airplane than you need? Well, the A350 is going to be more fuel efficient than the A330neo. Or at least it should be since it’s a brand new design. But that’s where purchase price comes into play.

Delta is the first to place a firm order for the A330-900neo, and you know Airbus wanted to get one of those on the books. I have no doubt that Delta got a smoking deal on those airplanes. They’ll still be vastly superior to the 767 in terms of operating economics, but they won’t be the most fuel efficient in the sky. I chuckled when I saw Delta call the A330-900neo “advanced” while the A350-900 was called “state-of-the-art.” Still, the lower purchase price must have made it worthwhile. That’s certainly consistent with Delta’s narrowbody decisions as well.

Meanwhile, for Asia flying, that extra range starts to become more important. Detroit to Hong Kong is 6,800nm, for example. You need those longer legs for Pacific flying, and so the A330-900neo just wasn’t really an option.

It looks like Delta’s needs here were in a little sweet spot of an area that the twin options from Airbus could fill nicely. Combine that with a great price, and Airbus was the winner here.

This all makes sense to me, though you have to wonder how the people in Delta’s burgeoning Seattle hub feel about the decision. Maybe we’ll see Alaska kick up it’s “proudly all-Boeing” marketing message to try to increase its advantage in the market. Or maybe, as is most likely, nobody will care. Delta had to make the right decision to meet its financial and operational needs here. I’m guessing that’s exactly what’s happened.

[Edit to reflect the 787-9 as a comparable option, not just the 787-10.]

[Original by Kentaro Iemoto from Tokyo, Japan (Delta B747-400(N674US)Uploaded by russavia) [CC-BY-SA-2.0], via Wikimedia Commons]"
Indonesia receives first CSAR-dedicated EC725 from Airbus Helicopters - Vertical Magazine,"Fri, 07 Nov 2014 08:00:00 GMT",https://news.google.com/rss/articles/CBMiZGh0dHBzOi8vdmVydGljYWxtYWcuY29tL3ByZXNzLXJlbGVhc2VzL2luZG9uZXNpYXJlY2VpdmVzZmlyc3Rjc2FyZGVkaWNhdGVkZWM3MjVmcm9tYWlyYnVzaGVsaWNvcHRlci_SAQA?oc=5&hl=en-US&gl=US&ceid=US:en,"Airbus Helicopters has delivered the first CSAR-configured EC725 to Indonesia. Airbus Helicopters Photo

Airbus Helicopters has handed over the first of six EC725 rotorcraft acquired by Indonesia for combat search-and-rescue (CSAR) missions. Present at Airbus Helicopters’ Marignane, France facility to accept the aircraft included members of the Indonesian Ministry of Defence, the Indonesian Air Force, as well as PT Dirgantara Indonesia (PTDI). The 11-ton twin-engine helicopter will be delivered to the Air Force by mid-2015 after PTDI completes the mission equipment outfitting and customization at its Bandung, West Java facility.

“We are pleased to receive this first EC725 from Airbus Helicopters, which will allow us to complete it in the CSAR version to be handed over to the Indonesian Air Force,” said PTDI president Budi Santoso. “We will continue to work closely with Airbus Helicopters to ensure the on-time delivery of the remaining units, as we anticipate an additional order from the Air Force for 10 more EC725s to complete its squadron of 16 helicopters.”

When deployed by the Indonesian Air Force, the EC725 fleet will significantly enhance the military service’s CSAR capabilities, benefitting from the proven performance and durability of Airbus Helicopters’ latest member in its Super Puma helicopter family.

The mission equipment integration and completion of these six EC725 will mark a new step in Airbus Helicopters’ well-established cooperation with PTDI, which includes a strategic industrial agreement and the Indonesian company’s role in Airbus Helicopters’ global supply chain.

The Indonesian Air Force has been a long-time operator of both the AS332 Super Puma and SA330 Puma rotorcraft, which were license-produced by PTDI since over 30 years ago. The partnership between PTDI and Airbus Helicopters has continued to grow, resulting in PTDI becoming a key supplier of tail booms and airframe assemblies of the EC225 and EC725 since 2008.

“Airbus Helicopters’ cooperation with PT Dirgantara Indonesia is exemplary,” said Philippe Monteux, head of region South East Asia and Pacific at Airbus Helicopters. “Our delivery of the first EC725, with significant parts being first built by PTDI, underscores how our partnership continues to evolve, meeting Indonesia’s helicopter needs and further contributing to the progress of its aerospace sector.”

The EC725 entered service in 2005 and has already been selected by the military forces of France, Brazil, Mexico, Malaysia, Indonesia and Thailand. Its reliability and capabilities have been confirmed in crisis areas that include Lebanon, Afghanistan and Mali, while also supporting

France’s role during NATO-led operations in Libya. Missions performed by EC725s range from combat search and rescue to special operations, tactical transport and medical evacuation, along with a full range of maritime roles."
