Titre,Date de publication,URL,Contenu
Singapore Airlines and Airbus sign Flight Hour Services Tailored Support Package (FHS-TSP) contract for its A380 fleet - Airbus,"Mon, 15 Feb 2016 08:00:00 GMT",https://news.google.com/rss/articles/CBMiemh0dHBzOi8vd3d3LmFpcmJ1cy5jb20vZW4vbmV3c3Jvb20vcHJlc3MtcmVsZWFzZXMvMjAxNi0wMi1zaW5nYXBvcmUtYWlybGluZXMtYW5kLWFpcmJ1cy1zaWduLWZsaWdodC1ob3VyLXNlcnZpY2VzLXRhaWxvcmVk0gEA?oc=5&hl=en-US&gl=US&ceid=US:en,"Summary

Tailored service securing operational performance excellence

SINGAPORE AIRSHOW : FLIGHTS DISPLAY

Singapore Airlines (SIA) has signed a ‘Flight Hour Services - Tailored Support Package’ (FHSTSP) contract with Airbus to integrate and provide full component support, line and base airframe maintenance, as well as fleet technical management services for SIA’s 19 A380s. Under this 10-year agreement with Airbus, Singapore Airlines will benefit from the experience and expertise offered by Airbus in the areas of maintenance, engineering, reliability and supply chain management – partnering together with its affiliated MRO SIA Engineering Company (SIAEC).Didier Lux, Head of Airbus Customer Services says: “This Airbus FHS-TSP selection by Singapore Airlines for its A380 fleet marks a significant endorsement of our ability to deliver tailored and competitive value-adding services.” He adds: “We are extremely honoured by this latest expression of trust on the part of Singapore Airlines and, what's more, for extending our cooperation with SIA Engineering Company.”The FHS-TSP contract provides full component support, line and base maintenance, as well as fleet technical management services in Singapore. The scope of this agreement guarantees aircraft availability and ‘on-time performance’ (OTP), covering technical, logistics and maintenance. Furthermore, this Airbus FHS-TSP contract supersedes the existing FHSComponents support agreement signed in July 2007 for its A380s. To date Singapore Airlines’ in-service A330s are also covered by the same FHS-TSP agreement with Airbus. Airbus FHS contracts have now been selected to cover more than 245 aircraft from operators of A320, A330, A380 and A350.Airbus produces the world’s most modern and comprehensive family of airliners, ranging in capacity from 100 to more than 500 seats and has sold over 16,300 aircraft to more than 380 customers. Furthermore, through “Services by Airbus”, Airbus offers end-to-end fleet lifecycle solutions for all its customers. The portfolio ranges from standalone services, to the most complete integrated solutions. These include: Flight Hour & Tailored Support packages, upgrades, training, e-solutions, engineering & maintenance, flight operations Air Traffic Management, and material management services."
This Russian jet might just give Boeing and Airbus a run for their money - USA TODAY,"Fri, 12 Feb 2016 08:00:00 GMT",https://news.google.com/rss/articles/CBMilQFodHRwczovL3d3dy51c2F0b2RheS5jb20vc3RvcnkvdHJhdmVsL3JvYWR3YXJyaW9ydm9pY2VzLzIwMTYvMDIvMTIvdGhpcy1ydXNzaWFuLWpldC1taWdodC1qdXN0LWdpdmUtYm9laW5nLWFuZC1haXJidXMtYS1ydW4tZm9yLXRoZWlyLW1vbmV5LzgzMjg0Mzc2L9IBAA?oc=5&hl=en-US&gl=US&ceid=US:en,"This Russian jet might just give Boeing and Airbus a run for their money

When it comes to commercial airplane production, two companies essentially have the industry on lock: American-made Boeing and European-produced Airbus. Boeing's 737, 777 and 787 models — as well as Airbus' A320, A330 and A350 models — dominate airports across the world. Now, a Russian company is seeking to squeeze one of its planes right into the middle of the market.

Russian Rosavia hopes to uproot the foregone notion of these two companies' dominance with an unusually shaped wide-body aircraft called the Frigate Ecojet, designed to fly within the range of a narrow-bodied jet. Because of its oblong width, the Ecojet is able to carry between 276 and 358 passengers per flight, depending on cabin configuration. Rosavia is hoping that the magic number of passengers per flight is somewhere in the middle of those numbers.

By comparison, narrow-body Boeing and Airbus vehicles are built to carry less than 200 passengers on medium-haul routes. Their wide-body jets (747 and A380 excluded) are designed to carry between 240 and 325 passengers, but only on the longest flights currently possible. Rosavia is betting that there is an existing demand in the market for a wide-body jet with the capacity to hold hundreds of passengers, that doesn't need to fly halfway around the world to be financially viable.

The eco in Ecojet isn't a signifier for any sort of particularly green technology. Rather, it is short for economical. The hybrid plane combines the capacity of a wide-body jet with the range and operational savings of a narrow-body.

The oval fuselage my look strange to us today in comparison to the more cylindrical jets we are accustomed to seeing, but Rosavia hopes to change that opinion soon enough.

After completing aerodynamic and structural testing in Germany, Rosavia is scouting locations for an assembly line. The company hopes to begin producing the plane by 2018. Each Ecojet will cost an estimated $120 Million, allowing Rosavia to break even on its investment after the 115th plane is sold. In order to get that far, it will first need to raise $3 Billion in investment.

So will the Frigate Ecojet ever make it off the ground? Is the growing demand for air travel enough to warrant a new contender in the market? Will airlines break with loyalty and tradition to support a newcomer that might require reformatting across much of their existing infrastructure? Only time will tell."
Airbus Bench Designed to Seat Obese Flyers - Fortune,"Tue, 23 Feb 2016 08:00:00 GMT",https://news.google.com/rss/articles/CBMiP2h0dHBzOi8vZm9ydHVuZS5jb20vMjAxNi8wMi8yMy9haXJidXMtc2VhdC1mbGlnaHQtYmVuY2gtcGF0ZW50L9IBAA?oc=5&hl=en-US&gl=US&ceid=US:en,"The days of cramped flights soon may be over for overweight travelers.

Airbus Group has filed a patent application earlier this month for a new seating design, one that could relieve the aches and groans of squished globetrotters. The plan would replace airplanes seats with a “reconfigurable passenger bench.”

Get Data Sheet, Fortune’s technology newsletter.

The advantage to benches is that they could accommodate passengers of various sizes. Obese flyers, small children, or extra passengers might all fit together in a row, for example.

As the applications details, the bench could be used “for occupation by passengers who require increased space,” including overweight passengers and those with restricted mobility. The bench could also accommodate expanded capacity, such as seating three passengers or families with small children (two adults and two small children, say).

As so, as found in the patent application:

Screenshot of Airbus patent application

Airlines seats have shrunk several inches over the past few decades. At the same time, obesity rates in America have been on the rise. The combination has made for an uncomfortable trend on flights: cramming more mass into less space.

For more on airlines, watch:

Then again, airlines could just make the regular seats bigger."
