Titre,Date de publication,URL,Contenu
Britain's S.S. Daley Wins the LVMH Prize - The Business of Fashion,"Thu, 02 Jun 2022 07:00:00 GMT",https://news.google.com/rss/articles/CBMiWGh0dHBzOi8vd3d3LmJ1c2luZXNzb2ZmYXNoaW9uLmNvbS9hcnRpY2xlcy9sdXh1cnkvYnJpdGFpbnMtc3MtZGFsZXktd2lucy10aGUtbHZtaC1wcml6ZS_SAQA?oc=5&hl=en-US&gl=US&ceid=US:en,"Emerging British label S.S. Daley won the LVMH Prize for 2022, securing a cash prize of €300,000 for founder Steven Stokey-Daley as well as a year of mentorship by executives at luxury’s biggest conglomerate.

Stokey-Daley has become a breakout fashion star as his romantic, contemporary twist on British dress codes gained traction, with the likes of pop singer Harry Styles sporting his super-wide-legged canvas trousers and a dried-flower headress from the designer in a 2020 music video. Since then his label has been picked up by e-tailers Ssense and Matchesfashion, and he’s staged fashion shows incorporating socially-engaged performances that explored class and coming-of-age in British society.

“This just feels like the highest form of validation ever,” Daley told reporters following the prize ceremony.

The designer said he looked forward to having “mentorship to manage growth,” as he sought to establish the right mix between direct-to-consumer and wholesale channels.

ADVERTISEMENT

He said he planned to expand his ultra-small team, starting with help on e-commerce, inventories and fulfilment. “I’ve really just been doing it all myself,” he admitted.

LVMH also honoured two American labels, granting its Karl Lagerfeld prize (an award for runners-up dedicated to the late designer) to ERL and Winnie New York.

At the ceremony, ERL’s founder Eli Russell Linnetz spoke about drawing on his background as a filmmaker to emphasise the narrative dimension of fashion. His Venice Beach-based brand has become known for colourful, nostalgia-soaked twists on American fashion codes, and recently collaborated with Dior Homme.

Winnie New York’s founder Idris Balogun — a Nigerian-born designer known for mixing Savile Row tailoring with international cultural references linked to the African diaspora — thanked the prize for providing a “platform for talking about what I wanted to talk about.”

Disclosure: LVMH is part of a group of investors who, together, hold a minority interest in The Business of Fashion. All investors have signed shareholder’s documentation guaranteeing BoF’s complete editorial independence."
What’s Behind LVMH’s Investment in a Lab-Grown Company? - JCK,"Wed, 22 Jun 2022 07:00:00 GMT",https://news.google.com/rss/articles/CBMiR2h0dHBzOi8vd3d3Lmpja29ubGluZS5jb20vZWRpdG9yaWFsLWFydGljbGUvbHZtaHMtaW52ZXN0bWVudC1sYWItZ3Jvd24v0gEA?oc=5&hl=en-US&gl=US&ceid=US:en,"LVMH Luxury Ventures’ investment in Lusix was eyebrow-raising and noteworthy. What does it mean going forward?

When asked why LVMH invested in his nascent diamond-growing company, Lusix’s owner, Israeli billionaire Benny Landa, said at a JCK Las Vegas press conference: “Clearly, [LVMH] have made a financial investment. But I would ask myself, ‘Why would a luxury brand make a financial investment?’ There’s obviously very good reasons.”

After discussing that question with some well-informed folks, here are the best possible guesses.

One complaint I often hear from lab-created diamond sellers is that growers can’t produce consistently or reliably. That issue has led to at least one lawsuit.

“It’s hard to find nice-quality goods,” Ada Diamonds cofounder Lindsay Reinsmith told me last year. “If I had to guess, that’s the No. 1 reason that an LVMH brand has not stepped in [to the lab-grown market]. There are not enough nice goods available.”

If LVMH ever wanted to offer a lab-grown product—especially if it wanted to sell it at a big name, like Tiffany—it would need scale. Lusix says its production is more consistent and high-quality than others. Of course, it’s not the first grower to make that claim; only time will tell if that actually pans out. But LVMH’s investment will help Lusix scale its possibly more consistent production.

Which raises the question: Would LVMH—known for ultraexclusive luxury–ever offer lab-grown diamonds at one of its jewelry brands? One has to believe it may consider it, as it’s already used lab-grown diamonds on a TAG Heuer watch.

Consider LVMH’s plan for Tiffany: It’s targeting a younger demo; it wants to “elevate” the brand to reach higher price points; and it continually seeks—and even seems to crave—attention. Launching a lab-grown diamond line might tick two of those boxes, though it’s still not clear how lab-growns are playing in China, another brand focus. But if lab-grown diamonds are used as “starter” price-point jewelry, it could tick all three. (For the record, Tiffany’s past management said that lab-grown diamonds are “not a luxury material.”)

Which brings up another question: Would an LVMH brand ever carry lab-grown engagement rings?

That might be harder to imagine, given how natural diamond solitaires are the backbone of LVMH brands such as Tiffany. But it’s a little easier to conceive following Russia’s invasion of Ukraine, which is looking like a long, multiyear slog. Even if the war ends tomorrow, Alrosa might not get off the U.S. sanctioned entity list for some time. That leaves a possibly huge gap in diamond supply.

On LVMH’s most recent earnings call, chief financial officer Jean Jacques Guiony said, “We are currently working on replacing sourcing from Russia, from other locations, and it’s perfectly doable in a reasonably short time frame.”

Might Lusix be part of its short- or long-term solution? We’ll see.

Also worth noting: Lusix is marketing its diamonds as “sun-grown,” as they are produced with solar power. At the press conference, Landa said he wants “Sun Grown Diamonds” to become a “brand within a brand,” like Intel Inside.

That’s telling; when gem companies talk about “ingredient brands,” they almost always reference Intel—see Forevermark, Gemfields, WD Lab Grown, and, um, Alrosa.

Of course, building any kind of brand is expensive, provided a company is serious about it, which I’m not sure Lusix is. Landa declined to spell out any ad plans, but Intel’s annual marketing budget is over $1 billion.

It’s also not clear whether the term sun-grown complies with the Federal Trade Commission (FTC) Guides for describing lab-grown gems, especially if that term is used alone, and not with another recommended descriptor. (Those are currently limited to lab-grown, lab-created, and [company]-created.)

In 2019, the FTC warned lab-grown companies against using terms that “could suggest that the diamonds are naturally grown,” specifically calling out the term pure grown.

If FTC attorneys are on record objecting to the term pure grown, it’s hard to imagine sun-grown, a frequent descriptor for fruits and vegetables, would fare any better.

Sara Yood, deputy general counsel of the Jewelers Vigilance Committee notes “the [FTC] Green Guides caution against terms that could suggest laboratory-grown diamonds are naturally grown.… Sun-grown diamonds could be implying to a consumer that the diamonds were naturally grown. This claim, without qualification, could absolutely deceive a consumer, and I would expect the FTC would agree.”

She adds that phrases “like ‘solar-power lab-grown diamonds’ or possibly even just ‘solar lab-grown diamonds’ would be OK under the current guides.” But she believes that sun-grown diamonds would not be.

Lusix spokesperson Elizabeth Chatelain responds: “We think it’s an accurate descriptor. Maybe five years ago, it would have been confusing for consumers, but now we feel that they understand the difference. In the consumer’s mind, there are two terms: natural/mined and grown/created diamonds.”

[UPDATE: Lusix says it’s reached out to the FTC to make sure its wording is okay. If not, it will follow its recommended modification.]

Regardless, this does explain some comments Landa made to me during a post–press conference interview, which first struck me as strange, but now make more sense. In them, he compared growing diamonds to growing tomatoes.

Lusix’s diamond growers work like “a tomato grower in a greenhouse,” he said. “We don’t replace nature. All we do is create the environment that nature can create a diamond. We do it in a chamber, but it’s nature that creates the assembly that creates the diamond, just like it’s nature that grows the tomatoes. All the farmer does is create the right conditions—the soil, etc.—that enables nature to create the product.”

With all due respect to Mr. Landa—who has that salesman’s skill of seeming completely committed to what he’s saying—there’s obvious differences between a highly mechanized factory and a greenhouse or a farm. Greenhouses are hundreds of years old. They were around before electricity. Diamond-growing machines require huge amounts of power and were invented in the mid-20th century.

Landa did admit that diamond growing is “not a natural process,” but claimed tomato growing isn’t natural either.

Now it’s true, there are greenhouses and farms that use so many industrial processes, including chemical pesticides and GMOs, that they can’t qualify as organic. I’m not sure why Landa would want to lump his process in with those operations. Regardless, some greenhouse-grown tomatoes can be certified organic. By contrast, no lab-growing facility would be certified as natural, no matter how many clever analogies one comes up with.

When talking on the Rapaport podcast about the supposed eco benefits of lab-grown diamonds, Landa said that “all you have to do is look at a picture” of a mine.

If that’s all you have to do, let’s have some visual aids.

Here’s a photo of a tomato being grown in a greenhouse:

And here’s a picture of Lusix’s diamond growing factory.

There are many positive things one can say about solar-powered lab-grown diamond machines. Comparing them to tomato plants is, at best, a stretch.

Why am I harping on this? Landa is an accomplished businessman who clearly chooses his words with care and rarely wanders off message. These comments were likely said purposefully.

It’s an odd mix, the way Landa boasts his factory is the “most advanced, most fully automated” one around, but also eco-markets his diamonds as “sun-grown”—just like tomatoes. (They’re equally non-natural!)

Lusix has the potential to uplift the lab-grown industry. There are plenty of fine lab-grown companies. But that sector has also been a magnet for BS artists, criminals, and the Chinese military. It’s also seen its share of misleading rhetoric and wanton disregard for FTC regs.

Lusix has the chance to do better, to improve the entire category. That’s likely what attracted LVMH. Going forward, I hope it sets its sights on realizing that potential.

Top: Lusix’s solar-power generators (photo courtesy of Lusix)"
