Titre,Date de publication,URL,Contenu
LVMH's Toledano named chair of leading Paris fashion school - Vogue Business,"Tue, 14 Jun 2022 07:00:00 GMT",https://news.google.com/rss/articles/CBMiYGh0dHBzOi8vd3d3LnZvZ3VlYnVzaW5lc3MuY29tL2Zhc2hpb24vbHZtaHMtdG9sZWRhbm8tbmFtZWQtY2hhaXItb2YtbGVhZGluZy1wYXJpcy1mYXNoaW9uLXNjaG9vbNIBAA?oc=5&hl=en-US&gl=US&ceid=US:en,"To receive the Vogue Business newsletter, sign up here.

Paris fashion school Institut Français de la Mode (IFM) is adding some of luxury's biggest names to its board. LVMH’s Sidney Toledano has been named chairman, and Anne Dellière, Richemont’s group marketing and strategic plan director, as vice chair.

Toledano will succeed André Beirnaert, who did not renew his contract with IFM. Toledano previously held multiple roles at Dior, and was appointed chairman and CEO of LVMH-owned Christian Dior Couture before later being named VP, managing director and board member.

Read More With Paris fashion school, French fashion aims to grow its soft power Luxury industry’s CEOs turn out for the inauguration of the new campus of Paris’s Institut Français de la Mode.

In 2018, he was appointed chairman and CEO of LVMH Fashion Group, and became a member of the LVMH executive committee. He also sits on the executive committee of Fédération de la Haute Couture et de la Mode, the French fashion industry’s governing body.

“I am committed to putting my experience and my vision of fashion at the service of the younger generations. I am deeply committed to the transmission of knowledge and the central role of education,” a statement from Toledano reads. “Bringing together and developing talents from all over the world in Paris, in management as well as in design and craftsmanship, is essential for our industry.”

Education is one area where luxury’s rivals join forces. In November, a number of luxury CEOs came together for the inauguration of IFM’s new campus, including Toledano, Chanel fashion president Bruno Pavlovsky and Hermès executive vice president Guillaume de Seynes, who joined France’s minister for the economy and finances Bruno Le Maire, as well as IFM dean Xavier Romatet.

Sources told Vogue Business in March that Bruno Pavlovsky, president of Chanel Fashion and Chanel SAS, is the prime candidate to succeed Ralph Toledano as president of the Fédération de la Haute Couture et de la Mode.

Comments, questions or feedback? Email us at feedback@voguebusiness.com.

More from this author:

London Fashion Week: Smaller, buzzy June event here to stay

Farfetch to accept crypto payments

Emilio Pucci appoints Saar Debrouwere as CEO"
LVMH eyes India's burgeoning beauty market with investment in Sugar Cosmetics - Premium beauty,"Fri, 03 Jun 2022 07:00:00 GMT",https://news.google.com/rss/articles/CBMiR2h0dHBzOi8vd3d3LnByZW1pdW1iZWF1dHluZXdzLmNvbS9lbi9sdm1oLWV5ZXMtaW5kaWEtcy1idXJnZW9uaW5nLDIwNDE50gEA?oc=5&hl=en-US&gl=US&ceid=US:en,"Sugar Cosmetics, a cult favourite beauty brands amongst Gen Z and Millennial consumers in India, and one of the country’s largest beauty companies, has closed USD 50 million Series D fundraise led by the Asia fund of L Catterton.

“The upsized round saw strong interest from multiple private equity funds with continued participation from existing investors - A91 Partners, Elevation Capital, and India Quotient - firmly placing the company on track to further capitalize on its growth momentum in the rapidly expanding beauty and personal care market in India,” said L Catterton, a global private equity firm part-owned by LVMH, in a statement.

Omnichannel model

Sugar Cosmetics offers an extensive portfolio of beauty products across the lips, eyes, face, nails and skin categories and has more than quadrupled sales over the past three years. Products are sourced from suppliers in Germany, Italy, India, USA and Korea, and are sold online and through a network of 40,000 retail outlets across 550 Indian cities. “The company’s effective use of new-age, impact-focused content marketing has helped it develop lasting emotional connections with a diverse range of consumer cohorts,” highlighted L Catterton.

L Catterton, which is mostly focused on middle market companies and emerging high-growth enterprises, intends to build on their strategic relationship with LVMH to help Sugar Cosmetics to embark on their next stage of growth amid the expansion of India’s beauty and personal care market. L Catterton has significant experience investing globally in the beauty and personal care industry. Their current and past investments in the space include Il Makiage, Intercos, The Honest Company, Tula, Bliss, CI Flavors, Elemis, Etvos, Function of Beauty, Marubi, Merit, and Sociolla, among others.

Burgeoning cosmetics market

“The move comes at a time when the Indian cosmetics and toiletries market is at an inflection point,” commented Bobby Verghese, Consumer Analyst at GlobalData.

Driven by consumers who are increasingly making cosmetics and skincare a part of their daily repertoire and experimenting with different types of products, India’s beauty and personal care market has expanded considerably over the past five years. Rising adoption of online shopping and greater product penetration in secondary cities are also contributing to the market’s enlargement.

According to GlobalData, sales of beauty products grew by 5.6% CAGR [1] during 2015-2020, with value sales rising from US 11.1 billion in 2015 to USD 14.6 billion in 2020, when COVID-19 arrived. With the pandemic restrictions easing gradually, GlobalData forecasts the cosmetics and toiletries sales in India to grow by 7.2% CAGR over 2020-2025 to reach USD 20.6 billion in 2025.

“Startups such as Sugar Cosmetics and Nykaa are well positioned to tap the fast-paced growth in online beauty retail through their mastery of the omnichannel distribution model,” conluded Verghese."
Luxury Daily - Luxury Daily,"Thu, 16 Jun 2022 07:00:00 GMT",https://news.google.com/rss/articles/CBMiVmh0dHBzOi8vd3d3Lmx1eHVyeWRhaWx5LmNvbS9kYXlzLXdyYXAtbHZtaC1rZXJpbmctbWFyaWUtY2xhaXJlLWRhdmlkLXl1cm1hbi1hbmQtc2Vjb28v0gEA?oc=5&hl=en-US&gl=US&ceid=US:en,"News briefs

LVMH CEO Bernard Arnault and Toshi CEO Sojin Lee. Image credit: LVMH

Luxury Daily’s live news for June 16:



LVMH announces 2022 Innovation Award winners

French luxury conglomerate LVMH Moët Hennessy Louis Vuitton has chosen the winners of the sixth LVMH Innovation Award, celebrating startups with solutions that can impact the future of luxury.

Kering, Marie Claire launch responsible fashion campaign

French luxury conglomerate Kering is collaborating with women’s fashion magazine and media brand Marie Claire on a global initiative centered on responsible fashion.

David Yurman welcomes first chief of people and strategy

U.S. jeweler David Yurman is focusing on growth by hiring its first chief of people and strategy.

Secoo debuts Black Card service for high-end clients

Chinese ecommerce retailer Secoo is introducing a new lifestyle offering to turn its clients into spokespeople.

Please click here to read the morning newsletter"
Louis Vuitton's Shifting Celebrity Strategy | BoF - The Business of Fashion,"Tue, 07 Jun 2022 07:00:00 GMT",https://news.google.com/rss/articles/CBMiXWh0dHBzOi8vd3d3LmJ1c2luZXNzb2ZmYXNoaW9uLmNvbS9hcnRpY2xlcy9sdXh1cnkvbG91aXMtdnVpdHRvbnMtc2hpZnRpbmctY2VsZWJyaXR5LXN0cmF0ZWd5L9IBAA?oc=5&hl=en-US&gl=US&ceid=US:en,"In the high stakes business of celebrity dressing, what makes for a perfect match between a star and a fashion brand?

Louis Vuitton womenswear designer Nicolas Ghesquière and actress Jennifer Connelly have developed a close friendship over the years; he’s dressed her for dozens of red carpets and other appearances in dazzling, if sometimes polarising, custom designs.

But the relationship really paid off at this year’s Cannes Film Festival, when she wore his textured-metallic gown to the premiere of “Top Gun: Maverick.”

Connelly, with her hair pulled back, looked regal in the armour-like bodice, a can’t-forget moment that will forever be associated with a film that could prove to be her biggest hit ever. In its first weekend, the “Top Gun” sequel, starring Tom Cruise, took home an estimated $151 million at the box office in North America, blowing predictions out of the water.

ADVERTISEMENT

To be sure, there are big names in Louis Vuitton’s celebrity mix. But while Dior goes for shock and awe (Jennifer Lawrence, Rihanna) and Chanel leans heavily on the ingénue (Margaret Qualley, Lily-Rose Depp), since Ghesquière’s arrival in 2013, Vuitton has favoured thinking person’s stars in line with the designer’s mission to elevate the brand, like “La La Land” star Emma Stone, Léa Seydoux — a Bond girl with indie film cred — and Alicia Vikander, who won an Oscar in 2016 for her performance in “The Danish Girl,” but is just as believable in a genre film like the “The Green Knight.”

As a result, Vuitton’s red carpet strategy has driven fewer mentions on social media, where the success of celebrity tie-ups are typically measured, than its two biggest competitors. Since 2013, the brand has earned 86,500 mentions around the Academy Awards, compared to 168,000 for Chanel and 241,000 for Dior, according to tracking firm Brandwatch, mostly because Chanel and Dior’s stars tend to be bigger and are nominated for — and win — more Oscars.

Looks worn by Louis Vuitton ambassadors Jennifer Connelly and Deepika Padukone at the 2022 Cannes Film Festival illustrate the brand's dueling red-carpet strategies. (Getty Images)

And yet, despite the relative subtlety of its approach, Vuitton has managed to ramp up the conversation around its red-carpet appearances over the past four years. Its best Academy Awards performance happened back in 2016 when Vikander won for Best Supporting Actress in a Ghesquière design. But even without a Vuitton-dressed star landing on the stage in recent years, chatter has steadily grown (with a slight drop-off in 2022), whereas Chanel and Dior’s spikes are higher, but growth is not as steady.

However, as the influence of the American film industry wanes, with fewer people going to the movies and watching Hollywood awards shows, Vuitton appears to be shifting its strategy.

The brand now dresses a wider range of celebrities, from TikTok star Charli D’Amelio to Julia Roberts. In April, it signed 18-year-old “Stranger Things” star Millie Bobby Brown as an ambassador. At Cannes, it wasn’t Connelly but Bollywood superstar Deepika Padukone — who became Vuitton’s first Indian ambassador earlier this year — who generated a whopping seven out of the top 10 posts mentioning the brand, helping the LVMH-owned juggernaut earn more than $20 million in media value, according to tracking firm Launchmetrics.

What’s behind Vuitton’s celebrity success? And will its new approach prove as effective?

Big Budgets

While many brands deny that they pay celebrities to wear their wares, they often do. For the biggest stars, this typically takes the form of brand ambassadorships, which often include advertising campaigns as well as contractual commitments to wear a brand’s looks publicly. That’s on top of striking deals with stylists, who frequently charge brands fees of several thousand dollars a day to ensure their dresses make it onto the red carpet.

Big marketing budgets certainly help. And Louis Vuitton, which generates more revenue a year than any other luxury label, can simply afford to outspend most of its competitors. (That’s on a playing field where in the US alone, Louis Vuitton, Chanel and Dior spent a combined $44 million on print and online advertising in the first quarter of 2022, according to research firm MediaRadar.)

ADVERTISEMENT

How much of Vuitton’s marketing budget goes to celebrities each year? That depends on who’s on the current roster. If a major star suddenly becomes available, the budget can be found.

But big budgets aren’t everything.

Lots of Bets on Rising Stars

South Korean actress Bae Doona at Louis Vuitton's 2023 Cruise show in La Jolla, California. (Getty Images)

Louis Vuitton has a robust scouting system. This means it’s poised to jump on new talent quickly, placing plenty of bets on stars it believes are set to rise. (At the 2022 Met Gala, the brand dressed 11 people. At the 2022 Oscars, it dressed eight.)

“They do a good job of collecting ambassadors,” said Heather Cocks, red carpet commentator and co-author of the celebrity fashion blog Go Fug Yourself. “They roll the dice more frequently.”

Often, these early bets evolve into something bigger. (Millie Bobby Brown wore Vuitton several times before officially signing with them this year.) However, it doesn’t always work. Jennifer Lawrence look-a-like Haley Bennett was positioned as the next big thing in the mid-2010s, with Louis Vuitton dressing her even before any of her high-profile films were released. While she has appeared in films since, she is not yet a bonafide star.

Loyal Relationships

Chloë Grace Moretz, Jennifer Connelly and Alicia Vikander with Nicolas Ghesquière in Paris in 2019. (Getty Images)

Connelly, Vikander and Stone are super-famous, but as their careers have ebbed and flowed, Vuitton has continued to work with them, even when they weren’t in the headlines. That continuity has a lot to do with Ghesquière’s personal relationships with each actress.

Top brands like Vuitton work with their biggest stars for five or 10 years, sometimes longer — fragrance advertisements may run for decades — but industry sources say that Ghesquière in particular pounds the pavement to ensure these partnerships feel genuine, not only building friendships with the stars but also their stylists by spending time in Los Angeles, where most of them live. (The designer has such strong ties to the city that he recently bought an $11 million John Lautner house in the Hollywood Hills.)

He does this through private, one-on-one meetings, but also by staging events that garner media coverage, like the recent pre-Oscars party at hotspot Gigi’s that was hosted by W magazine and sponsored by Vuitton.

ADVERTISEMENT

Brand Over Dress

Celebrity Sightings In New York City - May 24, 2022 Jennifer Connelly showing off a Louis Vuitton bag at a television appearance in May 2022 on the promotion tour for ""Top Gun: Maverick."" (Raymond Hall/GC Images)

Vuitton’s heritage as an accessories brand, not a couture house, is a weakness when it comes to celebrity dressing. Unlike Chanel, for example, Vuitton’s red carpet look lacks a clear signature: most consumers can’t easily spot a Vuitton gown. And on the red carpet, the brand oscillates between Ghesquière’s adventurous, space-age aesthetic and stars’ frequent preference for classically glamorous and sexy silhouettes. But Vuitton makes up for this by wrapping its celebrities in a bigger brand package that goes beyond a mere dress.

While longtime ambassadors Connelly and Vikander tend to wear runway or runway-inspired looks, at this year’s Oscars, Alana Haim’s white-beaded Vuitton gown was almost unidentifiable. And yet, the “Licorice Pizza” actress had been wearing (and talking about) Vuitton so much on her promotional tour for the film that the association stuck. The glossy advertisements featuring many of the brand’s top ambassadors are also extremely memorable, which helps to further cement the association. It’s less about a specific look and more about the whole package.

“There are very few brands that have such a strong identification between actress and product and brand,” said Stefano Tonchi, the former editor of W magazine. “They become a part of Louis Vuitton.”

A Strategy Shift

Actor Timothée Chalamet in a Louis Vuitton design at the 2022 Academy Awards. (Getty Images)

After years of steady success, Louis Vuitton appears to be broadening its approach to celebrity dressing with an eye on new geographies and the next generation.

In May, at its cruise show at the Salk Institute in La Jolla, California, about 100 miles south of Hollywood, the more than 20 notables included mainstays Seydoux and Chloë Grace Moretz, but also newly minted model Eve Jobs (daughter of the late Apple founder Steve Jobs), Thai actress Urassaya Sperbund, director Ava DuVernay and South Korean star Bae Doona. At the Met Gala, the brand made noise for dressing YouTube star Emma Chamberlain.

At this year’s Oscars, actor Timothée Chalamet’s sequined black suit, pulled from Ghesquière’s Spring 2022 womenswear collection and worn shirtless, was one of the most talked-about looks of the evening, suggesting that the brand has scope to go younger and more “pop” while maintaining its exclusivity.

Vuitton’s recent bets on a broader range of celebrity partners could create confusion for the consumer. Who is the Louis Vuitton archetype? Is it Connelly in a space-age sheath, Padukone in a classic ball gown or Chalamet in a shirtless tux?

With Ghesquière’s brand elevation mission broadly accomplished after nine years at the house, growing attention in new markets and with Gen-Z may increasingly be the name of the game.

“If attention and discussion is a goal, give the people something to talk about,” said Kellan Terry of Brandwatch, referring to Chalamet’s Oscars-night look. “It also didn’t hurt that he is a massive star and the face of a huge blockbuster.”

However, more people to dress also means more outfits to produce. At the Met Gala, the brand positioned its “no new dresses” policy as a sustainability statement, but not making new garments also meant saving hundreds of thousands of dollars.

Meanwhile, Connelly’s recent string of appearances — she wore Louis Vuitton twice on the red carpet at Cannes, then again for late-night television spots — are more representative of the failsafe strategies Vuitton has been using for years, suggesting that the brand is betting on a blend of the old and the new to keep its celebrity strategy competitive.

Disclosure: LVMH is part of a group of investors who, together, hold a minority interest in The Business of Fashion. All investors have signed shareholders’ documentation guaranteeing BoF’s complete editorial independence."
"Worn by A$AP Rocky, working with Dior, LVMH Prize winner – Erl is on the up - South China Morning Post","Fri, 10 Jun 2022 07:00:00 GMT",https://news.google.com/rss/articles/CBMic2h0dHBzOi8vd3d3LnNjbXAuY29tL2xpZmVzdHlsZS9mYXNoaW9uLWJlYXV0eS9hcnRpY2xlLzMxODA5NjgvZGlvci1jb2xsYWJvcmF0aW9uLWFuZC1leHBvc3VyZS1hYXAtcm9ja3ktZXJsLWZhc2hpb27SAXNodHRwczovL2FtcC5zY21wLmNvbS9saWZlc3R5bGUvZmFzaGlvbi1iZWF1dHkvYXJ0aWNsZS8zMTgwOTY4L2Rpb3ItY29sbGFib3JhdGlvbi1hbmQtZXhwb3N1cmUtYWFwLXJvY2t5LWVybC1mYXNoaW9u?oc=5&hl=en-US&gl=US&ceid=US:en,"Thanks to the involvement of Dover Street Market Paris, or DSMP, Russell Linnetz (who is based in Los Angeles, where he grew up) didn’t have to worry about any of that. The brand development group was established by Comme des Garçons CEO Adrian Joffe to support and distribute independent labels such as Youths In Balaclava and Vaquera.

While many young designers excel at putting out clothes that look great and attract buzz, they often struggle with the business back end – from sourcing materials and finding the right factories to producing garments and distributing them.

When Eli Russell Linnetz founded Erl in 2018, he had a luxury that few independent fashion designers have: he was able to delegate the difficult matters that can make or break a small fashion company and focus solely on the creative side.

The brand got a huge boost in September 2021, when rapper A$AP Rocky showed up to the Met Gala in new York in a multicoloured quilted blanket from the label.

Dior’s spring 2023 collection shown at Venice Beach. Photo: Eric Staudenmaier

Earlier this year, Erl collaborated with Dior Men’s artistic director Kim Jones for the French brand’s spring 2023 collection, which was shown a stone’s throw away from where Russell Linnetz lives, and exposed him to the inner workings of a big brand.

“It started over direct messages and, before you knew it, the whole design team was in Venice Beach,” says Russell Linnetz. “Seeing Kim work with his team and how he delegates creativity was really inspiring, and this experience showed me the power of commerce and how you can use business to tell bigger stories.”

Eli Russell Linnetz at the LVMH Prize awards presentation in Paris, June 2022.

Russell Linnetz never trained as a designer and came to fashion almost by chance. “I went to school as a screenwriter, to make movies. For me, it was always about telling a story, whether it was a music video or stage design,” he says in an interview in Paris after winning the Karl Lagerfeld Prize, part of the annual LVMH Prize awards.

The awards are given every year by luxury group LVMH – the company behind brands such as Dior and Louis Vuitton – to support small, independent creators.

The filmmaker had worked with musicians such as Kanye West and Lady Gaga, and it was only after a collaboration with Comme des Garçons for a fragrance campaign and a conversation with Joffe that Erl (the letters stand for the designer’s initials) was born.

Russell Linnetz at the LVMH Prize awards presentation in Paris, June 2022. He never trained as a designer and came to fashion almost by chance.

It’s tempting to view the unisex, laid-back label as yet another brand joining the streetwear bandwagon, but Russell Linnetz doesn’t like to define it that way.

“I don’t think in categories like streetwear. For me, it’s creating stories and characters,” he says. “I don’t think about how people see it.”

Los Angeles – particularly, Venice Beach where Russell Linnetz was born and lives – play a big role in the aesthetics of the brand, which Russell Linnetz calls “intimate, colourful, approachable and fun”.

Erl sweatshirt, available on Mr Porter.

Think bright colours, easy silhouettes, fun patterns, genderless separates such as hoodies and sweatshirts, cosy knitwear and floral-print shirts.

“Being from LA, where movies are so important, there’s that element of storytelling in my collections,” he says.

“I was born and raised in Venice Beach, which is very laid-back, and people want to be comfortable and are easy-going.”

Russell Linnetz of fashion label Erl. “I don’t feel like I’ve made it. I’m never satisfied,” he says.

Russell Linnetz is more than ready to tell bigger stories. Erl is available in about 250 stores around the world and the brand is planning to open a shop in Paris this year.

Winning the Karl Lagerfeld Award, which comes with a €150,000 (US$160,000) cash prize plus mentoring from LVMH executives, is likely to propel the rise of the label. Russell Linnetz admits that, in spite of the support of DSMP and recent accolades, there’s a lot of work to be done (hiring a CFO is next on his to-do list).

“Just because someone’s helping with production it doesn’t mean it’s going to be successful,” he says. “I don’t feel like I’ve made it. I’m never satisfied. I already have fittings tomorrow.”

He adds: “The exciting thing is that, after I finish a collection and take ownership of it, I don’t want to see it any more and I just shift gears. It takes a manic personality to do this.”"
