Titre,Date de publication,URL,Contenu,sentiment_finbert,sentiment_label,sentiment_score,sentiment_numerique
Designs on a new 'single glass' market: Domaine Chandon's $2 million makeover - The Australian Financial Review,"Tue, 26 Dec 2017 08:00:00 GMT",https://news.google.com/rss/articles/CBMigAFodHRwczovL3d3dy5hZnIuY29tL3Byb3BlcnR5L2NvbW1lcmNpYWwvZGVzaWducy1vbi1hLW5ldy1zaW5nbGUtZ2xhc3MtbWFya2V0LWRvbWFpbmUtY2hhbmRvbnMtMi1taWxsaW9uLW1ha2VvdmVyLTIwMTcxMjI2LWgwYTY1MdIBAA?oc=5&hl=en-US&gl=US&ceid=US:en,"To tap the demand, which Ms DeVenny said had been growing over the past five years, the renovation expanded the existing tasting bar with a ground-level lounge for casual visitors that was physically separate from the cellar door experience offered to the traditional tourist market. Previously the two distinct groups of visitors had all mingled in the one area.

""We get it all, unfortunately – or fortunately,"" she said. ""We certainly get tour groups and what we did was we created an upstairs space, like a mezzanine space, where they can have the hosted master class experience and people that are downstairs, don't get inundated by a group of 10, 12 people coming through at a time.""

The change of focus marked a challenge for a consumer goods company such as LVMH, said architect Adele Winteridge​, a director of Foolscap Studio, who led the redesign.

""For LVMH it is a struggle for them to go 'We'll spend money on hospitality',"" Ms Winteridge said. ""It's not their core business. But they're starting to come around to this idea.""

'Cellar doors are changing': Estate Director of Domaine Chandon Australia Shaine De Venny.

In part, the change was forced. The winery was struggling to efficiently manage the different groups from the more than 250,000 visitors it received per year.

Advertisement

""They had quite few functional issue with space as it was,"" Ms Winteridge said. ""Essentially they were getting a huge influx of people on the weekends and at certain times of the year. It wasn't able to deal with that amount of people.""

It's a redesign that also puts retail right at the centre of the experience. But having borrowed from the merchandising lessons of other products in the LVMH stable, such as watches, perfumes and handbags, Domaine Chandon went for the more subtle approach of well-curated displays.

""We didn't want to create a wine store,"" Ms DeVenny said. ""We're not a bottle shop. What we wanted to do was hero it, give information and almost allow people to browse the space like a bookstore… rather than having pallet loads of cartons on the floor.""

Less bottle shop, more boutique: Merchandising at the renovated winery borrows from the retailing lessons of LVMH's watches, perfumes and handbags.

The next step in the winery's transformation to tap the changing market, which Foolscap is currently working on, is a self-guided tour of the facilities that doesn't focus on the traditional educational process of how sparkling wine is produced, but is more brand-focused - and instagrammable.

""It's not the museum piece, it's something else,"" Ms Winteridge said. ""It might have a photo booth, where you take photos of yourself in Paris with a glass of fizz with your friends. That's coming up.""","{'label': 'Neutral', 'score': 0.9997853636741638}",neutral,0.9997853636741638,0
