Titre,Date de publication,URL,Contenu,sentiment_finbert,sentiment_label,sentiment_score,sentiment_numerique
L Catterton Acquires Majority Stake in Ganni - The Business of Fashion,"Thu, 14 Dec 2017 08:00:00 GMT",https://news.google.com/rss/articles/CBMiYGh0dHBzOi8vd3d3LmJ1c2luZXNzb2ZmYXNoaW9uLmNvbS9hcnRpY2xlcy9maW5hbmNlL2wtY2F0dGVydG9uLWFjcXVpcmVzLW1ham9yaXR5LXN0YWtlLWluLWdhbm5pL9IBAA?oc=5&hl=en-US&gl=US&ceid=US:en,"Ganni, the Danish mid-market label beloved by influencers and editors alike, is going global with the help of a top-tier strategic partner. L Catterton, the consumer-focused private equity firm whose shareholders include LVMH and Groupe Arnault, the family holding company of LVMH chairman Bernard Arnault, has acquired a 51 percent stake in the brand. The terms of the transaction were undisclosed.

“I felt we had taken Ganni to a point where we needed to look for a partner, and that would be someone who would take what we are good at and try to leverage that on an international scale,” said Ganni chief executive Nicolaj Reffstrup. “Trying to build an international brand out of Copenhagen is pretty tough… We are at a certain size where it doesn’t make sense to look for basic capital or minority investment; we needed a partner.”

Ditte and Nicolaj Reffstrup | Source: Oscar Meyer Ditte and Nicolaj Reffstrup | Source: Oscar Meyer

Ditte and Nicolaj Reffstrup | Source: Oscar Meyer

Ganni was founded by Frans Truelsen in 2000. Reffstrup and his wife Ditte, Ganni’s creative director, took control of the brand in 2009 when it was a mostly cashmere line turning over about 1 million euros per year and transformed it into a trendy label known for its sweet-spot pricing and playful mash-up of styles, trends and colours. The brand will generate around $45 million in sales in 2017 and expects revenues to grow by 50 percent in 2018.

ADVERTISEMENT

Instagram has been key to Ganni’s success. While the brand has a small following by international standards — 313,000 followers — its Danish model and It-girl fan base has a wide and influential reach. “It’s a very relevant group of followers and a lot of them feel that this ‘Ganni Girl’ concept resonates well with them,” said Reffstrup, referring to the #GanniGirls hashtag coined for the label’s followers by model Helena Christensen in 2015.

In L Catterton, Ganni has found an experienced partner that will help it expand in Europe, the United States and Asia. The private equity firm has invested in Gentle Monster, Gant, SMCP (Sandro Maje Claudie Pierlot) and Giuseppe Zanotti, among other fashion brands.

“They have unique knowledge of how to build global super brand,” said Reffstrup, adding that the firm's links to the LVMH Group and Groupe Arnault will also be valuable. “Quite frankly, we left a lot of money on the table because we wanted to go with the right partner, rather than the best price point.”

Moving forward, Reffstrup said Ganni will continue to take a “multi-dimensional” approach to growth, opening stores at a “moderate pace” of 5 to 6 locations per year. The label currently has 21 of its own stores in Scandinavia, as well as a thriving e-commerce business and a wholesale network of over 400 doors. “We are still in many ways a niche brand,” he said. “The US is definitely a priority because we sense that the brand resonates extremely well with the market.”

“Ganni has already established its strong international appeal, as demonstrated by its retail presence in 20 countries today,” wrote Eduardo Velasco, partner at L Catterton, over e-mail. “But the brand’s digitally driven strategy and strong e-commerce platform makes its potential for global growth even more exciting… With local offices around the globe, we are also able to provide on-the-ground operational expertise to help support and tailor the brand’s strategies in specific local markets.”

Ganni | Source: Ana Kras Ganni | Source: Ana Kras

Ganni | Source: Ana Kras

Culling its stockists is key to Ganni's strategy, too. This season, Reffstrup says Ganni will drop about 100 wholesale accounts— including one he declined to name that represented 10 percent of total sales — because it no longer provided the right brand adjacencies. With prices ranging from $50 for a t-shirt to over $2,000 for outerwear and wide-ranging collections covering dresses, knitwear shoes and lingerie, Ganni is often more accessibly-priced than other brands available at its wholesale partners. Its key partners include Net-a-Porter, Browns and Selfridges, in addition to independent boutiques such as Uzwei in Hamburg, Elise Walker in Los Angeles, Boutique 1 in Dubai and London and Theresa in Munich.

Wholesale currently accounts for two-thirds of Ganni’s sales. “The longterm plan is to balance that out,” says Reffstrup. “We do not expect to grow aggressively over the years. We are going to slow down slightly relative to our size.”

ADVERTISEMENT

Ganni will also benefit from L Catterton’s merchandising expertise. “We are not born retailers,” explained Reffstrup. “There is a lot that they can teach us about increasing the units per transaction by putting together a better merchandise offering.”

While Ganni plans to open new offices in London and New York, the company will remain headquartered in Copenhagen, its spiritual home, known for the mix-and-match style that has been a key inspiration. Pursuing scale while retaining Ganni's unique brand DNA, therefore, is a balancing act that Reffstrup knows is a challenge: “We only have very few examples of fashion companies [here] that have grown to a certain size.”

“As with any rapidly growing global brand, the key is effectively managing that growth and preserve the brand’s strong foundation,” added Velasco via email. “As Ganni continues to successfully expand in new and existing markets, L Catterton will ensure the team has the tools to maintain the high quality, contemporary style and fantastic customer experience that Ganni’s customers have come to love.”

Related Articles:

[ How Ganni Reinvented Scandinavian StyleOpens in new window ]

[ With $2 Billion IPO Under Belt, SMCP Plots China GrowthOpens in new window ]","{'label': 'Neutral', 'score': 0.9999321699142456}",neutral,0.9999321699142456,0
Alexandre Arnault & RIMOWA's Continued Relevance - HYPEBEAST,"Thu, 14 Dec 2017 08:00:00 GMT",https://news.google.com/rss/articles/CBMiQGh0dHBzOi8vaHlwZWJlYXN0LmNvbS8yMDE3LzEyL2FsZXhhbmRyZS1hcm5hdWx0LXJpbW93YS1sYS1wb3AtdXDSAQA?oc=5&hl=en-US&gl=US&ceid=US:en,"Alexandre Arnault isn’t much older than most fans queuing every Thursday for Supreme drops. However, as the son of LVMH chairman Bernard Arnault, the 25-year-old already has more business experience than most mid-twenty-somethings. As the CEO of luggage label RIMOWA, Arnault has focused on expanding the brand’s global reach and making it equally desirable as other LVMH lines. At the new RIMOWA pop-up in Los Angeles, he discussed the brand’s next moves.

On the topic of the brand’s old stores — its LA branch is currently undergoing renovation — Arnault explained, “We want to modernize our stores and make them more — it’s going to sound like every other brand — but more experiential.” In that vein, Arnault aims to continue opening RIMOWA pop-ups; “Pop-ups are very exciting because they allow you to test things that you can’t do in more permanent places, and then I think also it’s a cool way to … launch new products, to launch new collections.” The brand also aims to become a one-stop-shop for travelers: the pop-up offers pressed juice, fashion magazines and essential goods like pens. Furthermore, RIMOWA is integrating technology into its suitcases to allow for more ease on the road, like an electronic tag feature that allows users to digitally display their luggage tag on the case instead of having to print one out.

Check out the entire dialogue on Fashionista. Meanwhile, UNITED ARROWS recently announced a collaboration centering around an all-black RIMOWA luggage.","{'label': 'Neutral', 'score': 0.999812662601471}",neutral,0.999812662601471,0
"Phoebe Philo, the world's leading feminist fashion designer, is stepping down from Céline - Quartz","Fri, 22 Dec 2017 08:00:00 GMT",https://news.google.com/rss/articles/CBMia2h0dHBzOi8vcXouY29tL3F1YXJ0enkvMTE2NDM0NS9jZWxpbmVzLXBob2ViZS1waGlsby10aGUtd29ybGRzLWxlYWRpbmctZmVtaW5pc3QtZmFzaGlvbi1kZXNpZ25lci1zdGVwcy1kb3du0gEA?oc=5&hl=en-US&gl=US&ceid=US:en,"WWD confirmed this morning that Phoebe Philo, the British designer at the helm of Céline, will depart the label after presenting her final collection, for Fall 2018, in March. While the game of designer musical chairs between fashion labels has become commonplace, Philo’s exit after a decade marks the end of an era at the LVMH-owned fashion house, and for the world of women’s fashion overall.

LVMH doesn’t disclose revenues for individual labels, but Céline is widely understood to be a powerhouse, which Philo roughly quadrupled in size over her tenure, buffeted by a host of hit handbags.

Advertisement

But Philo’s legacy at Céline will go far beyond her impacts on LVMH’s bottom line.

At Céline, she changed the way women dressed by recognizing and respecting that women don’t have to wear their power in a way that’s loud, or overtly sexual. The oversized camel coats, lofty turtleneck sweaters, modern jewelry, and white Stan Smiths that have become a uniform for urbane women globally? That’s all Philo. Her looks on the runway—and the outfits she wore to take a bow after her shows—were widely imitated by admirers and fast-fashion imitators. It’s hard to imagine that the accessible, menswear-inspired looks that have filled Zara’s women’s department over the last several years would have existed without Céline’s influence.

Advertisement

And the shoes! In addition to Céline’s oft-imitated block-heeled pumps and Philo’s own white Stan Smiths, the designer showed sandals and heels covered in fur that looked shorn from the back of a very luxe Muppet. They were funny—but they were also kind of fabulous. And without them, I might not be leaving the house today in burgundy shearling-lined Birkenstocks.

While Philo created clothes that powerful women—gallerists, bankers, and editors among them—long to wear, she herself became a role model for self-assured (and stylish) feminists who won’t apologize for putting themselves and their families first. (Philo shied away from the spotlight herself, but gave “Philophiles” everywhere something to swoon over when she put Joan Didion in her ads in 2015.)

As a designer at Chloé in 2005, Philo skipped a season for maternity leave—a phrase not commonly uttered then in the high fashion world—and then left altogether in 2006, for a two-year hiatus before joining Céline. With Céline, she moved the headquarters from Paris to London, where her family lived, and forewent a runway show in 2012 when she was expecting her third child. No word on Philo’s next moves, but WWD reports that she has no immediate plans to work for another label.","{'label': 'Neutral', 'score': 0.9999964237213135}",neutral,0.9999964237213135,0
"Drapers Top 100 2017 – 32. Bernard Arnault, chief executive, LVMH - Drapers","Fri, 15 Dec 2017 08:00:00 GMT",https://news.google.com/rss/articles/CBMiYWh0dHBzOi8vd3d3LmRyYXBlcnNvbmxpbmUuY29tL3Blb3BsZS9kcmFwZXJzLXRvcC0xMDAtMjAxNy0zMi1iZXJuYXJkLWFybmF1bHQtY2hpZWYtZXhlY3V0aXZlLWx2bWjSAQA?oc=5&hl=en-US&gl=US&ceid=US:en,"The boss of luxury powerhouse LVMH is a non-mover in this year’s Top 100. Arnault continues to oversee some of the world’s most powerful luxury houses, including Céline, Louis Vuitton and Christian Dior, and recently looked to a new generation of leaders in a reshuffle at the top of its fashion arm. Current Dior boss Sidney Toledano will replace Pierre-Yves Roussel as chairman and CEO of LVMH Fashion Group, while Roussel will become a special advisor to Arnault.

The French conglomerate launched new multi-brand ecommerce site 24 Sèvres in June. Based on LVMH’s Parisian department store Le Bon Marché, the site seeks to capitalise on the growing demand for luxury fashion online. Although it is still early days, 24 Sèvres has already impressed with its polished shopping experience, carefully curated selection and high-quality content.

LVMH also joined fellow luxury giant Kering in banning the use of super-skinny models on its fashion week catwalks. The companies have established a joint charter that states they will employ models who are size six and above.

Back to the Top 100","{'label': 'Neutral', 'score': 0.9999420642852783}",neutral,0.9999420642852783,0
Serial yacht owners: 3 billionaires transforming yachting - Yacht Harbour,"Thu, 07 Dec 2017 08:00:00 GMT",https://news.google.com/rss/articles/CBMiXGh0dHBzOi8veWFjaHRoYXJib3VyLmNvbS9uZXdzL3NlcmlhbC15YWNodC1vd25lcnMtLTMtYmlsbGlvbmFpcmVzLXRyYW5zZm9ybWluZy15YWNodGluZy0yMjY50gEA?oc=5&hl=en-US&gl=US&ceid=US:en,"











Building innovative yachts takes extensive, intimate knowledge of their use, only acquired at an owner's level, as well as large amounts of capital devoted to creating floating masterpieces. Yacht Harbour looks at some of the most inspiring billionaires from the superyacht space.





Bernard Arnault













Position: Chairman, LVMH





Net worth: $64 billion (2017)





Iconic in many ways, luxury conglomerate LVMH and its CEO, Bernard Arnault have long set a gold standard in the luxury world and yachting was no exception to this rule. In fact, Arnault's 101-meter yacht, Symphony is currently the largest Feadship ever built.





With a net worth currently valued at $64 billion by Forbes, Bernard Arnault's 33-year run shaping the luxury world through his Louis Vuitton Moet Henessy Group, took him to being the 2nd richest person in Europe and in the world's top 10 billionaires.





In yachting however, the 68 year-old Frenchmen is most well known for his involvement in the sector. His first major step into superyachts became the conversion of the 70-meter Amadeus into a luxury yacht from a research vessel in 2007.













Rebuilt at Jade Yachts in Taiwan, the transformation was overseen by Vripack to a design by Redmond Langton with Francois Zuretti creating the yacht's new interior. Accommodating up to 12 guests in a master suite spanning over the entire upper deck, a VIP suite on the main deck, and two guest and two twin cabins on the lower deck, she stretched over a total of five decks.





From a technical standpoint, the yacht is powered by twin Caterpillar engines letting the 70-meter yacht cruise for up to 16,400 nautical miles at a speed of 10.5 knots. In 2015, Arnault sold Amadeus, which was later renamed to Felix by its current owner.









Photo by Julien Hubert





Around the same time, Feadship delivered the 101-meter Symphony, the largest yacht it ever built. According to Marianne, Symphony was delivered to Maltese company, Sonata Yachting, a firm which LVMH disclosed was a fully owned subsidiary in its yearly report.





A common feature found across the two yachts are their golf tee located aft of the upper deck, which allows its guests to shoot specially designed, bio-degradable balls into the sea from the yacht. Designed by Tim Heywood, Symphony has a gross tonnage of near 3,000GT.









Photo by Julien Hubert





Arnault's interests in yachting however are not limited to his personal fleet. In 2008, LVMH led an acquisition of British yacht manufacturer, Princess Yachts from South African investor, Graham Beck in a transaction that amounted to just over €250 million. The deal then saw L Capital, a fund controlled by LVMH, gain a 70% controlling stake in Princess Yachts.





LVMH then continued its efforts to expand into yachting by acquiring Royal Van Lent, a shipyard part of Feadship, later that year in a deal that analysts put at around €400 million. The shipyard later went on to build the 101.5-meter Symphony and remains a part of LVMH's portfolio to this day.





Herb Chambers





Position : Chairman, Herb Chambers Companies





Net worth : $1,38 billion (2017)





Delivered in 2012 by Abeking & Rasmussen, the 60-meter Excellence V, one of the most voluminous yachts in her size, became her American's owner fifth superyacht. His fleet's next flagship, an 80-meter Abeking & Rasmussen is however still under construction.

Herb Chambers' first yacht became a 30ft Trojan fishing boat in 1970, he then upgraded to a 53ft Hatteras before starting his journey into the superyacht space with a 38.7-meter Feadship, Excellence. Launched in 1986, three years after Chambers sold his blooming copier sales business, A Copy, for $80 million, the yacht could reach 13.5 knots.





Later known as Golden Rule and last refitted in 2006, the yacht was sold by her new owners in 2011 at an asking price of $4.9 million. She was then renamed once again to Miss Iloilo in 2013.













Chambers next yachting project became an even larger Feadship, the 47.5-meter Excellence II launched in 1999. With an interior by Sam Sorgiovanni, the yacht had a beam of 8.9m and could reach a speed of 14.5 knots.





Later reportedly sold by Chambers to American businessman, Dennis M. Jones who renamed her to D'Natalin II, the yacht was then sold once again and renamed to Princess K. Now cruising under the name Princess Too, she was sold to her current owner in the summer of 2016 at an asking price of €15 million.













Launched this time by Abeking & Rasmussen in 2001, Excellence III became a 57-meter superyacht with an exterior by Donald Starkey designed with charter in mind. Praised for her comfortable seven cabin layout by guests, the yacht went on to have an inspiring charter record led by Chambers' long-time captain, Ray Shore.





Listed for sale in 2010 Excellence III was later sold in March 2012 asking $45,950,000. The popular charter yacht was then renamed to Dream following her sale and lengthened to 60-meters during her 2014 refit.













Chambers' subsequent project became a 78-meter Abeking & Rasmussen which was planned to take on the name Excellence IV. A few months into the build, Chambers received an offer to buy the yacht from a friend, which he decided to turn down.





Halfway through the build he however realised that such a project would prevent him from mooring in harbour such as Gustavia in St.Barts and Capri. When a Russian oligarch made another offer to buy the project at a profit for Chambers, the American businessman accepted. ""I did well on that one."" Chambers told Forbes. The yacht went on to become Eminence.













Following the sale, Chambers decided to take on another project at Abeking & Rasmussen building Excellence V, a 60-meter yacht with the interior volume and comfort of a 75-meter superyacht. Launched in 2011, she is now available for charter from €595,000 per week.













""There was a transition where it became a business for me"" Chambers told Forbes on his superyacht projects, ""I get more enjoyment out of building the boats than I do using them"". Chambers's Excellence IV, a 28-meter Pershing launched in 2014, might be the only exception to this rule as he keeps it for his personal use. The yacht was however listed for sale and is now asking $8,400,000.





Chambers, now owner of the Herb Chambers Companies, the largest automotive dealership group in New England, USA with over $2.5 billion in revenue in 2014, might however be on his most ambitious yachting project yet. Indeed, the American billionaire has commissioned an 80-meter project currently under construction at Abeking & Rasmussen, which he says will be a cross between M/Y A and a more traditional yacht.









Dennis Washington





Position : Chairman, Washington Companies





Net worth : $5,9 billion (2017)













Washington became acquainted with boating relatively late, according to one of his recent interviews, he stepped on a boat for the very first time in 1979, when he was 45 years old. His connection with the sea was however immediate, ""I just loved the sound of being out on the water and being so relaxed"" he told Forbes. Soon after, he purchased his first boat, the 25.9-meter Wanigan III for $150,000. What sets apart Washington from most yacht owners is his interest in refitting yachts up to his high standards. A year and a half after the purchase of the Wanigan III, he began to rebuild it and sold it a couple of years later.





In 1992 he purchased Chieftain, a 105ft tug built in Glasgow in 1929 that had escorted British WW2 ships and had remained under the British flag for nearly 60 years. Washington had the yacht shipped back to Vancouver by his port captain, Fred Larsson, and started a lengthy process to create the most tastefully decorated tug afloat. Washington in fact even announced that the newly named St. Eval would remain in the Washington family for perpetuity. St. Eval can now often be found moored in Washington's private marina in Vancouver.













Also docked in Vancouver is the 36.4-meter Abeking & Rasmussen, Impromptu, which Washington purchased from Boeing. Before serving as Boeing's corporate yacht as Daedalus, Impromptu was owned by beer magnate, August Busch. After learning that Boeing was looking to sell, he purchased and refitted the yacht, which he still owns to this day.













The first yacht to be named Attessa became yet another one of Washington's rebuild projects. After purchasing the 130ft Yecats built by Kong & Halvorsen in 1984, Washington lengthened the yacht to 142ft and renamed it to Attessa. The yacht later appeared in the movie ""Indecent Proposal"". It was then sold to George Argyros and renamed to Huntress before catching fire and sinking off the coast of Greece in 1998.





Washington's second Attessa became a Feadship launched in 1988 as Impromptu with a length of 43.4-meters. Following Washington buying the yacht in the 1990s, the yacht was extended by over 5 meters and renamed to Attessa II. The yacht was later reportedly sold to American billionaire, Wayne Huizenga who renamed her to Floridian. She then went through several changes of ownership until her current owners renamed the yacht to Mysorah and extensively refitted her once again.













Another vessel that is still part Washington's fleet to this day is Attessa III. Built by Feadship in 1998 as Lady Aviva for Joe Lewis, the 62-meter yacht caught fire in May 2000 in the Red Sea. With the owner and insurance company looking to get rid of it, Washington bought the superyacht and, after a 36-month long refit process at the Feadship De Vries shipyard, she reemerged as the fully rebuilt and extended 68m Attessa III. Completely transformed, Attessa III featured the largest composite extension in yachting history. Washington still owns the yacht to this day and keeps her on America's west coast.













Washington's most ambitious project however began just under two years later after Attessa III's launch. Having become aware that Taiwanese shipping billionaire, Chang Yung Fa was looking to sell his 91-meter Evergreen, Washington flew out to Taiwan to inspect the hull in 2007. ""Chairman Chang built the boat like a warship, but it was not attractive structurally. I thought it would be a great project."" he told Forbes. The American billionaire bought the yacht and sailed it to his Vancouver facility for a refit.













The refit process involved a new superstructure shape, interior layout, helipad and tender garage, which resulted in a completely new vessel. Lengthened by almost 10 meters, Attessa IV became the 24th largest in the world at the time of her relaunch in 2010. Amongst her standout features are a spa on the lower deck, a private cinema, a helipad and a multi-purpose room on the yacht's sundeck with a Chihuly chandelier under a glass dome.

The superyacht sector is, at its essence, a extremely small niche when one looks at absolute amounts, with barely 10,000 yachts over 24 meters in length. As a result, innovation in the sector requires drive and experience that only a few individuals in the world have been able to develop.","{'label': 'Neutral', 'score': 0.9999992847442627}",neutral,0.9999992847442627,0
