Titre,Date de publication,URL,Contenu
LVMH Inaugurates Hélios Beauty Research Center - WWD,"Mon, 18 Nov 2013 08:00:00 GMT",https://news.google.com/rss/articles/CBMiaWh0dHBzOi8vd3dkLmNvbS9iZWF1dHktaW5kdXN0cnktbmV3cy9iZWF1dHktZmVhdHVyZXMvbHZtaC1pbmF1Z3VyYXRlcy1uZXctYmVhdXR5LXJlc2VhcmNoLWNlbnRlci03MjgxNDgzL9IBAA?oc=5&hl=en-US&gl=US&ceid=US:en,"PARIS — Bernard Arnault is a very hands-on luxury titan — occasionally even having a hand in architecture.

That’s the case with LVMH Moët Hennessy Louis Vuitton’s new research facility for its fragrance and cosmetics activities, based just outside of Orléans, France. It is named after the Greek sun god, Hélios.

Officially inaugurated Monday when LVMH’s managing director Antonio Belloni snipped a ribbon, the triangular center comprises six, three-story buildings with a communal area at the center.

Arnault, LVMH’s chairman and chief executive officer, was involved in the project’s design, said Claude Martinez, president and ceo of Parfums Christian Dior.

From the outset, Arnault liked the shape, “which is quite unique because it favors and enhances the connection between the three key dimensions of what we are doing here, which is research, formulation and — [an element] getting more and more important — regulation,” said Martinez.

“He was really involved in the way we designed the roof,” said Martinez, of the transparent, skinlike structure. “[Arnault] was clearly involved in the facade, from the outside, and had the idea of having a second level of architecture.”

The 200,000-square-foot center in Saint Jean de Braye houses 250 research scientists from more than 20 disciplines, such as ethnobotany, which create some 1,200 products each year. It is focused primarily on the brands Parfums Christian Dior, Guerlain, Parfums Givenchy and Fresh — although other LVMH beauty labels are also involved.

LVMH invested between 30 million euros and 40 million euros, or $40.6 million and $54.1 million at current exchange, in its construction, according to the company.

Modern and streamlined in black, white and gray tones, the Arte Charpentier-designed building sits on a 55-hectare, or 135-acre, park and complies with France’s High Environmental Quality standard, which involves limiting the environmental impact a building has while ensuring its optimum interior living conditions. To build the structure, 200 trees were cut down but 450 were replanted, for instance.

From the central area, with its undulating roof, staircases lead up to the labs and there are steps downstairs, to a garden level where there is a library, forum and training or meeting rooms. Natural light floods into the entire building.

Raw materials are stored in its lowest level.

Hélios is located in the region know as “Cosmetic Valley,” which is also the name of a business cluster comprised of numerous beauty companies. With the organization, LVMH research will be working on a program that involves helping nurture some small and medium-size companies in the sector, and also includes Orléans University.

Hélios, which has been running since September, can accommodate up to 300 researchers.

New products generate between 20 percent and 25 percent of LVMH’s perfume and cosmetics revenues that in 2012 amounted to 3.61 billion euros, or $4.64 billion at average exchange. The division has about 200 patents and invests between 2.5 percent and 3 percent of its sales in research and development."
LVMH-Owned DFS Group Unveils T Galleria Hong Kong - Jing Daily,"Tue, 05 Nov 2013 08:00:00 GMT",https://news.google.com/rss/articles/CBMiTWh0dHBzOi8vamluZ2RhaWx5LmNvbS9wb3N0cy9sdm1oLW93bmVkLWRmcy1ncm91cC11bnZlaWxzLXQtZ2FsbGVyaWEtaG9uZy1rb25n0gEA?oc=5&hl=en-US&gl=US&ceid=US:en,"DFS' T Galleria location in Hong Kong. (Jenny Gao)

Last week, the world's leading luxury travel retailer DFS Group installed the new T Galleria—a rebranding first unveiled in September at its Waikiki location—to its three downtown stores in Hong Kong. In a celebration taking place in both its founding city and global headquarters, the LVMH-owned retail group hosted a preview day along with a ""T in Art"" showcase in conjunction with the Hong Kong Tourism Board and celebrity guest Daniel Wu.

Actor Daniel Wu at T Galleria's Hong Kong rebranding celebration. (Jenny Gao)

With 420 boutiques in 10 countries, DFS is the largest single retailer to Chinese consumers outside China, and of the $102 billion spent by travelers from China on international tourism in 2012, approximately 65 percent was shopping-related. This is no different in Hong Kong, where DFS stores in Tsim Sha Tsui East, Tsim Sha Tsui Canton Road, and Causeway Bay Hysan Place serve as retail havens for more than 18 million visitors a year, a majority of which are mainland Chinese. Together with the 48 retail spaces DFS operates at Hong Kong International Airport, the Group offers a comprehensive selection of categories, including beauty & fragrances, fashion & accessories, watches & jewelry, and wine & spirits.

At the Canton Road location in particular, DFS has recently enhanced its luxury brand selection with new renovations and offerings. In addition to opening several new boutiques, including DFS' first Tory Burch boutique in Hong Kong, the group has remodeled its beauty floor, adding personalized service options like its signature Beauty Concierge.

Philippe Schaus, CEO of DFS Group. (Jenny Gao)

Philippe Schaus, CEO of DFS Group, notes that these changes did not come overnight, but have rather been an evolution over time. ""The launch of T Galleria follows several years of significant upgrades to our global store network and the introduction of highly personalized services that today have made our Gallerias luxury retail destinations unto themselves.""

DFS's marketing campaign featured other aspects to draw the attention of mainland Chinese travelers. By partnering with the Hong Kong Tourism Board, which recognizes the importance of attracting Chinese tourists, DFS has unveiled a new art platform for tourism in the city called ""T in Art"", which features giant sculptures of ""T's"" placed within the popular tourist attraction Avenue of the Stars. Various iconic Hong Kong artists and entrepreneurs were invited to design their own ""T"", including film director Patrick Kong, hotelier Yenn Wong, and actor Daniel Wu, who was first to unveil his ""T"" when he joined DFS on the preview day.

At the press conference on October 28th, Jing Daily talked to Benjamin Vuchot, regional president of Asia North for DFS, to learn more about the company's strategies to cater to the needs of the affluent Chinese traveler abroad. ""In the last 10 years, the sophistication of the Chinese affluent consumer and traveler has really risen substantially. Whereas we previously only had customers from Tier 1 cities like Beijing and Shanghai, now we are seeing newly rich customers from Tier 2, 3, 4, and even 5. As they are in different stages of their experience and education in luxury shopping, we have the unique opportunity to help educate them, some of whom are first-time travelers.""

Actor Daniel Wu discusses T Galleria's ""T in Art"" campaign at the rebranding celebration. (Jenny Gao)

Mr. Vuchot adds that for the affluent Chinese customer, ""exclusivity and first access are important, as is the authenticity of provenance, which DFS is able to guarantee."" Other services include VIP member's lounges, where guests can relax and enjoy warm egg tarts, find out what's new, and receive a curated experience from private shoppers. ""Customer experience is key for us and we're in the unique position to offer a consistent high quality of service for our VIP customers abroad, whether it’s in Macau, Hong Kong, Waikiki.""

In Hong Kong, personal shoppers are up to date on events and restaurant openings around town to be able to curate an all-around travel experience for customers, and in LA, a partnership with AEG allows exclusive access to sports and entertainment events for VIP customers. ""Our biggest challenge is to always understand who our customer is, and our Chinese customer is constantly evolving and extremely savvy. By being attentive to their needs, we are able to work closely with our brand partners to offer the right mix of products and deliver a superior experience every time."""
"Hélios, LVMH's giant new super beauty lab - Telegraph - fashion.telegraph.co.uk","Tue, 19 Nov 2013 08:00:00 GMT",https://news.google.com/rss/articles/CBMibGh0dHA6Ly9mYXNoaW9uLnRlbGVncmFwaC5jby51ay9iZWF1dHkvbmV3cy1mZWF0dXJlcy9UTUcxMDQ1OTY0Mi9IZWxpb3MtTFZNSHMtZ2lhbnQtbmV3LXN1cGVyLWJlYXV0eS1sYWIuaHRtbNIBAA?oc=5&hl=en-US&gl=US&ceid=US:en,"Hélios, LVMH's giant new super beauty lab

LVMH is putting all its big beauty labs under one silver roof at Hélios, its super science research centre in the Cosmetic Valley

BY Katy Young | 19 November 2013

LVMH, Moët Hennessy Louis Vuitton, have proven its ""commitment to the luxury perfumes and cosmetics industry in France,"" with a brand new state of the art research facility for its beauty division. Think the cosmetics equivalent of CERN's Hadron Collider.

Named after Greek God Hélios - ""in reference to the sun, an integral part of research in cosmetology"" says the brand - the R&D centre will be home to 250 researchers from Parfums Christian Dior, Guerlain, Givenchy Parfums and Fresh all dedicated to ""research, development and expertise"" in beauty.

Located in Saint-Jean-de-Braye, known as the Cosmetic Valley, Hélios has been 13 years in the making, stands at six three- storey buildings strong and spans 55 hectares, making it one of the largest production sites in beauty France has. ""It is an unparalleled facility for developing products that will meet the highest standards of quality. This state of the art facility is representative of the strategy of the Group and our ambition to consistently reinforce and expand the savoir-faire behind our businesses in France,"" says Bernard Arnault, chairman and CEO of the LVMH Group.

READ - Paris Fashion Week: Marc Jacobs's last show for Louis Vuitton

Proving just how competitive, and fast moving, the beauty industry is today, LVMH says Hélios will be concentrating on processes to secure new patents in science. The centre will work in more than 20 fields of research in beauty, including molecular and cell biology, physical chemistry, ethnobotany, formulation and toxicology. Even the architecture, all created by Arte Charpentier, which takes on the form of a triangle around a central atrium, has been designed to foster innovation and creativity - so the pressure is on.

READ - Fashion sales weaken at LVMH

According to WWD , LVMH put between $40.6 million and $54.1 million into Hélios - as well as 450 trees to replace the 200 it had to remove to create space.

READ - Dior's new look Beauty Boutique

But when you consider that new products generate up to 25 per cent of LVMH's perfume and cosmetics revenue, the maths is simple. ""The inauguration of our new Hélios research centre is a very positive development for our Perfumes and Cosmetics businesses,"" says Arnault. Indeed."
Fashion firm Loro Piana eyes future after takeover - Yahoo Finance,"Tue, 05 Nov 2013 08:00:00 GMT",https://news.google.com/rss/articles/CBMiSWh0dHA6Ly9maW5hbmNlLnlhaG9vLmNvbS9uZXdzL2Zhc2hpb24tZmlybS1sb3JvLXBpYW5hLWV5ZXMtMTUyNzQ0MzUyLmh0bWzSAQA?oc=5&hl=en-US&gl=US&ceid=US:en,"In this photo taken on Monday, Sept. 10, 2013 Pierluigi Loro Piana gestures during an interview in Milan, Italy. Loro Piana, an Italian luxury textiles maker and fashion house, is so particular about its materials that it bought its own natural reserve in the mountains of Peru to protect the vicuna, an endangered species that yields a precious wool. Such master of the supply chain, which brings it to Myanmar to extract minuscule fibers from the lotus flower and Mongolia for baby cashmere, has earned it customers willing to pay $20,000 for a vicuna coat. It also caught the attention of the French luxury conglomerate LVMH, which this summer agreed to pay euro2 billion ($2.7 billion) for an 80 percent stake in the six-generation family-run company. (AP Photo/Luca Bruno)

MILAN (AP) -- Loro Piana, an Italian luxury textiles maker and fashion house, is so particular about its materials that it bought its own natural reserve in the mountains of Peru to protect the vicuna, an endangered species that yields a precious wool.

Such master of the supply chain, which brings it to Myanmar to extract minuscule fibers from the lotus flower and Mongolia for baby cashmere, has earned it customers willing to pay $20,000 for a vicuna coat. It also caught the attention of the French luxury conglomerate LVMH, which this summer agreed to pay 2 billion euros ($2.7 billion) for an 80 percent stake in the six-generation family-run company.

From Loro Piana's side, the deal was a bid for continuity by a family-run company facing a generational shift while reaching for scale for future growth.

""What we were concerned about is that the company would be able to develop, and we believe that through the collaboration with the LVMH group this goal can be easily achieved,"" Pier Luigi Loro Piana, the chairman and co-CEO of his company, said in a recent interview. He and his brother Sergio have remained at the helm for an unspecified transition period.

The company, based in the northern Italian region of Piedmont, is already one of the world's largest producers of luxury textiles, with 4.5 million meters in 2012. And it has had double-digit growth — from 478 million euros in revenues in 2010 to 627 million euros last year.

But the deal will guarantee a solid level of captive business, as Loro Piana's 250 clients include brands already owned by LVMH, Pier Luigi said.

Italy's fashion industry is comprised primarily of small family-run companies, and the recession has hurt those who don't make most of their sales abroad. The Italian fashion world has likewise been reluctant to aggregate into conglomerates that can better weather shifting global crises — leaving fashion houses trying to secure their future to look primarily abroad for solutions.

Story continues

Loro Piana's new owner, whose full name is LVMH Moet Hennessy Louis Vuitton SA, already has a portfolio of Italian firms acquired over the years, including the Fendi fashion house and Bulgari jewelers. Its rival conglomerate, Kering, is also French and has such brands as Gucci and Bottega Veneta. The two have been among the most successful buyers of Italian fashion houses thanks to an approach that favors aggregating businesses that complement each other.

Not all fashion transitions have been smooth. Valentino and Gianfranco Ferre, for example, have experienced some turbulence, with multiple owners accompanying changes in the creative direction in the void left by the eponymous owners.

Pier Luigi Loro Piana said he was pleasantly surprised by LVMH CEO Bernard Arnault's interest in the company's supply chain control and, in particular, their efforts to preserve the vicuna. The company established a reserve in Peru for vicuna, camelids that were almost poached to extinction in the 1960s, doubling their numbers to 2,000 over five years. This year, Loro Piana bought a majority stake in a company in Argentina that has 6,000 free-range vicunas.

""I was pleasantly surprised by how much interest Mr. Arnault and his collaborators took in our capacity to control the entire chain,"" Loro Piana said. ""I was a little worried about this but instead I have seen a strong interest.""

A commitment to those projects, he said, will help guarantee Loro Piana's future — both as a source of jobs in Italy and profits for its French owners.

It's a formula that is finding acceptance in the Italian fashion world.

""We are a little unhappy when Italian companies are bought by outsiders,"" Milan fashion chamber president Mario Boselli said. ""But it must be said if we look at the history of Italian companies that have been bought by the two French groups, they are stories of cohesion and success that we can only acknowledge positively.

""Chapeau,"" he said, using the French expression for ""Hats off."""
2014 LVMH Prize for Young Fashion Designers (300000 Euros Prize) – Opportunities For Africans - Opportunities For Africans,"Tue, 26 Nov 2013 08:00:00 GMT",https://news.google.com/rss/articles/CBMiaGh0dHBzOi8vd3d3Lm9wcG9ydHVuaXRpZXNmb3JhZnJpY2Fucy5jb20vMjAxNC1sdm1oLXByaXplLWZvci15b3VuZy1mYXNoaW9uLWRlc2lnbmVycy0zMDAwMDAtZXVyb3MtcHJpemUv0gEA?oc=5&hl=en-US&gl=US&ceid=US:en,"Submission Deadline: February 2nd 2014

As part of its worldwide activities to support creativity in the fashion sector, the LVMH Group is launching the first edition of the LVMH Prize for Young Fashion Designers (the “Prize”).

The purpose of the Prize is to make the LVMH Group’s know-how available to assist young fashion

designers with their entrepreneurial projects. After finalists are short-listed by a committee of experts,

the Prize will be awarded to the enterprise of a young designer to be selected by an international jury

composed of qualified and recognized authorities in the fashion industry.

Eligibility Requirement:

You have a young fashion brand and you meet the following criteria :

You are older than 18 and under 40

You have produced at least two collections

Your collections are menswear or womenswear (not accessories)

There is no nationality requirement applicable to the Candidate or its artistic director for participating in the Prize

Prize

The Prize Winner shall receive assistance from the LVMH Group in supporting and developing its

creative work in the form of a personalized support, both technical and financial, for a period of twelve

(12) months from the Prize award.

This assistance will include:

Financial support, in the amount of three hundred thousand (300,000) euros, for developing the Prize Winner’s design projects; Individual support with representatives of the LVMH Group during a twelve (12)-month period.

Timeline

The estimated calendar for the Prize is as follows:

Submission of the applications on the Website before February 2, 2014 midnight (Paris time);

Shortlisting of the Candidates by the Organizer until February 28, 2014

Selection of the Finalists by the Committee of Experts at the end of March 2014;

Announcement of the Prize Winner by the Jury and award of the Prize in June 2014

For More Information:

Visit the Official Webpage of the LMVH Prize for Young Fashion Designers"
