Titre,Date de publication,URL,Contenu
Virgin Atlantic Just Unveiled Its Airbus A330neo — With the Most Spacious Suite in the Airline's History - Travel + Leisure,"Fri, 15 Jul 2022 07:00:00 GMT",https://news.google.com/rss/articles/CBMiVWh0dHBzOi8vd3d3LnRyYXZlbGFuZGxlaXN1cmUuY29tL2FpcmxpbmVzLWFpcnBvcnRzL3Zpcmdpbi1hdGxhbnRpYy1uZXctYWlyYnVzLWEzMzBuZW_SAQA?oc=5&hl=en-US&gl=US&ceid=US:en,"In 2019, Virgin Atlantic placed an order for 16 brand-new Airbus A330-900neo aircraft. And while the subsequent two years were a difficult time for travel, the industry is finally rebounding — just in time for the U.K.-based airline to receive the first three aircraft in the order.

The highly efficient A330neo will eventually replace Virgin Atlantic's older A330-900 aircraft, reducing fuel burn and carbon emissions by 11% from the older model — something that aligns closely with Virgin Atlantic's mission to fly ""the cleanest, greenest fleet in the sky,"" according to a press release.

Courtesy of Virgin Airlines

For this aircraft, which has slimmer proportions than other wide-body planes like the Airbus A350, Virgin Atlantic had to design a new business-class product — a collaborative project between the company's in-house design team and London creative agency Factorydesign. They riffed on Virgin Atlantic's existing Upper Class (the airline's term for business-class) suites, which are currently found on its A350 aircraft. But on the A330neo, the 30 Upper Class suites will have fully closing doors instead of partially closing ones, and each of the seats will be forward-facing rather than a mix of backward and forward. And they've been kitted out with the latest tech, including bluetooth connectivity to the in-flight entertainment system and wireless charging ports.

Courtesy of Virgin Airlines

Virgin Atlantic is known for having social spaces onboard each of its aircraft, and that trend will continue with the A330neo. Called the Loft, the space is a small onboard lounge for the exclusive use of Upper Class passengers that has communal seating for up to eight and a self-service refrigerator and freezer with treats like alcoholic beverages and ice cream. It even has wireless charging ports, just like the Upper Class suites.

Courtesy of Virgin Airlines

But the star of the show is an even more premium seat that's making its debut on the A330neo: the Retreat Suites. An upgrade over the traditional Upper Class suite, these suites provide even more space for passengers, with a six-foot, seven-inch lie-flat bed. And they have some of the biggest screens in the business, at a massive 27 inches. But the most innovative feature of the Retreat Suites is the fact that the ottomans for each seat can be set up as sitting space for guests — a fold-out table in between the main seat and the ottoman means that guests can dine together or just have a private social space in which to hang out.

The first A330neo aircraft will have two Retreat Suites onboard in the Upper Class cabin, located in front of the cabin in the middle of the two aisles. The seats can be combined into a two-person suite, or a divider can keep them separate for solo travelers. They will be available for Upper Class passengers to upgrade to starting 14 days before the flight at the relatively low price point of £200 (about $240).

Courtesy of Virgin Airlines

Behind Upper Class, the A330neo will have 45 Premium seats, the airline's premium-economy product, which offer extra recline and leg room, leg rests, and wireless charging ports. And in economy, the 184 seats will be a 2-4-2 layout, which reduces the number of middle seats in the cabin compared to many other wide-body aircraft, which often feature 3-3-3 layouts. Economy will be split into two types of seats: Economy and Economy Delight, which has three extra inches of leg room compared to the standard economy seat.

Courtesy of Virgin Airlines

""The A330neo plays a significant role in our multi-billion dollar fleet transformation, demonstrating our commitment to the planet,"" Corneel Koster, chief customer and operating officer at Virgin Atlantic, said in a statement. ""We know the most impactful thing we can do as an airline is to fly the cleanest, greenest, youngest fleet possible and the A330neo is integral to achieving this goal, reducing the average age of our fleet to just seven years by 2026. It's truly a plane for the future.""

Virgin Atlantic's A330neo will make its debut on the airline's Boston to London route in October 2022; tickets will go on sale this month."
COMAC is building Chinese jetliners and wants to take on Airbus and Boeing – The China Project - The China Project,"Thu, 14 Jul 2022 07:00:00 GMT",https://news.google.com/rss/articles/CBMicmh0dHBzOi8vdGhlY2hpbmFwcm9qZWN0LmNvbS8yMDIyLzA3LzE0L2NvbWFjLWlzLWJ1aWxkaW5nLWNoaW5lc2UtamV0bGluZXJzLWFuZC13YW50cy10by10YWtlLW9uLWFpcmJ1cy1hbmQtYm9laW5nL9IBAA?oc=5&hl=en-US&gl=US&ceid=US:en,"This web site uses cookies to deliver a modern, enjoyable web site experience."
Delta Air Lines to buy 12 A220 aircraft from Airbus - Reuters,"Tue, 19 Jul 2022 07:00:00 GMT",https://news.google.com/rss/articles/CBMiW2h0dHBzOi8vd3d3LnJldXRlcnMuY29tL2J1c2luZXNzL2Flcm9zcGFjZS1kZWZlbnNlL2RlbHRhLWJ1eS0xMi1haXJjcmFmdC1haXJidXMtMjAyMi0wNy0xOS_SAQA?oc=5&hl=en-US&gl=US&ceid=US:en,
LCI signs agreement for up to six H175 helicopters from Airbus - Airbus,"Wed, 27 Jul 2022 07:00:00 GMT",https://news.google.com/rss/articles/CBMieGh0dHBzOi8vd3d3LmFpcmJ1cy5jb20vZW4vbmV3c3Jvb20vcHJlc3MtcmVsZWFzZXMvMjAyMi0wNy1sY2ktc2lnbnMtYWdyZWVtZW50LWZvci11cC10by1zaXgtaDE3NS1oZWxpY29wdGVycy1mcm9tLWFpcmJ1c9IBAA?oc=5&hl=en-US&gl=US&ceid=US:en,"Marignane, LCI, a leading aviation company and a subsidiary of the Libra Group, has today announced an order for up to six H175 super-medium helicopters from Airbus, valued at over US$125 million.



The order is for two confirmed aircraft with the first H175 set to be delivered to LCI in late 2023. The agreement provides for a further four options, and builds on LCI’s previous order for new H175s.



Jaspal Jandu, CEO of LCI, says: “The Airbus H175 is a versatile, multi-purpose helicopter and this order will help to maintain the breadth of LCI’s product offering. This latest chapter in our partnership is an important element of our long-term growth strategy, and demonstrates our confidence in the helicopter leasing market.”



Bruno Even, CEO of Airbus Helicopters, says: “LCI is a longstanding and valued Airbus partner. As a leading lessor and operator of Airbus helicopters, their renewed commitment to the H175 demonstrates the strength of the marketplace and its post-pandemic recovery.



LCI’s fleet currently includes around 50 Airbus helicopters and fixed wing aircraft. They are deployed by 14 operators in 10 countries across the globe on a range of missions including emergency medical services, search and rescue and offshore wind.



The H175 first entered service in 2015 and combines long range capabilities with smooth flight qualities, excellent payload and cabin comfort. It is a highly versatile, super-medium aircraft that can operate in a range of different configurations.



LCI has consistently grown in scale and value as it has diversified over time. The lessor’s highly experienced management team has built strong relationships with aircraft and engine manufacturers, customers, and leading financial institutions.



Since its inception in 2004, LCI has undertaken in excess of US$8 billion of transactions in the aviation markets.



@AirbusHeli @LCIaviation #H175 #MakingMissionsPossible"
737 Max Orders Help Boeing Crush Airbus at Farnborough Airshow - FLYING,"Fri, 22 Jul 2022 07:00:00 GMT",https://news.google.com/rss/articles/CBMiWWh0dHBzOi8vd3d3LmZseWluZ21hZy5jb20vNzM3LW1heC1vcmRlcnMtaGVscC1ib2VpbmctY3J1c2gtYWlyYnVzLWF0LWZhcm5ib3JvdWdoLWFpcnNob3cv0gEA?oc=5&hl=en-US&gl=US&ceid=US:en,"Boeing’s 737 Max led airliner orders this week at England’s 2022 Farnborough International Airshow, representing a comeback of the beleaguered single-aisle jet.

Three years after Max airplanes were grounded in the wake of two deadly accidents, multiple Max variants garnered the lion’s share of Boeing’s 176 orders, eclipsing total orders for airliners manufactured by rival Airbus.

This year’s event marked the first time airliner manufacturers and customers have gathered at Farnborough since the COVID-19 pandemic cratered air travel in 2020, hobbling the airline industry.

As air travel ramps up this summer, Boeing’s largest order came from Atlanta-based Delta Air Lines, which ordered 100 737 Max 10s—now rebranded as 737-10s. Delta’s first new Boeing order since 2011 had been preceded by large Delta orders for Airbus A321 and its fuel-efficient A321neo variant.

“The aircraft will complement Delta’s high-performance A321neo fleet,” Delta said in a statement. The order will bring the carrier’s total 737 fleet to more than 300 aircraft, Delta’s second-largest fleet family behind Airbus’ A320.

Delta acknowledged the 737-10 variant is still awaiting final certification from the FAA—expected in 2023. “In the event of a delay, the agreement has adequate protection in place, including allowing Delta to shift to another model of [the] Max family if necessary,” Delta said.

Other Significant Orders

Airbus benefited from Delta’s spending spree as well, firming up 12 options for Airbus A220-300s, the larger version of the single-aisle airliner.

The total number of Airbus orders at Farnborough this year was smaller than Boeing’s, but included 56 orders from EasyJet for A320neos, including 18 previously ordered A320neos converted to orders for larger A321neos.

In fact the ultra-efficient A321neo received 17 orders from LATAM.

Nonetheless, Airbus orders at Farnborough totaled only 85 aircraft—a lower number than analysts expected. “If they really have some unfinished deals in the making, it remains to be seen,” Richard Schuurman of industry consultant AirInsight told FLYING. This week yielded the lowest number of Airbus orders at a major European airshow since the Paris Air Show in 2017, Schuurman said, “although they have already sold over 500 aircraft this year.”

Airbus Leaves Early

Airbus CEO Guillaume Faury and chief commercial officer Christian Scherer skipped the company’s traditional week-ender news conference to announce final order tallies. Instead, they left the airshow on Wednesday, a day earlier than expected, the Seattle Times reported.

Times reporter Dominic Gates reported Scherer told him, “Don’t worry about our sales ability. We’re doing really well, thank you very much.”

As day three at Farnborough ends, both Airbus CEO Faury and sales chief Scherer have left the Air Show.

There’ll be no major Airbus sales announcement press conferences on Thursday

“Don’t worry about our sales ability. We’re doing really well thank you very much” Scherer told me — Dominic Gates (@dominicgates) July 20, 2022

Embraer

Brazil-based Embraer reported orders for eight E175 airliners for Horizon Air and two E190 converted freighters for Nordic Aviation Capital.

Embraer also reported receiving letters of intent (LOIs) to purchase more than 250 of Embraer’s new 70- and 90-seat turboprops. The next-gen airliner is expected to be launched next year in Paris, Schuurman said. “It would almost double their order backlog and drastically improve their business case.”"
UK's IAG orders 37 Airbus A320neo family aircraft - Reuters,"Thu, 28 Jul 2022 07:00:00 GMT",https://news.google.com/rss/articles/CBMib2h0dHBzOi8vd3d3LnJldXRlcnMuY29tL2J1c2luZXNzL2Flcm9zcGFjZS1kZWZlbnNlL3Vrcy1pYWctb3JkZXJzLTM3LWFpcmJ1cy1hMzIwbmVvLWZhbWlseS1haXJjcmFmdC0yMDIyLTA3LTI4L9IBAA?oc=5&hl=en-US&gl=US&ceid=US:en,
Blue in Bloom: Inside ITA Airways' Airbus A350 (+Photos) – Airways - Airways Magazine,"Fri, 22 Jul 2022 07:00:00 GMT",https://news.google.com/rss/articles/CBMiL2h0dHBzOi8vYWlyd2F5c21hZy5jb20vaW5zaWRlLWl0YS1haXJ3YXlzLWEzNTAv0gEA?oc=5&hl=en-US&gl=US&ceid=US:en,"FARNBOROUGH – Among the most striking liveries of the static display aircraft at the Farnborough Airshow was one of ITA Airways’ (AZ) Airbus A350-900s, turning heads with its bright blue livery.

An inside look at the aircraft provides a glimpse into how the new Italian airline is looking to become a dominating force in the European market.

ITA has placed a focus on developing an airline that is sustainable and showcases Italian craftsmanship through its ‘Made in Italy’ campaign.

Photo: Kochan Kleps/Airways

As described by the airline, the A350 flagship aircraft is the ‘Ambassador of ITA Airways in the world’, and its bold blue livery certainly helps the airline stand out.

Following the struggles and eventual demise of Alitalia in late 2020, AZ was born, quickly establishing its brand and reorganizing itself.

Soon, in August of 2021, the airline launched its website and ticket sales, officially continuing the legacy of Alitalia.

The airline’s announcements, however, were made as the Italian government reviews offers by Lufthansa (LH), the MSC Group, and the Air France-KLM Group to become majority stakeholders.

ITA Chief Executive Officer, Fabio Lazzerini, Presents Sustainability Manifesto (Photo: Kochan Kleps/Airways)

Sustainability Takes the Spotlight

At the Farnborough Airshow, AZ presented its Sustainability Manifesto, which describes the airline’s efforts to offset emissions, utilize a ‘green value chain’, and promote diversity and inclusion.

Sustainability has become a focal issue for the aviation industry and provides airlines with the opportunity to not only help the planet but also reduce costs and create new products that incorporate new, exciting technologies.

A large part of the airline’s sustainability initiatives stems from its plan to overhaul its inherited fleet of Alitalia aircraft, exchanging them for next-generation Airbus aircraft. The new aircraft order, which was firmed on December 1, 2021, includes seven A220s, 11 A320neos, and 10 A330neos.

In addition, the airline signed with Air Lease Corporation to lease 31 next-generation Airbus aircraft, including the A350. The airline plans to ensure that 75% of its fleet is next-generation by 2025, an impressive goal.

Photo: Kochan Kleps/Airways

ITA’s Sleek A350

In June of this year, AZ began operating its fleet of Airbus A350-900 aircraft, becoming the first Italian and 40th airline globally to do so.

With five in operation and a further, sixth aircraft to soon join the airline’s fleet, the flagship product features the latest hard products available in the industry.

The new aircraft features 334 seats, including 33 lie-flat business class seats, 39 seats in ‘Comfort Economy’, and 262 in economy.

Photo: Kochan Kleps/Airways Photo: Kochan Kleps/Airways

“Comfort, elegance, simplicity, materials and colours” were the building blocks for the airline in its customization of the aircraft’s interior.

The carefully chosen tones and hues of the cabin create a harmonious, elegant atmosphere that reflects the airline’s brand.

Photo: Kochan Kleps/Airways

In addition to new seating, the aircraft utilizes special cabin lighting that changes seamlessly based on different situations on board.

For its business class seats, AZ chose Collins Super Diamond seats, which have become increasingly popular within the aviation industry.

ITA Airways New Uniform. Photo: Kochan Kleps/Airways

A Look at ITA’s New Uniforms

As part of the airline’s overhaul, AZ created new uniforms for its crew, with consultancy from Italian designer Brunello Cucinelli.

The project fused both sustainability objectives and its ‘Made in Italy’ initiative. The uniforms are produced by medium-sized Italian companies, as part of the airline’s work to focus on the national system.

The new uniforms include a dry-fitting jacket and trouser suit with a one-and-a-half breasted jacket for men, and a jacket and trousers or skirt combination for women.

Over the next few months, the uniforms will make their way through the fleet, and will be implemented progressively to “avoid wasting money.”

Featured Image: Kochan Kleps/Airways"
"Saudi King Salman, His Sons and Airbus - Fair Observer","Fri, 15 Jul 2022 07:00:00 GMT",https://news.google.com/rss/articles/CBMiTGh0dHBzOi8vd3d3LmZhaXJvYnNlcnZlci5jb20vcG9saXRpY3Mvc2F1ZGkta2luZy1zYWxtYW4taGlzLXNvbnMtYW5kLWFpcmJ1cy_SAQA?oc=5&hl=en-US&gl=US&ceid=US:en,"Last month, a London court heard how a senior executive and associate of an Airbus subsidiary paid over $11.5 million (£9.7 million) in bribes to Saudi Arabian military officials to secure lucrative contracts for the UK government.

The case, which was first exposed by Private Eye in 2016, relates to a UK government deal to provide communications services to the Saudi Arabian National Guard (SANG), which were delivered by a now defunct unit of Airbus called GPT Special Project Management. The Serious Fraud Office has prosecuted the case. It claims GPT paid other companies, which were then used to bribe senior Saudi officials, including Prince Miteb bin Abdullah bin Abdulaziz, former head of SANG, in order to secure the contracts.

Opening the defense case at Southwark Crown Court, Barrister Ian Winter QC described the structure of the government-to-government deal, which dates back to the late 1970s, as a “fiddle” that enabled members of the Saudi royal family and the British government to “deny having any knowledge of [the payments] at all”. Winter went on to say: “This indictment does not begin to plumb the depths of what the UK government has been involved in since the late 1970s.” The case promises not only to cast new light on the depths of UK-Saudi relations, but also to overshadow a much more recent Saudi deal with Airbus struck by Crown Prince Mohammed bin Salman (MBS) for the exclusive benefit of himself and his line of the family.

MBS’s Murky Business Empire

Little public information is available about how the Salman clan runs its business empire. MBS is believed to oversee it personally and his full brother Turki and mother Fahda bint Falah bin Sultan al-Hithlayn are also involved. Fahda, who is never seen in public, was restored to Saudi society without comment in 2018 after being locked up by MBS for two years. Turki’s main role is to introduce Western companies to the crown prince and he deliberately keeps in the background.

Outside Saudi Arabia, the family controls three Luxembourg-registered companies—Safason Corporation, Valburton Investments S.A. and Folabin—about which very little public information is available. Inside Saudi Arabia, their principal business vehicle is Tharawat Holding Company of which Turki bin Salman is the chairman.

Tharawat Holding Company has business interests inside Saudi Arabia in diverse sectors including construction, real estate, health, education, sports development, food and beverage, aquaculture, telecommunications and natural resources management. It is also suspected of having made a fortune out of defense contracts linked to the Yemen war. Before he was kidnapped and returned to Saudi Arabia against his will, a dissident Saudi prince told Arab Digest that, when the war started, Tharawat diversified its foreign partnerships into military materiel and the Salman clan enriched itself immensely via inflated arms contracts arranged by Turki.

“[Salman’s branch] are behind things inside the country and the Saudi public knows about it” said the prince. “MBS operates his business by bringing his special people and he is in control of the Royal Court. The younger brothers are making money, especially Prince Turki bin Salman. He has no official position—just a businessman —but MBS gives his brother some deals. Turki works for them.”

In September 2015, an anonymous grandson of Ibn Saud published a letter calling for the downfall of the Saudi king in which he warned that large sums of money are being embezzled by the inner circle of the royal family. The letter stated that $160 billion (SAR 600 billion) was taken by the leadership with a further $100 billion (SAR 375 billion) allegedly going directly to MBS and his brothers, Turki, Khaled, Nayif, Bandar, and Rakan.

Power and Wealth to MBS, His Sons and Brothers

The dissident prince also said Turki told him that MBS intends to change the current system of succession in the Saudi Kingdom to one based on primogeniture so that MBS’s own son will inherit the throne after him. “Turki told me we will be like Bahrain and Jordan where MBS will be king and then his son will be his successor’” said the prince.

“When MBS becomes king, he wants to put one of his children as crown prince, he wants it in his family, Salman’s family, so he will appoint his son as crown prince although he is only a little baby. He has one son called Salman. MBS wants to put him on the crown in the same way as the monarchies of Morocco, Bahrain, Jordan, or England do, to keep the throne for his blood. Either MBS will put his son directly as crown prince or he will first appoint one of his brothers and then his son.”

One business deal the Salman clan are known to have been involved in is arranging the financing for a new fleet of Airbus planes for Saudi Arabian Airlines, the flagship carrier of Saudi Arabia. In 2018 The Wall Street Journal published an investigation into how the clan uses businesses connected to the government to make their fortunes. The story explains in detail how, when MBS came to power, he helped re-engineer the original plan.

As per the original plan, Saudi Arabia’s Public Investment Fund (PIF) would have purchased 50 new planes directly from Airbus for Saudi Arabian Airlines. MBS has dumped that deal for a far more complex deal involving a newly established company called International Airfinance Corp (IAFC), which manages an Islamic finance fund called ALIF and is part-owned by an Islamic bank based in the Dubai International Financial Centre called Quantum Investment Bank in which Tharawat acquired a 54% stake. MBS’s brother Turki is the chairman of this bank.

Despite concerns raised about the deal—Saudi Arabian Airlines did not solicit bids from any other companies—and the fact that the Serious Fraud Office in London was at that time already investigating an Airbus subsidiary for corruption involving the Saudis, Airbus agreed to invest $100 million in ALIF on the condition that the fund would buy only Airbus planes. On June 23, 2014, Airbus and IAFC held a “signing ceremony” in London to announce the new fund. The IAFC press release tells us Turki hosted this ceremony.

In 2015, after King Abdullah died, the plan changed yet again into an even more convoluted chain of transactions. Instead of being sold directly to the Saudi government, the jets would now be sold to ALIF, which would in turn rent them to the state-owned Saudi Arabian Airlines, which has subsequently been rebranded as Saudia. Note that this convoluted deal helps Tharawat ending up as a beneficiary. As one government official put it, “at the end it went to Tharawat, who got others to finance it, and made huge profits without risking any of their money.”

On August 5, 2015, the anonymous opposition Saudi Twitter account Mujtahidd tweeted that the list price for 30 A320 and 20 A330-300 Airbus planes was $8 billion (SAR30 billion), but the amount budgeted was $12 billion (SAR 45 billion). The budgeted price is 50% more than the listed price, meaning $4 billion could be going into the pockets of MBS, Turki and their brothers. The original tweet is no longer available as Mujtahidd was hacked a month later and all its tweets were erased. Mujtahidd also wrote that MBS financed the deal with a Saudi government guarantee, on condition that Saudi Arabian Airlines paid Tharawat 150% of the agreed price.

The deal was finalized by MBS during a 2015 visit to France and not long after, at a gathering in a Saudi palace, he took credit for it. MBS claimed that the transaction demonstrated his success in balancing the Saudi state’s financial interests with his family’s interests. MBS reportedly said, “I am the mastermind behind this deal.” Depending on what happens next with the Serious Fraud Office’s case now unfolding in Southwark Crown Court, MBS’s cherished deal could yet come unstuck.

[Arab Digest first published this article and is a partner of Fair Observer.]

The views expressed in this article are the author’s own and do not necessarily reflect Fair Observer’s editorial policy."
"Farnborough Air Show: Airbus, Boeing Court Air India to Buy A350, 737 Max Planes - Bloomberg","Tue, 19 Jul 2022 07:00:00 GMT",https://news.google.com/rss/articles/CBMicGh0dHBzOi8vd3d3LmJsb29tYmVyZy5jb20vbmV3cy9hcnRpY2xlcy8yMDIyLTA3LTE5L2FpcmJ1cy1ib2VpbmctY291cnQtYWlyLWluZGlhLWluLWJsb2NrYnVzdGVyLWFpcmNyYWZ0LXVwZ3JhZGXSAQA?oc=5&hl=en-US&gl=US&ceid=US:en,"Why did this happen?

Please make sure your browser supports JavaScript and cookies and that you are not blocking them from loading. For more information you can review our Terms of Service and Cookie Policy."
