Titre,Date de publication,URL,Contenu
Airbus' Markus May on the Air Mobility Initiative in Germany and why it was created - Vertical Magazine,"Wed, 27 Jul 2022 07:00:00 GMT",https://news.google.com/rss/articles/CBMic2h0dHBzOi8vdmVydGljYWxtYWcuY29tL3EtYW5kLWEvYWlyYnVzLW1hcmt1cy1tYXktb24tdGhlLWFpci1tb2JpbGl0eS1pbml0aWF0aXZlLWluLWdlcm1hbnktYW5kLXdoeS1pdC13YXMtY3JlYXRlZC_SAQA?oc=5&hl=en-US&gl=US&ceid=US:en,"Airbus, along with around 30 key stakeholders, chose Germany to build an urban air mobility ecosystem. Dubbed the Air Mobility Initiative (AMI), the partners have garnered the support of the Free State of Bavaria and the Federal Republic of Germany, along with many other important players.

Members of the Air Mobility Initiative, including Airbus, have chosen Germany to build an urban air mobility ecosystem. Airbus Image

There are three fundamental areas for the Air Mobility Initiative: the eVTOL aircraft, the ground infrastructure, and the unmanned traffic management. With a €86-million (US$87-million) budget and three years to accomplish its scheduled projects, we spoke with Markus May, head of operations for urban air mobility (UAM) at Airbus, Ivonne Kuger, executive vice president of corporate development at Munich Airport International, and Jan Eric Putze, CEO of Droniq GmbH, to find out more about the initiative and what we can expect to see by 2025.

The following is an interview with Markus May — the first in a three-part article series discussing the AMI. This interview has been edited for length and clarity.

eVTOL.com: Having an entrepreneurial mindset in a corporate environment is very difficult to achieve and you were able to achieve it. How did you start the Airbus Urban Mobility GmbH?

Markus May: In 2018, we started Airbus Urban Mobility as a field of expertise. We come from an original equipment manufacturer (OEM) background. Airbus is excellent at designing, manufacturing, and developing aircraft and helicopters. But it is not just about a flying vehicle. We needed to address different pillars of the value chain and get a whole ecosystem to work together. We created a smaller entity with startup principles because we were — and still are — looking for a product-market fit.

We investigate two areas: developing an eVTOL aircraft, which is the CityAirbus NextGen, and being the architect of an air mobility transport system for cities and communities. Along with the three technical pillars [eVTOL aircraft, ground infrastructure, and air traffic management services] there are also other foundational aspects that we’ll need to address, like social acceptance, regulation, safety and security, as well as a user-centric design.

eVTOL.com: Can you explain what the Air Mobility Initiative is and what the group aims to accomplish?

Markus May: We want to build an MVP, a minimum viable product, for an air mobility transport system in an urban environment. That means we want to fly a passenger from point A (an airport) to point B (a city environment) with a vehicle like the CityAirbus NextGen. To do so, a U-space in the urban environment will be set up in order to create visibility amongst the different actors in the lower airspace.

With all these factors involved, our ambition is to make the whole transport system work together with all necessary players of the ecosystem. We are not replacing anything that currently exists. We are adding a complimentary means of transportation to an existing urban transportation system. Beyond that, we want to make sure that it is accessible to the public and an easy choice for the citizen who needs to commute between cities or communities.

Since 2020, we have been building a foundation with 30 partners as a collective effort to begin the process. And since we are shaping this new mode of transport in an existing world, it is obvious that there are compromises to be made and stakeholders to be convinced.

eVTOL.com: Do you intend to grow your partnerships within the initiative?

Markus May: This initiative is open and evolving. There will be new partnerships created as a result of new projects. We are in the process of defining new projects with new partners, but I cannot discuss it yet. With each individual project, we build one brick after another.

We are currently preparing new funding projects for this year.

Markus May, head of operations for urban air mobility (UAM) at Airbus, said the Air Mobility Initiative in Germany aims to make the whole transport system work together with all necessary players of the ecosystem. Airbus Image

eVTOL.com: How long have you had your sights set on Germany?

Markus May: There were several reasons behind what drove us toward southern Germany. There is an existing ecosystem of innovation for mobility in general. There are many startups that are in the region working on mobility, as well as established automotive and technology companies.

We also have an Airbus presence close by. Both divisions, Airbus Helicopters and Airbus Defense and Space, have testing and industrial sites in the area. We have a lot of support and resources with engineering experience in vertical lift. We can also discuss electrical flight and autonomy with the surrounding businesses. This technology is so new that if we were to set up somewhere else, we would not have this type of support and resources surrounding us as we do here in Munich.

eVTOL.com: Can you describe what the government landscape is like in Germany to help facilitate innovation and advancement of UAM in comparison to other regions, such as the U.S.?

Markus May: The Bavarian government had a strong willingness to make this happen. At the federal level, they wanted to see UAM in Germany. That is why they put together the budget and created a dedicated funding scheme to make this happen. We are very grateful for this financial support. The next step is now the creation of living lab environments to prototype, test and design the entire UAM ecosystem.

Comparing Germany with the U.S., companies in the U.S. seem to have strong support from the government and military. We probably have a little bit less in Germany and Europe in general.

The U.S. Federal Aviation Administration (FAA) and the European Union Aviation Safety Agency (EASA), two major regulators, are getting closer to aligning regulations. eVTOL aircraft certification will be aligned by both regulators, as it is today with helicopters and other classic aircraft. The alignment may take a few years but, in the meantime, we are making sure that we continue to follow high safety standards.

eVTOL.com: What are your thoughts about the FAA’s decision to change the way it certifies winged eVTOL aircraft? Does Airbus plan to have its EASA type certificate validated in the U.S. and other areas? If so, do you have any concerns about getting your type certification validated?

Markus May: We have been working very closely with EASA and will continue to work with them. Our goal is to certify with EASA first, then work with the FAA for approval. Everyone faces the same challenges when trying to certify their eVTOL aircraft. There are a lot of completely new designs being made, and the safety regulations will have to be designed as a comprehensive and reliable framework.

eVTOL.com: You’re working with a budget of €86-million (US$87-million) over a span of three years. What goals do you plan to accomplish over this period? When does Airbus plan to start UAM operations?

Markus May, head of operations for urban air mobility (UAM) at Airbus, said the Air Mobility Initiative in Germany received strong support from the local government, which put together the budget and created a dedicated funding scheme to facilitate the initiative. Airbus Image

Markus May: We will start UAM operations when we can ensure a transport solution and a mature ecosystem. In the meantime, we are building this solution step-by-step. We want to prototype how UAM operations will look in different environments, while regulations are still evolving. And hopefully we can launch this program by the middle of the decade.

We are working with Droniq to implement U-space to ensure integration of eVTOLs into the airspace. We also want to have the ground infrastructure set up and ready before we go into production.

As there is a new regulation taking into effect beginning in 2023, the objective is to set up the first U-space with Droniq in Bavaria. It is not a new airspace, but it will allow us to test the airspace to integrate eVTOLs with drones and helicopters so that we have different vehicles visible to each other in the same airspace. We would like to test this for a longer period as a laboratory environment.

Another important step is to work on operations, which includes ground infrastructure. We will build a vertiport prototype to see what processes we need on the ground. We want to efficiently integrate the processes with end-to-end logic. For instance, door-to-door travel time, which would be the amount of time it takes passengers to travel from their starting place to their ultimate desired destination.

eVTOL.com: Does the Air Mobility Initiative allow for other eVTOL OEMs to launch their vehicles through this program, or is the project exclusively for Airbus?

Markus May: Eventually, there will be different eVTOLs operating in the market. Until then, we are all pioneers of this aerospace revolution. Obviously, we’re focusing our attention on the CityAirbus NextGen from a vehicle perspective. But regarding other ecosystem elements, such as airspace, airport and city integration, we’re working with other players. We need this collaboration to establish joint standards for this emerging industry.

Apart from eVTOLs, we will be using other vehicles for flight testing. At our Airbus Drone Center, we are flying different types of drones, for instance. We will also fly an airship to get pictures and imagery of the city and environment to map out navigation for autonomous flight. We want to deliver a fully-electric vehicle that flies and we want to learn how it will operate in this sandbox environment. It will help us design for the future as operations and regulations are evolving.

eVTOL.com: What is the group’s strategy for addressing public perception?

Markus May: We have dedicated work packages that are focused on public acceptance. There are different studies from universities from a citizen or travel perspective and different frameworks. The City of Ingolstadt had set up a living lab downtown in the past, and there will be more to come in the next three years. UAM will be designed for citizens, by citizens. This is one of the most important elements in order to achieve societal acceptance for such an innovative mode of transport.

For instance, noise — if you cannot distinguish the eVTOL from the background noise anymore, it will be more acceptable. We can see positive feedback from the public, whether we look at the EASA study or at the learnings from trials in Ingolstadt. The concerns of citizens about noise are very important to help us define a better solution."
A380 superjumbo to test experimental open fan engine - CNN,"Wed, 20 Jul 2022 07:00:00 GMT",https://news.google.com/rss/articles/CBMiVWh0dHBzOi8vd3d3LmNubi5jb20vdHJhdmVsL2FydGljbGUvYWlyYnVzLWNmbS1hMzgwLXByb3B1bHNpb24tZGVtb25zdHJhdG9yL2luZGV4Lmh0bWzSAU5odHRwczovL2FtcC5jbm4uY29tL2Nubi90cmF2ZWwvYXJ0aWNsZS9haXJidXMtY2ZtLWEzODAtcHJvcHVsc2lvbi1kZW1vbnN0cmF0b3I?oc=5&hl=en-US&gl=US&ceid=US:en,"CNN —

Take a closer look at the plane on the top of this story. Notice anything different about one of its engines?

This Airbus A380, the world’s largest passenger jet, has been recruited as a demonstrator to trial new cutting-edge open fan engine architecture which could help cut carbon emissions by up to 20%.

The project was unveiled Tuesday by Airbus and CFM International at Farnborough Air Show just outside of London, an annual trade exhibition showcasing the latest in aerospace innovation.

It’s the latest innovation to be air-tested on the A380 “superjumbo,” which has had mixed fortunes in recent years. Production of the much-loved airplane was halted in 2021 due to lack of demand. Existing aircraft were grounded by airlines during the pandemic, only to enjoy a recent resurgence due to travel demand.

CFM, whose parent companies are GE and Safran Aircraft Engines, has been developing advanced propulsion technologies as part of its Revolutionary Innovation for Sustainable Engine (RISE) demonstration program.

Now the aim is to mature and accelerate that with a flight test campaign on board this A380, which is due to take to the skies in the latter half of this decade from the Airbus Flight Test facility in Toulouse, France.

Before that happens,CFM will perform engine ground tests and flight test validation at GE Aviation’s Flight Test Operations center in Victorville, California.

The aims of the flight test program are to better understand engine/wing integration and aerodynamic performance, to demonstrate better fuel efficiency that would cut CO2 emissions by a fifth compared to today’s most efficient engines, and to ensure compatibility with 100% Sustainable Aviation Fuels (SAF).

The aviation industry has made the ambitious pledge to achieve net-zero carbon emissions by 2050 and this new technology could help support that.

“New propulsion technologies will play an important role in achieving aviation’s net-zero objectives, along with new aircraft designs and sustainable energy sources,” said Sabine Klauke, Airbus Chief Technical Officer, in a statement.

The CFM RISE Program is all about pushing the technology envelope, redefining the art of the possible, and helping to achieve more sustainable long-term growth for our industry,” Gaël Méheust, President and CEO of CFM International, confirmed.

Earlier this year, Airbus announced it was to test an experimental hydrogen engine on an A380 – another partnership with CFM International – with the aim of creating a zero-emission airplane by 2035."
SKYNET 6A satellite passes Critical Design Review - Airbus,"Wed, 13 Jul 2022 07:00:00 GMT",https://news.google.com/rss/articles/CBMiYWh0dHBzOi8vd3d3LmFpcmJ1cy5jb20vZW4vbmV3c3Jvb20vbmV3cy8yMDIyLTA3LXNreW5ldC02YS1zYXRlbGxpdGUtcGFzc2VzLWNyaXRpY2FsLWRlc2lnbi1yZXZpZXfSAQA?oc=5&hl=en-US&gl=US&ceid=US:en,"Airbus designed state-of-the-art secure military communications satellite on track

Manufacture ongoing with more than 400 working on the programme

Stevenage, 13 July 2022 - Airbus has achieved a key milestone with the successful completion of the Critical Design Review (CDR) of the UK Ministry of Defence’s (MOD) next secure military communications satellite, SKYNET 6A.

Richard Franklin, Managing Director of Airbus Defence and Space UK said: “Achieving this crucial milestone is tangible proof that in partnership with Defence Digital in the Ministry of Defence we are firmly on track and making great progress on this flagship programme. We now have more than 400 people working on the project at our key sites in Stevenage, Portsmouth and Hawthorn. We are building SKYNET 6A with its unique military communications payload entirely in the UK and we currently have more than 45 small to medium sized enterprises and subcontractors helping to make sure we remain on target for launch in 2025.”

Airbus was awarded the SKYNET 6A contract in July 2020 to supplement the existing SKYNET 5 fleet of four satellites and enhance the UK’s milsatcom capability. The SKYNET 6A CDR has been achieved on time, working closely with the Defence Digital team. The next major milestone will be the delivery of the Communications Structure by the end of 2022.

The SKYNET 6A contract covers the design, development, manufacture, assembly, integration, test and launch, of the military communications satellite, and includes key national technology development programmes.

The SKYNET 5 programme, provided by Airbus as a full service outsource contract, has provided the UK MOD with a suite of highly robust, reliable and secure military communications services, supporting global operations since 2003. Airbus has been involved in SKYNET since 1974 and remains firmly committed to supporting a strong space manufacturing capability in the UK.

The SKYNET 6A satellite is based on the Airbus Eurostar Neo telecommunications satellite platform. It utilizes the unique Airbus military communications payload, adopting the latest digital processing to provide more capacity and greater versatility than previous SKYNET satellites. SKYNET 6A will feature proven Airbus electric orbit raising propulsion as well as electric station keeping systems for maximum cost effectiveness. Complete satellite integration will take place at Airbus facilities in the UK followed by testing using RAL Space testing facilities at Harwell in Oxfordshire supporting the UK Space Agency initiative for UK national end-to-end satellite production and support.

Note to Editors:

SKYNET 6A is still on track for launch in 2025 on a Falcon 9 provided by SpaceX.



@AirbusDefence #milsatcom #defencematters"
Airbus vs Boeing: who dominated the market during H1 2022? | Data - AeroTime,"Thu, 28 Jul 2022 07:00:00 GMT",https://news.google.com/rss/articles/CBMiUGh0dHBzOi8vd3d3LmFlcm90aW1lLmFlcm8vYXJ0aWNsZXMvMzE3NDUtYWlyYnVzLWJvZWluZy1oMS1maW5hbmNpYWwtcmVzdWx0cy1kYXRh0gFUaHR0cHM6Ly93d3cuYWVyb3RpbWUuYWVyby9hcnRpY2xlcy8zMTc0NS1haXJidXMtYm9laW5nLWgxLWZpbmFuY2lhbC1yZXN1bHRzLWRhdGEvYW1w?oc=5&hl=en-US&gl=US&ceid=US:en,"Airbus and Boeing, two of the world’s largest plane makers, revealed their financial results for the first six months of 2022.

According to data from financial reports, Boeing accumulated slightly more revenue than Airbus during the first half of 2022.

Boeing’s revenues fell slightly to $30.7 billion in H1 2022 in contrast to $32.2 billion during the first half of 2021. Meanwhile, Airbus’ consolidated revenues grew narrowly during the first half of 2022, with $24.8 billion accumulated in contrast to $24.6 billion during the same period the previous year.

In terms of net income, Airbus clearly led the way during the first half of 2022. In H1 2022, Airbus reported a net income of $1.9 billion, whereas Boeing posted a net loss of $1 billion.

Boeing’s negative results were driven by “lower defense volume and unfavorable performance”, the report said. Additionally, Boeing is awaiting approval from the US Federal Aviation Administration (FAA) to restart Dreamliner deliveries after they were halted in 2021 over manufacturing issues.

Boeing said it still expects total one-off costs of approximately $2 billion due to issues with the 787, with most set to be incurred by the end of 2023. It acquired costs of $283 million for the 787 in the second quarter.

It is also worth noting that H1 2021 was a better period than H1 2022 for both manufacturers. Airbus reported a net profit of $2.2 billion, while Boeing reported $6 million.

In the financial report, Airbus said it had a “solid” H1 2022 financial performance but warned about “supply chain challenges” which led the manufacturer to adjust the A320 Family ramp-up steps and now targets a monthly rate of 65 in early 2024, around six months later than previously planned. Looking ahead, Airbus aims to deliver 700 aircraft in 2022."
"Airbus Secures Flight Management Computers, Vision Systems Suppliers for Eurodrone - Avionics International","Fri, 15 Jul 2022 07:00:00 GMT",https://news.google.com/rss/articles/CBMie2h0dHBzOi8vd3d3LmF2aWF0aW9udG9kYXkuY29tLzIwMjIvMDcvMTUvYWlyYnVzLXNlY3VyZXMtZmxpZ2h0LW1hbmFnZW1lbnQtY29tcHV0ZXJzLXZpc2lvbi1zeXN0ZW1zLXN1cHBsaWVycy1mb3ItZXVyb2Ryb25lL9IBAA?oc=5&hl=en-US&gl=US&ceid=US:en,
Airbus Completes First ‘Wing Of Tomorrow’ Prototype - Aviation Week,"Wed, 20 Jul 2022 07:00:00 GMT",https://news.google.com/rss/articles/CBMiZGh0dHBzOi8vYXZpYXRpb253ZWVrLmNvbS9zaG93bmV3cy9mYXJuYm9yb3VnaC1haXJzaG93L2FpcmJ1cy1jb21wbGV0ZXMtZmlyc3Qtd2luZy10b21vcnJvdy1wcm90b3R5cGXSAQA?oc=5&hl=en-US&gl=US&ceid=US:en,"FARNBOROUGH—Airbus has announced that its Wing of Tomorrow team has completed the first of three prototype demonstrators.

“Wing of Tomorrow is about preparing our technologies, preparing our people, preparing our supply chain, and also [making] our physical and digital capabilities ready for our future generation of Airbus aircraft,” says Sue Partridge, head of the program. “Today’s completion of our first wing assembly marks a key milestone along that journey.”

The program, launched in 2016, has been investigating the design, manufacture and industrialization aspects of novel wing concepts, as well as designing for increased performance and lower weight. The demonstrators incorporate over 100 different technologies, some of which may be applicable to extant programs, while others may only find applicability on aircraft yet to be designed.

“There’s three main objectives of the technologies we’re developing,” Partridge says. “The first is about aircraft performance. Alongside the engine, the wing is the biggest lever that we have to improve the performance of the aircraft, so the Wing of Tomorrow demonstrators are focused on looking at selecting a wing architecture that really, really gives us low drag, good lift, very, very good fuel efficiency, and long wings, which drive us towards needing to develop the folding wing tip technology.”

“There’s two other key objectives of the program overall, and they’re very much around our industrial targets [and] cost performance,” she continues. “How can you make a high-performance carbon wing—in order to make a weight reduction—at a low cost? And ... the technologies that we develop need to be capable of being manufactured at a high rate. We’re understanding through developing the technologies and integrating them together what might be the bottlenecks to prevent us from using those technologies on a high-production-rate aircraft.”

The first prototype wingbox was designed at Airbus’ site in Filton, England—which Partridge is head of—and has been assembled at the Advanced Manufacturing Research Center at the company’s plant in Broughton, Wales. Testing will take place at Filton.

The folding wing tip has not yet been fitted; this work will take place at Airbus’s site in Broughton. “In terms of the assembly of the wingbox itself, it doesn’t have a huge effect,” Partridge says. “Although you have the fittings in the wing, the actual installation of the folding wingtip would happen as a second step. It’s a key part of the program but not really a huge driver of the main wingbox assembly itself.”

Each of the three prototypes has a different purpose. And, while each is based on the same architecture and design, there are differences between them. “We have some differences in technologies, because we’re working with different partners, and some partners are delivering three components—one for each of the wings—and the others only one,” Partridge says. “There are some minor differences in the technology bricks in terms of the industrial system we’re gradually building. We have lots of automation technologies we’re deploying, but we’re doing that, some on the first one then building for the second and building for the third to make the progression manageable.”

“The purposes of the three boxes are different,” she adds. “The first one will become our fully equipped box, where we will test our installation technologies as well as our structural technologies; the second one will go down to Filton and be structurally tested at full scale; and the third one is called our ‘run at rate’ box, where we’ll have the full industrial system deployed, and we’ll really be testing the constraints of those industrial technologies and those automation packages to see what the art of the possible is.”"
China OKs jointly built civil helicopter but no nod yet for Airbus' version - Reuters,"Mon, 25 Jul 2022 07:00:00 GMT",https://news.google.com/rss/articles/CBMigQFodHRwczovL3d3dy5yZXV0ZXJzLmNvbS9idXNpbmVzcy9hZXJvc3BhY2UtZGVmZW5zZS9jaGluYS1jZXJ0aWZpZXMtbmV3LWNpdmlsLWhlbGljb3B0ZXItam9pbnRseS1kZXZlbG9wZWQtd2l0aC1haXJidXMtMjAyMi0wNy0yNi_SAQA?oc=5&hl=en-US&gl=US&ceid=US:en,
