Titre,Date de publication,URL,Contenu
"Direct air carbon capture and storage for aviation, explained - Airbus","Mon, 18 Jul 2022 07:00:00 GMT",https://news.google.com/rss/articles/CBMib2h0dHBzOi8vd3d3LmFpcmJ1cy5jb20vZW4vbmV3c3Jvb20vc3Rvcmllcy8yMDIyLTA3LWRpcmVjdC1haXItY2FyYm9uLWNhcHR1cmUtYW5kLXN0b3JhZ2UtZm9yLWF2aWF0aW9uLWV4cGxhaW5lZNIBAA?oc=5&hl=en-US&gl=US&ceid=US:en,"What may sound like science fiction to many is now fast becoming reality. Direct Air Carbon Capture and Storage (DACCS) – which removes human-induced CO 2 directly from the air – could help multiple industries meet their net-zero carbon emissions targets. For hard-to-abate industries like aviation, it is emerging as a promising complementary solution to sustainable aviation fuel and hydrogen.

show more show less Direct Air Carbon Capture & Storage (DACCS) involves removing carbon emissions directly from the ambient air and safely storing them underground. Airbus is partnering with 1PointFive to bring this innovative technology to aviation. Discover how it works.

The sunrises in the Permian Basin, located in southwestern USA, are spectacular. Hundreds of kilometres of pancake-flat, arid scrubland stretch almost endlessly, until they meet the enormous Texan skies on the horizon.

There isn’t much to catch the eye around these parts. But as the road continues and the sun climbs higher into the deep blue sky, the view suddenly changes. Seemingly out of nowhere, a grey and black metal structure – hundreds of metres long and several storeys high – appears shimmering in the distance.

Move closer, it soon becomes clear: this massive structure is unlike anything else around. Embedded within each hangar-like block, a multitude of enormous fans spin like giant air conditioning units. And beyond these fans lies what looks like a manufacturing plant – a maze of metal pipes and storage tanks amid the rugged, dusty landscape.

This is a direct air capture facility through which hundreds of tonnes of carbon are being drawn in from the air. Here, in the year 2030 and in the heart of the Lone Star state, this spectacular creation is now a key bastion in the fight against climate change and the world’s transition to a net-zero energy system.

Carbon Engineering’s direct air capture technology is modelled on industrial cooling towers in which large fans draw air into an air contactor. Airbus has partnered with 1PointFive – Carbon Engineering’s licensed US partner – to bring carbon removals to the aviation industry. <br /> <br /> Photo: © Carbon Engineering

Carbon Engineering has pioneered a direct air capture technology at its pilot plant in Squamish, Canada and has now set its sights on large-scale deployment. Airbus has partnered with 1PointFive – Carbon Engineering’s licensed US partner – to bring carbon removals to the aviation industry. <br /> <br /> Photo: © Carbon Engineering

DACCS: how it works

A direct air capture – or DAC, for short – facility acts like a large-scale, highly efficient tree: it sucks air out of the atmosphere and extracts the CO 2 present there. In 2030, there will likely be dozens of them around the world. Back to the present day, however, and this technology is still in its infancy.

Carbon Engineering is looking to change that. The Canadian company has pioneered a direct air capture technology at its pilot plant in Squamish, Canada and has now set its sights on large-scale deployment. 1PointFive – Carbon Engineering’s licensed US partner – is developing these facilities at a megaton scale in the United States and elsewhere. The DAC facility, targeted to become operational in 2024 in the Permian Basin, is expected to capture up to one million tonnes of CO 2 from the air per year once fully operational. This is roughly equivalent to the work – or absorption capacity – of approximately 40 million trees.

The technology is simple: a large fan draws air into an air contactor, which is modelled on industrial cooling towers. The air passes over thin plastic surfaces with a non-toxic potassium hydroxide solution flowing over them to trap the CO 2 molecules as a carbonate salt.

The carbonate salt is separated from the solution using a pellet reactor. The carbon pellets are then heated in a calciner to release the CO 2 as pure gas. Lastly, the processed pellets are hydrated in a device called a “slaker” and recycled for use in the original capture solution.

The captured pure CO 2 can then either be stored underground or reused for the production of, for example, Power-to-Liquid fuel through a complementary process called AIR TO FUELSTM. The former, known as carbon storage or sequestration, involves injecting the CO 2 into saline formations more than a kilometre below the earth’s surface. As a result, CO 2 is permanently and safely stored underground.



Direct Air Carbon Capture & Storage (DACCS) involves removing carbon emissions directly from the ambient air. Discover how the technology works.

Bringing affordable and scalable carbon removals to aviation

In October 2021, the aviation industry adopted the long-term climate goal of net-zero carbon emissions by 2050. Multiple decarbonisation solutions – technology innovation in aircraft design, new fuels like hydrogen and SAF, efficiency improvements in airport operations and air traffic management, and market-based measures – have all been earmarked to help achieve this goal. But these alone will not suffice to reduce aviation’s CO 2 emissions to the required levels.

According to the Intergovernmental Panel on Climate Change (IPCC), simply eliminating emissions will not be enough for the world to reach net zero by 2050 – removing CO 2 from the atmosphere will also be necessary. And because hard-to-abate industries like aviation cannot capture their emissions at the source, direct air capture is considered a more suitable negative emissions solution.

This is why Airbus has partnered with 1PointFive to bring carbon removals from direct air capture technology to the aviation industry. In fact, Airbus has pre-purchased 100,000 tonnes of carbon removals per year over four years – or 400,000 tonnes in total – from 1PointFive as part of an initial offtake.

Several airlines have shown interest to collaborate with Airbus in this area with the objective to promote direct air capture as an essential pathway, among others, to achieve the industry’s net-zero target. As the aviation industry further refines its course towards net zero, it is partnerships like these – which bring together key stakeholders from both inside and outside the industry – that will be essential to bringing climate-neutral air travel ever closer to reality."
"Delta expands flexible, fuel-efficient Airbus A220 fleet - Delta News Hub","Tue, 19 Jul 2022 07:00:00 GMT",https://news.google.com/rss/articles/CBMiTmh0dHBzOi8vbmV3cy5kZWx0YS5jb20vZGVsdGEtZXhwYW5kcy1mbGV4aWJsZS1mdWVsLWVmZmljaWVudC1haXJidXMtYTIyMC1mbGVldNIBAA?oc=5&hl=en-US&gl=US&ceid=US:en,"Quiet and comfortable, the amenity-rich 130-seat narrowbody offers customers the in-flight experience of a widebody aircraft. Featuring 12 First Class, 30 Comfort+ and 88 Main Cabin seats, our A220-300 aircraft will serve customers traveling domestically and to our coastal hubs.

Airline exercises purchase rights for 12 additional A220-300 aircraft

Popular 130-seat plane offers best-in-class customer experience

State-of-the-art aircraft offer 25% better fuel efficiency than aircraft they will replace

Delta Air Lines will continue to grow its fuel-efficient, state-of-the-art Airbus A220 fleet, exercising rights to purchase 12 new A220-300 aircraft.

It is the latest step towards Delta’s ongoing upgrade and streamlining of its fleet, investing in more sustainable aircraft that provide an elevated customer experience.

“The A220-300 is economical, efficient and delivers superior performance,” said Mahendra Nair, S.V.P. - Fleet & TechOps Supply Chain. “These additional aircraft in the A220 family are an excellent investment for our customers and employees and will be fundamental as we work toward a more sustainable future for air travel.”

The announcement was made at the Farnborough International Airshow in the U.K., the global showcase for innovation in air travel and aerospace. It follows Delta’s announcement of 100 new Boeing 737 MAX aircraft, another milestone in the airline’s journey to reshape the future of air travel.

Article Aircraft Delta adds state-of-the-art, fuel-efficient Boeing 737 MAX to fleet The aircraft will be 20%-30% more fuel efficient than the retiring Delta planes it will replace, making the agreement an important step in Delta’s journey toward a sustainable future for aviation.

Quiet and comfortable, the amenity-rich 130-seat narrowbody offers customers the in-flight experience of a widebody aircraft. Featuring 12 First Class, 30 Comfort+ and 88 Main Cabin seats, our A220-300 aircraft will serve customers traveling domestically and to our coastal hubs.

Delta’s growing A220 fleet reinforces the airline’s commitment to sustainability. Powered by Pratt and Whitney’s latest-generation geared turbofan GTF engines, the A220 offers 25% better fuel efficiency than the aircraft it replaces.

Delta took delivery of its first Airbus A220 in October 2018 and was the first U.S. carrier to operate the aircraft type.

“Delta was the U.S. launch customer for the A220, and with this incremental order, it’s clear the airline and its passengers are pleased with both the economy and comfort of the aircraft,” said Christian Scherer, Airbus Chief Commercial Officer and Head of Airbus International. “The A220 bridges the gap between single-aisle and regional aircraft, and complements Delta’s A320 family fleet by providing short field performance with long range.”

Delta currently has 11 A220-300s in service and 51 on order, including the 12 purchase rights exercised today, which are slated for delivery beginning in 2026. In addition, Delta currently operates a fleet of 45 109-seat A220-100 aircraft."
Missing parts force Airbus to cut near-term supply goals - Reuters,"Wed, 27 Jul 2022 07:00:00 GMT",https://news.google.com/rss/articles/CBMicWh0dHBzOi8vd3d3LnJldXRlcnMuY29tL2J1c2luZXNzL2Flcm9zcGFjZS1kZWZlbnNlL2FpcmJ1cy10cmltcy1kZWxpdmVyeS10YXJnZXQtc2xvd3MtamV0LW91dHB1dC1oaWtlLTIwMjItMDctMjcv0gEA?oc=5&hl=en-US&gl=US&ceid=US:en,
Could an open fan engine cut carbon emissions for more sustainable aviation? - Airbus,"Tue, 19 Jul 2022 07:00:00 GMT",https://news.google.com/rss/articles/CBMidWh0dHBzOi8vd3d3LmFpcmJ1cy5jb20vZW4vbmV3c3Jvb20vc3Rvcmllcy8yMDIyLTA3LWNvdWxkLWFuLW9wZW4tZmFuLWVuZ2luZS1jdXQtY2FyYm9uLWVtaXNzaW9ucy1mb3ItbW9yZS1zdXN0YWluYWJsZdIBAA?oc=5&hl=en-US&gl=US&ceid=US:en,"The technologies being developed for the next-generation fuel-efficient propulsion systems – and whose progress Airbus follows closely – are taking shape at all the big aero-engine makers, here we focus on one of these: CFM International’s “open fan” technology.

The open fan architecture is a key component of the engine maker’s “Revolutionary Innovation for Sustainable Engines” (RISE) technology development programme – which aims to demonstrate and mature a range of new technologies for future engines that could enter service by the mid-2030s.

Going forward, open fan technology will also be the focus of a major Airbus flight demonstration campaign to be performed in collaboration with CFM in the second half of this decade.

show more show less A new Airbus A380 demonstrator to accelerate advanced propulsion technologies through ground and flight testing.

Joint flight-testing ambitions

The joint demonstration programme will use shared flight test assets. Provisionally the plan is for CFM to perform engine ground tests, along with flight test validation at GE Aviation’s Flight Test Operations centre in Victorville, California, USA.

A second phase of flight tests will be performed from the Airbus flight test facility in Toulouse, France, in the second half of the decade. For these tests, the open fan engine will be mounted under the wing of a specially configured and instrumented A380 testbed aircraft.

The joint Airbus and CFM objectives for the open fan joint demonstration on the A380 are extensive. The high-level goals include: evaluation of open fan propulsive efficiency and performance on an aircraft; acceleration and maturity of technologies through ground testing; assessment of aircraft/engine integration and aerodynamics (thrust, drag, loads); and evaluation of internal and external noise levels.

Prediction capabilities are key to find the right design that meets both the fuel efficiency and the acoustic targets (for the communities around airports and also for passengers inside the cabin). And because CFM’s engine and the wing will be very close-coupled, these capabilities have to be developed in close collaboration.

In addition, Airbus and CFM will collaborate on understanding the use of hybrid-electric capabilities and ensuring compatibility with 100% Sustainable Aviation Fuel (SAF).

Preparing the hardware for flight tests on an A380 testbed…

However, before any of the above objectives can be investigated, between now and the first demonstration flight in the second half of the decade, an intensive phase of Engineering preparatory work is planned.

Pascal Arrouy, Airbus’ Open Fan Architect in the “Propulsion of Tomorrow” R&T programme explains: “We will first need to determine the flight physics constraints, design and assessments for the flight-test demonstration (FTD) engine installation. These will include: definition of the pylon ‘aero-lines’ (ie. the aerodynamics and physical geometries), assessment of loads, handling qualities and performance and preparation of modeling to support flight-test analysis.”

In addition, the pylon with the engine mounts and attachment will be jointly designed for minimising weight and vibration transmission to the cabin, as well as engine system integration. The fuselage structure affected by the propulsion system impact will also be studied.

Various aircraft systems will also need to be modified and preparatory tests performed to ensure that the behaviour of the A380 flight test aircraft with an open fan engine installed can be well understood for flight clearance and data validity. Specific areas of focus will include: power management (including open fan compatibility with hybrid-electric aircraft architectures); integration of the engine control systems; flight controls optimisation; fuel distribution; vibration analysis, and instrumentation installation.

“Once all these activities are complete, we will be able to move to the next phase which is the physical manufacture and assembly of the modifications to the aircraft including the new customised pylon,” explains Pascal. “This will be followed by specific tests on engine components to support the dossier needed for ultimate flight clearance of the complete package.”

Meanwhile inside the aircraft, workstations will also be installed to accommodate dedicated flight test engineers and technicians, who will monitor and measure the in-flight performance of the various mission system sensors installed. To this end the aircraft will be heavily instrumented with hundreds of sensors, including microphones, accelerometers, static pressure sensors and cameras.

The big picture ahead

For preparing the future, Airbus is committed to meeting the Paris Agreement targets and leading the decarbonisation of the aviation sector in full collaboration with all stakeholders – including engine manufacturers. Between now and 2035, Airbus’ R&T is focused on testing various technologies to reduce aircraft emissions. These include: alternative fuels with 100% SAF compatibility before 2030; hydrogen technologies; hybridization; wide scope of inter-dependent solutions which will collectively contribute to Airbus’ decarbonisation ambitions. With these planned collaborative tests and demonstration of open fan technology with CFM we will hopefully be a signification set closer to achieving this.

From two counter-rotating fans to a single rotating fan + one fixed…

In the mid-1980s GE developed and flight-tested the GE36 “Unducted Fan” (UDF) engine demonstrator. The GE36 UDF relied on a forward fan that was driven by a dedicated turbine, while the rear fan was driven by another turbine which rotated in the opposite direction.

Fast-forward to 2017, when as part of a European Clean Sky initiative, Safran had developed a revitalised “Contra-Rotating-Open-Rotor” (CROR) concept and subsequently ground-tested it. CROR and the GE36 were both pusher configurations (blades at the rear) featuring two sets of fan blades which rotated in opposing directions.

Building on the CROR research, CFM’s open fan demonstrator includes many improvements and simplifications. This is a puller configuration (blades at the front) where the rear set of blades does not rotate. These rear blades are effectively a set of variable-pitch ‘stators’ which can efficiently manipulate the thrust airflow generated by the rotating front set, while further reducing mechanical complexity, weight and noise. With this change, the engine can direct air flow to fly at speeds consistent with conventional turbo fan engine architectures and deliver an improved cabin experience for passengers."
"Airbus, airlines to explore carbon capture technology - Reuters","Mon, 18 Jul 2022 07:00:00 GMT",https://news.google.com/rss/articles/CBMicGh0dHBzOi8vd3d3LnJldXRlcnMuY29tL2J1c2luZXNzL2Flcm9zcGFjZS1kZWZlbnNlL2FpcmJ1cy1haXJsaW5lcy1leHBsb3JlLWNhcmJvbi1jYXB0dXJlLXRlY2hub2xvZ3ktMjAyMi0wNy0xOC_SAQA?oc=5&hl=en-US&gl=US&ceid=US:en,
"Airbus, Air Canada, Air France-KLM, easyJet, International Airlines Group, LATAM Airlines Group, Lufthansa Group and ... - Airbus","Mon, 18 Jul 2022 07:00:00 GMT",https://news.google.com/rss/articles/CBMieWh0dHBzOi8vd3d3LmFpcmJ1cy5jb20vZW4vbmV3c3Jvb20vcHJlc3MtcmVsZWFzZXMvMjAyMi0wNy1haXJidXMtYWlyLWNhbmFkYS1haXItZnJhbmNlLWtsbS1lYXN5amV0LWludGVybmF0aW9uYWwtYWlybGluZXPSAQA?oc=5&hl=en-US&gl=US&ceid=US:en,"Farnborough, 18 July 2022 – Airbus and a number of major airlines – Air Canada, Air France-KLM, easyJet, International Airlines Group, LATAM Airlines Group, Lufthansa Group and Virgin Atlantic– have signed Letters of Intent (LoI) to explore opportunities for a future supply of carbon removal credits from direct air carbon capture technology.

Direct Air Carbon Capture and Storage (DACCS) is a high-potential technology that involves filtering and removing CO 2 emissions directly from the air using high powered fans. Once removed from the air, the CO 2 is safely and permanently stored in geologic reservoirs. As the aviation industry cannot capture CO 2 emissions released into the atmosphere at source, a direct air carbon capture and storage solution would allow the sector to extract the equivalent amount of emissions from its operations directly from atmospheric air.

Carbon removals via direct air capture technology complement other solutions that deliver CO 2 reductions, such as Sustainable Aviation Fuel (SAF), by addressing remaining emissions that cannot be directly eliminated.

As part of the agreements, the airlines have committed to engage in negotiations on the possible pre-purchase of verified and durable carbon removal credits starting in 2025 through to 2028. The carbon removal credits will be issued by Airbus’ partner 1PointFive – a subsidiary of Occidental’s Low Carbon Ventures business and the global deployment partner of direct air capture company Carbon Engineering. Airbus’ partnership with 1PointFive includes the pre-purchase of 400,000 tonnes of carbon removal credits to be delivered over four years.

“We are already seeing strong interest from airlines to explore affordable and scalable carbon removals,” said Julie Kitcher, Executive Vice President Communications and Corporate Affairs, Airbus. “These first letters of intent mark a concrete step towards the use of this promising technology for both Airbus’ own decarbonisation plan and the aviation sector’s ambition to achieve net-zero carbon emissions by 2050.”

“We’re excited to partner with Airbus. Carbon removal credits from direct air capture offer a practical, near-term and lower cost pathway that enables the aviation industry to advance its decarbonisation goals,” said Michael Avery, 1PointFive’s President.

“Air Canada is proud to support the early adoption of direct air capture and storage as we and the aviation industry move forward on the path to decarbonisation,” said Teresa Ehman, Senior Director, Environmental Affairs at Air Canada. “While we are in the early days of a long journey and much remains to be done, this technology is one of the many important levers that will be needed, along with many others, including sustainable aviation fuel and increasingly efficient and new technology aircraft, to decarbonise the aviation industry.”

“Sustainability is an integral part of the Air France-KLM Group’s strategy. While we activate all levers already at our disposal to reduce our carbon footprint – including fleet renewal, SAF incorporation and eco-piloting, we are also active partners in research and innovation, advancing knowledge on emerging technology in order to improve its price and efficiency. In addition to CO2 capture and storage, the technology opens up very interesting perspectives for the production of synthetic sustainable aviation fuel. The letter of intent we are signing with Airbus today embodies the collaborative approach the aviation industry has initiated to find effective solutions that meet the challenge of our environmental transition. Only together can we address the climate emergency,” said Fatima da Gloria de Sousa, VP Sustainability Air France-KLM.

Jane Ashton, easyJet’s Director of Sustainability, said: “Direct air capture is a nascent technology with a huge potential, so we are very pleased to be part of this important initiative. We believe that carbon removal solutions will be an essential element of our pathway to net zero, complementing other components and helping us to neutralise any residual emissions in the future. Ultimately, our ambition is to achieve zero carbon emission flying, and we are working with partners across the industry, including Airbus, on several dedicated projects to accelerate the development of future zero carbon emission aircraft technology.”

Jonathon Counsell, IAG´s Head of Sustainability, said: “Our industry’s transition will require a

variety of solutions, including new aircraft, sustainable aviation fuels and emerging technologies. Carbon removal will play an important role in enabling our sector to achieve net-zero carbon emissions by 2050.”

“DACCS represents an innovative way not only to remove net carbon from the atmosphere, but it also has the potential to play a part in the development of synthetic sustainable aviation fuels,” said Juan José Tohá, Corporate Affairs and Sustainability Director, LATAM Airlines Group. “There is no silver bullet for decarbonising the industry and we will rely on a combination of measures to reach our net-zero ambitions, including greater efficiencies, sustainable aviation fuels and new technologies, supported by the conservation of strategic ecosystems and quality offsets.”

Caroline Drischel, Head of Corporate Responsibility of Lufthansa Group said: “Achieving net-zero carbon emissions by 2050 is key for the Lufthansa Group. This involves billion euro investments in continuous fleet modernisation and our strong commitment to Sustainable Aviation Fuels. In addition we are exploring new technologies, like advanced and safe carbon capture and storage processes.”

Holly Boyd-Boland, Virgin Atlantic’s VP Corporate Development, said: “Reducing Virgin Atlantic’s carbon footprint is our number one climate action priority. Alongside our fleet transformation programme, fuel-efficient operations and supporting the commercial scalability of sustainable aviation fuels, the removal of CO 2 directly from the atmosphere through innovative carbon capture and storage technologies becomes a powerful tool in reaching our target of net-zero carbon emissions by 2050. We look forward to partnering with Airbus and 1PointFive to accelerate the development of Direct Air Carbon Capture and Permanent Storage solutions alongside our industry peers.”

According to the Intergovernmental Panel on Climate Change (IPCC), carbon removal is required to help the world go beyond climate mitigation and to support the achievement of net-zero targets. In addition, according to the Air Transport Action Group’s (ATAG) Waypoint 2050 report, offsets (mainly in the form of carbon removals) will be needed – between 6% and 8% – to make up any remaining shortfalls in emissions above the goal.

For more information on Direct Air Carbon Capture and Storage, click here.



@Airbus @AirCanada @AirFranceKLM @easyJet #InternationalAirlinesGroup @LATAMAirlines @lufthansaNews @VirginAtlantic @1PointFiveCCUS @CarbonEngineer #DACCS #SustainableAviation #FIA2022"
