Titre,Date de publication,URL,Contenu
Boeing's twin-aisle product strategy provides better segment coverage than Airbus - Leeham News and Analysis,"Fri, 06 Jul 2012 07:00:00 GMT",https://news.google.com/rss/articles/CBMic2h0dHBzOi8vbGVlaGFtbmV3cy5jb20vMjAxMi8wNy8wNi9ib2VpbmdzLXR3aW4tYWlzbGUtcHJvZHVjdC1zdHJhdGVneS1wcm92aWRlcy1iZXR0ZXItc2VnbWVudC1jb3ZlcmFnZS10aGFuLWFpcmJ1cy_SAQA?oc=5&hl=en-US&gl=US&ceid=US:en,"Boeing’s airplane strategy has shifted its focus to twin-aisle aircraft with the decision to proceed with the 737 MAX, says Nicole Piasecki, vice president of Business Development & Strategic Integration for Boeing Commercial Airplanes.

BCA has some critical tasks and choices ahead:

Complete the design and get into production the 787-9;

Launch the 787-10; and

Decide what to do to enhance the 777 to compete with the Airbus A350-1000.

Although launching the 787-10 is considered by most to be a foregone conclusion, it hasn’t happened yet. And although Boeing has been showing some reasonably detailed concepts around about the 777-8X, a 350-passenger replacement for the 777-300ER, and the 777-9X, a 407 passenger aircraft, neither concept is firm—and, according to one airline fleet planner, it’s not even clear Boeing will do much more than simply re-engine the current 777-300ER.

Nonetheless, Piasecki showed a group of reporters the Boeing product planning in a pre-Farnborough Air Show briefing that clearly demonstrates Boeing has better market segment coverage than Airbus today or potentially in the future. (Click to enlarge.)

“We are very happy with this line-up on the left, which very strongly leverages three families of products. When we go to market our ability to offer this product,” Piasecki said. “Customers are looking for airplanes that fit their route network.”

This has led Boeing to somewhat modify its wide-body strategy.

“If they don’t have to carry around so much fuel because they are only flying 5,000 miles, they no longer want that airplane [with more capability]. A year ago…I said all our wide-body airplanes were going to line up at 8,000-8,200nm. Our thinking has shifted…to offering twin aisle airplanes that have 10-15% seat capacity increments because that’s generally where an airline will decide to up-gauge. There is up-gauging going on it the market. We begin to think about difference in ranges within the family. We have a mid-range…and a longer-haul wide-body market. Both are very viable.”

This is the basis on which the 787-10 is currently going to have a range of about 6,900nm. It’s also the strategy Airbus outlined as it promoted the A330-300 as an airline ideally suited for intra-Asia, mid-range trans-ocean and mid-range European routes. Once an aircraft with a modest, intermediate range, the A333 has been improved to a range of not quite 6,000nm. This is well short of the planned range for the 787-10, but it is more than enough for most routes.

Boeing’s illustration above clearly shows the Airbus gaps, one of which is particularly acute between the 350-seat A350-1000 and the 525-seat A380. (It should be noted that airlines often configure the A380 in the high 400s and one, Korean, even as low as about 410. Likewise, Lufthansa–so far the only operator of the 747-8I–configured the airplane for about 380 passengers.)

The 777-9X, if it proceeds as currently being shown to airlines, has a three-class capacity of 407, thrusting it into the lowest end of the Very Large Airplane (VLA) category (>400 seats) that currently is occupied by the 747-8I and the A380.

Share this: Print

Email

Twitter

Pinterest

Facebook

WhatsApp

LinkedIn

Tumblr

Reddit

"
Airbus to take measures after Rio-Paris crash report - RFI English,"Thu, 05 Jul 2012 07:00:00 GMT",https://news.google.com/rss/articles/CBMiWWh0dHBzOi8vd3d3LnJmaS5mci9lbi9hbWVyaWNhcy8yMDEyMDcwNS1haXJidXMtdGFrZS1tZWFzdXJlcy1hZnRlci1yaW8tcGFyaXMtY3Jhc2gtcmVwb3J00gEA?oc=5&hl=en-US&gl=US&ceid=US:en,"France - Brazil

Airbus said on Thursday that it would take all necessary measures, after a French accident investigation report into the 2009 crash of an A330 jet from Rio de Janeiro to Paris in which 228 people died, partly blamed the plane’s ergonomics.

Advertising Read more

Airbus said it had “already started work at an industrial level to reinforce demands concerning the Pitot speed sensors”, which were also called into question by the investigation.

The final report released on Thursday by the French aviation safety authority, BEA, said the plane crashed into the Atlantic because of both human and technical failings.

The report made 25 new safety recommendations on top of the 25 called for in a July 2011 report.

BEA said the drama began with the malfunctioning of speed sensors, known as Pitots, manufactured by the French company, Thales, which have since been replaced on Airbus planes.

The crew was in a state of almost total loss of control of the situation, the investigation chief Alain Bouillard told journalists

The BEA report stressed the importance of “pilots’ training, so that they have a better knowledge of the plane’s systems in the event of an unusual destination.”

The report’s findings were eagerly awaited amid a bitter row between Airbus and Air France over who ultimately bears responsibility for the crash.

Air France has insisted the pilots were not to blame, saying the stall alarm had malfunctioned.

French magistrates are investigating Air France and Airbus for alleged manslaughter in connection with the crash.

Victims’ families had previously alleged that the involvement of big French corporations, such as Airbus and Air France was influencing the probe into the causes of the disaster.

A separate judicial report is to be presented to families next Tuesday.

Daily newsletterReceive essential international news every morning Subscribe"
Farnborough Airshow wrap: Airbus fight back futile against Boeing momentum - Aerospace Technology,"Mon, 09 Jul 2012 07:00:00 GMT",https://news.google.com/rss/articles/CBMiV2h0dHBzOi8vd3d3LmFlcm9zcGFjZS10ZWNobm9sb2d5LmNvbS9mZWF0dXJlcy9mZWF0dXJlZmFybmJvcm91Z2gtYWlyc2hvdy1haXJidXMtYm9laW5nL9IBAA?oc=5&hl=en-US&gl=US&ceid=US:en,"Boeing has secured a major deal with Air Lease Corp for the sale of 75 737 MAX aircraft, with Air Lease Corp CEO Steven Udvar-Hazy heralding design improvements made to the jets in recent months.

The order will comprise of 60 737-8 MAX aircraft and 15 737-9 airliners, with deliveries scheduled to start in 2018 and run through to 2022. ALC will also reserve options for a further 25 MAX aircraft, with Udvar-Hazy adding: ""We have done an exhaustive analysis of this aircraft and it shows a performance improvement of 12-13% over the 737-8 and 737-9.

""The MAX is a wonderful replacement for the classic 737s and other single-aisle aircraft around the world.""

Boeing revival after Paris washout

""The faltering eurozone economy and slow growth in China are being blamed for the subdued level of commitment seen at the show.""

The US-based aircraft manufacturer followed up ALC’s order by announcing that aircraft leasing firm GECAS had committed to purchase 100 737 aircraft, comprising of 75 MAX 8s and 25 Next-Generation 737-800s. Ray Conner, Boeing Commercial Airplanes president, heralded the importance of the fuel-efficient aircraft, stating: ""This commitment confirms the value of the 737 MAX in today’s competitive marketplace.""



The orders mark a significant turn around in fortunes for Boeing after it suffered at the hands of Airbus’s A320neo aircraft at the Paris Air Show in 2011. Boeing ended the event trailing in terms of orders and is still behind the A320, but the early activity and Uvdar-Hazy’s endorsement of the aircraft is likely to boost Boeing.

Airbus did, however, respond with the announcement of a potential $4.2bn order for its A350 passenger jet from Hong Kong-based airline Cathay Pacific. The order comprises of ten new A350-1000 aircraft, with Cathay Pacific converting an existing order for 16 A350-900 aircraft to the larger A350-1000 model.

Airbus may also take solace from further endorsements for its Sharklet winglet devices. Etihad Airways has now decided to take some of the A320s it had on order with the Sharklet winglets, which Airbus claim can provide around 3.5% fuel burn improvement on long-range flights. Of the 20 A320s Etihad has on order, 17 will now be delivered with the devices.

Warnings of subdued show

Despite the flurry of early activity, there have been warnings for those who have expected surprise announcements of lucrative orders or investment. Although both Airbus and Boeing have made eye-catching announcements, both orders were documented prior to the show’s opening, with both manufacturers falling behind the levels previously set at Paris 2011.

The faltering eurozone economy and slow growth in China are being blamed for the subdued level of commitment seen at the show, despite airlines feeling the need to modernise fleets in order to reduce the impact of high fuel costs.

Politicians visit Farnborough to boost UK aerospace

Whilst aerospace delegations have continued to swarm towards Farnborough, UK Prime Minister David Cameron toured Farnborough on its opening day in order to push exports of the Eurofighter Typhoon. Senior delegates from Malaysia, Oman and Saudi Arabia were briefed as to the Typhoon’s capabilities.

""The UK Government is to provide financial support of £120m, with £40m earmarked for the Siloet programme.""

David Cameron’s visit was followed up by the presence of Business Secretary Vince Cable on the second day of the show, who visited to announce an investment of £120m in aerospace research and technology.

The UK Government is to provide financial support of £120m, with £40m earmarked for the Siloet programme into advanced low-carbon engines research, which is currently led by Rolls-Royce, with Cable adding: ""I don’t feel embarrassed to say we want to support this industry and that it is a winner.""

Work into the Siloet programme will focus on light-weight materials, lean-burn systems and advanced components.

The financial support will also include £60m for a new aerodynamic centre to be established in the UK, with £15m to be invested into 11 further research and development technologies within the UK. A further £3m will be allocated to fund 500 additional places for aeronautical engineers to take Masters degrees."
Cathay ends Airbus A350-1000 drought - Reuters,"Tue, 10 Jul 2012 07:00:00 GMT",https://news.google.com/rss/articles/CBMiLmh0dHBzOi8vd3d3LnJldXRlcnMuY29tL2FydGljbGUvaWRVU0xORTg2OTAyMi_SAQA?oc=5&hl=en-US&gl=US&ceid=US:en,
United Says No to A380 While Considering Big Boeing and Airbus Jets - NYCAviation,"Sun, 08 Jul 2012 07:00:00 GMT",https://news.google.com/rss/articles/CBMiZmh0dHBzOi8vd3d3Lm55Y2F2aWF0aW9uLmNvbS8yMDEyLzA3L3VuaXRlZC1zYXlzLW5vLWEzODAtd2hpbGUtY29uc2lkZXJpbmctYmlnLWJvZWluZy1haXJidXMtamV0cy8yMzgzMdIBAA?oc=5&hl=en-US&gl=US&ceid=US:en,"United Airlines President and CEO Jeffrey Smisek is looking for aircraft larger than the A350-900, but has seemingly ruled out the Airbus A380 as a future addition to the United fleet.

Speaking to Aviation Week during a visit to Frankfurt, Smisek said, “The A380 is probably a little large for what we need, but the A350-900 might be sub-optimal for some of our routes,” adding “the A350-1000, Boeing 777X and Boeing 747-8 Intercontinental are all being considered for higher capacity, long-haul segments.”

United Airlines plans to take delivery of their first Boeing 787-8 Dreamliner in September, followed by another five before the end of the year."
Farnborough: Malaysia Airlines Airbus A380 Inside and Out - Airline Reporter,"Fri, 13 Jul 2012 07:00:00 GMT",https://news.google.com/rss/articles/CBMiYWh0dHBzOi8vd3d3LmFpcmxpbmVyZXBvcnRlci5jb20vMjAxMi8wNy9mYXJuYm9yb3VnaC1tYWxheXNpYS1haXJsaW5lcy1haXJidXMtYTM4MC1pbnNpZGUtYW5kLW91dC_SAQA?oc=5&hl=en-US&gl=US&ceid=US:en,"Malaysia Airlines recently took delivery of their first Airbus A380 and brought its second to the Farnborough Airshow to show it off.

Invited guests were allowed to take a tour of the interior and everyone with-in sight of the airport was able to see the A380 perform in the sky.

If the livery doesn’t look familiar to you, that is because the airline decided to give all their A380’s a special livery. The livery was a surprise (or a last minute decision), since the aircraft first flew with the standard livery on the tail. When seeing the design in photos, I wasn’t so sure what to think about it, but it really pops in person.

The main problem is the outside color scheme doesn’t match the inside. While the outside uses different shades of blue, the interior uses reds, which is a bit of a mind boggle when first boarding, but I am sure most people won’t even notice.

The airline decided to put their eight First Class seats, which are laid out in a 1-2-1 formation, on the main deck, at the front. First Class are mini-suites that contain a lay-flat bed, 89″ pitch, 23″ screen, power at the seat and a personal closet. To create a sense of height (literally), there are not overhead bins in First Class.

I have to say that the product seemed quite impressive, but I was not a fan of the materials and colors. A bit too much red and brown for my taste, but it could be cultural. I think I could probably get over the coloring and enjoy the product.

Business Class is found on the front part of the upper deck and is in a 2-2-2 configuration. The 66 full flat seats have a 74″ pitch, a 17″ screen and a power supply.

This Business Class is a pretty standard product out in the industry today — which is not a bad thing. There seemed to be plenty of storage (especially those seats up stairs with the side-bins) and the color I liked.

Economy is set up in a 2-4-2 on the upper deck and 3-4-3 on the main deck. They offer 32″ of pitch, seat power, and a 10.6″ screen.

If you are going to be flying in economy, trying getting a seat on the upper deck. Not only do you get to feel special for being on the upper deck, but if you score a window seat, you will be rewarded with extra arm room and a cubby between your seat and the wall.

One thing you will not find in the First Class cabin or the entire upper deck are baby bassinets. That is because Malaysia Airlines will only allow babies to fly in the economy section on the main deck.

Behind the cockpit, there are three small rooms. Two are rest areas for the pilots and one is their private lavatory. The cockpit is located between the A380’s two decks, so it takes a few steps to get in.

The actual cockpit itself is huge. We had about six people in it with no problem what-so-ever. You could really throw a party up there, but it is probably best to just stick with flying.

It was all well and fun checking out the inside of the A380, but the real impressive part was seeing this beast in the air, doing aggressive maneuvers during Farnborough. I am sure A380 pilots do not get to experience flying the world’s largest airliners like that very often. What a great treat for them and for those of us on the ground.

ADDITIONAL MALAYSIA AIRLINES AIRBUS A380 PHOTOS (even more on Flickr):

[nggallery id=12]



David Parker Brown EDITOR-IN-CHIEF & FOUNDER - SEATTLE, WA. David has written, consulted, and presented on multiple topics relating to airlines and travel since 2008. He has been quoted and written for a number of news organizations, including BBC, CNN, NBC News, Bloomberg, and others. He is passionate about sharing the complexities, the benefits, and the fun stuff of the airline business. Email me: david@airlinereporter.com https://www.airlinereporter.com"
Cathay Pacific Orders 10 Airbus A350-1000 Widebody Jets - NYCAviation,"Wed, 11 Jul 2012 07:00:00 GMT",https://news.google.com/rss/articles/CBMiYWh0dHBzOi8vd3d3Lm55Y2F2aWF0aW9uLmNvbS8yMDEyLzA3L2NhdGhheS1wYWNpZmljLW9yZGVycy0xMC1haXJidXMtYTM1MC0xMDAwLXdpZGVib2R5LWpldHMvMjM5MDXSAQA?oc=5&hl=en-US&gl=US&ceid=US:en,"Cathay Pacific Airways on Tuesday agreed to buy 10 Airbus A350-1000 aircraft, becoming the plane type’s launch customer.

The Hong Kong-based carrier also converted 16 existing orders for A350-900s to the bigger -1000 variant.

Cathay now has a total of 48 Airbus A350s on order. The airline will also lease two additional A350s.

The A350-1000 recently underwent a design modification which will give it 600 nm additional range compared to the original mockups. It will carry 350 passengers in a three class layout up to 8,400 nm, ideal for Cathay’s long-haul ops to Europe and North America.

Rolls-Royce Trent XWB engines delivering 97,000 lbs of thrust – the most powerful engines ever developed for an Airbus aircraft — will power the A350-1000."
Airbus Spreads Its Wings in Alabama - CNBC,"Mon, 02 Jul 2012 07:00:00 GMT",https://news.google.com/rss/articles/CBMiIGh0dHBzOi8vd3d3LmNuYmMuY29tL2lkLzQ4MDQ1MDEy0gEkaHR0cHM6Ly93d3cuY25iYy5jb20vYW1wL2lkLzQ4MDQ1MDEy?oc=5&hl=en-US&gl=US&ceid=US:en,"The company announced the new plant with state and local leaders in Alabama. Airbus is investing $600 Million into building the plant which will eventually employ approximately 1,000 workers. After considering a final plant in the U.S. for seven years, the European plane maker finally decided to commit to the U.S.

“The town is right, the talent is right, and the time is right,“ said Fabrice Bregier, CEO of Airbus.

For Alabama, the U.S. and Airbus adding a final assembly plant in Mobile is a big deal. Commercial airplane final assembly plants are among the most coveted manufacturing operations in the world, primarily because they generate so many jobs directly and indirectly. Another factor is the scarcity of commercial airplane final assembly plants. For Airbus, this will be just its fourth in the world, joining one in Germany, one in France, and another in China.

“This will shape the future of the region for years to come,” said Alabama Governor Robert Bentley.

For the U.S. economy and manufacturers, the Alabama plant is confirmation that the cost and efficiencies of building original products in the U.S. makes sense for global companies. While the U.S. used to be considered too expensive for many manufacturers, the lower dollar combined with skilled labor and manufacturing efficiencies now make building in the America a smart decision.

The new plant is expected to be up and running by 2015 when it will start producing new Airbus A320 models. The A320 is a popular narrow body plane flown on short and medium haul routes. Airbus has 3,293 on backlog and that number could grow later this decade as airlines around the world upgrade from older A320 models to the new A320neo, which will be 15 percent more fuel efficient. The A320 family is also at the heart of an intense battle between Airbus and Boeing for dominance of narrow body plane market.

In announcing the new plant in Mobile, Airbus CEO Fabrice Bregier acknowledged American Airlines , U.S. Airways and Virgin America have ordered Airbus planes.

-By CNBC's Phil LeBeau

@Lebeaucarnews"
Boeing wins $14.7 billion jet order from United - CNN,"Thu, 12 Jul 2012 07:00:00 GMT",https://news.google.com/rss/articles/CBMiR2h0dHBzOi8vbW9uZXkuY25uLmNvbS8yMDEyLzA3LzEyL25ld3MvY29tcGFuaWVzL2JvZWluZy11bml0ZWQvaW5kZXguaHRt0gEA?oc=5&hl=en-US&gl=US&ceid=US:en,"United Airlines placed an order for 150 Boeing 737 jets, worth $14.7 billion.

NEW YORK (CNNMoney) -- United Airlines on Thursday announced an order for 150 Boeing 737 jets, planes worth $14.7 billion at list prices.

The dea, announced in Chicago, the corporate home for both companies, is for 100 of the 737 MAX 9, as well as 50 of the 737-900ER extended range jets. The airline will take delivery of the jets between 2013 and 2022. The deal also includes an undisclosed number of options for additional aircraft.









Negotiations on the deal took about a year, said Jeff Smisek, CEO of United parent United Continental Holdings. He said the new jets will be more reliable and far more efficient, cutting fuel consumption by about 15% compared to the aircraft they replace.

Boeing being the sole supplier of the order is a victory for the aircraft maker in its competition with European rival Airbus. When American Airlines ordered 200 of the 737 jets from Boeing two years ago, it also ordered an additional 260 A320 aircraft from Airbus.

Smisek said that United had talked to both Airbus and Boeing before deciding to go only with Boeing on this order, its first since the 2010 merger of United and Continental.

The order is the largest for Boeing since the record $22 billion sale of 230 of the various 737 models to Lion Air, the largest airline in Indonesia, in November 2011.

The 737 MAX 9 will replace some A320 Airbus jets in the United fleet, but Smisek said that United has about 152 Airbus jets in its fleet and orders for 25 more, so ""we'll have Airbus for a long time."" The extended range 737's will be used to replace older, less efficient Boeing aircraft.

Even though the order was announced in Chicago, it will be counted in Boeing's sales total at the Farnborough air show taking place outside of London. The company announced orders for 98 other 737 jets from Air Lease Corp. (AL) and Virgin Australia.

There were also commitments for another 145 of the jets from GE Capital Aviation Services, the aircraft leasing unit of General Electric (GE, Fortune 500), and from overseas leasing companies ALAFCO and Avalon.

Boeing said the value of all the orders and commitments since the start of the air show stands at $35.6 billion, although that does not include the undisclosed value of the Virgin Australia deal.

By contrast, Airbus said it won about $16.9 billion worth of business for a total of 115 aircraft during the show.

Shares of Airbus parent European Aeronautic Defence and Space Co. (EADSY) fell 1.2% in trading Thursday, while shares of Boeing (BA, Fortune 500), a Dow Jones industrial average component, slipped 0.5%, which was still better than the larger declines in blue chip indexes.

Shares of United Continental (UAL, Fortune 500) fell 5%."
Airbus A400M tactical airlifter to get Thales TopOwl Helmet Mounted Sight and Display - The Aviationist,"Tue, 17 Jul 2012 07:00:00 GMT",https://news.google.com/rss/articles/CBMiMGh0dHBzOi8vdGhlYXZpYXRpb25pc3QuY29tLzIwMTIvMDcvMTcvYTQwMC1obXNkL9IBAA?oc=5&hl=en-US&gl=US&ceid=US:en,"During the Farnborough Airshow 2012, Thales announced that its TopOwl Helmet Mounted Sight and Display (HMSD) has been selected by the Operation for Joint Armaments Cooperation to be flight tested on the Airbus A400M “Atlas”.

Scheduled between June 2012 and April 2013, the tests will have to validate the use of the HMSD by the military transport aircraft crew during night missions.

Image credit: Thales

TopOwl incorporates a night vision function: it provides the same levels of performance as the latest generation of night vision googles (NVG) with a significantly higher level of comfort for the wearer, enabling pilots to fly long missions in complete safety.

The TopOwl visor-projected intensified night vision image is a vast improvement over conventional night vision optics by providing far superior environmental perception along with excellent peripheral vision (something lacking in other systems).

TopOwl itself isn’t new, having already been combat proven in Afghanistan and Libya during night missions by attack helicopters, but it’s the first time the system is going to be used in a fixed wing aircraft.

Richard Clements for TheAviationist.com

Image credit: David Cenciotti

Related Articles"
Drukair-Royal Bhutan Airlines Buys Airbus A319 With Sharklets - NYCAviation,"Wed, 11 Jul 2012 07:00:00 GMT",https://news.google.com/rss/articles/CBMiZ2h0dHBzOi8vd3d3Lm55Y2F2aWF0aW9uLmNvbS8yMDEyLzA3L2RydWthaXItcm95YWwtYmh1dGFuLWFpcmxpbmVzLWJ1eXMtYWlyYnVzLWEzMTktd2l0aC1zaGFya2xldHMvMjM5MDLSAQA?oc=5&hl=en-US&gl=US&ceid=US:en,"Drukair-Royal Bhutan Airlines has ordered an Airbus A319 with Sharklets, the airframer’s new wingtip-mounted fuel savings devices.

The new jet, with a list price of $80.7 million, will complement the Bhutan government-owned carrier’s existing fleet of two A319s.

Perched on the eastern end of the Himalayas and nestled between India and China, Bhutan is a small, landlocked country with a growing reliance on air service. Drukair’s hub at Paro Airport sits at an elevation of 7,000 ft, and is accessible only by a visual approach, making it one of the most challenging in the world.

“We are delighted to be ordering the Airbus A319 equipped with fuel saving Sharklets,” said Dasho Sonam Tshering Drukair Chairman, in a statement. “The addition of a third A319 will enable us to increase capacity and open up new direct routes and to welcome even more visitors to our landlocked country where aviation really is our gateway to the world. Its economic importance cannot be overestimated.”

Drukair plans to expand its existing routes within the region and add new service to Singapore and Hong Kong using the new aircraft."
