Titre,Date de publication,URL,Contenu
Airbus reshapes A350 cabin to accommodate up to 30 more seats - Flightglobal,"Thu, 21 Jul 2022 07:00:00 GMT",https://news.google.com/rss/articles/CBMiemh0dHBzOi8vd3d3LmZsaWdodGdsb2JhbC5jb20vZmFybmJvcm91Z2gtMjAyMi9haXJidXMtcmVzaGFwZXMtYTM1MC1jYWJpbi10by1hY2NvbW1vZGF0ZS11cC10by0zMC1tb3JlLXNlYXRzLzE0OTU0Mi5hcnRpY2xl0gEA?oc=5&hl=en-US&gl=US&ceid=US:en,"Airbus is nearing introduction of a new interior configuration standard for the A350 which will permit 10-abreast economy seating and potentially add 30 seats to the aircraft’s accommodation.

The densification change will allow the A350-1000 to carry “well over” 400 passengers in certain configurations, chief commercial officer Christian Scherer told FlightGlobal at the Farnborough air show.

He says the new standard provides “increased volume” inside the cabin which allows the airframer to “very comfortably” put a 10-abreast layout in economy, and provide 20-30 more seats depending on the pitch.

Scherer stresses that this is achieved “without compromising seat width”, and involves fitting such features as a slightly-reshaped cabin wall lining, so the walls are “pushed out a little bit”, providing additional interior width.

“That’s something that’s beginning to get good resonance in the market, because the comfort standards of the A350 have proven to be unparalleled,” he says.

“The cabin altitude on the airplane, the air quality, the sound levels of the A350 provide passengers with a very unique comfort environment.”

Initial aircraft featuring the new standard will be entering service shortly.

Airbus previously put the typical accommodation of the A350-1000 at 369 seats in a two-class layout, including 54 business seats and 315 nine-abreast economy seats.

The denser cabin option would bring the aircraft closer to the Boeing 777-9 which has a basic two-class layout of 414 seats – comprising 42 in business and 372 in 10-abreast economy.

While the update will raise the seating capacity of the A350-1000, Airbus is not immediately entertaining thoughts of designing a physically larger variant of the twinjet type – despite recent remarks from Emirates Airline president Tim Clark and IATA head Willie Walsh that the -1000 is too small and Airbus should consider an aircraft capable of seating at least 350 passengers in four classes.

Scherer says that Airbus takes “good note” of Clark’s comments, particularly as he remains a “champion” of the A380 – the discontinuation of which left the A350-1000 as Airbus highest-capacity offering.

“His arguments are well taken,” says Scherer. “Do we look at solutions, possible developments on A350s for additional seats? Of course we do. We constantly do, because of the [reduced] unit cost and to improve productivity of the programme.

“Is there anything on the drawing board to stretch the airplane, make it bigger? No there isn’t – but are we looking at it? For sure we are.

“We’re just out of the worst downturn we’ve ever seen in this industry. And we’re at an air show, so people saying ‘I need bigger airplanes’ is great stuff. But it’s not going to precipitate the development of a new airplane.”

Scherer says Airbus is “quite happy” with the performance of the A350, and adds the company is witnessing “a lot of interest on the widebodies coming back”.

“We need to come out of this pandemic and we need to so soberly, with solid transactions,” he says. “We’re not so much in the business of rehashing old deals, we’re looking forward, so I’m quite confident.”"
Airbus and Boeing Report June 2022 Commercial Aircraft Orders and Deliveries - Defense & Security Monitor,"Mon, 18 Jul 2022 07:00:00 GMT",https://news.google.com/rss/articles/CBMifmh0dHBzOi8vZHNtLmZvcmVjYXN0aW50ZXJuYXRpb25hbC5jb20vMjAyMi8wNy8xOC9haXJidXMtYW5kLWJvZWluZy1yZXBvcnQtanVuZS0yMDIyLWNvbW1lcmNpYWwtYWlyY3JhZnQtb3JkZXJzLWFuZC1kZWxpdmVyaWVzL9IBAA?oc=5&hl=en-US&gl=US&ceid=US:en,"Satisfactory orders haul ahead of Farnborough. Boeing reports solid deliveries, 737 MAX rate increase.

by J. Kasper Oestergaard, European Correspondent, Forecast International.

Boeing and Airbus delivered 51 and 58 commercial jets in June 2022, compared to 45 and 77 deliveries, respectively, in the same month last year. Year to date, Boeing and Airbus have delivered 216 and 295 aircraft, compared to 156 and 297, respectively, in the first half of 2021. So far this year, Boeing is 60 deliveries ahead and Airbus is two deliveries behind last year’s totals. June was a strong month for Boeing, and one would have to go all the way back to March 2019 to find a month with higher shipments.

Following a more than challenging 2020 due to the COVID-19 pandemic, 2021 was a year of recovery for the two largest commercial plane makers. 2022 is well underway and is expected to be another year of recovery for the commercial aircraft manufacturing industry, despite events currently unfolding in Ukraine. Boeing and Airbus still have a long way to go before deliveries are back to pre-pandemic levels, though.

For the full year 2021, Boeing delivered 340 aircraft, compared to 157 in 2020 and 380 in 2019. Boeing’s last “normal” year was 2018 – before COVID-19 and the 737 MAX grounding – when it delivered 806 jets, a level that will likely not be recaptured before 2024 or 2025. The past three years have been extremely challenging for Boeing but, despite ongoing Dreamliner quality issues and 777X delays, the outlook is bright.

The 737 MAX is approved to fly in nearly every country, and since late 2020 the fleet has flown more than one million flight hours. The aircraft, however, has not yet returned to commercial service in China despite the fact that the Civil Aviation Administration of China (CAAC) ungrounded the 737 MAX in December of last year. For example, China Eastern Airlines recently announced that aircraft modifications and further pilot training are needed before it can resume commercial service with the aircraft. The top reason for the 737 MAX’s absence in the skies over China is most likely the nation’s zero-COVID approach, which has wreaked havoc on domestic air travel; hence, there has been no need to add the 737 MAX capacity. In mid-June it was reported that China Southern Airlines is making test flights, as domestic demand is now looking to pick up again. In July, Air China also carried out a test flight with a 737 MAX.

In 2021, Airbus delivered 611 aircraft and won the deliveries crown for the third year in a row. Deliveries were up from 566 in 2020 but remain well below the company’s all-time record high of 863 shipments in 2019. Airbus is expected to retain the deliveries lead for the foreseeable future due to the company’s comfortable backlog lead over its American rival. Prior to 2019, Boeing had out-delivered Airbus every year since 2012.

As indicated above, in June 2022, Boeing delivered 51 jets, including 44 737s (43 MAX / 1 NG), four 767s, and three 777s. As of June, the 737 program is producing aircraft at an official rate of 31 per month, up from 27 per month in May. The rate of 27 per month was maintained between November 2021 and May 2022 and, prior to that, the monthly rate was just 19. Recently, The Seattle Times reported that delays in the supply of parts had resulted in a slowdown in 737 MAX production. Despite the rate increase and strong 737 MAX deliveries in June in general, supply chain issues are likely to persist for the time being. According to Reuters, Boeing has preliminary plans to boost 737 production to 38 jets per month in the first half of 2023, followed by another increase to 47 jets per month by the end of 2023.

Boeing 787 Dreamliner deliveries have now been suspended for more than a year, and it is unknown exactly when shipments will resume. Boeing suspended Dreamliner deliveries in May 2021 for the second time in less than a year. The Federal Aviation Administration is reviewing Boeing’s method for inspecting and evaluating the aircraft to ensure it meets federal safety regulations. In February, the head of the FAA, Steve Dickson, stated that the agency needs a “systemic fix” from Boeing to address Dreamliner production issues and would not allow the company to self-certify individual new jets when deliveries resume. Boeing recently advised key airlines and parts suppliers that Dreamliner deliveries would resume in the second half of 2022. In June, Bloomberg reported that Boeing is “almost there” with regard to restarting 787 deliveries. The current 787 production rate is approximately two aircraft per month, and Boeing expects to continue at this rate until deliveries resume and then return to five per month over time. In March of this year it was reported that the company is currently testing the ability of suppliers to meet output scenarios as high as seven per month by the end of 2023.

The 777 program was expected to get a new addition in late 2023 with the first delivery of the 777X, but in April Boeing announced this will now not happen before 2025. This reflects an updated assessment of the time required to meet certification requirements. According to Boeing, the 777-9 production rate ramp-up is being adjusted to minimize inventory and the number of planes requiring “change incorporation,” including a temporary pause through 2023. However, Boeing is taking advantage of the adjustment to the 777-9 production schedule by adding 777 freighter capacity starting in late 2023. In January of this year, Boeing launched a new 777X-based freighter, thereby expanding its 777X and cargo portfolio. Qatar Airways will be the 777-8F launch customer.

In June 2022, Airbus delivered 58 jets, including six A220s, 47 A320s (all NEO), two A330s, and three A350s. During 2021, Airbus steadily increased A320 production from 40 per month to 43 in Q3 2021 before finishing the year at a rate of 45 per month. Production will continue to be increased until reaching a monthly rate of 65 by the summer of 2023. Airbus has also discussed a scenario with a rate of 70 by Q1 2024. On May 4, Guillaume Faury, the CEO of Airbus, announced that the company continues to see strong growth in commercial aircraft demand driven by the A320 family. As a result, Airbus is now working with its supply chain to increase the A320 production rate to 75 aircraft per month in 2025. The A321XLR successfully accomplished its first flight on June 15, 2022. Entry into service, initially planned for the end of 2023, is now expected to take place in early 2024.

The A220, meanwhile, is being produced at a rate of five aircraft per month. The rate will be increased to six in the coming months – with a monthly production rate of 14 envisioned by the middle of the decade. The A350 production rate currently averages five per month and will be increased to six by early 2023. Airbus is currently producing two A330s per month, a rate that will be increased to nearly three aircraft by the end of 2022.

In 2021, Airbus launched the new A350 freighter, or A350F, which is a major and much-needed boost to the company’s competitiveness in the cargo segment. Boeing has long dominated the cargo space with its 737-800BCF, 767-300BCF, 767-300F, 777F, 777-8F and 747-8F offerings. Until now, Airbus has only offered the A330-200F, which has not performed well in competition against Boeing’s popular 767-300F. With the launch of the A350F, it appears Airbus is getting serious about capturing more of the cargo aircraft market. The A350F, which carries up to 120 tons (109 metric tons) of cargo, received its first order in November and will predominantly compete with the 777F. In comparison, the 777F has a cargo capacity of up to 112 tons (102 metric tons). To date, the A350F has accumulated 31 net new orders.

Turning to the June orders review, both companies had a satisfactory month. Boeing booked orders from three customers for a total of 50 jets. However, the company also reported 35 cancellations (29 737 MAXs and six 787s), resulting in just 15 net new orders in total. The largest order, for 48 737 MAXs, was placed by an undisclosed customer. Also, FedEx Express ordered a single 777F. Finally, American Airlines ordered a single 737 MAX for the second consecutive month. Year to date, Boeing has accumulated 186 net new orders (286 gross orders). In 2021, Boeing booked 909 gross orders and received 430 cancellations, for a total of 479 net new orders (before ASC 606 changes). Please note that for comparison reasons, we do not include the so-called ASC 606 accounting adjustments in the numbers reported in this article and regard net new orders as gross orders minus cancellations.

In June, Airbus booked orders from seven customers for a total of 78 jets and reported 10 cancellations, resulting in 68 net new orders. The largest order by far was placed by Qantas Airways and included 20 A220-300s, 20 A321XLRs and 12 A350-1000s. The Qantas order was announced in early May but not finalized before last month. Also, an undisclosed customer ordered seven A350 freighters and Turkish low-cost carrier Pegasus Airlines booked eight A321neos. Finally, International Airlines Group (IAG) ordered five A320neos and one A321neo, Silk Way West Airlines booked two A350Fs, and Delta Air Lines placed an order for a single A330-900.

Year to date, Airbus has accumulated 259 net new orders (442 gross orders). In 2021, Airbus booked a total of 771 gross orders and received 264 cancellations, for a total of 507 net new orders – enough to win the orders crown for the third year in a row. It should be noted, however, that if Boeing’s 2021 ASC 606 adjustments are included, Boeing comes out ahead with 535 net new orders.

It will be very interesting to track the ordering activity at this month’s Farnborough International Airshow. Given the current economic uncertainty and resurgence of COVID in some parts of the world, it is unknown if airlines and leasing companies will have an appetite for fleet renewal and expansion or if they are in wait-and-see mode. What we do know is that Airbus will likely present a major order for as many as 292 A320neo family aircraft combined for Air China, China Eastern, China Southern, and Shenzhen Airlines. The order was announced in early July but has not yet been firmed up. Also, rumors are circulating that Delta Air Lines is close to ordering more than 100 Boeing 737 MAX 10 narrowbody jets.

At the end of June 2022, Airbus reported a backlog of 7,046 jets, of which 6,376, or 90 percent, were A220 and A320ceo/neo family narrowbodies. This is 679 aircraft below the company’s all-time backlog record of 7,725 aircraft set in January 2020. By the end of June, Boeing’s backlog (total unfilled orders before ASC 606 adjustment) was 5,106 aircraft, of which 4,101, or 80 percent, were 737 NG/MAX narrowbody jets. Boeing’s all-time backlog high of 5,964 aircraft was set in August 2018. The number of Airbus aircraft to be built and delivered represents 8.2 years of shipments at the 2019 production level (the pre-pandemic level), or 11.5 years based on the 2021 total. In comparison, Boeing’s backlog would “only” last 6.3 years at the 2018 level (the most recent “normal” year for Boeing), or 15.0 years based on 2021 deliveries. In 2022 to date, Boeing’s book-to-bill ratio, calculated as net new orders divided by deliveries, is 0.86. Airbus’ book-to-bill ratio is 0.88. In 2021, Boeing’s book-to-bill ratio was 1.41, while Airbus reported a book-to-bill of 0.81.

2022 Forecast

Forecast International’s Platinum Forecast System is a breakthrough in forecasting technology that provides 15-year production forecasts. The author has used the Platinum Forecast System to retrieve the latest delivery forecast data from the Civil Aircraft Forecast product. For 2022, Forecast International’s analysts currently expect Boeing and Airbus to deliver 450 and 702 commercial jets, respectively. Compared to the 2021 level, this is a 32.4 percent increase for Boeing and a 14.9 percent increase for Airbus.

Boeing released first quarter 2022 results on April 27 but did not provide any updated guidance on deliveries. The company will release second quarter results on July 27. Airbus expects to deliver 720 commercial aircraft in 2022 and, as the basis for its 2022 guidance, the company assumes no further disruptions to the world economy, air traffic, and its own internal operations. The company released Q1 2022 earnings on May 4 and reaffirmed its 2022 guidance. Airbus will release second quarter results on July 27.

References:

Forecast International’s Civil Aircraft Forecast covers the rivalry between Airbus and Boeing in the large airliner sector; the emergence of new players in the regional aircraft segment looking to compete with Bombardier, Embraer, and ATR; and the shifting dynamics within the business jet market as aircraft such as the Bombardier Global 7000, Cessna Hemisphere, and Gulfstream G600 enter service. Also detailed in this service are the various market factors propelling the general aviation/utility segment as Textron Aviation, Cirrus, Diamond, Piper, and a host of others battle for sales and market share. An annual subscription includes 75 individual reports, most with a 10-year unit production forecast. Click here to learn more.

Share this:



Tweet

Print

Email

"
Airbus climbs past Boeing in single-aisle market share - Financial Times,"Sun, 17 Jul 2022 07:00:00 GMT",https://news.google.com/rss/articles/CBMiP2h0dHBzOi8vd3d3LmZ0LmNvbS9jb250ZW50L2MwODY0MmY1LTNhYTMtNDQ3Yi05MDI4LWMxYzg0YjhlMTBmZdIBAA?oc=5&hl=en-US&gl=US&ceid=US:en,"Print this page

Airbus and Boeing have competed neck and neck for five decades in one of the world’s great commercial rivalries. But, as the contest resumes in earnest in the wake of the pandemic, the old order has changed. Airbus now has a wide lead in the single-aisle market — the hottest area of aviation — leaving Boeing to grapple with how to bridge the gap.

The European company has grabbed new orders and market share with its popular A320 family of narrow-body jets, which predominantly serve shorter-haul destinations, to which travel has rebounded faster, compared with long-haul flights.

Latest figures to the end of June show that Airbus had close to 17,000 orders of its A320 and A220 aircraft, and has so far delivered just over 10,600. The A320 is now the bestselling aircraft ever, overtaking US-based Boeing’s 737 jet.

Recent fleet data from aviation consultancy Cirium showed Airbus’s A320 family with a “firm order backlog” market share of 59 per cent compared with Boeing’s 737 family of jets.

The bestseller within the A320 family is its largest model, the A321neo, which is also offered with extra fuel tanks in long-range and extra-long range variants. Some airlines — such as America’s JetBlue — now use these for long-haul flights that were traditionally flown by more expensive wide-body jets.

Airbus’s market share is only likely to grow as the group moves ahead with aggressive plans to lift output of the jets to 75 a month by 2025, despite industry-wide concerns about constraints in the supply chain. Production had reached a record 60 a month in 2019 before dropping to 40 a month when Covid hit.

Some analysts have questioned when Boeing will be able to regain some of that lost market share, as the company has continued to deal with fallout from the grounding of its 737 Max 8 after two fatal crashes within five months.

Production problems have prevented customer deliveries of Boeing’s wide-body 787 aircraft © Richard Ellis/Alamy

Global regulators have since cleared the jet to fly again after Boeing implemented software and design changes and the plane is notching up new orders.

Another challenge looming, however, is the recertification of the shorter 737 Max 7 and longer 737 Max 10 variants. Boeing is racing to complete those processes before the end of the year to avoid having to develop a new flight deck under rules introduced by US Congress following the Max crashes.

I have a lot of time for Dave Calhoun . . . but he’s not in Seattle and the problems in Boeing lie in Seattle

Boeing has also suffered production issues that have prevented customer deliveries of its wide-body 787 aircraft. In addition, development of its 777X aircraft has been delayed, while problems on a number of big defence contracts have only added to the challenges.

Union representatives, meanwhile, have criticised the company’s decision to move its global headquarters from Chicago to Washington, DC — seen as taking it further away from its spiritual home, the commercial aircraft factories of Seattle, and adding to persistent questions over the quality of its engineering.

Repeated delays on the commercial side have frustrated some of Boeing’s largest customers, including Ryanair. The low-cost carrier’s chief executive, Michael O’Leary, has said sweeping changes are needed to Boeing’s senior management led by chief executive Dave Calhoun.

In a recent interview, O’Leary told the Financial Times that the US aviation group has “lost huge market share and existing customers are being lost to Airbus, which is why I don’t understand why they sit there and do nothing”.

“I have a lot of time for Dave Calhoun . . . but he’s not in Seattle and the problems in Boeing lie in Seattle,” he said.

But others, including Lufthansa chief executive Carsten Spohr, have continued to back the US company. Boeing has insisted that things have changed since the Max accidents. It is also ramping up the hiring of engineers as it works with the US aviation regulator to certify its upcoming 777X aircraft.

Boeing’s chief executive Dave Calhoun has sought to resist discussion on market share © Christopher Goodney/Bloomberg

However, in a further blow, Boeing last month lost out to Airbus on a $37bn order from China’s three big state airlines. They chose 290 A320neo jets — the biggest order by Chinese airlines since the start of the pandemic. The country is a crucial market for both Airbus and Boeing and the orders come at a time of rising political tensions between the US and China.

Calhoun has previously cited uncertainty over orders from China as one of the three main risks facing the company, along with securely boosting production of the Max and resolving issues around the 787. China was the first country to ground the Max and, although its aviation regulator last year approved its return to service, Chinese carriers have not started flying the plane commercially again.

The multibillion-dollar question facing Boeing, therefore, is how to recover its lead against Airbus, at the same time as China’s first self-developed aircraft — Comac’s narrow-body C919 — is finally nearing completion.

Boeing abandoned a plan for a new midsize aeroplane — a twin-aisle aircraft that would have sat between the 737 Max and the larger 787 — and it remains unclear what its next step will be. Its balance sheet also remains constrained, with some $45bn of net debt.

$45bn Net debt on Boeing balance sheet

The company needs to “launch an answer to the A321neo,” says Kevin Michaels, managing director of Michigan-based AeroDynamic Advisory. “Can they afford it? I think they can. Their balance sheet isn’t great but you’ve got to invest in your core business to stay around in the long run.”

“The other problem they face is knowing what to do — if you do press the button, how do you do that plane? The world is about to change massively but no one yet knows what that technology will be and you could end up spending $20bn on something that will be immediately obsolete,” says Nick Cunningham, analyst at research firm Agency Partners in London, who believes the company needs to raise equity to fund a new programme.

But Calhoun has recently played down any concerns about the company’s market share position vis-à-vis Airbus. “At this moment in time, it’s less important,” he told an investor conference in June. Boeing, he added, had to concentrate on getting planes back in the air.

“We have to stay focused on doing that incredibly well. One aeroplane at a time. If I jump to a market share discussion immediately and say, ‘Let’s get above 50 and let’s do it next year’, what happens? The whole system gets crammed down in every way.”

He also indicated at the same conference that the company might not launch anything new for at least another couple of years. He does not believe that the performance improvement to justify an all new aircraft currently exists.

Boeing, he said, was sure it had the ability to compete. “I’m confident, my sales team is confident,” said Calhoun. “Our customers express confidence to me, so why would I rush? No good reason.”

Additional reporting by Philip Georgiadis

"
